,Title,Date
0,DTE Energy Co. stock outperforms competitors despite losses on the day - MarketWatch,"Fri, 04 Jun 2021 07:00:00 GMT"
1,Norfolk Southern Corp. stock underperforms Wednesday when compared to competitors - MarketWatch,"Wed, 09 Jun 2021 07:00:00 GMT"
2,BNDX | Vanguard Total International Bond ETF Overview - MarketWatch,"Thu, 05 Oct 2017 16:07:29 GMT"
3,GSFP | Goldman Sachs Future Planet Equity ETF Overview - MarketWatch,"Thu, 15 Jul 2021 16:03:44 GMT"
4,FORR Stock Price | Forrester Research Inc. Stock Quote (U.S.: Nasdaq) - MarketWatch,"Sun, 15 Oct 2017 05:18:29 GMT"
5,Shake Shack to expand in China - MarketWatch,"Tue, 22 Jun 2021 07:00:00 GMT"
6,Opinion: Here’s what inflation’s spike means for stocks now - MarketWatch,"Tue, 29 Jun 2021 07:00:00 GMT"
7,CFLT | Confluent Inc. Analyst Estimates - MarketWatch,"Sat, 26 Jun 2021 21:46:27 GMT"
8,"WallStreetBets is dying, long live the WallStreetBets movement - MarketWatch","Sat, 26 Jun 2021 07:00:00 GMT"
9,LEXT Stock Price | Lexston Mining Corp. Stock Quote (Canadian Securities Exchange) - MarketWatch,"Fri, 25 Jun 2021 20:07:31 GMT"
10,"Corteva Inc. stock rises Wednesday, outperforms market - MarketWatch","Wed, 30 Jun 2021 07:00:00 GMT"
11,Johnson & Johnson stock outperforms competitors despite losses on the day - MarketWatch,"Tue, 22 Jun 2021 07:00:00 GMT"
12,SON1 Stock Price | Sony Group Corp. Stock Quote (Germany: Frankfurt ) - MarketWatch,"Wed, 18 Oct 2017 00:26:09 GMT"
13,EJH | E-Home Household Service Holdings Ltd. Profile - MarketWatch,"Thu, 10 Jun 2021 12:33:15 GMT"
14,MNDY | monday.com Ltd. Analyst Estimates - MarketWatch,"Tue, 08 Jun 2021 19:35:42 GMT"
15,MacKenzie Scott has donated nearly $9 billion since her divorce from Jeff Bezos - MarketWatch,"Tue, 15 Jun 2021 07:00:00 GMT"
16,TLKM Stock Price | Telkom Indonesia (Persero) Stock Quote (Indonesia: Jakarta ) - MarketWatch,"Fri, 29 Sep 2017 22:23:32 GMT"
17,NEXT Stock Price | NextDecade Corp. Stock Quote (U.S.: Nasdaq) - MarketWatch,"Sun, 15 Oct 2017 11:09:46 GMT"
18,"Alphabet Inc. Cl A stock rises Monday, still underperforms market - MarketWatch","Mon, 28 Jun 2021 07:00:00 GMT"
19,"Ameriprise Financial Inc. stock falls Thursday, underperforms market - MarketWatch","Thu, 17 Jun 2021 07:00:00 GMT"
20,VCR | Vanguard Consumer Discretionary ETF Overview - MarketWatch,"Tue, 17 Oct 2017 22:26:14 GMT"
21,Amazon's China exposure is hard to unpack — but it's likely huge - MarketWatch,"Thu, 01 May 2025 20:10:27 GMT"
22,Warren Buffett says he’s halfway to giving away most of his fortune - MarketWatch,"Wed, 23 Jun 2021 07:00:00 GMT"
23,DODIX | Dodge & Cox Income Fund;I Advanced Charts - MarketWatch,"Fri, 20 Oct 2017 06:33:09 GMT"
24,"Opinion: If you want great healthcare, retire to these states - MarketWatch","Tue, 01 Jun 2021 07:00:00 GMT"
25,CC00 | Cocoa Continuous Contract Advanced Charts - MarketWatch,"Tue, 28 May 2019 03:17:41 GMT"
26,GSBD | Goldman Sachs BDC Inc. Profile - MarketWatch,"Sat, 10 Oct 2020 23:39:03 GMT"
27,Vivint Smart Home names David Bywater its new CEO - MarketWatch,"Mon, 07 Jun 2021 07:00:00 GMT"
28,AEMD Stock Price | Aethlon Medical Inc. Stock Quote (U.S.: Nasdaq) - MarketWatch,"Sat, 14 Oct 2017 03:52:50 GMT"
29,U.S. stocks end lower on mixed economic data as investors await Fed - MarketWatch,"Tue, 15 Jun 2021 07:00:00 GMT"
30,VOE | Vanguard Mid-Cap Value ETF Overview - MarketWatch,"Sat, 14 Oct 2017 11:43:53 GMT"
31,BBBT | Black Bird Biotech Inc. Options - MarketWatch,"Wed, 16 Jun 2021 19:20:28 GMT"
32,"We want to live in a small town where we can bike, hike and kayak -- so where should we retire? - MarketWatch","Wed, 30 Jun 2021 07:00:00 GMT"
33,"CBRE Group Inc. Cl A stock falls Monday, underperforms market - MarketWatch","Mon, 28 Jun 2021 07:00:00 GMT"
34,There's a new electric hypercar — the $2.4 million Rimac Nevera is made in-house and features a co-pilot - MarketWatch,"Tue, 29 Jun 2021 07:00:00 GMT"
35,RERGX | American Funds EuroPacific Growth Fund;R6 Advanced Charts - MarketWatch,"Fri, 20 Oct 2017 05:45:41 GMT"
36,"Duolingo, the fast-growing language-learning app, files for IPO - MarketWatch","Tue, 29 Jun 2021 07:00:00 GMT"
37,Vestum AB - MarketWatch,"Fri, 11 Jun 2021 06:10:55 GMT"
38,BMW introduces two new electric cars—and they’re very different - MarketWatch,"Thu, 24 Jun 2021 07:00:00 GMT"
39,AMC offers new perks for retail investors: free large popcorn - MarketWatch,"Wed, 02 Jun 2021 07:00:00 GMT"
40,"Opinion: For Juneteenth, America needs a new flag that all of us can honor - MarketWatch","Thu, 17 Jun 2021 07:00:00 GMT"
41,CCS Stock Price | Century Communities Inc. Stock Quote (U.S.: NYSE) - MarketWatch,"Mon, 21 Oct 2024 01:36:30 GMT"
42,MNO Stock Price | Meridian Mining UK Societas Stock Quote (Canada: Toronto) - MarketWatch,"Wed, 18 Oct 2017 22:49:28 GMT"
43,Opinion: What lumber and gold prices tell us about the stock market’s next move - MarketWatch,"Wed, 16 Jun 2021 07:00:00 GMT"
44,YMM | Full Truck Alliance Co. Ltd. ADR Profile - MarketWatch,"Wed, 23 Jun 2021 00:10:56 GMT"
45,"Six Flags offering seasonal workers up to $1,000 bonus - MarketWatch","Mon, 28 Jun 2021 07:00:00 GMT"
46,JPYVND | Japanese Yen/Vietnamese Dong Advanced Charts - MarketWatch,"Sat, 02 Dec 2017 05:30:17 GMT"
47,"Whirlpool Corp. stock rises Tuesday, outperforms market - MarketWatch","Tue, 29 Jun 2021 07:00:00 GMT"
48,Starbucks Corp. stock outperforms competitors on strong trading day - MarketWatch,"Tue, 08 Jun 2021 07:00:00 GMT"
49,Newell Brands Inc. stock outperforms competitors on strong trading day - MarketWatch,"Tue, 08 Jun 2021 07:00:00 GMT"
50,"Brace yourself, inflation could create a ‘giant wealth transfer’ from lenders to borrowers - MarketWatch","Thu, 17 Jun 2021 07:00:00 GMT"
51,Opinion: These 6 smart stock-selling strategies can help you keep what you make in the market - MarketWatch,"Mon, 07 Jun 2021 07:00:00 GMT"
52,LEO Stock Price | Leo Global Logistics PCL Stock Quote (Thailand: Bangkok ) - MarketWatch,"Mon, 09 Nov 2020 19:45:31 GMT"
53,KEO Stock Price | KEO PLC Stock Quote (Cyprus Stock Exchange) - MarketWatch,"Sat, 21 Oct 2017 12:00:32 GMT"
54,REAX | Real Brokerage Inc. Analyst Estimates - MarketWatch,"Wed, 30 Jun 2021 17:14:21 GMT"
55,Comcast Corp. Cl A stock outperforms market on strong trading day - MarketWatch,"Tue, 15 Jun 2021 07:00:00 GMT"
56,"‘If it got too successful it would be destroyed’: Remembering the Tulsa massacre, when a white mob destroyed ‘Black Wall Street’ 100 years ago - MarketWatch","Tue, 01 Jun 2021 07:00:00 GMT"
57,NYFANG | NYSE FANG+ Overview - MarketWatch,"Mon, 11 Jun 2018 02:38:47 GMT"
58,VMGMX | Vanguard Mid-Cap Growth Index Fund;Admiral Advanced Charts - MarketWatch,"Tue, 14 Nov 2017 09:10:33 GMT"
59,UGL | ProShares Ultra Gold Advanced Charts - MarketWatch,"Sat, 28 Oct 2017 00:00:52 GMT"
60,How much has 13 years under conservatorship cost Britney Spears? - MarketWatch,"Fri, 25 Jun 2021 07:00:00 GMT"
61,EXA Stock Price | Exail Technologies S.A. Stock Quote (France: Euronext Paris) - MarketWatch,"Wed, 14 Dec 2022 01:46:34 GMT"
62,"Asian Americans are still viewed as 'forever foreign.' That's keeping them out of the C-suite, this professor says - MarketWatch","Mon, 14 Jun 2021 07:00:00 GMT"
63,INDI | indie Semiconductor Inc. Annual Income Statement - MarketWatch,"Sat, 12 Jun 2021 07:32:19 GMT"
64,CXAI Stock Price | CXApp Inc. Stock Quote (U.S.: Nasdaq) - MarketWatch,"Wed, 15 Mar 2023 16:32:23 GMT"
65,AutoZone Inc. stock outperforms competitors despite losses on the day - MarketWatch,"Thu, 03 Jun 2021 07:00:00 GMT"
66,TEM | Tempus AI Inc. Options - MarketWatch,"Sun, 27 Jun 2021 02:18:18 GMT"
67,"Zions Bancorp N.A. stock rises Wednesday, still underperforms market - MarketWatch","Wed, 02 Jun 2021 07:00:00 GMT"
68,INDI | indie Semiconductor Inc. Analyst Estimates - MarketWatch,"Sat, 12 Jun 2021 04:06:24 GMT"
69,QSI | Quantum-Si Inc. Advanced Charts - MarketWatch,"Sat, 17 Mar 2018 21:55:37 GMT"
70,Amazon.com Inc. stock outperforms market despite losses on the day - MarketWatch,"Tue, 15 Jun 2021 07:00:00 GMT"
71,DDL | Dingdong (Cayman) Ltd. ADR Analyst Estimates - MarketWatch,"Wed, 30 Jun 2021 04:27:46 GMT"
72,VDADX | Vanguard Dividend Appreciation Index Fund;Admiral Advanced Charts - MarketWatch,"Wed, 18 Oct 2017 11:27:05 GMT"
73,HYT | BlackRock Corporate High Yield Fund Inc. Advanced Charts - MarketWatch,"Fri, 31 May 2019 21:24:49 GMT"
74,VITAX | Vanguard Information Technology Index Fund;Admiral Advanced Charts - MarketWatch,"Wed, 18 Oct 2017 15:26:10 GMT"
75,EL8 Stock Price | Elevate Uranium Ltd. Stock Quote (Australia: Sydney) - MarketWatch,"Tue, 08 Jun 2021 19:06:31 GMT"
76,SOFI | SoFi Technologies Inc. Annual Income Statement - MarketWatch,"Fri, 09 Jul 2021 15:30:36 GMT"
77,KRYAY Stock Price | Kerry Group PLC ADR Stock Quote (U.S.: OTC) - MarketWatch,"Thu, 19 Oct 2017 10:26:40 GMT"
78,LDBMKIN-20Y | India 20 Year Government Bond Advanced Charts - MarketWatch,"Fri, 20 Oct 2017 00:24:23 GMT"
79,TA100 | Tel Aviv 125 Index Overview - MarketWatch,"Tue, 17 Oct 2017 22:13:41 GMT"
80,PDFI Stock Price | Prophecy DeFi Inc. Stock Quote (Canadian Securities Exchange) - MarketWatch,"Mon, 28 Jun 2021 15:39:26 GMT"
81,FNCMX | Fidelity NASDAQ Composite Index Fund Advanced Charts - MarketWatch,"Fri, 20 Oct 2017 01:00:18 GMT"
82,VSGAX | Vanguard Small-Cap Growth Index Fund;Adm Advanced Charts - MarketWatch,"Thu, 19 Oct 2017 06:25:10 GMT"
83,GHRS | GH Research PLC Profile - MarketWatch,"Wed, 23 Jun 2021 04:41:46 GMT"
84,MTFC00 | Coal (API2) CIF ARA (ARGUS-McCloskey) Continuous Contract Advanced Charts - MarketWatch,"Sun, 19 May 2019 02:01:29 GMT"
85,300328 Stock Price | DongGuan EONTEC Co. Ltd. Stock Quote (China: Shenzhen) - MarketWatch,"Thu, 19 Oct 2017 05:34:12 GMT"
86,ICSFX | Invesco Comstock Fund;R6 Advanced Charts - MarketWatch,"Wed, 22 Nov 2017 07:47:53 GMT"
87,"United Parcel Service Inc. Cl B stock falls Tuesday, underperforms market - MarketWatch","Tue, 08 Jun 2021 07:00:00 GMT"
88,Whirlpool Corp. stock underperforms Tuesday when compared to competitors - MarketWatch,"Tue, 08 Jun 2021 07:00:00 GMT"
89,"I won over $55 million in the California lottery, but didn't tell my friends or family. Did I do the right thing? - MarketWatch","Wed, 30 Jun 2021 07:00:00 GMT"
90,ICCM Stock Price | IceCure Medical Ltd. Stock Quote (U.S.: Nasdaq) - MarketWatch,"Sun, 05 Nov 2017 05:36:46 GMT"
91,IDUP | iShares US Property Yield UCITS ETF Advanced Charts - MarketWatch,"Wed, 14 Mar 2018 15:51:22 GMT"
92,PAYO | Payoneer Global Inc. Options - MarketWatch,"Wed, 30 Jun 2021 17:56:58 GMT"
93,TSLVF Stock Price | Tier One Silver Inc. Stock Quote (U.S.: OTC) - MarketWatch,"Mon, 21 Jun 2021 18:25:15 GMT"
94,Used cars and housing costs drove inflation last month - MarketWatch,"Thu, 10 Jun 2021 07:00:00 GMT"
95,ANRG Stock Price | Anaergia Inc. Stock Quote (Canada: Toronto) - MarketWatch,"Sun, 27 Jun 2021 05:22:05 GMT"
96,TRCY Stock Price | Tri City Bankshares Corp. Stock Quote (U.S.: OTC) - MarketWatch,"Mon, 02 Oct 2017 01:10:40 GMT"
97,VIGAX | Vanguard Growth Index Fund;Admiral Advanced Charts - MarketWatch,"Thu, 19 Oct 2017 00:08:14 GMT"
98,Up in smoke: States are using tobacco settlement money to balance their budgets. Here's why that matters - MarketWatch,"Tue, 29 Jun 2021 07:00:00 GMT"
99,COPX | Global X Copper Miners ETF Advanced Charts - MarketWatch,"Fri, 27 Oct 2017 17:40:25 GMT"
