,Title,Date
0,Somewhere along the way the U.S. became a nation of truck drivers - MarketWatch,"Mon, 09 Feb 2015 08:00:00 GMT"
1,Nobody ‘knows’ the market: John Bogle - MarketWatch,"Thu, 05 Feb 2015 08:00:00 GMT"
2,KFC takes on packaging waste with edible coffee cups at U.K. stores - MarketWatch,"Fri, 27 Feb 2015 08:00:00 GMT"
3,DUG | ProShares UltraShort Energy Overview - MarketWatch,"Thu, 05 Oct 2017 16:11:35 GMT"
4,Warning: Your smart TV may be spying on you - MarketWatch,"Tue, 10 Feb 2015 08:00:00 GMT"
5,Millennials are choosing bourbon over Budweiser - MarketWatch,"Tue, 03 Feb 2015 08:00:00 GMT"
6,TMBMKDE-04Y | Germany 4 Year Government Bond Overview - MarketWatch,"Mon, 13 Nov 2017 22:46:13 GMT"
7,"Gap, Abercrombie need a pricing strategy shift - MarketWatch","Fri, 13 Feb 2015 08:00:00 GMT"
8,One Brit discovers why Americans are so fat - MarketWatch,"Fri, 06 Feb 2015 08:00:00 GMT"
9,NKRKY Stock Price | Nokian Renkaat Oyj ADR Stock Quote (U.S.: OTC) - MarketWatch,"Thu, 19 Oct 2017 22:56:02 GMT"
10,7 tax rules that apply to noncash charitable donations - MarketWatch,"Tue, 17 Feb 2015 08:00:00 GMT"
11,Jordanian pilot burned alive in new ISIS video: reports - MarketWatch,"Tue, 03 Feb 2015 08:00:00 GMT"
12,Opinion: Here’s why Microsoft stock is better than you think - MarketWatch,"Thu, 26 Feb 2015 08:00:00 GMT"
13,Opinion: Greece’s Varoufakis still holds a trump card - MarketWatch,"Tue, 17 Feb 2015 08:00:00 GMT"
14,Has the trend toward later retirements played out? - MarketWatch,"Wed, 18 Feb 2015 08:00:00 GMT"
15,10 things you should know about portfolio performance - MarketWatch,"Wed, 04 Feb 2015 08:00:00 GMT"
16,Here’s how other countries are addressing net neutrality - MarketWatch,"Thu, 26 Feb 2015 08:00:00 GMT"
17,Opinion: What really keeps Airbnb’s CEO up at night - MarketWatch,"Fri, 13 Feb 2015 08:00:00 GMT"
18,Snowed-under Boston braces for yet another blizzard - MarketWatch,"Fri, 13 Feb 2015 08:00:00 GMT"
19,What to do if you filed your taxes incorrectly - MarketWatch,"Wed, 25 Feb 2015 08:00:00 GMT"
20,The bullish setup for stocks is here - MarketWatch,"Wed, 11 Feb 2015 08:00:00 GMT"
21,There were just 12:06 minutes of actual gameplay during the Super Bowl - MarketWatch,"Mon, 02 Feb 2015 08:00:00 GMT"
22,Opinion: Bet on Buffett’s Berkshire Hathaway to beat small-cap stocks - MarketWatch,"Fri, 27 Feb 2015 08:00:00 GMT"
23,Opinion: ‘Merkel mania’ is at best premature - MarketWatch,"Fri, 20 Feb 2015 08:00:00 GMT"
24,What time is the Powerball drawing? - MarketWatch,"Wed, 11 Feb 2015 08:00:00 GMT"
25,Opinion: Pope Francis must answer questions about church’s financial dealings with Hitler - MarketWatch,"Tue, 10 Feb 2015 08:00:00 GMT"
26,Are your food and vitamin labels lying to you? - MarketWatch,"Tue, 17 Feb 2015 08:00:00 GMT"
27,SGOO Stock Price | Snoogoo Corp. Stock Quote (U.S.: OTC) - MarketWatch,"Tue, 17 Oct 2017 21:52:13 GMT"
28,How to work with someone with autism - MarketWatch,"Wed, 11 Feb 2015 08:00:00 GMT"
29,AC | Ayala Corp. Advanced Charts - MarketWatch,"Thu, 19 Oct 2017 07:23:01 GMT"
30,GBPINR | British Pound/Indian Rupee Advanced Charts - MarketWatch,"Sat, 21 Oct 2017 01:13:38 GMT"
31,The 16 states that still allow smoking in bars and restaurants - MarketWatch,"Wed, 04 Feb 2015 08:00:00 GMT"
32,"Oligarch, this is the car for you - MarketWatch","Sat, 07 Feb 2015 08:00:00 GMT"
33,TMUBMUSD03Y | U.S. 3 Year Treasury Note Overview - MarketWatch,"Wed, 18 Oct 2017 00:57:47 GMT"
34,10 things SAT scores won’t tell you - MarketWatch,"Tue, 24 Feb 2015 08:00:00 GMT"
35,Opinion: Cuba’s hidden tax on workers mocks socialist ideals - MarketWatch,"Sat, 21 Feb 2015 08:00:00 GMT"
36,Understanding performance: The S&P 500 Index - MarketWatch,"Wed, 18 Feb 2015 08:00:00 GMT"
37,Existing-home sales slow to 9-month low in January - MarketWatch,"Mon, 23 Feb 2015 08:00:00 GMT"
38,AAL | American Airlines Group Inc. Annual Income Statement - MarketWatch,"Wed, 25 Feb 2015 03:22:26 GMT"
39,Apple CEO Tim Cook says ‘sitting is the new cancer’ - MarketWatch,"Tue, 10 Feb 2015 08:00:00 GMT"
40,Can’t hire enough waiters at your restaurant? Hire a drone - MarketWatch,"Wed, 11 Feb 2015 08:00:00 GMT"
41,Russia’s famed AK-47 rifles could soon be made in the USA - MarketWatch,"Mon, 02 Feb 2015 08:00:00 GMT"
42,Opinion: How to invest like Leonard Nimoy’s Mr. Spock - MarketWatch,"Sat, 28 Feb 2015 08:00:00 GMT"
43,Arctic Circle: best place to drive a Lamborghini - MarketWatch,"Sat, 28 Feb 2015 08:00:00 GMT"
44,How a 1% savings boost could sweeten your retirement - MarketWatch,"Sat, 21 Feb 2015 08:00:00 GMT"
45,Chinese herdsman stumbles onto a 17-pound gold nugget - MarketWatch,"Fri, 13 Feb 2015 08:00:00 GMT"
46,"Close your eyes, kids. Sports Illustrated’s cover is its raciest yet - MarketWatch","Thu, 05 Feb 2015 08:00:00 GMT"
47,Mall of America heightens security after terrorist threat - MarketWatch,"Sun, 22 Feb 2015 08:00:00 GMT"
48,Mercedes-Maybach S600: The silence is deafening - MarketWatch,"Sat, 07 Feb 2015 08:00:00 GMT"
49,"Opinion: Planet Earth is the Titanic, climate change the iceberg - MarketWatch","Tue, 17 Feb 2015 08:00:00 GMT"
50,Gilead to discount its pricey Sovaldi drug - MarketWatch,"Wed, 04 Feb 2015 08:00:00 GMT"
51,Warren Buffett Says He Eats Like a Six-Year-Old - MarketWatch,"Thu, 26 Feb 2015 08:00:00 GMT"
52,Alibaba tries out drone delivery in China - MarketWatch,"Thu, 05 Feb 2015 08:00:00 GMT"
53,Your Pad Thai or burger is now on a pizza - MarketWatch,"Thu, 26 Feb 2015 08:00:00 GMT"
54,"For $37, you can buy this toy of Vladimir Putin riding a bear - MarketWatch","Wed, 04 Feb 2015 08:00:00 GMT"
55,ULE | ProShares Ultra Euro Overview - MarketWatch,"Sat, 21 Oct 2017 01:15:49 GMT"
56,Meet Porsche’s Macan S: The ‘S’ stands for sassy - MarketWatch,"Sat, 21 Feb 2015 08:00:00 GMT"
57,ATEA Stock Price | Atea ASA Stock Quote (Norway: Oslo) - MarketWatch,"Thu, 19 Oct 2017 05:14:34 GMT"
58,Beatle’s beetle-infested tree to be replaced Wednesday - MarketWatch,"Wed, 25 Feb 2015 08:00:00 GMT"
59,Edward Snowden says he thought ‘treason’ joke was funny - MarketWatch,"Mon, 23 Feb 2015 08:00:00 GMT"
60,The side effects of ‘pension envy’ - MarketWatch,"Tue, 24 Feb 2015 08:00:00 GMT"
61,"We’re living longer, yes, but why not healthier? - MarketWatch","Wed, 25 Feb 2015 08:00:00 GMT"
62,FUJHF Stock Price | Subaru Corp. Stock Quote (U.S.: OTC) - MarketWatch,"Tue, 03 Oct 2017 08:15:43 GMT"
63,PPC Stock Price | Pryce Corp. Stock Quote (Philippines: Manila) - MarketWatch,"Thu, 09 Nov 2017 05:33:57 GMT"
64,Why baby boomers don’t like to work from home - MarketWatch,"Tue, 03 Feb 2015 08:00:00 GMT"
65,OCDGF Stock Price | Ocado Group PLC Stock Quote (U.S.: OTC) - MarketWatch,"Wed, 18 Oct 2017 02:29:21 GMT"
66,Remember the China herdsman who found a giant gold nugget? The government does - MarketWatch,"Wed, 11 Feb 2015 08:00:00 GMT"
67,2014 was the year of the man purse - MarketWatch,"Sat, 07 Feb 2015 08:00:00 GMT"
68,How retirement plans vastly underestimate inflation - MarketWatch,"Tue, 03 Feb 2015 08:00:00 GMT"
69,Opinion: Life after craft: Elysian adapts after buyout by Anheuser-Busch - MarketWatch,"Mon, 02 Feb 2015 08:00:00 GMT"
70,Avon is no longer the No. 1 global direct sales company - MarketWatch,"Thu, 12 Feb 2015 08:00:00 GMT"
71,CAPL | CrossAmerica Partners L.P. Profile - MarketWatch,"Fri, 09 Oct 2020 22:59:07 GMT"
72,U.S. job openings hit highest level since 2001 - MarketWatch,"Tue, 10 Feb 2015 08:00:00 GMT"
73,10 things car dealers won’t tell you - MarketWatch,"Tue, 03 Feb 2015 08:00:00 GMT"
74,BGC Partners to buy rival brokerage GFI for $778 million - MarketWatch,"Fri, 20 Feb 2015 08:00:00 GMT"
75,10 richest Hollywood movie moguls - MarketWatch,"Sat, 14 Feb 2015 08:00:00 GMT"
76,12 ways to say ‘take this job and shove it’ - MarketWatch,"Fri, 20 Feb 2015 08:00:00 GMT"
77,LCTC Stock Price | Lifeloc Technologies Inc. Stock Quote (U.S.: OTC) - MarketWatch,"Fri, 13 Oct 2017 20:03:38 GMT"
78,Why new Greek premier Alexis Tsipras isn’t wearing a tie - MarketWatch,"Wed, 04 Feb 2015 08:00:00 GMT"
79,DNN | Denison Mines Corp. Advanced Charts - MarketWatch,"Sat, 21 Oct 2017 07:23:57 GMT"
80,Oil rig counts just hit a 5-year low - MarketWatch,"Fri, 06 Feb 2015 08:00:00 GMT"
81,BMO | Bank of Montreal Advanced Charts - MarketWatch,"Tue, 17 Oct 2017 11:19:07 GMT"
82,SCCO Stock Price | Southern Copper Corp. Stock Quote (Peru: Lima) - MarketWatch,"Sat, 21 Oct 2017 08:12:16 GMT"
83,Not your grandfather’s retirement - MarketWatch,"Fri, 06 Feb 2015 08:00:00 GMT"
84,CDW | CDW Corp. Analyst Estimates - MarketWatch,"Sun, 05 Nov 2017 00:47:29 GMT"
85,KNDI | Kandi Technologies Group Inc. Annual Cash Flow Statement - MarketWatch,"Sat, 21 Oct 2017 11:37:31 GMT"
86,Nationwide’s dead ‘Boy’ Super Bowl ad draws fire - MarketWatch,"Mon, 02 Feb 2015 08:00:00 GMT"
87,4 reasons Walmart is the most-hated retailer in America - MarketWatch,"Sat, 21 Feb 2015 08:00:00 GMT"
88,GPH Stock Price | Grand Plaza Hotel Corp. Stock Quote (Philippines: Manila) - MarketWatch,"Fri, 20 Oct 2017 00:47:28 GMT"
89,"What Wal-Mart got right in Canada, and what Target botched - MarketWatch","Wed, 11 Feb 2015 08:00:00 GMT"
90,Marvel fans can now binge-read comics for $9 a month - MarketWatch,"Fri, 13 Feb 2015 08:00:00 GMT"
91,Redhook finds a home between beer snobs and Bud Light - MarketWatch,"Thu, 26 Feb 2015 08:00:00 GMT"
92,How retirees can fund a Roth IRA - MarketWatch,"Mon, 09 Feb 2015 08:00:00 GMT"
93,"Why Nasdaq at 5,000 makes sense this time - MarketWatch","Mon, 23 Feb 2015 08:00:00 GMT"
94,DPM Stock Price | Dundee Precious Metals Inc. Stock Quote (Canada: Toronto) - MarketWatch,"Thu, 12 Oct 2017 22:56:26 GMT"
95,10 highest paid (and most popular) jobs in America - MarketWatch,"Tue, 17 Feb 2015 08:00:00 GMT"
96,Two books Warren Buffett says you should read - MarketWatch,"Sat, 28 Feb 2015 08:00:00 GMT"
97,The ultimate guide to market emoji - MarketWatch,"Wed, 25 Feb 2015 08:00:00 GMT"
98,"How one couple wiped out a $125,000 debt - MarketWatch","Sat, 14 Feb 2015 08:00:00 GMT"
99,"The costliest states for speedy, drunk and reckless drivers - MarketWatch","Sun, 22 Feb 2015 08:00:00 GMT"
