,Title,Date
0,9 powerful questions to ask a financial adviser in your first meeting - MarketWatch,"Tue, 27 Jun 2023 07:00:00 GMT"
1,Intel Corp. stock underperforms Friday when compared to competitors despite daily gains - MarketWatch,"Fri, 30 Jun 2023 07:00:00 GMT"
2,"First Quantum Minerals Ltd. stock rises Friday, outperforms market - MarketWatch","Fri, 02 Jun 2023 07:00:00 GMT"
3,Tyson Foods Inc. Cl A stock underperforms Thursday when compared to competitors - MarketWatch,"Thu, 08 Jun 2023 07:00:00 GMT"
4,Ralph Lauren Corp. Cl A stock underperforms Thursday when compared to competitors despite daily gains - MarketWatch,"Thu, 29 Jun 2023 07:00:00 GMT"
5,European stocks extend losing streak for fifth day - MarketWatch,"Fri, 23 Jun 2023 07:00:00 GMT"
6,VLUD | BNP Paribas Easy ESG Low Vol US UCITS ETF Overview - MarketWatch,"Fri, 18 Apr 2025 13:32:01 GMT"
7,"Admiral Group rises Friday, outperforms market - MarketWatch","Fri, 09 Jun 2023 07:00:00 GMT"
8,RSEL Stock Price | R.S.L. Electronics Ltd. Stock Quote (Israel: Tel-Aviv) - MarketWatch,"Wed, 18 Oct 2017 04:34:32 GMT"
9,Alaska Air Group Inc. stock outperforms market on strong trading day - MarketWatch,"Mon, 26 Jun 2023 07:00:00 GMT"
10,European Commission says it may want to break up Google’s ad-tech business - MarketWatch,"Wed, 14 Jun 2023 07:00:00 GMT"
11,Rocket Cos. Inc. stock outperforms market on strong trading day - MarketWatch,"Thu, 08 Jun 2023 07:00:00 GMT"
12,UEIC Stock Price | Universal Electronics Inc. Stock Quote (U.S.: Nasdaq) - MarketWatch,"Tue, 03 Oct 2017 08:45:02 GMT"
13,"U.S. stocks open slightly lower, extending Monday’s modest losses - MarketWatch","Tue, 06 Jun 2023 07:00:00 GMT"
14,"Constellation Brands Inc. Cl A stock falls Tuesday, underperforms market - MarketWatch","Tue, 06 Jun 2023 07:00:00 GMT"
15,Why is flood insurance so expensive? Florida homeowners struggle as costs rise - MarketWatch,"Tue, 06 Jun 2023 07:00:00 GMT"
16,FAZ | Direxion Daily Financial Bear 3x Shares Overview - MarketWatch,"Thu, 18 Feb 2010 21:52:41 GMT"
17,Logitech's stock hit by reports its $30 game controller was used to steer missing sub near Titanic - MarketWatch,"Wed, 21 Jun 2023 07:00:00 GMT"
18,"ResMed Inc. stock rises Thursday, still underperforms market - MarketWatch","Thu, 08 Jun 2023 07:00:00 GMT"
19,"Marsh & McLennan Cos. stock rises Monday, outperforms market - MarketWatch","Mon, 05 Jun 2023 07:00:00 GMT"
20,More beer! Constellation Brands’ earnings expected to get a boost from beer sales - MarketWatch,"Tue, 27 Jun 2023 07:00:00 GMT"
21,"DraftKings Inc. Cl A stock rises Thursday, outperforms market - MarketWatch","Thu, 01 Jun 2023 07:00:00 GMT"
22,Stock market set for big first half gain. What history says about rest of 2023. - MarketWatch,"Tue, 27 Jun 2023 07:00:00 GMT"
23,Parker Hannifin Corp. stock outperforms market on strong trading day - MarketWatch,"Wed, 07 Jun 2023 07:00:00 GMT"
24,"BlackRock Inc. stock rises Thursday, still underperforms market - MarketWatch","Thu, 29 Jun 2023 07:00:00 GMT"
25,‘How to travel for free’: I spent $500 hosting my friend for a week. Should she have paid for food and utilities? - MarketWatch,"Thu, 01 Jun 2023 07:00:00 GMT"
26,Musk vs. Zuckerberg: Which tech heavyweight is already winning the Wall Street cage match? - MarketWatch,"Fri, 23 Jun 2023 07:00:00 GMT"
27,TOON | Kartoon Studios Inc. Advanced Charts - MarketWatch,"Wed, 28 Jun 2023 02:19:33 GMT"
28,"New York to distribute 1 million free N95 masks amid hazardous smoke levels, as mask sales spike on Amazon - MarketWatch","Wed, 07 Jun 2023 07:00:00 GMT"
29,My wife’s family visits and never pays for anything. How do we get rid of them? - MarketWatch,"Sat, 10 Jun 2023 07:00:00 GMT"
30,Elizabeth Warren: ‘President Biden has the legal authority to cancel student-loan debt’ - MarketWatch,"Tue, 27 Jun 2023 07:00:00 GMT"
31,PPL Corp. stock outperforms competitors on strong trading day - MarketWatch,"Wed, 07 Jun 2023 07:00:00 GMT"
32,V20A | Vanguard LifeStrategy 20% Equity UCITS ETF Advanced Charts - MarketWatch,"Sun, 30 Mar 2025 02:10:17 GMT"
33,Paycom Software Inc. stock underperforms Friday when compared to competitors - MarketWatch,"Fri, 09 Jun 2023 07:00:00 GMT"
34,YERBF Stock Price | Yerbae Brands Corp. Stock Quote (U.S.: OTC) - MarketWatch,"Sat, 06 May 2023 21:32:21 GMT"
35,Procter & Gamble Co. stock outperforms market on strong trading day - MarketWatch,"Wed, 07 Jun 2023 07:00:00 GMT"
36,VAGG | Vanguard USD Emerging Markets Government Bond UCITS ETF Advanced Charts - MarketWatch,"Fri, 18 Apr 2025 13:32:01 GMT"
37,"Ocugen Inc. stock falls Friday, underperforms market - MarketWatch","Fri, 09 Jun 2023 07:00:00 GMT"
38,HWNI Stock Price | High Wire Networks Inc. Stock Quote (U.S.: OTC) - MarketWatch,"Mon, 10 Jan 2022 15:17:05 GMT"
39,CAVA | CAVA Group Inc. Options - MarketWatch,"Thu, 15 Jun 2023 20:32:03 GMT"
40,Joby Aviation stock extends rally after fresh $100 million investment - MarketWatch,"Thu, 29 Jun 2023 07:00:00 GMT"
41,AMEA | Amundi ETF MSCI Emerging Markets Asia Overview - MarketWatch,"Fri, 14 Jun 2019 15:19:39 GMT"
42,LIVE | Live Ventures Inc. Profile - MarketWatch,"Fri, 09 Oct 2020 01:49:30 GMT"
43,Opinion: What you should be thinking about 10 years before retirement - MarketWatch,"Fri, 16 Jun 2023 07:00:00 GMT"
44,AAIC Stock Price | Al Anwar Investments SAOG Stock Quote (Muscat Securities Market) - MarketWatch,"Fri, 05 Mar 2021 01:43:37 GMT"
45,KURRY Stock Price | Kuraray Co. Ltd. ADR Stock Quote (U.S.: OTC) - MarketWatch,"Wed, 18 Oct 2017 12:27:41 GMT"
46,"DXC Technology Co. stock rises Monday, outperforms market - MarketWatch","Mon, 12 Jun 2023 07:00:00 GMT"
47,BALD.B Stock Price | Fastighets AB Balder Series B Stock Quote (Sweden: Stockholm) - MarketWatch,"Sat, 18 May 2019 11:24:07 GMT"
48,Tesla’s stock is the most overbought in nearly 2 years - MarketWatch,"Wed, 14 Jun 2023 07:00:00 GMT"
49,SCS Stock Price | Steelcase Inc. Stock Quote (U.S.: NYSE) - MarketWatch,"Wed, 12 Jan 2011 13:36:47 GMT"
50,5 key takeaways from Fed Chair Jerome Powell’s press conference Wednesday - MarketWatch,"Wed, 14 Jun 2023 07:00:00 GMT"
51,OATN Stock Price | O.A.T. Inc. Stock Quote (U.S.: OTC) - MarketWatch,"Sat, 21 Nov 2020 17:06:59 GMT"
52,Illumina Inc. stock outperforms market on strong trading day - MarketWatch,"Mon, 05 Jun 2023 07:00:00 GMT"
53,EDZ | Direxion Daily Emerging Markets Bear 3x Shares Overview - MarketWatch,"Wed, 04 Oct 2017 02:30:02 GMT"
54,"Reckitt Benckiser Group falls Monday, underperforms market - MarketWatch","Mon, 05 Jun 2023 07:00:00 GMT"
55,‘Greedflation’: IMF puts blame for rise in prices on corporate greed - MarketWatch,"Tue, 27 Jun 2023 07:00:00 GMT"
56,SCO | ProShares UltraShort Bloomberg Crude Oil Overview - MarketWatch,"Sat, 30 Sep 2017 03:00:52 GMT"
57,"Zoom Video Communications Inc. stock falls Tuesday, underperforms market - MarketWatch","Tue, 13 Jun 2023 07:00:00 GMT"
58,AMC CEO touts record U.S. food and beverage sales - MarketWatch,"Mon, 05 Jun 2023 07:00:00 GMT"
59,"Rivian inks Tesla fast-charging agreement, joining Ford and GM - MarketWatch","Tue, 20 Jun 2023 07:00:00 GMT"
60,STP Stock Price | Stalprodukt S.A. Stock Quote (Poland: Warsaw) - MarketWatch,"Thu, 19 Oct 2017 05:05:52 GMT"
61,"H&R Block Inc. stock rises Monday, outperforms market - MarketWatch","Mon, 05 Jun 2023 07:00:00 GMT"
62,Howmet Aerospace Inc. stock outperforms competitors despite losses on the day - MarketWatch,"Wed, 14 Jun 2023 07:00:00 GMT"
63,Truist Financial Corp. stock underperforms Monday when compared to competitors - MarketWatch,"Mon, 12 Jun 2023 07:00:00 GMT"
64,Theft in open court: How a fight over lifesaving drugs led to accusations of brazen industrial espionage - MarketWatch,"Tue, 27 Jun 2023 07:00:00 GMT"
65,Keysight Technologies Inc. stock underperforms Monday when compared to competitors - MarketWatch,"Mon, 05 Jun 2023 07:00:00 GMT"
66,Best Buy Co. Inc. stock underperforms Wednesday when compared to competitors despite daily gains - MarketWatch,"Wed, 14 Jun 2023 07:00:00 GMT"
67,CACI Stock Price | CACI International Inc. Cl A Stock Quote (U.S.: NYSE) - MarketWatch,"Thu, 04 Mar 2010 14:15:06 GMT"
68,"Western Union Co. stock rises Tuesday, still underperforms market - MarketWatch","Tue, 13 Jun 2023 07:00:00 GMT"
69,"Thomson Reuters Corp. stock falls Thursday, underperforms market - MarketWatch","Thu, 01 Jun 2023 07:00:00 GMT"
70,PLI Stock Price | Platige Image S.A. Stock Quote (Poland: Warsaw) - MarketWatch,"Sat, 12 Oct 2019 01:02:27 GMT"
71,NPWR | NET Power Inc. Analyst Estimates - MarketWatch,"Thu, 22 Jun 2023 04:34:42 GMT"
72,"Heads of ‘orgasmic meditation’ group, OneTaste, charged with forced labor and sex abuse of followers - MarketWatch","Tue, 06 Jun 2023 07:00:00 GMT"
73,"Zoom Video Communications Inc. stock rises Thursday, still underperforms market - MarketWatch","Thu, 22 Jun 2023 07:00:00 GMT"
74,Inovio Pharmaceuticals Inc. stock underperforms Monday when compared to competitors - MarketWatch,"Mon, 05 Jun 2023 07:00:00 GMT"
75,P.F. Chang’s 34-year-old CEO on what he learned from billionaire John Paulson - MarketWatch,"Sat, 10 Jun 2023 07:00:00 GMT"
76,V80A | Vanguard LifeStrategy 80% Equity UCITS ETF Advanced Charts - MarketWatch,"Sun, 30 Mar 2025 02:29:54 GMT"
77,"Americans still say Disney is among the most patriotic brands in the U.S., despite DeSantis feud - MarketWatch","Thu, 29 Jun 2023 07:00:00 GMT"
78,"My wife and I live ‘an average life’ in the Bay Area making $320K. Last year, we bought a house for $200K over asking — now we don’t want to live in it. Should we get professional help? - MarketWatch","Sat, 17 Jun 2023 07:00:00 GMT"
79,Here’s where inflation is hurting Americans the most - MarketWatch,"Mon, 12 Jun 2023 07:00:00 GMT"
80,UFPT Stock Price | UFP Technologies Inc. Stock Quote (U.S.: Nasdaq) - MarketWatch,"Tue, 17 Oct 2017 23:30:58 GMT"
81,VEA | Vanguard FTSE Developed Markets ETF Overview - MarketWatch,"Wed, 18 Oct 2017 05:55:12 GMT"
82,Nasdaq books best first half since 1983 - MarketWatch,"Fri, 30 Jun 2023 07:00:00 GMT"
83,"Kinder Morgan Inc. stock rises Tuesday, outperforms market - MarketWatch","Tue, 13 Jun 2023 07:00:00 GMT"
84,Palantir’s stock rises as BofA cheers company’s ‘unique position’ in AI - MarketWatch,"Mon, 12 Jun 2023 07:00:00 GMT"
85,Corning Inc. stock outperforms competitors on strong trading day - MarketWatch,"Wed, 14 Jun 2023 07:00:00 GMT"
86,"Hit Wegovy weight-loss drug on track for $4 billion in U.S. sales despite supply constraints, analyst says - MarketWatch","Tue, 20 Jun 2023 07:00:00 GMT"
87,American Water Works Co. stock outperforms market on strong trading day - MarketWatch,"Mon, 05 Jun 2023 07:00:00 GMT"
88,"Check out the all-new, roomy Lexus TX 3-row SUV - MarketWatch","Mon, 12 Jun 2023 07:00:00 GMT"
89,Bernie Sanders is investigating Amazon warehouse working conditions - MarketWatch,"Tue, 20 Jun 2023 07:00:00 GMT"
90,'Buying the dip' is making a major stock-market comeback in 2023 as strategy heads for 3rd-best year ever - MarketWatch,"Thu, 08 Jun 2023 07:00:00 GMT"
91,"Fox Corp. Cl A stock falls Tuesday, underperforms market - MarketWatch","Tue, 13 Jun 2023 07:00:00 GMT"
92,"Ocugen Inc. stock rises Tuesday, outperforms market - MarketWatch","Tue, 27 Jun 2023 07:00:00 GMT"
93,How much does a financial adviser cost? - MarketWatch,"Tue, 27 Jun 2023 07:00:00 GMT"
94,AST Stock Price | Astarta Holding N.V. Stock Quote (Poland: Warsaw) - MarketWatch,"Wed, 18 Oct 2017 04:04:12 GMT"
95,"Aurora Cannabis Inc. stock falls Wednesday, still outperforms market - MarketWatch","Wed, 07 Jun 2023 07:00:00 GMT"
96,"Incyte Corp. stock falls Friday, underperforms market - MarketWatch","Fri, 09 Jun 2023 07:00:00 GMT"
97,6301 Stock Price | Komatsu Ltd. Stock Quote (Japan: Tokyo) - MarketWatch,"Thu, 22 Oct 2009 05:06:49 GMT"
98,CAVA | CAVA Group Inc. Annual Balance Sheet - MarketWatch,"Wed, 14 Jun 2023 04:07:51 GMT"
99,CISS | C3is Inc. SEC Filings - MarketWatch,"Fri, 23 Jun 2023 06:39:17 GMT"
