,Title,Date
0,"Dow drops nearly 50 points on losses for shares of Chevron, Boeing - MarketWatch","Thu, 19 Aug 2021 07:00:00 GMT"
1,XOS | Xos Inc. Analyst Estimates - MarketWatch,"Fri, 27 Aug 2021 04:40:09 GMT"
2,Blackrock’s research arm sees `real and broadening’ restart of global economy - MarketWatch,"Mon, 09 Aug 2021 07:00:00 GMT"
3,EMSKF Stock Price | Musk Metals Corp. Stock Quote (U.S.: OTC) - MarketWatch,"Mon, 15 Mar 2021 16:00:41 GMT"
4,"S&P 500 at 5,000? Credit Suisse sets 2022 target for stock-market benchmark - MarketWatch","Mon, 09 Aug 2021 07:00:00 GMT"
5,Investors compare 2021 stock-market rally to the pre-crash summer of 1987 --- should they? - MarketWatch,"Wed, 18 Aug 2021 07:00:00 GMT"
6,BULZ | MicroSectors FANG & Innovation 3x Leveraged ETN Overview - MarketWatch,"Sat, 21 Aug 2021 04:10:18 GMT"
7,Here’s how to live rent-free in a historic home - MarketWatch,"Thu, 19 Aug 2021 07:00:00 GMT"
8,"O'Reilly Automotive Inc. stock rises Friday, still underperforms market - MarketWatch","Fri, 20 Aug 2021 07:00:00 GMT"
9,CDC adds Turkey and three other destinations to its list of places to avoid - MarketWatch,"Tue, 17 Aug 2021 07:00:00 GMT"
10,Fed’s George backs ending bond-buying - MarketWatch,"Wed, 11 Aug 2021 07:00:00 GMT"
11,International Paper Co. stock outperforms market on strong trading day - MarketWatch,"Tue, 31 Aug 2021 07:00:00 GMT"
12,AGI Stock Price | Alamos Gold Inc. Stock Quote (Canada: Toronto) - MarketWatch,"Fri, 29 Sep 2017 23:17:50 GMT"
13,532174 | ICICI Bank Ltd. Profile - MarketWatch,"Tue, 09 Nov 2021 08:23:04 GMT"
14,C3RY Stock Price | Cherry AG Stock Quote (Germany: Xetra ) - MarketWatch,"Fri, 13 Aug 2021 05:33:22 GMT"
15,I'm 60 and have $1 million in my retirement accounts. My house needs a new roof. Should I use my savings to cover the repairs? - MarketWatch,"Mon, 09 Aug 2021 07:00:00 GMT"
16,LINE Stock Price | Linear Minerals Corp. Stock Quote (Canadian Securities Exchange) - MarketWatch,"Mon, 06 Jan 2025 19:34:34 GMT"
17,JOBY.WT | Joby Aviation Inc. Wt Profile - MarketWatch,"Wed, 11 Aug 2021 15:12:30 GMT"
18,SNN | Smith & Nephew PLC ADR Profile - MarketWatch,"Sat, 31 Oct 2020 16:49:17 GMT"
19,"Domino's Pizza Inc. stock falls Thursday, underperforms market - MarketWatch","Thu, 05 Aug 2021 07:00:00 GMT"
20,FleetCor Technologies Inc. stock underperforms Monday when compared to competitors - MarketWatch,"Mon, 09 Aug 2021 07:00:00 GMT"
21,"Willis Towers Watson PLC stock rises Tuesday, outperforms market - MarketWatch","Tue, 31 Aug 2021 07:00:00 GMT"
22,SPOI Stock Price | SPO Networks Inc. Stock Quote (U.S.: OTC) - MarketWatch,"Fri, 13 Oct 2017 21:53:03 GMT"
23,Who is Kathy Hochul? 5 facts about New York’s new governor - MarketWatch,"Tue, 10 Aug 2021 07:00:00 GMT"
24,Opinion: What is decentralized finance? An expert on bitcoins and blockchains explains the risks and rewards of DeFi - MarketWatch,"Sat, 21 Aug 2021 07:00:00 GMT"
25,"The housing market is so hot, a burnt Bay Area home is drawing bids above $850K - MarketWatch","Thu, 12 Aug 2021 07:00:00 GMT"
26,Apple crisp macchiato joins pumpkin spice latte on the Starbucks menu - MarketWatch,"Tue, 24 Aug 2021 07:00:00 GMT"
27,"American Express Co. stock rises Friday, still underperforms market - MarketWatch","Fri, 20 Aug 2021 07:00:00 GMT"
28,BERZ | MicroSectors FANG & Innovation -3x Inverse Leveraged ETN Overview - MarketWatch,"Tue, 17 Aug 2021 07:00:00 GMT"
29,WRN Stock Price | Western Copper & Gold Corp. Stock Quote (Canada: Toronto) - MarketWatch,"Thu, 19 Oct 2017 09:34:39 GMT"
30,Italy’s Marcell Jacobs: The new fastest man in the world - MarketWatch,"Sun, 01 Aug 2021 07:00:00 GMT"
31,News and analysis for those planning for or living in retirement - MarketWatch,"Fri, 13 Aug 2021 07:00:00 GMT"
32,Check out the new Genesis GV60 electric SUV - MarketWatch,"Mon, 30 Aug 2021 07:00:00 GMT"
33,"U.S. state tax revenues end 2021 higher than 2019, report finds - MarketWatch","Wed, 25 Aug 2021 07:00:00 GMT"
34,- MarketWatch,"Wed, 13 Oct 2021 13:49:00 GMT"
35,VBR | Vanguard Small-Cap Value ETF Overview - MarketWatch,"Sat, 30 Sep 2017 00:17:08 GMT"
36,9999 Stock Price | Netease Inc. Stock Quote (Hong Kong) - MarketWatch,"Thu, 09 Jul 2020 06:44:08 GMT"
37,"Nikola Corp. stock falls Monday, underperforms market - MarketWatch","Mon, 02 Aug 2021 07:00:00 GMT"
38,HUMA | Humacyte Inc. Options - MarketWatch,"Sat, 28 Aug 2021 10:42:09 GMT"
39,"Western Union suspends money transfers to Afghanistan, cutting off 'vital channel' of financial support - MarketWatch","Tue, 17 Aug 2021 07:00:00 GMT"
40,HSLV Stock Price | Highlander Silver Corp. Stock Quote (Canada: Toronto) - MarketWatch,"Sat, 28 Aug 2021 07:42:11 GMT"
41,How China may benefit from Afghanistan's estimated $3 trillion mineral reserves following the Taliban takeover - MarketWatch,"Sat, 21 Aug 2021 07:00:00 GMT"
42,"Exclusive: Bernie Madoff’s harrowing final days: hallucinations, dire medical conditions, and waiting for the end to come - MarketWatch","Mon, 09 Aug 2021 07:00:00 GMT"
43,"Hedge fund Alphadyne Asset Management loses $1.5 billion as yields tumbled in July, says report - MarketWatch","Tue, 03 Aug 2021 07:00:00 GMT"
44,ERAS Stock Price | Erasca Inc. Stock Quote (U.S.: Nasdaq) - MarketWatch,"Fri, 25 Jun 2021 22:41:55 GMT"
45,The S&P 500 is nearly 99% above its March 2020 low. These 3 big-tech charts will tell you if things are about to unravel - MarketWatch,"Fri, 13 Aug 2021 07:00:00 GMT"
46,"Bitcoin $100,000? Bulls see crypto at $50,000 as a pit stop to much higher prices - MarketWatch","Mon, 23 Aug 2021 07:00:00 GMT"
47,Trading pioneer Thomas Peterffy says SEC's Gensler will have a tough time banning payment for order flow - MarketWatch,"Tue, 31 Aug 2021 07:00:00 GMT"
48,AFLYY Stock Price | Air France-KLM ADR Stock Quote (U.S.: OTC) - MarketWatch,"Tue, 17 Oct 2017 21:56:20 GMT"
49,You need the Excelsior Pass now that NYC will require COVID-19 vaccination proof - MarketWatch,"Wed, 04 Aug 2021 07:00:00 GMT"
50,How did stimulus checks affect household finances? - MarketWatch,"Tue, 17 Aug 2021 07:00:00 GMT"
51,SNYXF Stock Price | Vital Energy Inc. Stock Quote (U.S.: OTC) - MarketWatch,"Tue, 28 Nov 2017 01:18:02 GMT"
52,Money talks. We listen. You learn. - MarketWatch,"Tue, 24 Aug 2021 22:17:24 GMT"
53,9IU | Canstar Resources Inc. Advanced Charts - MarketWatch,"Fri, 28 Sep 2018 23:15:29 GMT"
54,EWCZ Stock Price | European Wax Center Inc. Stock Quote (U.S.: Nasdaq) - MarketWatch,"Tue, 13 Jul 2021 23:03:19 GMT"
55,"Lockheed Martin CFO Possenriede to retire, effective immediately - MarketWatch","Tue, 03 Aug 2021 07:00:00 GMT"
56,IWY Stock Price | Sify Technologies Ltd. ADR Stock Quote (Germany: Frankfurt ) - MarketWatch,"Wed, 09 Apr 2025 02:28:20 GMT"
57,NOB Stock Price | Noobz from Poland S.A. Stock Quote (Poland: Warsaw) - MarketWatch,"Sat, 07 Aug 2021 20:53:37 GMT"
58,Cristiano Ronaldo to join Manchester United in latest European soccer shakeup - MarketWatch,"Thu, 26 Aug 2021 07:00:00 GMT"
59,"Iron Mountain Inc. stock falls Tuesday, underperforms market - MarketWatch","Tue, 24 Aug 2021 07:00:00 GMT"
60,WINA Stock Price | Winmark Corp. Stock Quote (U.S.: Nasdaq) - MarketWatch,"Wed, 18 Oct 2017 09:00:43 GMT"
61,"Kimberly-Clark Corp. stock rises Monday, still underperforms market - MarketWatch","Mon, 30 Aug 2021 07:00:00 GMT"
62,CAE Stock Price | CAE Inc. Stock Quote (Canada: Toronto) - MarketWatch,"Wed, 18 Oct 2017 11:20:56 GMT"
63,2802 Stock Price | Ajinomoto Co. Inc. Stock Quote (Japan: Tokyo) - MarketWatch,"Wed, 18 Oct 2017 09:41:19 GMT"
64,BofA sees rising risk of a large ‘fragility’ shock heading into the fall - MarketWatch,"Tue, 24 Aug 2021 07:00:00 GMT"
65,General Electric Co. stock outperforms competitors on strong trading day - MarketWatch,"Fri, 06 Aug 2021 07:00:00 GMT"
66,Dover Corp. stock underperforms Monday when compared to competitors despite daily gains - MarketWatch,"Mon, 30 Aug 2021 07:00:00 GMT"
67,Meet the Long Island guys who love unloved shopping malls - MarketWatch,"Tue, 17 Aug 2021 07:00:00 GMT"
68,CBAY - MarketWatch - MarketWatch,"Tue, 03 Aug 2021 20:18:58 GMT"
69,QDPL | Pacer Metaurus US Large Cap Div Multiplier 400 ETF Overview - MarketWatch,"Tue, 13 Jul 2021 12:49:23 GMT"
70,Opinion: How high-frequency traders are costing the rest of us billions of dollars each year - MarketWatch,"Thu, 05 Aug 2021 07:00:00 GMT"
71,Opinion: The FTC’s antitrust case against Facebook fails both legal tests - MarketWatch,"Tue, 24 Aug 2021 07:00:00 GMT"
72,"Moderna Inc. stock falls Wednesday, underperforms market - MarketWatch","Wed, 11 Aug 2021 07:00:00 GMT"
73,S&P 500 hasn’t fallen 5% from a peak in nearly 200 sessions—what that tells market historians - MarketWatch,"Sat, 21 Aug 2021 07:00:00 GMT"
74,IPSEY Stock Price | Ipsen ADR Stock Quote (U.S.: OTC) - MarketWatch,"Fri, 20 Oct 2017 09:46:14 GMT"
75,Arista Networks Inc. stock outperforms competitors on strong trading day - MarketWatch,"Tue, 24 Aug 2021 07:00:00 GMT"
76,Gloria Estefan’s Star Island Mansion Finally Sells for $35M - MarketWatch,"Thu, 12 Aug 2021 07:00:00 GMT"
77,"How real assets stack up to stocks, bonds when inflation is high, says BlackRock - MarketWatch","Thu, 26 Aug 2021 07:00:00 GMT"
78,WAFU Stock Price | Wah Fu Education Group Ltd. Stock Quote (U.S.: Nasdaq) - MarketWatch,"Wed, 01 May 2019 00:28:45 GMT"
79,Chipotle Mexican Grill Inc. stock underperforms Monday when compared to competitors - MarketWatch,"Mon, 16 Aug 2021 07:00:00 GMT"
80,"Pioneer Natural Resources Co. stock falls Friday, underperforms market - MarketWatch","Fri, 13 Aug 2021 07:00:00 GMT"
81,Bank of America vice chair and chief operating officer to retire at year’s end - MarketWatch,"Thu, 26 Aug 2021 07:00:00 GMT"
82,Aon PLC stock outperforms competitors on strong trading day - MarketWatch,"Tue, 31 Aug 2021 07:00:00 GMT"
83,Opinion: Large Social Security COLA increase may spark a debate about the appropriate index - MarketWatch,"Wed, 11 Aug 2021 07:00:00 GMT"
84,Asian markets mixed as investors await on economic data - MarketWatch,"Thu, 12 Aug 2021 07:00:00 GMT"
85,URC Stock Price | Universal Robina Corp. Stock Quote (Philippines: Manila) - MarketWatch,"Wed, 18 Oct 2017 10:37:36 GMT"
86,BULZ | MicroSectors FANG & Innovation 3x Leveraged ETN Options - MarketWatch,"Mon, 23 Aug 2021 11:13:35 GMT"
87,Short sellers didn’t pounce when China stocks tumbled - MarketWatch,"Wed, 04 Aug 2021 07:00:00 GMT"
88,ALNT Stock Price | Alantra Partners S.A. Stock Quote (Spain: Madrid ) - MarketWatch,"Tue, 17 Oct 2017 22:23:34 GMT"
89,"‘Most’ top Fed officials backed taper to start this year, minutes of July meeting show - MarketWatch","Wed, 18 Aug 2021 07:00:00 GMT"
90,"If the S&P 500 breaks above this key level, it could set off an 'epic emotional squeeze' not unlike 1999, strategists warn - MarketWatch","Mon, 09 Aug 2021 07:00:00 GMT"
91,ADTN Stock Price | ADTRAN Holdings Inc. Stock Quote (U.S.: Nasdaq) - MarketWatch,"Wed, 14 Apr 2010 13:52:34 GMT"
92,Market Data Center - MarketWatch,"Thu, 12 Aug 2021 12:53:27 GMT"
93,Walmart opens local delivery service to other retailers - MarketWatch,"Tue, 24 Aug 2021 07:00:00 GMT"
94,CDC Stock Price | Cityland Development Corp. Stock Quote (Philippines: Manila) - MarketWatch,"Thu, 19 Oct 2017 03:39:34 GMT"
95,The basics of dividend investing | How to Invest: Ep. 11 - MarketWatch,"Wed, 04 Aug 2021 07:00:00 GMT"
96,CYBN | Cybin Inc. Options - MarketWatch,"Mon, 09 Aug 2021 01:50:51 GMT"
97,"I’m a 39-year-old single dad with $600,000 saved — I want to retire at 50 but don’t know how. What should I do? - MarketWatch","Fri, 06 Aug 2021 07:00:00 GMT"
98,"Advanced Micro Devices Inc. stock falls Wednesday, underperforms market - MarketWatch","Wed, 18 Aug 2021 07:00:00 GMT"
99,Zoom Video Communications Inc. stock underperforms Wednesday when compared to competitors - MarketWatch,"Wed, 25 Aug 2021 07:00:00 GMT"
