,Title,Date
0,Manhattan Associates downgraded to hold from buy at SunTrust RH - MarketWatch,"Wed, 26 Sep 2018 07:00:00 GMT"
1,Verastem's stock halted for news pending - MarketWatch,"Mon, 24 Sep 2018 07:00:00 GMT"
2,Manhattan Associates stock price target raised to $69 from $55 at Benchmark - MarketWatch,"Fri, 14 Sep 2018 07:00:00 GMT"
3,ESGV Holdings - MarketWatch,"Fri, 21 Sep 2018 02:54:10 GMT"
4,The number of female multi-millionaires surged 31% last year - MarketWatch,"Thu, 06 Sep 2018 07:00:00 GMT"
5,Anthony Bourdain in trailer for show’s final season: ‘I pinch myself’ - MarketWatch,"Sun, 23 Sep 2018 07:00:00 GMT"
6,U.S. stocks close mostly higher as investors take escalating trade tensions in stride - MarketWatch,"Wed, 19 Sep 2018 07:00:00 GMT"
7,Here’s how Apple’s stock performs around iPhone launch events - MarketWatch,"Wed, 12 Sep 2018 07:00:00 GMT"
8,Alibaba’s Jack Ma to remain chairman for one more year - MarketWatch,"Sun, 09 Sep 2018 07:00:00 GMT"
9,These 7 countries are most at risk of a currency crisis: Nomura - MarketWatch,"Mon, 10 Sep 2018 07:00:00 GMT"
10,"The story of the bull market, in four charts - MarketWatch","Thu, 13 Sep 2018 07:00:00 GMT"
11,Texts and emails could ultimately help kill the statute of limitations for sex crimes - MarketWatch,"Fri, 28 Sep 2018 07:00:00 GMT"
12,Opinion: How to survive marijuana stocks’ rollercoaster ride - MarketWatch,"Mon, 24 Sep 2018 07:00:00 GMT"
13,From hammers to hair clippers: How Trump’s trade war with China will affect you - MarketWatch,"Sun, 30 Sep 2018 07:00:00 GMT"
14,OV8 Stock Price | Sheng Siong Group Ltd. Stock Quote (Singapore: SGX) - MarketWatch,"Wed, 18 Oct 2017 15:26:55 GMT"
15,TFI | SPDR Nuveen Bloomberg Municipal Bond ETF Overview - MarketWatch,"Tue, 24 Jul 2012 07:55:38 GMT"
16,How hackers can drain your frequent flyer miles - MarketWatch,"Sat, 22 Sep 2018 07:00:00 GMT"
17,Opinion: Greedy stock investors are starting to show signs of irrational exuberance - MarketWatch,"Fri, 14 Sep 2018 07:00:00 GMT"
18,‘Gilligan’s Island’ star shares a cautionary financial tale - MarketWatch,"Sun, 09 Sep 2018 07:00:00 GMT"
19,"Bitcoin slips back toward critical support, drags market cap below $200 billion - MarketWatch","Mon, 17 Sep 2018 07:00:00 GMT"
20,"SEC charges multiple firms, individuals with microcap fraud schemes, including Barry Honig - MarketWatch","Fri, 07 Sep 2018 07:00:00 GMT"
21,How a $450 million da Vinci painting got lost in America for years - MarketWatch,"Wed, 19 Sep 2018 07:00:00 GMT"
22,"That ubiquitous ‘distracted boyfriend’ meme of the year? Yes, it’s sexist, says Swedish ad group - MarketWatch","Wed, 26 Sep 2018 07:00:00 GMT"
23,Typical household now brings in as much income as before the recession - MarketWatch,"Wed, 12 Sep 2018 07:00:00 GMT"
24,"Here’s how the Fed’s statement, dot plot and forecast may shift - MarketWatch","Wed, 26 Sep 2018 07:00:00 GMT"
25,"California wildfire frequency could surge 50% by 2050, report finds - MarketWatch","Sat, 01 Sep 2018 07:00:00 GMT"
26,"These jobs will improve your dating life (well, they will help) - MarketWatch","Sun, 23 Sep 2018 07:00:00 GMT"
27,Trump Today: President says it would be ‘unfortunate’ if Kavanaugh accuser Ford doesn’t testify - MarketWatch,"Wed, 19 Sep 2018 07:00:00 GMT"
28,Americans’ fascination with ‘mortgage rates:’ a tour through financial market history - MarketWatch,"Sat, 22 Sep 2018 07:00:00 GMT"
29,"More than half of the gas stations in Wilmington, N.C., are out of fuel - MarketWatch","Fri, 14 Sep 2018 07:00:00 GMT"
30,U.S. consumer sentiment cools a bit in late September - MarketWatch,"Fri, 28 Sep 2018 07:00:00 GMT"
31,GARAN.E | Turkiye Garanti Bankasi A.S. Advanced Charts - MarketWatch,"Tue, 29 Mar 2022 20:17:14 GMT"
32,SVSN Stock Price | Stereo Vision Entertainment Inc. Stock Quote (U.S.: OTC) - MarketWatch,"Thu, 18 May 2017 09:16:21 GMT"
33,"‘Our democracy is in crisis,’ Hillary Clinton warns in essay blasting Trump - MarketWatch","Sun, 16 Sep 2018 07:00:00 GMT"
34,"Facebook can’t keep up with Twitter, and the Instagram news isn’t helping - MarketWatch","Tue, 25 Sep 2018 07:00:00 GMT"
35,Opinion: Tariffs could be worth it if Chinese were forced to stop stealing U.S. technology - MarketWatch,"Sat, 29 Sep 2018 07:00:00 GMT"
36,Opinion: Sell Tesla and buy GM — seriously - MarketWatch,"Thu, 13 Sep 2018 07:00:00 GMT"
37,Wealthy Americans may be warning of the stock market collapse to come: analyst - MarketWatch,"Mon, 17 Sep 2018 07:00:00 GMT"
38,Opinion: Apple and other companies sound the alarm on Trump’s China tariff plans - MarketWatch,"Tue, 11 Sep 2018 07:00:00 GMT"
39,SGP | Synergy Grid & Development Philippines Inc. Annual Income Statement - MarketWatch,"Tue, 25 Sep 2018 21:36:23 GMT"
40,Why you should never synchronize your phone with an Uber to play music - MarketWatch,"Sun, 02 Sep 2018 07:00:00 GMT"
41,A Hindenburg Omen is forming in the stock market. Should investors ignore it? - MarketWatch,"Mon, 17 Sep 2018 07:00:00 GMT"
42,The 5 things that best predict how rich you’ll be - MarketWatch,"Wed, 05 Sep 2018 07:00:00 GMT"
43,"Charting a bullish September backdrop: S&P 500, Nasdaq maintain major support - MarketWatch","Tue, 11 Sep 2018 07:00:00 GMT"
44,"Spending money on expensive stuff can make you happier, if you do it for the right reason - MarketWatch","Thu, 20 Sep 2018 07:00:00 GMT"
45,Ponzi scheme unraveled by feds used CLOs of consumer portfolios - MarketWatch,"Fri, 21 Sep 2018 07:00:00 GMT"
46,Crypto market cap tops $240 billion with bitcoin’s 5% weekend rally - MarketWatch,"Tue, 04 Sep 2018 07:00:00 GMT"
47,Your kid’s Happy Meal likely isn’t a healthy meal - MarketWatch,"Thu, 27 Sep 2018 07:00:00 GMT"
48,The new housing play: helping priced-out renters become long-distance landlords - MarketWatch,"Sat, 29 Sep 2018 07:00:00 GMT"
49,Opinion: Nouriel Roubini: 10 reasons conditions will be ripe for a financial crisis by 2020 - MarketWatch,"Fri, 14 Sep 2018 07:00:00 GMT"
50,Why it’s almost impossible to steal a Tesla (and get away with it) - MarketWatch,"Mon, 03 Sep 2018 07:00:00 GMT"
51,Dollar regains strength after economic data - MarketWatch,"Fri, 14 Sep 2018 07:00:00 GMT"
52,Stock market logs weekly loss as Trump hints at more China tariffs - MarketWatch,"Fri, 07 Sep 2018 07:00:00 GMT"
53,United Rentals to buy privately held BlueLine Rental for $2.1 billion in cash - MarketWatch,"Mon, 10 Sep 2018 07:00:00 GMT"
54,TCNNF | Trulieve Cannabis Corp. Advanced Charts - MarketWatch,"Sun, 30 Sep 2018 01:14:31 GMT"
55,Opinion: The cult next door: Debunking five misconceptions about human trafficking - MarketWatch,"Mon, 10 Sep 2018 07:00:00 GMT"
56,Tesla stock tanks after report company faces criminal probe over Musk’s tweet - MarketWatch,"Wed, 19 Sep 2018 07:00:00 GMT"
57,What ‘the most important chart in the world’ says about stocks going forward - MarketWatch,"Wed, 12 Sep 2018 07:00:00 GMT"
58,KEYN Stock Price | Keyence Corp. Stock Quote (Mexico) - MarketWatch,"Tue, 09 Apr 2019 07:21:33 GMT"
59,Why kissing up to the boss is a fool’s errand - MarketWatch,"Mon, 03 Sep 2018 07:00:00 GMT"
60,"Fans remember Marty Balin, founder of Jefferson Airplane and Starship - MarketWatch","Sat, 29 Sep 2018 07:00:00 GMT"
61,Opinion: Tesla needs to put a seat belt on Elon Musk - MarketWatch,"Wed, 19 Sep 2018 07:00:00 GMT"
62,"A stock-market bear signal is at a more-than-4-decade high, says Goldman - MarketWatch","Mon, 10 Sep 2018 07:00:00 GMT"
63,America’s fastest-growing plastic surgery procedure takes place below the belt - MarketWatch,"Sat, 15 Sep 2018 07:00:00 GMT"
64,PCL Stock Price | Pancontinental Energy N.L. Stock Quote (Australia: Sydney) - MarketWatch,"Thu, 21 Sep 2017 00:09:03 GMT"
65,Burberry will no longer burn unsold clothes - MarketWatch,"Thu, 06 Sep 2018 07:00:00 GMT"
66,Alibaba’s Jack Ma says government should stick to governing - MarketWatch,"Mon, 17 Sep 2018 07:00:00 GMT"
67,AUMC Stock Price | AURYN Mining Corp. Stock Quote (U.S.: OTC) - MarketWatch,"Sun, 16 Sep 2018 06:15:42 GMT"
68,"Asian markets hit as trade tensions escalate, sending Shanghai index to lowest since 2014 - MarketWatch","Mon, 17 Sep 2018 07:00:00 GMT"
69,"Tesla is ‘headed to the graveyard,’ warns iconic member of Detroit’s old guard - MarketWatch","Wed, 19 Sep 2018 07:00:00 GMT"
70,President Trump Visits Region Hit by Hurricane Florence - MarketWatch,"Wed, 19 Sep 2018 07:00:00 GMT"
71,LIFT Stock Price | Li-FT Power Ltd. Stock Quote (Canada: TSX Venture) - MarketWatch,"Tue, 18 Sep 2018 01:04:22 GMT"
72,Yardeni says Trump winning the trade war with China will trigger ‘the mother of all meltups’ - MarketWatch,"Sun, 09 Sep 2018 07:00:00 GMT"
73,Opinion: Fear of October is creeping into money flows in 11 popular tech stocks - MarketWatch,"Thu, 27 Sep 2018 07:00:00 GMT"
74,Why we keep hearing about once-famous TV actors in financial trouble - MarketWatch,"Mon, 10 Sep 2018 07:00:00 GMT"
75,Trump to impose tariffs on another $200 billion in Chinese goods - MarketWatch,"Tue, 18 Sep 2018 07:00:00 GMT"
76,If you’re over 50 ask your doctor about this now - MarketWatch,"Fri, 07 Sep 2018 07:00:00 GMT"
77,"Why the anti-fascist, anti-racist themes of ‘The Twilight Zone’ are more relevant today than ever - MarketWatch","Fri, 21 Sep 2018 07:00:00 GMT"
78,"Gold books a gain as dollar wavers, U.S. stocks slump - MarketWatch","Mon, 17 Sep 2018 07:00:00 GMT"
79,"XRP surges 75%, overtakes Ether as world’s second-biggest digital currency - MarketWatch","Fri, 21 Sep 2018 07:00:00 GMT"
80,‘Night School’ tops box office in best debut for a comedy this year - MarketWatch,"Sun, 30 Sep 2018 07:00:00 GMT"
81,GMDA - MarketWatch - MarketWatch,"Sat, 29 Sep 2018 00:34:39 GMT"
82,FSS Stock Price | Federal Signal Corp. Stock Quote (U.S.: NYSE) - MarketWatch,"Fri, 07 May 2010 12:10:58 GMT"
83,Barack Obama once got kicked out of Disneyland for smoking with his friends - MarketWatch,"Mon, 10 Sep 2018 07:00:00 GMT"
84,TOR Stock Price | Torpol S.A. Stock Quote (Poland: Warsaw) - MarketWatch,"Sat, 15 Sep 2018 13:58:12 GMT"
85,CA:RHC - MarketWatch - MarketWatch,"Mon, 24 Sep 2018 00:00:25 GMT"
86,Thor Industries to acquire Erwin Hymer in deal valued at 2.1 billion euros - MarketWatch,"Tue, 18 Sep 2018 07:00:00 GMT"
87,SRM Stock Price | Societe de Realisations Mecaniques Stock Quote (Casablanca Stock Exchange) - MarketWatch,"Wed, 17 Jul 2019 01:56:29 GMT"
88,ESGV | Vanguard ESG US Stock ETF Options - MarketWatch,"Fri, 21 Sep 2018 02:46:37 GMT"
89,Repatriated profits total $465 billion after Trump tax cuts - leaving $2.5 trillion overseas - MarketWatch,"Wed, 19 Sep 2018 07:00:00 GMT"
90,Elon Musk faces his own worst enemy - MarketWatch,"Sat, 01 Sep 2018 07:00:00 GMT"
91,House Republicans plan vote on $638 billion tax-cut extension - MarketWatch,"Thu, 06 Sep 2018 07:00:00 GMT"
92,"Alex Jones, Infowars permanently banned from Twitter after new violations - MarketWatch","Thu, 06 Sep 2018 07:00:00 GMT"
93,Venture-capital firm Kleiner Perkins to split over strategy differences - MarketWatch,"Sat, 15 Sep 2018 07:00:00 GMT"
94,Generation Z home buyers have family money and move fast to purchase property - MarketWatch,"Sun, 30 Sep 2018 07:00:00 GMT"
95,Opinion: This stock market indicator hasn’t been so inflated since the internet bubble top - MarketWatch,"Tue, 18 Sep 2018 07:00:00 GMT"
96,Dimon says he’d beat Trump in a presidential race because he’s smarter than Trump is - MarketWatch,"Wed, 12 Sep 2018 07:00:00 GMT"
97,"More than 200,000 teens had plastic surgery last year, and social media had a lot to do with it - MarketWatch","Sun, 30 Sep 2018 07:00:00 GMT"
98,Reforms haven’t eliminated risk of another Lehman-type failure - MarketWatch,"Fri, 14 Sep 2018 07:00:00 GMT"
99,Billionaire health-care investor Phillip Frost charged by SEC with pump-and-dump schemes - MarketWatch,"Mon, 17 Sep 2018 07:00:00 GMT"
