,Title,Date
0,"Stock futures, dollar fall after Moody’s strips U.S. of its top credit rating - MarketWatch","Sun, 18 May 2025 20:44:00 GMT"
1,"Bessent warns some steep ‘liberation day’ tariffs may return, dismisses Moody’s downgrade - MarketWatch","Sun, 18 May 2025 20:24:00 GMT"
2,Opinion: Why is the Fed quietly buying billions in bonds — and hoping nobody notices? - MarketWatch,"Fri, 16 May 2025 11:25:00 GMT"
3,What to make of the stock market’s recovery - MarketWatch,"Fri, 16 May 2025 17:15:00 GMT"
4,‘They will drown you too’: My coworker found out I inherited money — and harassed me to give him a loan - MarketWatch,"Sun, 18 May 2025 10:43:00 GMT"
5,"Stock Market on May 16, 2025: Dow erases 2025 loss, S&P 500 scores fifth straight day of gains after trade-war tensions eased - MarketWatch","Fri, 16 May 2025 20:36:00 GMT"
6,Opinion: America just imported a mountain of gold. Here’s why that should scare you. - MarketWatch,"Thu, 15 May 2025 11:45:00 GMT"
7,Powell signals return toward inflation-first strategy - MarketWatch,"Thu, 15 May 2025 12:40:00 GMT"
8,How Europe’s best investor picks stocks including GE Aerospace and Microsoft - MarketWatch,"Fri, 16 May 2025 10:53:00 GMT"
9,These 19 stocks at the intersection of AI and robotics could see big sales boosts - MarketWatch,"Sat, 17 May 2025 11:00:00 GMT"
10,Here’s how a Trump nuclear deal with Iran could impact global oil supplies and prices - MarketWatch,"Thu, 15 May 2025 20:44:00 GMT"
11,"Opinion: Trump’s tax bill is Republicans’ big, bloated, $4 trillion headache - MarketWatch","Wed, 14 May 2025 21:26:00 GMT"
12,"Strong earnings keep stock-market bulls in charge, but what could end the rally? - MarketWatch","Sun, 18 May 2025 21:46:00 GMT"
13,U.S. loses final triple-A credit rating after Moody’s downgrade: ‘Not good news’ - MarketWatch,"Fri, 16 May 2025 22:47:00 GMT"
14,Do you qualify for the tax breaks in the GOP’s big bill? Your income holds the answer. - MarketWatch,"Wed, 14 May 2025 10:00:00 GMT"
15,"UnitedHealth’s troubles pile up, as stock sinks again after report of DOJ probe - MarketWatch","Thu, 15 May 2025 12:14:00 GMT"
16,"Gold has a shot at more record highs, thanks to Trump’s preference for a weaker dollar - MarketWatch","Thu, 15 May 2025 10:30:00 GMT"
17,Newly issued eToro shares jump in Nasdaq debut. It’s a bullish sign for IPOs. - MarketWatch,"Wed, 14 May 2025 17:24:00 GMT"
18,Inflation just hit a 4-year low. Don’t expect price relief to last even as trade wars die down. - MarketWatch,"Wed, 14 May 2025 15:44:00 GMT"
19,Ether is finally outperforming bitcoin. Here’s what’s driving the crypto’s rally. - MarketWatch,"Tue, 13 May 2025 20:36:00 GMT"
20,Millions of Americans may lose health insurance under GOP tax plan. Here’s who will be affected most. - MarketWatch,"Tue, 13 May 2025 21:15:00 GMT"
21,"UnitedHealth’s troubles get worse, as 2025 outlook suspended and CEO steps down - MarketWatch","Tue, 13 May 2025 11:32:00 GMT"
22,"A new ‘senior bonus’ could give older adults a $4,000 tax break. Here’s who would qualify. - MarketWatch","Tue, 13 May 2025 18:44:00 GMT"
23,Wall Street’s ‘fear gauge’ just dropped with striking speed. Here’s what that’s meant in the past. - MarketWatch,"Tue, 13 May 2025 20:52:00 GMT"
24,"CPI snapshot: Consumer prices rise 0.2% in April, core up 0.2% - MarketWatch","Tue, 13 May 2025 20:35:00 GMT"
25,The stock market is bouncing back. Here’s a chance to fix your portfolio. - MarketWatch,"Tue, 13 May 2025 13:55:00 GMT"
26,"Stocks are at a risk of a drop of nearly 20%, says Goldman Sachs. Here’s the trigger. - MarketWatch","Fri, 09 May 2025 07:00:00 GMT"
27,"Opinion: The stock market is cheering the U.S.-China trade deal, but the tariff damage is done - MarketWatch","Mon, 12 May 2025 16:40:00 GMT"
28,Novo Nordisk rode Ozempic’s success to becoming Europe’s top company. Now it’s faltering and its CEO is out. - MarketWatch,"Fri, 16 May 2025 11:37:00 GMT"
29,‘We’re not wealthy’: My niece is marrying out of state and she has a honeymoon fund. Is that cheeky? - MarketWatch,"Fri, 16 May 2025 11:27:00 GMT"
30,Coinbase’s stock pops as the crypto exchange will join the S&P 500 index next Monday - MarketWatch,"Mon, 12 May 2025 21:33:00 GMT"
31,Consumer sentiment falls for 5th straight month in May as inflation worries grow - MarketWatch,"Fri, 16 May 2025 14:44:00 GMT"
32,What a steepening gold futures curve says about demand for the yellow metal - MarketWatch,"Tue, 13 May 2025 09:43:00 GMT"
33,"I paid my stepdaughter’s $415K mortgage, but her house fell in value. Do I sue? - MarketWatch","Wed, 14 May 2025 09:15:00 GMT"
34,Trump recession is off the table — but trouble is not over for the U.S. economy - MarketWatch,"Sat, 17 May 2025 13:00:00 GMT"
35,Nvidia looks to hold on to its business in China as Huawei threat intensifies - MarketWatch,"Fri, 16 May 2025 20:24:00 GMT"
36,UnitedHealth sees a longtime bull throw in the towel after stock’s plunge - MarketWatch,"Wed, 14 May 2025 18:46:00 GMT"
37,Virgin Galactic’s stock is skyrocketing. This is why. - MarketWatch,"Fri, 16 May 2025 13:14:00 GMT"
38,Republicans voted to raise the SALT cap. These taxpayers will benefit most. - MarketWatch,"Wed, 14 May 2025 20:31:00 GMT"
39,"Jensen Huang says Nvidia is missing out on a Boeing-sized opportunity in China: ‘Not a plane, the entire company’ - MarketWatch","Wed, 07 May 2025 07:00:00 GMT"
40,These companies will guarantee your rent. It will soon be a $1B-a-year industry. - MarketWatch,"Fri, 16 May 2025 19:17:00 GMT"
41,"Soros’s fund places new bets on Nvidia and a SpaceX rival, sells off Super Micro stake - MarketWatch","Thu, 15 May 2025 21:49:00 GMT"
42,Opinion: How Warren Buffett’s biggest investing mistakes actually teach you smart money lessons - MarketWatch,"Tue, 13 May 2025 11:50:00 GMT"
43,"House plan calls for annual fees of $250 for EVs, $100 for hybrids, while ending $7,500 EV tax credit - MarketWatch","Thu, 15 May 2025 16:47:00 GMT"
44,Gold skids more than 3% on tariff relief. Is it time to sell? - MarketWatch,"Mon, 12 May 2025 19:49:00 GMT"
45,"Michael Burry’s Scion bets against Nvidia, turns bearish on Chinese stocks - MarketWatch","Thu, 15 May 2025 21:03:00 GMT"
46,Student-loan borrowers in default could see Social Security benefits cut to $750 as debt collection resumes - MarketWatch,"Tue, 13 May 2025 13:41:00 GMT"
47,Third Point sells off Tesla and makes these other ‘Magnificent Seven’ moves - MarketWatch,"Thu, 15 May 2025 21:28:00 GMT"
48,"Warren Buffett’s Berkshire Hathaway dumps Citigroup stake, trims Bank of America, Capital One - MarketWatch","Thu, 15 May 2025 20:53:00 GMT"
49,‘We live modestly’: My wife and I have $900K in stocks and $380K in savings and CDs. Are we holding too much cash? - MarketWatch,"Thu, 08 May 2025 07:00:00 GMT"
50,An increasingly popular healthcare savings strategy could get more lucrative under GOP tax bill - MarketWatch,"Sat, 17 May 2025 12:00:00 GMT"
51,"U.S. stocks end higher Friday, with the Dow wiping out 2025 losses - MarketWatch","Fri, 16 May 2025 21:40:43 GMT"
52,Walmart’s CEO says Americans should brace for higher prices - MarketWatch,"Thu, 15 May 2025 11:11:00 GMT"
53,Why Friday’s options expiration could send this historic stock-market rally skidding to a halt - MarketWatch,"Thu, 15 May 2025 17:44:00 GMT"
54,Dow lags while S&P 500 tries for fifth-straight advance - MarketWatch,"Fri, 16 May 2025 09:36:00 GMT"
55,"Wholesale inflation shows biggest decline since 2020, but the good news is unlikely to last - MarketWatch","Thu, 15 May 2025 12:41:00 GMT"
56,"Congrats, class of 2025. Here are 5 money lessons you didn’t learn in college. - MarketWatch","Sat, 17 May 2025 14:00:00 GMT"
57,"Stanley Druckenmiller’s Duquesne dumps Alphabet, buys more Taiwan Semi and Coupang - MarketWatch","Thu, 15 May 2025 20:39:00 GMT"
58,"Fintech stocks are hot again, as Coinbase and eToro whet investor appetite - MarketWatch","Fri, 16 May 2025 14:16:00 GMT"
59,How long will the N.J. Transit strike last? Engineers want to make at least $100K. - MarketWatch,"Fri, 16 May 2025 16:40:00 GMT"
60,Coinbase says cyberattack cost up to $400 million after bribed overseas employees stole customer data - MarketWatch,"Thu, 15 May 2025 12:17:00 GMT"
61,Alphabet’s stock is now almost as cheap as eBay’s by this metric — but should you buy it? - MarketWatch,"Thu, 15 May 2025 16:32:00 GMT"
62,This is Generation X’s biggest retirement worry — and it’s not money - MarketWatch,"Thu, 15 May 2025 21:00:00 GMT"
63,"These $5,000 bonds can help you fix a stock-heavy portfolio - MarketWatch","Thu, 15 May 2025 13:36:00 GMT"
64,"‘I’m flabbergasted’: My friend wants to borrow $5,800 to save his home from foreclosure. What should I do? - MarketWatch","Fri, 09 May 2025 07:00:00 GMT"
65,GOP tax bill raises Obamacare premiums. These families would be hit hardest. - MarketWatch,"Thu, 15 May 2025 20:16:00 GMT"
66,Opinion: The stock market could stop short of new highs — but that seems unlikely now - MarketWatch,"Fri, 16 May 2025 02:54:00 GMT"
67,Trump says nations to get letters detailing tariff rates. Where tariffs sit now. - MarketWatch,"Fri, 16 May 2025 17:59:00 GMT"
68,"Most large cryptocurrencies climb on Dogecoin, Ethereum increases - MarketWatch","Fri, 16 May 2025 14:00:00 GMT"
69,My father’s widow keeps sending me $200 checks in the mail. Why would she do this? - MarketWatch,"Sat, 17 May 2025 11:20:00 GMT"
70,Bank of America says conditions are emerging for these unloved stocks to thrive. - MarketWatch,"Fri, 16 May 2025 13:00:00 GMT"
71,"‘My wife says no’: I’m 57 and ready to retire on $7,500 a month. Who’s right? - MarketWatch","Fri, 16 May 2025 09:25:00 GMT"
72,Opinion: More SALT should be on America’s tax-deduction menu. Way more. - MarketWatch,"Fri, 16 May 2025 18:28:00 GMT"
73,"My second wife says her 2 kids should inherit our estate, but I also have 2 kids. Is that fair? - MarketWatch","Tue, 06 May 2025 07:00:00 GMT"
74,Prices likely to rise at Walmart. More retailers will detail tariff impact this week. - MarketWatch,"Sun, 18 May 2025 14:00:00 GMT"
75,How America’s reliance on imported food would threaten the U.S. in a crisis - MarketWatch,"Fri, 16 May 2025 11:50:00 GMT"
76,How states can tax their millionaires more — and not lose them to safer havens - MarketWatch,"Thu, 15 May 2025 16:59:00 GMT"
77,Trump says India offered to drop tariffs on U.S. to zero - MarketWatch,"Thu, 15 May 2025 07:39:00 GMT"
78,I spend more on my daughter’s family than on my single son. Do I compensate him? - MarketWatch,"Sat, 10 May 2025 07:00:00 GMT"
79,Consumer prices likely rebounded in April as higher tariffs began to bite - MarketWatch,"Mon, 12 May 2025 20:04:00 GMT"
80,‘Bait-and-switch’ tactics now cost used-car buyers an average $640 in extra fees - MarketWatch,"Fri, 16 May 2025 20:09:00 GMT"
81,Opinion: A surprising silver lining from the COVID-19 pandemic - MarketWatch,"Thu, 15 May 2025 18:08:00 GMT"
82,Trump’s tax bill is in jeopardy. Here’s why some in GOP are getting cold feet. - MarketWatch,"Fri, 16 May 2025 16:17:00 GMT"
83,"Consumer inflation eases in April, but trade wars likely to raise prices despite reduced tariffs - MarketWatch","Tue, 13 May 2025 12:38:00 GMT"
84,‘I am scared to death that I’ll run out of money’: My wife and I are in our 50s and have $4.4 million. Can we retire early? - MarketWatch,"Tue, 06 May 2025 07:00:00 GMT"
85,‘It feels like I’m drowning’: I’m crippled by credit-card debt. Should I file for Chapter 13 bankruptcy? - MarketWatch,"Mon, 12 May 2025 12:15:00 GMT"
86,Investors may be liking what Powell didn't say - MarketWatch,"Thu, 15 May 2025 10:09:00 GMT"
87,My accountant said I’ll have to pay back Social Security I already received if I retire mid-year. Is that true? - MarketWatch,"Wed, 14 May 2025 16:20:00 GMT"
88,"Interest-rate differentials, flows to Japan show dollar still looks vulnerable - MarketWatch","Thu, 15 May 2025 09:30:00 GMT"
89,Will a Charter-Cox merger prove that bigger is better in a fast-declining cable marketplace? - MarketWatch,"Fri, 16 May 2025 11:23:00 GMT"
90,MarketWatch: Stock Market News - Financial News - MarketWatch,"Fri, 16 Jun 2006 21:17:50 GMT"
91,The biggest winner from potential stablecoin legislation may be the U.S. dollar. Here’s why. - MarketWatch,"Thu, 15 May 2025 19:53:00 GMT"
92,DJIA | Dow Jones Industrial Average Overview - MarketWatch,"Mon, 17 May 2010 13:49:26 GMT"
93,Opinion: Americans need someone to cut drug prices. But Wall Street doesn’t believe Trump has a plan. - MarketWatch,"Tue, 13 May 2025 17:43:00 GMT"
94,"I’m 90, and the RMDs and taxes on my $1.5 million are huge. Is it too late for Roth conversions now? - MarketWatch","Wed, 14 May 2025 16:44:00 GMT"
95,You can see AI everywhere — except in Big Tech’s profits - MarketWatch,"Wed, 14 May 2025 11:50:00 GMT"
96,VRCA Stock Price | Verrica Pharmaceuticals Inc. Stock Quote (U.S.: Nasdaq) - MarketWatch,"Tue, 05 Jun 2018 10:59:01 GMT"
97,Industrial output was flat in April as stress from Trump’s tariffs set in - MarketWatch,"Thu, 15 May 2025 13:19:00 GMT"
98,What Goldman Sachs says investors should do next as S&P 500 turns positive - MarketWatch,"Wed, 14 May 2025 11:30:00 GMT"
99,"Retail sales petered out as tariffs kicked in, but Americans are still spending enough to keep the economy from slumping - MarketWatch","Thu, 15 May 2025 12:53:00 GMT"
