,Title,Date
0,My boyfriend of nearly 10 years is naming his parents as his beneficiaries - MarketWatch,"Thu, 21 Nov 2024 08:00:00 GMT"
1,AUS | Smartshares S&P/ASX 200 ETF Overview - MarketWatch,"Mon, 12 May 2025 11:15:49 GMT"
2,"Hargreaves Lansdown rises Thursday, still underperforms market - MarketWatch","Thu, 14 Nov 2024 08:00:00 GMT"
3,MILIF Stock Price | Military Metals Corp. Stock Quote (U.S.: OTC) - MarketWatch,"Sun, 22 Sep 2024 11:28:01 GMT"
4,Opinion: Why Nvidia investors are missing the forest for the trees - MarketWatch,"Wed, 20 Nov 2024 08:00:00 GMT"
5,FOSRICH Stock Price | FosRich Cos. Ltd. Stock Quote (Jamaica Stock Exchange) - MarketWatch,"Fri, 29 Nov 2019 09:15:54 GMT"
6,ALSEN Stock Price | Sensorion S.A. Stock Quote (France: Euronext Paris) - MarketWatch,"Wed, 18 Oct 2017 04:24:14 GMT"
7,ECB warns that concentration in Mag. 7 poses financial stability risk - MarketWatch,"Wed, 20 Nov 2024 08:00:00 GMT"
8,"Lockheed Martin Corp. stock rises Tuesday, still underperforms market - MarketWatch","Tue, 05 Nov 2024 08:00:00 GMT"
9,Trump may attend SpaceX ‘Starship’ launch scheduled for Tuesday in Texas - MarketWatch,"Mon, 18 Nov 2024 08:00:00 GMT"
10,SNYN | Sanofi S.A. ADR Advanced Charts - MarketWatch,"Wed, 22 Nov 2017 17:19:18 GMT"
11,"After Intel’s messy earnings report, this much is clear - MarketWatch","Fri, 01 Nov 2024 07:00:00 GMT"
12,Jobless claims inch higher in latest week - MarketWatch,"Thu, 07 Nov 2024 08:00:00 GMT"
13,"AMC Networks 3Q Revenue Declines on Fewer Subscribers, Mixed Advertising Demand - MarketWatch","Fri, 08 Nov 2024 08:00:00 GMT"
14,Trump’s ‘DJT’ stock jumps after hours following regular-session slump - MarketWatch,"Tue, 05 Nov 2024 08:00:00 GMT"
15,"GameStop appoints Nat Turner to board, tightens links with Collectors - MarketWatch","Mon, 18 Nov 2024 08:00:00 GMT"
16,"Asian markets mostly decline, shrugging off Wall Street’s rally - MarketWatch","Mon, 11 Nov 2024 08:00:00 GMT"
17,General Mills is buying its fifth pet-food business. Here’s why it could fetch more growth. - MarketWatch,"Thu, 14 Nov 2024 08:00:00 GMT"
18,UniCredit makes $11 billion bid for rival Italian bank - MarketWatch,"Mon, 25 Nov 2024 08:00:00 GMT"
19,Opinion: A simple plan to fix Social Security? Be very suspicious. - MarketWatch,"Tue, 19 Nov 2024 08:00:00 GMT"
20,"Home-price growth has ‘stalled,’ Case-Shiller says - MarketWatch","Tue, 26 Nov 2024 08:00:00 GMT"
21,DGI Stock Price | Digi International Inc. Stock Quote (Germany: Frankfurt ) - MarketWatch,"Sat, 07 Oct 2017 12:40:55 GMT"
22,Nvidia’s stock is up 200% this year. Why analysts say it still screams ‘buy.’ - MarketWatch,"Mon, 11 Nov 2024 08:00:00 GMT"
23,"‘Trump trades’ move into overdrive as Dow, dollar and bond yields soar. What’s next for markets. - MarketWatch","Wed, 06 Nov 2024 08:00:00 GMT"
24,BIORQ Stock Price | Biora Therapeutics Inc. Stock Quote (U.S.: OTC) - MarketWatch,"Tue, 31 Dec 2024 20:05:03 GMT"
25,Carl Icahn’s investment arm’s stock slides after company again halves dividend - MarketWatch,"Fri, 08 Nov 2024 08:00:00 GMT"
26,WGMI | CoinShares Valkyrie Bitcoin Miners ETF Overview - MarketWatch,"Wed, 09 Feb 2022 09:43:06 GMT"
27,"Opinion: No, tariffs did not make American industry great - MarketWatch","Mon, 04 Nov 2024 08:00:00 GMT"
28,Mortgage rates jump after Trump defeats Harris - MarketWatch,"Wed, 06 Nov 2024 08:00:00 GMT"
29,Commerce Department to trim funding for Intel to build chip plants - MarketWatch,"Mon, 25 Nov 2024 08:00:00 GMT"
30,"Education stocks rally, with Trump seen as benefiting for-profit colleges - MarketWatch","Wed, 06 Nov 2024 08:00:00 GMT"
31,Their student loans should have been canceled already. What happens under Trump? - MarketWatch,"Mon, 18 Nov 2024 08:00:00 GMT"
32,Will Trump’s tariffs cause price hikes in electronics? - MarketWatch,"Sat, 16 Nov 2024 08:00:00 GMT"
33,"Why Trump pick of ‘Dr. Oz’ to oversee Medicare, Medicaid could be ‘devastating’ - MarketWatch","Thu, 21 Nov 2024 08:00:00 GMT"
34,‘Tariff Man’ Trump returns next year. How nervous are retailers this time around? - MarketWatch,"Fri, 22 Nov 2024 08:00:00 GMT"
35,A rising U.S. dollar could cause trouble for stock-market bulls - MarketWatch,"Sat, 30 Nov 2024 08:00:00 GMT"
36,PROSY Stock Price | Prosus N.V. ADR Stock Quote (U.S.: OTC) - MarketWatch,"Wed, 11 Sep 2019 20:40:12 GMT"
37,The cheapest SUVs that seat 7 - MarketWatch,"Tue, 12 Nov 2024 08:00:00 GMT"
38,VXRT Stock Price | Vaxart Inc. Stock Quote (U.S.: Nasdaq) - MarketWatch,"Sat, 17 Feb 2018 02:08:48 GMT"
39,"What’s at stake for stocks, bonds, and other markets as investors await election - MarketWatch","Sat, 02 Nov 2024 07:00:00 GMT"
40,McKesson Corp. stock outperforms competitors despite losses on the day - MarketWatch,"Fri, 15 Nov 2024 08:00:00 GMT"
41,"Cannabis stock valuations and investments hobbled by regulatory uncertainties, experts say - MarketWatch","Tue, 12 Nov 2024 08:00:00 GMT"
42,6 ways a second Trump presidency will affect home buyers and sellers - MarketWatch,"Wed, 06 Nov 2024 08:00:00 GMT"
43,Four reasons the bull market for stocks can continue - MarketWatch,"Sat, 02 Nov 2024 07:00:00 GMT"
44,CPACASC1 Stock Price | Cementos Pacasmayo S.A.A. Stock Quote (Peru: Lima) - MarketWatch,"Fri, 13 Oct 2017 05:57:23 GMT"
45,The Fed interrupted the stock market’s Trump rally. What comes next? - MarketWatch,"Sat, 16 Nov 2024 08:00:00 GMT"
46,APA | Smartshares Asia Pacific ETF Overview - MarketWatch,"Tue, 21 May 2019 08:35:54 GMT"
47,DG Innovate Shares Rise on EVage Automotive Joint Venture - MarketWatch,"Wed, 27 Nov 2024 08:00:00 GMT"
48,BMA Stock Price | Banco Macro S.A. ADR Stock Quote (U.S.: NYSE) - MarketWatch,"Sun, 05 Jun 2016 04:54:32 GMT"
49,Advance Auto Parts to exit Western U.S. as it closes more than 700 locations - MarketWatch,"Thu, 14 Nov 2024 08:00:00 GMT"
50,Dogecoin soars as altcoins look to benefit from Trump presidency - MarketWatch,"Mon, 11 Nov 2024 08:00:00 GMT"
51,BBWI Stock Price | Bath & Body Works Inc. Stock Quote (U.S.: NYSE) - MarketWatch,"Tue, 03 Aug 2021 17:42:44 GMT"
52,KLC | KinderCare Learning Cos. Inc. Advanced Charts - MarketWatch,"Thu, 18 Nov 2021 03:10:50 GMT"
53,Here’s what can stall Trump’s tax and tariff plans - MarketWatch,"Wed, 06 Nov 2024 08:00:00 GMT"
54,Broadcom Inc. stock underperforms Wednesday when compared to competitors - MarketWatch,"Wed, 20 Nov 2024 08:00:00 GMT"
55,Opinion: Crypto bulls doubled down on Trump for this 1 big reason - MarketWatch,"Mon, 04 Nov 2024 08:00:00 GMT"
56,"Elon Musk, Vivek Ramaswamy to run Trump’s ‘Department of Government Efficiency’ - MarketWatch","Tue, 12 Nov 2024 08:00:00 GMT"
57,"AMC touts theater investment plan but faces balancing act, Wedbush says - MarketWatch","Thu, 07 Nov 2024 08:00:00 GMT"
58,Exxon CEO says Trump won’t be able to ‘unleash’ new energy production - MarketWatch,"Tue, 12 Nov 2024 08:00:00 GMT"
59,Trump’s oil-drilling plans may pose a big problem for OPEC+ - MarketWatch,"Tue, 26 Nov 2024 08:00:00 GMT"
60,"Eli Lilly & Co. stock rises Tuesday, still underperforms market - MarketWatch","Tue, 19 Nov 2024 08:00:00 GMT"
61,DNMR Stock Price | Danimer Scientific Inc. Stock Quote (Mexico) - MarketWatch,"Wed, 19 Mar 2025 16:57:33 GMT"
62,DDOG Stock Price | Datadog Inc. Cl A Stock Quote (U.S.: Nasdaq) - MarketWatch,"Tue, 17 Sep 2019 18:54:00 GMT"
63,BZH Stock Price | Beazer Homes USA Inc. Stock Quote (U.S.: NYSE) - MarketWatch,"Tue, 10 Nov 2009 12:28:22 GMT"
64,Traders are loading up on protection against extreme moves as stocks zoom higher - MarketWatch,"Wed, 27 Nov 2024 08:00:00 GMT"
65,"Dow crosses 45,000 for first time - MarketWatch","Fri, 29 Nov 2024 08:00:00 GMT"
66,Krispy Kreme’s stock drops on earnings miss - MarketWatch,"Thu, 07 Nov 2024 08:00:00 GMT"
67,Trump could save $1.4 trillion nixing Biden executive orders - MarketWatch,"Wed, 27 Nov 2024 08:00:00 GMT"
68,An indicator pegged to Buffett and this bitcoin evangelist is flashing a warning for stock-market investors - MarketWatch,"Fri, 22 Nov 2024 08:00:00 GMT"
69,Brokerages are raking in millions from your presidential election bets - MarketWatch,"Tue, 05 Nov 2024 08:00:00 GMT"
70,"Fannie Mae, Freddie Mac shares downgraded amid privatization hopes - MarketWatch","Wed, 20 Nov 2024 08:00:00 GMT"
71,LBRT Stock Price | Liberty Energy Inc. Stock Quote (U.S.: NYSE) - MarketWatch,"Fri, 27 Oct 2017 11:25:11 GMT"
72,"With Senate control at stake, these outside groups spend $160 million in Montana - MarketWatch","Mon, 04 Nov 2024 08:00:00 GMT"
73,Trump selects former WWE CEO Linda McMahon to be education secretary - MarketWatch,"Tue, 19 Nov 2024 08:00:00 GMT"
74,History says bitcoin should rally after the election. Here’s how it might not. - MarketWatch,"Tue, 05 Nov 2024 08:00:00 GMT"
75,General Mills Inc. stock outperforms competitors on strong trading day - MarketWatch,"Wed, 13 Nov 2024 08:00:00 GMT"
76,Procter & Gamble Co. stock outperforms competitors on strong trading day - MarketWatch,"Fri, 15 Nov 2024 08:00:00 GMT"
77,COFYX | Columbia Contrarian Core Fund;I3 Overview - MarketWatch,"Wed, 18 Oct 2017 03:12:48 GMT"
78,"This bank is offering $6,000 for opening an account – and 8 others offering $1,000 or more as a sign-up bonus - MarketWatch","Mon, 25 Nov 2024 08:00:00 GMT"
79,Biden makes moves to cancel Ukraine’s debts ahead of Trump’s inauguration - MarketWatch,"Thu, 21 Nov 2024 08:00:00 GMT"
80,NVX Stock Price | Novonix Ltd. Stock Quote (Australia: Sydney) - MarketWatch,"Thu, 19 Oct 2017 01:14:45 GMT"
81,How S&P 500 tends to perform during Thanksgiving week and into New Year’s Eve - MarketWatch,"Wed, 27 Nov 2024 08:00:00 GMT"
82,Phunware’s stock soars on Donald Trump’s election victory - MarketWatch,"Wed, 06 Nov 2024 08:00:00 GMT"
83,"The S&P 500 breaks 6,000 for the first time. U.S. stocks may have more upside. - MarketWatch","Fri, 08 Nov 2024 08:00:00 GMT"
84,ArcelorMittal delays green transition plans blaming lack of EU support - MarketWatch,"Tue, 26 Nov 2024 08:00:00 GMT"
85,Robinhood poised as ‘major beneficiary’ of Trump’s crypto trading changes: analyst - MarketWatch,"Mon, 18 Nov 2024 08:00:00 GMT"
86,Consumer Cos Up on Improving Consumer Sentiment -- Consumer Roundup - MarketWatch,"Fri, 08 Nov 2024 08:00:00 GMT"
87,MICH Stock Price | Misr Chemical Industries Co. Stock Quote (Egyptian Exchange) - MarketWatch,"Wed, 18 Oct 2017 19:21:59 GMT"
88,Why one strategist lifted his recession probability to 75% after Trump's win - MarketWatch,"Fri, 15 Nov 2024 08:00:00 GMT"
89,NORSE.O | Norse Atlantic ASA Profile - MarketWatch,"Wed, 02 Apr 2025 07:58:33 GMT"
90,"On Election Day, Trump-linked Phunware’s stock slides - MarketWatch","Tue, 05 Nov 2024 08:00:00 GMT"
91,ASR | Smartshares Australian Resources ETF Overview - MarketWatch,"Sun, 18 Feb 2018 19:32:33 GMT"
92,Shares of Trump-related Phunware soar on election victory - MarketWatch,"Wed, 06 Nov 2024 08:00:00 GMT"
93,Trump to nominate North Dakota Gov. Doug Burgum as Interior secretary - MarketWatch,"Thu, 14 Nov 2024 08:00:00 GMT"
94,Retail sales climb again ahead of holiday shopping season. U.S. economy still has momentum. - MarketWatch,"Fri, 15 Nov 2024 08:00:00 GMT"
95,DFAS | Dimensional U.S. Small Cap ETF Overview - MarketWatch,"Sun, 13 Jun 2021 08:04:10 GMT"
96,KNRX | Knorex - Pre-IPO - MarketWatch,"Tue, 12 Nov 2024 08:00:00 GMT"
97,Pony AI’s Nasdaq debut signals possible thaw in U.S. stock-market listings by Chinese companies - MarketWatch,"Wed, 27 Nov 2024 08:00:00 GMT"
98,"Dow opens higher as S&P 500 nears 6,000 milestone - MarketWatch","Fri, 08 Nov 2024 08:00:00 GMT"
99,"MicroStrategy to lose ‘controlled company’ exemption, and stock seesaws higher - MarketWatch","Tue, 12 Nov 2024 08:00:00 GMT"
