,Title,Date
0,Lakeland Financial downgraded to market perform from outperform at Raymond James - MarketWatch,"Thu, 17 Dec 2015 08:00:00 GMT"
1,And the award for the worst forecast of 2015 goes to... - MarketWatch,"Wed, 30 Dec 2015 08:00:00 GMT"
2,Make your house a Christmas-light spectacular - MarketWatch,"Mon, 21 Dec 2015 08:00:00 GMT"
3,Chipotle’s food-safety issues might make it the safest place to eat - MarketWatch,"Fri, 18 Dec 2015 08:00:00 GMT"
4,VOLARA Stock Price | Controladora Vuela Compania de Aviacion S.A.B. de C.V. Series A Stock Quote (Mexico) - MarketWatch,"Thu, 19 Oct 2017 03:31:35 GMT"
5,"Like Kim Kardashian, many millennials living with their parents - MarketWatch","Wed, 23 Dec 2015 08:00:00 GMT"
6,China’s capital outflows seen tripling in November - MarketWatch,"Mon, 07 Dec 2015 08:00:00 GMT"
7,The sneaky reason your boss may give you a bonus this year - MarketWatch,"Sat, 19 Dec 2015 08:00:00 GMT"
8,The ‘candlesticks man’ says he’s not buying stocks - MarketWatch,"Wed, 02 Dec 2015 08:00:00 GMT"
9,CETX | Cemtrex Inc. Profile - MarketWatch,"Fri, 09 Oct 2020 00:28:54 GMT"
10,You might call Fiat’s new Spider a ‘Fiata’ - MarketWatch,"Sat, 26 Dec 2015 08:00:00 GMT"
11,Chipotle’s stock drops after another E. coli outbreak - MarketWatch,"Tue, 22 Dec 2015 08:00:00 GMT"
12,10 things the weight-loss industry won’t tell you - MarketWatch,"Thu, 24 Dec 2015 08:00:00 GMT"
13,Ben Bernanke says he never expected interest rates to stay at zero for so long - MarketWatch,"Wed, 16 Dec 2015 08:00:00 GMT"
14,Opinion: Here are numbers Amazon doesn’t want you to see - MarketWatch,"Tue, 01 Dec 2015 08:00:00 GMT"
15,FAA seeks safety fixes to Boeing 767 escape slides - MarketWatch,"Thu, 31 Dec 2015 08:00:00 GMT"
16,Where can you ride your hoverboard? - MarketWatch,"Wed, 30 Dec 2015 08:00:00 GMT"
17,"Avocado prices are falling sharply, not rising - MarketWatch","Tue, 29 Dec 2015 08:00:00 GMT"
18,"Where America’s newest citizens come from, by state - MarketWatch","Thu, 24 Dec 2015 08:00:00 GMT"
19,DreamWorks gets another lease on life as Amblin Partners Studio - MarketWatch,"Thu, 17 Dec 2015 08:00:00 GMT"
20,Dow sets mark for most volatile December since 2008 - MarketWatch,"Fri, 18 Dec 2015 08:00:00 GMT"
21,10 little-known charities that do the most good - MarketWatch,"Mon, 21 Dec 2015 08:00:00 GMT"
22,Carl Icahn boosts his bid for Pep Boys again - MarketWatch,"Mon, 21 Dec 2015 08:00:00 GMT"
23,Pantone’s 2016 colors of the year: Rose Quartz and Serenity - MarketWatch,"Thu, 03 Dec 2015 08:00:00 GMT"
24,"In Japan, Christmas isn’t a holiday — it’s Kentucky Fried Chicken day - MarketWatch","Sat, 19 Dec 2015 08:00:00 GMT"
25,Don’t be a Scrooge toward your elder care provider - MarketWatch,"Fri, 18 Dec 2015 08:00:00 GMT"
26,iPad Pro and its rivals are changing the tablet market - MarketWatch,"Wed, 02 Dec 2015 08:00:00 GMT"
27,"6 myths about Amazon Prime Air and drone delivery, debunked - MarketWatch","Wed, 02 Dec 2015 08:00:00 GMT"
28,13 charts on gun violence in America - MarketWatch,"Wed, 02 Dec 2015 08:00:00 GMT"
29,TGTX | TG Therapeutics Inc. Options - MarketWatch,"Sun, 20 Dec 2015 03:25:43 GMT"
30,America’s two-parent families reach lowest point in 50 years - MarketWatch,"Sat, 19 Dec 2015 08:00:00 GMT"
31,How the Grinch stalled the ‘Santa rally’ - MarketWatch,"Wed, 09 Dec 2015 08:00:00 GMT"
32,Americans love this federal agency most of all - MarketWatch,"Sat, 05 Dec 2015 08:00:00 GMT"
33,Do kids today get too many trophies? - MarketWatch,"Thu, 17 Dec 2015 08:00:00 GMT"
34,PXS Stock Price | Pyxis Tankers Inc. Stock Quote (U.S.: Nasdaq) - MarketWatch,"Mon, 26 Dec 2016 06:48:30 GMT"
35,Amazon’s Jeff Bezos goes hands-on for Washington Post’s digital shift - MarketWatch,"Mon, 21 Dec 2015 08:00:00 GMT"
36,Opinion: What the oldest stock market index is saying now - MarketWatch,"Wed, 16 Dec 2015 08:00:00 GMT"
37,Opinion: Obamacare bailouts prove that the law is flawed and lousy - MarketWatch,"Wed, 02 Dec 2015 08:00:00 GMT"
38,"Apple, HP, GE eagerly await opening of Iran’s markets - MarketWatch","Wed, 23 Dec 2015 08:00:00 GMT"
39,"How time can turn $3,000 into $50 million - MarketWatch","Mon, 28 Dec 2015 08:00:00 GMT"
40,"Watch out, millennials, Goldman says Gen-Z might eat your lunch - MarketWatch","Wed, 02 Dec 2015 08:00:00 GMT"
41,Kim Kardashian’s ‘Kimoji’ app already No. 1 on its first day in the App Store - MarketWatch,"Tue, 22 Dec 2015 08:00:00 GMT"
42,Why the junk bond selloff is getting very scary - MarketWatch,"Fri, 11 Dec 2015 08:00:00 GMT"
43,"How the 1% spend $30,000 on ostentatious Christmas decorations - MarketWatch","Mon, 21 Dec 2015 08:00:00 GMT"
44,Chelsea Clinton is expecting a second child - MarketWatch,"Mon, 21 Dec 2015 08:00:00 GMT"
45,BWEN Stock Price | Broadwind Inc. Stock Quote (U.S.: Nasdaq) - MarketWatch,"Tue, 06 Jul 2010 13:52:50 GMT"
46,A $100 million home in Dallas: Is real estate at its peak? - MarketWatch,"Mon, 07 Dec 2015 08:00:00 GMT"
47,- MarketWatch,"Thu, 03 Dec 2015 08:12:01 GMT"
48,All you need is money: ‘Yellow Submarine’ art on auction - MarketWatch,"Thu, 24 Dec 2015 08:00:00 GMT"
49,AKBA | Akebia Therapeutics Inc. Analyst Estimates - MarketWatch,"Sat, 19 Nov 2016 09:14:26 GMT"
50,"With rates so low, should you pay off your mortgage? - MarketWatch","Wed, 16 Dec 2015 08:00:00 GMT"
51,WING | Wingstop Inc. Advanced Charts - MarketWatch,"Wed, 11 Jan 2017 05:23:25 GMT"
52,Mark Zuckerberg defends his bid to get India online - MarketWatch,"Mon, 28 Dec 2015 08:00:00 GMT"
53,"Zuckerberg owns Giving Tuesday, pledges Facebook stake to charity - MarketWatch","Tue, 01 Dec 2015 08:00:00 GMT"
54,San Bernardino shooting: Picture of suspects starts to emerge - MarketWatch,"Thu, 03 Dec 2015 08:00:00 GMT"
55,10 stories that broke the Internet in 2015 - MarketWatch,"Thu, 17 Dec 2015 08:00:00 GMT"
56,Elon Musk over the moon as SpaceX makes history with rocket landing - MarketWatch,"Tue, 22 Dec 2015 08:00:00 GMT"
57,"Dollar retreats against euro, yen - MarketWatch","Thu, 24 Dec 2015 08:00:00 GMT"
58,PNAGF Stock Price | Petronas Gas Bhd Stock Quote (U.S.: OTC) - MarketWatch,"Thu, 19 Oct 2017 12:19:44 GMT"
59,Opinion: Chipotle’s disastrous 2015: What investors need to know - MarketWatch,"Tue, 29 Dec 2015 08:00:00 GMT"
60,Philadelphia Fed manufacturing index returns to negative level for December - MarketWatch,"Thu, 17 Dec 2015 08:00:00 GMT"
61,Drone powerhouse DJI looks to dominate thermal imaging market - MarketWatch,"Thu, 10 Dec 2015 08:00:00 GMT"
62,"In 5 years, a robot may be your boss - MarketWatch","Wed, 16 Dec 2015 08:00:00 GMT"
63,"This ‘smart money’ indicator nailed the dot-com bust, and it’s even more bearish now - MarketWatch","Tue, 22 Dec 2015 08:00:00 GMT"
64,Headlines for Southern Co. (NYS:SO) - BigCharts,"Fri, 14 Feb 2020 16:24:18 GMT"
65,6 things to know about Atlassian as it goes public - MarketWatch,"Thu, 10 Dec 2015 08:00:00 GMT"
66,Tim Cook says this is the real reason Apple products are made in China - MarketWatch,"Mon, 21 Dec 2015 08:00:00 GMT"
67,Imax is adding 50% more cinemas in Japan - MarketWatch,"Wed, 02 Dec 2015 08:00:00 GMT"
68,10 wealthiest couples on the planet - MarketWatch,"Tue, 22 Dec 2015 08:00:00 GMT"
69,Hack at Juniper Networks raises more questions about software ‘backdoors’ - MarketWatch,"Tue, 29 Dec 2015 08:00:00 GMT"
70,"Peter Lynch, 25 years later: it’s not just ‘invest in what you know’ - MarketWatch","Mon, 28 Dec 2015 08:00:00 GMT"
71,Hillary Clinton says Donald Trump isn’t funny anymore - MarketWatch,"Fri, 11 Dec 2015 08:00:00 GMT"
72,2016 predictions: What presidential election years mean for stocks - MarketWatch,"Tue, 29 Dec 2015 08:00:00 GMT"
73,Why some American couples stay married - MarketWatch,"Thu, 10 Dec 2015 08:00:00 GMT"
74,Atlanta’s Atlantic Station rides walkability to home-price gains - MarketWatch,"Fri, 11 Dec 2015 08:00:00 GMT"
75,Wal-Mart gives customers almost zero reason to use Walmart Pay - MarketWatch,"Fri, 11 Dec 2015 08:00:00 GMT"
76,What you get when a piano maker designs a car - MarketWatch,"Fri, 18 Dec 2015 08:00:00 GMT"
77,Taiwan central bank cuts interest rates again - MarketWatch,"Thu, 17 Dec 2015 08:00:00 GMT"
78,Cadillac’s CT6 takes on the Germans with a new lineup - MarketWatch,"Thu, 17 Dec 2015 08:00:00 GMT"
79,This crystal-encrusted Starbucks gift card buys you $50 in coffee but costs $200 - MarketWatch,"Tue, 22 Dec 2015 08:00:00 GMT"
80,Opinion: Tim Cook oversimplifies U.S. ‘skill’ problem - MarketWatch,"Wed, 23 Dec 2015 08:00:00 GMT"
81,This bearish technical pattern points to even more pain for crude oil - MarketWatch,"Tue, 08 Dec 2015 08:00:00 GMT"
82,Market’s change in character means time for cash is now - MarketWatch,"Fri, 18 Dec 2015 08:00:00 GMT"
83,Why you might need to buy a Christmas tree early this year - MarketWatch,"Sat, 05 Dec 2015 08:00:00 GMT"
84,Netflix has put Redbox on Blockbuster’s road to destruction - MarketWatch,"Tue, 08 Dec 2015 08:00:00 GMT"
85,"Heil, Trump? Philly newspaper compares leading GOP candidate to Hitler - MarketWatch","Tue, 08 Dec 2015 08:00:00 GMT"
86,Go inside the new McDonald’s that offers asparagus topping on its burgers - MarketWatch,"Thu, 31 Dec 2015 08:00:00 GMT"
87,AMZN | Amazon.com Inc. CDR Overview - MarketWatch,"Sun, 09 Mar 2025 05:46:57 GMT"
88,Icahn makes higher bid for Pep Boys - MarketWatch,"Mon, 07 Dec 2015 08:00:00 GMT"
89,"How long can Portland, Ore., homes remain relatively affordable? - MarketWatch","Wed, 09 Dec 2015 08:00:00 GMT"
90,PE Stock Price | Pure Energy Minerals Ltd. Stock Quote (Canada: TSX Venture) - MarketWatch,"Wed, 18 Oct 2017 00:07:42 GMT"
91,Lotus Exige Sport 350 is an adrenaline rush - MarketWatch,"Thu, 31 Dec 2015 08:00:00 GMT"
92,Express Scripts hits Martin Shkreli where it hurts - MarketWatch,"Tue, 01 Dec 2015 08:00:00 GMT"
93,The Paleo diet has it wrong: Cavemen did eat carbs? - MarketWatch,"Wed, 23 Dec 2015 08:00:00 GMT"
94,"Couple drops $500,000 check in Salvation Army red kettle - MarketWatch","Tue, 01 Dec 2015 08:00:00 GMT"
95,Federal Reserve embarks on historic new era of higher interest rates - MarketWatch,"Wed, 16 Dec 2015 08:00:00 GMT"
96,Pep Boys spurns Icahn for Bridgestone merger bid - MarketWatch,"Thu, 24 Dec 2015 08:00:00 GMT"
97,Opinion: I registered my drone. Here’s why you should too - MarketWatch,"Tue, 22 Dec 2015 08:00:00 GMT"
98,"George Soros blasts Donald Trump, Ted Cruz as fearmongers - MarketWatch","Mon, 28 Dec 2015 08:00:00 GMT"
99,7 key candlestick reversal patterns - MarketWatch,"Wed, 02 Dec 2015 08:00:00 GMT"
