,Title,Date
0,RMR Group downgraded to perform from outperform at Oppenheimer - MarketWatch,"Tue, 24 Mar 2020 07:00:00 GMT"
1,AHT.PRD Stock Price | Ashford Hospitality Trust Inc. 8.45% Cum. Pfd. Series D Stock Quote (U.S.: NYSE) - MarketWatch,"Sun, 19 May 2019 02:29:03 GMT"
2,2889 Stock Price | IBF Financial Holdings Co. Ltd. Stock Quote (Taiwan) - MarketWatch,"Sat, 21 Oct 2017 12:01:15 GMT"
3,SBFG Stock Price | SB Financial Group Inc. Stock Quote (U.S.: Nasdaq) - MarketWatch,"Fri, 06 Oct 2017 04:17:33 GMT"
4,Man who predicted the 2008 financial crisis says coronavirus may mean his bets of stock-market carnage are finally beginning to crystallize - MarketWatch,"Fri, 13 Mar 2020 07:00:00 GMT"
5,"New York City coronavirus cases reach nearly 30,000 with a death every 9.5 minutes - MarketWatch","Sat, 28 Mar 2020 07:00:00 GMT"
6,Financial News names Shruti Tripathi Chopra as editor - MarketWatch,"Wed, 11 Mar 2020 07:00:00 GMT"
7,CLB Stock Price | Core Laboratories Inc. Stock Quote (U.S.: NYSE) - MarketWatch,"Fri, 14 Jan 2011 19:25:09 GMT"
8,The 2020 Honda Clarity: A refined and civilized PHEV - MarketWatch,"Fri, 20 Mar 2020 07:00:00 GMT"
9,"Dr. Anthony Fauci, U.S.’s top infectious-disease expert, is in favor of a national lockdown - MarketWatch","Sun, 15 Mar 2020 07:00:00 GMT"
10,Sharjah Cement & Industrial Development Co. P.S.C. - MarketWatch,"Sat, 06 Jan 2018 05:24:52 GMT"
11,VRN | Veren Inc. Profile - MarketWatch,"Wed, 15 May 2024 23:39:52 GMT"
12,FNILX | Fidelity ZERO Large Cap Index Fund Advanced Charts - MarketWatch,"Tue, 31 Mar 2020 05:35:20 GMT"
13,ECVT Stock Price | Ecovyst Inc. Stock Quote (U.S.: NYSE) - MarketWatch,"Tue, 03 Aug 2021 14:47:59 GMT"
14,JOE | St. Joe Co. Profile - MarketWatch,"Fri, 09 Oct 2020 07:45:16 GMT"
15,YORW Stock Price | York Water Co. Stock Quote (U.S.: Nasdaq) - MarketWatch,"Sun, 01 Oct 2017 23:29:48 GMT"
16,"Stop panic-buying toilet paper: How to stock up smart, emergency or not - MarketWatch","Sat, 14 Mar 2020 07:00:00 GMT"
17,CNBC’s Jim Cramer: I’m more nervous now than before the Fed’s rate cut - MarketWatch,"Tue, 03 Mar 2020 08:00:00 GMT"
18,"Coronavirus update: 615,519 cases, 28,717 deaths; U.S. now has the most cases worldwide with more than 104,000 - MarketWatch","Sat, 28 Mar 2020 07:00:00 GMT"
19,"Fox Nation hosts Diamond, Silk: Media is exaggerating the coronavirus pandemic to make Trump look bad - MarketWatch","Tue, 31 Mar 2020 07:00:00 GMT"
20,New York shuts down; Cuomo warns socializing ‘has to stop and it has to stop now’ - MarketWatch,"Sun, 22 Mar 2020 07:00:00 GMT"
21,OKO Stock Price | Plumas Bancorp Stock Quote (Germany: Frankfurt ) - MarketWatch,"Wed, 28 Oct 2020 08:54:31 GMT"
22,5 life and financial lessons from Judge Judy - MarketWatch,"Tue, 03 Mar 2020 08:00:00 GMT"
23,Coronavirus forces Las Vegas Strip to shut down for first time since JFK assassination - MarketWatch,"Wed, 18 Mar 2020 07:00:00 GMT"
24,ZAIN Stock Price | Mobile Telecommunications Co. (MTC) K.S.C. Stock Quote (Kuwait Stock Exchange) - MarketWatch,"Wed, 18 Oct 2017 10:44:19 GMT"
25,"Coachella festival postponed due to coronavirus, a day after Pearl Jam puts off tour - MarketWatch","Wed, 11 Mar 2020 07:00:00 GMT"
26,IQM | Franklin Intelligent Machines ETF Advanced Charts - MarketWatch,"Thu, 05 Mar 2020 16:05:44 GMT"
27,360 Stock Price | New Focus Auto Tech Holdings Ltd. Stock Quote (Hong Kong) - MarketWatch,"Mon, 20 May 2019 13:37:20 GMT"
28,OVID Stock Price | Ovid Therapeutics Inc. Stock Quote (U.S.: Nasdaq) - MarketWatch,"Tue, 17 Oct 2017 23:25:15 GMT"
29,"Hand sanitizer, wipes, masks that Tennessee brothers tried to profiteer from gets donated - MarketWatch","Sun, 15 Mar 2020 07:00:00 GMT"
30,"Stocks plunge, coronavirus spreads and President Trump tweets image of himself playing a fiddle - MarketWatch","Mon, 09 Mar 2020 07:00:00 GMT"
31,ADIL Stock Price | Adial Pharmaceuticals Inc. Stock Quote (U.S.: Nasdaq) - MarketWatch,"Thu, 19 Oct 2017 04:59:05 GMT"
32,The bull market turns 11 on Monday — can it outrun the coronavirus stock selloff? - MarketWatch,"Sun, 08 Mar 2020 08:00:00 GMT"
33,ALPRO Stock Price | Prodware S.A. Stock Quote (France: Euronext Paris) - MarketWatch,"Tue, 17 Oct 2017 22:46:24 GMT"
34,The S&P 500 just lost a stunning 7.6%—here’s how the stock market tends to perform historically after a ‘Black Monday’ - MarketWatch,"Tue, 10 Mar 2020 07:00:00 GMT"
35,A first look at the futuristic Polestar Precept concept - MarketWatch,"Wed, 04 Mar 2020 08:00:00 GMT"
36,Lagarde in damage-control mode after saying ECB ‘not here to close spreads’ amid Italy bond selloff - MarketWatch,"Thu, 12 Mar 2020 07:00:00 GMT"
37,"Tennessee man sitting on almost 18,000 bottles of hand sanitizer says he’s doing ‘a public service’ - MarketWatch","Mon, 16 Mar 2020 07:00:00 GMT"
38,"Letter from locked-down Italy: the Cuban, Russian and Chinese efforts to assist Lombardy - MarketWatch","Wed, 25 Mar 2020 07:00:00 GMT"
39,ALTBG Stock Price | Blockchain Group S.A. Stock Quote (France: Euronext Paris) - MarketWatch,"Wed, 01 Aug 2018 21:04:06 GMT"
40,"Coronavirus update: 407,405 cases, 18,227 deaths, Italy shows glimmer of hope and NYC remains U.S. epicenter - MarketWatch","Tue, 24 Mar 2020 07:00:00 GMT"
41,"How the coronavirus stock-market rout dealt Chewy’s founder a $150 million blow to his Apple holdings, for now - MarketWatch","Mon, 23 Mar 2020 07:00:00 GMT"
42,PEG | Public Service Enterprise Group Inc. Profile - MarketWatch,"Sat, 10 Oct 2020 08:10:32 GMT"
43,Opinion: Trump is scrambling to make sure the coronavirus isn’t his Katrina - MarketWatch,"Tue, 03 Mar 2020 08:00:00 GMT"
44,Tom Hanks’s son gives an update on his dad’s coronavirus infection - MarketWatch,"Thu, 12 Mar 2020 07:00:00 GMT"
45,European Union lashes out at Trump’s ‘unilateral’ travel ban on Europe - MarketWatch,"Thu, 12 Mar 2020 07:00:00 GMT"
46,Trump believes coronavirus will vanish with April temps — experts are skeptical warm weather alone is enough - MarketWatch,"Mon, 16 Mar 2020 07:00:00 GMT"
47,TAREX | Third Avenue Real Estate Value Fund;Institutional Overview - MarketWatch,"Wed, 18 Oct 2017 00:23:37 GMT"
48,"President Trump is ‘kind of right’ about firing the U.S. economy back up before it’s too late, this real-estate mogul says - MarketWatch","Tue, 24 Mar 2020 07:00:00 GMT"
49,How to buy a Tesla Cybertruck for just $400 - MarketWatch,"Mon, 02 Mar 2020 08:00:00 GMT"
50,"‘This is how Planet of the Apes starts’ — As coronavirus slams Thailand tourism, monkeys brawl in the streets - MarketWatch","Thu, 12 Mar 2020 07:00:00 GMT"
51,Fox News analyst Brit Hume mocked over ‘Sexy Vixen Vinyl’ misfire - MarketWatch,"Tue, 03 Mar 2020 08:00:00 GMT"
52,"Behold, the ‘WTF chart of the year’ - MarketWatch","Thu, 19 Mar 2020 07:00:00 GMT"
53,Opinion: You should avoid shares of these banks with too much oil and gas exposure - MarketWatch,"Wed, 11 Mar 2020 07:00:00 GMT"
54,PRK Stock Price | Park National Corp. Stock Quote (U.S.: NYSE American) - MarketWatch,"Wed, 18 Oct 2017 04:58:20 GMT"
55,FIVN | Five9 Inc. Profile - MarketWatch,"Fri, 09 Oct 2020 01:45:09 GMT"
56,Getting crushed in this market? One look at Warren Buffett’s portfolio and you might feel a lot better about yours - MarketWatch,"Sat, 28 Mar 2020 07:00:00 GMT"
57,Airlines urgently need up to $200 billion to survive as coronavirus pushes industry deeper into crisis - MarketWatch,"Wed, 18 Mar 2020 07:00:00 GMT"
58,Opinion: The odds of a 2008-like stock-market meltdown are low - MarketWatch,"Fri, 06 Mar 2020 08:00:00 GMT"
59,Wall Street billionaire Bill Ackman says ‘hell is coming’ and urges President Trump to ‘send everyone home now’ - MarketWatch,"Wed, 18 Mar 2020 07:00:00 GMT"
60,$2 trillion coronavirus stimulus bill includes tax break for buying tampons - MarketWatch,"Sat, 28 Mar 2020 07:00:00 GMT"
61,Opinion: Coronavirus isn’t stopping the rich from getting even richer on Wall Street - MarketWatch,"Thu, 26 Mar 2020 07:00:00 GMT"
62,VRAYQ Stock Price | ViewRay Inc. Stock Quote (U.S.: OTC) - MarketWatch,"Wed, 26 Jul 2023 21:40:14 GMT"
63,KANSAINER | Kansai Nerolac Paints Ltd. Advanced Charts - MarketWatch,"Mon, 30 Mar 2020 22:48:44 GMT"
64,"Charting a technical breakdown, S&P 500 violates major support - MarketWatch","Tue, 10 Mar 2020 07:00:00 GMT"
65,"Grocery delivery sales up 60%, FreshDirect CEO says, calling his employees ‘first responders’ - MarketWatch","Sat, 28 Mar 2020 07:00:00 GMT"
66,This is how much American workers saved during the first year after Trump tax overhaul - MarketWatch,"Wed, 04 Mar 2020 08:00:00 GMT"
67,Opinion: These energy companies have the highest debt and the most at risk as the oil market collapses - MarketWatch,"Thu, 12 Mar 2020 07:00:00 GMT"
68,"Exclusive: Fed is ‘throwing money in the wrong place,’ says Sheila Bair, former top banking regulator - MarketWatch","Mon, 16 Mar 2020 07:00:00 GMT"
69,"Italy in total lockdown over coronavirus — here’s how it got to that point, and how its mistakes could be repeated elsewhere - MarketWatch","Mon, 09 Mar 2020 07:00:00 GMT"
70,SKFOF Stock Price | Sika AG Stock Quote (U.S.: OTC) - MarketWatch,"Tue, 03 Oct 2017 10:20:30 GMT"
71,Why you shouldn’t use Tito’s Vodka to make hand sanitizer — or attempt to make your own hand sanitizer period - MarketWatch,"Tue, 10 Mar 2020 07:00:00 GMT"
72,CNBC’s Rick Santelli suggests giving everyone coronavirus to spare the economy - MarketWatch,"Fri, 06 Mar 2020 08:00:00 GMT"
73,"Amtrak cancels nonstop Acela train service between NYC, Washington due to coronavirus - MarketWatch","Mon, 09 Mar 2020 07:00:00 GMT"
74,PD Stock Price | Precision Drilling Corp. Stock Quote (Canada: Toronto) - MarketWatch,"Fri, 13 Oct 2017 06:33:20 GMT"
75,HURA Holdings - MarketWatch,"Fri, 27 Mar 2020 15:26:43 GMT"
76,"Audacious Chinese coffee chain Luckin, not content with its quixotic battle against Starbucks, dreams of becoming Amazon, too - MarketWatch","Tue, 31 Mar 2020 07:00:00 GMT"
77,"New York overwhelmed by coronavirus as U.S. death toll tops 1,000 - MarketWatch","Wed, 25 Mar 2020 07:00:00 GMT"
78,GVSI Stock Price | Good Vibrations Shoes Inc. Stock Quote (U.S.: OTC) - MarketWatch,"Tue, 10 Oct 2017 10:21:47 GMT"
79,When to buy during an ugly stock market rout? These charts have the answers. - MarketWatch,"Thu, 19 Mar 2020 07:00:00 GMT"
80,Opinion: Warren Buffett’s latest advice could help you retire much richer - MarketWatch,"Mon, 23 Mar 2020 07:00:00 GMT"
81,U.S. health officials say Americans shouldn’t wear face masks to prevent coronavirus — here are 3 other reasons not to wear them - MarketWatch,"Mon, 02 Mar 2020 08:00:00 GMT"
82,Kroger reports earnings that beat estimates - MarketWatch,"Thu, 05 Mar 2020 08:00:00 GMT"
83,Pelosi says deal reached with White House on emergency aid package for coronavirus - MarketWatch,"Fri, 13 Mar 2020 07:00:00 GMT"
84,7408 Stock Price | Jamco Corp. Stock Quote (Japan: Tokyo) - MarketWatch,"Thu, 19 Oct 2017 20:44:13 GMT"
85,ICIL | Indo Count Industries Ltd. Advanced Charts - MarketWatch,"Sun, 15 Mar 2020 05:08:35 GMT"
86,CHAMPION Stock Price | Champion Breweries PLC Stock Quote (Nigerian Stock Exchange) - MarketWatch,"Sat, 18 May 2019 03:03:00 GMT"
87,Parsons upgraded to buy from hold at Stifel Nicolaus - MarketWatch,"Wed, 11 Mar 2020 07:00:00 GMT"
88,HSI | Hang Seng Index Overview - MarketWatch,"Sat, 21 Mar 2020 01:21:43 GMT"
89,Taleb says Musk’s comment on coronavirus panic being ‘dumb’ is what’s dumb - MarketWatch,"Sun, 08 Mar 2020 08:00:00 GMT"
90,BYRN | Byrna Technologies Inc. Profile - MarketWatch,"Fri, 09 Oct 2020 21:41:16 GMT"
91,VLGEA Stock Price | Village Super Market Inc. Cl A Stock Quote (U.S.: Nasdaq) - MarketWatch,"Wed, 14 Sep 2011 07:58:07 GMT"
92,"Market action a century ago suggests worst could be over for stocks, if not for the coronavirus pandemic - MarketWatch","Thu, 19 Mar 2020 07:00:00 GMT"
93,"Bare shelves at retailers amid crush of demand for sanitizer, cleaning supplies, dry goods - MarketWatch","Sun, 01 Mar 2020 08:00:00 GMT"
94,Want to know the best diet for your body?DNA tests may soon tell you — down to the variety of lettuce you should be eating - MarketWatch,"Mon, 02 Mar 2020 08:00:00 GMT"
95,Second dog tests positive for coronavirus as owners warned not to abandon pets - MarketWatch,"Sat, 21 Mar 2020 07:00:00 GMT"
96,Here’s the EPA’s list of over 300 coronavirus-fighting cleaning products - MarketWatch,"Sat, 14 Mar 2020 07:00:00 GMT"
97,"The stock market may bottom long before the coronavirus epidemic peaks, analysts say - MarketWatch","Sat, 21 Mar 2020 07:00:00 GMT"
98,Should I cancel my flight? Does recirculated air on a plane spread coronavirus? Here’s what you need to know before traveling - MarketWatch,"Sat, 14 Mar 2020 07:00:00 GMT"
99,A rare win for Gen X? Boomers gave us latchkey childhoods that prepped us for coronavirus quarantine - MarketWatch,"Sun, 22 Mar 2020 07:00:00 GMT"
