,Title,Date
0,PulteGroup Inc. stock outperforms competitors despite losses on the day - MarketWatch,"Thu, 27 Jun 2024 07:00:00 GMT"
1,Akamai Technologies Inc. stock underperforms Wednesday when compared to competitors - MarketWatch,"Wed, 12 Jun 2024 07:00:00 GMT"
2,Cardinal Health Inc. stock underperforms Tuesday when compared to competitors - MarketWatch,"Tue, 25 Jun 2024 07:00:00 GMT"
3,Lockheed Martin Corp. stock underperforms Tuesday when compared to competitors - MarketWatch,"Tue, 11 Jun 2024 07:00:00 GMT"
4,Novavax Inc. stock underperforms Friday when compared to competitors - MarketWatch,"Fri, 07 Jun 2024 07:00:00 GMT"
5,Applied Materials Inc. stock outperforms competitors on strong trading day - MarketWatch,"Thu, 27 Jun 2024 07:00:00 GMT"
6,Nordstrom Inc. stock underperforms Tuesday when compared to competitors - MarketWatch,"Tue, 25 Jun 2024 07:00:00 GMT"
7,"Diageo rises Wednesday, outperforms market - MarketWatch","Wed, 19 Jun 2024 07:00:00 GMT"
8,Microsoft Corp. stock outperforms competitors despite losses on the day - MarketWatch,"Thu, 20 Jun 2024 07:00:00 GMT"
9,"Loblaw Cos. Ltd. stock rises Monday, outperforms market - MarketWatch","Mon, 03 Jun 2024 07:00:00 GMT"
10,Prologis Inc. stock underperforms Monday when compared to competitors - MarketWatch,"Mon, 03 Jun 2024 07:00:00 GMT"
11,Amazon.com Inc. stock outperforms competitors on strong trading day - MarketWatch,"Thu, 20 Jun 2024 07:00:00 GMT"
12,"Agilent Technologies Inc. stock falls Thursday, underperforms market - MarketWatch","Thu, 27 Jun 2024 07:00:00 GMT"
13,Revvity Inc. stock underperforms Wednesday when compared to competitors despite daily gains - MarketWatch,"Wed, 05 Jun 2024 07:00:00 GMT"
14,"Boston Scientific Corp. stock rises Tuesday, still underperforms market - MarketWatch","Tue, 18 Jun 2024 07:00:00 GMT"
15,Standard Chartered outperforms market despite losses on the day - MarketWatch,"Mon, 03 Jun 2024 07:00:00 GMT"
16,REUSDUSD | BNP Paribas Easy SICAV ECPI Circular Economy Leaders Overview - MarketWatch,"Tue, 22 Apr 2025 08:45:50 GMT"
17,"Associated British Foods rises Wednesday, outperforms market - MarketWatch","Wed, 05 Jun 2024 07:00:00 GMT"
18,ADBIUSD | ETP on the Adaptivv Downside Control Bitcoin ETF Index Overview - MarketWatch,"Tue, 22 Apr 2025 09:47:24 GMT"
19,Hillenbrand Inc. stock outperforms competitors despite losses on the day - MarketWatch,"Fri, 28 Jun 2024 07:00:00 GMT"
20,"Vulcan Materials Co. stock rises Friday, outperforms market - MarketWatch","Fri, 28 Jun 2024 07:00:00 GMT"
21,Packaging Corp. of America stock underperforms Friday when compared to competitors - MarketWatch,"Fri, 28 Jun 2024 07:00:00 GMT"
22,Allstate Corp. stock outperforms competitors despite losses on the day - MarketWatch,"Fri, 28 Jun 2024 07:00:00 GMT"
23,"H&R Block Inc. stock rises Wednesday, still underperforms market - MarketWatch","Wed, 05 Jun 2024 07:00:00 GMT"
24,Salesforce Inc. stock outperforms competitors on strong trading day - MarketWatch,"Thu, 27 Jun 2024 07:00:00 GMT"
25,Comerica Inc. stock outperforms competitors on strong trading day - MarketWatch,"Thu, 20 Jun 2024 07:00:00 GMT"
26,APA Corp. stock outperforms competitors despite losses on the day - MarketWatch,"Mon, 03 Jun 2024 07:00:00 GMT"
27,Parker Hannifin Corp. stock underperforms Tuesday when compared to competitors - MarketWatch,"Tue, 04 Jun 2024 07:00:00 GMT"
28,"Informa rises Wednesday, outperforms market - MarketWatch","Wed, 05 Jun 2024 07:00:00 GMT"
29,Autodesk Inc. stock underperforms Friday when compared to competitors - MarketWatch,"Fri, 21 Jun 2024 07:00:00 GMT"
30,"Hikma Pharmaceuticals rises Monday, outperforms market - MarketWatch","Mon, 03 Jun 2024 07:00:00 GMT"
31,Salesforce Inc. stock outperforms competitors on strong trading day - MarketWatch,"Fri, 28 Jun 2024 07:00:00 GMT"
32,QXO | QXO Inc. Analyst Estimates - MarketWatch,"Tue, 18 Jun 2024 19:48:52 GMT"
33,Aurora Cannabis stock rises premarket on narrower loss from the year-ago period - MarketWatch,"Thu, 20 Jun 2024 07:00:00 GMT"
34,Israel rescues 4 hostages kidnapped in a Hamas-led attack on Oct. 7 - MarketWatch,"Sat, 08 Jun 2024 07:00:00 GMT"
35,Broadcom Inc. stock outperforms competitors on strong trading day - MarketWatch,"Fri, 28 Jun 2024 07:00:00 GMT"
36,"Ulta Beauty Inc. stock rises Wednesday, still underperforms market - MarketWatch","Wed, 12 Jun 2024 07:00:00 GMT"
37,Dividend stocks can help lower your risk. Many are bargains right now. - MarketWatch,"Wed, 12 Jun 2024 07:00:00 GMT"
38,"KLA Corp. stock rises Tuesday, outperforms market - MarketWatch","Tue, 18 Jun 2024 07:00:00 GMT"
39,Snap-On Inc. stock underperforms Monday when compared to competitors - MarketWatch,"Mon, 10 Jun 2024 07:00:00 GMT"
40,"LyondellBasell Industries N.V. Cl A stock falls Tuesday, underperforms market - MarketWatch","Tue, 25 Jun 2024 07:00:00 GMT"
41,Diamondback Energy Inc. stock outperforms competitors despite losses on the day - MarketWatch,"Wed, 26 Jun 2024 07:00:00 GMT"
42,"Popular tech ETF forced to dump Apple stock, buy Nvidia in upcoming rebalancing - MarketWatch","Mon, 17 Jun 2024 07:00:00 GMT"
43,"HCA Healthcare Inc. stock rises Thursday, still underperforms market - MarketWatch","Thu, 13 Jun 2024 07:00:00 GMT"
44,"Ocugen Inc. stock falls Thursday, underperforms market - MarketWatch","Thu, 13 Jun 2024 07:00:00 GMT"
45,Republican or Democrat doesn’t matter. Presidential elections boost stocks. - MarketWatch,"Mon, 10 Jun 2024 07:00:00 GMT"
46,New Morgan Stanley CEO Ted Pick sees growth despite ‘unusual’ economy - MarketWatch,"Tue, 11 Jun 2024 07:00:00 GMT"
47,GameStop’s stock suffers worst day since 2021 despite Roaring Kitty livestream - MarketWatch,"Fri, 07 Jun 2024 07:00:00 GMT"
48,Eastman Chemical Co. stock underperforms Thursday when compared to competitors - MarketWatch,"Thu, 27 Jun 2024 07:00:00 GMT"
49,MarketWatch - MarketWatch,"Sun, 16 Jun 2024 04:06:06 GMT"
50,"GameStop says it raised $2.14 billion in share sale, as Roaring Kitty continues to meme - MarketWatch","Wed, 12 Jun 2024 07:00:00 GMT"
51,"Summer is here — but pool demand less so, Pool Corp. says - MarketWatch","Mon, 24 Jun 2024 07:00:00 GMT"
52,Marathon Petroleum Corp. stock underperforms Thursday when compared to competitors - MarketWatch,"Thu, 27 Jun 2024 07:00:00 GMT"
53,"Auto Trader Group rises Tuesday, still underperforms market - MarketWatch","Tue, 18 Jun 2024 07:00:00 GMT"
54,"Restaurant Brands International Inc. stock rises Tuesday, outperforms market - MarketWatch","Tue, 11 Jun 2024 07:00:00 GMT"
55,Morgan Stanley stock underperforms Thursday when compared to competitors - MarketWatch,"Thu, 20 Jun 2024 07:00:00 GMT"
56,"British American Tobacco falls Friday, still outperforms market - MarketWatch","Fri, 28 Jun 2024 07:00:00 GMT"
57,"DraftKings Inc. Cl A stock falls Thursday, still outperforms market - MarketWatch","Thu, 20 Jun 2024 07:00:00 GMT"
58,"CCL Industries Inc. Cl B stock rises Monday, outperforms market - MarketWatch","Mon, 24 Jun 2024 07:00:00 GMT"
59,"Canadian Imperial Bank of Commerce stock rises Wednesday, outperforms market - MarketWatch","Wed, 12 Jun 2024 07:00:00 GMT"
60,I’ll have a monthly income of $12K in retirement. Do I pay off my 2.5% mortgage? - MarketWatch,"Thu, 13 Jun 2024 07:00:00 GMT"
61,General Mills’ stock falls after revenue miss and soft guidance - MarketWatch,"Wed, 26 Jun 2024 07:00:00 GMT"
62,These are the 10 cars that get the most speeding tickets - MarketWatch,"Mon, 10 Jun 2024 07:00:00 GMT"
63,HF Sinclair Corp. stock underperforms Wednesday when compared to competitors - MarketWatch,"Wed, 26 Jun 2024 07:00:00 GMT"
64,Is the stock market closed on Juneteenth? Will the post office be open? - MarketWatch,"Wed, 19 Jun 2024 07:00:00 GMT"
65,EXENS Stock Price | Exosens S.A. Stock Quote (France: Euronext Paris) - MarketWatch,"Fri, 07 Jun 2024 10:52:16 GMT"
66,"Constellation Brands Inc. Cl A stock rises Friday, outperforms market - MarketWatch","Fri, 07 Jun 2024 07:00:00 GMT"
67,"Phillips 66 stock falls Thursday, underperforms market - MarketWatch","Thu, 27 Jun 2024 07:00:00 GMT"
68,Rivian’s stock pulls back as company keeps yearly production target steady - MarketWatch,"Thu, 27 Jun 2024 07:00:00 GMT"
69,"Loblaw Cos. Ltd. stock rises Thursday, still underperforms market - MarketWatch","Thu, 06 Jun 2024 07:00:00 GMT"
70,"Tom Lee sees the S&P 500 reaching 15,000 by decade's end - MarketWatch","Mon, 24 Jun 2024 07:00:00 GMT"
71,AIPI Holdings - MarketWatch,"Sun, 09 Jun 2024 15:09:02 GMT"
72,EIB7EUR | Invesco Euro Government Bond 5-7 Years ETF Advanced Charts - MarketWatch,"Sun, 16 Mar 2025 20:51:05 GMT"
73,Procter & Gamble Co. stock underperforms Friday when compared to competitors - MarketWatch,"Fri, 07 Jun 2024 07:00:00 GMT"
74,ONIT | Onity Group Inc. Annual Income Statement - MarketWatch,"Thu, 13 Jun 2024 15:07:42 GMT"
75,"Aptiv PLC stock rises Thursday, outperforms market - MarketWatch","Thu, 27 Jun 2024 07:00:00 GMT"
76,"Shares of bitcoin miners CleanSpark, Riot rally after Trump meets executives - MarketWatch","Wed, 12 Jun 2024 07:00:00 GMT"
77,IPG Photonics Corp. stock outperforms competitors on strong trading day - MarketWatch,"Fri, 28 Jun 2024 07:00:00 GMT"
78,Jacobs Solutions Inc. stock outperforms competitors on strong trading day - MarketWatch,"Thu, 27 Jun 2024 07:00:00 GMT"
79,Investors have never withdrawn from S&P 500 funds like they did last week - MarketWatch,"Fri, 14 Jun 2024 07:00:00 GMT"
80,Waymo opens its driverless-taxi service to all in San Francisco - MarketWatch,"Tue, 25 Jun 2024 07:00:00 GMT"
81,"Coffee’s future lies in fancier ingredients, analysts say, as daily consumption dips - MarketWatch","Mon, 10 Jun 2024 07:00:00 GMT"
82,SLXXGBP Holdings - MarketWatch,"Fri, 28 Mar 2025 22:00:21 GMT"
83,Is Nvidia doomed to be the next Cisco or Intel? Here’s what investors need to know. - MarketWatch,"Mon, 24 Jun 2024 07:00:00 GMT"
84,Lennar Corp. Cl A stock underperforms Tuesday when compared to competitors - MarketWatch,"Tue, 18 Jun 2024 07:00:00 GMT"
85,"iBio Inc. stock falls Thursday, underperforms market - MarketWatch","Thu, 20 Jun 2024 07:00:00 GMT"
86,European stocks extend positive streak for second day - MarketWatch,"Thu, 06 Jun 2024 07:00:00 GMT"
87,Target raises quarterly dividend as retail competition heats up - MarketWatch,"Wed, 12 Jun 2024 07:00:00 GMT"
88,This chart shows Nvidia’s meteoric rise as ‘Jensenity’ continues - MarketWatch,"Fri, 07 Jun 2024 07:00:00 GMT"
89,"J Sainsbury rises Thursday, outperforms market - MarketWatch","Thu, 13 Jun 2024 07:00:00 GMT"
90,Here’s why AMD’s stock was just dubbed a top pick - MarketWatch,"Thu, 20 Jun 2024 07:00:00 GMT"
91,Charles Schwab Corp. stock outperforms competitors on strong trading day - MarketWatch,"Fri, 21 Jun 2024 07:00:00 GMT"
92,GameStop’s stock falls following downbeat earnings and plan to sell more shares - MarketWatch,"Fri, 07 Jun 2024 07:00:00 GMT"
93,Aon PLC stock outperforms market despite losses on the day - MarketWatch,"Fri, 14 Jun 2024 07:00:00 GMT"
94,C3.ai Inc. stock underperforms Tuesday when compared to competitors - MarketWatch,"Tue, 11 Jun 2024 07:00:00 GMT"
95,FGGG | Fidelity Global Government Bond Climate Aware UCITS ETF Overview - MarketWatch,"Thu, 20 Jun 2024 22:43:45 GMT"
96,SPXCCUSD | UBS ETF US Equity Defensive Covered Call Overview - MarketWatch,"Tue, 08 Apr 2025 07:12:56 GMT"
97,Cisco Systems Inc. stock outperforms competitors on strong trading day - MarketWatch,"Tue, 18 Jun 2024 07:00:00 GMT"
98,Opinion: What investors may be getting wrong about Apple’s AI strategy - MarketWatch,"Mon, 10 Jun 2024 07:00:00 GMT"
99,Darden Restaurants Inc. stock outperforms competitors despite losses on the day - MarketWatch,"Fri, 28 Jun 2024 07:00:00 GMT"
