,Title,Date
0,BOH | Bank of Hawaii Corp. SEC Filings - MarketWatch,"Wed, 07 May 2025 20:04:38 GMT"
1,Iron Mountain Inc. stock outperforms competitors despite losses on the day - MarketWatch,"Thu, 25 Feb 2021 08:00:00 GMT"
2,Rekor Systems stock price target raised to $21.50 from $14.00 at B. Riley - MarketWatch,"Mon, 08 Feb 2021 08:00:00 GMT"
3,W.W. Grainger Inc. stock outperforms competitors on strong trading day - MarketWatch,"Fri, 19 Feb 2021 08:00:00 GMT"
4,CBRE Group Inc. Cl A stock outperforms competitors despite losses on the day - MarketWatch,"Fri, 05 Feb 2021 08:00:00 GMT"
5,"Ulta Beauty Inc. stock rises Tuesday, still underperforms market - MarketWatch","Tue, 23 Feb 2021 08:00:00 GMT"
6,SANA Stock Price | Sana Biotechnology Inc. Stock Quote (U.S.: Nasdaq) - MarketWatch,"Thu, 14 Jan 2021 15:58:55 GMT"
7,"General Electric Co. stock falls Friday, underperforms market - MarketWatch","Fri, 05 Feb 2021 08:00:00 GMT"
8,EMNT Stock Price | Eminent Gold Corp. Stock Quote (Canada: TSX Venture) - MarketWatch,"Mon, 15 Feb 2021 00:06:28 GMT"
9,HBT Financial downgraded to market perform from outperform at Raymond James - MarketWatch,"Mon, 01 Feb 2021 08:00:00 GMT"
10,IPWG Stock Price | International Power Group Ltd. Stock Quote (U.S.: OTC) - MarketWatch,"Wed, 18 Oct 2017 00:58:29 GMT"
11,Last year's Super Bowl made the host city $572 million --- this year Tampa Bay likely won't make even half that - MarketWatch,"Mon, 01 Feb 2021 08:00:00 GMT"
12,300677 | Intco Medical Technology Co. Ltd. A Quarterly Income Statement - MarketWatch,"Wed, 24 Feb 2021 23:37:18 GMT"
13,2531 Stock Price | Takara Holdings Inc. Stock Quote (Japan: Tokyo) - MarketWatch,"Thu, 19 Oct 2017 22:50:40 GMT"
14,Avista upgraded to buy from neutral at Sidoti & Co. - MarketWatch,"Thu, 25 Feb 2021 08:00:00 GMT"
15,MASSY | Massy Holdings Ltd. Profile - MarketWatch,"Sun, 21 Feb 2021 19:44:43 GMT"
16,"Willis Towers Watson PLC stock rises Wednesday, outperforms market - MarketWatch","Wed, 17 Feb 2021 08:00:00 GMT"
17,AES Corp. stock outperforms market on strong trading day - MarketWatch,"Mon, 01 Feb 2021 08:00:00 GMT"
18,‘I like the stock’ and ‘I am not a cat’ — see the GameStop hearing highlights - MarketWatch,"Fri, 19 Feb 2021 08:00:00 GMT"
19,Trump's Full Speech at D.C. Rally on Jan. 6 - MarketWatch,"Sun, 07 Feb 2021 08:00:00 GMT"
20,SkyDrive - MarketWatch,"Fri, 26 Feb 2021 18:46:14 GMT"
21,MARA | MARA Holdings Inc. Profile - MarketWatch,"Thu, 18 Feb 2021 00:36:14 GMT"
22,"Western Union Co. stock falls Monday, still outperforms market - MarketWatch","Mon, 22 Feb 2021 08:00:00 GMT"
23,5014 | Chain Chon Industrial Co. Ltd. Profile - MarketWatch,"Sat, 20 Feb 2021 05:10:02 GMT"
24,Apache Corp. stock outperforms market on strong trading day - MarketWatch,"Tue, 16 Feb 2021 08:00:00 GMT"
25,PLUS Stock Price | Plus500 Ltd. Stock Quote (U.K.: London) - MarketWatch,"Wed, 18 Oct 2017 05:25:07 GMT"
26,UDR Inc. stock underperforms Friday when compared to competitors - MarketWatch,"Fri, 12 Feb 2021 08:00:00 GMT"
27,Second test flight of SpaceX’s Starship ends in another fiery crash - MarketWatch,"Tue, 02 Feb 2021 08:00:00 GMT"
28,SANA | Sana Biotechnology Inc. Annual Cash Flow Statement - MarketWatch,"Mon, 08 Feb 2021 08:33:39 GMT"
29,VCNX Stock Price | Vaccinex Inc. Stock Quote (U.S.: OTC) - MarketWatch,"Mon, 30 Jul 2018 16:25:33 GMT"
30,Safe Bulkers upgraded to buy from hold at Stifel Nicolaus - MarketWatch,"Mon, 01 Feb 2021 08:00:00 GMT"
31,BAMI | Banco BPM S.p.A. Quarterly Income Statement - MarketWatch,"Fri, 26 Feb 2021 11:40:50 GMT"
32,RCC | Ready Capital Corp. 5.75% Sr. Notes due 2026 Advanced Charts - MarketWatch,"Wed, 17 Feb 2021 01:06:26 GMT"
33,HALB Stock Price | Halberd Corp. Stock Quote (U.S.: OTC) - MarketWatch,"Tue, 17 Oct 2017 23:28:22 GMT"
34,Body of slain Capitol Police officer lies in state at Capitol rotunda - MarketWatch,"Tue, 02 Feb 2021 08:00:00 GMT"
35,DMC | DMCI Holdings Inc. Annual Balance Sheet - MarketWatch,"Sun, 21 Feb 2021 12:06:49 GMT"
36,543257 Stock Price | Indian Railway Finance Corp. Stock Quote (India: Bombay) - MarketWatch,"Sat, 20 Feb 2021 06:54:07 GMT"
37,HMN Stock Price | Horace Mann Educators Corp. Stock Quote (U.S.: NYSE) - MarketWatch,"Fri, 23 Dec 2016 20:22:51 GMT"
38,PODERC1 | Compania Minera Poderosa S.A. Profile - MarketWatch,"Wed, 17 Feb 2021 16:23:17 GMT"
39,8391 | Cornerstone Technologies Holdings Ltd. Advanced Charts - MarketWatch,"Fri, 25 Mar 2022 01:54:15 GMT"
40,PXA Stock Price | PEXA Group Ltd. Stock Quote (Australia: Sydney) - MarketWatch,"Fri, 02 Jul 2021 14:50:10 GMT"
41,"Zoom Video Communications Inc. stock falls Monday, underperforms market - MarketWatch","Mon, 08 Feb 2021 08:00:00 GMT"
42,EICHERMOT | Eicher Motors Ltd. Annual Cash Flow Statement - MarketWatch,"Tue, 23 Feb 2021 13:39:32 GMT"
43,DRRX Stock Price | Durect Corp. Stock Quote (U.S.: Nasdaq) - MarketWatch,"Wed, 08 Jun 2016 17:53:24 GMT"
44,Mining stocks climb as copper trades near decade high - MarketWatch,"Thu, 18 Feb 2021 08:00:00 GMT"
45,Genetic testing company 23andMe to go public via merger with Richard Branson's SPAC in $3.5 billion deal - MarketWatch,"Thu, 04 Feb 2021 08:00:00 GMT"
46,INEO Stock Price | INEO Tech Corp. Stock Quote (Canada: TSX Venture) - MarketWatch,"Sun, 23 Feb 2020 13:43:37 GMT"
47,Bill Gates roasted for saying rich countries should eat ‘100% synthetic beef’ - MarketWatch,"Tue, 16 Feb 2021 08:00:00 GMT"
48,300134 | Anhui Tat Fook Technology Co. Ltd. A Profile - MarketWatch,"Fri, 26 Feb 2021 09:07:24 GMT"
49,EHOS Stock Price | Ehouse Global Inc. Stock Quote (U.S.: OTC) - MarketWatch,"Fri, 12 May 2017 17:54:26 GMT"
50,BMBL | Bumble Inc. Cl A Analyst Estimates - MarketWatch,"Thu, 11 Feb 2021 17:49:05 GMT"
51,APL | Apollo Global Capital Inc. Profile - MarketWatch,"Tue, 23 Feb 2021 19:05:58 GMT"
52,3PL | 3P Learning Ltd. Annual Income Statement - MarketWatch,"Fri, 25 Feb 2022 14:23:11 GMT"
53,THQM Stock Price | Tchaikapharma High Quality Medicines AD Stock Quote (Bulgarian Stock Exchange) - MarketWatch,"Fri, 19 Feb 2021 21:16:45 GMT"
54,STI | STI Education Systems Holdings Inc. Profile - MarketWatch,"Mon, 22 Feb 2021 20:06:02 GMT"
55,U.S. fourth-quarter economic growth raised slightly to 4.1% - MarketWatch,"Thu, 25 Feb 2021 08:00:00 GMT"
56,XRO Stock Price | Xero Ltd. Stock Quote (Australia: Sydney) - MarketWatch,"Wed, 18 Oct 2017 04:15:55 GMT"
57,WIPRO | Wipro Ltd. Annual Cash Flow Statement - MarketWatch,"Sat, 20 Feb 2021 05:03:25 GMT"
58,"Salesforce.com Inc., Visa share gains lead Dow's 82-point jump - MarketWatch","Thu, 11 Feb 2021 08:00:00 GMT"
59,CLF | Cleveland-Cliffs Inc. SEC Filings - MarketWatch,"Wed, 14 Aug 2024 03:19:34 GMT"
60,"Dow falls 225 points on losses for Walmart, Salesforce.com Inc. stocks - MarketWatch","Thu, 18 Feb 2021 08:00:00 GMT"
61,Would McConnell support Trump as 2024 presidential nominee? ‘Absolutely.’ - MarketWatch,"Thu, 25 Feb 2021 08:00:00 GMT"
62,CINT Stock Price | Cint Group AB Stock Quote (Sweden: Stockholm) - MarketWatch,"Wed, 24 Feb 2021 12:19:12 GMT"
63,AP | Aboitiz Power Corp. Annual Income Statement - MarketWatch,"Fri, 18 Mar 2022 14:46:37 GMT"
64,"Charting bull-flag breakout attempts: S&P 500, Nasdaq tag record territory - MarketWatch","Tue, 16 Feb 2021 08:00:00 GMT"
65,JFU Stock Price | 9F Inc. ADR Stock Quote (U.S.: Nasdaq) - MarketWatch,"Thu, 15 Aug 2019 13:57:10 GMT"
66,AG1 | Auto1 Group SE Annual Income Statement - MarketWatch,"Tue, 30 Mar 2021 14:34:23 GMT"
67,Edison International stock underperforms Thursday when compared to competitors - MarketWatch,"Thu, 18 Feb 2021 08:00:00 GMT"
68,300866 | Anker Innovations Technology Co. Ltd. A Annual Income Statement - MarketWatch,"Tue, 23 Feb 2021 13:19:46 GMT"
69,IMM | Immutep Ltd. Annual Income Statement - MarketWatch,"Sat, 20 Feb 2021 18:52:45 GMT"
70,"Exxon Mobil Corp. stock rises Monday, still underperforms market - MarketWatch","Mon, 01 Feb 2021 08:00:00 GMT"
71,"Hartford Financial Services Group Inc. stock rises Friday, outperforms market - MarketWatch","Fri, 19 Feb 2021 08:00:00 GMT"
72,RVPH | Reviva Pharmaceuticals Holdings Inc. Analyst Estimates - MarketWatch,"Mon, 22 Feb 2021 00:13:25 GMT"
73,DOL | Dollarama Inc. Annual Income Statement - MarketWatch,"Thu, 25 Feb 2021 06:34:19 GMT"
74,IBM exploring sale of its Watson Health unit - MarketWatch,"Thu, 18 Feb 2021 08:00:00 GMT"
75,Wells Fargo & Co. stock underperforms Wednesday when compared to competitors - MarketWatch,"Wed, 10 Feb 2021 08:00:00 GMT"
76,AUB | Asia United Bank Corp. Profile - MarketWatch,"Fri, 19 Feb 2021 10:08:46 GMT"
77,MCET Stock Price | MultiCell Technologies Inc. Stock Quote (U.S.: OTC) - MarketWatch,"Fri, 13 Oct 2017 07:41:36 GMT"
78,"Williams Cos. stock rises Monday, outperforms market - MarketWatch","Mon, 22 Feb 2021 08:00:00 GMT"
79,GAIL | GAIL (India) Ltd. Annual Cash Flow Statement - MarketWatch,"Mon, 22 Feb 2021 20:38:10 GMT"
80,SEI | Sintana Energy Inc. Profile - MarketWatch,"Sat, 20 Feb 2021 03:04:50 GMT"
81,10-year Treasury rate briefly passes S&P 500 dividend yield - MarketWatch,"Thu, 25 Feb 2021 08:00:00 GMT"
82,Do Airbnbs push up rents and house prices? - MarketWatch,"Tue, 02 Feb 2021 08:00:00 GMT"
83,H4L1 | Halyk Savings Bank of Kazakhstan GDR Profile - MarketWatch,"Mon, 22 Feb 2021 13:50:22 GMT"
84,Opinion: What will low interest rates do to retirement savings? - MarketWatch,"Tue, 09 Feb 2021 08:00:00 GMT"
85,Electronic Arts Inc. stock underperforms Wednesday when compared to competitors - MarketWatch,"Wed, 24 Feb 2021 08:00:00 GMT"
86,'I was discarded after 40 years of marriage': Can my ex-husband file a joint tax return without my consent? He tried to take both my stimulus checks - MarketWatch,"Tue, 02 Feb 2021 08:00:00 GMT"
87,"Constellation Brands Inc. Cl A stock falls Wednesday, underperforms market - MarketWatch","Wed, 03 Feb 2021 08:00:00 GMT"
88,KPMG boss quits after telling staff to ‘stop moaning’ and ‘playing the victim’ about COVID work conditions - MarketWatch,"Fri, 12 Feb 2021 08:00:00 GMT"
89,"Charting shaky technical tests, U.S. benchmarks maintain key support - MarketWatch","Mon, 01 Feb 2021 08:00:00 GMT"
90,FuboTV's stock soars after Wedbush analyst boosts price target by 25% - MarketWatch,"Mon, 01 Feb 2021 08:00:00 GMT"
91,"Moody's Corp. stock rises Thursday, still underperforms market - MarketWatch","Thu, 04 Feb 2021 08:00:00 GMT"
92,WDLF Stock Price | Decentral Life Inc. Stock Quote (U.S.: OTC) - MarketWatch,"Tue, 17 Oct 2017 22:45:57 GMT"
93,Opinion: Reassess your life and career every 7 years by asking these 3 questions - MarketWatch,"Tue, 23 Feb 2021 08:00:00 GMT"
94,"Nasdaq gets punched in the mouth early Tuesday, on track for the biggest 2-day plunge in over five months as yields rise - MarketWatch","Tue, 23 Feb 2021 08:00:00 GMT"
95,"Forget 'Go woke, go broke,' NASCAR claims social justice is at forefront as new season begins - MarketWatch","Sat, 13 Feb 2021 08:00:00 GMT"
96,Hyundai now says it’s not in talks with Apple to develop autonomous electric car - MarketWatch,"Sun, 07 Feb 2021 08:00:00 GMT"
97,"Crown Castle International Corp. stock falls Tuesday, underperforms market - MarketWatch","Tue, 23 Feb 2021 08:00:00 GMT"
98,"Opinion: When activists try to seize corporate control, these shareholders come to the rescue - MarketWatch","Thu, 18 Feb 2021 08:00:00 GMT"
99,CBDHF Stock Price | HempFusion Wellness Inc. Stock Quote (U.S.: OTC) - MarketWatch,"Mon, 15 Feb 2021 09:41:25 GMT"
