,Title,Date
0,"Illinois Tool Works Inc. stock rises Thursday, still underperforms market - MarketWatch","Thu, 26 Jan 2023 08:00:00 GMT"
1,"Enbridge Inc. stock rises Tuesday, still underperforms market - MarketWatch","Tue, 17 Jan 2023 08:00:00 GMT"
2,Latest data on services and factory activity show China’s economy rebounding from pandemic doldrums - MarketWatch,"Tue, 31 Jan 2023 08:00:00 GMT"
3,Reparations for Black Americans 'could finally lead to closure': Sandy Darity - MarketWatch,"Thu, 12 Jan 2023 08:00:00 GMT"
4,End of AmazonSmile charity donations ‘could not come at a worse time’ for nonprofits - MarketWatch,"Fri, 20 Jan 2023 08:00:00 GMT"
5,"Portable retirement plans offer niche alternative for gig workers, job jumpers - MarketWatch","Fri, 13 Jan 2023 08:00:00 GMT"
6,Patty Murray becomes first female president pro tempore in Senate - MarketWatch,"Tue, 03 Jan 2023 08:00:00 GMT"
7,Vanguard expects municipal bond 'renaissance’ as investors should ‘salivate’ at higher yields - MarketWatch,"Wed, 18 Jan 2023 08:00:00 GMT"
8,Ronzoni is discontinuing this pasta shape and its fans are freaking out - MarketWatch,"Wed, 04 Jan 2023 08:00:00 GMT"
9,Here are the politicians pledging to donate or return contributions from FTX’s Sam Bankman-Fried - MarketWatch,"Thu, 12 Jan 2023 08:00:00 GMT"
10,FFIN | First Financial Bankshares Inc. Profile - MarketWatch,"Sun, 11 Oct 2020 03:15:35 GMT"
11,Is a severance package considered income for limits on Roth IRA contributions? - MarketWatch,"Fri, 27 Jan 2023 08:00:00 GMT"
12,"Peloton Interactive Inc. stock rises Tuesday, outperforms market - MarketWatch","Tue, 17 Jan 2023 08:00:00 GMT"
13,Dow drops more than 600 points as U.S. stocks end lower amid economic slowdown fears - MarketWatch,"Wed, 18 Jan 2023 08:00:00 GMT"
14,The Dow takes ‘important first step’ toward a new bull market - MarketWatch,"Fri, 06 Jan 2023 08:00:00 GMT"
15,Incoming Biden chief of staff Zients is nearly wealthy enough to buy the entire White House - MarketWatch,"Mon, 23 Jan 2023 08:00:00 GMT"
16,Latest from MarketWatch Options Trader column - MarketWatch,"Wed, 15 Jul 2020 03:18:11 GMT"
17,DC mayor: Biden should bring federal workers back to office or convert property - MarketWatch,"Wed, 04 Jan 2023 08:00:00 GMT"
18,Southwest Airlines Co. stock outperforms competitors on strong trading day - MarketWatch,"Thu, 19 Jan 2023 08:00:00 GMT"
19,Conservative activist Matt Schlapp accused of ‘aggressively fondling’ staffer - MarketWatch,"Tue, 17 Jan 2023 08:00:00 GMT"
20,"Job-openings data are missing a recent upturn in layoffs, Goldman economist says - MarketWatch","Tue, 17 Jan 2023 08:00:00 GMT"
21,"Charter Communications Inc. Cl A stock rises Wednesday, outperforms market - MarketWatch","Wed, 25 Jan 2023 08:00:00 GMT"
22,WCO Stock Price | WasteCo Group Ltd. Stock Quote (New Zealand: NZX) - MarketWatch,"Wed, 19 Apr 2023 11:12:55 GMT"
23,"Oprah Winfrey, now worth an estimated $2.5 billion, says you should spend your money like this — and for some of you, it’s also a simple, but smart, trick to save more - MarketWatch","Sat, 14 Jan 2023 08:00:00 GMT"
24,"Marathon Petroleum Corp. stock falls Monday, underperforms market - MarketWatch","Mon, 09 Jan 2023 08:00:00 GMT"
25,"Opinion: Intel just had its worst year since the dot-com bust, and it won’t get better anytime soon - MarketWatch","Thu, 26 Jan 2023 08:00:00 GMT"
26,"H&R Block Inc. stock falls Thursday, underperforms market - MarketWatch","Thu, 19 Jan 2023 08:00:00 GMT"
27,"Capital One Financial Corp. stock rises Tuesday, outperforms market - MarketWatch","Tue, 17 Jan 2023 08:00:00 GMT"
28,"Intuit Inc. stock rises Monday, outperforms market - MarketWatch","Mon, 23 Jan 2023 08:00:00 GMT"
29,Jane Fonda says climate crisis can be blamed on racism: ‘Where would they put the sh—? Not Bel Air.’ - MarketWatch,"Thu, 26 Jan 2023 08:00:00 GMT"
30,PFSI Stock Price | PennyMac Financial Services Inc. Stock Quote (U.S.: NYSE) - MarketWatch,"Sat, 06 Aug 2016 10:38:12 GMT"
31,What stock-market investors need to know as busiest week of earnings season begins - MarketWatch,"Tue, 31 Jan 2023 08:00:00 GMT"
32,"Gilead Sciences Inc. stock falls Thursday, underperforms market - MarketWatch","Thu, 26 Jan 2023 08:00:00 GMT"
33,Apple CEO Tim Cook asked for — and got — a major pay cut this year. Is there ever a time when some of us should accept one too? The answer is ‘yes.’ - MarketWatch,"Wed, 18 Jan 2023 08:00:00 GMT"
34,"Want a happier, more fulfilling retirement? Try this Japanese concept. - MarketWatch","Wed, 04 Jan 2023 08:00:00 GMT"
35,Opinion: Microsoft’s big move in AI does not mean it will challenge Google in search - MarketWatch,"Mon, 23 Jan 2023 08:00:00 GMT"
36,"You can earn upwards of $1,000 for opening a bank account right now — but you need to know this key thing before you do - MarketWatch","Sat, 14 Jan 2023 08:00:00 GMT"
37,"U.S. stocks flash rare bull-market signal for first time in nearly 3 years, but some have their doubts - MarketWatch","Wed, 18 Jan 2023 08:00:00 GMT"
38,XEL Stock Price | Xcel Energy Inc. Stock Quote (U.S.: Nasdaq) - MarketWatch,"Thu, 30 Jul 2009 11:20:29 GMT"
39,Why naked short selling has suddenly become a hot topic - MarketWatch,"Tue, 24 Jan 2023 08:00:00 GMT"
40,TSL Stock Price | Tesselis S.p.A. Stock Quote (Italy: Milan) - MarketWatch,"Sat, 21 Jan 2023 10:17:17 GMT"
41,Charles Schwab blasts NYSE over stock-trading glitch - MarketWatch,"Thu, 26 Jan 2023 08:00:00 GMT"
42,"Nancy Pelosi: Love or hate her, her senior work ethic is admirable - MarketWatch","Tue, 03 Jan 2023 08:00:00 GMT"
43,Stephanie McMahon resigns from WWE after Vince McMahon’s return to board - MarketWatch,"Wed, 11 Jan 2023 08:00:00 GMT"
44,"1 out of every 8 older Americans is a junk-food addict, survey finds - MarketWatch","Mon, 30 Jan 2023 08:00:00 GMT"
45,AULT - MarketWatch - MarketWatch,"Wed, 04 Jan 2023 07:42:08 GMT"
46,I ruined my family’s finances by withdrawing from my 401(k) to buy a house — and I regret it - MarketWatch,"Wed, 18 Jan 2023 08:00:00 GMT"
47,Here’s what Apple’s mixed-reality headset could feature - MarketWatch,"Mon, 23 Jan 2023 08:00:00 GMT"
48,PZ Stock Price | PZ Cussons Nigeria PLC Stock Quote (Nigerian Stock Exchange) - MarketWatch,"Tue, 02 Jul 2019 23:20:37 GMT"
49,U.S. air travel returns to normal a day after system breakdown - MarketWatch,"Thu, 12 Jan 2023 08:00:00 GMT"
50,NSYC Stock Price | National Stock Yards Co. Stock Quote (U.S.: OTC) - MarketWatch,"Wed, 18 Oct 2017 11:04:35 GMT"
51,XPON | Expion360 Inc. Analyst Estimates - MarketWatch,"Fri, 01 Apr 2022 15:41:03 GMT"
52,"Gallo, the biggest U.S. wine company, to lay off 355 in California - MarketWatch","Fri, 27 Jan 2023 08:00:00 GMT"
53,Buzz Aldrin just tied the knot at age 93. What to think about if you’re getting married later in life - MarketWatch,"Tue, 24 Jan 2023 08:00:00 GMT"
54,Marqeta promotes Simon Khalaf from chief product officer to CEO - MarketWatch,"Thu, 26 Jan 2023 08:00:00 GMT"
55,British Land Co. outperforms market despite losses on the day - MarketWatch,"Thu, 19 Jan 2023 08:00:00 GMT"
56,"Van Halen’s Sammy Hagar on making music, managing money…and drinking $80K bottles of wine - MarketWatch","Fri, 27 Jan 2023 08:00:00 GMT"
57,FIDU | Fidelity MSCI Industrials Index ETF Overview - MarketWatch,"Wed, 18 Oct 2017 05:55:48 GMT"
58,LIFW Stock Price - MarketWatch - MarketWatch,"Wed, 04 Jan 2023 18:24:06 GMT"
59,Citigroup’s Jane Fraser is fine with remote work — as long as employees stay productive - MarketWatch,"Thu, 19 Jan 2023 08:00:00 GMT"
60,The Computer Chip Wars: How AMD Ended Intel's Market Dominance - MarketWatch,"Tue, 11 Mar 2025 15:07:58 GMT"
61,2882 Stock Price | Cathay Financial Holding Co. Ltd. Stock Quote (Taiwan) - MarketWatch,"Sat, 21 Oct 2017 01:05:53 GMT"
62,"Home-sale prices have slumped 10% in San Francisco over the past year, Redfin says. But it's not the only city where real-estate values are falling. - MarketWatch","Fri, 20 Jan 2023 08:00:00 GMT"
63,Going to Davos has an exorbitant cost - MarketWatch,"Tue, 17 Jan 2023 08:00:00 GMT"
64,Don't count on the bear market's winners to fuel the next bull market - MarketWatch,"Fri, 06 Jan 2023 08:00:00 GMT"
65,EXC Stock Price | Exelon Corp. Stock Quote (U.S.: Nasdaq) - MarketWatch,"Thu, 02 Jul 2009 15:18:01 GMT"
66,ACTG Stock Price | Acacia Research Corp. - Acacia Technologies Stock Quote (U.S.: Nasdaq) - MarketWatch,"Wed, 06 Jan 2016 06:15:24 GMT"
67,"Comcast Corp. Cl A stock rises Tuesday, outperforms market - MarketWatch","Tue, 17 Jan 2023 08:00:00 GMT"
68,Amazon launches a subscription prescription drug service - MarketWatch,"Tue, 24 Jan 2023 08:00:00 GMT"
69,MKDW Stock Price | MKDWELL Tech Inc. Stock Quote (U.S.: Nasdaq) - MarketWatch,"Thu, 01 Aug 2024 14:22:28 GMT"
70,Salesforce names three directors amid pressure from activist investors - MarketWatch,"Fri, 27 Jan 2023 08:00:00 GMT"
71,Emergent BioSolutions to cut 5% of its workforce in reorganization effort - MarketWatch,"Mon, 09 Jan 2023 08:00:00 GMT"
72,QTWO Stock Price | Q2 Metals Corp. Stock Quote (Canada: TSX Venture) - MarketWatch,"Tue, 10 Jan 2023 04:54:22 GMT"
73,"Amid criticism for its handling of another Alzheimer's drug, FDA will decide this week whether to approve lecanemab - MarketWatch","Tue, 03 Jan 2023 08:00:00 GMT"
74,FATE Stock Price | Fate Therapeutics Inc. Stock Quote (U.S.: Nasdaq) - MarketWatch,"Mon, 06 Jun 2016 11:12:15 GMT"
75,"One simple piece of money advice both Shaq and LeBron live by that you should too — well, to a point - MarketWatch","Thu, 05 Jan 2023 08:00:00 GMT"
76,Supreme Court investigators narrowing suspects in leak of Alito draft of decision overturning Roe v. Wade - MarketWatch,"Fri, 13 Jan 2023 08:00:00 GMT"
77,Netflix revokes some staff’s access to other people’s salary information - MarketWatch,"Tue, 10 Jan 2023 08:00:00 GMT"
78,Seagate Technology Holdings PLC stock outperforms competitors on strong trading day - MarketWatch,"Fri, 06 Jan 2023 08:00:00 GMT"
79,Deere & Co. stock underperforms Monday when compared to competitors - MarketWatch,"Mon, 23 Jan 2023 08:00:00 GMT"
80,Workday to cut 3% of jobs amid a restructuring - MarketWatch,"Tue, 31 Jan 2023 08:00:00 GMT"
81,CMTL Stock Price | Comtech Telecommunications Corp. Stock Quote (U.S.: Nasdaq) - MarketWatch,"Sun, 26 Jun 2016 14:59:23 GMT"
82,Why the unexpectedly weak Leading Economic Indicators might be good news - MarketWatch,"Tue, 24 Jan 2023 08:00:00 GMT"
83,SOAR Stock Price | Volato Group Inc. Stock Quote (U.S.: NYSE American) - MarketWatch,"Mon, 04 Dec 2023 22:06:24 GMT"
84,Suze Orman says 'most of America today has absolutely no money.' - MarketWatch,"Wed, 25 Jan 2023 08:00:00 GMT"
85,China’s latest COVID challenge: Lunar New Year holiday travel surge - MarketWatch,"Fri, 06 Jan 2023 08:00:00 GMT"
86,KALU Stock Price | Kaiser Aluminum Corp. Stock Quote (U.S.: Nasdaq) - MarketWatch,"Sun, 11 Dec 2016 13:42:49 GMT"
87,New Zealand Prime Minister Jacinda Ardern steps down: 'I no longer have enough in the tank' - MarketWatch,"Thu, 19 Jan 2023 08:00:00 GMT"
88,SLDP Stock Price | Solid Power Inc. Stock Quote (U.S.: Nasdaq) - MarketWatch,"Thu, 09 Dec 2021 16:31:11 GMT"
89,Should I claim Social Security at 62 or 67? - MarketWatch,"Wed, 11 Jan 2023 08:00:00 GMT"
90,White families are reaping over 90% of the benefit from this powerful tax rule - MarketWatch,"Mon, 23 Jan 2023 08:00:00 GMT"
91,Where is Monterey Park and what does the shooting mean to Asian-Americans? - MarketWatch,"Wed, 25 Jan 2023 08:00:00 GMT"
92,Marie Kondo admits she’s ‘kind of given up’ on tidying up after having 3 kids - MarketWatch,"Thu, 26 Jan 2023 08:00:00 GMT"
93,IMTE Stock Price | Integrated Media Technology Ltd. Stock Quote (U.S.: Nasdaq) - MarketWatch,"Wed, 18 Oct 2017 05:37:55 GMT"
94,Ventas Inc. stock underperforms Tuesday when compared to competitors despite daily gains - MarketWatch,"Tue, 24 Jan 2023 08:00:00 GMT"
95,"C.H. Robinson Worldwide Inc. stock rises Wednesday, outperforms market - MarketWatch","Wed, 18 Jan 2023 08:00:00 GMT"
96,"Emera Inc. stock falls Monday, underperforms market - MarketWatch","Mon, 09 Jan 2023 08:00:00 GMT"
97,SPXC Stock Price | SPX Technologies Inc. Stock Quote (U.S.: NYSE) - MarketWatch,"Tue, 07 Jun 2016 12:20:02 GMT"
98,WRLG Stock Price | West Red Lake Gold Mines Ltd. Stock Quote (Canada: TSX Venture) - MarketWatch,"Fri, 06 Jan 2023 23:21:26 GMT"
99,"DexCom Inc. stock falls Wednesday, underperforms market - MarketWatch","Wed, 18 Jan 2023 08:00:00 GMT"
