,Title,Date
0,Century Communities double downgraded to underweight from overweight at J.P. Morgan - MarketWatch,"Tue, 22 Nov 2022 08:00:00 GMT"
1,Roblox downgraded to neutral from overweight at J.P. Morgan - MarketWatch,"Thu, 10 Nov 2022 08:00:00 GMT"
2,Sabra Healthcare REIT downgraded to underperform from neutral at BofA Securities - MarketWatch,"Mon, 14 Nov 2022 08:00:00 GMT"
3,Invitation Homes downgraded to outperform from strong buy at Raymond James - MarketWatch,"Tue, 29 Nov 2022 08:00:00 GMT"
4,Bausch + Lomb lowers full-year guidance due to strong dollar - MarketWatch,"Wed, 02 Nov 2022 07:00:00 GMT"
5,Marathon Oil stock price target raised to $48 from $37 at Raymond James - MarketWatch,"Mon, 28 Nov 2022 08:00:00 GMT"
6,Dominion Energy downgraded to neutral from buy at UBS - MarketWatch,"Mon, 07 Nov 2022 08:00:00 GMT"
7,Life Time Q3 revenue $496.4 mln vs. $385.0 mln a year ago; FactSet consensus $499.4 mln - MarketWatch,"Wed, 09 Nov 2022 08:00:00 GMT"
8,"Textron Inc. stock falls Friday, underperforms market - MarketWatch","Fri, 11 Nov 2022 08:00:00 GMT"
9,Getting older and losing confidence? Here’s how to get it back. - MarketWatch,"Fri, 25 Nov 2022 08:00:00 GMT"
10,CBWTF | Auxly Cannabis Group Inc. Analyst Estimates - MarketWatch,"Wed, 08 Nov 2017 14:08:18 GMT"
11,FINGF Stock Price | Finning International Inc. Stock Quote (U.S.: OTC) - MarketWatch,"Sun, 17 Apr 2011 11:51:49 GMT"
12,Actor Gabriel Byrne on why he’s never ‘lusted after a lot of money’ - MarketWatch,"Thu, 17 Nov 2022 08:00:00 GMT"
13,Instagram influencer Jay Mazini pleads guilty to running $8 million Ponzi scheme and crypto scam - MarketWatch,"Wed, 02 Nov 2022 07:00:00 GMT"
14,IP | Interpump Group S.p.A. Profile - MarketWatch,"Mon, 22 Feb 2021 04:05:15 GMT"
15,Fed ‘pivot’ to lower interest rates will be bullish for stocks. But timing is everything. - MarketWatch,"Tue, 29 Nov 2022 08:00:00 GMT"
16,Here's how top CEOs are opening up their wallets for J.D. Vance and other candidates in key Senate races - MarketWatch,"Thu, 03 Nov 2022 07:00:00 GMT"
17,"Pembina Pipeline Corp. stock rises Friday, outperforms market - MarketWatch","Fri, 11 Nov 2022 08:00:00 GMT"
18,Trump loyalist Kash Patel to receive immunity for testimony to grand jury in case surrounding government documents recovered at Mar-a-Lago club - MarketWatch,"Thu, 03 Nov 2022 07:00:00 GMT"
19,Phil Knight says he 'would doubt' Nike will ever work with Kyrie Irving again - MarketWatch,"Thu, 10 Nov 2022 08:00:00 GMT"
20,"EOG Resources Inc. stock rises Tuesday, still underperforms market - MarketWatch","Tue, 15 Nov 2022 08:00:00 GMT"
21,Alibaba Group Holding Ltd. ADR outperforms competitors on strong trading day - MarketWatch,"Mon, 28 Nov 2022 08:00:00 GMT"
22,"NRG Energy Inc. stock falls Monday, underperforms market - MarketWatch","Mon, 28 Nov 2022 08:00:00 GMT"
23,EGRX | Eagle Pharmaceuticals Inc. SEC Filings - MarketWatch,"Fri, 04 Nov 2022 08:02:17 GMT"
24,8990P | 8990 Holdings Inc. Pfd. Profile - MarketWatch,"Sun, 11 Oct 2020 14:16:02 GMT"
25,"Disney shocker: Bob Iger to return as CEO, Bob Chapek ousted - MarketWatch","Sun, 20 Nov 2022 08:00:00 GMT"
26,Wana Brands CEO makes seven-figure donation to fund cannabis research - MarketWatch,"Wed, 09 Nov 2022 08:00:00 GMT"
27,"Amid steep inflation, one thing is getting cheaper: cannabis - MarketWatch","Fri, 04 Nov 2022 07:00:00 GMT"
28,"'We’ve only just begun to see the layoffs and squeezes on profit margins,' warns Wells Fargo strategist - MarketWatch","Wed, 16 Nov 2022 08:00:00 GMT"
29,"'Steve Jobs Syndrome' strikes as Disney brings back Bob Iger, but history says that's a bad idea - MarketWatch","Mon, 21 Nov 2022 08:00:00 GMT"
30,Is alcohol legal in Qatar? Here are the drinking rules for the FIFA World Cup - MarketWatch,"Fri, 18 Nov 2022 08:00:00 GMT"
31,Donald Trump announces 2024 presidential run: ‘America’s comeback starts right now’ - MarketWatch,"Tue, 15 Nov 2022 08:00:00 GMT"
32,Elizabeth Holmes sentenced to over 11 years in prison for Theranos crimes - MarketWatch,"Fri, 18 Nov 2022 08:00:00 GMT"
33,CDLX Stock Price | Cardlytics Inc. Stock Quote (U.S.: Nasdaq) - MarketWatch,"Sat, 13 Jan 2018 00:48:57 GMT"
34,‘This situation is unprecedented’: 10 crazy things detailed in FTX’s bankruptcy filing - MarketWatch,"Thu, 17 Nov 2022 08:00:00 GMT"
35,"Progressive Corp. stock rises Tuesday, still underperforms market - MarketWatch","Tue, 22 Nov 2022 08:00:00 GMT"
36,Watch Jerome Powell’s speech at Brookings here - MarketWatch,"Wed, 30 Nov 2022 08:00:00 GMT"
37,SST Stock Price | System1 Inc. Stock Quote (U.S.: NYSE) - MarketWatch,"Thu, 16 Nov 2017 15:43:22 GMT"
38,"Hardship withdrawals from 401(k)s reach ‘concerning’ all-time high, Vanguard says - MarketWatch","Wed, 30 Nov 2022 08:00:00 GMT"
39,Qatar’s World Cup ambassador calls homosexuality ‘spiritual harm’ - MarketWatch,"Tue, 08 Nov 2022 08:00:00 GMT"
40,Fewer people are leasing cars—what it means for the used car market - MarketWatch,"Wed, 09 Nov 2022 08:00:00 GMT"
41,Morgan Housel turned parking lessons into a finance book that’s sold 2M copies - MarketWatch,"Wed, 02 Nov 2022 07:00:00 GMT"
42,RGTI | Rigetti Computing Inc. Profile - MarketWatch,"Fri, 25 Nov 2022 05:15:42 GMT"
43,FTX bankruptcy: Can account holders expect to get their money back? - MarketWatch,"Fri, 11 Nov 2022 08:00:00 GMT"
44,Tech hiring is slowing down — these two charts explain how and why - MarketWatch,"Mon, 21 Nov 2022 08:00:00 GMT"
45,Palantir stock falls after earnings as revenue growth slows - MarketWatch,"Mon, 07 Nov 2022 08:00:00 GMT"
46,CLEV Stock Price | Concrete Leveling Systems Inc. Stock Quote (U.S.: OTC) - MarketWatch,"Tue, 03 Oct 2017 09:34:35 GMT"
47,You need to understand the FTX debacle even if you have no investments in crypto - MarketWatch,"Fri, 11 Nov 2022 08:00:00 GMT"
48,MMSI Stock Price | Merit Medical Systems Inc. Stock Quote (U.S.: Nasdaq) - MarketWatch,"Fri, 22 Jul 2016 04:41:29 GMT"
49,Opinion: China’s economy is rotting from the head - MarketWatch,"Thu, 17 Nov 2022 08:00:00 GMT"
50,Paul Pelosi released from hospital a week after hammer attack - MarketWatch,"Thu, 03 Nov 2022 07:00:00 GMT"
51,More than $2 trillion in stock options expire Friday with put-call ratio near levels unseen since 2001 - MarketWatch,"Fri, 18 Nov 2022 08:00:00 GMT"
52,CCJ Stock Price | Cameco Corp. Stock Quote (U.S.: NYSE) - MarketWatch,"Tue, 07 Jun 2016 12:30:34 GMT"
53,NRL Stock Price | National Refinery Ltd. Stock Quote (Pakistan Stock Exchange) - MarketWatch,"Wed, 27 Dec 2017 03:51:56 GMT"
54,RAMP Stock Price | LiveRamp Holdings Inc. Stock Quote (U.S.: NYSE) - MarketWatch,"Tue, 02 Oct 2018 14:52:05 GMT"
55,Blood moon: What time is the lunar eclipse on Election Day? - MarketWatch,"Sun, 06 Nov 2022 07:00:00 GMT"
56,"Omnicom Group Inc. stock rises Tuesday, outperforms market - MarketWatch","Tue, 22 Nov 2022 08:00:00 GMT"
57,"It’s sexy, it’s fast. It’s…the new Toyota Prius? - MarketWatch","Mon, 21 Nov 2022 08:00:00 GMT"
58,"A 'cascade of margin calls' deleveraging, crypto failures and bitcoin at $13,000 are likely amid FTX fallout - MarketWatch","Thu, 10 Nov 2022 08:00:00 GMT"
59,"Arizona county, 3 N.C. precincts report voting problems - MarketWatch","Tue, 08 Nov 2022 08:00:00 GMT"
60,ACRV | Acrivon Therapeutics Inc. Analyst Estimates - MarketWatch,"Mon, 14 Nov 2022 01:21:15 GMT"
61,"Sempra stock rises Wednesday, outperforms market - MarketWatch","Wed, 23 Nov 2022 08:00:00 GMT"
62,"U.S. stocks finish lower Monday, with losses accelerating toward closing bell - MarketWatch","Mon, 14 Nov 2022 08:00:00 GMT"
63,CYBT Stock Price | Cybeats Technologies Corp. Stock Quote (Canadian Securities Exchange) - MarketWatch,"Fri, 18 Nov 2022 21:01:50 GMT"
64,"These are the $30,000 questions you need to ask yourself if you want to get richer, says personal finance guru Ramit Sethi (and psst: pros say he’s got a point) - MarketWatch","Sat, 05 Nov 2022 07:00:00 GMT"
65,YMAG | YieldMax Magnificent 7 Fund of Option Income ETF Overview - MarketWatch,"Thu, 01 Feb 2024 22:48:29 GMT"
66,Could Qatar’s ‘reusable’ World Cup stadium end up in Uruguay? There are some amazing plans for tournament venues. - MarketWatch,"Tue, 22 Nov 2022 08:00:00 GMT"
67,HSII Stock Price | Heidrick & Struggles International Inc. Stock Quote (U.S.: Nasdaq) - MarketWatch,"Tue, 03 Oct 2017 09:20:33 GMT"
68,The long-term-care system is broken. How can we fix it? - MarketWatch,"Thu, 03 Nov 2022 07:00:00 GMT"
69,Banks explore reimbursing customers who send money to scam Zelle accounts - MarketWatch,"Mon, 28 Nov 2022 08:00:00 GMT"
70,MASS Stock Price | 908 Devices Inc. Stock Quote (U.S.: Nasdaq) - MarketWatch,"Thu, 17 Dec 2020 23:53:15 GMT"
71,Trulieve issues cautious guidance ahead of key holiday season - MarketWatch,"Thu, 10 Nov 2022 08:00:00 GMT"
72,Netflix is interested in carrying live sports: report - MarketWatch,"Tue, 08 Nov 2022 08:00:00 GMT"
73,Exela Technologies Inc. stock underperforms Wednesday when compared to competitors - MarketWatch,"Wed, 23 Nov 2022 08:00:00 GMT"
74,880 Stock Price | SJM Holdings Ltd. Stock Quote (Hong Kong) - MarketWatch,"Mon, 20 Jul 2009 22:21:25 GMT"
75,Budweiser says it will give unused Qatar World Cup beer to Argentina - MarketWatch,"Tue, 22 Nov 2022 08:00:00 GMT"
76,How to approach rebalancing your portfolio this year - MarketWatch,"Fri, 18 Nov 2022 08:00:00 GMT"
77,TRSG Stock Price | Tungray Technologies Inc. Stock Quote (U.S.: Nasdaq) - MarketWatch,"Sat, 11 Mar 2023 06:32:57 GMT"
78,APT Stock Price | Alpha Pro Tech Ltd. Stock Quote (U.S.: NYSE American) - MarketWatch,"Sat, 30 Sep 2017 01:49:11 GMT"
79,600519 Stock Price | Kweichow Moutai Co. Ltd. Stock Quote (China: Shanghai) - MarketWatch,"Tue, 17 Oct 2017 22:41:36 GMT"
80,"Walmart vs. Kroger: How their prices compare on milk, bread, eggs and other grocery essentials - MarketWatch","Fri, 04 Nov 2022 07:00:00 GMT"
81,POCI Stock Price | Precision Optics Corp. Inc. Stock Quote (U.S.: Nasdaq) - MarketWatch,"Thu, 28 Dec 2017 02:45:28 GMT"
82,PAA Stock Price | Plains All American Pipeline L.P. Stock Quote (U.S.: Nasdaq) - MarketWatch,"Tue, 13 Apr 2010 13:13:04 GMT"
83,Twitter adds fact-check to Biden White House's tweet bragging about Social Security's COLA of 8.7% - MarketWatch,"Wed, 02 Nov 2022 07:00:00 GMT"
84,How inflation could affect the price of your Christmas tree - MarketWatch,"Wed, 02 Nov 2022 07:00:00 GMT"
85,U.S. oil prices recover after a drop to their lowest of the year - MarketWatch,"Mon, 28 Nov 2022 08:00:00 GMT"
86,GRND | Grindr Inc. Annual Income Statement - MarketWatch,"Fri, 18 Nov 2022 17:22:25 GMT"
87,Home builder sentiment continues to sour in November - MarketWatch,"Wed, 16 Nov 2022 08:00:00 GMT"
88,"These stocks are burning cash fast and might need to raise capital soon, Goldman Sachs flags - MarketWatch","Tue, 22 Nov 2022 08:00:00 GMT"
89,Hedge-fund giant Elliott warns looming hyperinflation could lead to ‘global societal collapse’ - MarketWatch,"Thu, 03 Nov 2022 07:00:00 GMT"
90,SNAL Stock Price | Snail Inc. Cl A Stock Quote (U.S.: Nasdaq) - MarketWatch,"Mon, 17 Oct 2022 19:07:25 GMT"
91,Trulieve misses revenue mark after Hurricane Ian and price pressure - MarketWatch,"Thu, 10 Nov 2022 08:00:00 GMT"
92,Kathy Griffin kicked off Twitter as ‘free-speech absolutist’ Elon Musk cracks down on parody accounts targeting him - MarketWatch,"Mon, 07 Nov 2022 08:00:00 GMT"
93,"Applovin stock falls 5% following earnings miss, another outlook cut - MarketWatch","Thu, 10 Nov 2022 08:00:00 GMT"
94,"Dodge’s electric muscle car emerges, and it will still rumble - MarketWatch","Mon, 07 Nov 2022 08:00:00 GMT"
95,Year-end rally? Bullish stock-market pattern set to collide with stagflation fears - MarketWatch,"Sat, 26 Nov 2022 08:00:00 GMT"
96,‘Era of cheap’ copper prices may be coming to an end - MarketWatch,"Thu, 10 Nov 2022 08:00:00 GMT"
97,SMWB Stock Price | Similarweb Ltd. Stock Quote (U.S.: NYSE) - MarketWatch,"Thu, 15 Apr 2021 22:58:05 GMT"
98,"Average savings by age: How much to save in your 20s, 30s, 40s, 50s and 60s - MarketWatch","Sat, 05 Nov 2022 07:00:00 GMT"
99,Americans are buying more luxury cars than ever - MarketWatch,"Wed, 09 Nov 2022 08:00:00 GMT"
