,Title,Date
0,Berry Petroleum downgraded to underweight from sector weight at KeyBanc Capital - MarketWatch,"Wed, 20 Nov 2019 08:00:00 GMT"
1,These public colleges offer a better return on investment than most private colleges — 10 and 40 years after graduation - MarketWatch,"Sat, 30 Nov 2019 08:00:00 GMT"
2,In the Elevator With YouTuber and Former NASA Engineer Mark Rober - MarketWatch,"Wed, 23 Jun 2021 23:47:25 GMT"
3,ROKT Holdings - MarketWatch,"Sat, 30 Nov 2019 07:18:11 GMT"
4,Wall Street fears repeat of May’s stock-market rout as talk of impasse on U.S.-China phase-one deal heats up - MarketWatch,"Thu, 21 Nov 2019 08:00:00 GMT"
5,"AARP exec: ‘OK, millennials …. we’re the people that actually have the money’ - MarketWatch","Sat, 16 Nov 2019 08:00:00 GMT"
6,Nothing says Christmas like $30 Trump Pence wrapping paper and $60 ‘Keep America Great’ ornaments - MarketWatch,"Thu, 14 Nov 2019 08:00:00 GMT"
7,"CNBC’s Jim Cramer, a longtime Tesla critic, says he might be about to buy a Model X — because his wife says so - MarketWatch","Sat, 30 Nov 2019 08:00:00 GMT"
8,How to survive working with your harasser - MarketWatch,"Wed, 20 Nov 2019 08:00:00 GMT"
9,"Climate change will break the housing market, says David Burt, who predicted the 2008 financial crisis - MarketWatch","Sat, 09 Nov 2019 08:00:00 GMT"
10,Cheers! A single shot of this whisky costs more than a Porsche 911 Carrera - MarketWatch,"Sat, 02 Nov 2019 07:00:00 GMT"
11,FAANG companies’ employees donate most often to this presidential candidate - MarketWatch,"Fri, 01 Nov 2019 07:00:00 GMT"
12,PTA | Cohen & Steers Tax-Advantaged Preferred Securities & Income Fund Overview - MarketWatch,"Fri, 30 Oct 2020 00:51:43 GMT"
13,The 2020 Ford Mustang: You’re in for a good time - MarketWatch,"Tue, 26 Nov 2019 08:00:00 GMT"
14,Dow and S&P 500 are guaranteed to rise at least another 5% in the next 2 months — if this 70-year-old pattern holds - MarketWatch,"Sat, 02 Nov 2019 07:00:00 GMT"
15,Molson Coors wants to make ‘Miller Time’ cool for millennials - MarketWatch,"Sat, 02 Nov 2019 07:00:00 GMT"
16,Opinion: Trump’s latest idea to squeeze China could squeeze you - MarketWatch,"Tue, 26 Nov 2019 08:00:00 GMT"
17,Warren Buffett increases Apple stake despite selling some stock - MarketWatch,"Mon, 18 Nov 2019 08:00:00 GMT"
18,‘The Apprentice: White House’? President Trump is reportedly considering it - MarketWatch,"Thu, 07 Nov 2019 08:00:00 GMT"
19,"Stock buybacks of $570 billion next year may support the S&P 500 even if there’s a recession, report says - MarketWatch","Wed, 13 Nov 2019 08:00:00 GMT"
20,Chaos sweeps Bolivia as ousted president Morales accepts asylum in Mexico - MarketWatch,"Mon, 11 Nov 2019 08:00:00 GMT"
21,"Drake is trying to trademark Canada’s pot warning label, and may be in for a fight - MarketWatch","Mon, 11 Nov 2019 08:00:00 GMT"
22,Opinion: The U.S. stock market rally is built on a crumbling base - MarketWatch,"Fri, 22 Nov 2019 08:00:00 GMT"
23,SOMS Stock Price | Shell Oman Marketing Co. S.A.O.G. Stock Quote (Muscat Securities Market) - MarketWatch,"Sun, 15 Oct 2017 23:26:59 GMT"
24,Opinion: How the slump in manufacturing created overblown fears of a recession - MarketWatch,"Sat, 02 Nov 2019 07:00:00 GMT"
25,Victoria’s Secret Fashion Show canceled as talk of a spinoff or Bath & Body Works IPO arises again - MarketWatch,"Sat, 23 Nov 2019 08:00:00 GMT"
26,GSFD Stock Price | Global Seafood Technologies Inc. Stock Quote (U.S.: OTC) - MarketWatch,"Tue, 17 Oct 2017 21:55:24 GMT"
27,More than a third of millennials polled approve of communism - MarketWatch,"Sat, 02 Nov 2019 07:00:00 GMT"
28,Uber co-founder Travis Kalanick has dumped more than $700 million in stock since last week - MarketWatch,"Sat, 16 Nov 2019 08:00:00 GMT"
29,The No. 1 thing people with fat savings accounts scrimp on that you likely don’t - MarketWatch,"Sat, 16 Nov 2019 08:00:00 GMT"
30,PATH | UiPath Inc. Profile - MarketWatch,"Fri, 23 Apr 2021 04:53:59 GMT"
31,"Kamala Harris, Maxine Waters release $100 billion affordable housing bill - MarketWatch","Fri, 22 Nov 2019 08:00:00 GMT"
32,Tesla’s broken-window Cybertruck debut leaves the internet divided - MarketWatch,"Fri, 22 Nov 2019 08:00:00 GMT"
33,Tesla’s Musk and Greenlight CEO lock horns in fiery Twitter feud - MarketWatch,"Sun, 10 Nov 2019 08:00:00 GMT"
34,All the reasons Trump’s move from New York to Florida for tax purposes could be ‘doomed’ - MarketWatch,"Mon, 04 Nov 2019 08:00:00 GMT"
35,"In stunner, Democrats flip both houses of Virginia’s state legislature - MarketWatch","Tue, 05 Nov 2019 08:00:00 GMT"
36,Donald Trump Jr. and girlfriend heckled off stage — by Trump supporters - MarketWatch,"Sat, 16 Nov 2019 08:00:00 GMT"
37,"The big worries facing stock investors in 2020, according to Citi’s top equity strategist - MarketWatch","Sat, 16 Nov 2019 08:00:00 GMT"
38,DRG | NYSE Arca Pharmaceutical Index Overview - MarketWatch,"Tue, 26 Apr 2011 16:39:48 GMT"
39,That’s ruff: White House mixes up hero dog’s gender - MarketWatch,"Tue, 26 Nov 2019 08:00:00 GMT"
40,5 life lessons from the ‘Crocodile Hunter’ on Steve Irwin Day - MarketWatch,"Fri, 15 Nov 2019 08:00:00 GMT"
41,A climate-change fix is the ‘biggest investment opportunity in history’: Al Gore to millennials - MarketWatch,"Fri, 22 Nov 2019 08:00:00 GMT"
42,Get good deals on these cars with high inventory - MarketWatch,"Wed, 13 Nov 2019 08:00:00 GMT"
43,SLAM Stock Price | Sanlam Kenya PLC Stock Quote (Nairobi Stock Exchange) - MarketWatch,"Tue, 05 Nov 2019 14:20:39 GMT"
44,Chick-fil-A will stop donating to the Salvation Army and Fellowship of Christian Athletes — and people are furious - MarketWatch,"Sat, 23 Nov 2019 08:00:00 GMT"
45,"About 55% of wealthy investors are bracing for a ‘significant drop’ in stocks before the end of 2020, UBS survey shows - MarketWatch","Sat, 16 Nov 2019 08:00:00 GMT"
46,TSLA34 | Tesla Inc. BDR Overview - MarketWatch,"Thu, 28 Nov 2019 13:48:58 GMT"
47,NRSA | NTG Nordic Transport Group A/S Advanced Charts - MarketWatch,"Thu, 28 Nov 2019 15:09:16 GMT"
48,Colgate reveals to competitors how it makes completely recyclable toothpaste tube - MarketWatch,"Thu, 21 Nov 2019 08:00:00 GMT"
49,Opinion: The real reason for Trump’s meltdowns - MarketWatch,"Sat, 09 Nov 2019 08:00:00 GMT"
50,Here’s why McDonald’s investors are upset Easterbrook is out as CEO - MarketWatch,"Sat, 09 Nov 2019 08:00:00 GMT"
51,Fed’s Bostic says he didn’t support last month’s interest-rate cut - MarketWatch,"Fri, 08 Nov 2019 08:00:00 GMT"
52,Are stock-market investors underestimating the chances of a recession in 2020? - MarketWatch,"Sat, 30 Nov 2019 08:00:00 GMT"
53,"The next six months will be ‘golden’ for homebuilder stocks, analysts say - MarketWatch","Wed, 06 Nov 2019 08:00:00 GMT"
54,‘Mattress Mack’ says he lost $13 million betting on the Houston Astros. Silver lining? The attention he got was worth $8.6 million for his store - MarketWatch,"Sat, 02 Nov 2019 07:00:00 GMT"
55,Bank of America declares ‘the end of the 60-40’ standard portfolio - MarketWatch,"Sat, 09 Nov 2019 08:00:00 GMT"
56,This is the No. 1 cruise line for your money - MarketWatch,"Sat, 16 Nov 2019 08:00:00 GMT"
57,‘This is the most prosperous economy the world has ever seen’ says Jamie Dimon — and it’s going to continue - MarketWatch,"Sat, 16 Nov 2019 08:00:00 GMT"
58,Trump says he’s ‘looking’ at exempting Apple from China tariffs - MarketWatch,"Thu, 21 Nov 2019 08:00:00 GMT"
59,3071 Stock Price | ADDA Corp. Stock Quote (Taipei Exchange) - MarketWatch,"Sun, 22 Oct 2017 11:32:48 GMT"
60,This analysis of 40 million Uber rides reveals exactly how much people tip — and whether men or women are more generous - MarketWatch,"Fri, 29 Nov 2019 08:00:00 GMT"
61,"Tesla’s Cybertruck doesn’t look street legal, but pre-orders are pouring in - MarketWatch","Mon, 25 Nov 2019 08:00:00 GMT"
62,TELA | TELA Bio Inc. Analyst Estimates - MarketWatch,"Sat, 09 Nov 2019 04:32:20 GMT"
63,Opinion: Stocks are likely to slide in coming weeks because market-timers are too bullish - MarketWatch,"Sat, 23 Nov 2019 08:00:00 GMT"
64,"Before you sign up for Disney+, use this calculator to add up the ‘true’ cost of your streaming services - MarketWatch","Thu, 21 Nov 2019 08:00:00 GMT"
65,Why investors need to tread carefully now that Schwab is merging with Ameritrade - MarketWatch,"Thu, 28 Nov 2019 08:00:00 GMT"
66,Disney stock surges to record high on the ‘eye-popping’ subscription number for Disney+ - MarketWatch,"Thu, 14 Nov 2019 08:00:00 GMT"
67,MYTIL Stock Price | Metlen Energy & Metals S.A. Stock Quote (Greece: Athens) - MarketWatch,"Tue, 17 Oct 2017 22:43:41 GMT"
68,"PayPal puts $4 billion into Honey’s pot, but it’s a sweet deal, analysts say - MarketWatch","Thu, 21 Nov 2019 08:00:00 GMT"
69,"‘Women are judged for being emotional’ — yet it’s more acceptable for men to get upset and angry, female executives say - MarketWatch","Fri, 29 Nov 2019 08:00:00 GMT"
70,IAN Stock Price | iAnthus Capital Holdings Inc. Stock Quote (Canadian Securities Exchange) - MarketWatch,"Fri, 31 May 2019 20:24:43 GMT"
71,Major stakeholders criticize SoftBank over bad investments - MarketWatch,"Tue, 26 Nov 2019 08:00:00 GMT"
72,Why are so many people over 55 going bankrupt? - MarketWatch,"Tue, 12 Nov 2019 08:00:00 GMT"
73,Taylor Swift is squaring off with private-equity giant Carlyle Group — here’s how the combatants stack up - MarketWatch,"Tue, 19 Nov 2019 08:00:00 GMT"
74,How the latest steps by Alipay and WeChat bring China closer to replacing cash with cellphones - MarketWatch,"Wed, 06 Nov 2019 08:00:00 GMT"
75,XINC | iShares Core Income Balanced ETF Portfolio Advanced Charts - MarketWatch,"Thu, 28 Nov 2019 03:29:14 GMT"
76,Elon Musk says he chose Berlin over U.K. for Tesla battery factory due to Brexit - MarketWatch,"Wed, 13 Nov 2019 08:00:00 GMT"
77,RMTI Stock Price | Rockwell Medical Inc. Stock Quote (U.S.: Nasdaq) - MarketWatch,"Fri, 29 Sep 2017 23:36:36 GMT"
78,"Giving your time to help others, rather than your money, may help you live longer - MarketWatch","Thu, 28 Nov 2019 08:00:00 GMT"
79,Sorrento Therapeutics shares soar 25% after it rejects offer from two companies - MarketWatch,"Mon, 25 Nov 2019 08:00:00 GMT"
80,Drake’s attempt to trademark Canada’s weed warning label hits a stop sign - MarketWatch,"Sat, 23 Nov 2019 08:00:00 GMT"
81,BAP Stock Price | Credicorp Ltd. Stock Quote (U.S.: NYSE) - MarketWatch,"Tue, 07 Jun 2016 12:30:34 GMT"
82,"Tesla unveils its Cybertruck: An angular electric pickup starting at $39,900 - MarketWatch","Sat, 23 Nov 2019 08:00:00 GMT"
83,5099 | Capital A Bhd Advanced Charts - MarketWatch,"Fri, 29 Nov 2019 15:56:12 GMT"
84,‘Wake up!’ Former Moonie says the ‘Cult of Trump’ needs ‘deprogramming’ - MarketWatch,"Sat, 30 Nov 2019 08:00:00 GMT"
85,Opinion: The U.S. can slash health-care costs 75% with 2 fundamental changes — and without ‘Medicare for All’ - MarketWatch,"Sat, 09 Nov 2019 08:00:00 GMT"
86,New York City to move iconic Wall Street Bull statue - MarketWatch,"Fri, 08 Nov 2019 08:00:00 GMT"
87,3088 Stock Price | AXIOMTEK Co. Ltd. Stock Quote (Taipei Exchange) - MarketWatch,"Sat, 21 Oct 2017 04:12:20 GMT"
88,Asian markets fall as Trump threatens more tariff hikes on China - MarketWatch,"Wed, 13 Nov 2019 08:00:00 GMT"
89,Cronos turns lower after kicking off cannabis earnings with revenue miss - MarketWatch,"Wed, 13 Nov 2019 08:00:00 GMT"
90,Opinion: Holiday scams to watch out for - MarketWatch,"Tue, 26 Nov 2019 08:00:00 GMT"
91,Where you live may affect how many years you have left - MarketWatch,"Wed, 27 Nov 2019 08:00:00 GMT"
92,PROSF | Prosus N.V. Analyst Estimates - MarketWatch,"Fri, 29 Nov 2019 19:14:00 GMT"
93,JPM.PRC | JPMorgan Chase & Co. Dep. Pfd. (Rep. 1/400th Pfd. Series EE) Advanced Charts - MarketWatch,"Wed, 27 Nov 2019 21:42:27 GMT"
94,U.S. industrial output falls by most in 17 months in October - MarketWatch,"Fri, 15 Nov 2019 08:00:00 GMT"
95,"Australian banking giant, Westpac, accused of massive money-laundering breaches - MarketWatch","Wed, 20 Nov 2019 08:00:00 GMT"
96,728 Stock Price | China Telecom Corp. Ltd. Stock Quote (Hong Kong) - MarketWatch,"Mon, 20 Jul 2009 00:43:53 GMT"
97,Here’s how the stock market tends to perform after the Fed cuts interest rates 3 times in a row - MarketWatch,"Sat, 02 Nov 2019 07:00:00 GMT"
98,Republican incumbent concedes Kentucky gubernatorial race nine days after election - MarketWatch,"Thu, 14 Nov 2019 08:00:00 GMT"
99,Critics say KKR’s ‘responsible investment’ stance is being clouded by its stake in a controversial tear-gas maker - MarketWatch,"Mon, 25 Nov 2019 08:00:00 GMT"
