,Title,Date
0,S&T Bancorp upgraded to outperform from neutral at Boenning & Scattergood - MarketWatch,"Mon, 22 Feb 2016 08:00:00 GMT"
1,British rock band Viola Beach killed in crash in Sweden - MarketWatch,"Sun, 14 Feb 2016 08:00:00 GMT"
2,Electrolux appoints Anna Ohlsson-Leijon as new CFO - MarketWatch,"Tue, 23 Feb 2016 08:00:00 GMT"
3,Warren Buffett’s advice couldn’t be more simple...and it’s more relevant than ever today - MarketWatch,"Fri, 12 Feb 2016 08:00:00 GMT"
4,"By this measure, Donald Trump sounds more liberal than Bernie Sanders - MarketWatch","Wed, 24 Feb 2016 08:00:00 GMT"
5,The average American will spend 43 days of his life on hold - MarketWatch,"Thu, 04 Feb 2016 08:00:00 GMT"
6,Why Tom DeMark is predicting an ugly March for the S&P 500 - MarketWatch,"Fri, 26 Feb 2016 08:00:00 GMT"
7,"Kroger, Fresh Market & Sprouts are grocery store winners in ‘barbell’-shaped market - MarketWatch","Fri, 12 Feb 2016 08:00:00 GMT"
8,The number one reason people go to the ER - MarketWatch,"Mon, 15 Feb 2016 08:00:00 GMT"
9,Credit Suisse swings to massive loss after write down - MarketWatch,"Thu, 04 Feb 2016 08:00:00 GMT"
10,The simple reason President Obama can’t cure cancer - MarketWatch,"Thu, 04 Feb 2016 08:00:00 GMT"
11,5 worst investment calls of this century - MarketWatch,"Sat, 13 Feb 2016 08:00:00 GMT"
12,BPTH | Bio-Path Holdings Inc. Options - MarketWatch,"Tue, 31 Oct 2017 18:31:05 GMT"
13,Why Obama says Republicans should ignore Biden’s Supreme Court comment - MarketWatch,"Wed, 24 Feb 2016 08:00:00 GMT"
14,Why some Americans are using 8-year loans to buy fancier cars - MarketWatch,"Wed, 17 Feb 2016 08:00:00 GMT"
15,New York City wants to ban chewing tobacco at the ballpark - MarketWatch,"Fri, 26 Feb 2016 08:00:00 GMT"
16,Here’s why Daraprim still costs $750 a pill - MarketWatch,"Thu, 04 Feb 2016 08:00:00 GMT"
17,Tour this $22 million Marbella mansion built from marble - MarketWatch,"Fri, 12 Feb 2016 08:00:00 GMT"
18,Monopoly trades colorful currency for bank cards in its ‘Ultimate Banking’ game - MarketWatch,"Tue, 16 Feb 2016 08:00:00 GMT"
19,KWEB | KraneShares CSI China Internet ETF Advanced Charts - MarketWatch,"Thu, 19 Oct 2017 08:20:43 GMT"
20,A $500 Tesla? Radio Flyer launches Model S for kids - MarketWatch,"Wed, 17 Feb 2016 08:00:00 GMT"
21,"In the luxury real estate market, ‘sex’ sells - MarketWatch","Thu, 18 Feb 2016 08:00:00 GMT"
22,10 things that keep your retirement planner up at night - MarketWatch,"Sat, 06 Feb 2016 08:00:00 GMT"
23,Big British companies line up against ‘Brexit’ - MarketWatch,"Tue, 23 Feb 2016 08:00:00 GMT"
24,"Fox executives didn’t understand ‘Deadpool,’ but took the risk anyway - MarketWatch","Wed, 17 Feb 2016 08:00:00 GMT"
25,Nike’s Phil Knight explains why he gave Stanford $400 million - MarketWatch,"Wed, 24 Feb 2016 08:00:00 GMT"
26,Read the letter Tim Cook wrote to Apple employees today - MarketWatch,"Mon, 22 Feb 2016 08:00:00 GMT"
27,Watch all of the government debt in the world grow in real time - MarketWatch,"Mon, 22 Feb 2016 08:00:00 GMT"
28,"Dow closes at 2-year low, dogged by global market turmoil - MarketWatch","Thu, 11 Feb 2016 08:00:00 GMT"
29,6134 Stock Price | Fuji Corp. Stock Quote (Japan: Tokyo) - MarketWatch,"Sat, 21 Oct 2017 08:13:57 GMT"
30,Struggling LeapFrog bought by VTech for $72 million - MarketWatch,"Sun, 07 Feb 2016 08:00:00 GMT"
31,6 ways the Obama administration would make college more affordable - MarketWatch,"Tue, 09 Feb 2016 08:00:00 GMT"
32,Opinion: How Donald Trump could become president by making a deal - MarketWatch,"Wed, 10 Feb 2016 08:00:00 GMT"
33,Japan Turns Harry Potter Into Cartoon-Style Drawings - MarketWatch,"Tue, 02 Feb 2016 08:00:00 GMT"
34,NML Stock Price | Nishat Mills Ltd. Stock Quote (Pakistan Stock Exchange) - MarketWatch,"Sat, 21 Oct 2017 05:19:41 GMT"
35,No Tesla for you! Elon Musk hits back over ‘banning’ outspoken customer - MarketWatch,"Wed, 03 Feb 2016 08:00:00 GMT"
36,Negative interest rates: More bad news for savers - MarketWatch,"Thu, 25 Feb 2016 08:00:00 GMT"
37,Why income investors should consider peer-to-peer lending - MarketWatch,"Wed, 17 Feb 2016 08:00:00 GMT"
38,Alcoholic soda was a $116 million business in 2015 - MarketWatch,"Fri, 26 Feb 2016 08:00:00 GMT"
39,Equinix finds its stock price among the clouds - MarketWatch,"Thu, 04 Feb 2016 08:00:00 GMT"
40,"Mapping America’s distressed communities, zip code by zip code - MarketWatch","Mon, 29 Feb 2016 08:00:00 GMT"
41,BGN Stock Price | Banca Generali S.p.A. Stock Quote (Italy: Milan) - MarketWatch,"Wed, 18 Oct 2017 11:39:14 GMT"
42,Groupon’s stock surge gives big boost to Alibaba and Yahoo shares - MarketWatch,"Tue, 16 Feb 2016 08:00:00 GMT"
43,51% of Americans say Apple should unlock iPhone for the FBI - MarketWatch,"Mon, 22 Feb 2016 08:00:00 GMT"
44,This is the $13 million mansion Lloyd Blankfein can’t sell - MarketWatch,"Fri, 26 Feb 2016 08:00:00 GMT"
45,‘Deadpool’ is Fox’s highest earning Marvel property - MarketWatch,"Mon, 22 Feb 2016 08:00:00 GMT"
46,College students: Here’s a dose of reality from an unlikely source - MarketWatch,"Mon, 08 Feb 2016 08:00:00 GMT"
47,"A baseball signed by JFK is worth $40,000. By Trump? $250 - MarketWatch","Fri, 19 Feb 2016 08:00:00 GMT"
48,Super Bowl ‘rocket’ mortgage ad brings jeers — and loan may not be so quick - MarketWatch,"Mon, 08 Feb 2016 08:00:00 GMT"
49,Hedge fund exposure has been bad news for stocks in 2016 - MarketWatch,"Tue, 23 Feb 2016 08:00:00 GMT"
50,Why you might retire to a tiny house — by choice - MarketWatch,"Tue, 23 Feb 2016 08:00:00 GMT"
51,Why a mortgage lender is renaming itself ‘Mr. Cooper’ - MarketWatch,"Thu, 25 Feb 2016 08:00:00 GMT"
52,North Korea Military Takes Control of Kaesong - MarketWatch,"Thu, 11 Feb 2016 08:00:00 GMT"
53,Opinion: Russia can no longer afford to buy its allies - MarketWatch,"Tue, 23 Feb 2016 08:00:00 GMT"
54,This woman turned her crushing student loan debt into art - MarketWatch,"Fri, 05 Feb 2016 08:00:00 GMT"
55,How to get a free Chipotle burrito - MarketWatch,"Mon, 08 Feb 2016 08:00:00 GMT"
56,‘$1bn here we come.’ — Martin Shkreli told Turing board as Daraprim buy got closer - MarketWatch,"Wed, 03 Feb 2016 08:00:00 GMT"
57,Some say China is behind the dollar’s weakness - MarketWatch,"Fri, 19 Feb 2016 08:00:00 GMT"
58,Fresh Del Monte’s banana problem is linked to drug smuggling - MarketWatch,"Wed, 24 Feb 2016 08:00:00 GMT"
59,David Tepper’s Appaloosa turns bullish on some oil and gas stocks - MarketWatch,"Tue, 16 Feb 2016 08:00:00 GMT"
60,Budweiser insists it didn’t pay Peyton Manning for that $3.2 million in free advertising - MarketWatch,"Mon, 08 Feb 2016 08:00:00 GMT"
61,"Cheap rustic getaways, thanks to Uncle Sam - MarketWatch","Fri, 05 Feb 2016 08:00:00 GMT"
62,How President Kanye West would make college more affordable - MarketWatch,"Wed, 17 Feb 2016 08:00:00 GMT"
63,Jeb Bush says Donald Trump would be worse than Obama - MarketWatch,"Thu, 11 Feb 2016 08:00:00 GMT"
64,BCRX | BioCryst Pharmaceuticals Inc. Analyst Estimates - MarketWatch,"Tue, 16 Feb 2016 09:44:20 GMT"
65,Audi’s Q7 SUV: How it stacks up vs. Volvo’s XC90 - MarketWatch,"Sat, 06 Feb 2016 08:00:00 GMT"
66,Office Depot profit and revenue fall short - MarketWatch,"Tue, 23 Feb 2016 08:00:00 GMT"
67,Now even private-equity firms are buying back their own shares - MarketWatch,"Thu, 11 Feb 2016 08:00:00 GMT"
68,Bebe Stores says Manny Mashouf returns as CEO - MarketWatch,"Fri, 19 Feb 2016 08:00:00 GMT"
69,It's time to forget oil’s impact on stocks - MarketWatch,"Tue, 02 Feb 2016 08:00:00 GMT"
70,This is the bestselling automobile in America - MarketWatch,"Mon, 15 Feb 2016 08:00:00 GMT"
71,The most popular dog breed in America - MarketWatch,"Tue, 23 Feb 2016 08:00:00 GMT"
72,"The robots are coming for jobs that pay $20 an hour or less, White House finds - MarketWatch","Tue, 23 Feb 2016 08:00:00 GMT"
73,"Apple CEO Tim Cook acts like he’s insane, analyst says - MarketWatch","Mon, 01 Feb 2016 08:00:00 GMT"
74,S59 Stock Price | SIA Engineering Co. Ltd. Stock Quote (Singapore: SGX) - MarketWatch,"Wed, 18 Oct 2017 11:13:47 GMT"
75,At least 15 dead in Taiwan earthquake - MarketWatch,"Sat, 06 Feb 2016 08:00:00 GMT"
76,Berkshire Hathaway net worth up $15.4 billion in 2015: annual letter - MarketWatch,"Sat, 27 Feb 2016 08:00:00 GMT"
77,LCEU Holdings - MarketWatch,"Tue, 01 Oct 2019 08:06:11 GMT"
78,Opinion: Hillary Clinton will win because she’s the true conservative in the race - MarketWatch,"Mon, 22 Feb 2016 08:00:00 GMT"
79,NESTLE Stock Price | Nestle Nigeria PLC Stock Quote (Nigerian Stock Exchange) - MarketWatch,"Sun, 26 May 2019 17:47:43 GMT"
80,"Restaurant Brands reports earnings beat, same-store sales growth - MarketWatch","Tue, 16 Feb 2016 08:00:00 GMT"
81,"Move over, China — India will drive future oil-demand growth - MarketWatch","Thu, 11 Feb 2016 08:00:00 GMT"
82,The yen has crossed a critical ‘line in the sand’ - MarketWatch,"Tue, 09 Feb 2016 08:00:00 GMT"
83,A map of where U.S. job growth is spiking - MarketWatch,"Tue, 23 Feb 2016 08:00:00 GMT"
84,Trump blames ‘bad earpiece’ for failing to condemn ex-KKK leader - MarketWatch,"Mon, 29 Feb 2016 08:00:00 GMT"
85,The No. 1 social network by country isn’t always Facebook - MarketWatch,"Fri, 19 Feb 2016 08:00:00 GMT"
86,MTCH | Match Group Inc. Options - MarketWatch,"Sat, 13 Feb 2016 10:26:10 GMT"
87,Biggest money lessons learned by 3 recent college graduates - MarketWatch,"Wed, 24 Feb 2016 08:00:00 GMT"
88,Mexico’s president names new CEO of state-run Pemex - MarketWatch,"Mon, 08 Feb 2016 08:00:00 GMT"
89,Opinion: Chilling ways the global economy echoes 1930s Great Depression era - MarketWatch,"Fri, 19 Feb 2016 08:00:00 GMT"
90,Mark Zuckerberg touts Samsung’s virtual-reality efforts - MarketWatch,"Sun, 21 Feb 2016 08:00:00 GMT"
91,Getting rid of $100 bill would be no easy task - MarketWatch,"Wed, 17 Feb 2016 08:00:00 GMT"
92,Warren Buffett says America is still great - MarketWatch,"Sat, 27 Feb 2016 08:00:00 GMT"
93,Opinion: Gold has no business being this expensive - MarketWatch,"Wed, 03 Feb 2016 08:00:00 GMT"
94,How far can you go on $50 in gas? - MarketWatch,"Sat, 06 Feb 2016 08:00:00 GMT"
95,Mom and dad make up 45% of medical marijuana patients - MarketWatch,"Wed, 24 Feb 2016 08:00:00 GMT"
96,Cars sink through the ice at festival celebrating winter - MarketWatch,"Tue, 09 Feb 2016 08:00:00 GMT"
97,"Saudi Arabia, Russia, Qatar, Venezuela agree to freeze oil production - MarketWatch","Tue, 16 Feb 2016 08:00:00 GMT"
98,"Every major city in the world, captured in one cheeky map - MarketWatch","Tue, 02 Feb 2016 08:00:00 GMT"
99,What did Chipotle workers do today? Here’s what we know - MarketWatch,"Mon, 08 Feb 2016 08:00:00 GMT"
