,Title,Date
0,MING Stock Price | SpareBank 1 SMN Stock Quote (Norway: Oslo) - MarketWatch,"Sat, 21 Oct 2017 09:07:53 GMT"
1,ETF dedicated to pro sports sponsorships steps up to the plate - MarketWatch,"Tue, 11 Jul 2017 07:00:00 GMT"
2,Jeff Bezos’s first Instagram post: ‘ROCKET FACTORY COMING SOON’ - MarketWatch,"Fri, 21 Jul 2017 07:00:00 GMT"
3,Why China fears ‘gray rhino’ risk to fragile financial system - MarketWatch,"Tue, 18 Jul 2017 07:00:00 GMT"
4,"Aaron Judge jersey sells for eye-popping $160,000 at auction - MarketWatch","Mon, 31 Jul 2017 07:00:00 GMT"
5,This is why millennials are fat and broke - MarketWatch,"Tue, 18 Jul 2017 07:00:00 GMT"
6,GOLI Stock Price | Numeral Ltd. Stock Quote (Mauritius Stock Exchange) - MarketWatch,"Tue, 17 Dec 2019 10:52:00 GMT"
7,Is NBA star Stephen Curry still underpaid at $40 million a year? - MarketWatch,"Sun, 02 Jul 2017 07:00:00 GMT"
8,Sean Spicer quits as White House press secretary over Scaramucci hire - MarketWatch,"Fri, 21 Jul 2017 07:00:00 GMT"
9,SECT | Main Sector Rotation ETF Overview - MarketWatch,"Sat, 14 Oct 2017 02:56:00 GMT"
10,Apple supplier Foxconn nearing decision about producing display panels in Wisconsin - MarketWatch,"Mon, 24 Jul 2017 07:00:00 GMT"
11,How preparing for a partner’s death may have saved this company - MarketWatch,"Thu, 13 Jul 2017 07:00:00 GMT"
12,More Americans are renters now than at any time in the last 50 years - MarketWatch,"Fri, 21 Jul 2017 07:00:00 GMT"
13,BEZ Stock Price | Berentzen-Gruppe AG Stock Quote (Germany: Frankfurt ) - MarketWatch,"Wed, 18 Oct 2017 09:47:18 GMT"
14,Imagine a world with no more traffic lights - MarketWatch,"Thu, 06 Jul 2017 07:00:00 GMT"
15,Green Party presidential candidate Jill Stein says Democrats are still scapegoating - MarketWatch,"Mon, 03 Jul 2017 07:00:00 GMT"
16,Americans are giving bitcoin as a wedding gift - MarketWatch,"Tue, 04 Jul 2017 07:00:00 GMT"
17,Stock-market benchmarks ring up records as Morgan Stanley fosters buying spirits - MarketWatch,"Wed, 19 Jul 2017 07:00:00 GMT"
18,"Opinion: If the stock market can make you rich, why are so many Americans poor? - MarketWatch","Wed, 26 Jul 2017 07:00:00 GMT"
19,BRNL Stock Price | Brunel International N.V. Stock Quote (Netherlands: Euronext Amsterdam) - MarketWatch,"Wed, 18 Oct 2017 14:11:53 GMT"
20,What is a mancation and why are men taking them? - MarketWatch,"Fri, 21 Jul 2017 07:00:00 GMT"
21,Trump lashes out as new poll finds record low approval rating - MarketWatch,"Sun, 16 Jul 2017 07:00:00 GMT"
22,"First Solar, SunPower shares rise amid new contracts - MarketWatch","Wed, 19 Jul 2017 07:00:00 GMT"
23,"‘Dunkirk’ director Christopher Nolan rips Netflix, praises Amazon - MarketWatch","Wed, 19 Jul 2017 07:00:00 GMT"
24,"Chaotic clashes in Hamburg between police, G-20 demonstrators - MarketWatch","Thu, 06 Jul 2017 07:00:00 GMT"
25,The stock market may not be able to defy gravity for much longer - MarketWatch,"Wed, 12 Jul 2017 07:00:00 GMT"
26,Mattel could get wrecked by weak ‘Cars 3’ toy sales - MarketWatch,"Mon, 31 Jul 2017 07:00:00 GMT"
27,"After defending Trump Jr.’s meeting, Rohrabacher says bitcoin world needs to adopt know-your-customer procedures - MarketWatch","Fri, 14 Jul 2017 07:00:00 GMT"
28,ATOM | Atomera Inc. Profile - MarketWatch,"Fri, 09 Oct 2020 05:08:29 GMT"
29,Don’t have a college degree? These are the industries with the best-paid jobs - MarketWatch,"Sat, 29 Jul 2017 07:00:00 GMT"
30,7911 Stock Price | Toppan Holdings Inc. Stock Quote (Japan: Tokyo) - MarketWatch,"Sat, 21 Oct 2017 01:10:24 GMT"
31,"Sorry, America, but everything you’ve heard about lonely, unhappy single people is wrong - MarketWatch","Mon, 10 Jul 2017 07:00:00 GMT"
32,TNA | Direxion Daily Small Cap Bull 3x Shares Annual Income Statement - MarketWatch,"Sat, 16 Oct 2021 03:42:36 GMT"
33,Opinion: Social Security is the biggest challenge facing us - MarketWatch,"Wed, 05 Jul 2017 07:00:00 GMT"
34,The U.S. stock market is the world’s most expensive - MarketWatch,"Thu, 20 Jul 2017 07:00:00 GMT"
35,"U.S. to ban tourist visits to North Korea, tour operators say - MarketWatch","Fri, 21 Jul 2017 07:00:00 GMT"
36,Trump says France’s first lady ‘in such good shape’ - MarketWatch,"Thu, 13 Jul 2017 07:00:00 GMT"
37,Here is why your savings rate is more important than your investments’ returns - MarketWatch,"Fri, 21 Jul 2017 07:00:00 GMT"
38,Here’s how to fix the airline travel nightmare - MarketWatch,"Fri, 07 Jul 2017 07:00:00 GMT"
39,"Bitcoin may have reached a tipping point, now that ‘Downtown’ Josh Brown just invested - MarketWatch","Fri, 21 Jul 2017 07:00:00 GMT"
40,This is exactly how often cocaine and feces show up on your dollar bills - MarketWatch,"Tue, 11 Jul 2017 07:00:00 GMT"
41,SUS Stock Price | Surgical Science Sweden AB Stock Quote (Sweden: Stockholm) - MarketWatch,"Sat, 21 Oct 2017 06:08:53 GMT"
42,034020 Stock Price | Doosan Enerbility Co. Ltd. Stock Quote (S. Korea: KRX) - MarketWatch,"Wed, 18 Oct 2017 22:21:24 GMT"
43,AKAM | Akamai Technologies Inc. Quarterly Cash Flow Statement - MarketWatch,"Tue, 25 Jul 2017 06:32:30 GMT"
44,The legacy and luck of Vanguard’s Jack Bogle - MarketWatch,"Mon, 17 Jul 2017 07:00:00 GMT"
45,European stocks log biggest gain in 2½ months after Yellen testimony - MarketWatch,"Wed, 12 Jul 2017 07:00:00 GMT"
46,Opinion: Why the U.S. Postal Service gives Amazon special delivery - MarketWatch,"Sat, 15 Jul 2017 07:00:00 GMT"
47,"Trump puts his hands together for ‘the late, great Abraham Lincoln’ - MarketWatch","Thu, 27 Jul 2017 07:00:00 GMT"
48,RDTE | Roundhill Russell 2000 0DTE Covered Call Strategy ETF Overview - MarketWatch,"Fri, 13 Sep 2024 23:38:25 GMT"
49,BRACBANK Stock Price | BRAC Bank Ltd. Stock Quote (Dhaka Stock Exchange) - MarketWatch,"Wed, 18 Oct 2017 09:50:52 GMT"
50,Why Neurocrine is charging twice as much for its new drug as it said it would - MarketWatch,"Wed, 05 Jul 2017 07:00:00 GMT"
51,"When Bill Gates and Mark Zuckerberg sound the same dire warning about jobs, it’s time to listen - MarketWatch","Fri, 07 Jul 2017 07:00:00 GMT"
52,PetIQ prices initial public offering at high end of range - MarketWatch,"Thu, 20 Jul 2017 07:00:00 GMT"
53,"Meet Fiona, the Cincinnati Zoo’s $200,000 baby hippo - MarketWatch","Thu, 20 Jul 2017 07:00:00 GMT"
54,ANG Stock Price | Austin Engineering Ltd. Stock Quote (Australia: Sydney) - MarketWatch,"Fri, 20 Oct 2017 01:51:44 GMT"
55,"Jeff Bezos was the richest person in the world, for half a day - MarketWatch","Thu, 27 Jul 2017 07:00:00 GMT"
56,Two cancer drug prices have already been hiked by 8% this year - MarketWatch,"Sat, 08 Jul 2017 07:00:00 GMT"
57,This is how many months black women need to work to earn the same as white men - MarketWatch,"Mon, 31 Jul 2017 07:00:00 GMT"
58,This is how much American parents spend on their kids’ education - MarketWatch,"Mon, 03 Jul 2017 07:00:00 GMT"
59,San Francisco is paying people $10 a month to save money - MarketWatch,"Tue, 04 Jul 2017 07:00:00 GMT"
60,Amazon’s stock drop after results is the smallest in seven years - MarketWatch,"Mon, 31 Jul 2017 07:00:00 GMT"
61,Beware of the curse of the number 7 in the stock market - MarketWatch,"Fri, 21 Jul 2017 07:00:00 GMT"
62,LDTC Stock Price | LeddarTech Holdings Inc. Stock Quote (U.S.: Nasdaq) - MarketWatch,"Fri, 22 Dec 2023 16:02:39 GMT"
63,Elon Musk warns AI is humanity’s biggest threat - MarketWatch,"Sun, 16 Jul 2017 07:00:00 GMT"
64,JAGX | Jaguar Health Inc. Advanced Charts - MarketWatch,"Fri, 20 Oct 2017 05:58:47 GMT"
65,"Young, married women should learn this skill — and we don’t mean cooking - MarketWatch","Sat, 29 Jul 2017 07:00:00 GMT"
66,"Housing starts jump as construction, home buying get back on track - MarketWatch","Wed, 19 Jul 2017 07:00:00 GMT"
67,"The highest paid athletes in the world, in one chart - MarketWatch","Sat, 29 Jul 2017 07:00:00 GMT"
68,Opinion: Stay away from bitcoin and ethereum — they are complete garbage - MarketWatch,"Tue, 11 Jul 2017 07:00:00 GMT"
69,PETQ - MarketWatch - MarketWatch,"Mon, 24 Jul 2017 06:50:37 GMT"
70,Americans in this state are the biggest users of e-cigarettes - MarketWatch,"Wed, 05 Jul 2017 07:00:00 GMT"
71,LXRX | Lexicon Pharmaceuticals Inc. Advanced Charts - MarketWatch,"Wed, 20 Jan 2010 14:57:45 GMT"
72,Nolan’s cinematic vision in ‘Dunkirk’ is Hollywood’s best defense against Netflix - MarketWatch,"Mon, 24 Jul 2017 07:00:00 GMT"
73,Nasdaq extends win streak as stocks digest latest political drama - MarketWatch,"Tue, 11 Jul 2017 07:00:00 GMT"
74,Opinion: 7 money-making lessons from the richest man who ever lived - MarketWatch,"Sat, 29 Jul 2017 07:00:00 GMT"
75,This is how long it takes to get regain your concentration after texting on your iPhone - MarketWatch,"Mon, 31 Jul 2017 07:00:00 GMT"
76,Opinion: Watch out: ‘Kids’ are making the most money in this stock market - MarketWatch,"Mon, 31 Jul 2017 07:00:00 GMT"
77,Trump administration stymies push for improved climate-risk disclosure among companies - MarketWatch,"Mon, 31 Jul 2017 07:00:00 GMT"
78,"The richest people on the planet just got richer, but one country was outstanding - MarketWatch","Sat, 29 Jul 2017 07:00:00 GMT"
79,BLK | BlackRock Inc. Advanced Charts - MarketWatch,"Tue, 21 Jul 2009 11:47:14 GMT"
80,CROWN Stock Price | Crown Asia Chemicals Corp. Stock Quote (Philippines: Manila) - MarketWatch,"Fri, 20 Oct 2017 22:15:48 GMT"
81,VW asks EU to scrutinize German car makers - MarketWatch,"Mon, 24 Jul 2017 07:00:00 GMT"
82,IEFM | iShares Edge MSCI Europe Momentum Factor UCITS ETF Overview - MarketWatch,"Fri, 27 Oct 2017 23:59:29 GMT"
83,Opinion: 3 reasons global markets will root for a President Pence - MarketWatch,"Wed, 12 Jul 2017 07:00:00 GMT"
84,"End of Glass-Steagall did not lead to 2008 Wall Street meltdown, Fed report suggests - MarketWatch","Mon, 31 Jul 2017 07:00:00 GMT"
85,Are you a money bully? - MarketWatch,"Fri, 21 Jul 2017 07:00:00 GMT"
86,"In a fast-fashion world, Michael Kors is too slow - MarketWatch","Wed, 12 Jul 2017 07:00:00 GMT"
87,LIAB Stock Price | Lindab International AB Stock Quote (Sweden: Stockholm) - MarketWatch,"Thu, 19 Oct 2017 22:02:29 GMT"
88,Nobody told the euro that Mario Draghi was dovish - MarketWatch,"Fri, 21 Jul 2017 07:00:00 GMT"
89,"Trump slams CNN, which says he should start doing his job - MarketWatch","Mon, 03 Jul 2017 07:00:00 GMT"
90,DDC Stock Price | DDC Enterprise Ltd. Stock Quote (U.S.: NYSE American) - MarketWatch,"Thu, 29 Dec 2016 12:10:57 GMT"
91,Elon Musk just burned Mark Zuckerberg in a tweet about AI - MarketWatch,"Wed, 26 Jul 2017 07:00:00 GMT"
92,"Bitcoin fan who held up sign during Yellen’s testimony receives $10,000 for his effort - MarketWatch","Thu, 13 Jul 2017 07:00:00 GMT"
93,"Tesla’s bear-market dip, in one chart - MarketWatch","Thu, 06 Jul 2017 07:00:00 GMT"
94,This new drug could help the U.S. survive a nuclear meltdown - MarketWatch,"Tue, 18 Jul 2017 07:00:00 GMT"
95,Chipotle upgraded on belief menu innovation will outshine latest norovirus reports - MarketWatch,"Thu, 20 Jul 2017 07:00:00 GMT"
96,MFG Stock Price | Magellan Financial Group Ltd. Stock Quote (Australia: Sydney) - MarketWatch,"Wed, 18 Oct 2017 03:58:49 GMT"
97,This luxury credit card is only for truly big spenders - MarketWatch,"Sun, 23 Jul 2017 07:00:00 GMT"
98,"The Nintendo Switch’s sell-out launch, in many charts - MarketWatch","Wed, 26 Jul 2017 07:00:00 GMT"
99,Why more companies are rolling back loyalty programs - MarketWatch,"Mon, 31 Jul 2017 07:00:00 GMT"
