,Title,Date
0,Amgen and Advasix in global cancer immunotherapies colllaboration - MarketWatch,"Tue, 02 Aug 2016 07:00:00 GMT"
1,Cintas to pay $97.50 per G&K stock in cash - MarketWatch,"Tue, 16 Aug 2016 07:00:00 GMT"
2,Novozymes shares drop 8.3% after financial results - MarketWatch,"Wed, 10 Aug 2016 07:00:00 GMT"
3,Dollar General Q2 sales $5.39 bln vs. $5.1 bln year ago - MarketWatch,"Thu, 25 Aug 2016 07:00:00 GMT"
4,"BMW, Hella downgraded to neutral from buy at Goldman - MarketWatch","Fri, 19 Aug 2016 07:00:00 GMT"
5,‘Wolf of Wall Street’ producer strikes 1MDB deal with feds - MarketWatch,"Mon, 01 Aug 2016 07:00:00 GMT"
6,PKI Stock Price | Parkland Corp. Stock Quote (Canada: Toronto) - MarketWatch,"Wed, 18 Oct 2017 15:20:22 GMT"
7,Analysts stunned by 115% premium in Mattress Firm takeover bid - MarketWatch,"Tue, 09 Aug 2016 07:00:00 GMT"
8,Ex-banker who blamed dad guilty in insider trading case - MarketWatch,"Wed, 17 Aug 2016 07:00:00 GMT"
9,"Meet Aston Martin’s ‘big, kingly and fast’ new touring car - MarketWatch","Sat, 27 Aug 2016 07:00:00 GMT"
10,"These fancy, futuristic public libraries rank among the world’s best - MarketWatch","Thu, 18 Aug 2016 07:00:00 GMT"
11,Huma Abedin says she’s leaving Anthony Weiner after latest online scandal - MarketWatch,"Mon, 29 Aug 2016 07:00:00 GMT"
12,The 10 most livable cities in the world - MarketWatch,"Thu, 18 Aug 2016 07:00:00 GMT"
13,Physical-book sales are staging a comeback after many years of decline - MarketWatch,"Mon, 22 Aug 2016 07:00:00 GMT"
14,Opinion: Surprise! Gold has bullish news for the stock market - MarketWatch,"Fri, 26 Aug 2016 07:00:00 GMT"
15,"Watch a $300,000 Ferrari get wrecked by incompetent parallel parking - MarketWatch","Tue, 09 Aug 2016 07:00:00 GMT"
16,"Looking for love, and a high credit score - MarketWatch","Fri, 26 Aug 2016 07:00:00 GMT"
17,Zooming past you at an airport soon: Rideable suitcases - MarketWatch,"Sat, 13 Aug 2016 07:00:00 GMT"
18,Opinion: This is the reason Putin is even more dangerous than you thought - MarketWatch,"Sat, 27 Aug 2016 07:00:00 GMT"
19,1808 Stock Price | Haseko Corp. Stock Quote (Japan: Tokyo) - MarketWatch,"Wed, 18 Oct 2017 10:25:38 GMT"
20,SPGI | S&P Global Inc. Analyst Estimates - MarketWatch,"Fri, 09 Sep 2016 23:54:49 GMT"
21,Tornado Flings Debris Around Philippine Capital - MarketWatch,"Mon, 15 Aug 2016 07:00:00 GMT"
22,"Move over, Tesla? Karma unveils its hybrid sports car - MarketWatch","Sat, 13 Aug 2016 07:00:00 GMT"
23,My friend divorced a millionaire TV executive. Is she entitled to his Social Security? - MarketWatch,"Tue, 30 Aug 2016 07:00:00 GMT"
24,Target shoppers just don’t find the fresh groceries all that appetizing - MarketWatch,"Sat, 20 Aug 2016 07:00:00 GMT"
25,Kobe Bryant unveils $100 million venture-capital fund - MarketWatch,"Mon, 22 Aug 2016 07:00:00 GMT"
26,Opinion: How to make August the best month of the year for stocks - MarketWatch,"Mon, 01 Aug 2016 07:00:00 GMT"
27,"Thanks to Michael Phelps, cupping craze takes spotlight in Rio - MarketWatch","Mon, 08 Aug 2016 07:00:00 GMT"
28,XXMMF Stock Price | Ximen Mining Corp. Stock Quote (U.S.: OTC) - MarketWatch,"Wed, 18 Oct 2017 12:21:59 GMT"
29,These young NBA stars are rising because of meditation and mindfulness - MarketWatch,"Mon, 29 Aug 2016 07:00:00 GMT"
30,"Elon Musk, SolarCity execs to buy most of SolarCity bond offering - MarketWatch","Wed, 24 Aug 2016 07:00:00 GMT"
31,"Under attack? No, it’s just a Snorlax causing another Pokemon Go stampede - MarketWatch","Mon, 22 Aug 2016 07:00:00 GMT"
32,30 words Americans can’t pronounce correctly - MarketWatch,"Wed, 31 Aug 2016 07:00:00 GMT"
33,Wall Street whistleblowers could collect over $100 million - MarketWatch,"Wed, 10 Aug 2016 07:00:00 GMT"
34,Inside the frozen-in-time mansions of Michigan’s Mackinac Island - MarketWatch,"Wed, 31 Aug 2016 07:00:00 GMT"
35,TAC | Transalta Corp. Analyst Estimates - MarketWatch,"Tue, 30 Aug 2016 02:02:39 GMT"
36,Starbucks lawsuit alleging it put too much ice in drinks gets dismissed - MarketWatch,"Wed, 24 Aug 2016 07:00:00 GMT"
37,Opinion: Here’s how to reduce inequality and poverty in America - MarketWatch,"Tue, 23 Aug 2016 07:00:00 GMT"
38,5 stadiums with worse names than Chicago’s Guaranteed Rate Field - MarketWatch,"Wed, 24 Aug 2016 07:00:00 GMT"
39,Check out Justin Bieber’s party pad on Hawaii’s Big Island - MarketWatch,"Wed, 10 Aug 2016 07:00:00 GMT"
40,Billion-euro price tag on South of France manse makes it world’s richest listing - MarketWatch,"Sat, 27 Aug 2016 07:00:00 GMT"
41,WLWHY Stock Price | Woolworths Holdings Ltd. ADR Stock Quote (U.S.: OTC) - MarketWatch,"Wed, 18 Oct 2017 04:47:56 GMT"
42,Agilent shares slip after revenue forecast downgraded - MarketWatch,"Wed, 17 Aug 2016 07:00:00 GMT"
43,The new amenity for the super rich? Luxury panic rooms - MarketWatch,"Fri, 26 Aug 2016 07:00:00 GMT"
44,5 things Tim Cook has done better at Apple than Steve Jobs did - MarketWatch,"Sun, 28 Aug 2016 07:00:00 GMT"
45,M1GU Stock Price | Sabana Industrial REIT Stock Quote (Singapore: SGX) - MarketWatch,"Wed, 18 Oct 2017 03:31:15 GMT"
46,600448 Stock Price | Huafang Co. Ltd. A Stock Quote (China: Shanghai) - MarketWatch,"Fri, 20 Oct 2017 19:02:40 GMT"
47,"Yankees’ Alex Rodriguez to retire, play final game Friday - MarketWatch","Sun, 07 Aug 2016 07:00:00 GMT"
48,Opinion: Why Wall Street’s discrimination against women has no future - MarketWatch,"Mon, 01 Aug 2016 07:00:00 GMT"
49,RNG | RingCentral Inc. Cl A Analyst Estimates - MarketWatch,"Tue, 30 Aug 2016 09:36:23 GMT"
50,LVHI | Franklin International Low Volatility High Dividend Index ETF Overview - MarketWatch,"Fri, 20 Oct 2017 22:34:19 GMT"
51,"Los Angeles enters a new era as a global city, with home demand and prices to match - MarketWatch","Thu, 25 Aug 2016 07:00:00 GMT"
52,How far does $1 go in your state? - MarketWatch,"Thu, 11 Aug 2016 07:00:00 GMT"
53,Facebook’s Mark Zuckerberg may have a Bieber problem on his hands - MarketWatch,"Sat, 20 Aug 2016 07:00:00 GMT"
54,New York Fed warns of troubling consequence of rising student loan debt - MarketWatch,"Tue, 02 Aug 2016 07:00:00 GMT"
55,Opinion: 5 reasons to think twice about your target-date fund - MarketWatch,"Tue, 23 Aug 2016 07:00:00 GMT"
56,APVO | Aptevo Therapeutics Inc. Analyst Estimates - MarketWatch,"Thu, 19 Oct 2017 05:18:00 GMT"
57,Hefner residency demand is undoing of $110 million Playboy Mansion sale - MarketWatch,"Fri, 05 Aug 2016 07:00:00 GMT"
58,Hot wheels: The 10 most-stolen cars - MarketWatch,"Wed, 10 Aug 2016 07:00:00 GMT"
59,There’s a market in Trump and Clinton lies - MarketWatch,"Fri, 19 Aug 2016 07:00:00 GMT"
60,Opinion: Air pollution will kill more than 200 million people in the next 45 years - MarketWatch,"Mon, 15 Aug 2016 07:00:00 GMT"
61,"49ers quarterback Colin Kaepernick takes a stand, but at what cost? - MarketWatch","Tue, 30 Aug 2016 07:00:00 GMT"
62,Opinion: Bite on these three market bargains instead of pricey FANG stocks - MarketWatch,"Thu, 11 Aug 2016 07:00:00 GMT"
63,10 things that make electric-car maker Tesla special - MarketWatch,"Tue, 23 Aug 2016 07:00:00 GMT"
64,Pfizer agrees to buy cancer behemoth Medivation for $14 billion - MarketWatch,"Mon, 22 Aug 2016 07:00:00 GMT"
65,Those cargo shorts you love? They may be hurting your marriage - MarketWatch,"Tue, 02 Aug 2016 07:00:00 GMT"
66,Film Trailer: 'Hacksaw Ridge' - MarketWatch,"Tue, 30 Aug 2016 07:00:00 GMT"
67,This flying egg is actually a drone - MarketWatch,"Wed, 24 Aug 2016 07:00:00 GMT"
68,Oil rig carrying 280 tons of diesel runs aground off Scotland - MarketWatch,"Tue, 09 Aug 2016 07:00:00 GMT"
69,"Ann Coulter, not Rob Lowe, gets slammed by Comedy Central roasters - MarketWatch","Mon, 29 Aug 2016 07:00:00 GMT"
70,"Opinion: September is the worst month for U.S. stocks, and no one knows why - MarketWatch","Wed, 31 Aug 2016 07:00:00 GMT"
71,ASRE Stock Price | Astra Energy Inc. Stock Quote (U.S.: OTC) - MarketWatch,"Mon, 12 Oct 2020 02:32:51 GMT"
72,This is what a pro athlete’s tax return looks like - MarketWatch,"Mon, 29 Aug 2016 07:00:00 GMT"
73,Delta now blames failed ‘switchgear’ for massive outage - MarketWatch,"Tue, 09 Aug 2016 07:00:00 GMT"
74,Opinion: Here’s how you know the stock market is hugely overvalued - MarketWatch,"Tue, 16 Aug 2016 07:00:00 GMT"
75,Opinion: Why Donald Trump couldn’t bring back 5 million factory jobs - MarketWatch,"Mon, 22 Aug 2016 07:00:00 GMT"
76,Brexit hits value of office buildings in London’s financial district - MarketWatch,"Mon, 08 Aug 2016 07:00:00 GMT"
77,"Mylan’s EpiPen price increases are Valeant-like in size, Shkreli-like in approach - MarketWatch","Thu, 18 Aug 2016 07:00:00 GMT"
78,U.S. stocks open higher as investors weigh rate-hike prospects - MarketWatch,"Mon, 29 Aug 2016 07:00:00 GMT"
79,Is Restoration Hardware soft launching a property business? - MarketWatch,"Sat, 06 Aug 2016 07:00:00 GMT"
80,Backlash grows against Mylan’s EpiPen price hikes - MarketWatch,"Wed, 24 Aug 2016 07:00:00 GMT"
81,401(k) balances increased very little in the last 10 years - MarketWatch,"Wed, 10 Aug 2016 07:00:00 GMT"
82,JKN Stock Price | JKN Global Group PCL Stock Quote (Thailand: Bangkok ) - MarketWatch,"Wed, 07 Feb 2018 05:57:37 GMT"
83,Opinion: Here’s how to trade a stock after an earnings surprise - MarketWatch,"Thu, 18 Aug 2016 07:00:00 GMT"
84,Beauty school must pay $11 million in federal fraud case - MarketWatch,"Mon, 15 Aug 2016 07:00:00 GMT"
85,The secret (and costly) life of the American teenager - MarketWatch,"Wed, 31 Aug 2016 07:00:00 GMT"
86,HNHPF | Hon Hai Precision Industry Co. Ltd. GDR Analyst Estimates - MarketWatch,"Mon, 20 Nov 2017 06:03:46 GMT"
87,011000 Stock Price | GeneOneLifeScience Inc. Stock Quote (S. Korea: KRX) - MarketWatch,"Wed, 18 Oct 2017 22:24:20 GMT"
88,Fisherman scoops up $100 million pearl — but keeps it under the bed for 10 years - MarketWatch,"Thu, 25 Aug 2016 07:00:00 GMT"
89,"This is the top! No, wait. THIS is the top! - MarketWatch","Tue, 16 Aug 2016 07:00:00 GMT"
90,Stanford students can now only drink beer and wine on campus - MarketWatch,"Tue, 23 Aug 2016 07:00:00 GMT"
91,Vail looks to Canada as U.S. ski industry cools - MarketWatch,"Mon, 08 Aug 2016 07:00:00 GMT"
92,Opinion: 7 reasons Amazon stock will only go higher - MarketWatch,"Fri, 12 Aug 2016 07:00:00 GMT"
93,P&G to pull back on some targeted ads on Facebook - MarketWatch,"Wed, 17 Aug 2016 07:00:00 GMT"
94,Opinion: Six myths about the U.S. economy that are just plain wrong - MarketWatch,"Fri, 19 Aug 2016 07:00:00 GMT"
95,7 reasons Americans are unhappy - MarketWatch,"Tue, 30 Aug 2016 07:00:00 GMT"
96,Screens are hooking kids on ‘digital heroin’ - MarketWatch,"Mon, 29 Aug 2016 07:00:00 GMT"
97,Don’t fall prey to the low-credibility Fed echo chamber - MarketWatch,"Thu, 18 Aug 2016 07:00:00 GMT"
98,Want to invest in self-driving cars? Check out the chips - MarketWatch,"Sat, 27 Aug 2016 07:00:00 GMT"
99,How the sandwich generation is changing the way people remodel homes - MarketWatch,"Tue, 30 Aug 2016 07:00:00 GMT"
