,Title,Date
0,‘We are shocked and upset’: My mother died and her second husband said he now owns everything. Is this true? - MarketWatch,"Wed, 22 Jan 2025 08:00:00 GMT"
1,I’m going to inherit millions. My husband says I’d be ‘selfish’ to keep it. - MarketWatch,"Sat, 18 Jan 2025 08:00:00 GMT"
2,THFF | First Financial Corp. SEC Filings - MarketWatch,"Thu, 08 May 2025 05:55:43 GMT"
3,SPMC | Sound Point Meridian Capital Inc. Annual Income Statement - MarketWatch,"Mon, 12 May 2025 00:37:22 GMT"
4,"Stock Market on Jan. 24, 2025: S&P 500 ends below record high as tech slumps, but posts big weekly gain along with Nasdaq and Dow after Trump's return to White House - MarketWatch","Fri, 24 Jan 2025 08:00:00 GMT"
5,Moderna’s stock is falling. Goldman Sachs says it’s no longer a buy. - MarketWatch,"Wed, 29 Jan 2025 08:00:00 GMT"
6,XYZ | Block Inc. Advanced Charts - MarketWatch,"Tue, 21 Jan 2025 20:45:41 GMT"
7,U.S. stocks are expensive by almost any metric — and could remain so for a while - MarketWatch,"Fri, 10 Jan 2025 08:00:00 GMT"
8,COR Stock Price | Coreo AG Stock Quote (Germany: Xetra ) - MarketWatch,"Thu, 16 Jan 2025 06:51:22 GMT"
9,JetBlue’s bonds find buyers despite stock slide - MarketWatch,"Thu, 30 Jan 2025 08:00:00 GMT"
10,Opinion: Is Trump’s bitcoin embrace the biggest ‘pump-and-dump’ ever? - MarketWatch,"Thu, 16 Jan 2025 08:00:00 GMT"
11,How Visa and other fintech stocks can get a boost from AI - MarketWatch,"Fri, 24 Jan 2025 08:00:00 GMT"
12,Here’s what the Apple bears are getting wrong about the stock - MarketWatch,"Fri, 31 Jan 2025 08:00:00 GMT"
13,Veteran news anchor Chris Wallace lists exquisite Georgian Revival home in D.C. for $6.4 million after leaving CNN - MarketWatch,"Thu, 23 Jan 2025 08:00:00 GMT"
14,Oil prices rally as fresh U.S. sanctions on Russia threaten global supplies - MarketWatch,"Fri, 10 Jan 2025 08:00:00 GMT"
15,Opinion: Elon Musk has his doubts about Stargate. Here’s why he may be right. - MarketWatch,"Wed, 22 Jan 2025 08:00:00 GMT"
16,"December jobs report forecast is 155,000 but watch the jobless rate - MarketWatch","Thu, 09 Jan 2025 08:00:00 GMT"
17,"Trump rolls back effort to lower Medicare, Medicaid drug costs - MarketWatch","Tue, 21 Jan 2025 08:00:00 GMT"
18,OneWater Marine Shares Rise Following Better-Than-Expected 1Q - MarketWatch,"Thu, 30 Jan 2025 08:00:00 GMT"
19,"Six out of seven conditions are met for a stock-market bubble, says UBS - MarketWatch","Thu, 23 Jan 2025 08:00:00 GMT"
20,Trump vs. Powell: Who will drive the stock market as the Fed holds its first meeting of the year? - MarketWatch,"Mon, 27 Jan 2025 08:00:00 GMT"
21,Lockheed Martin’s earnings weighed down by write-downs on classified programs - MarketWatch,"Tue, 28 Jan 2025 08:00:00 GMT"
22,Blink Charging: SEC Ends Probe With No Enforcement Action - MarketWatch,"Tue, 21 Jan 2025 08:00:00 GMT"
23,"Kinross Gold Corp. stock rises Wednesday, outperforms market - MarketWatch","Wed, 22 Jan 2025 08:00:00 GMT"
24,Altria says counterfeit e-vape products are impacting its business outlook - MarketWatch,"Thu, 30 Jan 2025 08:00:00 GMT"
25,Moderna’s stock tumbles to post-COVID lows after revenue outlook disappoints - MarketWatch,"Mon, 13 Jan 2025 08:00:00 GMT"
26,Stocks open mostly higher after Monday's AI selloff - MarketWatch,"Tue, 28 Jan 2025 08:00:00 GMT"
27,"Richelieu Hardware 4Q Profit Slides, Revenue Beats Expectations - MarketWatch","Thu, 16 Jan 2025 08:00:00 GMT"
28,"MicroStrategy adds another bull to its side, and yes, it’s all about bitcoin - MarketWatch","Wed, 29 Jan 2025 08:00:00 GMT"
29,"Altria Group Inc. stock rises Wednesday, still underperforms market - MarketWatch","Wed, 08 Jan 2025 08:00:00 GMT"
30,Nvidia’s toughest competition might just be Alphabet — but there’s a catch - MarketWatch,"Fri, 24 Jan 2025 08:00:00 GMT"
31,"Large-cap U.S. stocks may be heading for a lost decade, this contrarian warns. What to buy instead. - MarketWatch","Tue, 14 Jan 2025 08:00:00 GMT"
32,"Portillo's Shares Rise On Outlook for 4Q, 2024 Sales - MarketWatch","Tue, 14 Jan 2025 08:00:00 GMT"
33,Crypto XRP reaches all-time high above $3. It now has the $4-plus range in its sights. - MarketWatch,"Wed, 15 Jan 2025 08:00:00 GMT"
34,Disney CEO Iger's Total Compensation Climbs 30% in 2024 - MarketWatch,"Thu, 23 Jan 2025 08:00:00 GMT"
35,Boeing may soon sell some of its businesses. That could finally boost the stock. - MarketWatch,"Mon, 27 Jan 2025 08:00:00 GMT"
36,Lightbridge Shares Gain on Partnership Study With Oklo - MarketWatch,"Thu, 23 Jan 2025 08:00:00 GMT"
37,EU Sets Feb. 26 Deadline For Nokia/Infinera Deal Probe - MarketWatch,"Fri, 24 Jan 2025 08:00:00 GMT"
38,Why there’s now ‘incredible demand for physical gold’ in New York markets - MarketWatch,"Fri, 31 Jan 2025 08:00:00 GMT"
39,Macquarie Gets Further Extension to Renewi Bid Deadline - MarketWatch,"Thu, 23 Jan 2025 08:00:00 GMT"
40,Elon Musk predicts 'epic' 2026 and 'ridiculous' 2027 - MarketWatch,"Wed, 29 Jan 2025 08:00:00 GMT"
41,Consumer expectations for higher inflation soar in early January - MarketWatch,"Fri, 10 Jan 2025 08:00:00 GMT"
42,Travelers withstands higher catastrophe losses as underwriting fuels earnings beat - MarketWatch,"Wed, 22 Jan 2025 08:00:00 GMT"
43,YDDL | One and one Green Technologies - Pre-IPO - MarketWatch,"Tue, 21 Jan 2025 08:00:00 GMT"
44,"U.K. in danger of ‘debt death spiral,’ says Bridgewater founder Dalio - MarketWatch","Tue, 21 Jan 2025 08:00:00 GMT"
45,Tesla's free cash flow beat expectations by more than $400 million - MarketWatch,"Wed, 29 Jan 2025 08:00:00 GMT"
46,"Mag 7 stocks may not repeat their winning streak in 2025, Wall Street gurus warn - MarketWatch","Thu, 30 Jan 2025 08:00:00 GMT"
47,"During the DeepSeek turmoil, computer-driven funds rose while fundamental funds slumped. - MarketWatch","Tue, 28 Jan 2025 08:00:00 GMT"
48,Opinion: Trump’s early moves could actually increase drug prices for seniors - MarketWatch,"Thu, 23 Jan 2025 08:00:00 GMT"
49,I’m 67 and will work for 5 more years. I was told to claim Social Security now. - MarketWatch,"Fri, 31 Jan 2025 08:00:00 GMT"
50,Target’s holiday sales show a rebound from third-quarter doldrums - MarketWatch,"Thu, 16 Jan 2025 08:00:00 GMT"
51,"Cash is king, says under-fire AMC chief executive after equity raise - MarketWatch","Mon, 20 Jan 2025 08:00:00 GMT"
52,"Meyer Burger Shares Jump on Additional Financing, Takeover - MarketWatch","Mon, 20 Jan 2025 08:00:00 GMT"
53,Elevance Health earnings boost health-insurance stocks after upbeat outlook - MarketWatch,"Thu, 23 Jan 2025 08:00:00 GMT"
54,Major corporations are rushing to issue bonds as Treasury yields spike - MarketWatch,"Sat, 11 Jan 2025 08:00:00 GMT"
55,"The U.S. is in a 'sweet spot.' But markets have one thing wrong, says Goldman. - MarketWatch","Mon, 20 Jan 2025 08:00:00 GMT"
56,Paul Krugman thinks bond yields may be rising due to an ‘insanity premium’ - MarketWatch,"Wed, 08 Jan 2025 08:00:00 GMT"
57,VIX surges as Wall Street tech fears mount - MarketWatch,"Mon, 27 Jan 2025 08:00:00 GMT"
58,Is the stock market open today? Here’s what to know for Inauguration Day and MLK Day. - MarketWatch,"Sun, 19 Jan 2025 08:00:00 GMT"
59,De La Rue Shares Jump on Revised Takeover Proposal - MarketWatch,"Thu, 09 Jan 2025 08:00:00 GMT"
60,DeepSeek and ChatGPT take on photosynthesis: This viral TikTok pits the two AI chatbots head to head - MarketWatch,"Tue, 28 Jan 2025 08:00:00 GMT"
61,"JPMorgan’s stock returns to record territory. Thanks, CPI. - MarketWatch","Wed, 15 Jan 2025 08:00:00 GMT"
62,Opinion: DeepSeek panic shows the S&P 500 isn’t the safe investment people think - MarketWatch,"Tue, 28 Jan 2025 08:00:00 GMT"
63,"Bitcoin needs to see these catalysts to hit $120,000 - MarketWatch","Wed, 22 Jan 2025 08:00:00 GMT"
64,Risk appetite among U.S. stock-market investors has deteriorated in January: S&P Global - MarketWatch,"Tue, 14 Jan 2025 08:00:00 GMT"
65,How much does 401(k) auto-enrollment help workers save for retirement? - MarketWatch,"Thu, 09 Jan 2025 08:00:00 GMT"
66,Energy Rises as Sector's '25 Rebound Continues - Energy Roundup - MarketWatch,"Tue, 14 Jan 2025 08:00:00 GMT"
67,Why ditching the penny may not cost Americans much - MarketWatch,"Tue, 28 Jan 2025 08:00:00 GMT"
68,P&G 2Q Sales Rise as Volumes Rebound - MarketWatch,"Wed, 22 Jan 2025 08:00:00 GMT"
69,"Tariffs, Trump and China: What 2025 holds for shipping stocks - MarketWatch","Tue, 14 Jan 2025 08:00:00 GMT"
70,Powell’s goal for Fed today: ‘Trying not to make a splash’ - MarketWatch,"Mon, 27 Jan 2025 08:00:00 GMT"
71,AGRZ | Agroz - Pre-IPO - MarketWatch,"Thu, 16 Jan 2025 08:00:00 GMT"
72,Citi Raises 1Q Crude Oil Price Estimates - MarketWatch,"Thu, 09 Jan 2025 08:00:00 GMT"
73,Victims of L.A. fires and other disasters will soon get more generous tax breaks - MarketWatch,"Tue, 14 Jan 2025 08:00:00 GMT"
74,"Bajaj Finance falls Monday, underperforms market - MarketWatch","Mon, 13 Jan 2025 08:00:00 GMT"
75,Bond king Gundlach says investors have ‘left the bus’ as yields spike during Fed cuts. Here’s his advice. - MarketWatch,"Wed, 15 Jan 2025 08:00:00 GMT"
76,Zuckerberg wants to spend billions more on AI. Meta investors like that idea. - MarketWatch,"Fri, 24 Jan 2025 08:00:00 GMT"
77,Does DeepSeek spell doomsday for Nvidia and other AI stocks? Here’s what to know. - MarketWatch,"Mon, 27 Jan 2025 08:00:00 GMT"
78,S&P 500 briefly erases postelection 'Trump bump' - MarketWatch,"Mon, 13 Jan 2025 08:00:00 GMT"
79,"Lam Research Issues Upbeat Guidance After 2Q Profit, Revenue Jump - MarketWatch","Wed, 29 Jan 2025 08:00:00 GMT"
80,Toronto Stocks Edge Higher After Two Days of Losses - MarketWatch,"Wed, 08 Jan 2025 08:00:00 GMT"
81,"Stock Market News, Jan. 28, 2025: Dow ends higher, S&P 500 and Nasdaq bounce back after Monday's AI selloff; Nvidia pops 8.9%; Fed kicks off policy meeting - MarketWatch","Tue, 28 Jan 2025 08:00:00 GMT"
82,Bitcoin has ‘nothing to do’ with DeepSeek. Here’s why its price tumbled anyway. - MarketWatch,"Mon, 27 Jan 2025 08:00:00 GMT"
83,"‘U.S. businesses are starting 2025 in an upbeat mood,’ S&P finds, as Trump takes reins over the economy - MarketWatch","Fri, 24 Jan 2025 08:00:00 GMT"
84,Aviation stocks in focus after deadly collision. American Airlines shares decline. - MarketWatch,"Thu, 30 Jan 2025 08:00:00 GMT"
85,Stock market’s $1 trillion wipeout shows what can happen when AI bets unspool - MarketWatch,"Tue, 28 Jan 2025 08:00:00 GMT"
86,Manhattan Associates Shares Fall on Downbeat Outlook - MarketWatch,"Tue, 28 Jan 2025 08:00:00 GMT"
87,"Dow to cut 1,500 jobs as it struggles to restore profitability. Stock slides to four-year low - MarketWatch","Thu, 30 Jan 2025 08:00:00 GMT"
88,Opinion: Which total market fund is best for long-term investors? - MarketWatch,"Mon, 13 Jan 2025 08:00:00 GMT"
89,"Stock Market News, Jan. 21, 2025: Dow ends up over 500 points, S&P 500 and Nasdaq climb on first trading day of Trump’s second term. Apple stock down, Netflix earnings ahead. - MarketWatch","Tue, 21 Jan 2025 08:00:00 GMT"
90,Smoke forces evacuation from world’s largest battery storage plant in California - MarketWatch,"Sat, 18 Jan 2025 08:00:00 GMT"
91,Opinion: The ‘January defect’ could slam stocks if buyers don’t step up quick - MarketWatch,"Sat, 18 Jan 2025 08:00:00 GMT"
92,What may happen in the aftermath of the Los Angeles fires - MarketWatch,"Fri, 10 Jan 2025 08:00:00 GMT"
93,"Biogen Gets U.S., European Reviews of Higher-Dose Spinraza - MarketWatch","Thu, 23 Jan 2025 08:00:00 GMT"
94,These two bank stocks stand out for improvement in 2025 - MarketWatch,"Mon, 13 Jan 2025 08:00:00 GMT"
95,3 signs bitcoin isn’t done breaking record highs just yet - MarketWatch,"Thu, 16 Jan 2025 08:00:00 GMT"
96,Trump set to break the all-time federal debt record amid inflation battle - MarketWatch,"Fri, 17 Jan 2025 08:00:00 GMT"
97,Stock market’s ‘Trump bump’ nearly erased thanks to bond selloff. What’s next. - MarketWatch,"Sat, 11 Jan 2025 08:00:00 GMT"
98,Exclusive: Cannabis groups combine to push for federal reforms under Trump - MarketWatch,"Thu, 16 Jan 2025 08:00:00 GMT"
99,"Jensen Huang crushed quantum stocks, now the 'Pharma Bro' is going for the kill - MarketWatch","Fri, 10 Jan 2025 08:00:00 GMT"
