,Title,Date
0,Hiscox shares drop 7.2% after full-year results - MarketWatch,"Mon, 26 Feb 2018 08:00:00 GMT"
1,Oil rebounds to end sharply higher after smaller-than-expected inventory rise - MarketWatch,"Wed, 14 Feb 2018 08:00:00 GMT"
2,VXRT | Vaxart Inc. Annual Income Statement - MarketWatch,"Sat, 17 Feb 2018 08:16:19 GMT"
3,RUN | SunRun Inc. Profile - MarketWatch,"Fri, 09 Oct 2020 11:46:05 GMT"
4,How palladium’s rally is setting platinum up for a comeback - MarketWatch,"Mon, 05 Feb 2018 08:00:00 GMT"
5,"Fewer Americans are majoring in education, but will students pay the price? - MarketWatch","Wed, 14 Feb 2018 08:00:00 GMT"
6,IQCD Stock Price | Industries Qatar Stock Quote (Qatar Exchange) - MarketWatch,"Mon, 25 Dec 2017 11:06:17 GMT"
7,Why ‘Black Panther’ is the most important blockbuster in years - MarketWatch,"Sat, 17 Feb 2018 08:00:00 GMT"
8,Opinion: Investors are way too greedy for a stock-market selloff to really take hold - MarketWatch,"Thu, 01 Feb 2018 08:00:00 GMT"
9,Would you pay $12 for ‘raw’ water? - MarketWatch,"Sun, 25 Feb 2018 08:00:00 GMT"
10,California now allows driverless cars without a human behind the wheel - MarketWatch,"Tue, 27 Feb 2018 08:00:00 GMT"
11,‘Only the mafia does better’ — Studio 54’s business secrets revealed in new documentary - MarketWatch,"Mon, 05 Feb 2018 08:00:00 GMT"
12,Obama indirectly smacks Trump’s White House in ‘off-the-record’ speech - MarketWatch,"Tue, 27 Feb 2018 08:00:00 GMT"
13,Opinion: Why these early retirees won’t touch bitcoin or other cryptos — and neither should you - MarketWatch,"Fri, 09 Feb 2018 08:00:00 GMT"
14,Feinstein fails to win endorsement of California Democrats - MarketWatch,"Mon, 26 Feb 2018 08:00:00 GMT"
15,IAGG Holdings - MarketWatch,"Fri, 16 Feb 2018 01:29:58 GMT"
16,These companies help single parents travel easily with kids - MarketWatch,"Wed, 21 Feb 2018 08:00:00 GMT"
17,"The U.S.’s weapons of the future, including the B-21 Raider, push technology into new areas - MarketWatch","Fri, 23 Feb 2018 08:00:00 GMT"
18,Onion writer’s routinely recycled mass-shooting headline hits close to home - MarketWatch,"Thu, 15 Feb 2018 08:00:00 GMT"
19,BKNG | Booking Holdings Inc. Analyst Estimates - MarketWatch,"Tue, 27 Feb 2018 18:30:11 GMT"
20,OUT1V Stock Price | Outokumpu Oyj Stock Quote (Finland: Helsinki) - MarketWatch,"Tue, 17 Oct 2017 22:09:02 GMT"
21,Opinion: Heed Warren Buffett’s warning: Bitcoin is pure FOMO - MarketWatch,"Sat, 10 Feb 2018 08:00:00 GMT"
22,"History suggests the correction isn’t near over, as this chart demonstrates - MarketWatch","Sun, 11 Feb 2018 08:00:00 GMT"
23,"Bitcoin remains in freefall, dives below $7,000 - MarketWatch","Mon, 05 Feb 2018 08:00:00 GMT"
24,Stock-market melt-up takes a timeout as bond yields rise - MarketWatch,"Sat, 03 Feb 2018 08:00:00 GMT"
25,The most expensive colleges in America - MarketWatch,"Tue, 27 Feb 2018 08:00:00 GMT"
26,Why Netflix’s surprise ‘Cloverfield Paradox’ release could be a game-changer - MarketWatch,"Mon, 05 Feb 2018 08:00:00 GMT"
27,"Apple has $163 billion to burn, and Tim Cook plans to spend it - MarketWatch","Sun, 04 Feb 2018 08:00:00 GMT"
28,"Apple HomePod loses to Google, Sonos in sound tests, says Consumer Reports - MarketWatch","Mon, 12 Feb 2018 08:00:00 GMT"
29,This chart warns that the 30-year downtrend in interest rates may be over - MarketWatch,"Thu, 15 Feb 2018 08:00:00 GMT"
30,"Facebook earnings lead to praise of ‘powerful’ ad business, stock shoots to record high - MarketWatch","Thu, 01 Feb 2018 08:00:00 GMT"
31,European stocks close at 5-month low after Wall Street carnage - MarketWatch,"Tue, 06 Feb 2018 08:00:00 GMT"
32,Download RUBEGP Data | Russian Ruble/Egyptian Pound Price Data - MarketWatch,"Sun, 14 Feb 2021 12:19:56 GMT"
33,BVILY Stock Price | Breville Group Ltd. ADR Stock Quote (U.S.: OTC) - MarketWatch,"Sat, 21 Oct 2017 09:31:21 GMT"
34,Avid's stock falls after CEO terminated for violations of workforce conduct - MarketWatch,"Mon, 26 Feb 2018 08:00:00 GMT"
35,Would you get tested for STDs by mail? Some millennials are doing just that - MarketWatch,"Sat, 17 Feb 2018 08:00:00 GMT"
36,Here’s the staggering amount banks have been fined since the financial crisis - MarketWatch,"Sat, 24 Feb 2018 08:00:00 GMT"
37,These Americans will never get Social Security benefits — and we don’t mean millennials - MarketWatch,"Sun, 25 Feb 2018 08:00:00 GMT"
38,DLTR | Dollar Tree Inc. Profile - MarketWatch,"Sat, 10 Oct 2020 13:54:58 GMT"
39,What an $8.5 billion O’Hare Airport expansion means for travelers — if American Airlines lifts objection - MarketWatch,"Wed, 28 Feb 2018 08:00:00 GMT"
40,QGRIX | Invesco Global Allocation Fund;R6 Advanced Charts - MarketWatch,"Fri, 02 Feb 2018 08:34:55 GMT"
41,Here are the biggest losers among Dow and S&P 500 stocks in Monday’s rout - MarketWatch,"Tue, 06 Feb 2018 08:00:00 GMT"
42,This might be the time when you can finally get quality stocks on sale - MarketWatch,"Thu, 15 Feb 2018 08:00:00 GMT"
43,RGO Stock Price | Regeneron Pharmaceuticals Inc. Stock Quote (Germany: Frankfurt ) - MarketWatch,"Wed, 18 Oct 2017 09:40:16 GMT"
44,VIC Stock Price | Vingroup JSC Stock Quote (Ho Chi Minh Stock Exchange) - MarketWatch,"Sat, 14 Oct 2017 18:53:37 GMT"
45,"Richard Thaler, Nobel Prize-winning economist, says Wells Fargo is ‘slimy’ - MarketWatch","Tue, 20 Feb 2018 08:00:00 GMT"
46,The death of the dinner date - MarketWatch,"Wed, 14 Feb 2018 08:00:00 GMT"
47,Do Amazon warehouses hurt local jobs? - MarketWatch,"Sun, 04 Feb 2018 08:00:00 GMT"
48,"Ivanka Trump is a source of White House discord, CNN reports - MarketWatch","Wed, 28 Feb 2018 08:00:00 GMT"
49,A rocky divorce teaches a financial adviser about women’s money problems - MarketWatch,"Fri, 09 Feb 2018 08:00:00 GMT"
50,"Dollar holds loss, marks weakest level against yen since September - MarketWatch","Tue, 13 Feb 2018 08:00:00 GMT"
51,Emotional support dog injures young girl on Southwest flight - MarketWatch,"Sun, 25 Feb 2018 08:00:00 GMT"
52,MOTS Stock Price | Motus GI Holdings Inc. Stock Quote (U.S.: OTC) - MarketWatch,"Sat, 10 Feb 2018 16:25:53 GMT"
53,Tesla clarifies Musk’s Model 3 promise amid worst week for the stock since July - MarketWatch,"Mon, 12 Feb 2018 08:00:00 GMT"
54,Why investors shouldn’t panic over falling bond prices - MarketWatch,"Tue, 13 Feb 2018 08:00:00 GMT"
55,U.S. opens door to meeting with North Korea at Olympics - MarketWatch,"Tue, 06 Feb 2018 08:00:00 GMT"
56,Powell’s goal as he heads to the Hill: No blinking at inflation - MarketWatch,"Mon, 26 Feb 2018 08:00:00 GMT"
57,AT&T exploring sale of its data-center business - MarketWatch,"Thu, 01 Feb 2018 08:00:00 GMT"
58,Nestle acquires majority stake in Terrafertil - MarketWatch,"Fri, 09 Feb 2018 08:00:00 GMT"
59,Facebook earnings send stock to record after massive ad price increase - MarketWatch,"Thu, 01 Feb 2018 08:00:00 GMT"
60,How this MarketWatch reporter ended up covering commodities for the last 20 years - MarketWatch,"Mon, 05 Feb 2018 08:00:00 GMT"
61,This four-legged robot can open doors and we’re all doomed - MarketWatch,"Tue, 13 Feb 2018 08:00:00 GMT"
62,NB11 Stock Price | Vaxart Inc. Stock Quote (Germany: Frankfurt ) - MarketWatch,"Sat, 24 Feb 2018 15:27:17 GMT"
63,"Samsung unveils Galaxy S9 phone, featuring animated human emojis - MarketWatch","Mon, 26 Feb 2018 08:00:00 GMT"
64,UTLM Stock Price | Ukrtelecom PJSC Stock Quote (Ukrainian Exchange) - MarketWatch,"Sat, 21 Oct 2017 07:48:55 GMT"
65,Millennials are killing marriage — here’s why that’s a good thing - MarketWatch,"Fri, 16 Feb 2018 08:00:00 GMT"
66,Opinion: The stock market’s swoon demands a new narrative - MarketWatch,"Tue, 06 Feb 2018 08:00:00 GMT"
67,"2018 Winter Olympics: Snowboarder Chloe Kim gets ‘hangry,’ grabs gold - MarketWatch","Mon, 12 Feb 2018 08:00:00 GMT"
68,Sony Pictures says sorry for food allergy scene in ‘Peter Rabbit’ movie - MarketWatch,"Tue, 13 Feb 2018 08:00:00 GMT"
69,Super Bowl commercial blackout: NBC denies glitch cost it millions - MarketWatch,"Sun, 04 Feb 2018 08:00:00 GMT"
70,SpaceX successfully launches massive Falcon Heavy rocket after years of anticipation - MarketWatch,"Tue, 06 Feb 2018 08:00:00 GMT"
71,"Trump Today: President says senators fear the NRA, criticizes Sessions again - MarketWatch","Wed, 28 Feb 2018 08:00:00 GMT"
72,Dollar follows Treasury yields higher after Fed minutes - MarketWatch,"Wed, 21 Feb 2018 08:00:00 GMT"
73,"China set to overtake U.S. as biggest nuclear energy nation, IEA says - MarketWatch","Thu, 22 Feb 2018 08:00:00 GMT"
74,"Here’s how ‘relatively small’ this stock-market pullback really is, in one chart - MarketWatch","Fri, 09 Feb 2018 08:00:00 GMT"
75,"Having ADHD made me more successful — here’s how you can, too - MarketWatch","Sun, 25 Feb 2018 08:00:00 GMT"
76,From blade-sharpening to ballet — the cost of being an Olympic figure skater - MarketWatch,"Thu, 22 Feb 2018 08:00:00 GMT"
77,"Steve Wozniak had $70,000 in bitcoin stolen after falling for a simple, yet perfect, scam - MarketWatch","Wed, 28 Feb 2018 08:00:00 GMT"
78,Is Amazon’s Alexa smarter than Apple’s HomePod? - MarketWatch,"Sat, 03 Feb 2018 08:00:00 GMT"
79,What makes Warren Buffett a ‘prime example’ of the failure of American capitalism? - MarketWatch,"Sat, 17 Feb 2018 08:00:00 GMT"
80,Opinion: ‘Bond vigilantes’ should die a quiet death - MarketWatch,"Thu, 22 Feb 2018 08:00:00 GMT"
81,Ethereum chief warns cryptocurrencies could ‘drop to near-zero at any time’ - MarketWatch,"Tue, 20 Feb 2018 08:00:00 GMT"
82,This is the most sinful state in America - MarketWatch,"Fri, 23 Feb 2018 08:00:00 GMT"
83,Men who buy into the ‘Madonna-Whore dichotomy’ have less satisfying relationships - MarketWatch,"Mon, 05 Feb 2018 08:00:00 GMT"
84,"Bitcoin briefly tumbles below $8,000, as cryptos crater - MarketWatch","Fri, 02 Feb 2018 08:00:00 GMT"
85,Alphabet’s Waymo picks up speed in driverless cars - MarketWatch,"Wed, 28 Feb 2018 08:00:00 GMT"
86,Netflix documentary re-examines HSBC’s $881 million money-laundering scandal - MarketWatch,"Sat, 24 Feb 2018 08:00:00 GMT"
87,"Home price gains picked up steam at year-end, CoreLogic says - MarketWatch","Wed, 07 Feb 2018 08:00:00 GMT"
88,Here’s the most expensive city to buy a house — and it’s not even close - MarketWatch,"Tue, 13 Feb 2018 08:00:00 GMT"
89,Good news — the Fed’s shift to quantitative tightening might not be as painful as expected - MarketWatch,"Fri, 23 Feb 2018 08:00:00 GMT"
90,You can now buy a house in Italy for a little over a dollar - MarketWatch,"Fri, 02 Feb 2018 08:00:00 GMT"
91,BIM Stock Price | bioMerieux S.A. Stock Quote (France: Euronext Paris) - MarketWatch,"Thu, 12 Oct 2017 19:26:41 GMT"
92,"FTSE 100 marks best week since 2016, as global stocks rebound - MarketWatch","Fri, 16 Feb 2018 08:00:00 GMT"
93,Wakanda forever: The overt feminism of ‘Black Panther’ - MarketWatch,"Thu, 22 Feb 2018 08:00:00 GMT"
94,Bitcoin is acting like the stock market — and that’s not usual - MarketWatch,"Thu, 08 Feb 2018 08:00:00 GMT"
95,"Trump call for higher age limit on gun sales backed by some Republicans, but most quiet - MarketWatch","Fri, 23 Feb 2018 08:00:00 GMT"
96,Super Bowl of central banking: If the Philadelphia Fed played its Boston rival - MarketWatch,"Fri, 02 Feb 2018 08:00:00 GMT"
97,Here’s how the stock market typically performs in the aftermath of a major rout - MarketWatch,"Sun, 11 Feb 2018 08:00:00 GMT"
98,Buffett says new accounting rule will ‘severely distort’ future earnings figures - MarketWatch,"Sat, 24 Feb 2018 08:00:00 GMT"
99,"Elon Musk predicts profit at Tesla in 2018, and much more - MarketWatch","Thu, 08 Feb 2018 08:00:00 GMT"
