,Title,Date
0,PLUS Stock Price | DigiPlus Interactive Corp. Stock Quote (Philippines: Manila) - MarketWatch,"Thu, 16 Mar 2023 07:28:18 GMT"
1,"Kotak Mahindra Bank falls Wednesday, underperforms competitors - MarketWatch","Wed, 26 Mar 2025 07:00:00 GMT"
2,"Maruti Suzuki India falls Wednesday, underperforms competitors - MarketWatch","Wed, 26 Mar 2025 07:00:00 GMT"
3,I fled our $2.2M home due to domestic abuse. My husband won’t sell. What now? - MarketWatch,"Fri, 07 Mar 2025 08:00:00 GMT"
4,"Stock Market News, March 3, 2025: Dow ends down 650 points, S&P 500 and Nasdaq fall sharply after Trump affirms Canada, Mexico tariffs - MarketWatch","Mon, 03 Mar 2025 08:00:00 GMT"
5,Shutting the Education Department won’t change curriculums — but it could impact funding of programs - MarketWatch,"Thu, 20 Mar 2025 07:00:00 GMT"
6,Investors are on edge about potential changes to the Fed’s balance sheet plan - MarketWatch,"Tue, 18 Mar 2025 07:00:00 GMT"
7,Why sportsbooks really need March Madness bettors to lose this year - MarketWatch,"Tue, 18 Mar 2025 15:08:00 GMT"
8,"Here’s the level that could be an attractive entry point for stocks, says Morgan Stanley’s Mike Wilson - MarketWatch","Mon, 10 Mar 2025 07:00:00 GMT"
9,U.S. stock futures rise as Wall Street looks to extend gains despite uncertainty - MarketWatch,"Sun, 23 Mar 2025 07:00:00 GMT"
10,This could be Tesla’s next plan to recoup China market share - MarketWatch,"Fri, 14 Mar 2025 07:00:00 GMT"
11,Bausch + Lomb Recalls EnVista Intraocular Lenses - MarketWatch,"Thu, 27 Mar 2025 07:00:00 GMT"
12,Spiking ‘VIX’ can signal it’s time to buy stocks - MarketWatch,"Tue, 11 Mar 2025 07:00:00 GMT"
13,Dick’s Sporting Goods faces tariff ‘unknowns’ and issues conservative outlook - MarketWatch,"Tue, 11 Mar 2025 07:00:00 GMT"
14,"Gold Futures Hit Fresh High on Weaker U.S. Inflation, Economic Volatility - MarketWatch","Thu, 13 Mar 2025 16:43:00 GMT"
15,Adobe’s stock has been an AI laggard. A ho-hum earnings forecast is adding to its declines. - MarketWatch,"Wed, 12 Mar 2025 07:00:00 GMT"
16,Car Insurance Calculator: Estimate Costs Before Buying - MarketWatch,"Mon, 31 Mar 2025 07:00:00 GMT"
17,Nvidia’s stock has been ‘brutalized.’ Here’s the big disconnect. - MarketWatch,"Tue, 11 Mar 2025 07:00:00 GMT"
18,"Social Security is on the path to privatization, experts say, led by Musk’s DOGE - MarketWatch","Sat, 22 Mar 2025 07:00:00 GMT"
19,How Nvidia saw $200 million evaporate after CoreWeave’s IPO pricing - MarketWatch,"Fri, 28 Mar 2025 07:00:00 GMT"
20,Opinion: Trump’s reciprocal tariffs could bring stagflation — and deflate his support - MarketWatch,"Tue, 18 Mar 2025 07:00:00 GMT"
21,"Savills Pretax Profit, Revenue Rise Amid Market Improvement - MarketWatch","Thu, 13 Mar 2025 07:37:00 GMT"
22,Gold has outperformed stocks. Here’s what that means for investors. - MarketWatch,"Fri, 21 Mar 2025 07:00:00 GMT"
23,Why Trump’s ‘gold card’ visa program could make the pricey U.S. housing market even more expensive - MarketWatch,"Sat, 01 Mar 2025 08:00:00 GMT"
24,"Dow turns lower, pullback for S&P 500 and Nasdaq intensifies - MarketWatch","Thu, 20 Mar 2025 10:04:00 GMT"
25,"Dow ends lower, S&P 500 and Nasdaq resume rout - MarketWatch","Thu, 20 Mar 2025 18:05:00 GMT"
26,Fed fears 'stagflation shock' will intensify: Apollo's Slok - MarketWatch,"Tue, 25 Mar 2025 07:00:00 GMT"
27,Opinion: DeepSeek scared away some AI funders. But this wealthy backer is ready to spend. - MarketWatch,"Fri, 14 Mar 2025 07:00:00 GMT"
28,Women’s March Madness ratings are down without Caitlin Clark — but it’s not a doom signal for the sport - MarketWatch,"Fri, 28 Mar 2025 07:00:00 GMT"
29,"Trex Shares Rise on Excitement Around Deal Between Azek, James Hardie - MarketWatch","Mon, 24 Mar 2025 07:00:00 GMT"
30,Nvidia confirmed that this mining stock will remain an AI play - MarketWatch,"Tue, 18 Mar 2025 02:27:00 GMT"
31,Airline stocks tumbled in March — why that matters for the economy - MarketWatch,"Mon, 31 Mar 2025 07:00:00 GMT"
32,"Lululemon calls out weak brand awareness, as sluggish forecast sinks shares - MarketWatch","Thu, 27 Mar 2025 07:00:00 GMT"
33,"Stock Market on March 14, 2025: S&P 500 ends Friday with biggest daily gain since November as Big Tech stocks rally. But it was a rough week for U.S. equities amid tariffs worries. - MarketWatch","Fri, 14 Mar 2025 07:00:00 GMT"
34,DatChat Shares Double After Myseum Platform Hits App Stores - MarketWatch,"Tue, 25 Mar 2025 07:00:00 GMT"
35,These 20 stocks are likely to be losers no matter what the market does - MarketWatch,"Thu, 13 Mar 2025 07:00:00 GMT"
36,"ITC falls Wednesday, underperforms market - MarketWatch","Wed, 19 Mar 2025 07:00:00 GMT"
37,Treasury yields end higher for second day after CPI inflation data comes in cooler than expected - MarketWatch,"Wed, 12 Mar 2025 07:00:00 GMT"
38,"Stock Market on March 28, 2025: Dow, S&P 500, Nasdaq see worst day in almost three weeks after inflation, consumer-sentiment reports; stocks post weekly drop to deepen March losses ahead of reciprocal tariffs - MarketWatch","Fri, 28 Mar 2025 07:00:00 GMT"
39,"Stocks to Watch: Cognizant Technology Solutions, Mineralys Therapeutics, PDF Solutions - MarketWatch","Fri, 07 Mar 2025 08:00:00 GMT"
40,SoftBank expands its AI footprint with $6.5 billion purchase of Ampere Computing - MarketWatch,"Wed, 19 Mar 2025 07:00:00 GMT"
41,"Stock Market, March 26, 2025: Dow, S&P 500 and Nasdaq snap 3-day winning streak ahead of auto-tariffs announcement; GameStop shares pop - MarketWatch","Wed, 26 Mar 2025 07:00:00 GMT"
42,Why you should focus on these 15 most-profitable stocks in the S&P 500 right now - MarketWatch,"Mon, 31 Mar 2025 07:00:00 GMT"
43,Alarm.com Promotes Internal Executive to Succeed Valenzuela as CFO - MarketWatch,"Wed, 19 Mar 2025 20:36:00 GMT"
44,Social Security chaos fuels anxiety about scams - MarketWatch,"Thu, 13 Mar 2025 07:00:00 GMT"
45,The stock market is wobbly. Is now a good time to change how much I invest? - MarketWatch,"Thu, 13 Mar 2025 07:00:00 GMT"
46,I’m 63 and planning to retire. I watched in horror as the markets tanked. Will I have enough to get me to my 90s? - MarketWatch,"Tue, 18 Mar 2025 07:00:00 GMT"
47,"Nasdaq turns higher, stocks attempting to bounce - MarketWatch","Fri, 21 Mar 2025 07:00:00 GMT"
48,Church & Dwight Names New CFO Ahead of CEO Transition - MarketWatch,"Fri, 14 Mar 2025 07:00:00 GMT"
49,Intel’s new CEO asks customers for criticism and help in his mission to revive the chip giant - MarketWatch,"Mon, 31 Mar 2025 07:00:00 GMT"
50,"Tech Mahindra , underperforms market - MarketWatch","Mon, 17 Mar 2025 07:00:00 GMT"
51,Why should I tip servers who earn $20 an hour? - MarketWatch,"Mon, 10 Mar 2025 07:00:00 GMT"
52,The ‘Squid Game’ market: Risky leveraged ETFs boomed in 2024. Now comes the bust. - MarketWatch,"Fri, 21 Mar 2025 07:00:00 GMT"
53,More home builders cut prices to lure buyers put off by high costs - MarketWatch,"Mon, 17 Mar 2025 07:00:00 GMT"
54,CLIH27 | Cocoa Mar 2027 Advanced Charts - MarketWatch,"Mon, 17 Mar 2025 17:07:00 GMT"
55,Fed rate-cut forecast stays same for next three years - MarketWatch,"Wed, 19 Mar 2025 18:32:59 GMT"
56,15 absolute best deals from Wayfair’s huge spring sale this week - MarketWatch,"Fri, 21 Mar 2025 07:00:00 GMT"
57,"Dollar Tree 4Q Loss Widens, Confirms Sale of Family Dollar Business - MarketWatch","Wed, 26 Mar 2025 11:03:00 GMT"
58,Falling VIX shows traders' calmer mood - MarketWatch,"Wed, 26 Mar 2025 12:42:51 GMT"
59,Individual investors are still pretty bearish: survey - MarketWatch,"Thu, 20 Mar 2025 12:40:49 GMT"
60,Netflix has won the streaming wars. Now what? - MarketWatch,"Mon, 17 Mar 2025 07:00:00 GMT"
61,New Fortress Energy Sells Jamaica Natural Gas Operations for $1.06 Bln - MarketWatch,"Thu, 27 Mar 2025 07:00:00 GMT"
62,Bernard Arnault's Son Proposed as Moncler Board Member - MarketWatch,"Thu, 27 Mar 2025 07:00:00 GMT"
63,GNH26 | British Pound Sterling/ New Zealand Dollar Mar 2026 Advanced Charts - MarketWatch,"Fri, 21 Mar 2025 19:56:00 GMT"
64,Pacific Biosciences Names Jim Gibson Chief Financial Officer - MarketWatch,"Thu, 27 Mar 2025 07:00:00 GMT"
65,Stock indexes turn lower immediately following job-openings data - MarketWatch,"Tue, 11 Mar 2025 09:21:00 GMT"
66,Trump to make announcement on car tariffs after the market's close - MarketWatch,"Wed, 26 Mar 2025 17:35:44 GMT"
67,Nvidia's stock is off to a better start on Wednesday - MarketWatch,"Tue, 18 Mar 2025 02:27:00 GMT"
68,"Wipro advances Thursday, underperforms competitors - MarketWatch","Thu, 20 Mar 2025 10:31:00 GMT"
69,Consumer confidence sinks to 4-year low amid Trump’s tariffs and trade wars - MarketWatch,"Tue, 25 Mar 2025 07:00:00 GMT"
70,Breadth is looking pretty weak today - MarketWatch,"Fri, 21 Mar 2025 16:50:28 GMT"
71,"Nestle India falls Monday, underperforms market - MarketWatch","Mon, 17 Mar 2025 07:00:00 GMT"
72,Tesla’s stock falls as another bullish analyst worries about deliveries - MarketWatch,"Mon, 31 Mar 2025 07:00:00 GMT"
73,Cantor-Affiliated SPAC Files To Go Public - MarketWatch,"Mon, 10 Mar 2025 07:00:00 GMT"
74,‘DOGE checks’ update: Will Musk and Trump send savings to taxpayers? - MarketWatch,"Mon, 31 Mar 2025 07:00:00 GMT"
75,Why sportsbooks like FanDuel and DraftKings really need March Madness bettors to lose this year - MarketWatch,"Tue, 18 Mar 2025 07:00:00 GMT"
76,Alector to Cut 13% of Workforce - MarketWatch,"Mon, 10 Mar 2025 07:00:00 GMT"
77,Gold leads U.S. import surge on tariff fears - MarketWatch,"Fri, 07 Mar 2025 08:00:00 GMT"
78,Why record-high egg prices won’t go down anytime soon — and it’s not just due to bird flu - MarketWatch,"Wed, 12 Mar 2025 07:00:00 GMT"
79,WHWK Stock Price | Whitehawk Therapeutics Inc. Stock Quote (U.S.: Nasdaq) - MarketWatch,"Wed, 19 Mar 2025 17:17:02 GMT"
80,Trump retreats from 50% tariffs on Canadian metals. Here’s what comes next. - MarketWatch,"Tue, 11 Mar 2025 07:00:00 GMT"
81,"If you missed out on gold’s record run, take a look at silver - MarketWatch","Sat, 22 Mar 2025 07:00:00 GMT"
82,Americans hate inflation — but it’s not going away anytime soon - MarketWatch,"Sat, 22 Mar 2025 07:00:00 GMT"
83,Opinion: MAGA investors seeing red as ‘Trump trades’ tank - MarketWatch,"Sat, 22 Mar 2025 07:00:00 GMT"
84,Why Tom Lee says a face-ripping stock-market rally may have started - MarketWatch,"Tue, 25 Mar 2025 07:00:00 GMT"
85,"Freshpet Shares Rise 7% After Hours, Company Joining S&P SmallCap 600 - MarketWatch","Fri, 07 Mar 2025 08:00:00 GMT"
86,Wall Street can’t stop talking about the ‘Mar-a-Lago Accord.’ Here’s how the currency deal would work. - MarketWatch,"Sat, 01 Mar 2025 08:00:00 GMT"
87,"Stock Market News, March 4, 2025: : Dow ends down 670 points, S&P 500 tumbles 1.2%, Nasdaq edges lower amid Trump's tariff turmoil - MarketWatch","Tue, 04 Mar 2025 08:00:00 GMT"
88,Powell says Fed can ‘wait for greater clarity’ on economic outlook - MarketWatch,"Fri, 07 Mar 2025 08:00:00 GMT"
89,Nvidia to Develop AI-Native 6G Network With Telecom Companies - MarketWatch,"Tue, 18 Mar 2025 19:06:00 GMT"
90,U.S. Crude Oil Stockpiles Rise For Second Straight Week - MarketWatch,"Wed, 12 Mar 2025 14:57:00 GMT"
91,"Nvidia, Google and Disney Developing Open-Source Robot Training Program - MarketWatch","Tue, 18 Mar 2025 19:32:00 GMT"
92,Making the rest of the world great again - MarketWatch,"Wed, 19 Mar 2025 07:00:00 GMT"
93,Social Security Administration to cut phone service for direct-deposit transactions - MarketWatch,"Wed, 12 Mar 2025 07:00:00 GMT"
94,Average American Savings in 2025: How Your Savings Compare - MarketWatch,"Wed, 19 Mar 2025 07:00:00 GMT"
95,"Utilities Climb, Recouping Some Losses on Rate Cut Hopes - Utilities Roundup - MarketWatch","Fri, 07 Mar 2025 08:00:00 GMT"
96,Oklo Shares Rise on Nuclear Regulatory Commission Application Progress - MarketWatch,"Mon, 24 Mar 2025 07:00:00 GMT"
97,"I invested $100,000 in the S&P 500 and lost $10,000. When will it recover? - MarketWatch","Mon, 31 Mar 2025 07:00:00 GMT"
98,Roth conversions are the retirement version of “buy the dip” - MarketWatch,"Mon, 17 Mar 2025 07:00:00 GMT"
99,Petco Health & Wellness Shares Surge on Partnership with Uber - MarketWatch,"Thu, 27 Mar 2025 07:00:00 GMT"
