,Title,Date
0,SimCorp shares fall 6.7% in early Thursday trade - MarketWatch,"Thu, 24 Aug 2017 07:00:00 GMT"
1,TRGP | Targa Resources Corp. Advanced Charts - MarketWatch,"Sun, 19 Nov 2017 01:25:19 GMT"
2,This is the ‘wall of worry’ that stocks have climbed to rally 271% - MarketWatch,"Sat, 19 Aug 2017 07:00:00 GMT"
3,Carl Sagan saw today’s ‘demon-haunted’ America coming over 20 years ago - MarketWatch,"Sun, 13 Aug 2017 07:00:00 GMT"
4,AVAX Stock Price | Avax S.A. Stock Quote (Greece: Athens) - MarketWatch,"Mon, 02 Oct 2017 01:17:35 GMT"
5,Why Disney chose Lyft over Uber for the theme park’s ‘Minnie Vans’ - MarketWatch,"Wed, 02 Aug 2017 07:00:00 GMT"
6,These are all the companies are trying to stop white supremacists from raising money - MarketWatch,"Sun, 20 Aug 2017 07:00:00 GMT"
7,PREF | Principal Spectrum Preferred Securities Active ETF Overview - MarketWatch,"Sat, 14 Oct 2017 07:52:45 GMT"
8,ELT Stock Price | Elektrotim S.A. Stock Quote (Poland: Warsaw) - MarketWatch,"Sat, 21 Oct 2017 04:35:58 GMT"
9,5 Warren Buffett quotes for anyone who thinks they can pick stocks and get rich like he did - MarketWatch,"Fri, 11 Aug 2017 07:00:00 GMT"
10,Abercrombie & Fitch fills swimsuit void left by Victoria’s Secret - MarketWatch,"Mon, 28 Aug 2017 07:00:00 GMT"
11,Opinion: These 7 billionaires are worried about a stock-market correction - MarketWatch,"Thu, 10 Aug 2017 07:00:00 GMT"
12,Why OkCupid wants to slow things down - MarketWatch,"Tue, 29 Aug 2017 07:00:00 GMT"
13,FCHRF Stock Price | Georg Fischer AG Stock Quote (U.S.: OTC) - MarketWatch,"Tue, 13 Jul 2021 09:50:02 GMT"
14,What that viral New York Times inequality chart really shows - MarketWatch,"Wed, 09 Aug 2017 07:00:00 GMT"
15,ABC reporter Tom Llamas slammed as a snitch for calling police on Houston ‘looters’ - MarketWatch,"Wed, 30 Aug 2017 07:00:00 GMT"
16,AFK | VanEck Africa Index ETF Overview - MarketWatch,"Mon, 02 Oct 2017 20:20:37 GMT"
17,This is the creepiest thing about being harassed online - MarketWatch,"Fri, 11 Aug 2017 07:00:00 GMT"
18,TSM | Taiwan Semiconductor Manufacturing Co. Ltd. ADR Quarterly Balance Sheet - MarketWatch,"Fri, 13 Oct 2017 23:13:52 GMT"
19,5 ways to live in a foreign country for free - MarketWatch,"Fri, 25 Aug 2017 07:00:00 GMT"
20,Baby boomers are way dirtier than millennials - MarketWatch,"Thu, 31 Aug 2017 07:00:00 GMT"
21,‘The Sinner’ signals USA Network’s move to the dark side - MarketWatch,"Wed, 09 Aug 2017 07:00:00 GMT"
22,How bra startups are transforming the way women shop for lingerie - MarketWatch,"Wed, 09 Aug 2017 07:00:00 GMT"
23,Here’s why Twitter won’t ban Donald Trump - MarketWatch,"Sat, 19 Aug 2017 07:00:00 GMT"
24,Apple’s iPhone announcement expected in Sept. 12 event - MarketWatch,"Mon, 28 Aug 2017 07:00:00 GMT"
25,"‘Fire and fury,’ pronounces banner headline of Charlottesville, Va., newspaper - MarketWatch","Sat, 12 Aug 2017 07:00:00 GMT"
26,ACSI | American Customer Satisfaction Core Alpha ETF Overview - MarketWatch,"Fri, 29 Sep 2017 20:36:46 GMT"
27,"Barack Obama’s tweet is the most ‘liked’, 4th most retweeted, in Twitter’s history - MarketWatch","Thu, 17 Aug 2017 07:00:00 GMT"
28,The other Pandora: Jeweler’s stock looks like a good deal - MarketWatch,"Wed, 23 Aug 2017 07:00:00 GMT"
29,What economists say about the jobs report Trump calls ‘excellent’ - MarketWatch,"Fri, 04 Aug 2017 07:00:00 GMT"
30,Here’s how much gasoline we’ll get from the Strategic Petroleum Reserve oil release - MarketWatch,"Thu, 31 Aug 2017 07:00:00 GMT"
31,Opinion: The Trump bump is running on vapor - MarketWatch,"Fri, 25 Aug 2017 07:00:00 GMT"
32,Crocs patent infringement complaint against USA Dawgs rejected - MarketWatch,"Mon, 14 Aug 2017 07:00:00 GMT"
33,Cost of imported goods rose for first time in three months - MarketWatch,"Tue, 15 Aug 2017 07:00:00 GMT"
34,Don’t quit your job if you work in 1 of these 5 industries - MarketWatch,"Thu, 31 Aug 2017 07:00:00 GMT"
35,Yet another twist for retail as Best Buy and Amazon bring back the traveling salesman - MarketWatch,"Tue, 29 Aug 2017 07:00:00 GMT"
36,SDS Stock Price | Seamless Distribution Systems AB Stock Quote (Nordic Growth Market) - MarketWatch,"Sat, 18 Nov 2017 08:09:18 GMT"
37,‘Star Wars: The Last Jedi’: Lego unveils its new sets - MarketWatch,"Thu, 31 Aug 2017 07:00:00 GMT"
38,VBG.B Stock Price | VBG Group AB Series B Stock Quote (Sweden: Stockholm) - MarketWatch,"Mon, 27 May 2019 04:23:53 GMT"
39,"Trump ‘tearing the country apart,’ majority says in poll - MarketWatch","Thu, 31 Aug 2017 07:00:00 GMT"
40,FPXAA | Prague PX Index Overview - MarketWatch,"Sat, 28 Oct 2017 07:48:52 GMT"
41,‘Game of Thrones’: The science behind all that spitting - MarketWatch,"Sun, 06 Aug 2017 07:00:00 GMT"
42,"Are Gates and Bezos really the richest men in the world? Nyet, says one fund manager - MarketWatch","Tue, 01 Aug 2017 07:00:00 GMT"
43,Opinion: Amazon thrives by thumbing its nose at Wall Street - MarketWatch,"Thu, 10 Aug 2017 07:00:00 GMT"
44,KBNT Stock Price | Kubient Inc. Stock Quote (U.S.: OTC) - MarketWatch,"Sat, 08 Aug 2020 01:11:45 GMT"
45,DUK Stock Price | Duke Energy Corp. Stock Quote (U.S.: NYSE) - MarketWatch,"Fri, 08 Dec 2023 22:08:27 GMT"
46,Why loneliness is more dangerous than obesity - MarketWatch,"Sun, 13 Aug 2017 07:00:00 GMT"
47,What we know about Uber’s apparent CEO pick Dara Khosrowshahi - MarketWatch,"Mon, 28 Aug 2017 07:00:00 GMT"
48,"Bitcoin rises, so people Google ‘bitcoin,’ so then bitcoin rises, so then people Google... - MarketWatch","Wed, 16 Aug 2017 07:00:00 GMT"
49,Why supermarkets want to sell you ugly fruits and vegetables - MarketWatch,"Tue, 08 Aug 2017 07:00:00 GMT"
50,APVO | Aptevo Therapeutics Inc. Advanced Charts - MarketWatch,"Sat, 21 Oct 2017 10:54:17 GMT"
51,Here’s the real secret to losing weight and staying thin (Hint: You’re not going to like it) - MarketWatch,"Thu, 31 Aug 2017 07:00:00 GMT"
52,PBI | Pitney Bowes Inc. Advanced Charts - MarketWatch,"Thu, 30 Jul 2009 21:06:20 GMT"
53,FLT Stock Price | Flight Centre Travel Group Ltd. Stock Quote (Australia: Sydney) - MarketWatch,"Thu, 19 Oct 2017 23:01:08 GMT"
54,Bad news for the stock market: The Hindenburg Omen is back - MarketWatch,"Wed, 23 Aug 2017 07:00:00 GMT"
55,This is how much you should spend to get a good umbrella - MarketWatch,"Wed, 16 Aug 2017 07:00:00 GMT"
56,FLMX | Franklin FTSE Mexico ETF Overview - MarketWatch,"Sun, 12 Nov 2017 05:20:59 GMT"
57,It’s B cup or bust: Plastic surgeons tell Moneyish that women want smaller breast implants - MarketWatch,"Tue, 29 Aug 2017 07:00:00 GMT"
58,"Dark side of highly personal grooming: A quarter of people suffer waxing, trimming, ‘manscaping’ injuries - MarketWatch","Sat, 19 Aug 2017 07:00:00 GMT"
59,MPC | Marathon Petroleum Corp. Advanced Charts - MarketWatch,"Fri, 01 Jul 2011 12:20:54 GMT"
60,IGEN | iGen Networks Corp. Advanced Charts - MarketWatch,"Tue, 21 Nov 2017 21:31:58 GMT"
61,Fairfax sells Singapore’s First Capital to Mitsui Sumitomo for $1.6 billion - MarketWatch,"Wed, 23 Aug 2017 07:00:00 GMT"
62,Walmart’s new organic restaurant will have acai bowls and avocado toast - MarketWatch,"Thu, 24 Aug 2017 07:00:00 GMT"
63,One of the most successful hedge-fund pros says we’re ‘nowhere near an overheated’ stock market - MarketWatch,"Sun, 20 Aug 2017 07:00:00 GMT"
64,Target is setting its sights on lucrative children’s market - MarketWatch,"Tue, 22 Aug 2017 07:00:00 GMT"
65,"Dollar to finish year stronger on better inflation, Wells Fargo says - MarketWatch","Mon, 07 Aug 2017 07:00:00 GMT"
66,This is the right way to go food shopping - MarketWatch,"Tue, 29 Aug 2017 07:00:00 GMT"
67,Racking up the ‘favorites’ on Zillow make homes sell faster and for more - MarketWatch,"Tue, 22 Aug 2017 07:00:00 GMT"
68,North Korea steps back from plan to launch missiles at Guam - MarketWatch,"Mon, 14 Aug 2017 07:00:00 GMT"
69,U.S. pets are responsible for 30% of the environmental impact of meat eating - MarketWatch,"Fri, 04 Aug 2017 07:00:00 GMT"
70,EZJ | easyJet PLC Advanced Charts - MarketWatch,"Thu, 09 Nov 2017 01:30:10 GMT"
71,These are the most — and the least — trusted news sources in the U.S. - MarketWatch,"Thu, 31 Aug 2017 07:00:00 GMT"
72,This vodka is made from old Twinkies and stale donuts - MarketWatch,"Wed, 23 Aug 2017 07:00:00 GMT"
73,VXF | Vanguard Extended Market ETF Overview - MarketWatch,"Wed, 04 Oct 2017 22:43:41 GMT"
74,China’s Xi urges Trump to exercise restraint toward North Korea - MarketWatch,"Sat, 12 Aug 2017 07:00:00 GMT"
75,T. Rowe Price names Céline Dufétel Chief Financial Officer - MarketWatch,"Tue, 22 Aug 2017 07:00:00 GMT"
76,How retirees can make money as fake hospital patients - MarketWatch,"Fri, 11 Aug 2017 07:00:00 GMT"
77,OTK Stock Price | Otsuka Corp. Stock Quote (Germany: Frankfurt ) - MarketWatch,"Fri, 20 Oct 2017 21:50:10 GMT"
78,Here’s what happens when you beat Warren Buffett at bridge - MarketWatch,"Wed, 30 Aug 2017 07:00:00 GMT"
79,"This former child star talks anxiety, panic attacks and working with Robin Williams - MarketWatch","Fri, 11 Aug 2017 07:00:00 GMT"
80,"Elon Musk admits to ‘unrelenting stress,’ says he may be bipolar - MarketWatch","Tue, 01 Aug 2017 07:00:00 GMT"
81,Tesla’s relentless push toward autonomous driving has rankled its Autopilot team - MarketWatch,"Thu, 24 Aug 2017 07:00:00 GMT"
82,"How to turn $60 into $40,000: Invest in a poker player and get lucky - MarketWatch","Tue, 01 Aug 2017 07:00:00 GMT"
83,"Where was KPMG, Wells Fargo’s auditor, while the funny business was going on? - MarketWatch","Mon, 21 Aug 2017 07:00:00 GMT"
84,Is MealPal worth it? What I learned after 30 days chasing my subscription lunch - MarketWatch,"Mon, 21 Aug 2017 07:00:00 GMT"
85,"At summer camp, baby boomers relive their youth with archery and show-and-tell - MarketWatch","Mon, 14 Aug 2017 07:00:00 GMT"
86,"If you’re reading this, you have a 19.3% chance of being rich - MarketWatch","Sun, 27 Aug 2017 07:00:00 GMT"
87,Kleiner Perkins to invest $40 million in Tulip.io - MarketWatch,"Tue, 22 Aug 2017 07:00:00 GMT"
88,More than half of women who got an abortion last year were using contraception - MarketWatch,"Fri, 11 Aug 2017 07:00:00 GMT"
89,Victoria’s Secret has a bra problem - MarketWatch,"Sat, 19 Aug 2017 07:00:00 GMT"
90,"How the bond industry changed, 15 years after the first fixed-income ETF - MarketWatch","Fri, 04 Aug 2017 07:00:00 GMT"
91,Opinion: Retailers aren’t hurting because people are buying ‘experiences’ instead of stuff - MarketWatch,"Tue, 22 Aug 2017 07:00:00 GMT"
92,Tiki-torch maker decries use by white supremacists - MarketWatch,"Sun, 13 Aug 2017 07:00:00 GMT"
93,These restaurants are serving up major discounts if you turn off your phone - MarketWatch,"Tue, 22 Aug 2017 07:00:00 GMT"
94,SYF | Synchrony Financial Analyst Estimates - MarketWatch,"Wed, 23 Aug 2017 06:26:50 GMT"
95,"60% of Americans don’t trust Donald Trump, CNN poll finds - MarketWatch","Tue, 08 Aug 2017 07:00:00 GMT"
96,Trump administration could lead to more drinking—through deregulation - MarketWatch,"Tue, 15 Aug 2017 07:00:00 GMT"
97,Here’s how much college tuition costs have soared in each state over the last decade - MarketWatch,"Thu, 24 Aug 2017 07:00:00 GMT"
98,What to do when you have a super-demanding boss - MarketWatch,"Mon, 21 Aug 2017 07:00:00 GMT"
99,Opinion: Stock prices look attractive now — compared to bonds - MarketWatch,"Mon, 21 Aug 2017 07:00:00 GMT"
