,Title,Date
0,undefined - MarketWatch - MarketWatch,"Mon, 12 May 2025 20:17:06 GMT"
1,GFC | Gecina Annual Income Statement - MarketWatch,"Thu, 11 Feb 2021 01:53:47 GMT"
2,LMMRX | ClearBridge Dividend Strategy Fund;R Advanced Charts - MarketWatch,"Thu, 28 Dec 2017 09:40:49 GMT"
3,Opinion: Donald Trump builds the best swamps - MarketWatch,"Sat, 23 Dec 2017 08:00:00 GMT"
4,KCE | SPDR S&P Capital Markets ETF Overview - MarketWatch,"Sun, 08 Oct 2017 19:48:24 GMT"
5,TRMD | Torm PLC Options - MarketWatch,"Wed, 27 Dec 2017 10:04:54 GMT"
6,Here’s how much Uber drivers really make - MarketWatch,"Fri, 01 Dec 2017 08:00:00 GMT"
7,Bob Iger will likely extend tenure as Disney CEO past 2019 retire date - MarketWatch,"Wed, 06 Dec 2017 08:00:00 GMT"
8,Winklevoss twins are believed to be the first bitcoin billionaires - MarketWatch,"Mon, 04 Dec 2017 08:00:00 GMT"
9,How your name can put you at greater risk of identity theft - MarketWatch,"Tue, 19 Dec 2017 08:00:00 GMT"
10,TKO | TKO Group Holdings Inc. Analyst Estimates - MarketWatch,"Thu, 14 Dec 2017 13:44:55 GMT"
11,E3B Stock Price | Eutelsat Communications Stock Quote (Berlin Stock Exchange) - MarketWatch,"Sun, 31 Dec 2017 05:50:08 GMT"
12,‘Outlander’ season 3 finale: Claire and Jamie’s not-so-excellent adventure - MarketWatch,"Sun, 10 Dec 2017 08:00:00 GMT"
13,"Behold, the ‘Holiday Doorman Tip-O-Meter’ is here... - MarketWatch","Sun, 24 Dec 2017 08:00:00 GMT"
14,SPYV Holdings - MarketWatch,"Sun, 10 Dec 2017 08:36:21 GMT"
15,TMBMKGB-20Y | U.K. 20 Year Gilt Advanced Charts - MarketWatch,"Fri, 15 Dec 2017 13:44:12 GMT"
16,GlycoMimetics shares surge 15% premarket - MarketWatch,"Tue, 12 Dec 2017 08:00:00 GMT"
17,ALEX Stock Price | Alexander & Baldwin Inc. Stock Quote (U.S.: NYSE) - MarketWatch,"Fri, 13 Oct 2017 05:35:19 GMT"
18,DBC Holdings - MarketWatch,"Fri, 08 Dec 2017 19:16:12 GMT"
19,Here are the winners and losers of the new tax law - MarketWatch,"Fri, 22 Dec 2017 08:00:00 GMT"
20,SES | SES AI Corp. Options - MarketWatch,"Mon, 11 Dec 2017 07:56:18 GMT"
21,AUDEUR | Australian Dollar/Euro Advanced Charts - MarketWatch,"Thu, 21 Dec 2017 11:18:43 GMT"
22,FMCKJ Stock Price | Freddie Mac 8.375% Non-Cum. Perp. Conv. Pfd. Stock Quote (U.S.: OTC) - MarketWatch,"Wed, 04 Oct 2017 02:25:49 GMT"
23,HIPS | GraniteShares HIPS US High Income ETF Options - MarketWatch,"Wed, 13 Dec 2017 23:14:52 GMT"
24,"He plays the Winter Soldier, but Sebastian Stan may have found his toughest role in ‘I, Tonya’ - MarketWatch","Thu, 07 Dec 2017 08:00:00 GMT"
25,TRZ | Transat A.T. Inc. Annual Income Statement - MarketWatch,"Sun, 17 Jan 2021 11:04:44 GMT"
26,4631 Stock Price | DIC Corp. Stock Quote (Japan: Tokyo) - MarketWatch,"Wed, 24 Mar 2010 23:46:30 GMT"
27,Americans say they are worse off today than 50 years ago - MarketWatch,"Fri, 29 Dec 2017 08:00:00 GMT"
28,BBKCF | BIGG Digital Assets Inc. Analyst Estimates - MarketWatch,"Thu, 28 Dec 2017 13:25:03 GMT"
29,EXROF | Exro Technologies Inc. Analyst Estimates - MarketWatch,"Fri, 15 Dec 2017 12:14:35 GMT"
30,Why buying a 10-year-old car is a savvy move - MarketWatch,"Fri, 29 Dec 2017 08:00:00 GMT"
31,These 55 stocks have at least doubled since Trump was elected - MarketWatch,"Tue, 19 Dec 2017 08:00:00 GMT"
32,EVH | Evolent Health Inc. Cl A Profile - MarketWatch,"Sat, 10 Oct 2020 10:03:13 GMT"
33,Jerusalem may name a train station near Western Wall after Trump - MarketWatch,"Wed, 27 Dec 2017 08:00:00 GMT"
34,More than 13% of the homes in these states are worth more than $1 million - MarketWatch,"Thu, 28 Dec 2017 08:00:00 GMT"
35,NLFSK Stock Price | Nilfisk Holding A/S Stock Quote (Denmark: OMX) - MarketWatch,"Fri, 23 Feb 2018 11:24:29 GMT"
36,PHDG Holdings - MarketWatch,"Wed, 28 Feb 2018 00:30:06 GMT"
37,603387 | Getein Biotech Inc. A Profile - MarketWatch,"Sun, 25 Oct 2020 04:41:06 GMT"
38,G2XJ Holdings - MarketWatch,"Mon, 11 Dec 2017 03:36:17 GMT"
39,FTLF | FitLife Brands Inc. Profile - MarketWatch,"Fri, 09 Oct 2020 18:11:11 GMT"
40,6877 Stock Price | CLSA Premium Ltd. Stock Quote (Hong Kong) - MarketWatch,"Thu, 14 Dec 2017 22:24:47 GMT"
41,STZ | SPDR MSCI Europe Financials UCITS ETF Overview - MarketWatch,"Wed, 13 Dec 2017 02:34:42 GMT"
42,MWC | Manila Water Co. Inc. Advanced Charts - MarketWatch,"Fri, 22 Dec 2017 12:00:14 GMT"
43,Fandango is not worried about the millennial moviegoer - MarketWatch,"Sun, 10 Dec 2017 08:00:00 GMT"
44,"Trump asks Americans, ‘how’s your 401(k)?’ Here’s the answer - MarketWatch","Tue, 19 Dec 2017 08:00:00 GMT"
45,CSEMU | iShares MSCI EMU UCITS ETF Overview - MarketWatch,"Tue, 12 Dec 2017 11:12:14 GMT"
46,Opinion: Why it matters if bitcoin is a currency or a commodity - MarketWatch,"Wed, 13 Dec 2017 08:00:00 GMT"
47,STAI | ScanTech AI Systems Inc. Advanced Charts - MarketWatch,"Thu, 28 Dec 2017 06:00:18 GMT"
48,Here’s how the stock market has handled past government shutdowns - MarketWatch,"Thu, 21 Dec 2017 08:00:00 GMT"
49,VIGI Holdings - MarketWatch,"Sat, 20 Jan 2018 07:53:59 GMT"
50,MSECX Holdings - MarketWatch,"Thu, 28 Dec 2017 18:42:28 GMT"
51,BDX Stock Price | Budimex S.A. Stock Quote (Poland: Warsaw) - MarketWatch,"Sat, 21 Oct 2017 11:59:57 GMT"
52,Why debt can be so dangerous in retirement - MarketWatch,"Fri, 15 Dec 2017 08:00:00 GMT"
53,Meet the most generous tipper in America - MarketWatch,"Tue, 05 Dec 2017 08:00:00 GMT"
54,NOKUSD | Norwegian Krone/U.S. Dollar Advanced Charts - MarketWatch,"Thu, 14 Dec 2017 15:51:49 GMT"
55,BOXL | Boxlight Corp. Analyst Estimates - MarketWatch,"Sun, 03 Dec 2017 12:22:29 GMT"
56,Here are the ways Google and Amazon are fighting - MarketWatch,"Tue, 12 Dec 2017 08:00:00 GMT"
57,DEV Stock Price | DevEx Resources Ltd. Stock Quote (Australia: Sydney) - MarketWatch,"Sun, 10 Dec 2017 20:15:50 GMT"
58,SBB.B | Samhaellsbyggnadsbolaget i Norden AB Series B Annual Income Statement - MarketWatch,"Sat, 16 Jan 2021 06:35:34 GMT"
59,"U.S. gains 228,000 new jobs in November in another strong show of hiring - MarketWatch","Fri, 08 Dec 2017 08:00:00 GMT"
60,IFOS | Itafos Inc. Annual Income Statement - MarketWatch,"Sun, 17 Jan 2021 06:03:24 GMT"
61,SW | Smurfit Westrock PLC Analyst Estimates - MarketWatch,"Thu, 14 Dec 2017 13:09:24 GMT"
62,CCCC | C4 Therapeutics Inc. Analyst Estimates - MarketWatch,"Sun, 03 Dec 2017 12:55:46 GMT"
63,RWWI | Rand Worldwide Inc. Profile - MarketWatch,"Sat, 31 Oct 2020 21:18:02 GMT"
64,RBBN | Ribbon Communications Inc. Analyst Estimates - MarketWatch,"Thu, 14 Dec 2017 11:31:06 GMT"
65,"What the insane circumstances under which Dickens wrote ‘A Christmas Carol’ reveal about money, debt, and success - MarketWatch","Mon, 25 Dec 2017 08:00:00 GMT"
66,TKOMY Stock Price | Tokio Marine Holdings Inc. ADR Stock Quote (U.S.: OTC) - MarketWatch,"Mon, 02 May 2011 12:33:45 GMT"
67,Embattled blood-testing firm Theranos gets $100 million lifeline From Fortress - MarketWatch,"Sat, 23 Dec 2017 08:00:00 GMT"
68,"Nintendo’s blockbuster 2017 comeback, in one chart - MarketWatch","Tue, 26 Dec 2017 08:00:00 GMT"
69,Bitcoin’s anonymous creator just cracked the top 50 richest list - MarketWatch,"Mon, 18 Dec 2017 08:00:00 GMT"
70,U.S. stock trading volume hit a three-year low in 2017 amid near-absent volatility - MarketWatch,"Fri, 22 Dec 2017 08:00:00 GMT"
71,CARG | CarGurus Inc. Cl A Profile - MarketWatch,"Sun, 11 Oct 2020 18:14:50 GMT"
72,601311 | Camel Group Co. Ltd. Annual Income Statement - MarketWatch,"Fri, 18 Jun 2021 01:33:04 GMT"
73,The YouTube channels for investors to watch now - MarketWatch,"Thu, 28 Dec 2017 08:00:00 GMT"
74,SUSCO | SUSCO PCL Annual Income Statement - MarketWatch,"Sat, 16 Jan 2021 23:09:33 GMT"
75,"Ascension, Providence St. Joseph Health merger would create largest U.S. hospital operator - MarketWatch","Sun, 10 Dec 2017 08:00:00 GMT"
76,Sen. Kennedy isn’t quite done humiliating Trump’s judicial nominee - MarketWatch,"Mon, 18 Dec 2017 08:00:00 GMT"
77,Terrorist plot to kill Theresa May thwarted by British agents - MarketWatch,"Wed, 06 Dec 2017 08:00:00 GMT"
78,VML | Vital Metals Ltd. Annual Income Statement - MarketWatch,"Sun, 17 Jan 2021 02:47:41 GMT"
79,Here's how to handle getting fired right before the holidays - MarketWatch,"Sun, 17 Dec 2017 08:00:00 GMT"
80,AI is too smart and busy to knock off humans - MarketWatch,"Fri, 08 Dec 2017 08:00:00 GMT"
81,Southern California stunned by spread of wildfires: ‘We weren’t prepared’ - MarketWatch,"Thu, 07 Dec 2017 08:00:00 GMT"
82,TXG | 10x Genomics Inc. Advanced Charts - MarketWatch,"Sun, 25 Feb 2018 13:52:50 GMT"
83,NNG Stock Price | NanoGroup S.A. Stock Quote (Poland: Warsaw) - MarketWatch,"Wed, 27 Dec 2017 08:07:10 GMT"
84,3563 | Machvision Inc. Advanced Charts - MarketWatch,"Thu, 21 Dec 2017 22:06:47 GMT"
85,ZZ.B Stock Price | Zinzino AB Series B Stock Quote (Sweden: Stockholm) - MarketWatch,"Tue, 21 May 2019 13:43:14 GMT"
86,10 financial lessons you can learn from holiday movies - MarketWatch,"Sat, 23 Dec 2017 08:00:00 GMT"
87,RIGD Stock Price | Reliance Industries Ltd. GDR Stock Quote (U.K.: London) - MarketWatch,"Wed, 18 Oct 2017 03:29:47 GMT"
88,MCGCX | BlackRock Advantage Global Fund;Investor C Advanced Charts - MarketWatch,"Thu, 21 Dec 2017 13:00:55 GMT"
89,IPOs in 2018: Here are six tech companies that could go public - MarketWatch,"Sun, 31 Dec 2017 08:00:00 GMT"
90,How this ‘baby whisperer’ started a thriving business - MarketWatch,"Mon, 04 Dec 2017 08:00:00 GMT"
91,CENER Stock Price | Cenergy Holdings S.A. Stock Quote (Greece: Athens) - MarketWatch,"Wed, 20 Dec 2017 01:35:07 GMT"
92,RCBBX | American Funds Corporate Bond Fund;R2 Advanced Charts - MarketWatch,"Sun, 10 Dec 2017 05:28:54 GMT"
93,PAT Stock Price | Panthera Resources PLC Stock Quote (U.K.: London) - MarketWatch,"Thu, 28 Dec 2017 07:29:57 GMT"
94,Opinion: Both parties are total hypocrites about budget deficits - MarketWatch,"Wed, 06 Dec 2017 08:00:00 GMT"
95,Think you can time the stock market? Look at this chart first - MarketWatch,"Mon, 11 Dec 2017 08:00:00 GMT"
96,Amazon wants to disrupt the neighborhood pharmacy—but its sketchy health products could get in the way - MarketWatch,"Mon, 04 Dec 2017 08:00:00 GMT"
97,AR | Antero Resources Corp. Options - MarketWatch,"Sat, 09 Dec 2017 00:12:26 GMT"
98,SAVA | Cassava Sciences Inc. Advanced Charts - MarketWatch,"Fri, 01 Dec 2017 15:22:22 GMT"
99,Police raid Gucci offices in tax probe: reports - MarketWatch,"Mon, 04 Dec 2017 08:00:00 GMT"
