,Title,Date
0,Idexx Laboratories downgraded to hold from buy at Stifel Nicolaus - MarketWatch,"Mon, 25 Jul 2022 07:00:00 GMT"
1,"Saputo Inc. stock rises Thursday, still underperforms market - MarketWatch","Thu, 28 Jul 2022 07:00:00 GMT"
2,NexTier Oilfield Solutions downgraded to neutral from buy at BofA Securities - MarketWatch,"Fri, 15 Jul 2022 07:00:00 GMT"
3,"TC Energy Corp. stock rises Thursday, outperforms market - MarketWatch","Thu, 14 Jul 2022 07:00:00 GMT"
4,VTEX downgraded to sector weight from overweight at KeyBanc Capital - MarketWatch,"Thu, 07 Jul 2022 07:00:00 GMT"
5,"Alphabet Inc. Cl A stock falls Friday, underperforms market - MarketWatch","Fri, 22 Jul 2022 07:00:00 GMT"
6,Vornado Realty Trust stock price target cut to $32 from $38 at Mizuho - MarketWatch,"Wed, 06 Jul 2022 07:00:00 GMT"
7,Purple Innovation stock price target cut to $10 from $14 at KeyBanc Capital - MarketWatch,"Mon, 11 Jul 2022 07:00:00 GMT"
8,Datadog stock price target cut to $132 from $160 at KeyBanc Capital - MarketWatch,"Fri, 22 Jul 2022 07:00:00 GMT"
9,Datadog stock price target cut to $130 from $160 at Monness Crespi Hardt - MarketWatch,"Tue, 26 Jul 2022 07:00:00 GMT"
10,CytomX Therapeutics stock price target cut to $2 from $6 at Wedbush - MarketWatch,"Thu, 07 Jul 2022 07:00:00 GMT"
11,CytomX Therapeutics stock price target cut to $4 from $16 at Mizuho - MarketWatch,"Thu, 07 Jul 2022 07:00:00 GMT"
12,Abiomed Inc. stock underperforms Wednesday when compared to competitors - MarketWatch,"Wed, 06 Jul 2022 07:00:00 GMT"
13,SL Green Realty Corp. stock underperforms Wednesday when compared to competitors - MarketWatch,"Wed, 06 Jul 2022 07:00:00 GMT"
14,China’s booming fast-fashion giant Shein faces dozens of U.S. lawsuits alleging design theft - MarketWatch,"Sun, 03 Jul 2022 07:00:00 GMT"
15,FORTUM Stock Price | Fortum Oyj Stock Quote (Finland: Helsinki) - MarketWatch,"Wed, 18 Oct 2017 02:24:51 GMT"
16,"Pfizer Inc. stock rises Thursday, still underperforms market - MarketWatch","Thu, 07 Jul 2022 07:00:00 GMT"
17,War inflation is slowing. Here's the S&P 500 level where a Bank of America strategist says investors should 'gorge' on stocks. - MarketWatch,"Sat, 16 Jul 2022 07:00:00 GMT"
18,"Biden signs into law $280 billion package for chips, scientific research — here’s what’s in it - MarketWatch","Wed, 27 Jul 2022 07:00:00 GMT"
19,SGHT Stock Price | Sight Sciences Inc. Stock Quote (U.S.: Nasdaq) - MarketWatch,"Wed, 23 Jun 2021 22:12:16 GMT"
20,The Science Behind How Abortion Pills Work - MarketWatch,"Fri, 01 Jul 2022 07:00:00 GMT"
21,PLTU | Direxion Daily PLTR Bull 2X Shares Overview - MarketWatch,"Thu, 12 Dec 2024 22:55:53 GMT"
22,524804 Stock Price | Aurobindo Pharma Ltd. Stock Quote (India: Bombay) - MarketWatch,"Thu, 19 Oct 2017 00:36:40 GMT"
23,Opinion: The Fed’s rate hikes alone won’t cure inflation - MarketWatch,"Mon, 25 Jul 2022 07:00:00 GMT"
24,"Norfolk Southern Corp. stock falls Tuesday, still outperforms market - MarketWatch","Tue, 26 Jul 2022 07:00:00 GMT"
25,‘No way’: Missouri attorney general threatens to sue cities that help cover out-of-state abortion travel - MarketWatch,"Tue, 05 Jul 2022 07:00:00 GMT"
26,TELE Stock Price | Telecure Technologies Inc. Stock Quote (Canadian Securities Exchange) - MarketWatch,"Mon, 06 Sep 2021 12:21:47 GMT"
27,European stocks decrease Tuesday - MarketWatch,"Tue, 05 Jul 2022 07:00:00 GMT"
28,"U.S. inflation climbs to new 41-year high of 9.1%, CPI shows, as gas prices surge - MarketWatch","Wed, 13 Jul 2022 07:00:00 GMT"
29,"M&T Bank Corp. stock rises Thursday, still underperforms market - MarketWatch","Thu, 28 Jul 2022 07:00:00 GMT"
30,ECPG Stock Price | Encore Capital Group Inc. Stock Quote (U.S.: Nasdaq) - MarketWatch,"Sat, 17 Dec 2016 09:19:36 GMT"
31,"Consolidated Edison Inc. stock rises Friday, still underperforms market - MarketWatch","Fri, 29 Jul 2022 07:00:00 GMT"
32,These are the 10 best LGBTQ+ friendly countries to retire to - MarketWatch,"Fri, 08 Jul 2022 07:00:00 GMT"
33,Forget the 1970s — this market is drawing comparisons to the 1870s - MarketWatch,"Sat, 02 Jul 2022 07:00:00 GMT"
34,9956 Stock Price | Valor Holdings Co. Ltd. Stock Quote (Japan: Tokyo) - MarketWatch,"Sat, 21 Oct 2017 11:16:01 GMT"
35,TSMX | Direxion Daily TSM Bull 2X Shares Overview - MarketWatch,"Sun, 20 Oct 2024 05:50:16 GMT"
36,Chinese bank depositors face off with police in angry protest - MarketWatch,"Sun, 10 Jul 2022 07:00:00 GMT"
37,TGOL Stock Price | Thunder Gold Corp. Stock Quote (Canada: TSX Venture) - MarketWatch,"Sun, 17 Jul 2022 07:58:38 GMT"
38,REWLD | Amundi FTSE EPRA/NAREIT Global Developed UCITS ETF Overview - MarketWatch,"Fri, 17 Nov 2017 03:43:22 GMT"
39,Rising inflation pushes staggering 71 million people worldwide into poverty - MarketWatch,"Thu, 07 Jul 2022 07:00:00 GMT"
40,"Choco Tacos have been discontinued, and fans of the ice cream treat are melting down - MarketWatch","Mon, 25 Jul 2022 07:00:00 GMT"
41,"After Tesla sold most of its bitcoin, Elon Musk says he is open to buying more, though 'cryptocurrency is a side show' - MarketWatch","Wed, 20 Jul 2022 07:00:00 GMT"
42,HKD | AMTD Digital Inc. ADR Advanced Charts - MarketWatch,"Fri, 15 Jul 2022 23:15:41 GMT"
43,SINCH Stock Price | Sinch AB Stock Quote (Sweden: Stockholm) - MarketWatch,"Sat, 23 Feb 2019 10:24:44 GMT"
44,"Boris Johnson resigns, but will remain U.K. prime minister for now - MarketWatch","Thu, 07 Jul 2022 07:00:00 GMT"
45,"Jacobs Engineering Group Inc. stock falls Friday, underperforms market - MarketWatch","Fri, 01 Jul 2022 07:00:00 GMT"
46,Donald Trump left the White House in January 2021 and is still using the presidential seal at his New Jersey golf club - MarketWatch,"Fri, 29 Jul 2022 07:00:00 GMT"
47,"What possible credit-card legislation could mean for Visa, Mastercard — and you - MarketWatch","Wed, 27 Jul 2022 07:00:00 GMT"
48,RIO Stock Price | Bodegas Riojanas S.A. Stock Quote (Spain: Madrid ) - MarketWatch,"Wed, 18 Oct 2017 16:41:57 GMT"
49,Bobby Bonilla Day: Here are current and retired players with deferred payments - MarketWatch,"Fri, 01 Jul 2022 07:00:00 GMT"
50,"Bill Russell, NBA great and Celtics legend, dies at 88 - MarketWatch","Sun, 31 Jul 2022 07:00:00 GMT"
51,Big Tech earnings are about to determine the direction of the market - MarketWatch,"Mon, 25 Jul 2022 07:00:00 GMT"
52,"Tesla's margins shrink despite ‘embarrassing’ price increases, putting Elon Musk in a tough spot - MarketWatch","Wed, 20 Jul 2022 07:00:00 GMT"
53,"United Airlines Holdings Inc. stock falls Tuesday, underperforms market - MarketWatch","Tue, 26 Jul 2022 07:00:00 GMT"
54,Activison stock upgraded on ‘increasingly compelling’ merger-arbitrage opportunity - MarketWatch,"Mon, 25 Jul 2022 07:00:00 GMT"
55,MGTX Stock Price | MeiraGTx Holdings PLC Stock Quote (U.S.: Nasdaq) - MarketWatch,"Wed, 06 Jun 2018 23:59:33 GMT"
56,Latest from Tonya Garcia - MarketWatch,"Tue, 18 Dec 2018 04:12:14 GMT"
57,- MarketWatch,"Fri, 08 Jul 2022 16:17:30 GMT"
58,EMI | Emperador Inc. Profile - MarketWatch,"Mon, 11 Jul 2022 02:24:02 GMT"
59,3888 Stock Price | Kingsoft Corp. Ltd. Stock Quote (Hong Kong) - MarketWatch,"Thu, 27 Aug 2009 10:26:15 GMT"
60,MarketAxess Holdings Inc. stock outperforms market on strong trading day - MarketWatch,"Tue, 05 Jul 2022 07:00:00 GMT"
61,AI | Air Liquide S.A. Advanced Charts - MarketWatch,"Fri, 24 Nov 2017 08:56:22 GMT"
62,DraftKings Inc. stock outperforms competitors on strong trading day - MarketWatch,"Tue, 12 Jul 2022 07:00:00 GMT"
63,SSAAY Stock Price | SSAB AB ADR Stock Quote (U.S.: OTC) - MarketWatch,"Wed, 18 Oct 2017 02:29:32 GMT"
64,Upstart stock plunges again after admitting it won’t hit disappointing forecast - MarketWatch,"Thu, 07 Jul 2022 07:00:00 GMT"
65,CEZZY Stock Price | Cez A.S. ADR 144A Stock Quote (U.S.: OTC) - MarketWatch,"Sun, 22 Oct 2017 21:03:24 GMT"
66,"Prudential Financial Inc. stock rises Wednesday, outperforms market - MarketWatch","Wed, 20 Jul 2022 07:00:00 GMT"
67,Genuine Parts Co. stock underperforms Thursday when compared to competitors despite daily gains - MarketWatch,"Thu, 28 Jul 2022 07:00:00 GMT"
68,Ericsson shares skid after missing profit expectations - MarketWatch,"Thu, 14 Jul 2022 07:00:00 GMT"
69,GE to name its power business GE Vernova after split off - MarketWatch,"Mon, 18 Jul 2022 07:00:00 GMT"
70,500180 Stock Price | HDFC Bank Ltd. Stock Quote (India: Bombay) - MarketWatch,"Wed, 23 Mar 2011 05:00:13 GMT"
71,"5 of the best-rated laptops you can buy right now, including a new MacBook for under $1,000 - MarketWatch","Sat, 23 Jul 2022 07:00:00 GMT"
72,FOCUS | Barron's Future Focus Stock Index Overview - MarketWatch,"Fri, 07 May 2021 15:30:58 GMT"
73,Bank of America Corp. stock outperforms market despite losses on the day - MarketWatch,"Mon, 11 Jul 2022 07:00:00 GMT"
74,Becton Dickinson & Co. stock outperforms competitors despite losses on the day - MarketWatch,"Tue, 12 Jul 2022 07:00:00 GMT"
75,Minor league baseball salary: Manfred defends 'living wage' for minor leaguers - MarketWatch,"Wed, 20 Jul 2022 07:00:00 GMT"
76,Gold futures post back-to-back session losses - MarketWatch,"Tue, 26 Jul 2022 07:00:00 GMT"
77,"Rich nations caused climate harm to poorer ones, Dartmouth study says - MarketWatch","Wed, 13 Jul 2022 07:00:00 GMT"
78,"Paramount Global Cl B stock falls Wednesday, underperforms market - MarketWatch","Wed, 06 Jul 2022 07:00:00 GMT"
79,Mattel stock turns lower as American Girl sales drop - MarketWatch,"Thu, 21 Jul 2022 07:00:00 GMT"
80,Hess Corp. stock outperforms market on strong trading day - MarketWatch,"Fri, 29 Jul 2022 07:00:00 GMT"
81,Gap Inc. stock underperforms Wednesday when compared to competitors - MarketWatch,"Wed, 06 Jul 2022 07:00:00 GMT"
82,Don’t fear the bear. It gives you chances to pick winning stocks and beat the market. - MarketWatch,"Wed, 13 Jul 2022 07:00:00 GMT"
83,Nancy Pelosi’s husband sells $4 million worth of Nvidia stock at a major loss - MarketWatch,"Wed, 27 Jul 2022 07:00:00 GMT"
84,‘I am freaking out!’ I started investing money with a robo-adviser in September. I’ve lost money. How am I doing? Should I keep going? - MarketWatch,"Wed, 13 Jul 2022 07:00:00 GMT"
85,Biden administration says releases from oil reserves cut gasoline prices by up to 40 cents per gallon - MarketWatch,"Tue, 26 Jul 2022 07:00:00 GMT"
86,Roper Technologies Inc. stock outperforms competitors on strong trading day - MarketWatch,"Thu, 14 Jul 2022 07:00:00 GMT"
87,"Walt Disney Co. stock rises Thursday, still underperforms market - MarketWatch","Thu, 07 Jul 2022 07:00:00 GMT"
88,"As America swelters, these stocks could be heat-wave winners - MarketWatch","Mon, 25 Jul 2022 07:00:00 GMT"
89,Beer-flavored mac ’n’ cheese is now a thing - MarketWatch,"Fri, 29 Jul 2022 07:00:00 GMT"
90,"If this stock market is shaping up like 2008, here's where we could be headed next, says strategist - MarketWatch","Mon, 11 Jul 2022 07:00:00 GMT"
91,CABK Stock Price | CaixaBank S.A. Stock Quote (Spain: Madrid ) - MarketWatch,"Tue, 17 Oct 2017 21:55:30 GMT"
92,20 of the best early Amazon Prime Day deals you can get right now - MarketWatch,"Thu, 07 Jul 2022 07:00:00 GMT"
93,U.S. jobless claims jump to highest level since November - MarketWatch,"Thu, 21 Jul 2022 07:00:00 GMT"
94,ROAR Stock Price | Lion Rock Resources Inc. Stock Quote (Canada: TSX Venture) - MarketWatch,"Wed, 13 Jul 2022 02:53:15 GMT"
95,GRRR | Gorilla Technology Group Inc. SEC Filings - MarketWatch,"Fri, 15 Jul 2022 23:05:22 GMT"
96,Scared of stocks? Most investors are too conservative with their retirement plans. - MarketWatch,"Fri, 01 Jul 2022 07:00:00 GMT"
97,Visionary Visa founder Dee Hock dies at 93 - MarketWatch,"Wed, 20 Jul 2022 07:00:00 GMT"
98,UBS isn’t yet a believer in the rally. Here’s its advice on what to do now. - MarketWatch,"Fri, 22 Jul 2022 07:00:00 GMT"
99,Emerson Electric Co. stock outperforms competitors despite losses on the day - MarketWatch,"Mon, 11 Jul 2022 07:00:00 GMT"
