,Title,Date
0,"Coca-Cola, Dow Inc. share losses contribute to Dow's nearly 275-point fall - MarketWatch","Thu, 16 Sep 2021 07:00:00 GMT"
1,Uber Technologies Inc. stock underperforms Thursday when compared to competitors despite daily gains - MarketWatch,"Thu, 23 Sep 2021 07:00:00 GMT"
2,Gold ends higher as global stocks tumble on ‘big risk-off trading day’ sparked by Evergrande - MarketWatch,"Mon, 20 Sep 2021 07:00:00 GMT"
3,"'I’m taking care of everybody, and now I want somebody to take care of me': The high price of America's care-worker crisis - MarketWatch","Wed, 29 Sep 2021 07:00:00 GMT"
4,Diageo will use wind and solar to make Bulleit bourbon at first carbon-neutral facility in North America - MarketWatch,"Tue, 28 Sep 2021 07:00:00 GMT"
5,BKSY | BlackSky Technology Inc. Analyst Estimates - MarketWatch,"Tue, 14 Sep 2021 03:38:45 GMT"
6,PRCT | PROCEPT BioRobotics Corp. Profile - MarketWatch,"Wed, 15 Sep 2021 07:59:47 GMT"
7,SOPA | Society Pass Inc. Analyst Estimates - MarketWatch,"Thu, 07 Oct 2021 16:46:37 GMT"
8,VIXY | ProShares VIX Short-Term Futures ETF Overview - MarketWatch,"Sun, 15 Oct 2017 01:56:43 GMT"
9,MODU Stock Price | Modulight Oyj Stock Quote (Finland: Helsinki) - MarketWatch,"Fri, 24 Sep 2021 04:50:39 GMT"
10,ACHR | Archer Aviation Inc. SEC Filings - MarketWatch,"Fri, 17 Sep 2021 20:56:37 GMT"
11,Short-selling stocks — and trying to play short squeezes — can be very dangerous - MarketWatch,"Wed, 15 Sep 2021 07:00:00 GMT"
12,eBay Inc. stock underperforms Friday when compared to competitors - MarketWatch,"Fri, 17 Sep 2021 07:00:00 GMT"
13,Salesforce.com Inc. stock outperforms market on strong trading day - MarketWatch,"Thu, 30 Sep 2021 07:00:00 GMT"
14,UAC Stock Price | UAC Global PCL Stock Quote (Thailand: Bangkok ) - MarketWatch,"Wed, 18 Oct 2017 00:57:25 GMT"
15,Burger King is permanently banning these 120 ingredients from its menu - MarketWatch,"Thu, 09 Sep 2021 07:00:00 GMT"
16,"Waste Connections Inc. stock falls Tuesday, still outperforms market - MarketWatch","Tue, 28 Sep 2021 07:00:00 GMT"
17,"Micron Technology Inc. stock rises Friday, still underperforms market - MarketWatch","Fri, 24 Sep 2021 07:00:00 GMT"
18,"Reddit’s ‘Apes’ have gone bananas and made Dole — yes, Dole — a meme stock - MarketWatch","Thu, 30 Sep 2021 07:00:00 GMT"
19,"Litecoin hoax highlights crypto market vulnerable to scams: 'Walmart has no relationship with litecoin,' says big box retailer - MarketWatch","Mon, 13 Sep 2021 07:00:00 GMT"
20,Cookie monsters: Pokemon Mew Oreos are selling for tens of thousands of dollars on eBay - MarketWatch,"Wed, 29 Sep 2021 07:00:00 GMT"
21,CTEK Stock Price | CTEK AB Stock Quote (Sweden: Stockholm) - MarketWatch,"Tue, 28 Sep 2021 08:07:24 GMT"
22,Blackstone buys maker of LiftMaster garage doors - MarketWatch,"Tue, 07 Sep 2021 07:00:00 GMT"
23,The $1 trillion that has flowed to global stocks in 2021 is bigger than the last 20 years combined - MarketWatch,"Fri, 10 Sep 2021 07:00:00 GMT"
24,Hollywood Superagent Ari Emanuel Selling Brentwood Home for $25.9M - MarketWatch,"Thu, 16 Sep 2021 07:00:00 GMT"
25,House made of shipping containers sells for $5 million - MarketWatch,"Mon, 06 Sep 2021 07:00:00 GMT"
26,FedEx Corp. stock outperforms market despite losses on the day - MarketWatch,"Fri, 10 Sep 2021 07:00:00 GMT"
27,"'A perfect storm of horrible': A single mother, whose daughter has anorexia, lost her unemployment benefits --- now the rent is due - MarketWatch","Tue, 14 Sep 2021 07:00:00 GMT"
28,Eargo stock plummets to record low as the former hot IPO is now a target of a DOJ criminal probe - MarketWatch,"Thu, 23 Sep 2021 07:00:00 GMT"
29,Crypto-trading hamster Mr. Goxx has outperformed the S&P 500 since June - MarketWatch,"Tue, 28 Sep 2021 07:00:00 GMT"
30,ACHR | Archer Aviation Inc. Annual Cash Flow Statement - MarketWatch,"Fri, 17 Sep 2021 20:57:18 GMT"
31,ARQQ | Arqit Quantum Inc. Profile - MarketWatch,"Fri, 22 Oct 2021 03:42:36 GMT"
32,Fed’s Mester backs taper of bond purchases starting in November - MarketWatch,"Fri, 24 Sep 2021 07:00:00 GMT"
33,2216 Stock Price | Broncus Holding Corp. Stock Quote (Hong Kong) - MarketWatch,"Sat, 18 Sep 2021 20:39:04 GMT"
34,Why a private clinic says it won’t test Candace Owens for COVID-19 - MarketWatch,"Thu, 02 Sep 2021 07:00:00 GMT"
35,543320 Stock Price | Eternal Ltd. Stock Quote (India: Bombay) - MarketWatch,"Sun, 05 Sep 2021 16:17:03 GMT"
36,Whirlpool Corp. stock underperforms Monday when compared to competitors despite daily gains - MarketWatch,"Mon, 27 Sep 2021 07:00:00 GMT"
37,AVUV | Avantis U.S. Small-Cap Value ETF Overview - MarketWatch,"Sun, 20 Oct 2019 11:45:36 GMT"
38,CBI Stock Price | Commercial Bank International P.S.C. Stock Quote (Abu Dhabi Securities Exchange) - MarketWatch,"Sun, 25 Aug 2019 05:15:12 GMT"
39,PFE | Pfizer Inc. Profile - MarketWatch,"Fri, 09 Oct 2020 04:09:00 GMT"
40,Asian markets tumble as Wall Street finishes a miserable month - MarketWatch,"Thu, 30 Sep 2021 07:00:00 GMT"
41,Corbus Pharmaceuticals Holdings Inc. stock outperforms market on strong trading day - MarketWatch,"Wed, 15 Sep 2021 07:00:00 GMT"
42,"Bank of America Corp. stock rises Thursday, outperforms market - MarketWatch","Thu, 09 Sep 2021 07:00:00 GMT"
43,"Dollarama Inc. stock rises Wednesday, outperforms market - MarketWatch","Wed, 08 Sep 2021 07:00:00 GMT"
44,Federal Reserve meeting days have been good for the stock market — until Powell starts talking - MarketWatch,"Wed, 22 Sep 2021 07:00:00 GMT"
45,"My bank accidentally deposited $10K in my account. I reported it, then moved it to my savings account. Have I done enough? - MarketWatch","Thu, 23 Sep 2021 07:00:00 GMT"
46,"INVESCO Ltd. stock falls Thursday, underperforms market - MarketWatch","Thu, 30 Sep 2021 07:00:00 GMT"
47,ACHR | Archer Aviation Inc. Profile - MarketWatch,"Sun, 10 Oct 2021 14:08:20 GMT"
48,"Wheaton Precious Metals Corp. stock falls Wednesday, underperforms market - MarketWatch","Wed, 29 Sep 2021 07:00:00 GMT"
49,"JPMorgan says buy that S&P 500 dip, but you might want to look at this chart first - MarketWatch","Tue, 21 Sep 2021 07:00:00 GMT"
50,"Algonquin Power & Utilities Corp. stock falls Thursday, underperforms market - MarketWatch","Thu, 09 Sep 2021 07:00:00 GMT"
51,AI-assisted robots could reduce surgery complications by 5 times - MarketWatch,"Wed, 22 Sep 2021 07:00:00 GMT"
52,"AES Corp. stock falls Wednesday, underperforms market - MarketWatch","Wed, 22 Sep 2021 07:00:00 GMT"
53,VENTANAS Stock Price | Puerto Ventanas S.A. Stock Quote (Chile: Santiago) - MarketWatch,"Sat, 18 Nov 2017 09:33:29 GMT"
54,Norwegian Cruise Line Holdings Ltd. stock outperforms market despite losses on the day - MarketWatch,"Tue, 28 Sep 2021 07:00:00 GMT"
55,Here's why Robert Shiller's two stock-market indexes are telling wildly different valuation stories. - MarketWatch,"Wed, 01 Sep 2021 07:00:00 GMT"
56,"Is it cheaper to book hotels in advance, or to wait? - MarketWatch","Tue, 14 Sep 2021 07:00:00 GMT"
57,RDW | Redwire Corp. Analyst Estimates - MarketWatch,"Tue, 07 Sep 2021 05:38:40 GMT"
58,Evergrande sends Dow down 800 points: What investors need to know about China's teetering property giant - MarketWatch,"Mon, 20 Sep 2021 07:00:00 GMT"
59,5 hottest destinations in America right now for a fall vacation - MarketWatch,"Sat, 18 Sep 2021 07:00:00 GMT"
60,Asbury Automotive to acquire Larry H. Miller Dealerships and Total Care Auto in $3.2 billion deal - MarketWatch,"Wed, 29 Sep 2021 07:00:00 GMT"
61,Martin Marietta Materials Inc. stock outperforms competitors despite losses on the day - MarketWatch,"Tue, 07 Sep 2021 07:00:00 GMT"
62,MassMutual fined $4 million for failing to monitor GameStop booster Kevin Gill - MarketWatch,"Thu, 16 Sep 2021 07:00:00 GMT"
63,"Dow's 150-point jump highlighted by gains in shares of Boeing, Merck - MarketWatch","Wed, 29 Sep 2021 07:00:00 GMT"
64,CNI Stock Price | Centuria Capital Group Stock Quote (Australia: Sydney) - MarketWatch,"Mon, 06 Nov 2017 06:34:10 GMT"
65,RSV Stock Price | Robinson PLC Stock Quote (Berlin Stock Exchange) - MarketWatch,"Mon, 06 Sep 2021 15:28:58 GMT"
66,Nintendo Co. Ltd. ADR underperforms Tuesday when compared to competitors - MarketWatch,"Tue, 28 Sep 2021 07:00:00 GMT"
67,NCAA to start using ‘March Madness’ branding for women’s tournament - MarketWatch,"Thu, 30 Sep 2021 07:00:00 GMT"
68,Taco Bell's new Crispy Chicken Sandwich Taco is a taco-sandwich hybrid that's not sure to satisfy - MarketWatch,"Thu, 30 Sep 2021 07:00:00 GMT"
69,Here’s what would happen if Americans could look up everyone’s salary - MarketWatch,"Thu, 30 Sep 2021 07:00:00 GMT"
70,Here’s how the stock market has performed in past government shutdowns - MarketWatch,"Wed, 29 Sep 2021 07:00:00 GMT"
71,"Nike could lose production of 160 million pairs of shoes due to COVID-related facility closures in Vietnam, according to BTIG - MarketWatch","Mon, 13 Sep 2021 07:00:00 GMT"
72,SAENF Stock Price | Solar Alliance Energy Inc. Stock Quote (U.S.: OTC) - MarketWatch,"Sat, 14 Oct 2017 00:21:16 GMT"
73,"Abbott Laboratories stock rises Wednesday, outperforms market - MarketWatch","Wed, 08 Sep 2021 07:00:00 GMT"
74,IYE | iShares U.S. Energy ETF Overview - MarketWatch,"Sun, 01 Oct 2017 04:05:38 GMT"
75,Mastercard gets into the BNPL game with new installment offering - MarketWatch,"Tue, 28 Sep 2021 07:00:00 GMT"
76,Whole Foods to add Amazon's 'Just Walk Out' technology to two stores - MarketWatch,"Wed, 08 Sep 2021 07:00:00 GMT"
77,PFE Stock Price | Pfizer Inc. Stock Quote (Germany: Xetra ) - MarketWatch,"Sat, 21 Oct 2017 07:21:42 GMT"
78,Tyson Foods Inc. Cl A stock outperforms market despite losses on the day - MarketWatch,"Mon, 20 Sep 2021 07:00:00 GMT"
79,Simon Property Group Inc. stock underperforms Monday when compared to competitors - MarketWatch,"Mon, 20 Sep 2021 07:00:00 GMT"
80,"PPL Corp. stock falls Tuesday, still outperforms market - MarketWatch","Tue, 28 Sep 2021 07:00:00 GMT"
81,Fifth Third Bancorp stock outperforms market on strong trading day - MarketWatch,"Mon, 27 Sep 2021 07:00:00 GMT"
82,The U.S. is welcoming back international tourists — but it could complicate your holiday travel plans - MarketWatch,"Mon, 20 Sep 2021 07:00:00 GMT"
83,Sept. 11 attacks: Windows on the World chef on his near-miss on 9/11 - MarketWatch,"Fri, 10 Sep 2021 07:00:00 GMT"
84,Health officials debunk Nicki Minaj’s claim that COVID vaccine caused impotence - MarketWatch,"Wed, 15 Sep 2021 07:00:00 GMT"
85,‘Now Hiring 14 & 15 year olds’: Oregon McDonald’s looks to combat labor shortage - MarketWatch,"Wed, 01 Sep 2021 07:00:00 GMT"
86,'Buy the dip' is a horrible stock-market strategy -- and these charts prove it - MarketWatch,"Tue, 21 Sep 2021 07:00:00 GMT"
87,Equinix Inc. stock outperforms market on strong trading day - MarketWatch,"Wed, 22 Sep 2021 07:00:00 GMT"
88,ACHR.WT | Archer Aviation Inc. Wt Profile - MarketWatch,"Fri, 04 Feb 2022 11:04:19 GMT"
89,"Emotional AI and other 'moonshot' technologies could grow to $6 trillion market by 2030, says Bank of America - MarketWatch","Thu, 16 Sep 2021 07:00:00 GMT"
90,Xerox Holdings Corp. stock outperforms competitors despite losses on the day - MarketWatch,"Fri, 10 Sep 2021 07:00:00 GMT"
91,These are the most important things to check on a stock's quote page before deciding whether to buy or sell - MarketWatch,"Sat, 04 Sep 2021 07:00:00 GMT"
92,MREIT | MREIT Inc. Profile - MarketWatch,"Fri, 24 Sep 2021 14:15:05 GMT"
93,KEEPR | Keepers Holdings Inc. Profile - MarketWatch,"Sat, 16 Apr 2022 08:54:50 GMT"
94,"IPG Photonics Corp. stock rises Tuesday, outperforms market - MarketWatch","Tue, 07 Sep 2021 07:00:00 GMT"
95,TOST | Toast Inc. Analyst Estimates - MarketWatch,"Thu, 23 Sep 2021 03:30:12 GMT"
96,This humble car has quietly reached a major milestone - MarketWatch,"Tue, 07 Sep 2021 07:00:00 GMT"
97,Schlumberger Ltd. stock underperforms Friday when compared to competitors despite daily gains - MarketWatch,"Fri, 10 Sep 2021 07:00:00 GMT"
98,"Gold prices settle higher, as Evergrande woes boost the metal’s haven appeal - MarketWatch","Fri, 24 Sep 2021 07:00:00 GMT"
99,3221 | Tai-Saw Technology Co. Ltd. Advanced Charts - MarketWatch,"Sat, 18 Sep 2021 15:37:26 GMT"
