,Title,Date
0,"Fed cuts rate by a quarter point, cites 'global developments,' 'muted inflation' - CNBC","Wed, 31 Jul 2019 07:00:00 GMT"
1,"Beyond Meat's chicken came first, and it was a failure. Wall Street and investors don't care - CNBC","Mon, 29 Jul 2019 07:00:00 GMT"
2,"How Canon, Nikon and other Japanese camera companies are fighting for survival in the Smartphone era - CNBC","Sun, 28 Jul 2019 07:00:00 GMT"
3,Amazon reveals the truth on why it nixed New York and chose Virginia for its HQ2 - CNBC,"Wed, 10 Jul 2019 07:00:00 GMT"
4,I've been a 'millennial therapist' for more than 5 years—and this is their No. 1 complaint - CNBC,"Tue, 02 Jul 2019 07:00:00 GMT"
5,"Mythbusters' Adam Savage spent 14 years and over $15,000 building a single Comic-Con costume - CNBC","Thu, 18 Jul 2019 07:00:00 GMT"
6,Retiring this year? How much you'll need for health-care costs - CNBC,"Thu, 18 Jul 2019 07:00:00 GMT"
7,Apple beats rivals to be named top company in the US for solar - CNBC,"Thu, 25 Jul 2019 07:00:00 GMT"
8,"Feds end probe of hush money that Trump lawyer Michael Cohen directed to Stormy Daniels, Karen McDougal - CNBC","Wed, 17 Jul 2019 07:00:00 GMT"
9,LA becomes largest city in US to formally include LGBTQ businesses in contract process worth billions - CNBC,"Fri, 26 Jul 2019 07:00:00 GMT"
10,Here's what the average American typically pays in 401(k) fees - CNBC,"Mon, 22 Jul 2019 07:00:00 GMT"
11,Why Fiat's classic Italian cars are struggling in the US - CNBC,"Mon, 08 Jul 2019 07:00:00 GMT"
12,Sally Shin Profile - CNBC,"Sat, 26 Sep 2015 20:36:30 GMT"
13,Unilever's plan to stop massive plastic pollution from destroying the oceans - CNBC,"Sun, 14 Jul 2019 07:00:00 GMT"
14,"Greek 10-year yield dips under 2% for first time ever, back below US 10-year - CNBC","Thu, 25 Jul 2019 07:00:00 GMT"
15,The island that was used to promote the Fyre Festival is on sale for $11.8 million - CNBC,"Wed, 03 Jul 2019 07:00:00 GMT"
16,The Latino community is in a retirement crisis - CNBC,"Fri, 12 Jul 2019 07:00:00 GMT"
17,"'Anonymous' data might not be so anonymous, study shows - CNBC","Tue, 23 Jul 2019 07:00:00 GMT"
18,Virtual reality 'Star Wars' experiences move into malls as clothing stores go dark - CNBC,"Thu, 25 Jul 2019 07:00:00 GMT"
19,Gap's Athleta brand lands its first sponsored athlete: Olympic track champion Allyson Felix - CNBC,"Wed, 31 Jul 2019 07:00:00 GMT"
20,"McDonald's, Uber and Johnson & Johnson no longer have chief marketing officers — here's what that means - CNBC","Thu, 25 Jul 2019 07:00:00 GMT"
21,"At a high-stakes tournament, a lucky fisherman reels in $2.6 million in cold hard cash - CNBC","Mon, 22 Jul 2019 07:00:00 GMT"
22,Richard Branson's Virgin Orbit gets one step closer to launching satellites from a 747 airplane - CNBC,"Wed, 10 Jul 2019 07:00:00 GMT"
23,"Deutsche Bank will exit global equities business and slash 18,000 jobs in sweeping overhaul - CNBC","Sun, 07 Jul 2019 07:00:00 GMT"
24,China says its greenhouse gas emissions soar over 50% from 2005 to 2014 - CNBC,"Mon, 15 Jul 2019 07:00:00 GMT"
25,"Dubai International airport installs 15,000 solar panels - CNBC","Wed, 17 Jul 2019 07:00:00 GMT"
26,"At 63, Bill Gates says he now asks himself these 3 questions that he wouldn't have in his 20s - CNBC","Sat, 06 Jul 2019 07:00:00 GMT"
27,"These valuable pennies are worth up to $200,000—and they might be in your pocket - CNBC","Thu, 18 Jul 2019 07:00:00 GMT"
28,Surescripts ups its battle with Amazon PillPack: 'We are turning the matter over to the FBI' - CNBC,"Mon, 29 Jul 2019 07:00:00 GMT"
29,Robinhood lands a $7.6 billion valuation after recent funding round - CNBC,"Mon, 22 Jul 2019 07:00:00 GMT"
30,McDonald's US franchisees ask for a Southern-style chicken sandwich to compete with Chick-fil-A - CNBC,"Wed, 10 Jul 2019 07:00:00 GMT"
31,America's 10 most expensive states to live in 2019 - CNBC,"Wed, 10 Jul 2019 07:00:00 GMT"
32,This is now the longest US economic expansion in history - CNBC,"Tue, 02 Jul 2019 07:00:00 GMT"
33,A major river in Europe hit by drought could create economic havoc - CNBC,"Wed, 31 Jul 2019 07:00:00 GMT"
34,Microsoft opens first retail store in Europe – just down the street from Apple - CNBC,"Wed, 10 Jul 2019 07:00:00 GMT"
35,'Stranger Things 3' breaks Netflix record for most-viewed series in first four days - CNBC,"Tue, 09 Jul 2019 07:00:00 GMT"
36,Medical cannabis is gaining momentum in Asia - CNBC,"Sun, 14 Jul 2019 07:00:00 GMT"
37,Here's how much President Trump's 28-year-old director of Oval Office operations makes - CNBC,"Mon, 01 Jul 2019 07:00:00 GMT"
38,"Betsy DeVos and family see profits soar after Trump tax reform bill, deregulation efforts - CNBC","Mon, 22 Jul 2019 07:00:00 GMT"
39,Bank of America beats analysts' profit estimates on retail banking strength - CNBC,"Wed, 17 Jul 2019 07:00:00 GMT"
40,The student debt crisis has hit black students especially hard. Here's how - CNBC,"Sat, 27 Jul 2019 07:00:00 GMT"
41,"A quarter of Europeans lie about their salaries during job interviews, research claims - CNBC","Wed, 31 Jul 2019 07:00:00 GMT"
42,How a coffee shop business turned into Australia's fastest-growing $1 billion start-up - CNBC,"Mon, 29 Jul 2019 07:00:00 GMT"
43,What is Hong Kong's relationship with China? - CNBC,"Thu, 18 Jul 2019 07:00:00 GMT"
44,"Self-driving cars face two important challenges, says World Economic Forum executive - CNBC","Mon, 01 Jul 2019 07:00:00 GMT"
45,"Google still keeps a list of everything you ever bought using Gmail, even if you delete all your emails - CNBC","Fri, 05 Jul 2019 07:00:00 GMT"
46,Jeffrey Epstein got court documents claiming he raped 15-year-old girl day before he was injured in jail cell - CNBC,"Tue, 30 Jul 2019 07:00:00 GMT"
47,US viewership of the 2019 Women's World Cup final was 22% higher than the 2018 men's final - CNBC,"Wed, 10 Jul 2019 07:00:00 GMT"
48,7 ways to save big when grocery shopping at Publix - CNBC,"Wed, 03 Jul 2019 07:00:00 GMT"
49,The age of Azure is upon us: Microsoft's biggest business segment is now the one that includes its Azure cloud - CNBC,"Thu, 18 Jul 2019 07:00:00 GMT"
50,Hasbro stands to make millions from Marvel's Phase 4 slate - CNBC,"Tue, 23 Jul 2019 07:00:00 GMT"
51,Snap's stock is up more than 200% from its low and is a huge winner in 2019 - CNBC,"Sat, 13 Jul 2019 07:00:00 GMT"
52,'The Lion King' sets a July record with $191.8 million opening weekend in the US - CNBC,"Sun, 21 Jul 2019 07:00:00 GMT"
53,The Fed chairman says the relationship between inflation and unemployment is gone - CNBC,"Thu, 11 Jul 2019 07:00:00 GMT"
54,Capital One shares dive after data breach affecting 100 million - CNBC,"Tue, 30 Jul 2019 07:00:00 GMT"
55,"Nearly half of students at five top MBA programs borrow at least $100,000 to finance their degree - CNBC","Tue, 09 Jul 2019 07:00:00 GMT"
56,Beyond Meat's competitor Impossible Foods plans to launch in grocery stores in September after getting FDA approval - CNBC,"Wed, 31 Jul 2019 07:00:00 GMT"
57,Sriracha maker loses lawsuit to its former jalapeno grower - CNBC,"Fri, 05 Jul 2019 07:00:00 GMT"
58,Trump and 2020 Democrats are racing to the Hamptons for fundraisers in hunt for wealthy donors - CNBC,"Tue, 23 Jul 2019 07:00:00 GMT"
59,Fake news is real — A.I. is going to make it much worse - CNBC,"Fri, 12 Jul 2019 07:00:00 GMT"
60,"Disney bought Marvel for $4 billion in 2009, a decade later it's made more than $18 billion at the global box office - CNBC","Sun, 21 Jul 2019 07:00:00 GMT"
61,Plant-based eggs land their first major fast food deal - CNBC,"Thu, 25 Jul 2019 07:00:00 GMT"
62,"'Avengers: Endgame' is now the highest-grossing film of all time, dethroning 'Avatar' - CNBC","Sun, 21 Jul 2019 07:00:00 GMT"
63,Online bank Green Dot reveals savings account with a rate 30 times the national average - CNBC,"Tue, 30 Jul 2019 07:00:00 GMT"
64,"Want an extra $10,000? Consider moving to these states - CNBC","Wed, 10 Jul 2019 07:00:00 GMT"
65,IAC invests $250 million in car-sharing company Turo - CNBC,"Wed, 17 Jul 2019 07:00:00 GMT"
66,Trump Labor Secretary Alex Acosta resigns amid pressure from Jeffrey Epstein sex traffic case - CNBC,"Fri, 12 Jul 2019 07:00:00 GMT"
67,Trump and Dems agree America's infrastructure needs a $2 trillion fix. These 5 states are in the best shape in 2019 - CNBC,"Wed, 10 Jul 2019 07:00:00 GMT"
68,American Airlines cancels Boeing 737 Max flights through Nov. 2 as planes stay grounded - CNBC,"Sun, 14 Jul 2019 07:00:00 GMT"
69,3 of billionaire Jeff Bezos' secrets to success - CNBC,"Fri, 05 Jul 2019 07:00:00 GMT"
70,Here's how criminals use stolen passport information - CNBC,"Fri, 05 Jul 2019 07:00:00 GMT"
71,Apple plans to buy Intel's wireless chip unit for $1 billion - CNBC,"Thu, 25 Jul 2019 07:00:00 GMT"
72,"Nike 'Waffle Shoe' sells for $475,500, becoming the most expensive sneakers ever auctioned - CNBC","Tue, 23 Jul 2019 07:00:00 GMT"
73,People who live in the suburbs have almost 4 times as much in savings as city dwellers - CNBC,"Tue, 30 Jul 2019 07:00:00 GMT"
74,My house smells like an airport. Yours can too - CNBC,"Sun, 28 Jul 2019 07:00:00 GMT"
75,Google's DeepMind says its A.I. tech can spot acute kidney disease 48 hours before doctors spot it - CNBC,"Wed, 31 Jul 2019 07:00:00 GMT"
76,Whitney Houston died in 2012. Next year you can see her hologram perform - CNBC,"Sat, 13 Jul 2019 07:00:00 GMT"
77,Kanye West's comeback: from $53 million in debt to making over $150 million in a year - CNBC,"Wed, 10 Jul 2019 07:00:00 GMT"
78,Antiwar candidate Bernie Sanders faces backlash over the $1.2 trillion war machine he brought to Vermont - CNBC,"Wed, 10 Jul 2019 07:00:00 GMT"
79,This chart shows how much money Americans earn at every age - CNBC,"Wed, 24 Jul 2019 07:00:00 GMT"
80,"Adidas' social media campaign backfires, sending out anti-Semitic tweets - CNBC","Tue, 02 Jul 2019 07:00:00 GMT"
81,"Check out FB.PS, V's stock price (FB,V) in real time - CNBC","Fri, 12 Jul 2019 15:15:31 GMT"
82,Meet the man trying to make Elon Musk's hyperloop dream a reality in Europe - CNBC,"Fri, 26 Jul 2019 07:00:00 GMT"
83,Tom Cruise's leather jacket in the 'Top Gun' sequel shows just how crucial China is as a movie market - CNBC,"Fri, 19 Jul 2019 07:00:00 GMT"
84,Alexandra Gibbs Portfolio - CNBC,"Thu, 13 Aug 2015 02:08:10 GMT"
85,"Meet Paige Thompson, who is accused of hacking Capital One and stealing the data of 100 million people - CNBC","Tue, 30 Jul 2019 07:00:00 GMT"
86,Chevy uncovers new Corvette Convertible – and race version of new Stingray - CNBC,"Sat, 27 Jul 2019 07:00:00 GMT"
87,Coca-Cola and Pepsi push into energy drinks as soda consumption falls - CNBC,"Tue, 23 Jul 2019 07:00:00 GMT"
88,These states are the cheapest places to live in America in 2019 - CNBC,"Wed, 10 Jul 2019 07:00:00 GMT"
89,"Apple's iPhone sales miss estimates, down 12% versus last year - CNBC","Tue, 30 Jul 2019 07:00:00 GMT"
90,Medallia soars more than 75% in market debut as investors flock to another cloud software IPO - CNBC,"Fri, 19 Jul 2019 07:00:00 GMT"
91,Trump's campaign offered 10 plastic straws for $15 because 'liberal paper straws don't work' — and they just sold out - CNBC,"Fri, 19 Jul 2019 07:00:00 GMT"
92,How to see which apps are gobbling up all of your data each month - CNBC,"Sat, 13 Jul 2019 07:00:00 GMT"
93,"Fake followers in influencer marketing will cost brands $1.3 billion this year, report says - CNBC","Wed, 24 Jul 2019 07:00:00 GMT"
94,"Harvesting rare-earth metals from the moon will happen this century, NASA chief says - CNBC","Thu, 18 Jul 2019 07:00:00 GMT"
95,"These 7 high-paying work-from-home jobs all pay as much as $90,000 a year or more - CNBC","Tue, 30 Jul 2019 07:00:00 GMT"
96,Ariana Grande's 'Sweetener' tour drives more than ticket sales as fans register to vote in record numbers - CNBC,"Mon, 01 Jul 2019 07:00:00 GMT"
97,US cuts Turkey from F-35 program after Russian missile deal - CNBC,"Wed, 17 Jul 2019 07:00:00 GMT"
98,The Japan-South Korea dispute could push up the price of your next smartphone - CNBC,"Mon, 22 Jul 2019 07:00:00 GMT"
99,Starbucks licenses its 'gold standard' tech to give global franchisees access to its mobile app - CNBC,"Mon, 22 Jul 2019 07:00:00 GMT"
