,Title,Date
0,"China took control of an Italian military drone maker without authorities knowing it, report says - CNBC","Tue, 16 Nov 2021 08:00:00 GMT"
1,Twitter CTO Parag Agrawal will replace Jack Dorsey as CEO - CNBC,"Mon, 29 Nov 2021 08:00:00 GMT"
2,European Central Bank warns of bubbles in property and financial markets - CNBC,"Wed, 17 Nov 2021 08:00:00 GMT"
3,'You can gain everything and you can lose everything' — here's why experts remain skeptical about the NFT market - CNBC,"Mon, 29 Nov 2021 08:00:00 GMT"
4,The 10 jobs with the most remote work opportunities—and how much they pay - CNBC,"Fri, 19 Nov 2021 08:00:00 GMT"
5,Elon Musk picked a Twitter fight with Bernie Sanders over tax policy - CNBC,"Mon, 15 Nov 2021 08:00:00 GMT"
6,A renewable energy company in Thailand has electric vehicle dreams - CNBC,"Mon, 22 Nov 2021 08:00:00 GMT"
7,"Tesla will spend at least $1.06 billion on Texas 'Gigafactory' and hopes to finish it this year, filings show - CNBC","Tue, 23 Nov 2021 08:00:00 GMT"
8,All U.S. adults now eligible for Pfizer and Moderna Covid vaccine booster shots after CDC gives final OK - CNBC,"Fri, 19 Nov 2021 08:00:00 GMT"
9,Travel in 2022: Is it time to plan those big trips abroad? - CNBC,"Sun, 28 Nov 2021 08:00:00 GMT"
10,Many people are flying private jet services for the first time. Here's what they're paying - CNBC,"Tue, 30 Nov 2021 08:00:00 GMT"
11,"AMC, Sony offering NFTs to people who purchase advance Spider-Man tickets - CNBC","Sun, 28 Nov 2021 08:00:00 GMT"
12,"'Squid Game' crypto token cost one Shanghai investor his life savings of $28,000 after coin plunged to near zero - CNBC","Tue, 02 Nov 2021 07:00:00 GMT"
13,Go inside UPS' boot-camp for driver trainees who are set to hit the road this holiday season - CNBC,"Fri, 19 Nov 2021 08:00:00 GMT"
14,Ghost towns and toxic fumes: How an idyllic California lake became a disaster - CNBC,"Sat, 06 Nov 2021 07:00:00 GMT"
15,Trump White House chief of staff Mark Meadows blows off appearance at Jan. 6 Capitol riot House panel - CNBC,"Fri, 12 Nov 2021 08:00:00 GMT"
16,Inspire Brands launches a ghost kitchen as more restaurants lean into virtual restaurants - CNBC,"Tue, 09 Nov 2021 08:00:00 GMT"
17,Ford's new custom electric pickup truck is a blast from the past - CNBC,"Thu, 04 Nov 2021 07:00:00 GMT"
18,Portugal makes it illegal for bosses to contact employees outside working hours - CNBC,"Mon, 15 Nov 2021 08:00:00 GMT"
19,Red Sox owners reach agreement to buy Pittsburgh Penguins - CNBC,"Mon, 29 Nov 2021 08:00:00 GMT"
20,"Sierra Space raises $1.4 billion at $4.5 billion valuation as it builds spaceplane, space station - CNBC","Fri, 19 Nov 2021 08:00:00 GMT"
21,Watch CNBC's full interview with JPMorgan's Bruce Kasman on Powell and Yellen's testimony - CNBC,"Tue, 30 Nov 2021 08:00:00 GMT"
22,NBA star Antoine Walker bounced back from bankruptcy in two years. Here's his advice for rebuilding finances - CNBC,"Sat, 13 Nov 2021 08:00:00 GMT"
23,Ford to repurchase up to $5 billion in junk bonds as it restructures its balance sheet in hopes of restoring credit rating - CNBC,"Thu, 04 Nov 2021 07:00:00 GMT"
24,Thousands of Americans living abroad got stimulus checks. Here’s why - CNBC,"Tue, 09 Nov 2021 08:00:00 GMT"
25,Glass bottle shortages put pressure on wine and spirits companies ahead of key holiday season - CNBC,"Tue, 23 Nov 2021 08:00:00 GMT"
26,"If you don’t get a 6% raise, are you taking a pay cut due to inflation? Here’s what experts say - CNBC","Sat, 20 Nov 2021 08:00:00 GMT"
27,"Citadel CEO Ken Griffin pays $43.2 million for Constitution copy, outbidding crypto group - CNBC","Fri, 19 Nov 2021 08:00:00 GMT"
28,"Authentic Brands Group shelves IPO, to sell stake in deal that values company at $12.7 billion - CNBC","Mon, 22 Nov 2021 08:00:00 GMT"
29,Xi says China is ready to work with U.S. on condition of 'mutual respect' - CNBC,"Tue, 09 Nov 2021 08:00:00 GMT"
30,"On Giving Tuesday, cryptocurrency and NFT backers are bullish on donations - CNBC","Tue, 30 Nov 2021 08:00:00 GMT"
31,Trump-backed candidate Sean Parnell suspends campaign in crucial Pennsylvania Senate race - CNBC,"Mon, 22 Nov 2021 08:00:00 GMT"
32,"J&J plans to split into two companies, separating consumer products and pharmaceutical businesses - CNBC","Fri, 12 Nov 2021 08:00:00 GMT"
33,A full recap of the Fed's market-moving decision and Powell's press conference - CNBC,"Wed, 03 Nov 2021 07:00:00 GMT"
34,"Trump defended Jan. 6 Capitol rioters chanting 'hang Mike Pence,' called anger over Biden election result 'common sense' - CNBC","Fri, 12 Nov 2021 08:00:00 GMT"
35,Nvidia crypto mining chip sales fell off a cliff this quarter - CNBC,"Wed, 17 Nov 2021 08:00:00 GMT"
36,El-Erian says he bought bitcoin but sold too early — here's when he'd feel comfortable buying again - CNBC,"Tue, 16 Nov 2021 08:00:00 GMT"
37,Tesla shares slide after Elon Musk proposes selling 10% of his stock in a Twitter poll - CNBC,"Mon, 08 Nov 2021 08:00:00 GMT"
38,"Meta, formerly Facebook, is reportedly planning retail stores as it pushes into metaverse - CNBC","Fri, 05 Nov 2021 07:00:00 GMT"
39,Planet Fitness CEO says gym membership has almost reached its pre-Covid peak - CNBC,"Thu, 04 Nov 2021 07:00:00 GMT"
40,Jeff Bezos hired this Amazon applicant ‘on the spot’—here are the 2 interview questions he asked - CNBC,"Tue, 02 Nov 2021 07:00:00 GMT"
41,'Investing shouldn't be sexy.' Here's where millennial influencer Tori Dunlap is putting her money - CNBC,"Fri, 12 Nov 2021 08:00:00 GMT"
42,Elon Musk tells SpaceX employees that Starship engine crisis is creating a 'risk of bankruptcy' - CNBC,"Tue, 30 Nov 2021 08:00:00 GMT"
43,Watch CNBC's Full Interview with Blink Charging CEO Michael Farkas - CNBC,"Mon, 15 Nov 2021 08:00:00 GMT"
44,"Here’s how much money you’d have if you invested $1,000 in Tesla 1, 5 and 10 years ago - CNBC","Thu, 04 Nov 2021 07:00:00 GMT"
45,"Stocks slip despite strong retail earnings, Visa drags Dow lower - CNBC","Tue, 16 Nov 2021 08:00:00 GMT"
46,Value investor Guy Spier on why gold is not the best hedge against inflation - CNBC,"Wed, 10 Nov 2021 08:00:00 GMT"
47,"Green Bay Packers to sell $90 million worth of 'stock' in NFL team, only sixth time shares offered to public - CNBC","Mon, 15 Nov 2021 08:00:00 GMT"
48,"CNN host Chris Cuomo used his media sources to find out info on brother Andrew's accusers, records show - CNBC","Mon, 29 Nov 2021 08:00:00 GMT"
49,Coinbase shares drop after third-quarter revenue misses analysts' estimates - CNBC,"Tue, 09 Nov 2021 08:00:00 GMT"
50,Attorney for Henry Kissinger tells jurors he invested $6 million in Theranos after meeting Elizabeth Holmes - CNBC,"Tue, 02 Nov 2021 07:00:00 GMT"
51,"Vaccine inequality is a human rights issue, says U.S. doctor - CNBC","Tue, 30 Nov 2021 08:00:00 GMT"
52,Hedge fund investor tells jurors in Holmes trial that Theranos lied about finger-prick tech and military use - CNBC,"Tue, 16 Nov 2021 08:00:00 GMT"
53,Blockbuster art week sets record with more than $2.6 billion in sales - CNBC,"Tue, 23 Nov 2021 08:00:00 GMT"
54,New Twitter CEO Parag Agrawal is central to Jack Dorsey's plans to revamp social media - CNBC,"Mon, 29 Nov 2021 08:00:00 GMT"
55,Why Illinois paid $694 million to keep nuclear plants open - CNBC,"Sat, 20 Nov 2021 08:00:00 GMT"
56,Elon Musk urges Tesla employees to reduce cost of vehicle deliveries - CNBC,"Sat, 27 Nov 2021 08:00:00 GMT"
57,"Ithaca, New York becomes first U.S. city to begin 100% decarbonization of buildings, an urban climate change milestone - CNBC","Thu, 04 Nov 2021 07:00:00 GMT"
58,Nvidia's $40 billion takeover of chip designer Arm faces a UK national security probe - CNBC,"Tue, 16 Nov 2021 08:00:00 GMT"
59,"For decades, Trader Joe's employees had to work on Thanksgiving — and it's all because of wine - CNBC","Thu, 25 Nov 2021 08:00:00 GMT"
60,Several hundred Google employees sign manifesto against widened Covid vaccine mandate - CNBC,"Tue, 23 Nov 2021 08:00:00 GMT"
61,"Michael Jordan, Giannis Antetokounmpo lift luxury watch start-up WatchBox to valuation nearing $1 billion - CNBC","Tue, 23 Nov 2021 08:00:00 GMT"
62,Here are your new income tax brackets for 2022 - CNBC,"Wed, 10 Nov 2021 08:00:00 GMT"
63,Germany's $9 billion digital bank N26 to withdraw from the U.S. - CNBC,"Thu, 18 Nov 2021 08:00:00 GMT"
64,Alternative rocket builder SpinLaunch completes first test flight - CNBC,"Tue, 09 Nov 2021 08:00:00 GMT"
65,"Rivian prices IPO at $78 a share, valuing electric vehicle company at $66.5 billion - CNBC","Tue, 09 Nov 2021 08:00:00 GMT"
66,"The best cruises of 2022, according to U.S. News & World Report - CNBC","Tue, 09 Nov 2021 08:00:00 GMT"
67,"Shell ditches the Dutch, moves to London in share structure overhaul - CNBC","Mon, 15 Nov 2021 08:00:00 GMT"
68,Peloton shares rise after company nets $1.07 billion in discounted stock sale - CNBC,"Tue, 16 Nov 2021 08:00:00 GMT"
69,Emergent Biosolutions shares plunge by more than 37% after U.S. cancels deal with Covid vaccine maker - CNBC,"Fri, 05 Nov 2021 07:00:00 GMT"
70,"J.D. Vance, an ally of tech investor Peter Thiel, made almost $1 million in the period before he launched his Ohio Senate campaign - CNBC","Fri, 26 Nov 2021 08:00:00 GMT"
71,"Elon Musk said he prefers to stay out of politics – his lobbying efforts, campaign donations and tweets say otherwise - CNBC","Tue, 09 Nov 2021 08:00:00 GMT"
72,A fintech helping banks enter the cloud hits $1 billion valuation in JPMorgan-backed investment - CNBC,"Mon, 29 Nov 2021 08:00:00 GMT"
73,Apple-supplier Infineon is still 'far away' from meeting chip demand - CNBC,"Wed, 10 Nov 2021 08:00:00 GMT"
74,Same-sex couples in certain states may get a tax break from Democrats’ $1.75 trillion social plan - CNBC,"Tue, 16 Nov 2021 08:00:00 GMT"
75,German cannabis firm shares pop after new government pledges to legalize the drug - CNBC,"Thu, 25 Nov 2021 08:00:00 GMT"
76,Pacific island minister films climate speech knee-deep in the ocean - CNBC,"Mon, 08 Nov 2021 08:00:00 GMT"
77,Why airport security is so slow and how the TSA and airlines are trying to fix it - CNBC,"Wed, 24 Nov 2021 08:00:00 GMT"
78,Half of Americans with retirement accounts have taken an early withdrawal - CNBC,"Mon, 22 Nov 2021 08:00:00 GMT"
79,Laura Levine - CNBC,"Thu, 04 Nov 2021 07:00:00 GMT"
80,Paycheck to Paycheck - CNBC,"Mon, 01 Nov 2021 15:10:01 GMT"
81,Iceland takes a swipe at Zuckerberg's 'Meta' announcement in new viral tourism video - CNBC,"Fri, 12 Nov 2021 08:00:00 GMT"
82,Ford partners with GlobalFoundries to increase chip supplies - CNBC,"Thu, 18 Nov 2021 08:00:00 GMT"
83,Google warns crypto miners are using compromised cloud accounts - CNBC,"Fri, 26 Nov 2021 08:00:00 GMT"
84,Dow finishes 460 points lower in major reversal triggered by first U.S. omicron case - CNBC,"Tue, 30 Nov 2021 08:00:00 GMT"
85,Bezos Earth Fund CEO: Here's how we're giving away $10 billion of Jeff's money - CNBC,"Thu, 04 Nov 2021 07:00:00 GMT"
86,"This 27-year-old quit her job ‘with no backup plan.’ Now she makes $10,000 per month freelancing on Fiverr - CNBC","Thu, 04 Nov 2021 07:00:00 GMT"
87,Watch CNBC's full interview with Evercore's Mark Mahaney on his top stock picks - CNBC,"Fri, 12 Nov 2021 08:00:00 GMT"
88,Four ways holiday shopping has changed since the pandemic began - CNBC,"Sun, 21 Nov 2021 08:00:00 GMT"
89,Pfizer to allow generic versions of its Covid-19 pill in 95 countries - CNBC,"Tue, 16 Nov 2021 08:00:00 GMT"
90,"Take-Two CEO is skeptical about Facebook's metaverse, says it could be unpopular - CNBC","Thu, 04 Nov 2021 07:00:00 GMT"
91,The House passed Biden's massive social safety net and climate bill. Here's what happens next - CNBC,"Fri, 19 Nov 2021 08:00:00 GMT"
92,Clubhouse co-founder opens up on growing pains: 'It's been quite an 18 months' - CNBC,"Tue, 09 Nov 2021 08:00:00 GMT"
93,Children in the Netherlands are among the world's happiest. Here's what the parents do differently - CNBC,"Fri, 26 Nov 2021 08:00:00 GMT"
94,Europeans are headed to the United States — here’s where they’re going - CNBC,"Thu, 18 Nov 2021 08:00:00 GMT"
95,How the company that makes glass for your iPhone produces vials for Covid vaccines - CNBC,"Thu, 18 Nov 2021 08:00:00 GMT"
96,"'The freighter markets are on fire right now. That's where we see real growth,' Boeing exec says - CNBC","Mon, 15 Nov 2021 08:00:00 GMT"
97,"Microsoft’s GitHub CEO Nat Friedman is stepping down, product chief Thomas Dohmke will replace him - CNBC","Wed, 03 Nov 2021 07:00:00 GMT"
98,Kevin Spacey ordered to pay 'House of Cards' studio nearly $31 million for contract breach - CNBC,"Mon, 22 Nov 2021 08:00:00 GMT"
99,This couple's 8 income streams bring in over $3 million per year in revenue: 'It all started with side hustles'—here's their best advice - CNBC,"Wed, 17 Nov 2021 08:00:00 GMT"
