,Title,Date
0,"Strive founder Vivek Ramaswamy on new anti-ESG fund, 'anti-woke' investing - CNBC","Wed, 10 Aug 2022 07:00:00 GMT"
1,"Does the Inflation Reduction Act violate Biden’s $400,000 tax pledge? Expect 'a different answer depending on who you ask,' says analyst - CNBC","Fri, 05 Aug 2022 07:00:00 GMT"
2,Watch CNBC’s full interview with Light Street Capital founder & CIO Glen Kacher - CNBC,"Mon, 29 Aug 2022 07:00:00 GMT"
3,"First-time homebuyers can now get up to $200,000 for a down payment in D.C.—see if you qualify for similar programs in your state - CNBC","Wed, 24 Aug 2022 07:00:00 GMT"
4,Ether surges to a two-month high after ethereum inches closer to long-awaited upgrade - CNBC,"Thu, 11 Aug 2022 07:00:00 GMT"
5,Self-made millionaire: 'Don't buy a home—unless you can afford to waste money' - CNBC,"Thu, 11 Aug 2022 07:00:00 GMT"
6,Hyundai to export heavy-duty hydrogen electric trucks to Germany - CNBC,"Thu, 04 Aug 2022 07:00:00 GMT"
7,"Deadlock with Russia over Nord Stream gas turbine is not our fault, Siemens Energy CEO says - CNBC","Mon, 08 Aug 2022 07:00:00 GMT"
8,"'Avoid these 2 resume words at all costs,' says career expert—here are 35 power verbs to use instead - CNBC","Wed, 31 Aug 2022 07:00:00 GMT"
9,Walmart explores matchmaker marketplace for social media influencers - CNBC,"Thu, 18 Aug 2022 07:00:00 GMT"
10,The 5 most expensive cars up for sale at Pebble Beach this weekend - CNBC,"Thu, 18 Aug 2022 07:00:00 GMT"
11,There are a bunch of hidden menus on your iPhone. Here’s how to use them - CNBC,"Fri, 26 Aug 2022 07:00:00 GMT"
12,Cannabis drinks pop up as companies bet on the growing market for legal marijuana - CNBC,"Tue, 30 Aug 2022 07:00:00 GMT"
13,"Nvidia says gaming market conditions are 'challenging,' Q3 forecast misses - CNBC","Wed, 24 Aug 2022 07:00:00 GMT"
14,"Canceled sailings, stuck vessels, warehouse prices show U.S. ports are still struggling - CNBC","Thu, 25 Aug 2022 07:00:00 GMT"
15,Roller coaster crash at German Legoland injures 34 - CNBC,"Thu, 11 Aug 2022 07:00:00 GMT"
16,"VinFast hiring 8,000 additional employees to boost production - CNBC","Sat, 06 Aug 2022 07:00:00 GMT"
17,"Making work friends is hard, but doing it can make you more 'happy and satisfied'—here's how - CNBC","Tue, 09 Aug 2022 07:00:00 GMT"
18,64% of consumers are worried about 'shrinkflation.' What it is and how to watch for it while shopping - CNBC,"Mon, 29 Aug 2022 07:00:00 GMT"
19,Andreessen Horowitz announces plans to invest in Adam Neumann's new residential real estate company - CNBC,"Mon, 15 Aug 2022 07:00:00 GMT"
20,Crypto mixing service Tornado Cash blacklisted by Treasury Department for alleged use in laundering - CNBC,"Mon, 08 Aug 2022 07:00:00 GMT"
21,CNBC Chairman Mark Hoffman stepping down after 17 years at network - CNBC,"Tue, 16 Aug 2022 07:00:00 GMT"
22,"Amazon is shutting down its telehealth service, Amazon Care - CNBC","Wed, 24 Aug 2022 07:00:00 GMT"
23,"Salman Rushdie ‘on the road to recovery,’ agent says - CNBC","Sun, 14 Aug 2022 07:00:00 GMT"
24,SpaceX and T-Mobile team up to use Starlink satellites to 'end mobile dead zones' - CNBC,"Thu, 25 Aug 2022 07:00:00 GMT"
25,How to start investing while you're still in college - CNBC,"Fri, 05 Aug 2022 07:00:00 GMT"
26,Watch CNBC’s full interview with Fairlead Strategies founder Katie Stockton - CNBC,"Fri, 19 Aug 2022 07:00:00 GMT"
27,"Don't worry, the IRS isn't hiring an 'army' of auditors—here's what's really happening - CNBC","Wed, 31 Aug 2022 07:00:00 GMT"
28,'What are we anxious about?' and other big questions you should ask before moving in with your partner - CNBC,"Sat, 13 Aug 2022 07:00:00 GMT"
29,Here's where China's real estate troubles could spill over - CNBC,"Thu, 11 Aug 2022 07:00:00 GMT"
30,"Netflix is expanding its push into video games, but few subscribers are playing along - CNBC","Sat, 06 Aug 2022 07:00:00 GMT"
31,"George Clooney had tequila, Ryan Reynolds gin. For female celebrities? Wine is in - CNBC","Sun, 07 Aug 2022 07:00:00 GMT"
32,How to become an influencer on TikTok or Instagram - CNBC,"Thu, 04 Aug 2022 07:00:00 GMT"
33,Hackers drain nearly $200 million from crypto startup in 'free-for-all' attack - CNBC,"Tue, 02 Aug 2022 07:00:00 GMT"
34,Lawmakers call for safety upgrades as people face long lines ‘outside in the heat for hours’ at Social Security offices - CNBC,"Wed, 17 Aug 2022 07:00:00 GMT"
35,A parody Twitter account created by a paralegal mocking Dr. Oz's 'crudites' campaign video goes viral - CNBC,"Fri, 19 Aug 2022 07:00:00 GMT"
36,"Credit scores still sit at all-time high, despite some 'deterioration' in how Americans are faring financially - CNBC","Tue, 30 Aug 2022 07:00:00 GMT"
37,New York's ritzy Hamptons plays host to over a dozen political fundraisers this month as midterms approach - CNBC,"Wed, 03 Aug 2022 07:00:00 GMT"
38,Trump's Truth Social barred from Google Play store over content moderation concerns - CNBC,"Tue, 30 Aug 2022 07:00:00 GMT"
39,Salman Rushdie reportedly on a ventilator and unable to speak after he was stabbed - CNBC,"Fri, 12 Aug 2022 07:00:00 GMT"
40,Adidas says CEO Rorsted to give up his post in 2023 - CNBC,"Mon, 22 Aug 2022 07:00:00 GMT"
41,South Korea's president pardons Samsung leader Jay Y. Lee - CNBC,"Thu, 11 Aug 2022 07:00:00 GMT"
42,"Fed sees interest rate hikes continuing until inflation eases substantially, minutes show - CNBC","Wed, 17 Aug 2022 07:00:00 GMT"
43,Watch CNBC's full interview with Ethan Allen's Farooq Kathwari - CNBC,"Thu, 04 Aug 2022 07:00:00 GMT"
44,Mall owners say retailers are still opening stores in spite of recession fears - CNBC,"Tue, 02 Aug 2022 07:00:00 GMT"
45,Disney CEO Bob Chapek again distances himself from Bob Iger with Disney+ pricing decision - CNBC,"Sun, 21 Aug 2022 07:00:00 GMT"
46,"Two people plead guilty in theft of diary of Ashley Biden, daughter of president - CNBC","Thu, 25 Aug 2022 07:00:00 GMT"
47,10 common phrases that make you sound passive-aggressive in the workplace - CNBC,"Fri, 19 Aug 2022 07:00:00 GMT"
48,Here's the latest on the massive recall that includes popular beverages from Oatly and Stumptown - CNBC,"Fri, 05 Aug 2022 07:00:00 GMT"
49,Chinese property developers' cash flows have plunged by more than 20% - CNBC,"Wed, 17 Aug 2022 07:00:00 GMT"
50,"This RV repairman started answering internet questions on a lunch break—now he makes $115,000 a year doing it - CNBC","Tue, 09 Aug 2022 07:00:00 GMT"
51,Apple tells employees to work at the office three times per week starting in September - CNBC,"Mon, 15 Aug 2022 07:00:00 GMT"
52,Stores and suppliers clash over price hikes as shoppers hit by sticker shock - CNBC,"Mon, 15 Aug 2022 07:00:00 GMT"
53,How China’s strict Covid policies led to supply chain bottlenecks - CNBC,"Fri, 19 Aug 2022 07:00:00 GMT"
54,Inflation peaking? 10 common consumer items where prices are falling - CNBC,"Fri, 19 Aug 2022 07:00:00 GMT"
55,Chinese tech giants share details of their prized algorithms with top regulator in unprecedented move - CNBC,"Mon, 15 Aug 2022 07:00:00 GMT"
56,Google workers demand equal abortion benefits as state bans go into effect - CNBC,"Thu, 18 Aug 2022 07:00:00 GMT"
57,New Instagram feature allows users to remove weight loss and weight control ads from their feeds - CNBC,"Sat, 13 Aug 2022 07:00:00 GMT"
58,Nvidia stock falls after U.S. government restricts chip sales to China - CNBC,"Wed, 31 Aug 2022 07:00:00 GMT"
59,American Airlines agrees to buy 20 supersonic planes from Boom - CNBC,"Tue, 16 Aug 2022 07:00:00 GMT"
60,"Putin slams U.S., claims it wants to drag out war in Ukraine and provoke China - CNBC","Tue, 16 Aug 2022 07:00:00 GMT"
61,This introverted CEO says the workplace is built for extroverts—she uses these 2 simple strategies to thrive - CNBC,"Tue, 30 Aug 2022 07:00:00 GMT"
62,"Dr. Fauci: If you aren't up-to-date on Covid vaccines and boosters, you’re ‘going to get into trouble’ - CNBC","Wed, 03 Aug 2022 07:00:00 GMT"
63,Former Vice President Dick Cheney rips 'coward' Trump in election ad for daughter Liz - CNBC,"Thu, 04 Aug 2022 07:00:00 GMT"
64,"S&P 500, Nasdaq fall Friday, but notch weekly gains after blowout July jobs report - CNBC","Fri, 05 Aug 2022 07:00:00 GMT"
65,"Higher prices, skimpier portions and apps — how fast-food chains are changing value deals - CNBC","Sat, 06 Aug 2022 07:00:00 GMT"
66,"Don't try quiet quitting, says Kevin O'Leary: It's 'a really bad idea' - CNBC","Sat, 20 Aug 2022 07:00:00 GMT"
67,"Trump complained U.S. generals lacked the loyalty German generals showed Hitler, book says - CNBC","Mon, 08 Aug 2022 07:00:00 GMT"
68,FCC denies SpaceX bid for nearly $1 billion in rural broadband subsidies for Starlink - CNBC,"Wed, 10 Aug 2022 07:00:00 GMT"
69,Billionaire hedge fund manager Julian Robertson dies at 90 - CNBC,"Tue, 23 Aug 2022 07:00:00 GMT"
70,Here's why HBO Max is pulling dozens of films and TV series from the streaming platform - CNBC,"Fri, 19 Aug 2022 07:00:00 GMT"
71,"Job unhappiness is at a staggering all-time high, according to Gallup - CNBC","Fri, 12 Aug 2022 07:00:00 GMT"
72,Wall Street revives Russian bond trading after U.S. go-ahead - CNBC,"Mon, 15 Aug 2022 07:00:00 GMT"
73,Struggling with long Covid? Experts say diet and nutrition could help — here's what you need to know - CNBC,"Mon, 29 Aug 2022 07:00:00 GMT"
74,Some social media influencers are being paid thousands to endorse cryptocurrency projects - CNBC,"Thu, 11 Aug 2022 07:00:00 GMT"
75,DOJ plans to retry Philip Esformes despite Trump commuting sentence of Florida nursing home owner - CNBC,"Fri, 12 Aug 2022 07:00:00 GMT"
76,"Bankrupt crypto lending platform Celsius withdraws motion to hire CFO back at $92,000 a month - CNBC","Sun, 07 Aug 2022 07:00:00 GMT"
77,The $300 billion meme stock that makes GameStop look like child's play - CNBC,"Wed, 03 Aug 2022 07:00:00 GMT"
78,"These are the 10 highest paying global cities for interns, according to a new report - CNBC","Wed, 17 Aug 2022 07:00:00 GMT"
79,Transportation Department is losing top auto safety regulator after a few months on the job - CNBC,"Fri, 12 Aug 2022 07:00:00 GMT"
80,Mortgage rates will fall to 4.5% in 2023? That's the estimate from Fannie Mae. Here’s what that means for homebuyers - CNBC,"Mon, 29 Aug 2022 07:00:00 GMT"
81,"Dow closes 200 points higher on Tuesday for fifth day of gains, buoyed by Walmart and Home Depot - CNBC","Tue, 16 Aug 2022 07:00:00 GMT"
82,1 in 4 Gen Z employees worry that taking a lunch break makes them look bad at work - CNBC,"Thu, 04 Aug 2022 07:00:00 GMT"
83,"29-year-old college dropout near LA brings in $245,000 a year as a wedding guitarist and real estate investor - CNBC","Thu, 18 Aug 2022 07:00:00 GMT"
84,"The modern family: 18% of Americans live in multigenerational households. For this N.J. family, it was ‘a lifesaver’ during the pandemic - CNBC","Fri, 19 Aug 2022 07:00:00 GMT"
85,Europe is experiencing its worst drought in at least 500 years - CNBC,"Tue, 23 Aug 2022 07:00:00 GMT"
86,An Iran nuclear deal revival could dramatically alter oil prices — if it happens - CNBC,"Wed, 31 Aug 2022 07:00:00 GMT"
87,Watch CNBC's full interview with Booking Holdings CEO Glenn Fogel - CNBC,"Thu, 04 Aug 2022 07:00:00 GMT"
88,Dow slumps 600 points Monday to wrap worst day since June as summer rally fades - CNBC,"Tue, 23 Aug 2022 07:00:00 GMT"
89,"Childhood polio vaccination rate is dangerously low in some New York communities, increasing the risk of an outbreak - CNBC","Thu, 18 Aug 2022 07:00:00 GMT"
90,"Crypto criminals laundered $540 million by using a service called RenBridge, new report shows - CNBC","Wed, 10 Aug 2022 07:00:00 GMT"
91,"Fiber optic technology powers the internet, and it's a big business - CNBC","Wed, 17 Aug 2022 07:00:00 GMT"
92,"Stocks extend their losing streak a third day, Dow closes down 300 points - CNBC","Tue, 30 Aug 2022 07:00:00 GMT"
93,"People are spending lots of money on makeup and beauty, and retailers are cashing in - CNBC","Sun, 14 Aug 2022 07:00:00 GMT"
94,"Consumer prices rose 8.5% in July, less than expected as inflation pressures ease a bit - CNBC","Wed, 10 Aug 2022 07:00:00 GMT"
95,Trump-backed gubernatorial candidate Tudor Dixon wins Michigan Republican primary - CNBC,"Tue, 02 Aug 2022 07:00:00 GMT"
96,"Ford to eliminate 3,000 jobs in an effort to cut costs - CNBC","Mon, 22 Aug 2022 07:00:00 GMT"
97,First Solar announces new U.S. panel factory following the Inflation Reduction Act - CNBC,"Tue, 30 Aug 2022 07:00:00 GMT"
98,7 changes Americans are willing to make to fix Social Security — including one with 'overwhelming bipartisan support' - CNBC,"Wed, 03 Aug 2022 07:00:00 GMT"
99,Robinhood's crypto division fined $30 million by New York financial regulator - CNBC,"Tue, 02 Aug 2022 07:00:00 GMT"
