,Title,Date
0,Check out BioScience Health Innovations's stock price (BHIC) in real time - CNBC,"Tue, 06 May 2025 00:13:24 GMT"
1,"Iran has launched drone attacks at Israel, U.S. officials say - CNBC","Sat, 13 Apr 2024 07:00:00 GMT"
2,BHP makes $39 billion bid for Anglo American in mining mega play - CNBC,"Thu, 25 Apr 2024 07:00:00 GMT"
3,Dow closes 400 points lower Wednesday as hot consumer inflation report incites selloff: Live updates - CNBC,"Wed, 10 Apr 2024 07:00:00 GMT"
4,"Wall Street pushes out rate-cut expectations, sees risk they don't start until March 2025 - CNBC","Wed, 17 Apr 2024 07:00:00 GMT"
5,Tesla slashes price of its premium driver assistance option by half in U.S. - CNBC,"Fri, 12 Apr 2024 07:00:00 GMT"
6,Los Angeles is using AI in a pilot program to try to predict homelessness and allocate aid - CNBC,"Fri, 19 Apr 2024 07:00:00 GMT"
7,"Former Tesla SVP Drew Baglino is selling $181.5 million worth of stock, SEC filing says - CNBC","Thu, 25 Apr 2024 07:00:00 GMT"
8,Biden fund gets big donation from son of Republican megadonor Larry Ellison - CNBC,"Tue, 16 Apr 2024 07:00:00 GMT"
9,Eclipse flights swarm airports: 'We had to close the runway to park planes' - CNBC,"Mon, 08 Apr 2024 07:00:00 GMT"
10,"The most successful young employees always use these 10 phrases to stand out at work, says Harvard career advisor - CNBC","Thu, 25 Apr 2024 07:00:00 GMT"
11,"Elon Musk's X begins rewarding 'influential' users with blue checks, free subscriptions to platform - CNBC","Thu, 04 Apr 2024 07:00:00 GMT"
12,"Apple pulls Meta's WhatsApp, Threads from China App Store - CNBC","Fri, 19 Apr 2024 07:00:00 GMT"
13,Spotify reports record quarterly profit after a year marked by deep layoffs and activist attention - CNBC,"Tue, 23 Apr 2024 07:00:00 GMT"
14,Ukraine can keep on fighting Russia — but the 'victory' it wants might be out of reach - CNBC,"Fri, 26 Apr 2024 07:00:00 GMT"
15,"Coinbase secures restricted dealer license in Canada, pushing expansion abroad amid SEC crackdown - CNBC","Thu, 04 Apr 2024 07:00:00 GMT"
16,Japanese yen hits fresh 34-year low despite verbal intervention from authorities - CNBC,"Thu, 25 Apr 2024 07:00:00 GMT"
17,Amazon is trying to get rid of its signature brown boxes. The retail shipping giant has a long way to go - CNBC,"Mon, 01 Apr 2024 07:00:00 GMT"
18,"Lululemon to shutter Washington distribution center, lay off 128 employees after tripling warehouse footprint - CNBC","Fri, 19 Apr 2024 07:00:00 GMT"
19,S&P 500 and Nasdaq close lower for a fourth straight day as Nvidia shares slide: Live updates - CNBC,"Wed, 17 Apr 2024 07:00:00 GMT"
20,ASML earnings drag semiconductor stocks lower - CNBC,"Wed, 17 Apr 2024 07:00:00 GMT"
21,Donald Trump set to receive $1.25 billion worth of Trump Media stock in DJT earnout bonus - CNBC,"Mon, 22 Apr 2024 07:00:00 GMT"
22,"No cognitive bias is more 'dramatic or dangerous' than this one, author says—here's how to avoid it - CNBC","Mon, 22 Apr 2024 07:00:00 GMT"
23,"House passes Ukraine, Israel, Taiwan aid, potential TikTok ban - CNBC","Sat, 20 Apr 2024 07:00:00 GMT"
24,Eco-friendly startups are turning to treeless toilet paper - CNBC,"Mon, 08 Apr 2024 07:00:00 GMT"
25,"Use these 7 phrases to make new friends at any age, says psychologist and expert in human connection - CNBC","Tue, 23 Apr 2024 07:00:00 GMT"
26,"Apple sends invites to May 7 launch event, new iPads expected - CNBC","Tue, 23 Apr 2024 07:00:00 GMT"
27,"Rubrik prices IPO at $32 per share, above the expected range - CNBC","Wed, 24 Apr 2024 07:00:00 GMT"
28,"Retailers like Peloton and Saks keep paying vendors late, signaling possible 'financial distress' - CNBC","Thu, 04 Apr 2024 07:00:00 GMT"
29,Disney CEO Bob Iger on streaming: We have to turn it into a growth business - CNBC,"Thu, 04 Apr 2024 07:00:00 GMT"
30,"Amazon ends drone program in California, plans to start deliveries in Arizona later this year - CNBC","Mon, 22 Apr 2024 07:00:00 GMT"
31,Meta's Reality Labs posts $3.85 billion loss in first quarter - CNBC,"Wed, 24 Apr 2024 07:00:00 GMT"
32,Amazon CEO Andy Jassy in shareholder letter says he's committed to cost cutting while investing in AI - CNBC,"Thu, 11 Apr 2024 07:00:00 GMT"
33,"Biden administration to forgive $7.4 billion in student debt for another 277,000 borrowers - CNBC","Fri, 12 Apr 2024 07:00:00 GMT"
34,"Coca-Cola tops earnings estimates, hikes revenue outlook on higher prices - CNBC","Tue, 30 Apr 2024 07:00:00 GMT"
35,"The rich are getting second passports, citing risk of instability - CNBC","Wed, 10 Apr 2024 07:00:00 GMT"
36,S&P 500 closes little changed as higher bond yields dampen earnings enthusiasm - CNBC,"Thu, 25 Apr 2024 07:00:00 GMT"
37,Meta plunges 16% on weak revenue guidance even as first-quarter results top estimates - CNBC,"Wed, 24 Apr 2024 07:00:00 GMT"
38,"Apple iPhone sales drop 19% in China as demand for Huawei smartphones soars, research says - CNBC","Tue, 23 Apr 2024 07:00:00 GMT"
39,"WNBA Commissioner on the 'Caitlin Clark effect', impact on women's sports and equal pay push - CNBC","Mon, 08 Apr 2024 07:00:00 GMT"
40,BlackRock's Larry Fink sees Fed cutting rates twice this year but missing 2% inflation goal - CNBC,"Fri, 12 Apr 2024 07:00:00 GMT"
41,"Apple will 'look at' manufacturing in Indonesia, CEO Cook says, as China diversification push continues - CNBC","Wed, 17 Apr 2024 07:00:00 GMT"
42,"China will remain the world's No. 1 growth driver, says the Asian Development Bank - CNBC","Thu, 11 Apr 2024 07:00:00 GMT"
43,"S&P 500 posts best week since November, Nasdaq surges 2% Friday as Alphabet soars: Live updates - CNBC","Fri, 26 Apr 2024 07:00:00 GMT"
44,"Hedge funds are ‘dead as a doornail,’ says chairman of ultra-rich investors' club Tiger 21 - CNBC","Tue, 30 Apr 2024 07:00:00 GMT"
45,LinkedIn betting it can take on TikTok and Instagram in influencer marketing - CNBC,"Fri, 12 Apr 2024 07:00:00 GMT"
46,Disney's parks are its top money maker — and it plans to spend $60 billion to keep it that way - CNBC,"Sun, 07 Apr 2024 07:00:00 GMT"
47,Skydance extends final offer to Paramount as merger talks stick on a possible shareholder vote - CNBC,"Mon, 29 Apr 2024 07:00:00 GMT"
48,"62-year-old started her business with $1,000—now it brings in over $25 million a year: 'I just had to do this' - CNBC","Sun, 07 Apr 2024 07:00:00 GMT"
49,Binance's billionaire founder to find out if prison time is coming — here's what lawyers are expecting - CNBC,"Tue, 30 Apr 2024 07:00:00 GMT"
50,Google partners with Bayer on new AI product for radiologists - CNBC,"Tue, 09 Apr 2024 07:00:00 GMT"
51,Germany's far-right AfD party is finding success on TikTok — as its popularity among young voters grows - CNBC,"Mon, 29 Apr 2024 07:00:00 GMT"
52,"Biden wants to triple China tariffs on steel, aluminum imports - CNBC","Wed, 17 Apr 2024 07:00:00 GMT"
53,"Accounting jobs are in high demand—many pay over $100,000 and can be done from home - CNBC","Fri, 12 Apr 2024 07:00:00 GMT"
54,Elon Musk says Tesla will unveil its robotaxi on Aug. 8; shares pop - CNBC,"Fri, 05 Apr 2024 07:00:00 GMT"
55,How this UK-based firm is growing a more sustainable cannabis - CNBC,"Mon, 08 Apr 2024 07:00:00 GMT"
56,Check out Adidas AG's stock price (ADS0-FF) in real time - CNBC,"Tue, 25 Mar 2025 13:18:51 GMT"
57,"This startup helps plants talk to farmers, reducing pesticides and agricultural waste - CNBC","Thu, 25 Apr 2024 07:00:00 GMT"
58,Iranian currency plunges to record low against dollar after strikes on Israel - CNBC,"Sun, 14 Apr 2024 07:00:00 GMT"
59,Citadel Securities blasts Trump Media CEO Devin Nunes over DJT short-selling letter - CNBC,"Fri, 19 Apr 2024 07:00:00 GMT"
60,"Digital ad market is finally on the mend, bouncing back from the 'dark days' of 2022 - CNBC","Sat, 27 Apr 2024 07:00:00 GMT"
61,Barclays shares up 6% as bank swings back to profit in first quarter amid strategic overhaul - CNBC,"Thu, 25 Apr 2024 07:00:00 GMT"
62,AMD and Intel dip on report China told telecoms to remove foreign chips - CNBC,"Fri, 12 Apr 2024 07:00:00 GMT"
63,Amazon cloud unit kills Snowmobile data transfer truck eight years after driving 18-wheeler onstage - CNBC,"Wed, 17 Apr 2024 07:00:00 GMT"
64,Something strange has been happening with jobless claims numbers lately - CNBC,"Fri, 19 Apr 2024 07:00:00 GMT"
65,Small business optimism hits 11-year low as inflation fears won't go away - CNBC,"Tue, 09 Apr 2024 07:00:00 GMT"
66,Apple reportedly exploring personal home robots - CNBC,"Wed, 03 Apr 2024 07:00:00 GMT"
67,Amazon ditches cashierless checkout system at its grocery stores - CNBC,"Wed, 03 Apr 2024 07:00:00 GMT"
68,"China's BYD to launch first electric pickup truck this year in latest challenge to Tesla, Ford - CNBC","Thu, 04 Apr 2024 07:00:00 GMT"
69,"Why your rich friend Venmo requests you for $4: People with more money 'struggle with generosity,' expert says - CNBC","Sat, 13 Apr 2024 07:00:00 GMT"
70,WTO forecasts rebound in global trade but keeps geopolitical risks in focus - CNBC,"Wed, 10 Apr 2024 07:00:00 GMT"
71,Email isn't just annoying to Gen Z workers—it's stressing them out - CNBC,"Tue, 23 Apr 2024 07:00:00 GMT"
72,"90% of qualifying electric-vehicle buyers opt for $7,500 'new clean vehicle' tax credit as upfront payment, Treasury says - CNBC","Fri, 12 Apr 2024 07:00:00 GMT"
73,"Yellen kicks off China meetings with overcapacity concerns, encouraging market-oriented reforms - CNBC","Thu, 04 Apr 2024 07:00:00 GMT"
74,Copper prices climb to 2024 high as Citi calls the start of the metal's second bull market this century - CNBC,"Wed, 10 Apr 2024 07:00:00 GMT"
75,Red Lobster seeks a buyer as it looks to avoid bankruptcy filing - CNBC,"Thu, 25 Apr 2024 07:00:00 GMT"
76,China's BYD fires up its car offerings to compete with Tesla and Jeep at the same time - CNBC,"Tue, 16 Apr 2024 07:00:00 GMT"
77,Oracle boosts its generative AI capabilities as cloud competition heats up - CNBC,"Mon, 29 Apr 2024 07:00:00 GMT"
78,"McDonald’s earnings miss estimates as diners pull back, Middle East boycotts hit sales - CNBC","Tue, 30 Apr 2024 07:00:00 GMT"
79,Healthy Returns: J&J cell therapy gains new edge over Bristol Myers rival - CNBC,"Tue, 09 Apr 2024 07:00:00 GMT"
80,Shares of critical chip firm ASML drop 5% as sales miss expectations with 22% fall - CNBC,"Wed, 17 Apr 2024 07:00:00 GMT"
81,"China accounted for two-thirds of new global coal plant capacity in 2023, report finds - CNBC","Sun, 14 Apr 2024 07:00:00 GMT"
82,Paramount CEO Bob Bakish could be out as soon as Monday as Skydance merger talks continue - CNBC,"Sat, 27 Apr 2024 07:00:00 GMT"
83,FTC sues to block Coach parent Tapestry's acquisition of Capri Holdings - CNBC,"Mon, 22 Apr 2024 07:00:00 GMT"
84,"Trump could drive inflation higher with his second-term economic agenda, analysts say - CNBC","Tue, 30 Apr 2024 07:00:00 GMT"
85,JPMorgan Chase shares drop after bank gives disappointing guidance on 2024 interest income - CNBC,"Fri, 12 Apr 2024 07:00:00 GMT"
86,"Google restructures finance team as part of AI shift, CFO tells employees in memo - CNBC","Wed, 17 Apr 2024 07:00:00 GMT"
87,"With daily entrance fee 'Disney-fication' of Venice, the world hits its overtourism tipping point - CNBC","Sun, 28 Apr 2024 07:00:00 GMT"
88,Apple lays off over 600 California employees after shuttering car project - CNBC,"Thu, 04 Apr 2024 07:00:00 GMT"
89,This U.S. company tested a 4-day workweek—and says it made workers happier and more productive - CNBC,"Fri, 05 Apr 2024 07:00:00 GMT"
90,Alphabet tempers fears that it's falling behind in AI with blowout first-quarter results - CNBC,"Thu, 25 Apr 2024 07:00:00 GMT"
91,More Americans say they are living paycheck to paycheck this year than in 2023—here's why - CNBC,"Tue, 09 Apr 2024 07:00:00 GMT"
92,Americans check their phones 144 times a day: How you can break bad digital habits - CNBC,"Wed, 17 Apr 2024 07:00:00 GMT"
93,CEO: Here's the No. 1 most common type of good boss people actually like—and how to become it - CNBC,"Mon, 22 Apr 2024 07:00:00 GMT"
94,Bitcoin evangelist Michael Saylor has made $370 million from MicroStrategy stock sales this year - CNBC,"Fri, 19 Apr 2024 07:00:00 GMT"
95,"ByteDance, TikTok shelled out $7 million on lobbying and ads to combat potential U.S. ban - CNBC","Tue, 23 Apr 2024 07:00:00 GMT"
96,Ford tops first-quarter earnings estimates as commercial unit offsets EV losses - CNBC,"Wed, 24 Apr 2024 07:00:00 GMT"
97,Microsoft will unveil new Windows and cloud AI features in May - CNBC,"Wed, 10 Apr 2024 07:00:00 GMT"
98,10 U.S. states where Americans earn the lowest incomes—only 2 aren't in the South - CNBC,"Sat, 06 Apr 2024 07:00:00 GMT"
99,"Bank of Japan keeps monetary policy unchanged, sees slightly higher inflation in fiscal 2024 - CNBC","Thu, 25 Apr 2024 07:00:00 GMT"
