,Title,Date
0,"CNBC Fed Survey, September 20, 2016 - CNBC","Sat, 10 May 2025 01:26:58 GMT"
1,"Oil bankruptcies: 100 down, maybe 100 more to go - CNBC","Wed, 28 Sep 2016 07:00:00 GMT"
2,"Truck crashes, dumps unstamped pennies on Delaware highway - CNBC","Thu, 08 Sep 2016 07:00:00 GMT"
3,7 body-language tricks to exude confidence - CNBC,"Wed, 14 Sep 2016 07:00:00 GMT"
4,Durex announced an eggplant flavored condom for a very serious reason - CNBC,"Tue, 06 Sep 2016 07:00:00 GMT"
5,Trump: My plan is the most pro-growth 'perhaps in the history of our country' - CNBC,"Thu, 15 Sep 2016 07:00:00 GMT"
6,'The Profit' star Marcus Lemonis identifies a common mistake that wrecks businesses - CNBC,"Wed, 14 Sep 2016 07:00:00 GMT"
7,Your vanity is the reason this millionaire is investing in action sports - CNBC,"Tue, 20 Sep 2016 07:00:00 GMT"
8,How billionaire tech mogul Elon Musk got his start - CNBC,"Fri, 02 Sep 2016 07:00:00 GMT"
9,A tech start-up founder explains why he left Silicon Valley for Austin - CNBC,"Thu, 01 Sep 2016 07:00:00 GMT"
10,Gasoline prices could be the cheapest for any fall since Obama was first elected - CNBC,"Wed, 14 Sep 2016 07:00:00 GMT"
11,"Chanos: Trump was my easiest short, like 'ocean liners hitting icebergs' - CNBC","Wed, 14 Sep 2016 07:00:00 GMT"
12,Texas-based Miracle Mattress shuts doors indefinitely after 9/11 ad falls flat - CNBC,"Sun, 11 Sep 2016 07:00:00 GMT"
13,Walmart in Florida removes Coke display in shape of doomed World Trade Center - CNBC,"Thu, 08 Sep 2016 07:00:00 GMT"
14,"'Bra war' heats up, but Victoria's Secret shoppers are still the most valuable - CNBC","Mon, 26 Sep 2016 07:00:00 GMT"
15,"If you missed billionaires Lasry & Sternlicht at Delivering Alpha, here's the transcript - CNBC","Thu, 15 Sep 2016 07:00:00 GMT"
16,This may be the quote that doomed $9 billion startup Theranos - CNBC,"Tue, 06 Sep 2016 07:00:00 GMT"
17,Air China magazine warns London visitors to avoid ethnic minority areas - CNBC,"Wed, 07 Sep 2016 07:00:00 GMT"
18,Want to talk like a pirate? Learn Indonesian - CNBC,"Mon, 19 Sep 2016 07:00:00 GMT"
19,Nutanix aims to crack open the tech IPO window - CNBC,"Fri, 30 Sep 2016 07:00:00 GMT"
20,Morgan Freeman on how 'Shawshank' became a classic - CNBC,"Tue, 06 Sep 2016 07:00:00 GMT"
21,"More Hanjin ships seized, as freight rates surge and cargo owners fret - CNBC","Thu, 01 Sep 2016 07:00:00 GMT"
22,Samsung acted with ‘arrogance’ in Note 7 recall in China: CCTV state broadcaster - CNBC,"Fri, 30 Sep 2016 07:00:00 GMT"
23,Zappos CEO Tony Hsieh on getting rid of managers: What I wish I’d done differently - CNBC,"Tue, 13 Sep 2016 07:00:00 GMT"
24,American Greed - Silk Road: Digital Drug Dealers - CNBC,"Tue, 27 Sep 2016 07:00:00 GMT"
25,Michael Dell on EMC acquisition: Tech is 'the change-or-die business' - CNBC,"Wed, 07 Sep 2016 07:00:00 GMT"
26,"Ugly shoes are en vogue, as Ugg mashup hits stores, Crocs storm the runway - CNBC","Tue, 20 Sep 2016 07:00:00 GMT"
27,A new use for Google Glass: Helping children with autism understand emotion - CNBC,"Thu, 22 Sep 2016 07:00:00 GMT"
28,"After Samsung’s Note 7, here’s 10 of the biggest tech recalls ever - CNBC","Tue, 13 Sep 2016 07:00:00 GMT"
29,"Modi news: India, Pakistan tensions mount after attack in Kashmir - CNBC","Tue, 20 Sep 2016 07:00:00 GMT"
30,Brown shoes could lose you a job in UK banking: Study - CNBC,"Thu, 01 Sep 2016 07:00:00 GMT"
31,Catherine Boyle Profile - CNBC,"Sat, 15 Aug 2015 08:23:27 GMT"
32,Get a tattoo of this restaurant's burger and get free burgers for life - CNBC,"Thu, 29 Sep 2016 07:00:00 GMT"
33,Shipshape? What you need to know about Hanjin’s troubles - CNBC,"Fri, 02 Sep 2016 07:00:00 GMT"
34,Zuckerberg accused of censorsing iconic Viet War photo of naked girl fleeing - CNBC,"Fri, 09 Sep 2016 07:00:00 GMT"
35,Donald Trump Jr compares Syrian refugees to poisoned Skittles - CNBC,"Tue, 20 Sep 2016 07:00:00 GMT"
36,Check out Fidelity Dividend ETF for Rising Rates's stock price (FDRR) in real time - CNBC,"Sat, 05 Aug 2017 17:56:50 GMT"
37,The secret link between JFK and Ronald Reagan—and why it matters now - CNBC,"Fri, 09 Sep 2016 07:00:00 GMT"
38,Big-spending sneakerheads gear up for Yeezy mania - CNBC,"Fri, 23 Sep 2016 07:00:00 GMT"
39,This hedge funder is up 36% this year. Here's how he did it - CNBC,"Tue, 13 Sep 2016 07:00:00 GMT"
40,Here's how much the average American family has saved for retirement - CNBC,"Mon, 12 Sep 2016 07:00:00 GMT"
41,"American Greed: ""Gigapix"" Gallery - CNBC","Mon, 19 Sep 2016 07:00:00 GMT"
42,NY/NJ bombing suspect charged with 5 counts of attempted murder of a law enforcement officer: NBC - CNBC,"Mon, 19 Sep 2016 07:00:00 GMT"
43,Jon Marino - CNBC,"Mon, 25 Jan 2016 03:00:53 GMT"
44,"‘Growing global tension’ to drive drone sales, seen doubling by 2025: Research - CNBC","Sun, 11 Sep 2016 07:00:00 GMT"
45,10 of Donald Trump's most outlandish quotes on key issues - CNBC,"Mon, 26 Sep 2016 07:00:00 GMT"
46,"Potash Corp, Agrium to merge to create $36 billion company - CNBC","Mon, 12 Sep 2016 07:00:00 GMT"
47,"American Greed: ""The Stealing Socialite"" Gallery - CNBC","Fri, 09 Sep 2016 07:00:00 GMT"
48,Instructions for turning off an ad blocker on CNBC - CNBC,"Mon, 07 Aug 2017 23:14:01 GMT"
49,"Neil deGrasse Tyson says yes, we all could be living in the matrix - CNBC","Wed, 28 Sep 2016 07:00:00 GMT"
50,Check out Banco de Sabadell SA's stock price (SAB-ES) in real time - CNBC,"Wed, 02 Aug 2017 16:28:53 GMT"
51,The smart investing strategy a janitor used to build an $8 million portfolio - CNBC,"Fri, 02 Sep 2016 07:00:00 GMT"
52,Representative on Wells Fargo and other big banks: 'It's time to break them up' - CNBC,"Thu, 29 Sep 2016 07:00:00 GMT"
53,This chef created a quiet food menu for movie theaters - CNBC,"Tue, 27 Sep 2016 07:00:00 GMT"
54,Check out Sartorius AG's stock price (SRT-DE) in real time - CNBC,"Wed, 02 Aug 2017 22:03:43 GMT"
55,"American Greed: ""Family Fortune Feud"" Gallery - CNBC","Fri, 16 Sep 2016 07:00:00 GMT"
56,Uber hammered by price gouging accusations during NYC's explosion - CNBC,"Sun, 18 Sep 2016 07:00:00 GMT"
57,Google-backed blockchain start-up Ripple raises $55 million from big banks - CNBC,"Thu, 15 Sep 2016 07:00:00 GMT"
58,5 success tips from a multibillionaire who went from rags to riches - CNBC,"Fri, 16 Sep 2016 07:00:00 GMT"
59,"American Greed: Highlight Clip - ""A Night Out with the Scripps Family"" - CNBC","Mon, 19 Sep 2016 07:00:00 GMT"
60,Meet Blaze: The Chipotle-inspired pizza joint LeBron James dumped McDonald's for - CNBC,"Thu, 08 Sep 2016 07:00:00 GMT"
61,How much do countries spend to get you to show up? - CNBC,"Fri, 30 Sep 2016 07:00:00 GMT"
62,Facebook's Mark Zuckerberg says the most successful entrepreneurs share 3 traits - CNBC,"Fri, 02 Sep 2016 07:00:00 GMT"
63,Sweet: Our law enforcement is at a 'gold-medal level' - CNBC,"Mon, 19 Sep 2016 07:00:00 GMT"
64,Pornhub wants women to pursue STEM careers - CNBC,"Thu, 22 Sep 2016 07:00:00 GMT"
65,North Korea nuke test sparks new worries for ex-diplomats - CNBC,"Tue, 20 Sep 2016 07:00:00 GMT"
66,Trump Taps Citizens United President As Deputy Campaign Manager - CNBC,"Thu, 01 Sep 2016 07:00:00 GMT"
67,CNBC Exclusive: CNBC Transcript: Kansas City Fed President Esther George Speaks with CNBC’s Steve Liesman on “Squawk Box” Today - CNBC,"Thu, 29 Sep 2016 07:00:00 GMT"
68,Inside Cole Haan's innovation lab: Inventing dress shoes that feel like sneakers - CNBC,"Mon, 12 Sep 2016 07:00:00 GMT"
69,Wall Street movie 'Equity' dramatizes unequal workplace - CNBC,"Wed, 07 Sep 2016 07:00:00 GMT"
70,Sony CEO: We can still innovate with 'wacky' products - CNBC,"Tue, 20 Sep 2016 07:00:00 GMT"
71,Dropping the F-bomb when you're a CEO: Is it ever OK? - CNBC,"Fri, 02 Sep 2016 07:00:00 GMT"
72,"Truman Capote's ashes, once owned by Johnny Carson's ex-wife, sold for $45,000 - CNBC","Sun, 25 Sep 2016 07:00:00 GMT"
73,Trump brags about not paying taxes: 'That makes me smart' - CNBC,"Mon, 26 Sep 2016 07:00:00 GMT"
74,Steve gives Geoff a new hairstyle - CNBC,"Fri, 16 Sep 2016 07:00:00 GMT"
75,Taco Bell to launch Airheads White Mystery Freeze - CNBC,"Wed, 07 Sep 2016 07:00:00 GMT"
76,What 9 self-made millionaires do before breakfast - CNBC,"Tue, 06 Sep 2016 07:00:00 GMT"
77,95-year-old fashion icon Iris Apfel says hard work is her fountain of youth - CNBC,"Fri, 02 Sep 2016 07:00:00 GMT"
78,China developing 500km/h trains to lead export of high-speed rail technology - CNBC,"Sun, 25 Sep 2016 07:00:00 GMT"
79,A couple that saved $1 million to retire at age 43 shares the first steps they took - CNBC,"Wed, 07 Sep 2016 07:00:00 GMT"
80,Ailes ally Greta Van Susteren to leave Fox - CNBC,"Tue, 06 Sep 2016 07:00:00 GMT"
81,The biggest hedge fund donor this election: Why it stays so quiet - CNBC,"Fri, 09 Sep 2016 07:00:00 GMT"
82,"Bill Clinton supports lower corporate tax rate, says reasoning for TPP clear - CNBC","Wed, 21 Sep 2016 07:00:00 GMT"
83,Driverless cars will kill the most jobs in select US states - CNBC,"Fri, 02 Sep 2016 07:00:00 GMT"
84,PGIM - CNBC,"Mon, 31 Jul 2017 14:12:41 GMT"
85,Breakingviews: Trump's $4.6 billion in free media - CNBC,"Fri, 30 Sep 2016 07:00:00 GMT"
86,How this 'Shark Tank'-backed bagel maker bagged a deal with Starbucks - CNBC,"Fri, 09 Sep 2016 07:00:00 GMT"
87,Big US military aid package to Israel has strings attached - CNBC,"Thu, 15 Sep 2016 07:00:00 GMT"
88,The Hague revives maritime border dispute between Timor-Leste and Australia - CNBC,"Tue, 27 Sep 2016 07:00:00 GMT"
89,9 thoughts holding you back from getting rich — and what to think instead - CNBC,"Tue, 20 Sep 2016 07:00:00 GMT"
90,Commissions are devouring your 529 earnings gains - CNBC,"Tue, 20 Sep 2016 07:00:00 GMT"
91,Party City set for the year's biggest holiday: Halloween - CNBC,"Fri, 23 Sep 2016 07:00:00 GMT"
92,Elon Musk says rocket did not explode but instead experienced a 'fast fire' - CNBC,"Fri, 02 Sep 2016 07:00:00 GMT"
93,The 5 most outrageous things Hillary Clinton said in her FBI interview - CNBC,"Fri, 02 Sep 2016 07:00:00 GMT"
94,QE and negative rates are a Ponzi scheme: Saxo Bank CEO - CNBC,"Thu, 15 Sep 2016 07:00:00 GMT"
95,US companies are hoarding $2.5 trillion in cash overseas - CNBC,"Tue, 20 Sep 2016 07:00:00 GMT"
96,Goldie Hawn on Hillary Clinton and not being married to Kurt Russell for 33 years - CNBC,"Wed, 28 Sep 2016 07:00:00 GMT"
97,Billionaires Warren Buffett and Bill Gates have similar ideas about how much money you should leave your kids - CNBC,"Mon, 26 Sep 2016 07:00:00 GMT"
98,Singapore's Sing Lun has top sportwear labels as clients and an ambitious outlook - CNBC,"Fri, 09 Sep 2016 07:00:00 GMT"
99,CNBC Roku Channel Update - CNBC,"Fri, 09 Sep 2016 07:00:00 GMT"
