,Title,Date
0,Constitutional amendment to allow Trump third term introduced in the House - CNBC,"Thu, 23 Jan 2025 08:00:00 GMT"
1,"When I left Texas for Spain, ‘I gained the freedom to redefine myself’—it would’ve been impossible in the U.S. - CNBC","Sat, 18 Jan 2025 08:00:00 GMT"
2,Amazon lays off 'small number' of employees in communications and sustainability units - CNBC,"Wed, 29 Jan 2025 08:00:00 GMT"
3,UFC's Dana White joins Meta's board weeks before Trump takes office - CNBC,"Mon, 06 Jan 2025 08:00:00 GMT"
4,Musk aides lock government workers out of computer systems at U.S. agency: Reuters - CNBC,"Fri, 31 Jan 2025 08:00:00 GMT"
5,"Wayfair to exit Germany, cut 730 jobs as it looks to focus on physical retail - CNBC","Fri, 10 Jan 2025 08:00:00 GMT"
6,"Bitcoin drops below $100,000 in risk-off move as Nasdaq stocks are hit - CNBC","Mon, 27 Jan 2025 08:00:00 GMT"
7,DOJ fires officials involved in Trump prosecutions by special counsel Jack Smith - CNBC,"Mon, 27 Jan 2025 08:00:00 GMT"
8,Power stocks plunge as energy needs called into question because of new China AI lab - CNBC,"Mon, 27 Jan 2025 08:00:00 GMT"
9,Stellantis reveals redesigned Ram heavy-duty trucks - CNBC,"Tue, 07 Jan 2025 08:00:00 GMT"
10,These airlines were the most on time in 2024 - CNBC,"Thu, 02 Jan 2025 08:00:00 GMT"
11,"Meta scraps fact-checking, brings back political content in latest Trump-friendly move - CNBC","Tue, 07 Jan 2025 08:00:00 GMT"
12,The crazy ride in quantum computing stocks continues as shares rip higher on Microsoft's 'quantum-ready' directive - CNBC,"Wed, 15 Jan 2025 08:00:00 GMT"
13,Derivatives - CNBC,"Sat, 26 Sep 2015 11:09:56 GMT"
14,Chevron calls Gulf of Mexico the Gulf of America in earnings release after Trump order - CNBC,"Fri, 31 Jan 2025 08:00:00 GMT"
15,Fed Governor Bowman says December interest rate cut should be the last - CNBC,"Thu, 09 Jan 2025 08:00:00 GMT"
16,Morgan Stanley tops estimates on strong equities and fixed income trading revenue - CNBC,"Thu, 16 Jan 2025 08:00:00 GMT"
17,Jamie Dimon says the U.S. stock market is 'kind of inflated’ - CNBC,"Wed, 22 Jan 2025 08:00:00 GMT"
18,Mark Zuckerberg slams Apple on its lack of innovation and 'random rules' - CNBC,"Sat, 11 Jan 2025 08:00:00 GMT"
19,Boeing expects $4 billion loss for fourth quarter after chaotic 2024 - CNBC,"Thu, 23 Jan 2025 08:00:00 GMT"
20,"There's excitement of a 'space race' in crypto under Trump, says TRM Labs' Ari Redbord - CNBC","Mon, 06 Jan 2025 08:00:00 GMT"
21,Anthropic in talks to raise funding at $60 billion valuation - CNBC,"Tue, 07 Jan 2025 08:00:00 GMT"
22,British luxury carmaker Rolls-Royce says super rich fueling a demand boom for bespoke models - CNBC,"Wed, 08 Jan 2025 08:00:00 GMT"
23,Morgan Stanley CEO Ted Pick says bank will work with U.S. regulators on offering crypto - CNBC,"Thu, 23 Jan 2025 08:00:00 GMT"
24,Kalshi names Donald Trump Jr. as strategic advisor to prediction market firm - CNBC,"Mon, 13 Jan 2025 08:00:00 GMT"
25,"Rivian stock has its best day ever after EV maker reports 2024 production, deliveries - CNBC","Fri, 03 Jan 2025 08:00:00 GMT"
26,Trump won't rule out using U.S. military to control Panama Canal or Greenland - CNBC,"Tue, 07 Jan 2025 08:00:00 GMT"
27,Dow tumbles nearly 700 points Friday as strong jobs report casts doubt over Fed’s rate-cut path - CNBC,"Fri, 10 Jan 2025 08:00:00 GMT"
28,Amazon taps Whole Foods CEO to oversee grocery business - CNBC,"Mon, 27 Jan 2025 08:00:00 GMT"
29,"Target rolls back DEI initiatives, the latest big company to retreat - CNBC","Fri, 24 Jan 2025 08:00:00 GMT"
30,Here are the products and companies most at risk from Trump's tariff plans - CNBC,"Mon, 20 Jan 2025 08:00:00 GMT"
31,"'Will I receive an IRS stimulus check?' Answers to top questions on the $1,400 automatic payments - CNBC","Thu, 16 Jan 2025 08:00:00 GMT"
32,"Trump's Treasury pick Bessent says heavier Russia sanctions coming, no reason for digital currency - CNBC","Thu, 16 Jan 2025 15:07:48 GMT"
33,"Anthropic CEO doesn't see DeepSeek as 'adversaries,' but says export controls are critical - CNBC","Wed, 29 Jan 2025 08:00:00 GMT"
34,Chinese travelers cancel Lunar New Year trips to Thailand over safety concerns - CNBC,"Tue, 28 Jan 2025 08:00:00 GMT"
35,Meta announces end of DEI programs. Read the internal memo - CNBC,"Fri, 10 Jan 2025 08:00:00 GMT"
36,Apple turns its AI on by default in latest software update - CNBC,"Mon, 27 Jan 2025 08:00:00 GMT"
37,Biden administration seeks to avoid default crisis for student loan borrowers as garnishments resume - CNBC,"Wed, 15 Jan 2025 08:00:00 GMT"
38,"Sam Altman touts OpenAI-Microsoft alliance, says next phase will be 'better than anyone is ready for' - CNBC","Tue, 28 Jan 2025 08:00:00 GMT"
39,Super Bowl ads beckon up to $8 million apiece for Fox - CNBC,"Wed, 29 Jan 2025 08:00:00 GMT"
40,"Amazon licenses Melania Trump documentary, as Jeff Bezos cozies up to president-elect - CNBC","Sun, 05 Jan 2025 08:00:00 GMT"
41,"Delta links its loyalty program to Uber, ending partnership with Lyft - CNBC","Tue, 07 Jan 2025 08:00:00 GMT"
42,"GM, Ford report best annual U.S. sales since 2019 as auto recovery continues - CNBC","Fri, 03 Jan 2025 08:00:00 GMT"
43,"FTC sues PepsiCo, alleging price discrimination is raising costs for consumers - CNBC","Fri, 17 Jan 2025 08:00:00 GMT"
44,Chinese AI applications now have bigger aims — they're looking beyond chatbots - CNBC,"Sun, 26 Jan 2025 08:00:00 GMT"
45,Trump is searching for potential TikTok buyers — who are the likely contenders? - CNBC,"Fri, 24 Jan 2025 08:00:00 GMT"
46,OpenAI CEO Sam Altman: The new No. 1 ability you need to succeed—it's not raw intelligence - CNBC,"Mon, 13 Jan 2025 08:00:00 GMT"
47,FDA approves Johnson & Johnson’s nasal spray for depression as stand-alone treatment - CNBC,"Tue, 21 Jan 2025 08:00:00 GMT"
48,"Trump tariffs pose a greater threat to South Korea’s economy than domestic political chaos, BOK official suggests - CNBC","Thu, 02 Jan 2025 08:00:00 GMT"
49,Google offers 'voluntary' buyouts to hardware and platform teams - CNBC,"Fri, 31 Jan 2025 08:00:00 GMT"
50,White House says Trump funding freeze remains in effect despite rescinding OMB memo - CNBC,"Wed, 29 Jan 2025 08:00:00 GMT"
51,"Fed officials are worried about the inflation impacts from Trump's policies, minutes show - CNBC","Wed, 08 Jan 2025 08:00:00 GMT"
52,Los Angeles wildfires could be costliest blaze in U.S. history - CNBC,"Thu, 09 Jan 2025 08:00:00 GMT"
53,TikTok’s U.S. operations could be worth as much as $50 billion if ByteDance decides to sell - CNBC,"Wed, 15 Jan 2025 08:00:00 GMT"
54,American Airlines collision with Army helicopter is worst U.S. air disaster since 2001 - CNBC,"Thu, 30 Jan 2025 08:00:00 GMT"
55,"Meta employees criticize Zuckerberg decisions to end fact-checking, add Dana White to board - CNBC","Tue, 07 Jan 2025 08:00:00 GMT"
56,"Zuckerberg sets Meta's AI targets for the year, expects to spend $60 billion on growth - CNBC","Fri, 24 Jan 2025 08:00:00 GMT"
57,Tesla reports first-ever drop in annual deliveries - CNBC,"Thu, 02 Jan 2025 08:00:00 GMT"
58,Trump's plan for mass deportation could have a big effect on prices - CNBC,"Sat, 11 Jan 2025 08:00:00 GMT"
59,"'Unprecedented': The most punctual global airline last year was 'absolutely' a surprise, analytics firm CEO says - CNBC","Thu, 02 Jan 2025 08:00:00 GMT"
60,BlackRock's Fink sees potential risks and says the bond market will tell us where we are going - CNBC,"Thu, 23 Jan 2025 08:00:00 GMT"
61,Meme stocks: What are they and why you should be careful buying them - CNBC,"Mon, 18 Oct 2021 22:02:13 GMT"
62,Tesla posted record China sales in 2024. But this year is going to be tough as competition heats up - CNBC,"Mon, 06 Jan 2025 08:00:00 GMT"
63,"Elon Musk, Vivek Ramaswamy call remote work a 'Covid-era privilege.' Economists say it's here to stay - CNBC","Thu, 02 Jan 2025 08:00:00 GMT"
64,Here's what CEOs are saying about DEI at Davos - CNBC,"Fri, 24 Jan 2025 08:00:00 GMT"
65,Meta announces 5% cuts in preparation for 'intense year' — read the internal memo - CNBC,"Tue, 14 Jan 2025 08:00:00 GMT"
66,"A 2,000-year-old martial art is using virtual reality to reinvent itself - CNBC","Thu, 23 Jan 2025 08:00:00 GMT"
67,"Biden announces final round of student loan forgiveness, bringing aid total to nearly $189 billion - CNBC","Thu, 16 Jan 2025 08:00:00 GMT"
68,"Trump executive order declassifies JFK, RFK, Martin Luther King Jr. assassination files - CNBC","Thu, 23 Jan 2025 08:00:00 GMT"
69,"'We have a very focused business plan going forward,' says Polestar CEO - CNBC","Fri, 24 Jan 2025 08:00:00 GMT"
70,Apple disables AI notifications for news in its beta iPhone software - CNBC,"Thu, 16 Jan 2025 08:00:00 GMT"
71,Meta replaces policy chief Nick Clegg with former Republican staffer Joel Kaplan ahead of Trump inauguration - CNBC,"Thu, 02 Jan 2025 08:00:00 GMT"
72,Greenland’s melting ice is clearing the way for a mineral ‘gold rush’ - CNBC,"Fri, 17 Jan 2025 08:00:00 GMT"
73,Trump says he will send migrants to Guantanamo Bay - CNBC,"Wed, 29 Jan 2025 08:00:00 GMT"
74,"Europe ready to respond 'in a proportionate way' as Trump touts tariffs, top EU official says - CNBC","Wed, 22 Jan 2025 08:00:00 GMT"
75,"DeepSeek represents new phase in AI trend, says VanEck CEO Jan van Eck - CNBC","Tue, 28 Jan 2025 08:00:00 GMT"
76,"Google donates $1 million to Trump's inauguration fund, joining other tech giants - CNBC","Thu, 09 Jan 2025 08:00:00 GMT"
77,Watch CNBC's full interview with Starbucks chairman and CEO Brian Niccol - CNBC,"Wed, 29 Jan 2025 08:00:00 GMT"
78,CFPB sues Capital One for 'cheating' customers out of over $2 billion in interest - CNBC,"Tue, 14 Jan 2025 08:00:00 GMT"
79,"I’ve worked with over 1,000 kids—the ones with high emotional intelligence use these 6 phrases - CNBC","Sun, 19 Jan 2025 08:00:00 GMT"
80,The BRICS bloc is growing — and Trump's tariff threat isn't expected to put off aspiring members - CNBC,"Fri, 17 Jan 2025 08:00:00 GMT"
81,David Einhorn says we have reached the 'Fartcoin' stage of the market cycle - CNBC,"Tue, 21 Jan 2025 08:00:00 GMT"
82,Here's why you’re suddenly following President Trump on Instagram - CNBC,"Wed, 22 Jan 2025 08:00:00 GMT"
83,"Google restores Joe Biden to ‘U.S. presidents’ search results, blames ‘data error’ for omission - CNBC","Thu, 23 Jan 2025 08:00:00 GMT"
84,"Wealthy leaders share financial advice they gave their kids: Invest early, learn from failure — and think carefully about inheritance - CNBC","Thu, 23 Jan 2025 08:00:00 GMT"
85,"Atlassian closes at highest since 2022 after reporting better-than-expected earnings, revenue outlook - CNBC","Fri, 31 Jan 2025 08:00:00 GMT"
86,"Bitcoin accelerates its slide, falling toward $90,000 to start the week - CNBC","Mon, 13 Jan 2025 08:00:00 GMT"
87,"As WEF gets underway, the list of world leaders not attending Davos speaks volumes - CNBC","Mon, 20 Jan 2025 08:00:00 GMT"
88,Jeff Bezos says everything on Earth has improved since 'the good old days'—except for 1 thing - CNBC,"Fri, 03 Jan 2025 08:00:00 GMT"
89,Shein's Donald Tang: We are not fast fashion but fashion on-demand - CNBC,"Thu, 23 Jan 2025 08:00:00 GMT"
90,Elon Musk's X begins its push into financial services with Visa deal - CNBC,"Tue, 28 Jan 2025 08:00:00 GMT"
91,Trump says 25% tariffs on Mexico and Canada may not include oil: 'Oil is going to have nothing to do with it as far as I’m concerned' - CNBC,"Fri, 31 Jan 2025 08:00:00 GMT"
92,A global bond sell-off is deepening as investors pare Fed rate-cut expectations - CNBC,"Tue, 14 Jan 2025 08:00:00 GMT"
93,Why Meta had to 'bend the knee to Trump' ahead of his inauguration - CNBC,"Sat, 11 Jan 2025 08:00:00 GMT"
94,"Southwest Airlines pauses corporate hiring, most summer internships to cut costs - CNBC","Tue, 14 Jan 2025 08:00:00 GMT"
95,"Bank of America tops estimates on better-than-expected investment banking, interest income - CNBC","Thu, 16 Jan 2025 08:00:00 GMT"
96,"This Japanese man earned $80,000 a year from 'doing nothing' - CNBC","Mon, 06 Jan 2025 08:00:00 GMT"
97,Oracle shares jump 7% on involvement in AI infrastructure initiative that Trump will announce - CNBC,"Tue, 21 Jan 2025 08:00:00 GMT"
98,Spirit Airlines cuts 200 jobs in bankruptcy cost-cutting scramble - CNBC,"Thu, 16 Jan 2025 08:00:00 GMT"
99,"Foreign phone sales plunge 47% in China, spelling trouble for Apple - CNBC","Fri, 03 Jan 2025 08:00:00 GMT"
