,Title,Date
0,Are you prepared for a pet emergency? Most Americans are not - CNBC,"Thu, 14 Jun 2018 07:00:00 GMT"
1,Intel's Brian Krzanich is forced out as CEO after 'consensual relationship' with employee - CNBC,"Thu, 21 Jun 2018 07:00:00 GMT"
2,The secret to lower credit card rates and fees - CNBC,"Sun, 17 Jun 2018 07:00:00 GMT"
3,"The difference between G-7, G-8, and G-20 — and why they matter - CNBC","Fri, 08 Jun 2018 07:00:00 GMT"
4,Pitbull reveals his most important lesson about money - CNBC,"Sat, 02 Jun 2018 07:00:00 GMT"
5,GM's new 39-year-old CFO Dhivya Suryadevara is making history - CNBC,"Fri, 15 Jun 2018 07:00:00 GMT"
6,The head of Amazon's marketplace has lost most of his authority amid internal shake-up - CNBC,"Thu, 21 Jun 2018 07:00:00 GMT"
7,Wynn Resorts and other US companies could get hit in a US-China trade war - CNBC,"Fri, 15 Jun 2018 07:00:00 GMT"
8,Ripple CEO says 'dozens' of banks will use its cryptocurrency product in 2019 - CNBC,"Tue, 05 Jun 2018 07:00:00 GMT"
9,AT&T is about to give free TV to its wireless customers now that the Time Warner deal is done - CNBC,"Sat, 16 Jun 2018 07:00:00 GMT"
10,How this 25-year-old freelancer made 6 figures in 6 months off Fiverr - CNBC,"Fri, 29 Jun 2018 07:00:00 GMT"
11,Phone service can mean life or death after a disaster and AT&T and Verizon are using drones that could help - CNBC,"Sun, 24 Jun 2018 07:00:00 GMT"
12,The fake novel in hit TV show 'Younger' is now a real book - CNBC,"Tue, 12 Jun 2018 07:00:00 GMT"
13,Former Citrix chief Mark Templeton takes over at cloud start-up DigitalOcean - CNBC,"Wed, 20 Jun 2018 07:00:00 GMT"
14,This refugee-turned-CEO makes technology that lets you control a car with your mind - CNBC,"Wed, 06 Jun 2018 07:00:00 GMT"
15,America's biggest RV manufacturer warns tariffs are already raising costs - CNBC,"Thu, 07 Jun 2018 07:00:00 GMT"
16,"Ackman's hedge funds gain after years of losses, helped by Chipotle and ADP - CNBC","Fri, 15 Jun 2018 07:00:00 GMT"
17,Forgot to withdraw from your retirement account? How to avoid that killer penalty - CNBC,"Mon, 11 Jun 2018 07:00:00 GMT"
18,The woman behind 'female Viagra' sold her company for $1 billion — then got it back for free - CNBC,"Thu, 21 Jun 2018 07:00:00 GMT"
19,"Google sister-company Sidewalk has a secret 'yellow book' with its plans to reinvent cities, plus possible sites beyond Toronto - CNBC","Wed, 27 Jun 2018 07:00:00 GMT"
20,Oil industry is 'peddling misinformation' about electric vehicles - CNBC,"Fri, 29 Jun 2018 07:00:00 GMT"
21,Why Marc Benioff makes Salesforce employees do volunteer work on their first day - CNBC,"Thu, 28 Jun 2018 07:00:00 GMT"
22,"Here's what we know about Jarrod Ramos, identified as the suspect in the Maryland newspaper shooting - CNBC","Thu, 28 Jun 2018 07:00:00 GMT"
23,"Buffett's partner once gave $20,000 to doctor picked to lead Berkshire, Amazon, JP Morgan venture - CNBC","Wed, 20 Jun 2018 07:00:00 GMT"
24,"Google will not renew controversial Pentagon contract, cloud leader Diane Greene tells employees - CNBC","Fri, 01 Jun 2018 07:00:00 GMT"
25,Here's what people actually ask Amazon's Alexa - CNBC,"Wed, 27 Jun 2018 07:00:00 GMT"
26,Elon Musk hosts a Boring flamethrower party - CNBC,"Mon, 11 Jun 2018 07:00:00 GMT"
27,"US oil exports boom to record level, surpassing most OPEC nations - CNBC","Wed, 27 Jun 2018 07:00:00 GMT"
28,Drone giant DJI is building a new headquarters as a 'floating community' with a giant sky bridge to test drones - CNBC,"Sun, 17 Jun 2018 07:00:00 GMT"
29,Inside Amazon's Grand Challenge — a secretive lab working on cancer research and other ventures - CNBC,"Tue, 05 Jun 2018 07:00:00 GMT"
30,Tony Hawk's dad convinced him to invest his money in a house at 17 — and it was ‘one of the smartest things’ he ever did - CNBC,"Fri, 01 Jun 2018 07:00:00 GMT"
31,"North Korea could account for nearly a quarter of a unified Korean Peninsula's economy one day, UBS says - CNBC","Wed, 27 Jun 2018 07:00:00 GMT"
32,Bill Gates refuses to overspend on these 2 common things - CNBC,"Thu, 28 Jun 2018 07:00:00 GMT"
33,"Wait your turn, Group 5. United is testing a new boarding method this summer - CNBC","Fri, 01 Jun 2018 07:00:00 GMT"
34,Take a look inside Charleston's weirdest mansion — it's $5 million and it's hurricane-proof - CNBC,"Sat, 23 Jun 2018 07:00:00 GMT"
35,"McDonald's to add self-order kiosks to 1,000 stores each quarter - CNBC","Mon, 04 Jun 2018 07:00:00 GMT"
36,How Anne and Susan Wojcicki's parents raised the founder of 23andMe and the CEO of YouTube - CNBC,"Mon, 18 Jun 2018 07:00:00 GMT"
37,Here's how much the Golden State Warriors could bring home if they win the NBA Finals - CNBC,"Fri, 08 Jun 2018 07:00:00 GMT"
38,Elon Musk e-mails Tesla employees urging 'radical improvements' to hit quarterly targets - CNBC,"Sat, 16 Jun 2018 07:00:00 GMT"
39,Silicon Valley’s Achilles’ heel threatens to topple its supremacy in innovation - CNBC,"Wed, 20 Jun 2018 07:00:00 GMT"
40,"$1.1 billion in cryptocurrency has been stolen this year, and it was apparently easy to do - CNBC","Thu, 07 Jun 2018 07:00:00 GMT"
41,Why the gender pay gap still exists 55 years after the Equal Pay Act was signed - CNBC,"Sun, 10 Jun 2018 07:00:00 GMT"
42,"Jeff Bezos, Mark Cuban and Elon Musk avoid this productivity killer—and you should too - CNBC","Wed, 13 Jun 2018 07:00:00 GMT"
43,"Billionaire conservative donor David Koch to retire from Koch Industries, influential political network - CNBC","Tue, 05 Jun 2018 07:00:00 GMT"
44,"Apple ‘one of the biggest gaming companies in the world’ even though it doesn't make games, analyst says - CNBC","Tue, 05 Jun 2018 07:00:00 GMT"
45,"Here's a list of products affected by tariffs so far, including nails and whiskey - CNBC","Thu, 28 Jun 2018 07:00:00 GMT"
46,"The US-North Korea summit was great for China, but not so good for the rest of Asia - CNBC","Wed, 13 Jun 2018 07:00:00 GMT"
47,This new water bottle could put the 'squeeze' on the $8 billion reusable water bottle industry - CNBC,"Fri, 08 Jun 2018 07:00:00 GMT"
48,The story of how comic books became public enemy No. 1 in America’s war on juvenile delinquency - CNBC,"Sun, 10 Jun 2018 07:00:00 GMT"
49,Alan Greenspan on trade: The notion that foreigners are ripping us off is 'nonsense' - CNBC,"Wed, 13 Jun 2018 07:00:00 GMT"
50,This NFL star turned Wharton MBA grad landed a big job at Goldman Sachs — here's his No. 1 key for success - CNBC,"Mon, 25 Jun 2018 07:00:00 GMT"
51,"Why your first job out of college really, really matters - CNBC","Tue, 26 Jun 2018 07:00:00 GMT"
52,A french fry gets soggy in 5 minutes. This company wants to keep it crispy for 60. - CNBC,"Fri, 29 Jun 2018 07:00:00 GMT"
53,Why Instagram gives one employee the 'axe' every week - CNBC,"Thu, 14 Jun 2018 07:00:00 GMT"
54,This weed-killing AI robot can tell crops apart - CNBC,"Mon, 04 Jun 2018 07:00:00 GMT"
55,"The problem with high drug prices isn't 'foreign freeloading,' it's the patent system - CNBC","Wed, 27 Jun 2018 07:00:00 GMT"
56,How Ant Financial grew larger than Goldman Sachs - CNBC,"Fri, 08 Jun 2018 07:00:00 GMT"
57,Supreme Court rules that Trump's travel ban is constitutional - CNBC,"Tue, 26 Jun 2018 07:00:00 GMT"
58,Elon Musk slept on his office couch and ‘showered at the YMCA’ while starting his first company - CNBC,"Tue, 19 Jun 2018 07:00:00 GMT"
59,Here's who's making money from immigration enforcement - CNBC,"Fri, 29 Jun 2018 07:00:00 GMT"
60,How this 23-year-old became the only full-time woman trader at the New York Stock Exchange - CNBC,"Wed, 13 Jun 2018 07:00:00 GMT"
61,Here's what it's like to shop at Toys R Us for the last time - CNBC,"Fri, 29 Jun 2018 07:00:00 GMT"
62,Elon Musk emails employees about 'extensive and damaging sabotage' by employee - CNBC,"Mon, 18 Jun 2018 07:00:00 GMT"
63,How Kim Jong Un wants to develop his economy and secure his regime - CNBC,"Mon, 11 Jun 2018 07:00:00 GMT"
64,Buffett on bitcoin and cryptocurrencies - CNBC,"Tue, 26 Jun 2018 07:00:00 GMT"
65,"US economic advisor Larry Kudlow in good condition following heart attack, White House says - CNBC","Mon, 11 Jun 2018 07:00:00 GMT"
66,Lunch with Warren Buffett auctioned off for $3.3 million - CNBC,"Sat, 02 Jun 2018 07:00:00 GMT"
67,60% of employees surveyed would take a pay cut to work for this type of company - CNBC,"Tue, 12 Jun 2018 07:00:00 GMT"
68,Stanford researchers: 'Follow your passion' advice could make you less successful - CNBC,"Fri, 22 Jun 2018 07:00:00 GMT"
69,"A year later, what Uber has done to revamp its troubled image - CNBC","Wed, 20 Jun 2018 07:00:00 GMT"
70,Here's who is getting rich off the World Cup - CNBC,"Thu, 14 Jun 2018 07:00:00 GMT"
71,Kroger to bring driverless cars to grocery delivery - CNBC,"Thu, 28 Jun 2018 07:00:00 GMT"
72,That vacation social media post might raise the risk of robbery - CNBC,"Thu, 14 Jun 2018 07:00:00 GMT"
73,Online marketplace Etsy soars after increasing the fees it takes from each sale - CNBC,"Thu, 14 Jun 2018 07:00:00 GMT"
74,We want to hear from you! Submit your questions for the traders below - CNBC,"Thu, 28 Jun 2018 07:00:00 GMT"
75,From dishwasher to culinary rebel: How Anthony Bourdain became a celebrity chef - CNBC,"Fri, 08 Jun 2018 07:00:00 GMT"
76,Elon Musk: This is why we have to build civilizations in space - CNBC,"Tue, 26 Jun 2018 07:00:00 GMT"
77,How to invest in the booming pet industry - CNBC,"Wed, 06 Jun 2018 07:00:00 GMT"
78,"You think it's your friend calling, but it's actually this growing phone scam - CNBC","Tue, 12 Jun 2018 07:00:00 GMT"
79,Here's what 12 experts say about whether President Trump can pardon himself - CNBC,"Mon, 04 Jun 2018 07:00:00 GMT"
80,Facebook denies building eye-tracking software - CNBC,"Tue, 12 Jun 2018 07:00:00 GMT"
81,"A DNA testing start-up sent used kits filled with spit to some customers, an example of growing pains in a new industry - CNBC","Fri, 15 Jun 2018 07:00:00 GMT"
82,10 business classes you can take online for free - CNBC,"Mon, 25 Jun 2018 07:00:00 GMT"
83,JP Morgan is unleashing artificial intelligence on a business that moves $5 trillion for corporations every day - CNBC,"Wed, 20 Jun 2018 07:00:00 GMT"
84,"Sex robots offer little evidence of any health benefits, doctors say - CNBC","Tue, 05 Jun 2018 07:00:00 GMT"
85,HelloFresh is latest meal kit to head to the grocery store - CNBC,"Sun, 03 Jun 2018 07:00:00 GMT"
86,"""Beware"" - CNBC","Wed, 06 Jun 2018 07:00:00 GMT"
87,'CNBC Meets: Defining Values' airs on June 29 - CNBC,"Fri, 15 Jun 2018 07:00:00 GMT"
88,Apple has a new app that lets you measure almost anything with your iPhone - CNBC,"Wed, 13 Jun 2018 07:00:00 GMT"
89,Insurance start-up launches on-demand health coverage - CNBC,"Thu, 28 Jun 2018 07:00:00 GMT"
90,Amazon's new Fire TV Cube lets you ask Alexa to change the channel - CNBC,"Thu, 07 Jun 2018 07:00:00 GMT"
91,"Tesla is asking Model 3 reservation holders for another $2,500 to order their cars - CNBC","Thu, 28 Jun 2018 07:00:00 GMT"
92,SpaceX planning massive expansion of rocket facilities on Florida's space coast - CNBC,"Fri, 08 Jun 2018 07:00:00 GMT"
93,"This bank is staffing branches with humanoid robots that dance, take selfies and push credit cards - CNBC","Tue, 26 Jun 2018 07:00:00 GMT"
94,Bill Gates says gamer bots from Elon Musk-backed nonprofit are 'huge milestone' in A.I. - CNBC,"Thu, 28 Jun 2018 07:00:00 GMT"
95,This floating robotic factory will build satellites and spaceships in orbit - CNBC,"Sat, 23 Jun 2018 07:00:00 GMT"
96,The woman suing Point72 and Steve Cohen speaks out about alleged gender and pay discrimination - CNBC,"Mon, 11 Jun 2018 07:00:00 GMT"
97,Snap-on CEO: If Trump went after us like Harley-Davidson for overseas factories we'd defend ourselves - CNBC,"Thu, 28 Jun 2018 07:00:00 GMT"
98,The Amazon Fire TV Cube is so good I want one for every TV in my house - CNBC,"Thu, 21 Jun 2018 07:00:00 GMT"
99,"The next 9/11 will be a cyberattack, security expert warns - CNBC","Fri, 01 Jun 2018 07:00:00 GMT"
