,Title,Date
0,Coronavirus: China's Xi sends best wishes to Trump; campaign manager Bill Stepien tests positive - CNBC,"Sat, 03 Oct 2020 07:00:00 GMT"
1,Walmart signs trio of drone deals as it races to play catch-up with Amazon - CNBC,"Mon, 05 Oct 2020 07:00:00 GMT"
2,AMD to buy chip peer Xilinx for $35 billion in data center push - CNBC,"Tue, 27 Oct 2020 07:00:00 GMT"
3,SEC sues John McAfee over promoting cryptocurrency offerings on Twitter - CNBC,"Mon, 05 Oct 2020 07:00:00 GMT"
4,Health-care workers in Michigan criticize Trump's rally amid record Covid cases - CNBC,"Tue, 27 Oct 2020 07:00:00 GMT"
5,"Unemployment was supposed to be temporary. Now, it’s permanent for almost 4 million - CNBC","Tue, 13 Oct 2020 07:00:00 GMT"
6,"Amazon has resumed policies that penalize workers for taking too many breaks, just in time for Prime Day - CNBC","Wed, 14 Oct 2020 07:00:00 GMT"
7,Former IBM CEO says employers should stop hiring based on college degrees and focus on this instead - CNBC,"Mon, 05 Oct 2020 07:00:00 GMT"
8,"President Trump would be better for stock market, says CNBC All-America survey poll - CNBC","Tue, 27 Oct 2020 07:00:00 GMT"
9,55. Clifford Swan Investment Counselors - CNBC,"Tue, 06 Oct 2020 07:00:00 GMT"
10,Tech exec Palmer Luckey to host California fundraiser for President Trump this weekend - CNBC,"Fri, 16 Oct 2020 07:00:00 GMT"
11,Full interview: HSBC CFO discusses bank's forecast-busting quarter - CNBC,"Tue, 27 Oct 2020 07:00:00 GMT"
12,"Swiss city Geneva to introduce a minimum wage of over $4,000 a month - CNBC","Thu, 01 Oct 2020 07:00:00 GMT"
13,"Ant Group to raise $34.5 billion, valuing it at over $313 billion, in biggest IPO of all time - CNBC","Mon, 26 Oct 2020 07:00:00 GMT"
14,Covid hospitalizations rising in 36 states as U.S. hits another record for average new cases - CNBC,"Tue, 27 Oct 2020 07:00:00 GMT"
15,Wall Street donors line up behind Biden in massive third-quarter fundraising haul - CNBC,"Fri, 16 Oct 2020 07:00:00 GMT"
16,"Whoop, maker of the fitness tracker that pro athletes love, is now valued at $1.2 billion - CNBC","Wed, 28 Oct 2020 07:00:00 GMT"
17,Apple falls as strong iPad and Mac sales don't make up for iPhone decline - CNBC,"Thu, 29 Oct 2020 07:00:00 GMT"
18,"Amazon launches first online store in the Nordics, gets off to rocky start - CNBC","Wed, 28 Oct 2020 07:00:00 GMT"
19,"U.S. reports more than 83,000 coronavirus cases two days in a row as experts warn of difficult winter - CNBC","Sat, 24 Oct 2020 07:00:00 GMT"
20,Rock legend Eddie Van Halen has died after long battle with throat cancer - CNBC,"Tue, 06 Oct 2020 07:00:00 GMT"
21,"Biden's tax plan could create a tax rate of as much 62% for New Yorkers and Californians, studies show - CNBC","Mon, 19 Oct 2020 07:00:00 GMT"
22,Facebook says it helped 4.4 million people register to vote in the U.S. this year - CNBC,"Mon, 26 Oct 2020 07:00:00 GMT"
23,Job losses hit Gen Z harder during the pandemic than older generations - CNBC,"Thu, 15 Oct 2020 07:00:00 GMT"
24,global - CNBC,"Sat, 03 Oct 2020 17:38:00 GMT"
25,Troy Stratos - CNBC - CNBC,"Fri, 30 Oct 2020 22:52:37 GMT"
26,Hotels on demand: Operators are selling 'subscriptions' to lure back visitors - CNBC,"Fri, 16 Oct 2020 07:00:00 GMT"
27,"Facebook rebuts 'The Social Dilemma,' a popular Netflix documentary - CNBC","Fri, 02 Oct 2020 07:00:00 GMT"
28,U.S. reportedly explores sanctions on China's Ant Group. Analysts say they'll be 'largely symbolic' - CNBC,"Thu, 15 Oct 2020 07:00:00 GMT"
29,Trump press secretary Kayleigh McEnany and two deputies test positive for coronavirus - CNBC,"Mon, 05 Oct 2020 07:00:00 GMT"
30,GOP strategist: 4 days after the election we should know 'who's going to be the next president' - CNBC,"Fri, 23 Oct 2020 07:00:00 GMT"
31,GM's Cruise plans to test unmanned self-driving cars this year in San Francisco - CNBC,"Thu, 15 Oct 2020 07:00:00 GMT"
32,Former Microsoft CEO Steve Ballmer: I’ll bet money Big Tech won’t be broken up - CNBC,"Wed, 07 Oct 2020 07:00:00 GMT"
33,"SpaceX prices Starlink satellite internet service at $99 per month, according to e-mail - CNBC","Tue, 27 Oct 2020 07:00:00 GMT"
34,"Shaquille O'Neal recommends you save money from every paycheck, no matter how much - CNBC","Sun, 18 Oct 2020 13:09:46 GMT"
35,"Boeing slashes forecast for new aircraft demand, expects coronavirus pandemic to hurt sales for more than a decade - CNBC","Tue, 06 Oct 2020 07:00:00 GMT"
36,"Hims, a direct-to-consumer health company, is going public via SPAC - CNBC","Thu, 01 Oct 2020 07:00:00 GMT"
37,Check out Peer To Peer Network's stock price (PTOP) in real time - CNBC,"Tue, 15 Aug 2017 11:13:55 GMT"
38,Skype is still around — it's just been upstaged by Microsoft Teams - CNBC,"Sat, 10 Oct 2020 07:00:00 GMT"
39,"Sony raises full-year profit outlook after record second quarter on strong gaming, 'Demon Slayer' - CNBC","Wed, 28 Oct 2020 07:00:00 GMT"
40,"Sweden bans Huawei, ZTE from upcoming 5G networks - CNBC","Tue, 20 Oct 2020 07:00:00 GMT"
41,Here are the top moments and highlights from Day 2 of Amy Coney Barrett's confirmation hearings - CNBC,"Tue, 13 Oct 2020 07:00:00 GMT"
42,Top military leaders self-quarantining after positive coronavirus test at Pentagon - CNBC,"Tue, 06 Oct 2020 07:00:00 GMT"
43,"Holiday shoppers are crossing themselves off of the gift list, trade group says - CNBC","Wed, 21 Oct 2020 07:00:00 GMT"
44,Paris put on 'maximum alert' as more Covid-19 restrictions are imposed - CNBC,"Mon, 05 Oct 2020 07:00:00 GMT"
45,Trump reveals plan to sell F-35 fighter jets to UAE — but hurdles remain - CNBC,"Fri, 30 Oct 2020 07:00:00 GMT"
46,Panera Bread becomes first national chain to label entrees as climate friendly - CNBC,"Wed, 14 Oct 2020 07:00:00 GMT"
47,More than 600 million people traveled in China during 'Golden Week' - CNBC,"Fri, 09 Oct 2020 07:00:00 GMT"
48,"Arby's enters Mexico, and pandemic pushes new U.S. customers to try its sandwiches - CNBC","Thu, 22 Oct 2020 07:00:00 GMT"
49,"Drive-thru times at fast-food chains slow by nearly 30 seconds as demand soars during pandemic, study finds - CNBC","Thu, 01 Oct 2020 07:00:00 GMT"
50,Spice Girl Melanie C says the live music industry needs support - CNBC,"Thu, 01 Oct 2020 07:00:00 GMT"
51,Wisconsin Foxconn plant hailed by Trump hasn't hired enough people to get tax credits - CNBC,"Mon, 12 Oct 2020 07:00:00 GMT"
52,"Asia-Pacific has more billionaires than any other region, as pandemic boosts wealth - CNBC","Wed, 07 Oct 2020 07:00:00 GMT"
53,TikTok is driving massive toy sales as play dates become less frequent during pandemic - CNBC,"Fri, 16 Oct 2020 07:00:00 GMT"
54,Mark Cuban: These are the 2 books I’m reading right now - CNBC,"Fri, 23 Oct 2020 07:00:00 GMT"
55,Fourth-generation movie theater operator says chain is months from bankruptcy - CNBC,"Fri, 09 Oct 2020 07:00:00 GMT"
56,"Justice Department sues author of Melania Trump tell-all book, says Stephanie Winston Wolkoff broke nondisclosure agreement - CNBC","Tue, 13 Oct 2020 07:00:00 GMT"
57,Why Tesla's 20-million electric vehicle goal could next take Elon Musk to India - CNBC,"Thu, 22 Oct 2020 07:00:00 GMT"
58,This 108-year-old woman survived two pandemics: The 1918 Spanish flu and Covid-19 - CNBC,"Fri, 23 Oct 2020 07:00:00 GMT"
59,Will masks become the 'new normal' even after the pandemic has passed? Some Americans say so - CNBC,"Sat, 24 Oct 2020 07:00:00 GMT"
60,"Trump wants Congress to approve more $1,200 stimulus checks. That may not be easy - CNBC","Wed, 07 Oct 2020 07:00:00 GMT"
61,This small American car company now has the world’s fastest car (316 mph) — take a look - CNBC,"Wed, 21 Oct 2020 07:00:00 GMT"
62,"Wondering what to do with your investments if Trump or Biden wins? Try nothing, experts say - CNBC","Sat, 31 Oct 2020 07:00:00 GMT"
63,Here's what to watch during the final two weeks of the Trump-Biden campaign - CNBC,"Tue, 20 Oct 2020 07:00:00 GMT"
64,"Bristol-Myers gets 'potentially revolutionary medicine' in MyoKardia deal, CEO says - CNBC","Mon, 05 Oct 2020 07:00:00 GMT"
65,Music legend Nile Rodgers says post-Covid insurance issues could radically change live shows - CNBC,"Fri, 23 Oct 2020 07:00:00 GMT"
66,Meet Ryan Smith: the latest tech billionaire to buy an NBA team - CNBC,"Sat, 31 Oct 2020 07:00:00 GMT"
67,"Saudi Arabia loses vote to stay on UN Human Rights Council; China, Russia and Cuba win seats - CNBC","Wed, 14 Oct 2020 07:00:00 GMT"
68,"More than 7 in 10 Gen-Zers report symptoms of depression during pandemic, survey finds - CNBC","Wed, 21 Oct 2020 07:00:00 GMT"
69,Dow rallies more than 500 points for its best day since July - CNBC,"Tue, 06 Oct 2020 07:00:00 GMT"
70,How to get your money back when your credit card is stolen and you've been a victim of fraud - CNBC,"Sun, 11 Oct 2020 07:00:00 GMT"
71,Kudlow refuses to say whether Trump wore a mask in his return to work - CNBC,"Wed, 07 Oct 2020 07:00:00 GMT"
72,"Ripple CEO rejects Coinbase's 'apolitical culture,' says Silicon Valley has an ‘obligation’ to society - CNBC","Mon, 26 Oct 2020 07:00:00 GMT"
73,"Amazon cloud revenue jumps 29%, in line with expectations - CNBC","Thu, 29 Oct 2020 07:00:00 GMT"
74,"Trump campaign ran a Facebook ad implying he won the election, which is supposed to be against the company’s rules - CNBC","Tue, 27 Oct 2020 07:00:00 GMT"
75,This 32-year-old's start-up is helping thousands of Malaysians find work during the pandemic - CNBC,"Wed, 28 Oct 2020 07:00:00 GMT"
76,WEF says machines will create more jobs than they destroy but warns of pandemic ‘double-disruption’ - CNBC,"Tue, 20 Oct 2020 07:00:00 GMT"
77,Many Americans will eventually need long-term care. Here's how to pay for it - CNBC,"Sat, 17 Oct 2020 07:00:00 GMT"
78,Black Friday is over: Here's why retailers are touting weeks of deals this year - CNBC,"Fri, 02 Oct 2020 07:00:00 GMT"
79,"Delta posts another massive loss, warns recovery could take 2 years or more - CNBC","Tue, 13 Oct 2020 07:00:00 GMT"
80,"Protests in Thailand are a 'double whammy' for the economy, which is reeling from Covid-19 - CNBC","Fri, 16 Oct 2020 07:00:00 GMT"
81,"The used car boom is one of the hottest, and trickiest, coronavirus markets for consumers - CNBC","Thu, 15 Oct 2020 07:00:00 GMT"
82,This is Goldman’s bet to break into a $32 billion industry serving the world's biggest corporations - CNBC,"Wed, 28 Oct 2020 07:00:00 GMT"
83,Mitch McConnell says a coronavirus stimulus package is 'unlikely in the next three weeks' - CNBC,"Fri, 09 Oct 2020 07:00:00 GMT"
84,Chamath Palihapitiya to take Clover Health public in another SPAC deal worth $3.7 billion - CNBC,"Tue, 06 Oct 2020 07:00:00 GMT"
85,TikTok passes Instagram as second-most popular social app for U.S. teens - CNBC,"Tue, 06 Oct 2020 07:00:00 GMT"
86,"Cineworld brings down the curtain on U.S., U.K. theaters; 45,000 jobs hit - CNBC","Mon, 05 Oct 2020 07:00:00 GMT"
87,"JPMorgan creates new unit for blockchain projects, says the technology is close to making money - CNBC","Tue, 27 Oct 2020 07:00:00 GMT"
88,Mission Produce CEO Steve Barnard on IPO - CNBC,"Thu, 01 Oct 2020 07:00:00 GMT"
89,Scientists make digital breakthrough in chemistry that could revolutionize the drug industry - CNBC,"Sat, 24 Oct 2020 07:00:00 GMT"
90,"Apple failed to market the iPhone 12 Pro to the average consumer, analysts say - CNBC","Wed, 14 Oct 2020 07:00:00 GMT"
91,Trump claims the worsening U.S. coronavirus outbreak is a 'Fake News Media Conspiracy' even as hospitalizations rise - CNBC,"Mon, 26 Oct 2020 07:00:00 GMT"
92,51. Sands Capital Management - CNBC,"Tue, 06 Oct 2020 07:00:00 GMT"
93,"How Among Us, a social deduction game, became this fall’s mega hit - CNBC","Wed, 14 Oct 2020 07:00:00 GMT"
94,"Here's how Trump and Biden stack up on crucial foreign policy issues, from Iran to China - CNBC","Tue, 27 Oct 2020 07:00:00 GMT"
95,Dow closes more than 400 points lower with one day left until Pelosi's stimulus deadline - CNBC,"Sun, 18 Oct 2020 07:00:00 GMT"
96,"Total 2020 election spending to hit nearly $14 billion, more than double 2016's sum - CNBC","Wed, 28 Oct 2020 07:00:00 GMT"
97,Shaquille O'Neal says Magic Johnson gave him the best money advice when he first joined the Lakers - CNBC,"Mon, 26 Oct 2020 07:00:00 GMT"
98,"Older Americans are selling the stock market, slowly but ceaselessly, to junior generations - CNBC","Sat, 17 Oct 2020 07:00:00 GMT"
99,"After bubble experiment, NHL turns to new ad tech to make up for missed revenue due to coronavirus - CNBC","Thu, 01 Oct 2020 07:00:00 GMT"
