,Title,Date
0,Roblox acquires voice moderation startup Speechly - TechCrunch,"Wed, 20 Sep 2023 07:00:00 GMT"
1,"Senser launches its AI-enhanced observability platform, raises $9.5M - TechCrunch","Wed, 27 Sep 2023 07:00:00 GMT"
2,IBM rolls out new generative AI features and models - TechCrunch,"Thu, 07 Sep 2023 07:00:00 GMT"
3,"JB Straubel talks Tesla, Redwood Materials and keeping a startup mentality at any scale - TechCrunch","Wed, 20 Sep 2023 07:00:00 GMT"
4,"The Apple Watch Series 9 features a new chip, the S9 - TechCrunch","Tue, 12 Sep 2023 07:00:00 GMT"
5,Smart display company Hearth Display raises $4.6M additional funding - TechCrunch,"Thu, 14 Sep 2023 07:00:00 GMT"
6,Off-price fashion shopping app Yaysay gives users 30 minutes per day to shop - TechCrunch,"Wed, 27 Sep 2023 07:00:00 GMT"
7,On-chain leverage trading platform Avantis Labs raises $4M seed round led by Pantera Capital - TechCrunch,"Tue, 26 Sep 2023 07:00:00 GMT"
8,Patronus AI conjures up an LLM evaluation tool for regulated industries - TechCrunch,"Thu, 14 Sep 2023 07:00:00 GMT"
9,"YouTube to add AI creator tools to find music for videos, add dubs - TechCrunch","Thu, 21 Sep 2023 07:00:00 GMT"
10,Do Apple’s environmental claims live up to its own highly polished hype? - TechCrunch,"Fri, 15 Sep 2023 07:00:00 GMT"
11,"Plaid’s Zach Perret on Visa, valuations and privacy - TechCrunch","Tue, 19 Sep 2023 07:00:00 GMT"
12,Microsoft reveals how hackers stole its email signing key… kind of - TechCrunch,"Fri, 08 Sep 2023 07:00:00 GMT"
13,Pinterest’s Gen Z-focused Shuffles app has now inspired a new Pinterest feature - TechCrunch,"Thu, 14 Sep 2023 07:00:00 GMT"
14,Pitch Deck Teardown: Learn.xyz’s $3M seed deck - TechCrunch,"Fri, 15 Sep 2023 07:00:00 GMT"
15,Apple-backed Globalstar inks $64M launch contract with SpaceX - TechCrunch,"Fri, 01 Sep 2023 07:00:00 GMT"
16,Microsoft’s mobile keyboard app SwiftKey gains new AI-powered features - TechCrunch,"Fri, 22 Sep 2023 07:00:00 GMT"
17,"Josys, a SaaS management platform, raises $93M - TechCrunch","Tue, 05 Sep 2023 07:00:00 GMT"
18,"Apple Watch Series 9 arrives, starting at $399 - TechCrunch","Tue, 12 Sep 2023 07:00:00 GMT"
19,8 web3 gaming experts discuss hurdles and opportunities in the road to wider adoption - TechCrunch,"Tue, 19 Sep 2023 07:00:00 GMT"
20,Sapphire Partners is now managing all of CalSTRS’ emerging manager portfolios - TechCrunch,"Wed, 13 Sep 2023 07:00:00 GMT"
21,Astranis wants to bring internet connectivity to up to 5 million in Mexico - TechCrunch,"Thu, 07 Sep 2023 07:00:00 GMT"
22,Taiwan-based lifestyle app FunNow merges with Eatigo to broaden its Southeast Asia reach - TechCrunch,"Mon, 11 Sep 2023 07:00:00 GMT"
23,Flint wants to disrupt the battery industry with paper - TechCrunch,"Tue, 19 Sep 2023 07:00:00 GMT"
24,EU considers imposing tariffs against Chinese EV companies - TechCrunch,"Wed, 13 Sep 2023 07:00:00 GMT"
25,YouTube Shorts to gain a generative AI feature called Dream Screen - TechCrunch,"Thu, 21 Sep 2023 07:00:00 GMT"
26,EV boat startup Arc wades into watersports with $70M in fresh funding - TechCrunch,"Wed, 27 Sep 2023 07:00:00 GMT"
27,Pitch Deck Teardown: Transcend’s $20M Series B deck - TechCrunch,"Fri, 22 Sep 2023 07:00:00 GMT"
28,Swan secures $40 million to bring embedded banking to Europe - TechCrunch,"Wed, 13 Sep 2023 07:00:00 GMT"
29,OpenAI launches a red teaming network to make its models more robust - TechCrunch,"Tue, 19 Sep 2023 07:00:00 GMT"
30,Digital forensics firm Binalyze raises $19M to investigate cyber threats - TechCrunch,"Wed, 13 Sep 2023 07:00:00 GMT"
31,Getty Images launches an AI-powered image generator - TechCrunch,"Mon, 25 Sep 2023 07:00:00 GMT"
32,Lidl recalls Paw Patrol snacks after website on packaging displayed porn - TechCrunch,"Fri, 01 Sep 2023 07:00:00 GMT"
33,Meredith Whittaker reaffirms that Signal would leave UK if forced by privacy bill - TechCrunch,"Thu, 21 Sep 2023 07:00:00 GMT"
34,"YouTube debuts a new app, YouTube Create, for editing videos, adding effects and more - TechCrunch","Thu, 21 Sep 2023 07:00:00 GMT"
35,You can now FaceTime from your Apple TV 4K - TechCrunch,"Mon, 18 Sep 2023 07:00:00 GMT"
36,Shaquille O’Neal talks investing in edtech and startups that are going to 'change people’s lives’ - TechCrunch,"Tue, 19 Sep 2023 07:00:00 GMT"
37,Headspace is bringing an immersive VR experience to Meta Quest 3 ‘soon’ - TechCrunch,"Wed, 27 Sep 2023 07:00:00 GMT"
38,Apple is killing the iPhone’s silent switch - TechCrunch,"Tue, 12 Sep 2023 07:00:00 GMT"
39,How the FBI took down the notorious Qakbot botnet - TechCrunch,"Fri, 01 Sep 2023 07:00:00 GMT"
40,Judge upholds $18 minimum pay for NYC delivery workers - TechCrunch,"Thu, 28 Sep 2023 07:00:00 GMT"
41,All the iPhone 15 models compared - TechCrunch,"Fri, 15 Sep 2023 07:00:00 GMT"
42,"Google’s Bard chatbot can now tap into your Google apps, double-check answers and more - TechCrunch","Tue, 19 Sep 2023 07:00:00 GMT"
43,Real-time flight rewards search engine Point.me raises $10M - TechCrunch,"Tue, 05 Sep 2023 07:00:00 GMT"
44,Mastodon’s latest release makes the open source Twitter alternative easier to use - TechCrunch,"Thu, 21 Sep 2023 07:00:00 GMT"
45,JOKR now valued at $800M after bagging about $50M in Series D funding - TechCrunch,"Wed, 20 Sep 2023 07:00:00 GMT"
46,Jude is building a bladder health champion - TechCrunch,"Sun, 03 Sep 2023 07:00:00 GMT"
47,Mark Zuckerberg went 33 minutes without saying ‘metaverse’ at his keynote - TechCrunch,"Wed, 27 Sep 2023 07:00:00 GMT"
48,African VC firm Enza Capital launches founder partner program as it closes $58M across funds - TechCrunch,"Thu, 28 Sep 2023 07:00:00 GMT"
49,Diligent raises $25 million to triple its nursing robot’s reach - TechCrunch,"Thu, 21 Sep 2023 07:00:00 GMT"
50,"Former Meta AI VP debuts Sizzle, an AI-powered learning app and chatbot - TechCrunch","Wed, 20 Sep 2023 07:00:00 GMT"
51,Bird acquires Spin scooters from Tier for $19M - TechCrunch,"Tue, 19 Sep 2023 07:00:00 GMT"
52,eBay rolls out a tool that generates product listings from photos - TechCrunch,"Thu, 07 Sep 2023 07:00:00 GMT"
53,Superorder raises $10M to help restaurants maintain their online presence - TechCrunch,"Fri, 15 Sep 2023 07:00:00 GMT"
54,"After relaunching as a studio for creators, LimeWire acquires BlueWillow, a Midjourney competitor - TechCrunch","Tue, 19 Sep 2023 07:00:00 GMT"
55,Redwood Materials acquires European battery recycler in expansion push - TechCrunch,"Tue, 19 Sep 2023 07:00:00 GMT"
56,"X (formerly Twitter) is worst for disinformation, per EU analysis - TechCrunch","Tue, 26 Sep 2023 07:00:00 GMT"
57,"Connect Ventures hits $80M for its next fund, says the Bear market means 'Product is back, baby!' - TechCrunch","Tue, 05 Sep 2023 07:00:00 GMT"
58,Beyond Aero is building a hydrogen-powered jet - TechCrunch,"Tue, 19 Sep 2023 07:00:00 GMT"
59,Chipmaker NXP confirms data breach involving customers’ information - TechCrunch,"Tue, 05 Sep 2023 07:00:00 GMT"
60,"WordPress blogs can now be followed in the fediverse, including Mastodon - TechCrunch","Thu, 14 Sep 2023 07:00:00 GMT"
61,WhatsApp is launching its Channels feature globally - TechCrunch,"Wed, 13 Sep 2023 07:00:00 GMT"
62,French battery maker Verkor scores $2.1B to build gigafactory - TechCrunch,"Thu, 14 Sep 2023 07:00:00 GMT"
63,"Meta Quest adds new avatar customization options, an unsend message feature and more - TechCrunch","Mon, 11 Sep 2023 07:00:00 GMT"
64,Can the quick grocery delivery model only work in emerging markets? - TechCrunch,"Tue, 12 Sep 2023 07:00:00 GMT"
65,"San Francisco requests redo on Cruise, Waymo robotaxi expansion hearing - TechCrunch","Wed, 13 Sep 2023 07:00:00 GMT"
66,"Terraform fork gets renamed OpenTofu, and joins Linux Foundation - TechCrunch","Wed, 20 Sep 2023 07:00:00 GMT"
67,Robot software firm Mujin raises $85M - TechCrunch,"Tue, 05 Sep 2023 07:00:00 GMT"
68,Why is Y Combinator so defensive lately? - TechCrunch,"Wed, 20 Sep 2023 07:00:00 GMT"
69,Meta’s $500 Quest 3 targets consumer mixed reality - TechCrunch,"Wed, 27 Sep 2023 07:00:00 GMT"
70,"E-bike subscription service Dance reaches 10,000 active subscribers - TechCrunch","Tue, 12 Sep 2023 07:00:00 GMT"
71,Apple says iPhone and iPad apps will show up on the visionOS App Store from the get-go - TechCrunch,"Tue, 05 Sep 2023 07:00:00 GMT"
72,Ascento’s robots aid overstretched security guards - TechCrunch,"Mon, 11 Sep 2023 07:00:00 GMT"
73,Apple replaces Lightning connector with USB-C for iPhone 15 - TechCrunch,"Tue, 12 Sep 2023 07:00:00 GMT"
74,Elicit is building a tool to automate scientific literature review - TechCrunch,"Mon, 25 Sep 2023 07:00:00 GMT"
75,Zoom rebrands existing — and intros new — generative AI features - TechCrunch,"Tue, 05 Sep 2023 07:00:00 GMT"
76,Apple adds USB 3 speeds to iPhone 15 Pro but you won’t get those out of the box - TechCrunch,"Tue, 12 Sep 2023 07:00:00 GMT"
77,Meta debuts AI Studio to let developers build custom chatbots - TechCrunch,"Wed, 27 Sep 2023 07:00:00 GMT"
78,Niura's EEG-implemented earbuds scan your brain health and recommend music to your mood - TechCrunch,"Fri, 22 Sep 2023 07:00:00 GMT"
79,Pitch Deck Teardown: Tomorrow University’s $10M Series A deck - TechCrunch,"Fri, 08 Sep 2023 07:00:00 GMT"
80,"Pilot is a social travel hub that uses AI to help you plan, book and share trips - TechCrunch","Thu, 28 Sep 2023 07:00:00 GMT"
81,Former a16z execs launch Bastion - TechCrunch,"Thu, 21 Sep 2023 07:00:00 GMT"
82,Upside Foods’ Uma Valeti on why it’s so difficult to scale cultivated meat - TechCrunch,"Tue, 19 Sep 2023 07:00:00 GMT"
83,"Apple revamps iCloud.com with more features for drive, mail and notes - TechCrunch","Fri, 29 Sep 2023 07:00:00 GMT"
84,Front goes beyond the unified inbox with a Zendesk-style knowledge base - TechCrunch,"Wed, 20 Sep 2023 07:00:00 GMT"
85,Glass Health is building an AI for suggesting medical diagnoses - TechCrunch,"Fri, 08 Sep 2023 07:00:00 GMT"
86,"Artists sign open letter saying generative AI is good, actually - TechCrunch","Thu, 07 Sep 2023 07:00:00 GMT"
87,How badly will AI-generated images impact elections? - TechCrunch,"Fri, 08 Sep 2023 07:00:00 GMT"
88,Darrow raises $35M for an AI that parses public documents for class action lawsuit potential - TechCrunch,"Tue, 19 Sep 2023 07:00:00 GMT"
89,Arm’s latest IPO filing eyes potential $52B valuation - TechCrunch,"Tue, 05 Sep 2023 07:00:00 GMT"
90,TikTok and Billboard team up to launch a top 50 song chart - TechCrunch,"Thu, 14 Sep 2023 07:00:00 GMT"
91,BioticsAI wants to improve prenatal ultrasound scans with AI - TechCrunch,"Tue, 19 Sep 2023 07:00:00 GMT"
92,AI-Enriched Automation Will Transform the Digital Advertising Industry. Here’s How. - TechCrunch,"Tue, 26 Sep 2023 02:00:45 GMT"
93,"Meta Connect 2023: Everything you need to know about Quest 3 VR, Ray-Ban smart glasses and Meta AI - TechCrunch","Wed, 27 Sep 2023 07:00:00 GMT"
94,Reddit users on mobile can now translate posts into other languages - TechCrunch,"Fri, 08 Sep 2023 07:00:00 GMT"
95,TikTok may start serving you Google Search results - TechCrunch,"Thu, 21 Sep 2023 07:00:00 GMT"
96,"Twitter/X rival T2 rebrands as 'Pebble,' saying the old name was never meant to be permanent - TechCrunch","Mon, 18 Sep 2023 07:00:00 GMT"
97,"Transfr, a VR platform for workforce training, raises $40M - TechCrunch","Thu, 28 Sep 2023 07:00:00 GMT"
98,Google is opening up its generative AI search experience to teenagers - TechCrunch,"Thu, 28 Sep 2023 07:00:00 GMT"
99,Airbnb is verifying all properties in its top five markets including the U.S. - TechCrunch,"Wed, 20 Sep 2023 07:00:00 GMT"
