,Title,Date
0,Open source developers urged to ditch GitHub following Copilot launch - TechCrunch,"Fri, 01 Jul 2022 07:00:00 GMT"
1,Netflix to test a new ‘add a home’ option to charge for password sharing - TechCrunch,"Mon, 18 Jul 2022 07:00:00 GMT"
2,Amazon bets on influencers to drive sales for Prime Day - TechCrunch,"Thu, 07 Jul 2022 07:00:00 GMT"
3,"SendSprint, by ex-Flutterwave executive, hits market with $5 flat fee for all international money transfers - TechCrunch","Wed, 13 Jul 2022 07:00:00 GMT"
4,"India’s Tata Motors wants to sell 50,000 EVs by end of fiscal year - TechCrunch","Mon, 04 Jul 2022 07:00:00 GMT"
5,Slack is increasing prices and changing the way its free plan works - TechCrunch,"Mon, 18 Jul 2022 07:00:00 GMT"
6,"With $40M in new funding, Frontegg looks to expand its B2B user management service - TechCrunch","Thu, 28 Jul 2022 07:00:00 GMT"
7,TomoCredit raises $22M to make credit scores 'obselete' - TechCrunch,"Thu, 21 Jul 2022 07:00:00 GMT"
8,Tedooo raises $3M to scale its social network for buyers and sellers - TechCrunch,"Wed, 20 Jul 2022 07:00:00 GMT"
9,Backbone’s mobile gaming controller gets an official PlayStation edition - TechCrunch,"Thu, 28 Jul 2022 07:00:00 GMT"
10,Startups - TechCrunch,"Sun, 20 Apr 2025 14:28:24 GMT"
11,Rimac begins production of its $2.5 million Nevera hypercar EV - TechCrunch,"Tue, 12 Jul 2022 07:00:00 GMT"
12,Baidu reveals the next-gen robotaxi that will be deployed throughout China - TechCrunch,"Wed, 20 Jul 2022 07:00:00 GMT"
13,Media & Entertainment News - TechCrunch,"Mon, 22 Aug 2022 22:12:51 GMT"
14,Microsoft will block Office macros by default starting July 27 - TechCrunch,"Fri, 22 Jul 2022 07:00:00 GMT"
15,"a16z leads $6.5M seed round for Adaptive, a construction software and fintech play - TechCrunch","Thu, 07 Jul 2022 07:00:00 GMT"
16,Autochek acquires CoinAfrique to grow its footprint in Francophone Africa - TechCrunch,"Wed, 06 Jul 2022 07:00:00 GMT"
17,"Equal Ventures has a new pair of funds, filings show - TechCrunch","Fri, 29 Jul 2022 07:00:00 GMT"
18,"Nothing can’t resist the NFT hype, and its fans are questioning - TechCrunch","Wed, 06 Jul 2022 07:00:00 GMT"
19,Google Cloud announces its first region in Mexico - TechCrunch,"Thu, 21 Jul 2022 07:00:00 GMT"
20,Pink Sauce went viral on TikTok. But then it exploded (literally). - TechCrunch,"Fri, 22 Jul 2022 07:00:00 GMT"
21,Contentsquare closes a mammoth $600M round as customers clamor for digital analytics - TechCrunch,"Wed, 20 Jul 2022 07:00:00 GMT"
22,MetaMask co-founder sees a developer-led future for its crypto wallet - TechCrunch,"Thu, 14 Jul 2022 07:00:00 GMT"
23,"Meta is shutting down Tuned, its social app for couples - TechCrunch","Mon, 25 Jul 2022 07:00:00 GMT"
24,"Carl Pei talks new device, road to launch, future of Nothing - TechCrunch","Tue, 12 Jul 2022 07:00:00 GMT"
25,TikTok’s chief security officer steps down amid increased scrutiny from US officials - TechCrunch,"Fri, 15 Jul 2022 07:00:00 GMT"
26,Airbnb co-founder Joe Gebbia steps back from leadership role - TechCrunch,"Thu, 21 Jul 2022 07:00:00 GMT"
27,"Canvas Medical, ‘the Tesla of EMRs,’ raises a $24 million Series B round - TechCrunch","Thu, 14 Jul 2022 07:00:00 GMT"
28,Anker’s new GaNPrime charger lineup is cranking out up to 150 W of power - TechCrunch,"Mon, 25 Jul 2022 07:00:00 GMT"
29,"Spotify forks out $295M for Findaway, Podsights, Chartable and Sonantic, filing reveals - TechCrunch","Thu, 28 Jul 2022 07:00:00 GMT"
30,"Google Maps rolls out location sharing notifications, immersive views and better bike navigation - TechCrunch","Wed, 27 Jul 2022 07:00:00 GMT"
31,Can Alto succeed at employee-driven ride-hail? - TechCrunch,"Fri, 22 Jul 2022 07:00:00 GMT"
32,"Not gonna lie, this NGL lawsuit is kinda juicy - TechCrunch","Fri, 15 Jul 2022 07:00:00 GMT"
33,Healthie lands $16.5M to build the Stripe for virtual patient care - TechCrunch,"Wed, 20 Jul 2022 07:00:00 GMT"
34,Cathay Innovation launches third multi-stage startup fund at $1B - TechCrunch,"Tue, 12 Jul 2022 07:00:00 GMT"
35,"Clearco cuts 25% of staff, considers ‘strategic options’ for international operations - TechCrunch","Fri, 29 Jul 2022 07:00:00 GMT"
36,"Jagmeet Singh, Author at TechCrunch | Page 3 of 13 - TechCrunch","Thu, 29 Sep 2022 15:35:49 GMT"
37,Google delays move away from cookies in Chrome to 2024 - TechCrunch,"Wed, 27 Jul 2022 07:00:00 GMT"
38,UK’s Online Safety Bill on pause pending new PM - TechCrunch,"Thu, 14 Jul 2022 07:00:00 GMT"
39,Cybersecurity vendor Entrust tells customers data was stolen during June cyberattack - TechCrunch,"Wed, 27 Jul 2022 07:00:00 GMT"
40,Barcelona’s Impress heads toward a $125M Series B round in its bid to digitize orthodontics - TechCrunch,"Mon, 11 Jul 2022 07:00:00 GMT"
41,Sony officially owns Bungie now - TechCrunch,"Fri, 15 Jul 2022 07:00:00 GMT"
42,Spotify is testing in-app podcast creation tools - TechCrunch,"Fri, 01 Jul 2022 07:00:00 GMT"
43,"McEasy is digitizing Indonesia’s logistics, transportation and supply chain industries - TechCrunch","Tue, 05 Jul 2022 07:00:00 GMT"
44,Smartphone sales drop sharply in China - TechCrunch,"Thu, 28 Jul 2022 07:00:00 GMT"
45,Google brings back Street View in India after years of rejection - TechCrunch,"Tue, 26 Jul 2022 07:00:00 GMT"
46,Warner Music Group signs on to SoundCloud’s artist-friendly payment model - TechCrunch,"Thu, 21 Jul 2022 07:00:00 GMT"
47,Corporate travel tech platform Spotnana nabs $75M - TechCrunch,"Tue, 26 Jul 2022 07:00:00 GMT"
48,AI-powered photo stock startup Wirestock lands partnership with Getty Images - TechCrunch,"Fri, 01 Jul 2022 07:00:00 GMT"
49,"Most startups were overvalued before 2021, and now it’s causing problems - TechCrunch","Fri, 01 Jul 2022 07:00:00 GMT"
50,Fly.io wants to change the way companies deploy apps at the edge - TechCrunch,"Thu, 28 Jul 2022 07:00:00 GMT"
51,Acast acquires podcast database Podchaser - TechCrunch,"Mon, 18 Jul 2022 07:00:00 GMT"
52,Babbel brings its B2B language learning service to the US - TechCrunch,"Tue, 26 Jul 2022 07:00:00 GMT"
53,Hotel giant Marriott confirms yet another data breach - TechCrunch,"Wed, 06 Jul 2022 07:00:00 GMT"
54,Sample Seed pitch deck: Arkive's 9.7 million deck - TechCrunch,"Thu, 21 Jul 2022 07:00:00 GMT"
55,Children’s rights groups call out TikTok’s ‘design discrimination’ - TechCrunch,"Mon, 11 Jul 2022 07:00:00 GMT"
56,FTX CEO leads Trustless Media’s seed round to help build community-owned web3 shows - TechCrunch,"Wed, 27 Jul 2022 07:00:00 GMT"
57,China’s Jaka Robotics fueled by Saudi Arabia’s Prosperity7 in global push - TechCrunch,"Mon, 25 Jul 2022 07:00:00 GMT"
58,TikTok says ‘Project Texas’ will bolster security for US users in wake of China data access concerns - TechCrunch,"Mon, 04 Jul 2022 07:00:00 GMT"
59,Uprise banks $1.4M to be a ‘family office’ for Gen Z - TechCrunch,"Mon, 11 Jul 2022 07:00:00 GMT"
60,Ukrainian startup Preply beats the geopolitical odds with $50M to grow its language learning platform - TechCrunch,"Wed, 13 Jul 2022 07:00:00 GMT"
61,Former Theranos exec Sunny Balwani is found guilty of fraud - TechCrunch,"Thu, 07 Jul 2022 07:00:00 GMT"
62,SpaceX’s Starship booster engines explode in test gone wrong - TechCrunch,"Tue, 12 Jul 2022 07:00:00 GMT"
63,Activision Blizzard’s Johanna Faries will discuss Call of Duty at TechCrunch Disrupt - TechCrunch,"Wed, 13 Jul 2022 07:00:00 GMT"
64,"C2 Ventures raises new fund to invest in the ‘dull, dirty and dangerous’ - TechCrunch","Tue, 12 Jul 2022 07:00:00 GMT"
65,Robin raises $30M to expand its office reservation software as companies embrace hybrid work - TechCrunch,"Thu, 14 Jul 2022 07:00:00 GMT"
66,"Celus, which uses AI to automate circuit board design, raises $25.6M - TechCrunch","Wed, 06 Jul 2022 07:00:00 GMT"
67,When did the startup boom peak? - TechCrunch,"Wed, 06 Jul 2022 07:00:00 GMT"
68,The Exploration Company is developing a brand new reusable orbital spacecraft - TechCrunch,"Thu, 28 Jul 2022 07:00:00 GMT"
69,"After dominating the short-video market, TikTok may be considering a music service - TechCrunch","Fri, 29 Jul 2022 07:00:00 GMT"
70,Snap launches Snapchat for Web to bring the app’s core features to desktop - TechCrunch,"Mon, 18 Jul 2022 07:00:00 GMT"
71,We don’t need no stinking trademarks: GetHenry changes name to Cycle - TechCrunch,"Wed, 20 Jul 2022 07:00:00 GMT"
72,Kate Ma - TechCrunch,"Sat, 11 May 2024 08:39:08 GMT"
73,"Daily Crunch: Google Maps unveils improved bike navigation, location sharing and aerial landmark views - TechCrunch","Wed, 27 Jul 2022 07:00:00 GMT"
74,The New York Times is turning Wordle into a board game - TechCrunch,"Fri, 15 Jul 2022 07:00:00 GMT"
75,Scale Computing secures $55M to help companies manage edge infrastructure - TechCrunch,"Tue, 12 Jul 2022 07:00:00 GMT"
76,New documents reveal ‘huge’ scale of US government’s cell phone location data tracking - TechCrunch,"Mon, 18 Jul 2022 07:00:00 GMT"
77,Conscience VC raises oversubscribed fund for consumer companies rooted in science - TechCrunch,"Tue, 12 Jul 2022 07:00:00 GMT"
78,Enterprise News| Page 86 of 442 - TechCrunch,"Thu, 28 Jul 2022 15:56:11 GMT"
79,Pitch Deck Teardown: Alto Pharmacy’s $200M Series E deck - TechCrunch,"Thu, 28 Jul 2022 07:00:00 GMT"
80,Dead spiders: Nature’s robot hands - TechCrunch,"Mon, 25 Jul 2022 07:00:00 GMT"
81,Struck Capital ploughs $15M into spinning up its own startups - TechCrunch,"Tue, 26 Jul 2022 07:00:00 GMT"
82,Amazon starts delivering packages with Rivian-built EVs - TechCrunch,"Thu, 21 Jul 2022 07:00:00 GMT"
83,Panasonic to build $4B EV battery plant in Kansas - TechCrunch,"Wed, 13 Jul 2022 07:00:00 GMT"
84,WTF is a 409A? - TechCrunch,"Wed, 20 Jul 2022 07:00:00 GMT"
85,ClearBuds resulted from a research at Univ of Washington - TechCrunch,"Mon, 11 Jul 2022 07:00:00 GMT"
86,Instacart expands its EBT SNAP payments program to 10 more states - TechCrunch,"Mon, 25 Jul 2022 07:00:00 GMT"
87,TikTok ‘pauses’ privacy policy switch in Europe after regulatory scrutiny - TechCrunch,"Tue, 12 Jul 2022 07:00:00 GMT"
88,The cybersecurity implications of the quantum world - TechCrunch,"Tue, 17 Jan 2023 19:01:34 GMT"
89,Facebook tests a way to add up to five profiles tied to a single account - TechCrunch,"Thu, 14 Jul 2022 07:00:00 GMT"
90,JusTalk spilled millions of user messages and locations for months - TechCrunch,"Tue, 26 Jul 2022 07:00:00 GMT"
91,Nucleus Genomics lands new funding from Alexis Ohanian to help people assess specific disease risks - TechCrunch,"Fri, 15 Jul 2022 07:00:00 GMT"
92,"As Netflix pivots, American attitudes shift to owning digital assets, not just streaming them - TechCrunch","Thu, 14 Jul 2022 07:00:00 GMT"
93,Denmark bans Chromebooks and Google Workspace in schools over data transfer risks - TechCrunch,"Mon, 18 Jul 2022 07:00:00 GMT"
94,"NFL+ streaming service launches in the US, replacing NFL Game Pass - TechCrunch","Mon, 25 Jul 2022 07:00:00 GMT"
95,Bored Apes founders on their plans for Otherside metaverse - TechCrunch,"Tue, 19 Jul 2022 07:00:00 GMT"
96,Fairbanc provides BNPL for micro-merchants in Indonesia - TechCrunch,"Thu, 21 Jul 2022 07:00:00 GMT"
97,Look out Putin — Ukrainian woman invents 'solar for balconies' to wean Europe off Russian gas - TechCrunch,"Mon, 18 Jul 2022 07:00:00 GMT"
98,Pogo lands millions to become the ‘Honey for the real world’ - TechCrunch,"Tue, 26 Jul 2022 07:00:00 GMT"
99,Minecraft says ‘No F-ing Thanks’ to NFTs - TechCrunch,"Wed, 20 Jul 2022 07:00:00 GMT"
