,Title,Date
0,Google's latest mobile search algorithm update makes having a mobile-friendly site even more important - TechCrunch,"Wed, 16 Mar 2016 07:00:00 GMT"
1,Jury awards Hulk Hogan $115M in sex tape lawsuit against Gawker - TechCrunch,"Fri, 18 Mar 2016 07:00:00 GMT"
2,All 60 startups that launched at Y Combinator Winter 2016 Demo Day 1 - TechCrunch,"Tue, 22 Mar 2016 07:00:00 GMT"
3,"Square brings on the team behind Framed Data, a predictive analytics startup - TechCrunch","Mon, 14 Mar 2016 07:00:00 GMT"
4,Uber and Ola launch motorbike taxi services in India - TechCrunch,"Wed, 02 Mar 2016 08:00:00 GMT"
5,Signe Brewster - TechCrunch,"Wed, 02 Mar 2016 20:42:14 GMT"
6,"Source: Microsoft mulled an $8 billion bid for Slack, will focus on Skype instead - TechCrunch","Fri, 04 Mar 2016 08:00:00 GMT"
7,Review: Samsung’s Galaxy S7 and S7 edge are the phones we’ve craved - TechCrunch,"Tue, 08 Mar 2016 08:00:00 GMT"
8,HackerOne - TechCrunch,"Tue, 14 Jun 2016 22:02:40 GMT"
9,Face-plant into this airplane tray table pillow - TechCrunch,"Mon, 21 Mar 2016 07:00:00 GMT"
10,"Boom, the startup that wants to build supersonic planes, just signed a massive deal with Virgin - TechCrunch","Wed, 23 Mar 2016 07:00:00 GMT"
11,Mapstr adds directions to its app to keep track of your favorite places - TechCrunch,"Thu, 24 Mar 2016 07:00:00 GMT"
12,Review: The Oculus Rift - TechCrunch,"Mon, 28 Mar 2016 07:00:00 GMT"
13,Robinhood co-founder Baiju Bhatt to talk fighting the establishment at Disrupt NY - TechCrunch,"Thu, 24 Mar 2016 07:00:00 GMT"
14,A rant about why Snapchat 2.0 is no disappearing teen fad - TechCrunch,"Tue, 29 Mar 2016 07:00:00 GMT"
15,The downfall of the walled garden: Here’s why iAd failed - TechCrunch,"Mon, 28 Mar 2016 07:00:00 GMT"
16,"Vimeo unveils its next set of Originals, including its first-ever feature film and concert - TechCrunch","Thu, 10 Mar 2016 08:00:00 GMT"
17,Ask.fm founders back dating app Mint - TechCrunch,"Thu, 17 Mar 2016 07:00:00 GMT"
18,NASA is sending a 3D printer to space that you can use - TechCrunch,"Sat, 19 Mar 2016 07:00:00 GMT"
19,Apple is working on a fix for iOS bug that causes tapping links to crash iPhones - TechCrunch,"Mon, 28 Mar 2016 07:00:00 GMT"
20,AnkerBox launches charging-as-a-service - TechCrunch,"Tue, 29 Mar 2016 07:00:00 GMT"
21,"Amazon expands Dash Button line-up, top sellers to date include Tide, Bounty, Cottonelle - TechCrunch","Thu, 31 Mar 2016 07:00:00 GMT"
22,Microsoft apologizes for hijacked chatbot Tay’s ‘wildly inappropriate’ tweets - TechCrunch,"Fri, 25 Mar 2016 07:00:00 GMT"
23,"Citizen scientists, you can now DIY your own DNA analysis with Bento Lab - TechCrunch","Wed, 30 Mar 2016 07:00:00 GMT"
24,Gecko Robotics Does The Heavy Inspecting At Power Plants To Prevent Human Fatalities - TechCrunch,"Wed, 23 Mar 2016 07:00:00 GMT"
25,Spectral Edge wants to drive its infrared photo-enhancing tech into every smartphone - TechCrunch,"Mon, 21 Mar 2016 07:00:00 GMT"
26,"Vevo’s recommendations get more personalized, thanks to integrations with Spotify, Twitter and YouTube - TechCrunch","Thu, 24 Mar 2016 07:00:00 GMT"
27,Investments in VR/AR have already hit $1.1 billion in 2016 - TechCrunch,"Mon, 07 Mar 2016 08:00:00 GMT"
28,Microsoft’s new tools let businesses integrate Skype into their own web and mobile apps - TechCrunch,"Thu, 31 Mar 2016 07:00:00 GMT"
29,Kanye West’s ‘The Life of Pablo’ is the first SaaS album - TechCrunch,"Thu, 17 Mar 2016 07:00:00 GMT"
30,Microsoft is using Minecraft to develop artificial intelligence tech for the real world - TechCrunch,"Mon, 14 Mar 2016 07:00:00 GMT"
31,Google could be selling Boston Dynamics because even Google thinks these robots are terrifying - TechCrunch,"Thu, 17 Mar 2016 07:00:00 GMT"
32,"With Privacy, you can create virtual debit cards to protect your online payments - TechCrunch","Fri, 25 Mar 2016 07:00:00 GMT"
33,How I built a hoverboard company and then blew it up - TechCrunch,"Tue, 01 Mar 2016 08:00:00 GMT"
34,How real businesses are using machine learning - TechCrunch,"Sat, 19 Mar 2016 07:00:00 GMT"
35,A global experiment in Roam co-living - TechCrunch,"Thu, 17 Mar 2016 07:00:00 GMT"
36,Billionaire investor Peter Thiel nabs another $1.3 billion for Founders Fund - TechCrunch,"Fri, 25 Mar 2016 07:00:00 GMT"
37,"Bumble launches BFF, a feature to find new friends - TechCrunch","Fri, 04 Mar 2016 08:00:00 GMT"
38,Google joins the Open Compute Project - TechCrunch,"Wed, 09 Mar 2016 08:00:00 GMT"
39,"Tesla Model 3 preorders surge past the 150,000 mark - TechCrunch","Thu, 31 Mar 2016 07:00:00 GMT"
40,vMocion looks to end motion sickness in virtual reality by tricking your brain - TechCrunch,"Wed, 30 Mar 2016 07:00:00 GMT"
41,The Sony Future Lab could be as forward-thinking as the Walkman - TechCrunch,"Fri, 04 Mar 2016 08:00:00 GMT"
42,Roger brings its beautifully designed walkie-talkie app to Android - TechCrunch,"Tue, 01 Mar 2016 08:00:00 GMT"
43,"Facebook Messenger adds music, starting with Spotify song sharing - TechCrunch","Thu, 03 Mar 2016 08:00:00 GMT"
44,Verdigris takes $9M to power its AI energy consumption analytics b2b startup - TechCrunch,"Thu, 24 Mar 2016 07:00:00 GMT"
45,ZIRX - TechCrunch,"Mon, 13 Jun 2016 21:39:39 GMT"
46,Scientists create living ‘insect-computer hybrid’ with user-adjustable speed and gait - TechCrunch,"Wed, 30 Mar 2016 07:00:00 GMT"
47,Facer brings its popular watchface customization utility to Apple Watch - TechCrunch,"Thu, 03 Mar 2016 08:00:00 GMT"
48,Why you should fear artificial intelligence - TechCrunch,"Tue, 22 Mar 2016 07:00:00 GMT"
49,Email is dying among mobile’s youngest users - TechCrunch,"Thu, 24 Mar 2016 07:00:00 GMT"
50,"How to train your human, part II: Products that make habits last - TechCrunch","Sat, 12 Mar 2016 08:00:00 GMT"
51,GIlman Louie - TechCrunch,"Sun, 13 Mar 2016 08:00:00 GMT"
52,Video: The father and son VCs behind the new LocalGlobe seed fund - TechCrunch,"Wed, 02 Mar 2016 08:00:00 GMT"
53,Zubie makes your car part of the Internet of Things - TechCrunch,"Wed, 09 Mar 2016 08:00:00 GMT"
54,Ben Horowitz backs rapper Ryan Leslie’s SMS commerce startup Superphone - TechCrunch,"Mon, 07 Mar 2016 08:00:00 GMT"
55,Pope Francis will reportedly start an official Instagram account - TechCrunch,"Tue, 15 Mar 2016 07:00:00 GMT"
56,"Your favorite accelerator programs, ranked - TechCrunch","Fri, 11 Mar 2016 08:00:00 GMT"
57,Sky makes $45M strategic investment in Asia-based Netflix rival iFlix - TechCrunch,"Wed, 09 Mar 2016 08:00:00 GMT"
58,Intel gets unique 3D video tech with Replay Technologies acquisition - TechCrunch,"Wed, 09 Mar 2016 08:00:00 GMT"
59,The new Apple TV has been jailbroken - TechCrunch,"Wed, 23 Mar 2016 07:00:00 GMT"
60,The world’s top VR director Chris Milk will wow us at Disrupt NY - TechCrunch,"Tue, 08 Mar 2016 08:00:00 GMT"
61,MIT spin-out Thunkable hopes its drag-and-drop app builder can be a money-spinner too - TechCrunch,"Sat, 05 Mar 2016 08:00:00 GMT"
62,"Local deals site LivingSocial lays off 280, over 50% of staff, outsources customer services - TechCrunch","Wed, 16 Mar 2016 07:00:00 GMT"
63,Defeated Go world champion beats DeepMind AI in penultimate match - TechCrunch,"Sun, 13 Mar 2016 08:00:00 GMT"
64,AT&T will launch online-only packages for DirecTV this year - TechCrunch,"Wed, 02 Mar 2016 08:00:00 GMT"
65,Google’s new Destinations feature lets you plan trips right from its search engine on mobile - TechCrunch,"Tue, 08 Mar 2016 08:00:00 GMT"
66,Hands-on with the $949 mind-bending Meta 2 augmented reality headset - TechCrunch,"Wed, 02 Mar 2016 08:00:00 GMT"
67,Daqri acquires 1066 Labs to power its augmented reality smart helmet - TechCrunch,"Tue, 01 Mar 2016 08:00:00 GMT"
68,"AliveCor unveils Kardia Band, a medical-grade EKG band for Apple Watch - TechCrunch","Wed, 16 Mar 2016 07:00:00 GMT"
69,Flex is a tampon alternative you can wear during sex - TechCrunch,"Thu, 31 Mar 2016 07:00:00 GMT"
70,Review: Master & Dynamic’s MW60 makes wireless headphones look cool again - TechCrunch,"Tue, 22 Mar 2016 07:00:00 GMT"
71,2016 Honda Civic: autonomous features for $20K - TechCrunch,"Fri, 18 Mar 2016 07:00:00 GMT"
72,GenZe 2.0 electric scooter brings electric power to the people - TechCrunch,"Fri, 11 Mar 2016 08:00:00 GMT"
73,Instagram is switching its feed from chronological to best posts first - TechCrunch,"Tue, 15 Mar 2016 07:00:00 GMT"
74,"Extensify lets you ""tweak"" your iOS apps without jailbreaking - TechCrunch","Tue, 01 Mar 2016 08:00:00 GMT"
75,Up All Night gets you into concerts and exclusive events for $25 a month - TechCrunch,"Thu, 10 Mar 2016 08:00:00 GMT"
76,"Snapchat seamlessly combines video, audio, GIFs, stickers in ""Chat 2.0"" - TechCrunch","Tue, 29 Mar 2016 07:00:00 GMT"
77,"Salesforce takes on ServiceMax, Microsoft and Oracle with new field service product - TechCrunch","Tue, 15 Mar 2016 07:00:00 GMT"
78,Trainline buys Captain Train for up to $189 million - TechCrunch,"Mon, 14 Mar 2016 07:00:00 GMT"
79,DoorDash says its new service fee isn’t really a new fee - TechCrunch,"Fri, 11 Mar 2016 08:00:00 GMT"
80,"Distribusion, the startup that makes it easy to sell intercity bus tickets, picks up €6 million funding - TechCrunch","Thu, 17 Mar 2016 07:00:00 GMT"
81,Hero unveils a new home gadget to help you track and dispense pills - TechCrunch,"Mon, 07 Mar 2016 08:00:00 GMT"
82,Cisco to acquire Leaba Semiconductor for $320 million as buying spree continues - TechCrunch,"Wed, 02 Mar 2016 08:00:00 GMT"
83,Cyan Banister joins Founders Fund as partner - TechCrunch,"Tue, 29 Mar 2016 07:00:00 GMT"
84,"Kodak tries its hand at social with new ""Kodak Moments"" storytelling app - TechCrunch","Fri, 11 Mar 2016 08:00:00 GMT"
85,Home services marketplace Angie’s List to drop paywall for a freemium model - TechCrunch,"Thu, 03 Mar 2016 08:00:00 GMT"
86,"WeWork’s second acquisition is Welkio, a digital sign-in system for offices - TechCrunch","Fri, 18 Mar 2016 07:00:00 GMT"
87,Apple strikes a deal with MLB to put iPads in dugouts - TechCrunch,"Tue, 29 Mar 2016 07:00:00 GMT"
88,Here are the 59 startups that demoed at Y Combinator Winter ’16 Demo Day 2 - TechCrunch,"Wed, 23 Mar 2016 07:00:00 GMT"
89,Gigwell rescues concert bookers from PDF hell - TechCrunch,"Tue, 08 Mar 2016 08:00:00 GMT"
90,Tinder rival Bumble is majority-owned by European dating behemoth Badoo - TechCrunch,"Fri, 25 Mar 2016 07:00:00 GMT"
91,Human Ventures turns ‘normals’ into founders - TechCrunch,"Wed, 16 Mar 2016 07:00:00 GMT"
92,Pornhub gets immersive with new virtual reality category - TechCrunch,"Wed, 23 Mar 2016 07:00:00 GMT"
93,"I tried out Nike’s self-tying shoes, the HyperAdapt 1.0 - TechCrunch","Fri, 18 Mar 2016 07:00:00 GMT"
94,Oculus shows off first-look of Minecraft for Gear VR and it’s mehhh - TechCrunch,"Wed, 16 Mar 2016 07:00:00 GMT"
95,Ring’s new Video Doorbell Pro ditches the battery for more smarts in a smaller package - TechCrunch,"Wed, 16 Mar 2016 07:00:00 GMT"
96,"Waze now tells you when to leave, thanks to its new Planned Drives feature - TechCrunch","Wed, 16 Mar 2016 07:00:00 GMT"
97,Snapchat reportedly acquires Bitmoji maker Bitstrips for $100 million - TechCrunch,"Fri, 25 Mar 2016 07:00:00 GMT"
98,Engineers bridge the divide between technology and society - TechCrunch,"Tue, 15 Mar 2016 07:00:00 GMT"
99,Veeqo acquires London-based parcel delivery startup ParcelBright - TechCrunch,"Tue, 08 Mar 2016 08:00:00 GMT"
