,Title,Date
0,LimeBike raises $12 million to roll out bike sharing without kiosks in the US - TechCrunch,"Wed, 15 Mar 2017 07:00:00 GMT"
1,Scorp is a fast-growing social video app you’ve probably never heard of - TechCrunch,"Wed, 01 Mar 2017 08:00:00 GMT"
2,Justice Department reportedly ready to charge 4 hackers in Yahoo breach - TechCrunch,"Tue, 14 Mar 2017 07:00:00 GMT"
3,Apple’s drops AIDS charity branding for its red iPhone in China - TechCrunch,"Wed, 22 Mar 2017 07:00:00 GMT"
4,"Banned crime reporting app Vigilante returns as Citizen, says its 'report incident' feature will be pulled - TechCrunch","Fri, 10 Mar 2017 08:00:00 GMT"
5,Startup School will soon be in session at Y Combinator - TechCrunch,"Mon, 06 Mar 2017 08:00:00 GMT"
6,"Facebook introduces personal fundraising tools, donate buttons in Facebook Live for Pages - TechCrunch","Thu, 30 Mar 2017 07:00:00 GMT"
7,MLB.com At Bat and NHL are first to launch personalized app icons on iOS 10.3 - TechCrunch,"Tue, 28 Mar 2017 07:00:00 GMT"
8,"Instagram begins blurring some sensitive content, opens two-factor to all - TechCrunch","Thu, 23 Mar 2017 07:00:00 GMT"
9,Facebook Messenger now lets you privately share your Live Location for an hour - TechCrunch,"Mon, 27 Mar 2017 07:00:00 GMT"
10,Thiel’s chief of staff tapped as White House deputy CTO - TechCrunch,"Fri, 03 Mar 2017 08:00:00 GMT"
11,Japanese authorities decry ongoing robot failures at Fukushima - TechCrunch,"Sat, 25 Mar 2017 07:00:00 GMT"
12,Amazon Alexa now supports Office 365 Calendar - TechCrunch,"Mon, 06 Mar 2017 08:00:00 GMT"
13,"Twitch to relaunch Curse, acquired last year, as the more social Twitch Desktop App - TechCrunch","Fri, 10 Mar 2017 08:00:00 GMT"
14,Fritz Lanman takes CEO role at ClassPass as founder Payal Kadakia steps in as Chairman - TechCrunch,"Fri, 17 Mar 2017 07:00:00 GMT"
15,Spotify and Waze partner to play music and navigate seamlessly - TechCrunch,"Tue, 14 Mar 2017 07:00:00 GMT"
16,Hubble raises $16.5 million to deliver affordable daily contact lenses - TechCrunch,"Tue, 07 Mar 2017 08:00:00 GMT"
17,Facebook Messenger’s PM director Martinazzi leaves after launching Day - TechCrunch,"Sat, 11 Mar 2017 08:00:00 GMT"
18,"Decipher sneaker culture with the founders of StockX, Stadium Goods and Greats at Disrupt NY 2017 - TechCrunch","Tue, 07 Mar 2017 08:00:00 GMT"
19,"Six months in, iMessage App Store growth slows as developers lose interest - TechCrunch","Thu, 16 Mar 2017 07:00:00 GMT"
20,Udemy co-founder Eren Bali just raised $6.5 million for his newest startup - TechCrunch,"Wed, 29 Mar 2017 07:00:00 GMT"
21,What Betsy DeVos’ confirmation means for innovation in education - TechCrunch,"Sun, 05 Mar 2017 08:00:00 GMT"
22,What to do about those ‘government-backed attack’ warnings from Google - TechCrunch,"Fri, 24 Mar 2017 07:00:00 GMT"
23,How does the Lucid Air stack up against the competition? - TechCrunch,"Thu, 16 Mar 2017 07:00:00 GMT"
24,UberEATS debuts Restaurant Manager to give food businesses actionable data - TechCrunch,"Thu, 02 Mar 2017 08:00:00 GMT"
25,Sudden Coffee aims to stir up instant brewing with third-wave tech - TechCrunch,"Tue, 07 Mar 2017 08:00:00 GMT"
26,Twitter is launching a Live video API - TechCrunch,"Mon, 20 Mar 2017 07:00:00 GMT"
27,WikiLeaks publishes data trove claiming to detail CIA hacking methods - TechCrunch,"Tue, 07 Mar 2017 08:00:00 GMT"
28,Facebook Messenger Day launches as a Snapchat Stories clone for making plans - TechCrunch,"Thu, 09 Mar 2017 08:00:00 GMT"
29,Report: Free trials push Apple Music ahead of Pandora and Spotify on mobile usage - TechCrunch,"Wed, 29 Mar 2017 07:00:00 GMT"
30,"Chowbotics raises $5 million for salad-making robots named Sally, of course - TechCrunch","Thu, 09 Mar 2017 08:00:00 GMT"
31,Someone recreated The Office’s Dunder Mifflin in explorable 3D and I love it - TechCrunch,"Tue, 28 Mar 2017 07:00:00 GMT"
32,Goodyear’s AI tire concept can read the road and adapt on the fly - TechCrunch,"Tue, 07 Mar 2017 08:00:00 GMT"
33,"Nintendo blames Switch Joy-Con issue on ‘manufacturing variation,’ offers fix - TechCrunch","Wed, 22 Mar 2017 07:00:00 GMT"
34,Brooklinen tucks in $10M in Series A from FirstMark - TechCrunch,"Thu, 16 Mar 2017 07:00:00 GMT"
35,"Vevo aims for more traction with Watch Party, a chatroom for queuing, watching videos - TechCrunch","Thu, 16 Mar 2017 07:00:00 GMT"
36,GeoVisual Search from Descartes Labs makes the Earth searchable - TechCrunch,"Tue, 07 Mar 2017 08:00:00 GMT"
37,YouTube’s automatic captioning system can now describe sound effects - TechCrunch,"Thu, 23 Mar 2017 07:00:00 GMT"
38,MongoDB’s Atlas database service goes freemium - TechCrunch,"Tue, 07 Mar 2017 08:00:00 GMT"
39,Amazon quietly launches its own social media influencer program into beta - TechCrunch,"Fri, 31 Mar 2017 07:00:00 GMT"
40,Roblox nabs $92 million to power its massive social gaming platform for kids - TechCrunch,"Tue, 14 Mar 2017 07:00:00 GMT"
41,"Thirsting for a new media empire, Beautycon raises $9 million - TechCrunch","Mon, 20 Mar 2017 07:00:00 GMT"
42,X-ray technique creates nanometer-scale 3D reconstructions of computer chips - TechCrunch,"Wed, 15 Mar 2017 07:00:00 GMT"
43,Mark Zuckerberg and Priscilla Chan are expecting another baby girl - TechCrunch,"Thu, 09 Mar 2017 08:00:00 GMT"
44,Smart diabetes management service Livongo Health raises $52.5M and looks to new markets - TechCrunch,"Thu, 16 Mar 2017 07:00:00 GMT"
45,"Google Allo gets improved GIF and emoji support, easier access to Google Assistant - TechCrunch","Thu, 02 Mar 2017 08:00:00 GMT"
46,"Carbon moves into high-volume manufacturing with SpeedCell system, and bigger 3D printers - TechCrunch","Thu, 16 Mar 2017 07:00:00 GMT"
47,Scoot wants to expand its electric scooter operations globally with a white-label service - TechCrunch,"Thu, 09 Mar 2017 08:00:00 GMT"
48,Review: The Nintendo Switch - TechCrunch,"Wed, 01 Mar 2017 08:00:00 GMT"
49,deeplink.me - TechCrunch,"Fri, 18 Apr 2014 11:06:22 GMT"
50,How the M14 Industries Dragons’ Den deal collapsed - TechCrunch,"Tue, 07 Mar 2017 08:00:00 GMT"
51,Private pictures and video of Emma Watson and other celebrities leak online - TechCrunch,"Wed, 15 Mar 2017 07:00:00 GMT"
52,3 habits of successful language learners - TechCrunch,"Sun, 05 Mar 2017 08:00:00 GMT"
53,Facebook pivots into Stories - TechCrunch,"Tue, 28 Mar 2017 07:00:00 GMT"
54,CALA’s app fits designer clothing to your body using iPhone photos - TechCrunch,"Thu, 23 Mar 2017 07:00:00 GMT"
55,Apple releases new colorful Apple Watch ad - TechCrunch,"Fri, 31 Mar 2017 07:00:00 GMT"
56,"Soundcloud confirms new $70M credit line, still closin $100M round - TechCrunch","Thu, 23 Mar 2017 07:00:00 GMT"
57,Picture yourself as a space tourist in these Blue Origin capsule interior shots - TechCrunch,"Wed, 29 Mar 2017 07:00:00 GMT"
58,Facebook Live adds PC game and desktop live streaming - TechCrunch,"Wed, 22 Mar 2017 07:00:00 GMT"
59,Niles is a Slack bot that learns your team’s questions and answers them so you don’t have to - TechCrunch,"Fri, 17 Mar 2017 07:00:00 GMT"
60,Names and definitions of leaked CIA hacking tools - TechCrunch,"Thu, 09 Mar 2017 08:00:00 GMT"
61,Oculus catches a break as TRT lawsuit is dismissed - TechCrunch,"Fri, 10 Mar 2017 08:00:00 GMT"
62,"Nomos Glashütte’s Metro Neomatik is modern, slim and sophisticated watch - TechCrunch","Sun, 26 Mar 2017 07:00:00 GMT"
63,Facebook Messenger rolls out mention alerts and message Reaction emoji - TechCrunch,"Thu, 23 Mar 2017 07:00:00 GMT"
64,Wells Fargo will let you use Apple Pay and Android Pay to withdraw money - TechCrunch,"Mon, 27 Mar 2017 07:00:00 GMT"
65,Tinder Online is a new web version of the dating app - TechCrunch,"Tue, 28 Mar 2017 07:00:00 GMT"
66,LIKEtoKNOW.it’s app helps you buy the products in your screenshots - TechCrunch,"Mon, 06 Mar 2017 08:00:00 GMT"
67,Revolut users can now apply for credit in just a few minutes - TechCrunch,"Tue, 14 Mar 2017 07:00:00 GMT"
68,Google unveils playable ads for Android game developers and other tools - TechCrunch,"Wed, 01 Mar 2017 08:00:00 GMT"
69,Airobotics scores authorization to fly autonomous drones in Israel - TechCrunch,"Mon, 27 Mar 2017 07:00:00 GMT"
70,Amazon’s AWS acquired meeting productivity startup Do to expand Chime - TechCrunch,"Wed, 08 Mar 2017 08:00:00 GMT"
71,Hyperloop One shows off progress on its full-scale test site in Nevada - TechCrunch,"Tue, 07 Mar 2017 08:00:00 GMT"
72,Ciarán O'Leary - TechCrunch,"Sat, 11 May 2024 14:41:57 GMT"
73,One bitcoin is now worth more than one ounce of gold - TechCrunch,"Thu, 02 Mar 2017 08:00:00 GMT"
74,"Alibaba invests in WayRay, a maker of augmented-reality dashboards for smart cars - TechCrunch","Wed, 15 Mar 2017 07:00:00 GMT"
75,"Twitter will live stream 1,500 hours of eSports, including original content - TechCrunch","Thu, 02 Mar 2017 08:00:00 GMT"
76,Coinbase has added margin trading to its bitcoin exchange - TechCrunch,"Tue, 21 Mar 2017 07:00:00 GMT"
77,"Amazon debuts AmazonFresh Pickup, drive-up groceries delivered to your trunk - TechCrunch","Tue, 28 Mar 2017 07:00:00 GMT"
78,Tencent leads $350M investment in Chinese photo/streaming app Kuaishou - TechCrunch,"Thu, 23 Mar 2017 07:00:00 GMT"
79,What it’s like at San Quentin’s coding school - TechCrunch,"Fri, 24 Mar 2017 07:00:00 GMT"
80,Indigo Fair connects local retailers with the perfect merchandise - TechCrunch,"Tue, 07 Mar 2017 08:00:00 GMT"
81,Luxury phone maker Vertu changes hands yet again - TechCrunch,"Mon, 13 Mar 2017 07:00:00 GMT"
82,Spotify acquires content recommendation startup MightyTV - TechCrunch,"Mon, 27 Mar 2017 07:00:00 GMT"
83,Congress just voted to let internet providers sell your browsing history - TechCrunch,"Tue, 28 Mar 2017 07:00:00 GMT"
84,Uber rival Grab expands its engineering team with new offices in India and Vietnam - TechCrunch,"Tue, 14 Mar 2017 07:00:00 GMT"
85,"Google’s Search app now includes Gboard, a widget and expanded 3D Touch - TechCrunch","Tue, 28 Mar 2017 07:00:00 GMT"
86,OceanGate plans an expedition to 3D scan the Titanic - TechCrunch,"Wed, 15 Mar 2017 07:00:00 GMT"
87,The Atomo Modular Electronics System is like LEGO for electronics - TechCrunch,"Fri, 17 Mar 2017 07:00:00 GMT"
88,Tesla Model 3 will get a Performance version next year - TechCrunch,"Fri, 24 Mar 2017 07:00:00 GMT"
89,Evie teams up with Verizon to launch a new search experience next to your Android home screen - TechCrunch,"Tue, 28 Mar 2017 07:00:00 GMT"
90,"Google’s smarter, A.I.-powered translation system expands to more languages - TechCrunch","Mon, 06 Mar 2017 08:00:00 GMT"
91,"Latch tools up with second smart access product for offices, apartment blocks - TechCrunch","Wed, 08 Mar 2017 08:00:00 GMT"
92,Hailo app being parked in London as mytaxi migration kicks off - TechCrunch,"Mon, 13 Mar 2017 07:00:00 GMT"
93,Tech In Asia is raising $6M to double down on its recruitment business - TechCrunch,"Sun, 19 Mar 2017 07:00:00 GMT"
94,"Amazon’s AWS buys Thinkbox Software, maker of tools for creative professionals - TechCrunch","Mon, 06 Mar 2017 08:00:00 GMT"
95,6 River Systems unveils warehouse robots that show workers the way - TechCrunch,"Thu, 30 Mar 2017 07:00:00 GMT"
96,MuleSoft prices IPO above expected range at $17 per share - TechCrunch,"Thu, 16 Mar 2017 07:00:00 GMT"
97,YouTube responds to complaints that its Restricted Mode censors LGBT videos - TechCrunch,"Sun, 19 Mar 2017 07:00:00 GMT"
98,Mass Effect: Andromeda offers plenty of gameplay depth despite some faults - TechCrunch,"Mon, 20 Mar 2017 07:00:00 GMT"
99,"Years after crashing on Travis Kalanick's couch, this founder has raised $18M for his startup, Mashape - TechCrunch","Thu, 23 Mar 2017 07:00:00 GMT"
