,Title,Date
0,"Google has 2 billion users on Android, 500M on Google Photos - TechCrunch","Wed, 17 May 2017 07:00:00 GMT"
1,Google Cloud Platform launches its fourth region in North America - TechCrunch,"Wed, 10 May 2017 07:00:00 GMT"
2,"Facebook, Messenger and Instagram unite with cross-app notifications - TechCrunch","Thu, 18 May 2017 07:00:00 GMT"
3,SoftBank Group - TechCrunch,"Wed, 10 May 2017 08:39:39 GMT"
4,"HBO’s Silicon Valley gets renewed for fifth season, Erlich Bachman won’t return - TechCrunch","Thu, 25 May 2017 07:00:00 GMT"
5,"Apple acquires AI company Lattice Data, a specialist in unstructured ‘dark data’, for $200M - TechCrunch","Sat, 13 May 2017 07:00:00 GMT"
6,Google’s Compute Engine now lets you choose between CPU platforms - TechCrunch,"Wed, 31 May 2017 07:00:00 GMT"
7,Sphero’s Ultimate Lightning McQueen demo - TechCrunch,"Wed, 24 May 2017 07:00:00 GMT"
8,gen z - TechCrunch,"Thu, 11 May 2017 17:16:11 GMT"
9,Samantha Stein - TechCrunch,"Mon, 15 May 2017 13:00:26 GMT"
10,The Blackbelt lets you 3D print really long items - TechCrunch,"Tue, 09 May 2017 07:00:00 GMT"
11,VMware and Google extend partnership to include Chrome OS management in Workspace One - TechCrunch,"Tue, 09 May 2017 07:00:00 GMT"
12,"After beating the world’s elite Go players, Google’s AlphaGo AI is retiring - TechCrunch","Sat, 27 May 2017 07:00:00 GMT"
13,Feast your eyes on this 600-DPI e-paper screen - TechCrunch,"Thu, 25 May 2017 07:00:00 GMT"
14,"Gatwick Airport now has 2,000 beacons for indoor navigation - TechCrunch","Thu, 25 May 2017 07:00:00 GMT"
15,"Google is giving a cluster of 1,000 Cloud TPUs to researchers for free - TechCrunch","Wed, 17 May 2017 07:00:00 GMT"
16,Cheetah Mobile’s Live.me streaming service raises $60M from Chinese investors - TechCrunch,"Tue, 02 May 2017 07:00:00 GMT"
17,"Mark Thompson, CEO and president of The New York Times Company, to talk shop at Disrupt - TechCrunch","Wed, 03 May 2017 07:00:00 GMT"
18,Report: Hackers ‘aligned’ with Vietnam government attacked international firms and media - TechCrunch,"Sun, 14 May 2017 07:00:00 GMT"
19,BlindPAD’s tablet makes visual information tactile for the vision-impaired - TechCrunch,"Fri, 05 May 2017 07:00:00 GMT"
20,Blackstorm Labs taps Facebook’s AI bots to build a helper next to an Instant Game - TechCrunch,"Wed, 03 May 2017 07:00:00 GMT"
21,"Sergey Brin’s giant airship will be world’s largest, serve humanitarian role - TechCrunch","Fri, 26 May 2017 07:00:00 GMT"
22,"The Farmer’s Dog, a customized pet food subscription service, scoops up $8.1 million - TechCrunch","Thu, 18 May 2017 07:00:00 GMT"
23,"Cisco scoops up yet another cloud company, acquiring SD-WAN startup Viptela for $610M - TechCrunch","Mon, 01 May 2017 07:00:00 GMT"
24,Thailand backs down on threat to ban Facebook - TechCrunch,"Tue, 16 May 2017 07:00:00 GMT"
25,Snapchat’s Bitmoji get changing expressions and Snapcode placement - TechCrunch,"Tue, 23 May 2017 07:00:00 GMT"
26,Xbox Game Pass launches June 1 with over 100 titles - TechCrunch,"Wed, 24 May 2017 07:00:00 GMT"
27,The Trayvax Element is a minimalist wallet for the paranoid beer-lover - TechCrunch,"Fri, 05 May 2017 07:00:00 GMT"
28,WhatsApp back after worldwide outage - TechCrunch,"Wed, 03 May 2017 07:00:00 GMT"
29,Matterport launches Pro2 camera optimized for 2D and 3D imagery - TechCrunch,"Wed, 31 May 2017 07:00:00 GMT"
30,Hillary Clinton says pulling out of climate accords would hurt US businesses - TechCrunch,"Wed, 31 May 2017 07:00:00 GMT"
31,Angie’s List will merge with HomeAdvisor after finally accepting IAC’s acquisition offer - TechCrunch,"Mon, 01 May 2017 07:00:00 GMT"
32,Microsoft teases new Surface event in Shanghai on May 23rd - TechCrunch,"Fri, 05 May 2017 07:00:00 GMT"
33,grammarly - TechCrunch,"Fri, 12 May 2017 13:05:42 GMT"
34,"With $25 million in funding, Prumentum Group is building a ""hybrid robo"" wealth manager - TechCrunch","Thu, 25 May 2017 07:00:00 GMT"
35,"Google quietly debuts Chatbase, a chatbot analytics platform - TechCrunch","Wed, 17 May 2017 07:00:00 GMT"
36,Minecraft arrives on the Nintendo Switch - TechCrunch,"Fri, 12 May 2017 07:00:00 GMT"
37,"Amazon unveils the $230 Echo Show, with a screen for calls, shipping June 28 - TechCrunch","Tue, 09 May 2017 07:00:00 GMT"
38,Redwood Materials - TechCrunch,"Sat, 13 May 2017 02:15:40 GMT"
39,Why we stepped up to the patent troll problem - TechCrunch,"Thu, 04 May 2017 07:00:00 GMT"
40,Facebook’s ParlAI is where researchers will push the boundaries of conversational AI - TechCrunch,"Mon, 15 May 2017 07:00:00 GMT"
41,Google makes Kotlin a first-class language for writing Android apps - TechCrunch,"Wed, 17 May 2017 07:00:00 GMT"
42,Foursquare data shows international tourism to the U.S. is down - TechCrunch,"Wed, 24 May 2017 07:00:00 GMT"
43,French presidential frontrunner Macron’s emails leaked after alleged hack - TechCrunch,"Fri, 05 May 2017 07:00:00 GMT"
44,“The Handmaid’s Tale” is critical to the success of Hulu’s Live TV service - TechCrunch,"Sun, 07 May 2017 07:00:00 GMT"
45,"Phil Libin exits General Catalyst for All Turtles, a new AI ‘startup studio’ - TechCrunch","Mon, 15 May 2017 07:00:00 GMT"
46,Meet the 21st batch of 500 Startups companies - TechCrunch,"Tue, 23 May 2017 07:00:00 GMT"
47,"Nickelodeon revamps Noggin, its 'Netflix for Kids,' with dozens of interactive, play-along videos - TechCrunch","Wed, 31 May 2017 07:00:00 GMT"
48,"For one new fund, the question isn’t which corporate backer, but why not 10? - TechCrunch","Fri, 26 May 2017 07:00:00 GMT"
49,Deep Science AI monitors security feeds for masks and guns to quicken response times - TechCrunch,"Tue, 16 May 2017 07:00:00 GMT"
50,reVIVE wins the Disrupt NY 2017 Hackathon Grand Prize - TechCrunch,"Sun, 14 May 2017 07:00:00 GMT"
51,"Harry Stebbings and more join #PathFounders at #TheEuropas, June 13, London - TechCrunch","Thu, 25 May 2017 07:00:00 GMT"
52,Caribou Bioscience's Rachel Haurwitz will chat with us about clipping out cancer at Disrupt NY - TechCrunch,"Thu, 04 May 2017 07:00:00 GMT"
53,"Weekly Roundup: Elon Musk's Boring Company revealed, Google Docs phishing scam strikes - TechCrunch","Fri, 05 May 2017 07:00:00 GMT"
54,Microsoft’s Presentation Translator translates presentations in real time - TechCrunch,"Wed, 10 May 2017 07:00:00 GMT"
55,Intel could be about to release a very expensive Core i9 CPU - TechCrunch,"Mon, 15 May 2017 07:00:00 GMT"
56,Etsy names Josh Silverman as its new CEO - TechCrunch,"Tue, 02 May 2017 07:00:00 GMT"
57,Lucid’s unique approach to cars is about more than just electric drivetrains - TechCrunch,"Sun, 14 May 2017 07:00:00 GMT"
58,The Shade Room is profitable and not interested in acquisition - TechCrunch,"Wed, 17 May 2017 07:00:00 GMT"
59,Savari works to bring 5G to connected cars - TechCrunch,"Mon, 15 May 2017 07:00:00 GMT"
60,"YouTube revamps its desktop site with an updated design, optional dark theme, and faster framework - TechCrunch","Tue, 02 May 2017 07:00:00 GMT"
61,Snapchat launches self-serve ad manager - TechCrunch,"Thu, 04 May 2017 07:00:00 GMT"
62,Houzz adds a basic AR mode to its iOS apps to help you shop for furniture - TechCrunch,"Wed, 03 May 2017 07:00:00 GMT"
63,Naval Ravikant hints at future plans for Product Hunt and adding secondary trading to AngelList - TechCrunch,"Fri, 19 May 2017 07:00:00 GMT"
64,BackMap helps people who are visually impaired navigate cities and indoor areas - TechCrunch,"Sun, 14 May 2017 07:00:00 GMT"
65,AMD’s new top-end Radeon Vega graphics cards are taking aim at competing GPUs - TechCrunch,"Tue, 16 May 2017 07:00:00 GMT"
66,Here’s how the laptop ban works on flights to the US - TechCrunch,"Fri, 12 May 2017 07:00:00 GMT"
67,Amazon cancels its QVC-like shopping show ‘Style Code Live’ - TechCrunch,"Tue, 30 May 2017 07:00:00 GMT"
68,SoFi co-founder Dan Macklin is leaving the company - TechCrunch,"Thu, 25 May 2017 07:00:00 GMT"
69,Facebook’s content moderation rules dubbed ‘alarming’ by child safety charity - TechCrunch,"Mon, 22 May 2017 07:00:00 GMT"
70,"Tackling diagnostic medicine with AI, Viz launches a tool to identify strokes - TechCrunch","Mon, 01 May 2017 07:00:00 GMT"
71,Airbnb is running its own internal university to teach data science - TechCrunch,"Wed, 24 May 2017 07:00:00 GMT"
72,Mark Zuckerberg gets trolled on Harvard's student newspaper ahead of commencement speech - TechCrunch,"Thu, 25 May 2017 07:00:00 GMT"
73,"Comcast’s new wireless service, Xfinity Mobile, is now live - TechCrunch","Wed, 17 May 2017 07:00:00 GMT"
74,Silicon Valley law firm Gunderson Dettmer’s legal advice for Pied Piper - TechCrunch,"Sat, 27 May 2017 07:00:00 GMT"
75,FactGem wants to help businesses get more value out of their data - TechCrunch,"Mon, 15 May 2017 07:00:00 GMT"
76,‘Facebook Rewards’ QR codes dangle discounts for offline purchases - TechCrunch,"Mon, 01 May 2017 07:00:00 GMT"
77,Instagram direct messages now support web links and different photo orientations - TechCrunch,"Thu, 25 May 2017 07:00:00 GMT"
78,Spotify buys AI startup Niland to develop its music personalization and recommendations - TechCrunch,"Thu, 18 May 2017 07:00:00 GMT"
79,iTunes is coming to the Windows Store - TechCrunch,"Thu, 11 May 2017 07:00:00 GMT"
80,Google Maps for Android adds Street View images in navigation to show your turns - TechCrunch,"Fri, 12 May 2017 07:00:00 GMT"
81,Far Cry 5’s launch trailer gives us a first look at its rural U.S. setting - TechCrunch,"Fri, 26 May 2017 07:00:00 GMT"
82,Xiaomi puts the focus on India with plans to open 100 retail stores - TechCrunch,"Fri, 12 May 2017 07:00:00 GMT"
83,MIT researchers invent clothes that breathe with the help of biological cells - TechCrunch,"Wed, 24 May 2017 07:00:00 GMT"
84,"Meet Relive, a startup that uses data to turn your outdoor activities into 3D animated videos - TechCrunch","Tue, 02 May 2017 07:00:00 GMT"
85,Chat app Kik takes on Facebook with developer ecosystem built on the blockchain - TechCrunch,"Thu, 25 May 2017 07:00:00 GMT"
86,Toyota turns to blockchain to drive autonomous vehicle adoption - TechCrunch,"Mon, 22 May 2017 07:00:00 GMT"
87,Oscar Health’s Mario Schlosser on Getting Healthcare Right - TechCrunch,"Mon, 15 May 2017 07:00:00 GMT"
88,"Benchmark just hired Sarah Tavel, the first female general partner in the firm’s history - TechCrunch","Tue, 09 May 2017 07:00:00 GMT"
89,Houzeo - TechCrunch,"Tue, 16 May 2017 07:00:00 GMT"
90,A day on the track with the ridiculous 2017 Ford GT supercar - TechCrunch,"Thu, 11 May 2017 07:00:00 GMT"
91,"Uber’s New York manager, Josh Mohrer, joins Tusk Ventures as managing director - TechCrunch","Tue, 30 May 2017 07:00:00 GMT"
92,"Microsoft launches the Fluent Design System, its take on Google’s Material Design - TechCrunch","Thu, 11 May 2017 07:00:00 GMT"
93,Riley raises $3.1M to help real estate agents rate and respond to their leads - TechCrunch,"Fri, 26 May 2017 07:00:00 GMT"
94,Scan these new QR-style Spotify Codes to instantly play a song - TechCrunch,"Fri, 05 May 2017 07:00:00 GMT"
95,Transport Canada recalls the AT-AT walker for poor cold weather performance - TechCrunch,"Thu, 04 May 2017 07:00:00 GMT"
96,"Tragedy strikes as Uber CEO Kalanick loses mother in boating accident, father in serious condition - TechCrunch","Sat, 27 May 2017 07:00:00 GMT"
97,Lost item finder Tile grabs another $25 million in funding - TechCrunch,"Tue, 16 May 2017 07:00:00 GMT"
98,Apple could stop updating the iPad mini - TechCrunch,"Tue, 16 May 2017 07:00:00 GMT"
99,Commission Impossible: How and why the FCC created net neutrality - TechCrunch,"Tue, 30 May 2017 07:00:00 GMT"
