,Title,Date
0,Google To The Yahoo Rescue - TechCrunch,"Tue, 20 Oct 2015 07:00:00 GMT"
1,The Future Of Enterprise Storage Is Probably Not Storage - TechCrunch,"Fri, 23 Oct 2015 07:00:00 GMT"
2,"Employees Deplane From Flightcar As It Undergoes Major ""Restructuring"" - TechCrunch","Thu, 08 Oct 2015 07:00:00 GMT"
3,GoPro Publishes Sneak Peek Of Upcoming Drone After Reporting Disappointing Earnings - TechCrunch,"Wed, 28 Oct 2015 07:00:00 GMT"
4,Everything You Need To Know About The DraftKings/FanDuel Scandal - TechCrunch,"Mon, 19 Oct 2015 07:00:00 GMT"
5,Understanding The 3D Printing Ecosystem - TechCrunch,"Wed, 28 Oct 2015 07:00:00 GMT"
6,"Meet Teforia, A Tea Brewing Robot For The Home - TechCrunch","Thu, 29 Oct 2015 07:00:00 GMT"
7,"SOLS Lets You Buy 3D-Printed Insoles, Customized To Your Feet, Right From An iPhone App - TechCrunch","Mon, 05 Oct 2015 07:00:00 GMT"
8,Apple Acquires Artificial Intelligence Startup Perceptio - TechCrunch,"Mon, 05 Oct 2015 07:00:00 GMT"
9,"Facebook At Work Signs Up Its Biggest Business Yet: 100,000 Workers At The Royal Bank Of Scotland - TechCrunch","Sun, 25 Oct 2015 07:00:00 GMT"
10,"Forget Self-Destructing Messages, Buzz’s New App Offers Self-Destructing Connections - TechCrunch","Fri, 30 Oct 2015 07:00:00 GMT"
11,Live GIF Turns iPhone 6s Live Photos Into Shareable GIFs - TechCrunch,"Thu, 15 Oct 2015 07:00:00 GMT"
12,"Curious World Debuts A Subscription Service For Kid-Friendly Videos, Games And Books That’s The Same Price As Netflix - TechCrunch","Wed, 21 Oct 2015 07:00:00 GMT"
13,"Watch Out, VCs: Chris Farmer Plans To Massively Disrupt The Industry - TechCrunch","Thu, 22 Oct 2015 07:00:00 GMT"
14,Square Will End Payment-Processing Agreement With Starbucks - TechCrunch,"Wed, 14 Oct 2015 07:00:00 GMT"
15,"TicketFire Adds Their Own Digital Ticket Marketplace, Pic-To-Sell - TechCrunch","Fri, 16 Oct 2015 07:00:00 GMT"
16,"Here’s The New Star Wars Trailer, Scene-By-Scene, As GIFs For You To Study - TechCrunch","Mon, 19 Oct 2015 07:00:00 GMT"
17,AdmitSee Raises $1.8 Million In Seed Funding From Silicon Valley Heavyweights - TechCrunch,"Tue, 06 Oct 2015 07:00:00 GMT"
18,When Robots Come To Pray - TechCrunch,"Wed, 07 Oct 2015 07:00:00 GMT"
19,Pure Storage Prices IPO At $17 - TechCrunch,"Tue, 06 Oct 2015 07:00:00 GMT"
20,Can Civil Comments Kill The Internet Troll? - TechCrunch,"Sat, 31 Oct 2015 07:00:00 GMT"
21,"Twelve South Announces The Forté, A Fancy Apple Watch Stand For The Tasteful - TechCrunch","Wed, 14 Oct 2015 07:00:00 GMT"
22,Swiftkey Releases Predictive Keyboard Built On A Neural Network - TechCrunch,"Thu, 08 Oct 2015 07:00:00 GMT"
23,"Kinnek, A Small Biz Marketplace, Raises $20 Million Led By Thrive Capital - TechCrunch","Thu, 15 Oct 2015 07:00:00 GMT"
24,Giphy Expands Beyond Messenger With Its New GIF-Sharing App - TechCrunch,"Thu, 29 Oct 2015 07:00:00 GMT"
25,Married Founders Of Wildfire Leave Google 3 Years After $350M+ Buyout - TechCrunch,"Thu, 15 Oct 2015 07:00:00 GMT"
26,3D Modeling Startup BioDigital Launches An API For The Human Body - TechCrunch,"Thu, 01 Oct 2015 07:00:00 GMT"
27,WikiLeaks Posts Classified Documents From CIA Director John Brennan’s AOL Account - TechCrunch,"Wed, 21 Oct 2015 07:00:00 GMT"
28,Singapore Home Furnishing E-Tailer HipVan Unboxes A $3.3M Series A Round - TechCrunch,"Wed, 07 Oct 2015 07:00:00 GMT"
29,‘Smart Menstrual Cup’ Looncup Deciphers Your Flow - TechCrunch,"Thu, 08 Oct 2015 07:00:00 GMT"
30,OpenGov Picks Up $25 Million More And Adds Marc Andreessen To The Board - TechCrunch,"Thu, 15 Oct 2015 07:00:00 GMT"
31,Google Launches New Cloud Platform Region To Better Serve Eastern U.S. - TechCrunch,"Thu, 01 Oct 2015 07:00:00 GMT"
32,Google’s iOS App Now Lets You Tap And Play GIFs - TechCrunch,"Wed, 07 Oct 2015 07:00:00 GMT"
33,HBO NOW Goes Live On Roku - TechCrunch,"Thu, 08 Oct 2015 07:00:00 GMT"
34,Pixar Studios Doubles Effects In Upcoming Film ‘The Good Dinosaur’ - TechCrunch,"Fri, 09 Oct 2015 07:00:00 GMT"
35,"Bill Gurley: ""I Hope To God We Have A Soft Landing"" - TechCrunch","Tue, 06 Oct 2015 07:00:00 GMT"
36,Stock Trading Was Expensive And Ugly. Robinhood’s App Makes It Free And Pretty - TechCrunch,"Mon, 26 Oct 2015 07:00:00 GMT"
37,The Nintendo Entertainment System (NES) Turns 30 - TechCrunch,"Sun, 18 Oct 2015 07:00:00 GMT"
38,Automatically Animate GIFs In Your Google Image Search Results - TechCrunch,"Fri, 02 Oct 2015 07:00:00 GMT"
39,Experience Street View In Virtual Reality With Google Cardboard - TechCrunch,"Mon, 12 Oct 2015 07:00:00 GMT"
40,Facebook Tests A Dedicated Shopping Feed - TechCrunch,"Mon, 12 Oct 2015 07:00:00 GMT"
41,Instagram’s New Standalone App Boomerang Captures 1-Second Video Loops - TechCrunch,"Thu, 22 Oct 2015 07:00:00 GMT"
42,"Misfit Debuts The Shine 2, A Bigger, More Powerful Version Of Its Flagship Activity & Sleep Tracker - TechCrunch","Tue, 20 Oct 2015 07:00:00 GMT"
43,Katie Roof - TechCrunch,"Mon, 05 Oct 2015 21:12:06 GMT"
44,Easily Measure The Profitability Of Your Consumer Subscription Business - TechCrunch,"Mon, 05 Oct 2015 07:00:00 GMT"
45,Atlassian Splits Its JIRA Project Tracking Service Into 3 Standalone Offerings To Better Serve Non-Technical Teams - TechCrunch,"Tue, 06 Oct 2015 07:00:00 GMT"
46,Amazon Files Suit Against Individuals Offering Fake Product Reviews On Fiverr.com - TechCrunch,"Fri, 16 Oct 2015 07:00:00 GMT"
47,"Ditch The Faux Hoverboard And Commute With Gi FlyBike, A Foldable Electric Bike - TechCrunch","Mon, 26 Oct 2015 07:00:00 GMT"
48,"Amazon Launches Snowball, A Rugged Storage Appliance For Importing Data To AWS By FedEx - TechCrunch","Wed, 07 Oct 2015 07:00:00 GMT"
49,"Facebook Expands Search To All 2 Trillion Posts, Surfacing Public Real-Time News - TechCrunch","Thu, 22 Oct 2015 07:00:00 GMT"
50,"Amazon Shuts Down Its Hotel Booking Site, Amazon Destinations - TechCrunch","Wed, 14 Oct 2015 07:00:00 GMT"
51,Here’s A Video Of Michael J. Fox Trying On Real Self-Lacing Nikes - TechCrunch,"Wed, 21 Oct 2015 07:00:00 GMT"
52,Watch This Self-Steering Tesla Model S Drive Itself (And Us) Down The Highway - TechCrunch,"Wed, 14 Oct 2015 07:00:00 GMT"
53,This Guy Turned The Front Of His House Into A Massive Video Game For Halloween - TechCrunch,"Fri, 30 Oct 2015 07:00:00 GMT"
54,Twitter Shares Pop 5.7% On News Of @Jack’s Return - TechCrunch,"Mon, 05 Oct 2015 07:00:00 GMT"
55,HTML5 On The Rise: No Longer Ahead Of Its Time - TechCrunch,"Wed, 28 Oct 2015 07:00:00 GMT"
56,YouTube Red Deal Forces ESPN To Pull Its Videos From YouTube - TechCrunch,"Fri, 23 Oct 2015 07:00:00 GMT"
57,"Loan Platform Kabbage Raises $135M At A $1B Valuation, Grows Credit Line to $900M - TechCrunch","Wed, 14 Oct 2015 07:00:00 GMT"
58,You Can Now Jailbreak Your iOS 9 Devices (But You Probably Shouldn’t) - TechCrunch,"Wed, 14 Oct 2015 07:00:00 GMT"
59,BlaBlaCar COO Nicolas Brusson To Talk About France’s New Unicorn At Disrupt London - TechCrunch,"Fri, 23 Oct 2015 07:00:00 GMT"
60,"Capital One Launches SwiftID, A Way To Bypass Security Questions With Just A Swipe - TechCrunch","Fri, 23 Oct 2015 07:00:00 GMT"
61,Matrix Partners Gets A New General Partner: Hardi Meybaum - TechCrunch,"Tue, 06 Oct 2015 07:00:00 GMT"
62,Arx Pax Demos Its New Steerable Mag-Lev Hoverboard - TechCrunch,"Wed, 21 Oct 2015 07:00:00 GMT"
63,"Talk With Your Colleagues Anonymously, With Blind - TechCrunch","Fri, 30 Oct 2015 07:00:00 GMT"
64,Twitter Unveils A New Set Of Brand-Centric Analytics - TechCrunch,"Mon, 26 Oct 2015 07:00:00 GMT"
65,Photos And Details Of Uber’s Map-Making Car - TechCrunch,"Mon, 19 Oct 2015 07:00:00 GMT"
66,"Omid Kordestani Leaves Google, Joins Twitter As Its Executive Chairman - TechCrunch","Wed, 14 Oct 2015 07:00:00 GMT"
67,"Catherine Shu, Author at TechCrunch | Page 63 of 105 - TechCrunch","Fri, 02 Oct 2015 21:51:43 GMT"
68,"Lumo Aims For The Running Market With Launch Of ""Smart"" Pants To Improve Runners' Posture - TechCrunch","Wed, 07 Oct 2015 07:00:00 GMT"
69,Alphabet Now Owns abcdefghijklmnopqrstuvwxyz.com - TechCrunch,"Wed, 07 Oct 2015 07:00:00 GMT"
70,Google Play Games Now Lets You Record And Share Gameplay - TechCrunch,"Wed, 28 Oct 2015 07:00:00 GMT"
71,"Elon Musk, Sam Altman Predict Self-Driving Cars Will Be On The Road In Just A Few Years - TechCrunch","Tue, 06 Oct 2015 07:00:00 GMT"
72,IBM Acquires Cleversafe To Accelerate Hybrid Cloud Storage Strategy - TechCrunch,"Mon, 05 Oct 2015 07:00:00 GMT"
73,"Moment-Sharing App Fling Adds Reactions To Promote Global Conversations, Tackles User Safety - TechCrunch","Thu, 29 Oct 2015 07:00:00 GMT"
74,The Apple Watch Hermès Collection Is Now Available For Purchase - TechCrunch,"Mon, 05 Oct 2015 07:00:00 GMT"
75,Virgin America And Spotify Team Up For Free Inflight Music Streaming - TechCrunch,"Tue, 20 Oct 2015 07:00:00 GMT"
76,"Listen To Lost My Name CEO Talk Side Project To Startup, Google Ventures, And What’s Next - TechCrunch","Tue, 20 Oct 2015 07:00:00 GMT"
77,"On-Demand Moving App Dolly Raises $8M Series A, Expands Services To Seattle - TechCrunch","Thu, 01 Oct 2015 07:00:00 GMT"
78,"Red Hat Is Buying IT Automation Startup Ansible, For $150M - TechCrunch","Fri, 16 Oct 2015 07:00:00 GMT"
79,NEA Backs On-Demand Beauty Business Glamsquad In $15 Million Series B - TechCrunch,"Fri, 09 Oct 2015 07:00:00 GMT"
80,"Forget The 7-Day Forecast, WeatherPlanner Will Give You Year-Ahead Weather Predictions - TechCrunch","Thu, 29 Oct 2015 07:00:00 GMT"
81,Stitch Is A Social Network For Seniors - TechCrunch,"Sat, 31 Oct 2015 07:00:00 GMT"
82,Fintech - TechCrunch,"Fri, 23 Oct 2015 03:22:12 GMT"
83,"Tackling The Multi-Billion-Dollar ""Athleisure"" Wear Market, Outdoor Voices Raises $7 Million - TechCrunch","Wed, 14 Oct 2015 07:00:00 GMT"
84,Secret Co-Founder David Byttow Preps New Enterprise Startup After Stint At Medium - TechCrunch,"Mon, 05 Oct 2015 07:00:00 GMT"
85,The Rise Of The Smartphone Means The End Of Mobile Wallets From Carriers And Banks - TechCrunch,"Mon, 26 Oct 2015 07:00:00 GMT"
86,SeatGeek Embraces Paperless Tickets - TechCrunch,"Thu, 22 Oct 2015 07:00:00 GMT"
87,Theranos Refutes Claims Its Blood-Test Tech Is Unreliable - TechCrunch,"Thu, 15 Oct 2015 07:00:00 GMT"
88,Don Bluth Is Crowdfunding A Dragon’s Lair Movie - TechCrunch,"Mon, 26 Oct 2015 07:00:00 GMT"
89,"Construction App Fieldwire Raises $6.6 Million, Led by Formation 8 - TechCrunch","Tue, 27 Oct 2015 07:00:00 GMT"
90,"Patreon Hacked, Gigabytes Of Data And Code Leaked - TechCrunch","Mon, 05 Oct 2015 07:00:00 GMT"
91,"Google CEO Sundar Pichai Cites ""Real Sense Of Energy And Focus"" For Success - TechCrunch","Thu, 22 Oct 2015 07:00:00 GMT"
92,Chewing On Life’s Big Questions With Rainn Wilson’s SoulPancake - TechCrunch,"Thu, 01 Oct 2015 07:00:00 GMT"
93,"Lookup, A Chat App That Connects Retailers And Customers In India, Raises $2.5M - TechCrunch","Wed, 14 Oct 2015 07:00:00 GMT"
94,"Snapchat Adds Slow-Mo, Fast-Forward, And Rewind Video Filters - TechCrunch","Wed, 28 Oct 2015 07:00:00 GMT"
95,Fashion And Tech Collide Again As Apple’s Jony Ive Will Co-Host Met Gala - TechCrunch,"Fri, 16 Oct 2015 07:00:00 GMT"
96,Photos And Details Of Uber’s Map-Making Car - TechCrunch,"Mon, 19 Oct 2015 07:00:00 GMT"
97,"Common, The Co-Living Startup From A General Assembly Founder, Opens Its First Building in Brooklyn - TechCrunch","Mon, 19 Oct 2015 07:00:00 GMT"
98,Google Makes Its Single Sign-On Solution Compatible With More Enterprise Apps - TechCrunch,"Tue, 13 Oct 2015 07:00:00 GMT"
99,Snapchat’s New Sponsored Lenses Turn Your Selfies Into Ads - TechCrunch,"Thu, 01 Oct 2015 07:00:00 GMT"
