,Title,Date
0,"As Bluesky surges, Threads begins testing custom feeds - TechCrunch","Fri, 15 Nov 2024 08:00:00 GMT"
1,Hail Mary! AI in the confessional - TechCrunch,"Mon, 18 Nov 2024 08:00:00 GMT"
2,Threads adjusts its algorithm to show you more content from accounts you follow - TechCrunch,"Thu, 21 Nov 2024 08:00:00 GMT"
3,Apple 16-inch MacBook Pro (M4 Pro) review: A powerful desktop replacement - TechCrunch,"Thu, 07 Nov 2024 08:00:00 GMT"
4,Microsoft Outlook now lets you create personalized AI-powered themes - TechCrunch,"Thu, 07 Nov 2024 08:00:00 GMT"
5,Spotify tests a video feature for audiobooks as it ramps up video expansion - TechCrunch,"Thu, 21 Nov 2024 08:00:00 GMT"
6,A company is now developing human washing machines - TechCrunch,"Thu, 21 Nov 2024 08:00:00 GMT"
7,The other election night winner: Perplexity - TechCrunch,"Wed, 06 Nov 2024 08:00:00 GMT"
8,Latin America fintech will be a market to watch in 2025 - TechCrunch,"Sun, 24 Nov 2024 08:00:00 GMT"
9,PointFive snaps up $20M for breakthrough tech to track usage across multiple clouds - TechCrunch,"Tue, 12 Nov 2024 08:00:00 GMT"
10,German fintech unicorn N26 just had its first profitable quarter - TechCrunch,"Thu, 21 Nov 2024 08:00:00 GMT"
11,"Current AI scaling laws are showing diminishing returns, forcing AI labs to change course - TechCrunch","Wed, 20 Nov 2024 08:00:00 GMT"
12,"OpenAI releases a teacher’s guide to ChatGPT, but some educators are skeptical - TechCrunch","Wed, 20 Nov 2024 08:00:00 GMT"
13,SuperAnnotate helps companies manage their AI datasets - TechCrunch,"Mon, 18 Nov 2024 08:00:00 GMT"
14,Bluesky says 1 million people signed up for the platform in last 24 hours - TechCrunch,"Thu, 14 Nov 2024 08:00:00 GMT"
15,Mistral launches a moderation API - TechCrunch,"Thu, 07 Nov 2024 08:00:00 GMT"
16,"Entrepreneur Marc Lore on ‘founder mode,’ bad hires, and why avoiding risk is deadly - TechCrunch","Sun, 24 Nov 2024 08:00:00 GMT"
17,Perplexity mulls getting into hardware - TechCrunch,"Tue, 26 Nov 2024 08:00:00 GMT"
18,YouTube chases TikTok with new gifting feature for vertical livestreams - TechCrunch,"Thu, 14 Nov 2024 08:00:00 GMT"
19,"Time spent online by adults in the UK jumped by nearly an hour in 2024, says Ofcom - TechCrunch","Wed, 27 Nov 2024 08:00:00 GMT"
20,FBI confirms China-backed hackers breached US telecom giants to steal wiretap data - TechCrunch,"Thu, 14 Nov 2024 08:00:00 GMT"
21,"H, the AI startup that raised $220M, launches its first product: Runner H for 'agentic' applications - TechCrunch","Wed, 20 Nov 2024 08:00:00 GMT"
22,Red Hat is acquiring AI optimization startup Neural Magic - TechCrunch,"Tue, 12 Nov 2024 08:00:00 GMT"
23,Nearly half of AI data centers may not have enough power by 2027 - TechCrunch,"Thu, 14 Nov 2024 08:00:00 GMT"
24,"Anthropic raises another $4B from Amazon, makes AWS its ‘primary’ training partner - TechCrunch","Fri, 22 Nov 2024 08:00:00 GMT"
25,SpaceX wants to test refueling Starships in space early next year - TechCrunch,"Fri, 01 Nov 2024 07:00:00 GMT"
26,Hacker says they banned ‘thousands’ of Call of Duty gamers by abusing anti-cheat flaw - TechCrunch,"Thu, 07 Nov 2024 08:00:00 GMT"
27,Snowflake snaps up data management company Datavolo - TechCrunch,"Wed, 20 Nov 2024 08:00:00 GMT"
28,Twenty is building an open source alternative to Salesforce - TechCrunch,"Mon, 18 Nov 2024 08:00:00 GMT"
29,WhatsApp rolls out voice message transcripts - TechCrunch,"Thu, 21 Nov 2024 08:00:00 GMT"
30,Chinese autonomous driving startup Pony AI seeks up to $224M in US IPO - TechCrunch,"Thu, 14 Nov 2024 08:00:00 GMT"
31,"As demand for lithium explodes, battery recycling startup Tozero sprints to scale with $11.7M seed - TechCrunch","Mon, 11 Nov 2024 08:00:00 GMT"
32,Ex-Duolingo execs raise $13M for a startup that's making it easier to access a college education - TechCrunch,"Mon, 18 Nov 2024 08:00:00 GMT"
33,DoorDash’s app can now import your grocery list for faster shopping - TechCrunch,"Mon, 18 Nov 2024 08:00:00 GMT"
34,"Unlike X, Bluesky says it won’t train AI on your posts - TechCrunch","Fri, 15 Nov 2024 08:00:00 GMT"
35,OpenAI acquired Chat.com - TechCrunch,"Wed, 06 Nov 2024 08:00:00 GMT"
36,Chrome on iOS now lets you search using images and text at the same time - TechCrunch,"Tue, 12 Nov 2024 08:00:00 GMT"
37,Amazon Japan raided by anti-monopoly authorities - TechCrunch,"Tue, 26 Nov 2024 08:00:00 GMT"
38,"Reliance, Disney complete India media merger valued at $8.5B - TechCrunch","Thu, 14 Nov 2024 08:00:00 GMT"
39,"GenAI suffers from data overload, so companies should focus on smaller, specific goals - TechCrunch","Sun, 03 Nov 2024 07:00:00 GMT"
40,OneCell Diagnostics bags $16M to help limit cancer recurrence using AI - TechCrunch,"Wed, 20 Nov 2024 08:00:00 GMT"
41,AI pioneer François Chollet leaves Google - TechCrunch,"Thu, 14 Nov 2024 08:00:00 GMT"
42,YC-backed Four Growers builds robots to help solve greenhouse labor shortages - TechCrunch,"Wed, 20 Nov 2024 08:00:00 GMT"
43,"TikTok launches integration with Lemon8, as US ban looms - TechCrunch","Tue, 12 Nov 2024 08:00:00 GMT"
44,"Corning, maker of toughened Gorilla Glass for phones, faces EU antitrust probe - TechCrunch","Wed, 06 Nov 2024 08:00:00 GMT"
45,FBI raids home of Polymarket CEO Shayne Coplan - TechCrunch,"Thu, 14 Nov 2024 08:00:00 GMT"
46,Elon Musk wants to block the transfer of Infowars’ X accounts to The Onion - TechCrunch,"Tue, 26 Nov 2024 08:00:00 GMT"
47,"Kim Kardashian has befriended Optimus, the Tesla bot - TechCrunch","Tue, 19 Nov 2024 08:00:00 GMT"
48,Substack is giving out free subscriptions to boost app installs - TechCrunch,"Tue, 05 Nov 2024 08:00:00 GMT"
49,Exclusive: Glint Solar grabs $8M to help accelerate solar energy adoption across Europe - TechCrunch,"Thu, 07 Nov 2024 08:00:00 GMT"
50,Elon Musk files for injunction to halt OpenAI’s transition to a for-profit - TechCrunch,"Sat, 30 Nov 2024 08:00:00 GMT"
51,Supersonic aircraft startup Exosonic is shutting down - TechCrunch,"Fri, 08 Nov 2024 08:00:00 GMT"
52,The Beatles’ AI-assisted track ‘Now and Then’ is nominated for two Grammy awards - TechCrunch,"Fri, 08 Nov 2024 08:00:00 GMT"
53,Amazon debuts its largest Echo Show yet - TechCrunch,"Wed, 20 Nov 2024 08:00:00 GMT"
54,Apple Mac Mini (M4) review: More power in a tiny package - TechCrunch,"Thu, 07 Nov 2024 08:00:00 GMT"
55,OpenAI moves to trademark its o1 ‘reasoning’ models - TechCrunch,"Wed, 27 Nov 2024 08:00:00 GMT"
56,Ai2 releases new language models competitive with Meta’s Llama - TechCrunch,"Tue, 26 Nov 2024 08:00:00 GMT"
57,OpenAI’s take on AI agents could come in January - TechCrunch,"Wed, 13 Nov 2024 08:00:00 GMT"
58,Apple’s AI-powered Final Cut Pro 11 is now available - TechCrunch,"Wed, 13 Nov 2024 08:00:00 GMT"
59,"Apple iOS 18.2 public beta arrives with new AI features, but some remain waitlisted - TechCrunch","Wed, 06 Nov 2024 08:00:00 GMT"
60,Bluesky gears up for Election Day as X goes pro-Trump - TechCrunch,"Mon, 04 Nov 2024 08:00:00 GMT"
61,Intel and Biden Administration finalize $7.86B CHIPS Act grant for domestic manufacturing - TechCrunch,"Tue, 26 Nov 2024 08:00:00 GMT"
62,Tessl raises $125M at $500M+ valuation to build AI that writes and maintains code - TechCrunch,"Thu, 14 Nov 2024 08:00:00 GMT"
63,Sill’s new app rounds up the best links from your Bluesky and Mastodon networks - TechCrunch,"Mon, 25 Nov 2024 08:00:00 GMT"
64,Snowflake hackers identified and charged with stealing 50 billion AT&T records - TechCrunch,"Tue, 12 Nov 2024 08:00:00 GMT"
65,DOJ: Google must sell Chrome to end monopoly - TechCrunch,"Wed, 20 Nov 2024 08:00:00 GMT"
66,"Microsoft to launch new custom chips for data processing, security - TechCrunch","Tue, 19 Nov 2024 08:00:00 GMT"
67,"Federato fixes insurance risk analysis with AI, raises $40M - TechCrunch","Wed, 20 Nov 2024 08:00:00 GMT"
68,"India orders Meta to curb WhatsApp data sharing, levies $25M fine - TechCrunch","Mon, 18 Nov 2024 08:00:00 GMT"
69,"Joco almost died at launch. Now, it's a lifeline for e-bike delivery riders — and a profitable business - TechCrunch","Sat, 30 Nov 2024 08:00:00 GMT"
70,What Trump’s victory could mean for AI regulation - TechCrunch,"Wed, 06 Nov 2024 08:00:00 GMT"
71,Apple says Mac users targeted in zero-day cyberattacks - TechCrunch,"Tue, 19 Nov 2024 08:00:00 GMT"
72,Spectro Cloud nets $75M to help companies manage their Kubernetes installations - TechCrunch,"Tue, 19 Nov 2024 08:00:00 GMT"
73,Bluesky verification could look a lot different from X’s blue checks - TechCrunch,"Tue, 26 Nov 2024 08:00:00 GMT"
74,These alternatives to popular apps can help reclaim your online life from billionaires and surveillance - TechCrunch,"Fri, 29 Nov 2024 08:00:00 GMT"
75,FTC reportedly opens antitrust investigation into Microsoft - TechCrunch,"Wed, 27 Nov 2024 08:00:00 GMT"
76,OpenAI has hired the co-founder of Twitter challenger Pebble - TechCrunch,"Sun, 03 Nov 2024 07:00:00 GMT"
77,Oura valued at $5B following deal with medical device firm Dexcom - TechCrunch,"Tue, 19 Nov 2024 08:00:00 GMT"
78,Australia looks to ban social media for kids under age 16 - TechCrunch,"Wed, 06 Nov 2024 08:00:00 GMT"
79,Truecaller’s founders step down as the spam blocking app regains momentum - TechCrunch,"Wed, 06 Nov 2024 08:00:00 GMT"
80,Generative AI startup Writer raises $200M at a $1.9B valuation - TechCrunch,"Tue, 12 Nov 2024 08:00:00 GMT"
81,Encore is an AI-powered search engine for your thrifting needs - TechCrunch,"Sun, 10 Nov 2024 08:00:00 GMT"
82,Apple is reportedly building a more conversational Siri powered by LLMs - TechCrunch,"Thu, 21 Nov 2024 08:00:00 GMT"
83,Amazon may up its investment in Anthropic — on one condition - TechCrunch,"Thu, 07 Nov 2024 08:00:00 GMT"
84,Lightyear is on a mission to modernize network procurement - TechCrunch,"Tue, 19 Nov 2024 08:00:00 GMT"
85,Google Lens can now check prices and inventory when shopping in the real world - TechCrunch,"Tue, 19 Nov 2024 08:00:00 GMT"
86,Appcharge raises $26M to help gaming apps cut out Apple and Google from virtual goods revenues - TechCrunch,"Mon, 25 Nov 2024 08:00:00 GMT"
87,‘I went to Greenland to try to buy it’: Meet the founder who wants to recreate Mars on Earth - TechCrunch,"Fri, 15 Nov 2024 08:00:00 GMT"
88,Instagram will soon let you reset your recommendation algorithm - TechCrunch,"Tue, 19 Nov 2024 08:00:00 GMT"
89,Tubi hops on the short-form video bandwagon with its ‘Scenes’ feature - TechCrunch,"Thu, 21 Nov 2024 08:00:00 GMT"
90,"Marc Andreessen, Joe Lonsdale, and all the other VCs reportedly in the running for DOGE and other Trump committees - TechCrunch","Wed, 27 Nov 2024 08:00:00 GMT"
91,World of Warcraft turns 20 - TechCrunch,"Sun, 17 Nov 2024 08:00:00 GMT"
92,Meet three incoming EU lawmakers in charge of key tech policy areas - TechCrunch,"Sat, 23 Nov 2024 08:00:00 GMT"
93,Cambridge materials science spin-out Molyon is on a mission to make next-gen batteries fly - TechCrunch,"Tue, 26 Nov 2024 08:00:00 GMT"
94,"ServiceTitan could be the first of many ‘dirty’ term-sheet IPOs, VCs believe - TechCrunch","Tue, 26 Nov 2024 08:00:00 GMT"
95,Agentio raises $12M from Benchmark for its YouTube ad marketplace - TechCrunch,"Tue, 19 Nov 2024 08:00:00 GMT"
96,Apple is buying photo-editing app Pixelmator - TechCrunch,"Fri, 01 Nov 2024 07:00:00 GMT"
97,Anthropic teams up with Palantir and AWS to sell AI to defense customers - TechCrunch,"Thu, 07 Nov 2024 08:00:00 GMT"
98,Amazon confirms employee data stolen after hacker claims MOVEit breach - TechCrunch,"Mon, 11 Nov 2024 08:00:00 GMT"
99,"As the year draws to a close, startups don’t pause - TechCrunch","Fri, 29 Nov 2024 08:00:00 GMT"
