,Title,Date
0,Now Facebook says it may remove Like counts - TechCrunch,"Mon, 02 Sep 2019 07:00:00 GMT"
1,Facebook expands its playable and AR ad formats - TechCrunch,"Thu, 19 Sep 2019 07:00:00 GMT"
2,"Facebook launches Portal TV, a $149 video chat set-top box - TechCrunch","Wed, 18 Sep 2019 07:00:00 GMT"
3,"Bellwether Coffee, ‘the fastest-growing company in coffee,’ raises $40M Series B - TechCrunch","Wed, 04 Sep 2019 07:00:00 GMT"
4,SpaceX’s orbital Starship prototype construction progress detailed in new photos - TechCrunch,"Tue, 17 Sep 2019 07:00:00 GMT"
5,A huge database of Facebook users’ phone numbers found online - TechCrunch,"Wed, 04 Sep 2019 07:00:00 GMT"
6,Alchemist Accelerator is launching a European program - TechCrunch,"Fri, 20 Sep 2019 07:00:00 GMT"
7,How Peloton made sweat addictive enough to IPO - TechCrunch,"Sun, 22 Sep 2019 07:00:00 GMT"
8,"WeChat restricts controversial video face-swapping app Zao, citing ‘security risks’ - TechCrunch","Mon, 02 Sep 2019 07:00:00 GMT"
9,"Volkswagen reveals its mass-market ID.3, an electric car with up to 341 miles of range - TechCrunch","Mon, 09 Sep 2019 07:00:00 GMT"
10,Xiaomi has shipped 100 million smartphones in India - TechCrunch,"Fri, 06 Sep 2019 07:00:00 GMT"
11,Here are the iPhone 11 and iPhone 11 Pro - TechCrunch,"Tue, 10 Sep 2019 07:00:00 GMT"
12,"DeadHappy, the UK pay-as-you-go life insurance provider, raises £4M Series A - TechCrunch","Fri, 27 Sep 2019 07:00:00 GMT"
13,Social radio startup Stationhead moves beyond live broadcasts - TechCrunch,"Mon, 23 Sep 2019 07:00:00 GMT"
14,"Voter manipulation on social media now a global problem, report finds - TechCrunch","Thu, 26 Sep 2019 07:00:00 GMT"
15,Canoo takes the covers off of its debut electric vehicle - TechCrunch,"Tue, 24 Sep 2019 07:00:00 GMT"
16,"Ten years after Adobe bought Omniture, the deal comes into clearer focus - TechCrunch","Mon, 16 Sep 2019 07:00:00 GMT"
17,Daily Crunch: AR startup Daqri is shutting down - TechCrunch,"Fri, 13 Sep 2019 07:00:00 GMT"
18,Dating app maker Match sued by FTC for fraud - TechCrunch,"Thu, 26 Sep 2019 07:00:00 GMT"
19,"The mainframe business is alive and well, as IBM announces new z15 - TechCrunch","Thu, 12 Sep 2019 07:00:00 GMT"
20,Here are this year’s Breakthrough Prize Winners - TechCrunch,"Thu, 05 Sep 2019 07:00:00 GMT"
21,Accel and Sequoia seed Middesk with $4M to background check businesses - TechCrunch,"Thu, 12 Sep 2019 07:00:00 GMT"
22,Documents reveal how Russia taps phone companies for surveillance - TechCrunch,"Wed, 18 Sep 2019 07:00:00 GMT"
23,Target’s personalized loyalty program launches nationwide next month - TechCrunch,"Mon, 09 Sep 2019 07:00:00 GMT"
24,"Facebook has acquired Servicefriend, which builds 'hybrid' chatbots, for Calibra customer service - TechCrunch","Sat, 21 Sep 2019 07:00:00 GMT"
25,Subscription email app Tempo hits the right minimalist notes - TechCrunch,"Thu, 19 Sep 2019 07:00:00 GMT"
26,"Bird CEO Travis VanderZanden to talk scooters, unit economics and a multi-billion-dollar valuation at Disrupt SF - TechCrunch","Wed, 25 Sep 2019 07:00:00 GMT"
27,Audi’s off-roading electric concept would be perfect for Tatooine - TechCrunch,"Tue, 10 Sep 2019 07:00:00 GMT"
28,Jobpal pockets $2.7M for its enterprise recruitment chatbot - TechCrunch,"Mon, 30 Sep 2019 07:00:00 GMT"
29,"Meet SoundCloud rival Audius, free & anti-takedowns - TechCrunch","Tue, 24 Sep 2019 07:00:00 GMT"
30,"Amazon adds an 8-inch Echo Show, priced at $129 - TechCrunch","Wed, 25 Sep 2019 07:00:00 GMT"
31,The new Sonos Port connects your existing stereo setup to Sonos and AirPlay 2 - TechCrunch,"Thu, 05 Sep 2019 07:00:00 GMT"
32,Canal+ will bundle Netflix subscriptions in France - TechCrunch,"Mon, 16 Sep 2019 07:00:00 GMT"
33,Bux launches ‘BUX Zero’ to begin offering fee-free trading in Netherlands - TechCrunch,"Wed, 11 Sep 2019 07:00:00 GMT"
34,"Wikipedia blames malicious DDoS attack after site goes down across Europe, Middle East - TechCrunch","Sat, 07 Sep 2019 07:00:00 GMT"
35,India’s Milkbasket in talks to raise over $50M - TechCrunch,"Thu, 05 Sep 2019 07:00:00 GMT"
36,Google to pay $549 million fine and $510 million in back taxes in France - TechCrunch,"Thu, 12 Sep 2019 07:00:00 GMT"
37,This young litigation finance startup just secured $100 million to chase cases it thinks will win - TechCrunch,"Tue, 17 Sep 2019 07:00:00 GMT"
38,WeWork loses its chief communications officer ahead of planned IPO - TechCrunch,"Wed, 11 Sep 2019 07:00:00 GMT"
39,The direct to consumer department store Neighborhood Goods has raised $11 million - TechCrunch,"Wed, 11 Sep 2019 07:00:00 GMT"
40,Apple introduces the A13 Bionic for the iPhone 11 - TechCrunch,"Tue, 10 Sep 2019 07:00:00 GMT"
41,McDonald’s starts selling its Beyond Meat-based “P.L.T.” sandwich in Canada - TechCrunch,"Mon, 30 Sep 2019 07:00:00 GMT"
42,Assassin’s Creed Odyssey gets an educational mode — complete with quizzes - TechCrunch,"Tue, 10 Sep 2019 07:00:00 GMT"
43,Google Nest Hub Max review - TechCrunch,"Mon, 09 Sep 2019 07:00:00 GMT"
44,"Amazon Prime adds free mobile game content to its perks, starting with PUBG Mobile - TechCrunch","Fri, 20 Sep 2019 07:00:00 GMT"
45,"Porsche unveils the $150,900 Taycan Turbo electric sedan - TechCrunch","Wed, 04 Sep 2019 07:00:00 GMT"
46,Boston Dynamics puts its robotic quadruped Spot up for sale - TechCrunch,"Tue, 24 Sep 2019 07:00:00 GMT"
47,"Vested, a newly minted startup, aims to tell startup employees precisely when to exercise their options - TechCrunch","Wed, 25 Sep 2019 07:00:00 GMT"
48,"Mitto, the payment card and app for ‘Gen Z’ teens, raises €2M seed round - TechCrunch","Mon, 16 Sep 2019 07:00:00 GMT"
49,Cracking the code on podcast advertising for customer acquisition - TechCrunch,"Fri, 27 Sep 2019 07:00:00 GMT"
50,"These brothers just raised $15 million for their startup, Dutchie, a kind of Shopify for cannabis dispensaries - TechCrunch","Tue, 10 Sep 2019 07:00:00 GMT"
51,Amazon and Walmart’s Flipkart pledge to scrap single-use plastic packaging in India - TechCrunch,"Wed, 04 Sep 2019 07:00:00 GMT"
52,Programmer who took down open-source pieces over Chef ICE contract responds - TechCrunch,"Mon, 23 Sep 2019 07:00:00 GMT"
53,Fieldwire just raised $33.5 million more to give PlanGrid and its new owner Autodesk a run for their money - TechCrunch,"Mon, 16 Sep 2019 07:00:00 GMT"
54,JobTeaser scores £45M for its graduate recruitment platform - TechCrunch,"Tue, 10 Sep 2019 07:00:00 GMT"
55,Apple Watch Series 5 review - TechCrunch,"Wed, 18 Sep 2019 07:00:00 GMT"
56,Apple will now let you pick your own band color with launch of ‘Apple Watch Studio’ - TechCrunch,"Tue, 10 Sep 2019 07:00:00 GMT"
57,How founder and CTO Dries Buytaert sold Acquia for $1B - TechCrunch,"Wed, 25 Sep 2019 07:00:00 GMT"
58,Terminal raises $17M led by 8VC to source and build remote teams of engineers - TechCrunch,"Thu, 26 Sep 2019 07:00:00 GMT"
59,Aptiv and Hyundai form new joint venture focused on autonomous driving - TechCrunch,"Mon, 23 Sep 2019 07:00:00 GMT"
60,Cute Little Fuckers gets Kickstarter’s seal of approval for sex toy project - TechCrunch,"Tue, 24 Sep 2019 07:00:00 GMT"
61,Apple patents Watch band that could ID you from your wrist skin - TechCrunch,"Tue, 03 Sep 2019 07:00:00 GMT"
62,Google completes controversial takeover of DeepMind Health - TechCrunch,"Thu, 19 Sep 2019 07:00:00 GMT"
63,Director Ang Lee explains why he built a digital Will Smith in ‘Gemini Man’ - TechCrunch,"Fri, 27 Sep 2019 07:00:00 GMT"
64,Mitsubishi Heavy Industries resets ISS mission H-IIB rocket launch for September 24 - TechCrunch,"Fri, 20 Sep 2019 07:00:00 GMT"
65,An explosive breach of contract lawsuit against former Sequoia Capital partner Michael Goguen has been dismissed - TechCrunch,"Thu, 19 Sep 2019 07:00:00 GMT"
66,"GM is bringing Amazon Alexa to 2018 and newer Cadillac, Chevy, Buick and GMC vehicles - TechCrunch","Wed, 25 Sep 2019 07:00:00 GMT"
67,Hatebase catalogues the world’s hate speech in real time so you don’t have to - TechCrunch,"Tue, 10 Sep 2019 07:00:00 GMT"
68,Watch the Porsche Taycan make a 0-90-0 test run on the USS Hornet flight deck - TechCrunch,"Mon, 02 Sep 2019 07:00:00 GMT"
69,SpaceX ‘getting ready’ to fly orbital Starship design with new FCC filing - TechCrunch,"Tue, 10 Sep 2019 07:00:00 GMT"
70,"The Quantum Enterprise with Jim Clarke (Intel), Jay Gambetta (IBM), and Krysta Svore (Microsoft) - TechCrunch","Thu, 05 Sep 2019 07:00:00 GMT"
71,AppZen nabs $50M to build AI tools for expenses and other finance team work - TechCrunch,"Mon, 09 Sep 2019 07:00:00 GMT"
72,iPhone 11 Pro hands-on - TechCrunch,"Tue, 10 Sep 2019 07:00:00 GMT"
73,Apple in the Enterprise with Susan Prescott (Apple) - TechCrunch,"Thu, 05 Sep 2019 07:00:00 GMT"
74,"Gogoro launches its newest electric vehicle, a lightweight scooter called Viva - TechCrunch","Wed, 25 Sep 2019 07:00:00 GMT"
75,The Polaroid Lab uses the light from your phone's screen to turn digital photos into Polaroids - TechCrunch,"Tue, 10 Sep 2019 07:00:00 GMT"
76,Ironclad raises $50M Series C round for its digital contracting platform - TechCrunch,"Tue, 17 Sep 2019 07:00:00 GMT"
77,Light’s new minimalist phone is available now for $350 - TechCrunch,"Wed, 04 Sep 2019 07:00:00 GMT"
78,Apple's new 'For All Mankind' trailer focuses on the people dealing with a Soviet space race win - TechCrunch,"Thu, 26 Sep 2019 07:00:00 GMT"
79,Smart grocery cart startup Caper bags $10 million - TechCrunch,"Tue, 10 Sep 2019 07:00:00 GMT"
80,The emergence of super apps in Latin America - TechCrunch,"Thu, 19 Sep 2019 07:00:00 GMT"
81,India’s Darwinbox raises $15M to bring its HR tech platform to more Asian markets - TechCrunch,"Wed, 25 Sep 2019 07:00:00 GMT"
82,Kickstarter darling EcoFlow Delta battery generator is not what it seems - TechCrunch,"Sun, 29 Sep 2019 07:00:00 GMT"
83,Palo Alto Networks intends to acquire Zingbox for $75M - TechCrunch,"Wed, 04 Sep 2019 07:00:00 GMT"
84,Payments giant Stripe debuts a credit card in its latest step into the financing fray - TechCrunch,"Tue, 10 Sep 2019 07:00:00 GMT"
85,Amazon orders 100K electric delivery trucks from Rivian as part of going carbon-neutral by 2040 - TechCrunch,"Thu, 19 Sep 2019 07:00:00 GMT"
86,"Amboss, the knowledge platform for medical professionals, scores €30M Series B - TechCrunch","Mon, 30 Sep 2019 07:00:00 GMT"
87,"Alexa gets an improved voice and can now sound like Samuel L. Jackson, too - TechCrunch","Wed, 25 Sep 2019 07:00:00 GMT"
88,Walmart launches two new credit cards offering 5% back on digital purchases - TechCrunch,"Wed, 18 Sep 2019 07:00:00 GMT"
89,"Original Content podcast: Amazon’s ‘Carnival Row’ mixes fairies, politics and murder - TechCrunch","Sat, 07 Sep 2019 07:00:00 GMT"
90,Dropbox will start rolling out the new Dropbox app to everyone today - TechCrunch,"Wed, 25 Sep 2019 07:00:00 GMT"
91,Work Life Ventures raises $5M for debut enterprise SaaS seed fund - TechCrunch,"Tue, 10 Sep 2019 07:00:00 GMT"
92,Ricoh’s Theta Z1 is the first truly premium consumer 360 camera - TechCrunch,"Thu, 19 Sep 2019 07:00:00 GMT"
93,Nigerian online-only bank startup Kuda raises $1.6M - TechCrunch,"Tue, 10 Sep 2019 07:00:00 GMT"
94,Tipalti collects $76M from Twitter alums' 01 Advisors and more for its AI-based accounts payable solution - TechCrunch,"Tue, 24 Sep 2019 07:00:00 GMT"
95,Tonic launches a personalized news reader that respects user privacy - TechCrunch,"Fri, 20 Sep 2019 07:00:00 GMT"
96,Uber lays off 435 people across engineering and product teams - TechCrunch,"Tue, 10 Sep 2019 07:00:00 GMT"
97,Amazon’s Echo Show can now identify household pantry items held in front of its camera - TechCrunch,"Mon, 23 Sep 2019 07:00:00 GMT"
98,Period app Clue hopes to find out if you have PCOS - TechCrunch,"Wed, 04 Sep 2019 07:00:00 GMT"
99,"Under pressure, The We Company now only says it expects to go public 'by the end of the year' - TechCrunch","Mon, 16 Sep 2019 07:00:00 GMT"
