,Title,Date
0,SpaceX - TechCrunch,"Sat, 19 Apr 2025 21:54:53 GMT"
1,"Geek+, the Amazon Kiva of China, lands $200 million Series C - TechCrunch","Wed, 17 Jun 2020 07:00:00 GMT"
2,"The Loupedeck CT is a fantastic, flexible editing console for Mac and PC - TechCrunch","Wed, 24 Jun 2020 07:00:00 GMT"
3,"Apple unveils macOS 11.0 Big Sur, featuring a new aesthetic and redesigned apps - TechCrunch","Mon, 22 Jun 2020 07:00:00 GMT"
4,All the tech in Ford’s most important vehicle: the 2021 F-150 truck - TechCrunch,"Thu, 25 Jun 2020 07:00:00 GMT"
5,"Cue Health raises $100 million to speed development of rapid, portable COVID-19 diagnostics - TechCrunch","Wed, 10 Jun 2020 07:00:00 GMT"
6,What grocery startup Weee! learned from China’s tech giants - TechCrunch,"Fri, 05 Jun 2020 07:00:00 GMT"
7,Facebook tests the ability to share collections of curated content more publicly - TechCrunch,"Wed, 17 Jun 2020 07:00:00 GMT"
8,NexHealth’s founder went from a receptionist at a clinic in the Bronx to $12 million in funding - TechCrunch,"Tue, 30 Jun 2020 07:00:00 GMT"
9,Revolut expands bank account aggregation to Ireland - TechCrunch,"Tue, 16 Jun 2020 07:00:00 GMT"
10,Here’s everything Apple announced in the WWDC 2020 keynote today - TechCrunch,"Mon, 22 Jun 2020 07:00:00 GMT"
11,FirstMark Capital announces new funds with a fresh $650 million in investment capital - TechCrunch,"Tue, 16 Jun 2020 07:00:00 GMT"
12,"Lego pauses marketing of police sets, amid protests - TechCrunch","Thu, 04 Jun 2020 07:00:00 GMT"
13,"After merger, T-Mobile lays off hundreds of Sprint employees - TechCrunch","Tue, 16 Jun 2020 07:00:00 GMT"
14,Amazon eliminates single-use plastic in packaging in India - TechCrunch,"Mon, 29 Jun 2020 07:00:00 GMT"
15,"Global smartphone sales plummeted 20% in Q1, thanks to COVID-19 - TechCrunch","Mon, 01 Jun 2020 07:00:00 GMT"
16,"Data startup Axiom secures $4M from Crane Venture Partners, emerges from stealth - TechCrunch","Tue, 09 Jun 2020 07:00:00 GMT"
17,French court slaps down Google’s appeal against $57M GDPR fine - TechCrunch,"Fri, 19 Jun 2020 07:00:00 GMT"
18,Mark Zuckerberg commits Facebook to $10 million donation to 'groups working on racial justice' - TechCrunch,"Mon, 01 Jun 2020 07:00:00 GMT"
19,Xiaomi's Mi Smart Band 5 sports bigger display and new wireless charging system — and starts at $27 - TechCrunch,"Thu, 11 Jun 2020 07:00:00 GMT"
20,Medtech assessor Elektra Labs is offering free evaluations of COVID-19 biosensors to doctors - TechCrunch,"Mon, 29 Jun 2020 07:00:00 GMT"
21,Facebook and PayPal invest in Southeast Asian ride-hailing giant Gojek - TechCrunch,"Tue, 02 Jun 2020 07:00:00 GMT"
22,Payfone raises $100M for its mobile phone-based digital verification and ID platform - TechCrunch,"Thu, 18 Jun 2020 07:00:00 GMT"
23,TransferWise to offer investment products but has ‘no plans’ to become a bank - TechCrunch,"Tue, 30 Jun 2020 07:00:00 GMT"
24,"Nintendo now says 300,000 accounts breached by hackers - TechCrunch","Tue, 09 Jun 2020 07:00:00 GMT"
25,Google news and analysis| Page 98 of 447 - TechCrunch,"Sat, 10 May 2025 17:06:10 GMT"
26,Unbounce raises $38.4M to build better landing pages with automation - TechCrunch,"Wed, 17 Jun 2020 07:00:00 GMT"
27,"Now one of the largest Black-led venture firms by assets, Base10 raises $250 million second fund - TechCrunch","Fri, 26 Jun 2020 07:00:00 GMT"
28,Demandbase acquires Engagio to bring consolidation and ‘clarity’ to B2B marketing - TechCrunch,"Tue, 16 Jun 2020 07:00:00 GMT"
29,Brazil suspends WhatsApp’s payments service - TechCrunch,"Tue, 23 Jun 2020 07:00:00 GMT"
30,"The 1033 program takes center stage again, as militarized police make headlines - TechCrunch","Mon, 08 Jun 2020 07:00:00 GMT"
31,First commercial Earth-to-moon communication relay satellite planned for 2023 - TechCrunch,"Tue, 16 Jun 2020 07:00:00 GMT"
32,Canva design platform partners with FedEx Office as it pushes further into the US - TechCrunch,"Tue, 16 Jun 2020 07:00:00 GMT"
33,Say ‘so long’ to the original Segway - TechCrunch,"Tue, 23 Jun 2020 07:00:00 GMT"
34,Snapchat redesigns its app with new action bar - TechCrunch,"Thu, 11 Jun 2020 07:00:00 GMT"
35,Google’s 46-camera ‘light field videos’ let you change perspective and peek around corners - TechCrunch,"Tue, 23 Jun 2020 07:00:00 GMT"
36,Volkswagen launches home EV charging system sales ahead of ID.3 vehicle deliveries - TechCrunch,"Fri, 12 Jun 2020 07:00:00 GMT"
37,COVID-19 nearly killed this office furniture startup; turning to home offices may save it - TechCrunch,"Thu, 11 Jun 2020 07:00:00 GMT"
38,These free tools blur protesters’ faces and remove photo metadata - TechCrunch,"Sat, 06 Jun 2020 07:00:00 GMT"
39,Grado unveils its $420 Hemp Headphone - TechCrunch,"Wed, 10 Jun 2020 07:00:00 GMT"
40,Idinvest shares some trends on European consumer tech - TechCrunch,"Wed, 03 Jun 2020 07:00:00 GMT"
41,Slice raises $6M to help young Indians pay digitally and build credit score - TechCrunch,"Wed, 24 Jun 2020 07:00:00 GMT"
42,"Mercedes-Benz, Nvidia partner to bring ‘software-defined’ vehicles to market in 2024 - TechCrunch","Tue, 23 Jun 2020 07:00:00 GMT"
43,Mark Zuckerberg and Priscilla Chan respond to Chan Zuckerberg Initiative scientists' open letter on Trump - TechCrunch,"Fri, 12 Jun 2020 07:00:00 GMT"
44,Apple will let you port Google Chrome extensions to Safari - TechCrunch,"Thu, 25 Jun 2020 07:00:00 GMT"
45,Chris Cox returns to the fold as Facebook’s chief product officer - TechCrunch,"Thu, 11 Jun 2020 07:00:00 GMT"
46,Facebook expands its fan subscription program - TechCrunch,"Mon, 29 Jun 2020 07:00:00 GMT"
47,Zoom founder and CEO Eric Yuan will speak at Disrupt 2020 - TechCrunch,"Thu, 25 Jun 2020 07:00:00 GMT"
48,Apple’s Safari will soon tell you all the ad trackers watching you - TechCrunch,"Mon, 22 Jun 2020 07:00:00 GMT"
49,NASA seeks crowdsourced help designing a better moon toilet - TechCrunch,"Thu, 25 Jun 2020 07:00:00 GMT"
50,Astroscale expands into geostationary satellite life extension with new acquisition - TechCrunch,"Wed, 03 Jun 2020 07:00:00 GMT"
51,Interview: Apple’s Schiller says position on Hey app is unchanged and no rules changes are imminent - TechCrunch,"Thu, 18 Jun 2020 07:00:00 GMT"
52,Canva raises $60 million on a $6 billion valuation - TechCrunch,"Mon, 22 Jun 2020 07:00:00 GMT"
53,Collab Capital launches with a $50 million target and a mission to help Black entrepreneurs - TechCrunch,"Tue, 09 Jun 2020 07:00:00 GMT"
54,"Ahead of WWDC, Apple's Developer app adds Mac support, new features, iMessage stickers - TechCrunch","Mon, 15 Jun 2020 07:00:00 GMT"
55,How to set up your nice camera as a high-quality webcam in 5 minutes - TechCrunch,"Wed, 10 Jun 2020 07:00:00 GMT"
56,In-game app-development platform Overwolf acquires CurseForge assets from Twitch to get into mods - TechCrunch,"Mon, 22 Jun 2020 07:00:00 GMT"
57,Silq is a new high-level programming language for quantum computers - TechCrunch,"Mon, 15 Jun 2020 07:00:00 GMT"
58,API platform Postman delivers $150M Series C on $2B valuation - TechCrunch,"Thu, 11 Jun 2020 07:00:00 GMT"
59,iOS 14’s App Clips will save you from always needing ‘an app for that’ - TechCrunch,"Tue, 23 Jun 2020 07:00:00 GMT"
60,"Microsoft kills Mixer, will push users to Facebook Gaming - TechCrunch","Mon, 22 Jun 2020 07:00:00 GMT"
61,Apple Card debuts a $50 sign-up bonus in partnership with Walgreens - TechCrunch,"Wed, 03 Jun 2020 07:00:00 GMT"
62,Honda's global operations halted by ransomware attack - TechCrunch,"Tue, 09 Jun 2020 07:00:00 GMT"
63,Y Combinator’s Startup School relaunches to be ready when you are - TechCrunch,"Wed, 17 Jun 2020 07:00:00 GMT"
64,Jupiter wants to put grocery delivery on autopilot - TechCrunch,"Tue, 16 Jun 2020 07:00:00 GMT"
65,ServiceNow to acquire Belgian configuration management startup Sweagle - TechCrunch,"Mon, 22 Jun 2020 07:00:00 GMT"
66,Apple is releasing a Mac mini with an Apple processor for developers starting this week - TechCrunch,"Mon, 22 Jun 2020 07:00:00 GMT"
67,Klarna launches rewards program - TechCrunch,"Tue, 09 Jun 2020 07:00:00 GMT"
68,Privacy assistant Jumbo raises $8 million and releases major update - TechCrunch,"Wed, 24 Jun 2020 07:00:00 GMT"
69,"4 months into lockdown, Eventbrite CEO Julia Hartz sees ‘exciting signs of recovery’ - TechCrunch","Fri, 19 Jun 2020 07:00:00 GMT"
70,Pinwheel is the API platform for income verification that every fintech and neobank needs - TechCrunch,"Wed, 10 Jun 2020 07:00:00 GMT"
71,France releases contact-tracing app StopCovid - TechCrunch,"Tue, 02 Jun 2020 07:00:00 GMT"
72,Oracle’s BlueKai tracks you across the web. That data spilled online - TechCrunch,"Fri, 19 Jun 2020 07:00:00 GMT"
73,"Theaters are ready to reopen, but is America ready to go back to the movies? - TechCrunch","Wed, 10 Jun 2020 07:00:00 GMT"
74,just eat takeaway - TechCrunch,"Fri, 12 Jun 2020 08:47:53 GMT"
75,Tovala gobbles up $20M for its smart oven+meal kit service - TechCrunch,"Tue, 02 Jun 2020 07:00:00 GMT"
76,Confronting racial bias in video games - TechCrunch,"Sun, 21 Jun 2020 07:00:00 GMT"
77,Qualcomm launches its new smartwatch chips - TechCrunch,"Tue, 30 Jun 2020 07:00:00 GMT"
78,Halal fintech startup Wahed closes $25M led by Saudi Aramco’s investment arm - TechCrunch,"Mon, 08 Jun 2020 07:00:00 GMT"
79,"Stockwell, the AI-vending machine startup formerly known as Bodega, is shutting down July 1 - TechCrunch","Mon, 15 Jun 2020 07:00:00 GMT"
80,Babylon Health admits ‘software error’ led to patient data breach - TechCrunch,"Wed, 10 Jun 2020 07:00:00 GMT"
81,SiriusXM acquires Simplecast to double down on podcasts with distribution and analytics tools - TechCrunch,"Wed, 17 Jun 2020 07:00:00 GMT"
82,Tembici raises $47M Series B to expand its fleet of electric bikes - TechCrunch,"Wed, 03 Jun 2020 07:00:00 GMT"
83,"Facebook tests Wikipedia-powered information panels, similar to Google, in its search results - TechCrunch","Thu, 11 Jun 2020 07:00:00 GMT"
84,YouTube’s latest experiment is a TikTok rival focused on 15-second videos - TechCrunch,"Thu, 25 Jun 2020 07:00:00 GMT"
85,"Virgin Galactic flies second SpaceShipTwo test at New Mexico spaceport, clearing the way for powered spaceflight - TechCrunch","Thu, 25 Jun 2020 07:00:00 GMT"
86,Learn how to ‘nail it before you scale it’ with Floodgate’s Ann Miura-Ko at TC Early Stage SF - TechCrunch,"Thu, 11 Jun 2020 07:00:00 GMT"
87,China’s gay dating app Blued eyes Nasdaq IPO to expand overseas - TechCrunch,"Wed, 17 Jun 2020 07:00:00 GMT"
88,Snap lets you play as your Bitmoji in third-party games - TechCrunch,"Thu, 11 Jun 2020 07:00:00 GMT"
89,Google Sheets will soon be able to autocomplete data for you - TechCrunch,"Tue, 30 Jun 2020 07:00:00 GMT"
90,The Square Off robotic chess board gets a video calling component for remote games - TechCrunch,"Fri, 05 Jun 2020 07:00:00 GMT"
91,"BMW, Mercedes-Benz end ‘long-term’ automated driving alliance, for now - TechCrunch","Fri, 19 Jun 2020 07:00:00 GMT"
92,"Apple has acquired Fleetsmith, a startup that helps IT manage Apple devices remotely - TechCrunch","Wed, 24 Jun 2020 07:00:00 GMT"
93,OpenStack adds the StarlingX edge computing stack to its top-level projects - TechCrunch,"Thu, 11 Jun 2020 07:00:00 GMT"
94,Alexis Ohanian is leaving Initialized Capital - TechCrunch,"Fri, 26 Jun 2020 07:00:00 GMT"
95,"Trump suspended from Twitch, as Reddit bans the ‘The_Donald’ and additional subreddits - TechCrunch","Mon, 29 Jun 2020 07:00:00 GMT"
96,Alibaba taps international influencers to sell more globally - TechCrunch,"Tue, 09 Jun 2020 07:00:00 GMT"
97,The coronavirus has hastened the post-human era - TechCrunch,"Mon, 01 Jun 2020 07:00:00 GMT"
98,Mobile safety app Parachute’s new feature prevents anyone from turning off your live-streamed video - TechCrunch,"Mon, 01 Jun 2020 07:00:00 GMT"
99,Google finally brings group calling to the Nest Hub Max - TechCrunch,"Thu, 25 Jun 2020 07:00:00 GMT"
