,Title,Date
0,Amazon’s Answer to Delivery Driver Shortage: Recruit Pot Smokers - Bloomberg,"Wed, 01 Sep 2021 07:00:00 GMT"
1,Former PlayStation Chief Muses on the Future of Gaming - Bloomberg,"Fri, 03 Sep 2021 07:00:00 GMT"
2,Orban Seeks to Quell Talk of Hungary’s EU Exit as Elections Loom - Bloomberg,"Mon, 06 Sep 2021 07:00:00 GMT"
3,What the Solana Blackout Reveals About the Fragility of Crypto - Bloomberg,"Sat, 18 Sep 2021 07:00:00 GMT"
4,Canva Vaults to $40 Billion Value as Online Collaboration Surges - Bloomberg,"Tue, 14 Sep 2021 07:00:00 GMT"
5,Apple Could Still Push 30% Fee on App Makers After Ruling - Bloomberg,"Tue, 14 Sep 2021 07:00:00 GMT"
6,"Amid Western Blazes, Prescribed Fire Is Keeping Some Forests Resilient - Bloomberg","Wed, 08 Sep 2021 07:00:00 GMT"
7,SoftBank-Backed Lender Becomes Mexico Unicorn Worth $1.3 Billion - Bloomberg,"Wed, 29 Sep 2021 07:00:00 GMT"
8,Misfits Market Nearly Doubles Value to $2 Billion in Five Months - Bloomberg,"Tue, 14 Sep 2021 07:00:00 GMT"
9,"Ford, SK Invest $11.4 Billion in Electric Truck, Battery Plants - Bloomberg","Tue, 28 Sep 2021 07:00:00 GMT"
10,"In Paris, the Wrapped Arc de Triomphe Is a Polarizing Package - Bloomberg","Tue, 21 Sep 2021 07:00:00 GMT"
11,Why Wokeism Will Rule the World - Bloomberg,"Sun, 19 Sep 2021 07:00:00 GMT"
12,Bats in Laos Caves Harbor Closest Relatives to Covid-19 Virus - Bloomberg,"Sat, 18 Sep 2021 07:00:00 GMT"
13,How the Child Care Crisis Became a Global Economic Fiasco - Bloomberg,"Wed, 22 Sep 2021 07:00:00 GMT"
14,The Very Rich Already Have a Plan to Escape Biden’s Tax Increase - Bloomberg,"Thu, 02 Sep 2021 07:00:00 GMT"
15,Former Startup Darling Genius Sells to Media Lab for $80 Million - Bloomberg,"Thu, 16 Sep 2021 07:00:00 GMT"
16,Philippine Airlines Files Bankruptcy as Travel Fallout Rises - Bloomberg,"Fri, 03 Sep 2021 07:00:00 GMT"
17,Day-Trading Army Goes All-In on NFTs as Meme-Stock Mania Ebbs - Bloomberg,"Thu, 02 Sep 2021 07:00:00 GMT"
18,"U.S. Hiring Slows Sharply Amid Delta, Complicating Fed Taper - Bloomberg","Fri, 03 Sep 2021 07:00:00 GMT"
19,Dinosaur Cowboys Are Hunting for the Next $32 Million T. Rex Fossils - Bloomberg,"Thu, 16 Sep 2021 07:00:00 GMT"
20,Climate Change May Halve Sugar and Coffee Output By 2099 - Bloomberg,"Wed, 15 Sep 2021 07:00:00 GMT"
21,Mental Health Could Be the Next Casualty of Global Warming - Bloomberg,"Thu, 16 Sep 2021 07:00:00 GMT"
22,"Production Delays Lead Some Automakers to Try a Low-Cost, Low-Range Battery - Bloomberg","Tue, 07 Sep 2021 07:00:00 GMT"
23,Watch Business of Beauty - Bloomberg Quicktake - Bloomberg - Bloomberg,"Tue, 21 Sep 2021 19:28:03 GMT"
24,Lordstown to Sell Ohio Plant to Foxconn in $280 Million Deal - Bloomberg,"Thu, 30 Sep 2021 07:00:00 GMT"
25,Apple Bans Fortnite Until Appeals Are Exhausted in Lawsuit - Bloomberg,"Wed, 22 Sep 2021 07:00:00 GMT"
26,The Rise of the Pandemic Dashboard - Bloomberg,"Sat, 25 Sep 2021 07:00:00 GMT"
27,Buyside becoming more reliant on algorithmic-trading solutions - Bloomberg,"Wed, 01 Sep 2021 07:00:00 GMT"
28,Robinhood Plans Early-Deposit Feature That Rivals PayPal - Bloomberg,"Wed, 01 Sep 2021 07:00:00 GMT"
29,Electric Car Struggles Are Yet Another Problem for Evergrande - Bloomberg,"Mon, 20 Sep 2021 07:00:00 GMT"
30,Tencent Leads $60 Billion Loss as Game Crackdown Expands - Bloomberg,"Thu, 09 Sep 2021 07:00:00 GMT"
31,Why the Philippines Became the Worst Place to Be in Covid - Bloomberg,"Wed, 29 Sep 2021 07:00:00 GMT"
32,New York City Has Once Again Defied the Doomsayers. Here's Why. - Bloomberg,"Wed, 15 Sep 2021 07:00:00 GMT"
33,BlackRock Sets Up $1 Billion Maiden China Fund as Soros Laments - Bloomberg,"Tue, 07 Sep 2021 07:00:00 GMT"
34,KFY: Korn Ferry Stock Price Quote - New York - Bloomberg - Bloomberg,"Sat, 15 Mar 2014 02:00:09 GMT"
35,"Airline Pilots, Crews Exposed to Increasing Levels of Radiation - Bloomberg","Wed, 22 Sep 2021 07:00:00 GMT"
36,Morgan Stanley Taps Sheena Shah to Lead New Crypto Research Team - Bloomberg,"Mon, 13 Sep 2021 07:00:00 GMT"
37,Global Warming Set to Pass 1.5° C as Pollution Plans Fall Short - Bloomberg,"Wed, 15 Sep 2021 07:00:00 GMT"
38,Where Americans Moved Into Fire Danger Zones - Bloomberg,"Fri, 24 Sep 2021 07:00:00 GMT"
39,Freedom of Religion Means Freedom to Say No to Vaccines - Bloomberg,"Tue, 14 Sep 2021 07:00:00 GMT"
40,"Istanbul Turns Taps on Old Fountains, Joining Global Push for Free Drinks - Bloomberg","Mon, 20 Sep 2021 07:00:00 GMT"
41,Social Democrats’ Narrow Win Over Merkel’s Bloc Leaves German Government in Limbo - Bloomberg,"Mon, 27 Sep 2021 07:00:00 GMT"
42,Lab-Grown Mozzarella Gets New Funds for Global Cheese Expansion - Bloomberg,"Sun, 12 Sep 2021 07:00:00 GMT"
43,"Peter Thiel Gamed Silicon Valley, Donald Trump, and Democracy to Make Billions, Tax-Free - Bloomberg","Tue, 14 Sep 2021 07:00:00 GMT"
44,South Korea Fines Google for Abusing Smartphone Dominance - Bloomberg,"Tue, 14 Sep 2021 07:00:00 GMT"
45,This Village in England Is Already Using Hydrogen to Heat Homes - Bloomberg,"Wed, 08 Sep 2021 07:00:00 GMT"
46,World’s Largest Carbon-Sucking Plant Starts Making Tiny Dent in Emissions - Bloomberg,"Wed, 08 Sep 2021 07:00:00 GMT"
47,CD Projekt Boss Says Lesson Learned From Cyberpunk Debacle - Bloomberg,"Tue, 28 Sep 2021 07:00:00 GMT"
48,Wall Street South Builds Its Own New York to Lure Younger Crowd - Bloomberg,"Wed, 01 Sep 2021 07:00:00 GMT"
49,"Europe’s Energy Crisis Is Coming for the Rest of the World, Too - Bloomberg","Sun, 26 Sep 2021 07:00:00 GMT"
50,Matt Goldman - Bloomberg,"Wed, 29 Sep 2021 14:38:53 GMT"
51,Porsche CEO Says Electric Supercars Will Win Out: Munich Update - Bloomberg,"Mon, 06 Sep 2021 07:00:00 GMT"
52,BNP Paribas Adopts Bloomberg Core Mortgage Premium Solution - Bloomberg,"Wed, 08 Sep 2021 07:00:00 GMT"
53,European Energy Prices Pare Record Gains in Crisis-Led Rally - Bloomberg,"Tue, 28 Sep 2021 07:00:00 GMT"
54,German Finance Ministry Raided Over Anti-Money Laundering - Bloomberg,"Thu, 09 Sep 2021 07:00:00 GMT"
55,Is the Supreme Court Ready to Overturn Roe? We Don’t Know - Bloomberg,"Thu, 02 Sep 2021 07:00:00 GMT"
56,Billionaire Kellner Family Is Said to Weigh Home Credit Options - Bloomberg,"Thu, 16 Sep 2021 07:00:00 GMT"
57,Google’s Former AI Ethics Chief Has a Plan to Rethink Big Tech - Bloomberg,"Mon, 20 Sep 2021 07:00:00 GMT"
58,Bitcoin Acts Less Like Digital Gold and More Like a Risky Stock - Bloomberg,"Mon, 20 Sep 2021 07:00:00 GMT"
59,Battery Fires Haunt the Electric Car and Clean Power Revolution - Bloomberg,"Fri, 24 Sep 2021 07:00:00 GMT"
60,It’s Time for California to Decriminalize Jaywalking - Bloomberg,"Wed, 22 Sep 2021 07:00:00 GMT"
61,"If Your CEO Talks Like Kant, Think Twice Before Investing - Bloomberg","Thu, 16 Sep 2021 07:00:00 GMT"
62,YouTube’s Music Service Eclipses 50 Million Subscribers - Bloomberg,"Wed, 01 Sep 2021 07:00:00 GMT"
63,Maxwell Adler - Bloomberg,"Tue, 14 Sep 2021 22:40:12 GMT"
64,Why Your New Couch Will Be Delivered Only in 2022 - Bloomberg,"Sat, 25 Sep 2021 07:00:00 GMT"
65,Soros Calls BlackRock’s China Investment a ‘Tragic Mistake’ - Bloomberg,"Tue, 07 Sep 2021 07:00:00 GMT"
66,Judge Demands App Store Changes Just Before Apple’s Big Product Launch - Bloomberg,"Sun, 12 Sep 2021 07:00:00 GMT"
67,Why China's Evergrande Crisis Could Be Worse Than the U.S. Crash - Bloomberg,"Sat, 25 Sep 2021 07:00:00 GMT"
68,Apple’s Modest iPhone 13 Update Sets the Stage for Bigger iPhone 14 Changes Next Year - Bloomberg,"Sun, 26 Sep 2021 07:00:00 GMT"
69,U.S. Household Net Worth Hits Record on Home Values - Bloomberg,"Thu, 23 Sep 2021 07:00:00 GMT"
70,David Wilcox - Bloomberg,"Wed, 22 Sep 2021 05:03:38 GMT"
71,How Pakistan Won the War in Afghanistan - Bloomberg,"Thu, 09 Sep 2021 07:00:00 GMT"
72,Merkel’s Legacy Comes to Life on Berlin’s ‘Arab Street’ - Bloomberg,"Sat, 18 Sep 2021 07:00:00 GMT"
73,Sacklers to Exit From Complex Purdue Bankruptcy With Billions - Bloomberg,"Thu, 02 Sep 2021 07:00:00 GMT"
74,"Andreessen, Klay Thompson Bet on Fantasy Sports App Sleeper - Bloomberg","Thu, 16 Sep 2021 07:00:00 GMT"
75,Anna Wong - Bloomberg,"Thu, 02 Sep 2021 18:54:25 GMT"
76,China’s Electricity Crunch Is World’s Latest Supply-Chain Threat - Bloomberg,"Mon, 27 Sep 2021 07:00:00 GMT"
77,Rapper Drake Buys Stake in Dave’s Hot Chicken Restaurant Chain - Bloomberg,"Mon, 20 Sep 2021 07:00:00 GMT"
78,Stripe Is Said to Discuss Public Listing With Banks for 2022 - Bloomberg,"Fri, 10 Sep 2021 07:00:00 GMT"
79,Ruined Brazil Harvest Sparks Food Inflation... Everywhere - Bloomberg,"Mon, 27 Sep 2021 07:00:00 GMT"
80,EV Battery Prices Risk Reversing Downward Trend as Metals Surge - Bloomberg,"Tue, 14 Sep 2021 07:00:00 GMT"
81,CEO of Embattled HNA Detained in China Is a U.S. Citizen - Bloomberg,"Fri, 24 Sep 2021 07:00:00 GMT"
82,Bloomberg Introduces New Fixed Income Pre-Trade TCA Model - Bloomberg,"Wed, 22 Sep 2021 07:00:00 GMT"
83,"‘Most Americans Today Believe the Stock Market Is Rigged, and They’re Right’ - Bloomberg","Tue, 28 Sep 2021 07:00:00 GMT"
84,Revolut CEO Targets Billions of Dollars in Sales Before IPO - Bloomberg,"Wed, 01 Sep 2021 07:00:00 GMT"
85,The Unstoppable Appeal of Highway Expansion - Bloomberg,"Tue, 28 Sep 2021 07:00:00 GMT"
86,Macau Casinos See $18 Billion Wipeout as China Tightens Grip - Bloomberg,"Wed, 15 Sep 2021 07:00:00 GMT"
87,Iron Battery Breakthrough Could Eat Lithium’s Lunch - Bloomberg,"Thu, 30 Sep 2021 07:00:00 GMT"
88,Gazprom Plans to Start Nord Stream 2 Gas Pipeline Next Month - Bloomberg,"Wed, 08 Sep 2021 07:00:00 GMT"
89,Ghana’s Record Cocoa Harvest Is Bittersweet for Export Industry - Bloomberg,"Thu, 30 Sep 2021 07:00:00 GMT"
90,Tesla Heads to Court Over Allegations of Racism on Factory Floor - Bloomberg,"Wed, 22 Sep 2021 07:00:00 GMT"
91,Faux Meat Falters at the Drive-Thru - Bloomberg,"Fri, 24 Sep 2021 07:00:00 GMT"
92,Europe Wants to Cultivate a New Generation of Sustainable Farmers - Bloomberg,"Sat, 04 Sep 2021 07:00:00 GMT"
93,The World’s Deadliest Pig Virus Creeps Closer to the U.S. - Bloomberg,"Thu, 30 Sep 2021 07:00:00 GMT"
94,Forget Finance. Supply-Chain Management Is the Pandemic Era’s Must-Have MBA Degree - Bloomberg,"Fri, 03 Sep 2021 07:00:00 GMT"
95,Top Netflix Hit ‘Squid Game’ Sparks Korean Media Stock Surge - Bloomberg,"Mon, 27 Sep 2021 07:00:00 GMT"
96,Will Louch - Bloomberg,"Wed, 20 Apr 2022 20:34:44 GMT"
97,SoftBank Invests in Robotics Company Behind NYC Covid Testing - Bloomberg,"Wed, 22 Sep 2021 07:00:00 GMT"
98,"Arctic Oil, Gas Production Is Booming Despite Climate Fears - Bloomberg","Thu, 23 Sep 2021 07:00:00 GMT"
99,JD.com Unit to Take Over China Logistics in $2.1 Billion Deal - Bloomberg,"Fri, 03 Sep 2021 07:00:00 GMT"
