,Title,Date
0,MONKEYPATCH - LEI: 9695009NBHW3EACYYI76 - Bloomberg LEI,"Sat, 17 May 2025 00:04:59 GMT"
1,Facebook Bursts With Goodwill - Bloomberg.com,"Fri, 26 Feb 2016 08:00:00 GMT"
2,- Bloomberg.com,"Tue, 13 May 2025 00:18:09 GMT"
3,German Beer Purity Under the Microscope as Weedkiller Found - Bloomberg.com,"Fri, 26 Feb 2016 08:00:00 GMT"
4,Victoria's Secret CEO Abruptly Resigns - Bloomberg.com,"Fri, 12 Feb 2016 08:00:00 GMT"
5,How Kurion Plans to Clean Up Fukushima’s Tritium Nuclear Waste - Bloomberg.com,"Thu, 04 Feb 2016 08:00:00 GMT"
6,James Ellis - Bloomberg.com,"Sat, 27 Feb 2016 19:36:16 GMT"
7,Buffett's Empty Calendar Offers Billionaire Path to Bigger Ideas - Bloomberg.com,"Fri, 26 Feb 2016 08:00:00 GMT"
8,Marks's Oaktree Seen Nearing $1 Billion Gain on Gundlach Bet - Bloomberg.com,"Thu, 18 Feb 2016 08:00:00 GMT"
9,SRS Acquiom Inc - Bloomberg.com,"Fri, 10 May 2019 21:46:23 GMT"
10,Ania Nussbaum - Bloomberg.com,"Sun, 28 Feb 2016 11:24:14 GMT"
11,Benchmark Solutions Fully Integrated into the Bloomberg Professional Service | Press | Bloomberg LP - Bloomberg.com,"Tue, 09 Feb 2016 08:00:00 GMT"
12,Petal Card Inc - Bloomberg.com,"Fri, 10 May 2019 22:16:09 GMT"
13,Marco Rubio’s Older Brother Mario on the Hectic GOP Race - Bloomberg.com,"Wed, 17 Feb 2016 08:00:00 GMT"
14,Hong Kong Horse Racing Is Serious Business - Bloomberg.com,"Mon, 22 Feb 2016 08:00:00 GMT"
15,Zenefits CEO Conrad Resigns Amid Regulatory Compliance Issues - Bloomberg.com,"Mon, 08 Feb 2016 08:00:00 GMT"
16,Charis Investments LLC - Bloomberg.com,"Tue, 14 May 2019 14:54:40 GMT"
17,Oregon's Iconic Mount Hood Casts a 'Stunning' Shadow in the Sky - Bloomberg.com,"Thu, 11 Feb 2016 08:00:00 GMT"
18,"WhatsApp Hits 1 Billion Users, Fulfilling Zuckerberg's Promise - Bloomberg.com","Mon, 01 Feb 2016 08:00:00 GMT"
19,Polly Mosendz - Bloomberg.com,"Thu, 25 Feb 2016 03:10:43 GMT"
20,"Zombie Bees Are Real, and They're Stalking North America at Night - Bloomberg.com","Mon, 01 Feb 2016 08:00:00 GMT"
21,There Are Almost No Sculptures of History-Making Women in America - Bloomberg.com,"Wed, 24 Feb 2016 08:00:00 GMT"
22,Some Bike Infrastructure Is Worse Than None at All - Bloomberg.com,"Fri, 05 Feb 2016 08:00:00 GMT"
23,Mercedes Boots Robots From the Production Line - Bloomberg.com,"Thu, 25 Feb 2016 08:00:00 GMT"
24,"Decade After Materazzi Head Butt, Zidane the Focus in Italy - Bloomberg.com","Tue, 16 Feb 2016 08:00:00 GMT"
25,University Endowments - Bloomberg.com,"Wed, 10 Feb 2016 08:00:00 GMT"
26,Polish Institute Says Walesa Worked With Communist Police - Bloomberg.com,"Thu, 18 Feb 2016 08:00:00 GMT"
27,Robinhood Securities LLC - Bloomberg.com,"Mon, 13 Jan 2025 21:52:17 GMT"
28,In Search of the Risk-Free Rate - Bloomberg.com,"Thu, 04 Feb 2016 08:00:00 GMT"
29,IMS Health Pays Its CEO More Than IBM's to Keep Him From Leaving - Bloomberg.com,"Thu, 25 Feb 2016 08:00:00 GMT"
30,"Spoofing Isn't a U.K. Crime, Attorney Says in Sarao Case - Bloomberg.com","Fri, 05 Feb 2016 08:00:00 GMT"
31,Oil Rout Leaves Billionaire Shipping Magnate With Other Fish to Fry - Bloomberg.com,"Wed, 24 Feb 2016 08:00:00 GMT"
32,BlackRock's $1.9 Billion Credit Hedge Fund Suffers Worst January - Bloomberg.com,"Fri, 12 Feb 2016 08:00:00 GMT"
33,"Hedge Fund Manager Puts Profile on Social Media, Lures $20 Million - Bloomberg.com","Tue, 16 Feb 2016 08:00:00 GMT"
34,Your Smartphone Can Now Detect Earthquakes and Help You Survive - Bloomberg.com,"Mon, 15 Feb 2016 08:00:00 GMT"
35,Cathay Securities Inc - Bloomberg.com,"Fri, 10 May 2019 20:03:37 GMT"
36,Surge Pricing at Disneyland Could Boost Ticket Costs by 20% - Bloomberg.com,"Sat, 27 Feb 2016 08:00:00 GMT"
37,Syngenta Group HK Holdings Co Ltd - Company Profile and News - Bloomberg.com,"Thu, 05 May 2022 11:56:58 GMT"
38,Chobani Rejects PepsiCo's Offer to Take Stake in Yogurt Company - Bloomberg.com,"Fri, 05 Feb 2016 08:00:00 GMT"
39,The Spiky Geography of Venture Capital in the U.S. - Bloomberg.com,"Tue, 23 Feb 2016 08:00:00 GMT"
40,SPX Fund SPC - SPX Fund Segregated Portfolio Global - Bloomberg LEI,"Mon, 24 Feb 2025 17:32:59 GMT"
41,Record-Low Zimbabwe Corn Crop to Press Drought-Hit S. Africa - Bloomberg.com,"Wed, 17 Feb 2016 08:00:00 GMT"
42,Keli Network Inc - Bloomberg.com,"Fri, 10 May 2019 22:35:51 GMT"
43,HFD No 55 Inc - Bloomberg.com,"Sat, 11 May 2019 10:45:00 GMT"
44,"ECB Wants Proof That 500-Euro Note Helps Criminals, Mersch Says - Bloomberg.com","Thu, 04 Feb 2016 08:00:00 GMT"
45,The €500 Note Has Been Dead for Years - Bloomberg.com,"Tue, 16 Feb 2016 08:00:00 GMT"
46,FINALFA - LEI: 984500V52B4ADCCD5D21 - Bloomberg LEI,"Thu, 13 Feb 2025 20:49:20 GMT"
47,The Psychological Upside of Becoming a Regular at a Bar - Bloomberg.com,"Fri, 05 Feb 2016 08:00:00 GMT"
48,Tinkler Steps Down as Coal Company Boss Amid Bankruptcy Case - Bloomberg.com,"Mon, 08 Feb 2016 08:00:00 GMT"
49,"Tableau's Plunge Drags Salesforce, Workday on Growth Concern - Bloomberg.com","Fri, 05 Feb 2016 08:00:00 GMT"
50,Why Iraq Doesn't Prosecute Militia Atrocities - Bloomberg.com,"Tue, 09 Feb 2016 08:00:00 GMT"
51,Ferrari's Take on The Family Car: 690 Horsepower and V12 Engine - Bloomberg.com,"Mon, 08 Feb 2016 08:00:00 GMT"
52,McKinsey Scores as Saudis Call in Consultants for Economy Reboot - Bloomberg.com,"Wed, 24 Feb 2016 08:00:00 GMT"
53,The Big Long: Making a Killing in Market Everyone Left for Dead - Bloomberg.com,"Tue, 16 Feb 2016 08:00:00 GMT"
54,State Bank of India Third-Quarter Profit Drops 62% - Bloomberg.com,"Thu, 11 Feb 2016 08:00:00 GMT"
55,"A Book and Exhibit Tackle the Long, Complicated History of Affordable Housing in New York - Bloomberg.com","Fri, 26 Feb 2016 08:00:00 GMT"
56,'Big Short' Professor's Fund Swells in Past Year - Bloomberg.com,"Fri, 26 Feb 2016 08:00:00 GMT"
57,"Shark-Cage Diving Out, Austerity In for Global Mining Chiefs - Bloomberg.com","Thu, 04 Feb 2016 08:00:00 GMT"
58,JPMorgan Has New Theory About What Really Caused the Flash Rally - Bloomberg.com,"Fri, 26 Feb 2016 08:00:00 GMT"
59,Why You'll Have to Wait Years Before Getting That Gulfstream Personal Jet - Bloomberg.com,"Mon, 15 Feb 2016 08:00:00 GMT"
60,My Neanderthal Valentine - Bloomberg.com,"Sun, 14 Feb 2016 08:00:00 GMT"
61,EU Rift Over Refugees Grows as Greece Rebuffs Austrian Visit - Bloomberg.com,"Fri, 26 Feb 2016 08:00:00 GMT"
62,INDATA Services Co LLC - Bloomberg.com,"Sat, 11 May 2019 02:49:56 GMT"
63,TollPlus LLC - Bloomberg.com,"Sun, 12 May 2019 03:41:30 GMT"
64,Marex Capital Markets Inc - Bloomberg.com,"Sat, 11 May 2019 10:14:36 GMT"
65,`The Mermaid' Sets China Box-Office Record at $417 Mln - Bloomberg.com,"Mon, 22 Feb 2016 08:00:00 GMT"
66,OPEC of Maple Syrup Under Fire as Farmers Turn to Black Market - Bloomberg.com,"Fri, 26 Feb 2016 08:00:00 GMT"
67,Artist Wangechi Mutu on 'Brilliant Ideas' | Episode 21 - Bloomberg.com,"Fri, 12 Feb 2016 08:00:00 GMT"
68,Bank of New York Nominees Ltd/The - Bloomberg.com,"Sat, 11 May 2019 08:02:22 GMT"
69,How Investors Can Take Advantage of Volatile Markets - Bloomberg.com,"Mon, 08 Feb 2016 08:00:00 GMT"
70,Ducati's XDiavel Is a Techno-Cruiser Aimed Squarely at Harley-Davidson - Bloomberg.com,"Tue, 02 Feb 2016 08:00:00 GMT"
71,Verizon to Buy XO's Fiber Unit From Carl Icahn for $1.8 Billion - Bloomberg.com,"Mon, 22 Feb 2016 08:00:00 GMT"
72,"John Riccardo, Chrysler CEO Who Hired Iacocca, Dies at 91 - Bloomberg.com","Mon, 15 Feb 2016 08:00:00 GMT"
73,A Hedge Fund Titan's Worst Trade - Bloomberg.com,"Fri, 05 Feb 2016 08:00:00 GMT"
74,"Panda Express Branches Into Pizza, Salads - Bloomberg.com","Thu, 11 Feb 2016 08:00:00 GMT"
75,Soda Taxes Can Protect Health in Asia - Bloomberg.com,"Tue, 23 Feb 2016 08:00:00 GMT"
76,Modi's $222 Billion Make-in-India Haul Masks Hurdles to Come - Bloomberg.com,"Thu, 18 Feb 2016 08:00:00 GMT"
77,PetIQ Inc - Bloomberg.com,"Thu, 28 Feb 2019 16:03:58 GMT"
78,SMBC Aviation Capital Finance DAC - Bloomberg.com,"Fri, 10 May 2019 23:46:38 GMT"
79,Saying Sorry Isn't Enough in Corporate Japan - Bloomberg.com,"Wed, 03 Feb 2016 08:00:00 GMT"
80,Rolex vs. Tudor: A Tale of Two Vintage Day Dates - Bloomberg.com,"Tue, 09 Feb 2016 08:00:00 GMT"
81,Testing Porn Stars Isn't Stopping HIV - Bloomberg.com,"Fri, 12 Feb 2016 08:00:00 GMT"
82,Allianz Partners SAS - Bloomberg.com,"Sun, 12 May 2019 06:02:43 GMT"
83,Picasso Bust Pits Qatar Against Apollo CEO in Ownership Spat - Bloomberg.com,"Thu, 04 Feb 2016 08:00:00 GMT"
84,TPG Partner Wang to Join Minsheng Financial as Chief Executive - Bloomberg.com,"Tue, 16 Feb 2016 08:00:00 GMT"
85,How Amazon Is Building Its Delivery Footprint - Bloomberg.com,"Thu, 04 Feb 2016 08:00:00 GMT"
86,African Farmers Struggle to Feed Continent's Booming Population - Bloomberg.com,"Tue, 16 Feb 2016 08:00:00 GMT"
87,"Taylor Swift Wins Grammy for ‘1989,’ Beating Kendrick Lamar - Bloomberg.com","Mon, 15 Feb 2016 08:00:00 GMT"
88,PAVAN ROTO PRINT INDUSTRIES - Bloomberg LEI,"Tue, 25 Feb 2025 19:34:08 GMT"
89,Bank of America Increases CEO Moynihan's Pay 23% to $16 Million - Bloomberg.com,"Fri, 12 Feb 2016 08:00:00 GMT"
90,Spencer Zwick: Donald Trump Is a Brilliant Political Strategist - Bloomberg.com,"Tue, 09 Feb 2016 08:00:00 GMT"
91,Enval Distribution SAS - Bloomberg.com,"Sat, 18 May 2019 18:30:05 GMT"
92,ARCO Oil & Gas Co - Company Profile and News - Bloomberg.com,"Sat, 11 May 2019 18:44:47 GMT"
93,QuickBase Inc - Bloomberg.com,"Fri, 10 May 2019 22:17:18 GMT"
94,DUDES TRADE SA DE CV - Bloomberg LEI,"Tue, 18 Feb 2025 04:46:36 GMT"
95,These Are the World's Most Miserable Economies - Bloomberg.com,"Thu, 04 Feb 2016 08:00:00 GMT"
96,Chipotle's Sales Have Dropped by 10.3 Million Burritos - Bloomberg.com,"Tue, 02 Feb 2016 08:00:00 GMT"
97,Financial Times in Talks to Lease Former Headquarters in London - Bloomberg.com,"Thu, 18 Feb 2016 08:00:00 GMT"
98,Meet Lamudi: the Rocket-Backed Startup With Profits in Sight - Bloomberg.com,"Wed, 03 Feb 2016 08:00:00 GMT"
99,Geotek Ltd - Bloomberg.com,"Sun, 12 May 2019 06:23:46 GMT"
