,Title,Date
0,"Abhi Sharma, Weave Communications Inc: Profile and Biography - Bloomberg","Sat, 17 May 2025 14:23:38 GMT"
1,Drugs Could Soon Come With a Money-Back Guarantee - Bloomberg.com - Bloomberg.com,"Wed, 14 May 2025 20:06:03 GMT"
2,- Bloomberg.com,"Mon, 12 May 2025 11:40:36 GMT"
3,AUSTRALIAN BEEF TRADING CENTRE PTY LTD - Bloomberg LEI,"Wed, 23 Apr 2025 17:22:46 GMT"
4,The Real Payoff From an MBA Is Different for Men and Women - Bloomberg,"Tue, 20 Oct 2015 07:00:00 GMT"
5,The Problem With Using Chicago to Make the Case Against Gun Control - Bloomberg,"Tue, 06 Oct 2015 07:00:00 GMT"
6,These Are the Best Business Schools of 2015 - Bloomberg,"Sun, 28 Aug 2016 15:16:59 GMT"
7,STI Quote - Straits Times Index STI - Bloomberg,"Sat, 15 Mar 2014 01:40:33 GMT"
8,Watch Xi Refuses Mark Zuckerberg's Baby Naming Request - Bloomberg,"Mon, 05 Oct 2015 07:00:00 GMT"
9,Transports Alain Cassier - Bloomberg,"Sun, 19 May 2019 11:33:13 GMT"
10,Oklahoma Earthquakes Are a National Security Threat - Bloomberg,"Fri, 23 Oct 2015 07:00:00 GMT"
11,Bank of England’s Fried to head billionaire Kirsh family office | Insights | Bloomberg Professional Services - Bloomberg,"Thu, 15 Oct 2015 07:00:00 GMT"
12,Pilots Can’t Stop Cockpit Video Forever - Bloomberg,"Thu, 08 Oct 2015 07:00:00 GMT"
13,How an F Student Became America’s Most Prolific Inventor - Bloomberg,"Tue, 20 Oct 2015 07:00:00 GMT"
14,"Nespresso, Clooney Promote Coffee in War-Torn South Sudan - Bloomberg","Wed, 07 Oct 2015 07:00:00 GMT"
15,EU's Top Court Rules That Bitcoin Exchange Is Tax-Free - Bloomberg,"Thu, 22 Oct 2015 07:00:00 GMT"
16,The Parking Company Getting Young Japanese to Love Cars - Bloomberg,"Wed, 21 Oct 2015 07:00:00 GMT"
17,"Domino's Creates Its Own Delivery Car With GM, Google Partner - Bloomberg","Wed, 21 Oct 2015 07:00:00 GMT"
18,# 162 Paolo Rocca & family $14.9B - Bloomberg,"Wed, 01 Mar 2017 05:01:12 GMT"
19,How Thailand Became a Global Gender-Change Destination - Bloomberg,"Mon, 26 Oct 2015 07:00:00 GMT"
20,Gross Says Pimco Executives Plotted His Ouster to Get His Bonus - Bloomberg,"Thu, 08 Oct 2015 07:00:00 GMT"
21,"Thomas Stemberg, Founder of Staples Retail Chain, Dies at 66 - Bloomberg","Fri, 23 Oct 2015 07:00:00 GMT"
22,"Amazon to Ban Sale of Apple, Google Video-Streaming Devices - Bloomberg","Thu, 01 Oct 2015 07:00:00 GMT"
23,This 81-Year-Old Teaches Kids to Climb Mountains in Ecuador - Bloomberg,"Fri, 23 Oct 2015 07:00:00 GMT"
24,Right On: John Roberts Is Playing the Long Game - Bloomberg,"Thu, 01 Oct 2015 07:00:00 GMT"
25,Apicil Prevoyance - Bloomberg,"Mon, 13 May 2019 03:12:43 GMT"
26,Europe's Last Dictator Has Become the Darling of the Bond Market - Bloomberg,"Thu, 29 Oct 2015 07:00:00 GMT"
27,Orban Accuses Soros of Stoking Refugee Wave to Weaken Europe - Bloomberg,"Fri, 30 Oct 2015 07:00:00 GMT"
28,Bloomberg UX Expert Bonnie John Discusses Discoverability - Bloomberg,"Wed, 14 Oct 2015 07:00:00 GMT"
29,Cabela's Shares Soar After Activist Elliott Takes 11% Stake - Bloomberg,"Wed, 28 Oct 2015 07:00:00 GMT"
30,Controlling risk by optimizing portfolios - Bloomberg,"Fri, 30 Oct 2015 07:00:00 GMT"
31,Bernstein Launches Pairs Trading Application on the Bloomberg App Portal - Bloomberg,"Thu, 08 Oct 2015 07:00:00 GMT"
32,Lululemon’s Founding Family Gets Revenge With Cashmere - Bloomberg,"Thu, 15 Oct 2015 07:00:00 GMT"
33,Buffett Builds Rail Superhighway to Grab Truck Freight - Bloomberg,"Wed, 07 Oct 2015 07:00:00 GMT"
34,We Found the World's Cheapest Ikea Billy Bookcase - Bloomberg,"Thu, 15 Oct 2015 07:00:00 GMT"
35,These Are the Juiciest Nuggets From Bill Gross's Lawsuit Against Pimco - Bloomberg,"Thu, 08 Oct 2015 07:00:00 GMT"
36,Barry Diller Says He'll Leave the Country If Donald Trump Wins the White House - Bloomberg,"Tue, 06 Oct 2015 07:00:00 GMT"
37,"The 007 Effect: James Bond, the Spy Who Loved Brands - Bloomberg","Mon, 26 Oct 2015 07:00:00 GMT"
38,Bloomberg Billionaires Index - Kumar Birla - Bloomberg,"Wed, 01 Mar 2017 05:01:12 GMT"
39,NYC's Stuyvesant Town Said for Sale With Blackstone Weighing Bid - Bloomberg,"Sat, 17 Oct 2015 07:00:00 GMT"
40,Why Do High-Frequency Traders Cancel So Many Orders? - Bloomberg,"Thu, 08 Oct 2015 07:00:00 GMT"
41,Twitter Names Google Veteran Omid Kordestani as Chairman - Bloomberg,"Wed, 14 Oct 2015 07:00:00 GMT"
42,Lundin Gold Inc - Bloomberg,"Tue, 21 Apr 2015 04:35:51 GMT"
43,Amazon Wants to Know How Its Employees Feel Every Day - Bloomberg,"Fri, 09 Oct 2015 07:00:00 GMT"
44,"Manufacturing Moved South, Then Moved Out - Bloomberg","Wed, 07 Oct 2015 07:00:00 GMT"
45,Apple Acquires Startup Developing Advanced AI for Phones - Bloomberg,"Mon, 05 Oct 2015 07:00:00 GMT"
46,Botswana Grants Asylum to Eritrean Football Team Defectors - Bloomberg,"Wed, 28 Oct 2015 07:00:00 GMT"
47,Sequoia’s Michael Moritz Q&A: Venture Capital Is ‘High-Risk Poker’ - Bloomberg,"Fri, 16 Oct 2015 07:00:00 GMT"
48,It Looks Like Free Money Is Available in the Credit Market - Bloomberg,"Tue, 06 Oct 2015 07:00:00 GMT"
49,Turns Out Ants Are Incredibly Cost-Efficient Urban Planners - Bloomberg,"Thu, 22 Oct 2015 07:00:00 GMT"
50,Meet Three Women Shaking Up How Wall Street Parties for Good - Bloomberg,"Fri, 23 Oct 2015 07:00:00 GMT"
51,Zhongpu Handan Steel Co Ltd - Bloomberg,"Sun, 12 May 2019 03:36:07 GMT"
52,CIT's Thain to Step Down as CEO as Lender Seeks Asset Sales - Bloomberg,"Wed, 21 Oct 2015 07:00:00 GMT"
53,Jehovah's Witnesses - Bloomberg,"Sun, 12 May 2019 00:36:40 GMT"
54,Megabrew by the Numbers: A $106 Billion Deal in Four Charts - Bloomberg,"Tue, 13 Oct 2015 07:00:00 GMT"
55,GD Grafidata Srl - Bloomberg,"Sat, 11 May 2019 09:11:51 GMT"
56,Brecon Synergy Sdn Bhd - Bloomberg,"Sat, 11 May 2019 02:54:32 GMT"
57,Lauak France SASU - Bloomberg,"Sun, 12 May 2019 05:09:33 GMT"
58,Hurricane Patricia Makes Landfall as Mexico Braces for Floods - Bloomberg,"Fri, 23 Oct 2015 07:00:00 GMT"
59,Oversupply and Tighter Lending Threaten Korea's Property Market - Bloomberg,"Tue, 13 Oct 2015 07:00:00 GMT"
60,"FedEx Boosts Holiday Hiring 10% to 55,000 on Package Surge - Bloomberg","Mon, 26 Oct 2015 07:00:00 GMT"
61,GOOG: Alphabet Inc Stock Price Quote - NASDAQ GS - Bloomberg,"Fri, 12 May 2017 18:16:22 GMT"
62,"Yale Endowment Model Thrives as Swensen, Proteges Post Top Gains - Bloomberg","Tue, 06 Oct 2015 07:00:00 GMT"
63,How Bad Will It Get for American Express? - Bloomberg,"Thu, 15 Oct 2015 07:00:00 GMT"
64,The Trading Game - Bloomberg,"Tue, 08 Dec 2015 04:47:56 GMT"
65,Billionaire Singer Lauds Gold as Central Banks Aid Recovery - Bloomberg,"Wed, 14 Oct 2015 07:00:00 GMT"
66,Worldpay Jumps 10 Percent After Biggest U.K. IPO This Year - Bloomberg,"Tue, 13 Oct 2015 07:00:00 GMT"
67,Orbit Drilling Pty Ltd - Bloomberg,"Thu, 16 May 2019 09:26:33 GMT"
68,$50 Oil for 15 Years Isn't What Scares Bank of Russia Governor - Bloomberg,"Wed, 14 Oct 2015 07:00:00 GMT"
69,The Grim Economic Legacy of the Arab Spring Poster Children - Bloomberg,"Tue, 27 Oct 2015 07:00:00 GMT"
70,Carnegie Hall Promotes Mercedes Bass to Acting Chairman - Bloomberg,"Thu, 08 Oct 2015 07:00:00 GMT"
71,Inside the Fitness Boutique That Sells $300 Yoga Pants - Bloomberg,"Thu, 08 Oct 2015 07:00:00 GMT"
72,Bloomberg Service Center - Bloomberg Service Center,"Thu, 22 Oct 2015 03:09:47 GMT"
73,Nike CEO to NBA Owners: Our Gear Will Control Your Temperature - Bloomberg,"Fri, 23 Oct 2015 07:00:00 GMT"
74,Chavez's Disciples Are on a Collision Course - Bloomberg,"Fri, 02 Oct 2015 07:00:00 GMT"
75,"AB InBev, SABMiller Reach Agreement on Acquisition - Bloomberg","Tue, 13 Oct 2015 07:00:00 GMT"
76,2016 Target Weights for the Bloomberg Commodity Index Announced - Bloomberg,"Thu, 29 Oct 2015 07:00:00 GMT"
77,Tmna Services LLC - Bloomberg,"Sun, 12 May 2019 16:40:24 GMT"
78,Certified Forensic Loan Auditors LLC - Bloomberg,"Sat, 11 May 2019 18:11:14 GMT"
79,How Monkeys Became Big Business in Florida - Bloomberg,"Wed, 14 Oct 2015 07:00:00 GMT"
80,JPMorgan Said to Pay Most in $1.86 Billion CDS Settlement - Bloomberg,"Thu, 01 Oct 2015 07:00:00 GMT"
81,What I Wear to Work: Vanna White - Bloomberg,"Thu, 22 Oct 2015 07:00:00 GMT"
82,MTN Shares Fall Most Since 1998 on $5.2 Billion Nigeria Fine - Bloomberg,"Mon, 26 Oct 2015 07:00:00 GMT"
83,Tchaikovsky Distracts From Tension at Carnegie Hall Opening Gala - Bloomberg,"Wed, 07 Oct 2015 07:00:00 GMT"
84,America’s Only Formula 1 Driver on Eating and Training for the Races - Bloomberg,"Fri, 23 Oct 2015 07:00:00 GMT"
85,"Philippines to Modernize Aging Manila Airport, Boost Capacity - Bloomberg","Thu, 08 Oct 2015 07:00:00 GMT"
86,Russia Said to Back Early Syria Vote to Give Assad New Term - Bloomberg,"Thu, 22 Oct 2015 07:00:00 GMT"
87,How The Apprentice Explains Donald Trump's Campaign - Bloomberg,"Thu, 15 Oct 2015 07:00:00 GMT"
88,Bloomberg Billionaires Index - Graeme Hart - Bloomberg,"Wed, 01 Mar 2017 05:01:11 GMT"
89,Market Quotes of the Day on 'Bloomberg ‹GO›' - Bloomberg,"Tue, 06 Oct 2015 07:00:00 GMT"
90,Wait and Weep at Some of the Saddest Bus Stops in America - Bloomberg,"Thu, 01 Oct 2015 07:00:00 GMT"
91,This Startup Tracks America’s Murder Houses - Bloomberg,"Fri, 23 Oct 2015 07:00:00 GMT"
92,Billionaire Paul Tudor Jones to Staff: Learn to Write or I'll Rip Up Your Memo - Bloomberg,"Fri, 23 Oct 2015 07:00:00 GMT"
93,BTV Philippines Debuts - Bloomberg,"Wed, 07 Oct 2015 07:00:00 GMT"
94,Treasurer’s workflow: How a number can become strategy | Insights | Bloomberg Professional Services - Bloomberg,"Fri, 09 Oct 2015 07:00:00 GMT"
95,HAS: Hastings Technology Metals Ltd Stock Price Quote - ASE - Bloomberg - Bloomberg,"Sun, 12 Apr 2015 10:33:42 GMT"
96,EG Group Ltd - Bloomberg,"Sun, 12 May 2019 19:55:24 GMT"
97,Singapore Air to Take World’s Longest Flight Crown From Emirates - Bloomberg,"Tue, 13 Oct 2015 07:00:00 GMT"
98,"Steve Bannon: Vast, Right-Wing Conspirator - Bloomberg","Thu, 08 Oct 2015 07:00:00 GMT"
99,Ackman’s Pershing Square Holdings Loses 15.9% on Valeant - Bloomberg,"Wed, 28 Oct 2015 07:00:00 GMT"
