,Title,Date
0,"Temu Lures More Repeat Customers than EBay, Pressures Amazon - Bloomberg","Tue, 11 Jun 2024 07:00:00 GMT"
1,The Beginning of a New Businessweek Era - Bloomberg,"Tue, 25 Jun 2024 07:00:00 GMT"
2,Nvidia CEO Huang Has Billions at Foundation Where He Logs 1-Hour Weeks - Bloomberg,"Thu, 27 Jun 2024 07:00:00 GMT"
3,AI Isn’t Making Much Money for Software Companies — Yet - Bloomberg,"Wed, 19 Jun 2024 07:00:00 GMT"
4,China Home-Price Slump Accelerates Despite More Stimulus - Bloomberg,"Sun, 16 Jun 2024 07:00:00 GMT"
5,Silicon Valley Is On Alert Over a Proposed AI Bill in California - Bloomberg,"Thu, 06 Jun 2024 07:00:00 GMT"
6,Housing Crises Take a Toll on the World’s Most Liveable Cities - Bloomberg,"Thu, 27 Jun 2024 07:00:00 GMT"
7,Denmark to Tax Emissions From Farmers in Pioneering Move - Bloomberg,"Mon, 24 Jun 2024 07:00:00 GMT"
8,"NYC Has the World’s Worst Traffic Congestion, Costing $9 Billion - Bloomberg","Mon, 24 Jun 2024 07:00:00 GMT"
9,China Stops Publishing Data Highlighting Solar Power Constraints - Bloomberg,"Sun, 30 Jun 2024 07:00:00 GMT"
10,Ukraine’s Vision of Robot Assassins Shows Need for Binding AI Rules - Bloomberg,"Mon, 10 Jun 2024 07:00:00 GMT"
11,Apple’s Push to Infuse Devices With AI Will Take Years to Pay Off - Bloomberg,"Tue, 11 Jun 2024 07:00:00 GMT"
12,"German Unemployment Up More Than Expected, Damping Rebound Hopes - Bloomberg","Tue, 04 Jun 2024 07:00:00 GMT"
13,Target Lowers Bar for Workers to Stop Thefts to as Little as $50 - Bloomberg,"Thu, 27 Jun 2024 07:00:00 GMT"
14,Emmanuel Macron Goes From Towering to Toxic in France - Bloomberg,"Wed, 26 Jun 2024 07:00:00 GMT"
15,Record Labels Sue Two Startups for Training AI Models on Their Songs - Bloomberg,"Mon, 24 Jun 2024 07:00:00 GMT"
16,"Amazon Plans Discount Web Store in Effort to Counter Temu, Shein - Bloomberg","Wed, 26 Jun 2024 07:00:00 GMT"
17,TSMC ADRs Nears $1 Trillion Club Amid Flurry of Target Upgrades - Bloomberg,"Wed, 19 Jun 2024 07:00:00 GMT"
18,AOC Is Getting Too Mainstream for Her Progressive Base - Bloomberg,"Tue, 25 Jun 2024 07:00:00 GMT"
19,Yoshino Explains the Rise of Anti-DEI Litigation - Bloomberg,"Thu, 13 Jun 2024 07:00:00 GMT"
20,Sam Altman-Backed Rain AI Hires Apple Chip Vet to Lead Hardware - Bloomberg,"Thu, 27 Jun 2024 07:00:00 GMT"
21,Shein Confidentially Filed Papers for a Potential London IPO - Bloomberg,"Mon, 24 Jun 2024 07:00:00 GMT"
22,Watch Leaders With Lacqua: Novo Nordisk CEO Lars Fruergaard Jørgensen - Bloomberg,"Thu, 06 Jun 2024 07:00:00 GMT"
23,Bobby Jain Raises $5.3 Billion in Biggest Hedge Fund Debut Since 2018 - Bloomberg,"Mon, 24 Jun 2024 07:00:00 GMT"
24,The Tiny Lab Finding Danger in Your Medicine Cabinet - Bloomberg,"Wed, 05 Jun 2024 07:00:00 GMT"
25,Elon Wants YOU to Have More Babies - Bloomberg,"Fri, 21 Jun 2024 07:00:00 GMT"
26,Russians See Little Fallout After US Sanctions Hit Dollar Exchange Trade - Bloomberg,"Thu, 13 Jun 2024 07:00:00 GMT"
27,"China Property Drag Is Getting Worse, Factory Output Disappoints - Bloomberg","Mon, 17 Jun 2024 07:00:00 GMT"
28,Bloomberg Introduces Sustainability Tools into its Portfolio and Risk Analytics Solutions - Bloomberg,"Thu, 27 Jun 2024 07:00:00 GMT"
29,Sanctioning Russian Oil Tankers Will Raise Moscow’s Shipping Costs - Bloomberg,"Tue, 25 Jun 2024 07:00:00 GMT"
30,What the SCOTUS Camping Decision Means for Local Homelessness Policy - Bloomberg,"Fri, 28 Jun 2024 07:00:00 GMT"
31,DP World Plans $3 Billion Investment in African Ports by 2029 - Bloomberg,"Fri, 14 Jun 2024 07:00:00 GMT"
32,America’s War Machine Can’t Make Basic Artillery Fast Enough - Bloomberg,"Fri, 07 Jun 2024 07:00:00 GMT"
33,Apple Made Once-Unlikely Deal With Sam Altman to Catch Up in AI - Bloomberg,"Wed, 05 Jun 2024 07:00:00 GMT"
34,Bill Gates Says He’s Ready to Put Billions Into Nuclear Power - Bloomberg,"Sun, 16 Jun 2024 07:00:00 GMT"
35,"More AI Founders Looking to Sell Startups, Hugging Face CEO Says - Bloomberg","Thu, 13 Jun 2024 07:00:00 GMT"
36,Netflix’s Advertising Challenge: It Isn’t Big Enough - Bloomberg,"Sun, 23 Jun 2024 07:00:00 GMT"
37,"Russian Real Estate in Finland Pose Security Risk, PM Warns - Bloomberg","Mon, 10 Jun 2024 07:00:00 GMT"
38,"Novogratz Discusses Crypto, Violin Backed Loan - Bloomberg","Tue, 04 Jun 2024 07:00:00 GMT"
39,"New York Police Helicopters Are Flying More, Spent $12.4 Million in 2023 - Bloomberg","Tue, 18 Jun 2024 07:00:00 GMT"
40,SNB Cuts Rate Again to Aid Economy and Stem Gains in Franc - Bloomberg,"Thu, 20 Jun 2024 07:00:00 GMT"
41,Putin’s Flagship Forum Offers Stage to Children of His Elite - Bloomberg,"Wed, 05 Jun 2024 07:00:00 GMT"
42,Bloomberg Named ESG Data Provider of the Year - Americas at the Environmental Finance Sustainable Investment Awards | Press | Bloomberg LP - Bloomberg,"Fri, 28 Jun 2024 07:00:00 GMT"
43,Crypto Startup Funding Overcomes Blow-Ups to Hit $100 Billion - Bloomberg,"Sat, 15 Jun 2024 07:00:00 GMT"
44,ByteDance to Cut 450 Jobs in Indonesia After Tokopedia Deal - Bloomberg,"Tue, 11 Jun 2024 07:00:00 GMT"
45,Russia Is Said to Seek French-Held Uranium Assets in Niger - Bloomberg,"Mon, 03 Jun 2024 07:00:00 GMT"
46,SpaceX Falcon Heavy Launches Satellite to Track Sun Storms - Bloomberg,"Tue, 25 Jun 2024 07:00:00 GMT"
47,山东谊达投资担保发展有限公司 - Bloomberg LEI,"Sat, 19 Apr 2025 02:51:38 GMT"
48,Michigan Central: The Parallel Stories of Detroit and Ford's Pride - Bloomberg,"Fri, 07 Jun 2024 07:00:00 GMT"
49,Bond Traders Boldly Bet on 300 Basis Points of Fed Cuts by March - Bloomberg,"Wed, 26 Jun 2024 07:00:00 GMT"
50,Thailand Unveils Rules to Classify Cannabis as Narcotics Again - Bloomberg,"Tue, 11 Jun 2024 07:00:00 GMT"
51,Bloomberg Launches Regulatory Data Solution Addressing NAIC’s Principles-Based Bond Definition Project - Bloomberg,"Thu, 27 Jun 2024 07:00:00 GMT"
52,Catastrophe Bond Sales Soar as Markets Brace for Unusually Active Hurricane Season - Bloomberg,"Mon, 10 Jun 2024 07:00:00 GMT"
53,China’s Spate of Violence Prompts Outburst of Economic Anxiety - Bloomberg,"Fri, 21 Jun 2024 07:00:00 GMT"
54,"Apple to Debut Passwords App in Challenge to 1Password, LastPass - Bloomberg","Thu, 06 Jun 2024 07:00:00 GMT"
55,"AI’s Power Needs Means New Nuclear Power Tech Can’t Fail, US Energy Official Says - Bloomberg","Tue, 04 Jun 2024 07:00:00 GMT"
56,Hackers Demand as Much as $5 Million From Snowflake Clients - Bloomberg,"Mon, 17 Jun 2024 07:00:00 GMT"
57,"China’s EV Makers Got $231 Billion Aid Over 15 Years, Study Says - Bloomberg","Thu, 20 Jun 2024 07:00:00 GMT"
58,How BRICS Became So Much More Than Just a Slogan - Bloomberg,"Fri, 21 Jun 2024 07:00:00 GMT"
59,China Foreign Direct Investment Falls for 12 Straight Months - Bloomberg,"Fri, 21 Jun 2024 07:00:00 GMT"
60,Stablecoin Issuer Paxos Cuts 20% of Workforce - Bloomberg,"Wed, 12 Jun 2024 07:00:00 GMT"
61,Mubadala Set to Take Controlling Stake in Getir After $250 Million Injection - Bloomberg,"Mon, 24 Jun 2024 07:00:00 GMT"
62,You Can Now Buy Gold Bars From Vending Machines in South Korea - Bloomberg,"Wed, 05 Jun 2024 07:00:00 GMT"
63,Hedge Funds’ Secret Weapon to Fight the SEC Lives in Texas - Bloomberg,"Mon, 17 Jun 2024 07:00:00 GMT"
64,South Africa Risks Losing Billions Pledged for Climate Finance - Bloomberg,"Mon, 24 Jun 2024 07:00:00 GMT"
65,Amsterdam Plans to Remove Chinese-Made Cameras Over Spying Risks - Bloomberg,"Tue, 11 Jun 2024 07:00:00 GMT"
66,Podcast Producers Make Do With Less After Budgets Are Sliced in Half - Bloomberg,"Thu, 06 Jun 2024 07:00:00 GMT"
67,NYC Congestion Pricing Pause Puts Over $15 Billion in MTA Projects at Risk - Bloomberg,"Thu, 20 Jun 2024 07:00:00 GMT"
68,"StanChart Setting Up Spot Crypto Trading Desk for Bitcoin, Ether - Bloomberg","Fri, 21 Jun 2024 07:00:00 GMT"
69,LNG Price Slump Speeds Shift Away From Oil for China’s Trucks - Bloomberg,"Sat, 08 Jun 2024 07:00:00 GMT"
70,Soccer Star Ronaldo Buys Stake in Portuguese Porcelain Maker Vista Alegre - Bloomberg,"Fri, 14 Jun 2024 07:00:00 GMT"
71,Paying Walmart Managers Millions Is Just Good Business - Bloomberg,"Thu, 20 Jun 2024 07:00:00 GMT"
72,"Watch Two Sigma, Freestone Grove on Quant Strategies - Bloomberg","Wed, 26 Jun 2024 07:00:00 GMT"
73,"Nvidia’s 591,078% Rally to Most Valuable Stock Came in Waves - Bloomberg","Tue, 18 Jun 2024 07:00:00 GMT"
74,"Russia Tortured Ukrainians in Crimea, Human Rights Court Rules - Bloomberg","Tue, 25 Jun 2024 07:00:00 GMT"
75,China Floats Perks for German Carmakers to Prevent EV Levies - Bloomberg,"Mon, 24 Jun 2024 07:00:00 GMT"
76,"Macron’s Struggle Has Europe Fretting Over Defense, Ukraine - Bloomberg","Mon, 17 Jun 2024 07:00:00 GMT"
77,How to Stop Getting Hangry and Lose Weight - Bloomberg,"Fri, 28 Jun 2024 07:00:00 GMT"
78,ASML to Ship Its $380 Million Chip Machine to TSMC This Year - Bloomberg,"Wed, 05 Jun 2024 07:00:00 GMT"
79,Paris Loses Crown as Europe’s Biggest Stock Market to London - Bloomberg,"Mon, 17 Jun 2024 07:00:00 GMT"
80,Elon Musk’s xAI to Develop New Supercomputer in Memphis - Bloomberg,"Wed, 05 Jun 2024 07:00:00 GMT"
81,SEC Hedge Fund Fee Disclosure Rule Struck Down by US Court - Bloomberg,"Wed, 05 Jun 2024 07:00:00 GMT"
82,Car Dealerships Across US Halt Services After Cyberattack - Bloomberg,"Wed, 19 Jun 2024 07:00:00 GMT"
83,"Boeing Lost Hundreds of Bad 737 Parts, Whistleblower Says - Bloomberg","Tue, 18 Jun 2024 07:00:00 GMT"
84,Microsoft Backs Startup Focused on Making AI More Efficient - Bloomberg,"Tue, 04 Jun 2024 07:00:00 GMT"
85,Germany Warns Against Trade Barriers as EU Readies EV Tariffs - Bloomberg,"Sat, 08 Jun 2024 07:00:00 GMT"
86,Boeing Said Cleared to Resume Wide-Body Jet Deliveries to China - Bloomberg,"Thu, 27 Jun 2024 07:00:00 GMT"
87,How Glossier Turned a Viral Moment for ‘You’ Perfume Into a Lasting Business - Bloomberg,"Wed, 26 Jun 2024 07:00:00 GMT"
88,North Korea Sends More Trash Balloons Over Border as South Warns of Parasites - Bloomberg,"Mon, 24 Jun 2024 07:00:00 GMT"
89,Microsoft Tells More Clients Russian Hackers Viewed Emails - Bloomberg,"Fri, 28 Jun 2024 07:00:00 GMT"
90,Last-Minute Macron-Scholz Move Enrages EU Leaders at Summit - Bloomberg,"Fri, 28 Jun 2024 07:00:00 GMT"
91,Trump Says He’s Privately Decided Who His Running Mate Will Be - Bloomberg,"Sat, 22 Jun 2024 07:00:00 GMT"
92,McDonald’s Chicken ‘Big Mac’ Trademark Axed in EU - Bloomberg,"Wed, 05 Jun 2024 07:00:00 GMT"
93,Crypto Titans’ $160 Million War Chest Threatens Senate Democrats - Bloomberg,"Fri, 14 Jun 2024 07:00:00 GMT"
94,"After Oil, Russia May Now Be Building a Shadow Fleet for Gas - Bloomberg","Thu, 27 Jun 2024 07:00:00 GMT"
95,South Korea Is Making Weapons Faster and Cheaper Than the US - Bloomberg,"Wed, 05 Jun 2024 07:00:00 GMT"
96,The SEC Is Turning Its Gaze to ‘AI Washing’ - Bloomberg,"Thu, 20 Jun 2024 07:00:00 GMT"
97,Talks to Rework Ukraine $20 Billion Debt Fail to Yield Deal - Bloomberg,"Mon, 17 Jun 2024 07:00:00 GMT"
98,Binance CEO Teng Sees ‘Landmark’ Year as Crypto Goes Mainstream - Bloomberg,"Thu, 13 Jun 2024 07:00:00 GMT"
99,Dating Events Are on the Rise As Young People Abandon the Apps - Bloomberg,"Fri, 28 Jun 2024 07:00:00 GMT"
