,Title,Date
0,‘Sell America’ Is Back as Moody’s Pushes 30-Year Yield to 5% - Bloomberg,"Mon, 19 May 2025 06:34:00 GMT"
1,Nvidia CEO Unveils New Technologies to Protect AI Chip Lead - Bloomberg,"Mon, 19 May 2025 06:34:00 GMT"
2,Japan PM Ishiba Rebuffs Tax Cut Demands With Greek Debt Comparison - Bloomberg,"Mon, 19 May 2025 04:57:00 GMT"
3,"Covid Test, Vaccine Maker Stocks Jump as Cases Surge in Asia - Bloomberg","Mon, 19 May 2025 03:23:00 GMT"
4,Americans in Race for European Residency See Doors Slamming Shut - Bloomberg,"Mon, 19 May 2025 04:00:00 GMT"
5,Alibaba Shares Slide as AI Deal With Apple Faces US Scrutiny - Bloomberg,"Mon, 19 May 2025 03:29:00 GMT"
6,China Consumption Miss Overshadows Factory Strength Amid Tariffs - Bloomberg,"Mon, 19 May 2025 03:35:00 GMT"
7,China Home Prices Drop at Faster Pace in Blow During Trump's Trade War - Bloomberg,"Mon, 19 May 2025 04:10:00 GMT"
8,China’s Luxury Car Brand That’s Come From Behind to Overtake BMW - Bloomberg,"Mon, 19 May 2025 00:56:15 GMT"
9,"China Tells Officials to Rein In Alcohol, Cigarette Spending - Bloomberg","Mon, 19 May 2025 02:55:00 GMT"
10,"Dollar, US Stock Futures Weaker on US Downgrade: Markets Wrap - Bloomberg","Mon, 19 May 2025 07:16:16 GMT"
11,Putin Heads Into Trump Call Confident That Russia Has Upper Hand - Bloomberg,"Mon, 19 May 2025 08:15:25 GMT"
12,"Argentina's Javier Milei Wins Big in Buenos Aires City Vote, Dethroning Macri - Bloomberg","Mon, 19 May 2025 00:07:00 GMT"
13,Chinese Trader Who Made $1.5 Billion on Gold Builds a Giant Bet on Copper - Bloomberg,"Sun, 18 May 2025 23:00:26 GMT"
14,Why Apple Still Hasn’t Cracked AI - Bloomberg,"Sun, 18 May 2025 21:00:28 GMT"
15,Cybersecurity Firm Cyera Valued at $6 Billion in Funding Round - Bloomberg,"Sun, 18 May 2025 21:40:57 GMT"
16,Biden Is Diagnosed With ‘Aggressive’ Form of Prostate Cancer - Bloomberg,"Sun, 18 May 2025 21:46:21 GMT"
17,"Indian Defense Stocks Extend Rally on Earnings Boost, Spending - Bloomberg","Mon, 19 May 2025 05:17:00 GMT"
18,Top Hong Kong Builder Saw Weekend Sales Frenzy After Rates Fell - Bloomberg,"Mon, 19 May 2025 02:36:00 GMT"
19,Gold Gets Bounce From Moody’s US Downgrade After Big Weekly Drop - Bloomberg,"Mon, 19 May 2025 05:05:00 GMT"
20,Joe Biden Has Prostate Cancer. How Serious Is the Disease? - Bloomberg,"Mon, 19 May 2025 04:22:00 GMT"
21,Trump Tax Bill Advances After GOP Deal for Faster Medicaid Cuts - Bloomberg,"Mon, 19 May 2025 04:10:00 GMT"
22,NYC Bankers Who Live in NJ Game Out Commute as Rail Strike Upends RTO Plans - Bloomberg,"Sun, 18 May 2025 18:51:36 GMT"
23,Romanian Centrist Scores Victory Over Far-Right Trump Loyalist - Bloomberg,"Mon, 19 May 2025 06:19:00 GMT"
24,US-China Deal Is a Lesson for the Global South - Bloomberg,"Sun, 18 May 2025 20:00:26 GMT"
25,"Biden Diagnosed With Aggressive Prostate Cancer, NYT Reports - Bloomberg","Sun, 18 May 2025 20:07:25 GMT"
26,China-US Trade Truce Prompts Nations to Consider Tougher Tactics - Bloomberg,"Mon, 19 May 2025 07:38:45 GMT"
27,Houthis Say They Plan to Target Israeli Airports in Coming Hours - Bloomberg,"Sun, 18 May 2025 16:11:03 GMT"
28,"Portugal’s Premier Wins Election, Misses Majority: Exit Polls - Bloomberg","Sun, 18 May 2025 20:22:02 GMT"
29,Warner Bros.’ David Zaslav Tried to Rebrand HBO. It Didn’t Work. - Bloomberg,"Sun, 18 May 2025 22:30:26 GMT"
30,Mini ‘Sell America’ Trade Revived After Moody’s Downgrades US - Bloomberg,"Mon, 19 May 2025 03:35:00 GMT"
31,Modi Could Get Cornered on Trade by the White House - Bloomberg,"Sun, 18 May 2025 19:00:26 GMT"
32,Options Traders Wary of Trump Treat China Rally With Caution - Bloomberg,"Mon, 19 May 2025 00:00:00 GMT"
33,"Russia Detains Oil Tanker That Left Estonia, Report Says - Bloomberg","Sun, 18 May 2025 13:21:31 GMT"
34,Bessent Calls Moody’s ‘Lagging Indicator’ of US Fiscal Health - Bloomberg,"Sun, 18 May 2025 13:15:00 GMT"
35,Crypto High-Rollers Go Big on Bodyguards to Deter Kidnappers - Bloomberg,"Sun, 18 May 2025 13:17:59 GMT"
36,"Warren Buffett to Skip Stage at 2026 Annual Meeting, Omaha Paper Says - Bloomberg","Sun, 18 May 2025 18:17:02 GMT"
37,Wall Street Banks Say Emerging Markets’ Wasted Years Are Over - Bloomberg,"Mon, 19 May 2025 07:54:07 GMT"
38,JPY/USD: Hedge Funds Reload Long Yen Trades Ahead of Kato-Bessent Meeting - Bloomberg,"Mon, 19 May 2025 05:58:00 GMT"
39,Five Key Charts to Watch in Global Commodity Markets This Week - Bloomberg,"Sun, 18 May 2025 21:00:00 GMT"
40,US States Likely to Defy US Downgrade to Keep Top Credit Ratings - Bloomberg,"Sun, 18 May 2025 16:33:15 GMT"
41,"China Gave Pakistan Satellite Support, Indian Defense Group Says - Bloomberg","Sun, 18 May 2025 23:31:16 GMT"
42,"Zelenskiy Meets Vance, Rubio in Rome Ahead of Trump-Putin Call - Bloomberg","Sun, 18 May 2025 15:13:11 GMT"
43,"NJ Transit Makes Deal With Engineers, Ending Three-Day Strike - Bloomberg","Mon, 19 May 2025 00:18:00 GMT"
44,Big Tech Goes From Stock Market’s Safest Bet to Biggest Question - Bloomberg,"Sun, 18 May 2025 12:00:07 GMT"
45,Singapore Bourse Risks Further Delistings Despite New Proposals - Bloomberg,"Mon, 19 May 2025 02:30:00 GMT"
46,"Canada Says Most Tariffs on US Remain, Pushing Back on Oxford Report - Bloomberg","Sun, 18 May 2025 04:52:00 GMT"
47,Capital One Finishes Discover Acquisition After 15-Month Journey - Bloomberg,"Sun, 18 May 2025 12:30:31 GMT"
48,Offshoring AI to the Middle East Could Hand China a Win - Bloomberg,"Sun, 18 May 2025 12:00:29 GMT"
49,Saudi Arabia’s Sabic Is Said to Explore IPO of Its Gas Business - Bloomberg,"Sun, 18 May 2025 07:37:59 GMT"
50,FDA Approves Novavax Covid-19 Shot With Unusual Restrictions - Bloomberg,"Sun, 18 May 2025 02:21:00 GMT"
51,How Apple Fell Behind in the AI Race - Bloomberg,"Sun, 18 May 2025 21:26:17 GMT"
52,"Sara Duterte Wants Impeachment Trial to Go On, Sees ‘Bloodbath’ - Bloomberg","Sun, 18 May 2025 02:20:00 GMT"
53,India Restricts Some Imports from Bangladesh as Ties Suffer - Bloomberg,"Sun, 18 May 2025 06:22:00 GMT"
54,"Mexican Naval Sailboat Hits Brooklyn Bridge, Killing Two Crew - Bloomberg","Sun, 18 May 2025 15:39:15 GMT"
55,"Tusk Ally to Face Populist in Polish Runoff, Exit Poll Shows - Bloomberg","Sun, 18 May 2025 22:17:40 GMT"
56,Trump Loyalist Faces Math Prodigy in Romania Vote: What to Watch - Bloomberg,"Sun, 18 May 2025 04:00:00 GMT"
57,New CLO Managers Are Pouring Into the Market - Bloomberg,"Sat, 17 May 2025 19:00:00 GMT"
58,Australia ‘Up for a Deal’ With the EU After Years of Trade Talks - Bloomberg,"Sun, 18 May 2025 00:20:00 GMT"
59,New York Republican Floats Higher Tax Rate to Pay for SALT - Bloomberg,"Sat, 17 May 2025 17:59:15 GMT"
60,China’s Fossil Fuels Production Retreats From Record Levels - Bloomberg,"Mon, 19 May 2025 03:08:30 GMT"
61,An Artist Lost a $2 Million Crypto Nest Egg in Coinbase’s Hack - Bloomberg,"Sat, 17 May 2025 15:00:00 GMT"
62,The Great Era of Metro Railways Is Just Beginning - Bloomberg,"Sun, 18 May 2025 21:00:26 GMT"
63,"Carry Trade Window Opens on Easing Trade Tensions, Barclays Says - Bloomberg","Mon, 19 May 2025 02:45:00 GMT"
64,Taiwan Seeks LNG Cargoes After Shutting Last Nuclear Reactor - Bloomberg,"Mon, 19 May 2025 04:01:00 GMT"
65,Dubai’s Red-Hot Real Estate Is Starting to Attract Big Name Backers - Bloomberg,"Sun, 18 May 2025 11:11:24 GMT"
66,The AI Hiring Pause Is Officially Here - Bloomberg,"Sat, 17 May 2025 09:00:26 GMT"
67,Iran’s Khamenei Brands Trump a Liar in Escalation of Rhetoric - Bloomberg,"Sat, 17 May 2025 13:27:15 GMT"
68,Grim Economic Outlook Overtakes Solid Earnings as Tariff Disruptions Surface - Bloomberg,"Sat, 17 May 2025 11:00:00 GMT"
69,Traders Ride the Trump Show’s ‘Good Volatility’ - Bloomberg,"Mon, 19 May 2025 04:00:00 GMT"
70,"Beyond Nvidia, Four Things to Know at Asia’s Biggest Tech Show - Bloomberg","Sun, 18 May 2025 00:00:00 GMT"
71,Oil Steadies After Early Surge as Traders Mull Moody’s Downgrade - Bloomberg,"Mon, 19 May 2025 06:02:00 GMT"
72,"Indonesia Rupiah to Extend Rally on Fiscal Hopes, Weak Dollar - Bloomberg","Sun, 18 May 2025 23:50:31 GMT"
73,Wall Street Strategists React to Moody’s US Credit Rating Cut - Bloomberg,"Fri, 16 May 2025 23:03:22 GMT"
74,Goldman Sachs Leads in a Patchy Year for Foreign Banks in Japan - Bloomberg,"Sun, 18 May 2025 22:30:00 GMT"
75,US Loses Last Top Credit Rating With Downgrade From Moody’s - Bloomberg,"Sat, 17 May 2025 05:15:00 GMT"
76,"A Brexit Reset With Big Red Lines? Yes, Minister. - Bloomberg","Mon, 19 May 2025 03:00:00 GMT"
77,Supreme Court Blocks Trump’s Deportations of Venezuelans - Bloomberg,"Fri, 16 May 2025 21:52:37 GMT"
78,Ozempic CEO’s Exit From Novo Started With Teams Call Surprise - Bloomberg,"Fri, 16 May 2025 18:05:00 GMT"
79,CATL Shrugs Off US Blacklisting for Blockbuster Hong Kong Debut - Bloomberg,"Sun, 18 May 2025 00:00:00 GMT"
80,Europe Waits to See Where Trump Swerves to Next on Russia - Bloomberg,"Sat, 17 May 2025 06:34:00 GMT"
81,Apple Denies Blocking ‘Fortnite’ From EU Stores in Epic Dispute - Bloomberg,"Sat, 17 May 2025 03:55:00 GMT"
82,FDA Clears First Blood Test to Diagnose Alzheimer’s Disease - Bloomberg,"Fri, 16 May 2025 21:02:48 GMT"
83,Bulls Regain Appetite for Indian State-Owned Stocks - Bloomberg,"Mon, 19 May 2025 02:48:00 GMT"
84,Trump Says Walmart Shouldn’t Blame Tariffs for Higher Prices - Bloomberg,"Sat, 17 May 2025 16:19:10 GMT"
85,Welcome to the New Nuclear Age. It's Even More Chaotic. - Bloomberg,"Sun, 18 May 2025 12:00:28 GMT"
86,US Says It’s Not Decided Next Steps on NYC’s Congestion Pricing - Bloomberg,"Sat, 17 May 2025 15:25:33 GMT"
87,US Consumer Sentiment Nears Record Low on Inflation Concerns - Bloomberg,"Fri, 16 May 2025 15:39:35 GMT"
88,Abu Dhabi’s ‘Man in Manhattan’ Is Key to Unlocking Trump Deals - Bloomberg,"Fri, 16 May 2025 13:01:49 GMT"
89,UK and EU Poised to Grasp Post-Brexit Reset as Talks Go to Wire - Bloomberg,"Sun, 18 May 2025 21:20:42 GMT"
90,The Big Risk of Not Taking on Enough Risk: Merryn Talks Money - Bloomberg,"Sat, 17 May 2025 05:30:00 GMT"
91,North Sea: The UK Is Taxing an Oil Windfall That Doesn’t Exist - Bloomberg,"Mon, 19 May 2025 04:05:46 GMT"
92,Why OpenAI Is Fueling the Arms Race It Once Warned Against - Bloomberg,"Fri, 16 May 2025 11:00:32 GMT"
93,NYC Bankers Living in NJ Face Monday Chaos Even After Rail Deal - Bloomberg,"Mon, 19 May 2025 01:15:00 GMT"
94,America’s Leading Alien Hunters Depend on AI to Speed Their Search - Bloomberg,"Fri, 16 May 2025 11:00:26 GMT"
95,Tariffs Got You Down? Brush Off the 1930s Playbook. - Bloomberg,"Fri, 16 May 2025 12:00:29 GMT"
96,The Labour Budget Train Wreck Is Fast Approaching - Bloomberg,"Sat, 17 May 2025 06:01:29 GMT"
97,"HSBC Revamps Financing, Advisory to Help Private Credit Push - Bloomberg","Fri, 16 May 2025 11:10:46 GMT"
98,The Old Model of Billionaire Philanthropy Is Ending - Bloomberg,"Fri, 16 May 2025 10:00:27 GMT"
99,Trump Tax Bill Fails in House Panel as GOP Splits on Cost - Bloomberg,"Fri, 16 May 2025 19:26:26 GMT"
