,Title,Date
0,embryo testing - Bloomberg.com - Bloomberg.com,"Wed, 14 May 2025 10:58:38 GMT"
1,Facebook Copies TikTok App to Make Instagram Cool to Teens - Bloomberg News - Bloomberg.com,"Wed, 14 May 2025 02:59:41 GMT"
2,The Rags-to-Riches Journey of Italy’s Ray-Ban Billionaire - Bloomberg,"Fri, 13 May 2022 07:00:00 GMT"
3,Tech Companies Coddled Their Employees. Now They're Firing Them - Bloomberg,"Fri, 13 May 2022 07:00:00 GMT"
4,"Hacker Shows Off a Way to Unlock Tesla Models, Start Cars - Bloomberg","Mon, 16 May 2022 07:00:00 GMT"
5,"Goodbye, Blue House: A New Center of Political Power Is Rising in Seoul - Bloomberg","Sun, 08 May 2022 07:00:00 GMT"
6,Crypto Crowd’s Secret Gala Convenes Outside the Gates of Milken - Bloomberg,"Wed, 04 May 2022 07:00:00 GMT"
7,How $60 Billion in Terra Coins Went Up in Algorithmic Smoke - Bloomberg,"Fri, 20 May 2022 07:00:00 GMT"
8,Obamas and Airbnb CEO Launch $100 Million College Scholarship - Bloomberg,"Mon, 16 May 2022 07:00:00 GMT"
9,Buffalo Massacre Suspect Mapped Plans on Discord App for Months - Bloomberg,"Mon, 16 May 2022 07:00:00 GMT"
10,SEC’s Gensler Says Crypto Exchanges Trading Against Clients - Bloomberg,"Wed, 11 May 2022 07:00:00 GMT"
11,The Math Prodigy Whose Hack Upended DeFi Won’t Give Back His Millions - Bloomberg,"Wed, 18 May 2022 07:00:00 GMT"
12,"Why This Fund Manager Paid $15 Million for a Painting Estimated at $200,000 - Bloomberg","Fri, 13 May 2022 07:00:00 GMT"
13,Power Links to Europe Get New Life in Push to Cut Russian Energy - Bloomberg,"Tue, 31 May 2022 07:00:00 GMT"
14,"Angolan Ruling Party’s Lead Narrows Ahead of Vote, Poll Shows - Bloomberg","Mon, 09 May 2022 07:00:00 GMT"
15,Why Goofy Princeton Reunion Rituals Mean So Much to Me - Bloomberg,"Sun, 22 May 2022 07:00:00 GMT"
16,Buyout Firm Bridgepoint Weighs $2 Billion Sale of Software Provider Kyriba - Bloomberg,"Thu, 19 May 2022 07:00:00 GMT"
17,Ex-Arsenal Star Flamini Takes CEO Role at Own Chemical Startup - Bloomberg,"Wed, 04 May 2022 07:00:00 GMT"
18,Caesars Seeks Over $1 Billion for Famed Las Vegas Flamingo Hotel - Bloomberg,"Wed, 04 May 2022 07:00:00 GMT"
19,How Not to Respond to a Global Food Crisis - Bloomberg,"Fri, 13 May 2022 07:00:00 GMT"
20,Paris Plans to Remove Two Beltway Lanes to Cut Pollution - Bloomberg,"Fri, 20 May 2022 07:00:00 GMT"
21,"After a Pandemic Lull, Prices Soar for Blue Chip Art at Auction - Bloomberg","Tue, 10 May 2022 07:00:00 GMT"
22,Tesla Quarantining Thousands of Workers to Restore China Output - Bloomberg,"Tue, 24 May 2022 07:00:00 GMT"
23,"Marco Rubio Targets Citi, Amazon With Bill on Abortion-Travel Benefits - Bloomberg","Thu, 05 May 2022 07:00:00 GMT"
24,Spence School Faces Revived Suit Over Student Instagram Flap - Bloomberg,"Fri, 06 May 2022 07:00:00 GMT"
25,"What Do Zoomers Like? Pot or Shrooms, Not Booze - Bloomberg","Tue, 31 May 2022 07:00:00 GMT"
26,"Samsung SDI, Stellantis (STLA) Invest $2.5 Billion in US Battery Plant - Bloomberg","Tue, 24 May 2022 07:00:00 GMT"
27,Hong Kong Applications for BNO Visa Jumped During Covid Outbreak - Bloomberg,"Thu, 26 May 2022 07:00:00 GMT"
28,Mexico’s Hottest Resort Towns Struggle With Covid Travel Boom - Bloomberg,"Tue, 10 May 2022 07:00:00 GMT"
29,How New York City Plans to Speed Up its Buses - Bloomberg,"Fri, 27 May 2022 07:00:00 GMT"
30,Salt Bae Restaurant Owner May Sell Stake to Qatar Wealth Fund - Bloomberg,"Tue, 31 May 2022 07:00:00 GMT"
31,Credit Suisse Weighs Removing Gottstein as Soon as This Year - Bloomberg,"Sat, 14 May 2022 07:00:00 GMT"
32,Climate Change Is Making India and Pakistan Heat More Intense - Bloomberg,"Wed, 18 May 2022 07:00:00 GMT"
33,Kids Are Playing Poker Online in Virtual Reality Games — Legally - Bloomberg,"Mon, 16 May 2022 07:00:00 GMT"
34,Norway Sovereign Wealth Fund to Buy 50% of Berlin’s Sony Center - Bloomberg,"Fri, 20 May 2022 07:00:00 GMT"
35,Boeing’s Top Chinese Customer Drops 737 Max From Fleet Plans - Bloomberg,"Tue, 17 May 2022 07:00:00 GMT"
36,Is It Time to Stop Burning Our Garbage? - Bloomberg,"Mon, 23 May 2022 07:00:00 GMT"
37,Turkey’s Biggest City Falls Victim to Cold War With Erdogan - Bloomberg,"Thu, 05 May 2022 07:00:00 GMT"
38,UK Luxury Brands Urge Government to Bring Back Tax-Free Shopping for Tourists - Bloomberg,"Mon, 23 May 2022 07:00:00 GMT"
39,Snap CEO Evan Spiegel's Internal Memo to Staff in Full: Warns of Hiring Slowdown - Bloomberg,"Mon, 23 May 2022 07:00:00 GMT"
40,NYC Says Its Final Goodbye to the Pay Phone - Bloomberg,"Mon, 23 May 2022 07:00:00 GMT"
41,Revolut’s $33 Billion Bank App Hits a Roadblock in Britain - Bloomberg,"Fri, 06 May 2022 07:00:00 GMT"
42,JPMorgan Finds New Use for Blockchain in Trading and Lending - Bloomberg,"Thu, 26 May 2022 07:00:00 GMT"
43,"Elon Musk Turns to Billionaire Backers, Skeptics for Twitter Bid - Bloomberg","Fri, 06 May 2022 07:00:00 GMT"
44,Why Casinos Are Spying on Their Ultra-Rich Clients - Bloomberg,"Tue, 24 May 2022 07:00:00 GMT"
45,This Is the Space Station China is Building to Challenge the US - Bloomberg,"Sun, 29 May 2022 07:00:00 GMT"
46,"Consumer staples’ valuations are extreme, even compared to bonds - Bloomberg","Tue, 17 May 2022 07:00:00 GMT"
47,A US Recession Is Inevitable: Soros' Fitzpatrick - Bloomberg,"Tue, 31 May 2022 07:00:00 GMT"
48,"California, Long Leery of Nuclear Power, Joins Bid to Save It - Bloomberg","Wed, 25 May 2022 07:00:00 GMT"
49,Take the Swaps Off the Balance Sheet - Bloomberg,"Tue, 24 May 2022 07:00:00 GMT"
50,Bridging the Gap: How Alipay+ Is Simplifying Global Payments - Bloomberg Media,"Sun, 29 May 2022 07:00:00 GMT"
51,What You Need to Know About the US Baby Formula Shortage - Bloomberg,"Tue, 17 May 2022 07:00:00 GMT"
52,Terra Flops - Bloomberg,"Wed, 11 May 2022 07:00:00 GMT"
53,The Pandora’s Box of Embryo Testing Is Officially Open - Bloomberg,"Thu, 26 May 2022 07:00:00 GMT"
54,Uber Partners With Tesco for Fast Grocery Delivery in the U.K. - Bloomberg,"Tue, 03 May 2022 07:00:00 GMT"
55,Broadcom-VMware Deal: Michael Dell Becomes Billionaire Kingmaker in the Takeover - Bloomberg,"Mon, 23 May 2022 07:00:00 GMT"
56,Gun Violence in the US Far Exceeds Levels in Other Rich Nations - Bloomberg,"Thu, 26 May 2022 07:00:00 GMT"
57,Croatia Condemns Hungarian Leader for ‘Territorial Aspirations’ - Bloomberg,"Tue, 10 May 2022 07:00:00 GMT"
58,India’s Heatwaves Are Testing the Limits of Human Survival - Bloomberg,"Tue, 03 May 2022 07:00:00 GMT"
59,World Bank Reviews Alleged Abuses by Cambodian Microlenders After Investigation - Bloomberg,"Thu, 05 May 2022 07:00:00 GMT"
60,Why Germany Is Offering a Summer of Cheap Trains - Bloomberg,"Fri, 27 May 2022 07:00:00 GMT"
61,Rivian Manufacturing Executive Departs in Management Shuffle - Bloomberg,"Fri, 27 May 2022 07:00:00 GMT"
62,Bigger Shocks Are Coming With Your Electricity Bills - Bloomberg,"Sun, 22 May 2022 07:00:00 GMT"
63,Musk and Google Add to $2 Billion Boost for Carbon Removal - Bloomberg,"Tue, 03 May 2022 07:00:00 GMT"
64,"EU Countries Call for 1,000 Gigawatts of Solar Energy by 2030 - Bloomberg","Thu, 05 May 2022 07:00:00 GMT"
65,Is This a Mine Elon Musk and Joe Biden Can Both Support? - Bloomberg,"Sun, 08 May 2022 07:00:00 GMT"
66,The Children Left Behind by Long Covid - Bloomberg,"Wed, 04 May 2022 07:00:00 GMT"
67,This Summer’s Hotel Rates Will Keep You Up at Night - Bloomberg,"Wed, 25 May 2022 07:00:00 GMT"
68,Is Tesla ESG? Many funds own it. We say it's not for everyone | Insights | Bloomberg Professional Services - Bloomberg,"Thu, 26 May 2022 07:00:00 GMT"
69,Sri Lanka Inflation Jumps Close to 40% as Shortages Persist - Bloomberg,"Tue, 31 May 2022 07:00:00 GMT"
70,Elon Musk Says Bill Gates Has ‘Multi-Billion Dollar’ Tesla Short Position - Bloomberg,"Fri, 27 May 2022 07:00:00 GMT"
71,Ruble Hits 5-Year High as Gas Buyers Bend to Putin’s Will - Bloomberg,"Fri, 20 May 2022 07:00:00 GMT"
72,Used Cars Become an Expensive Problem for Online Dealers Like Carvana - Bloomberg,"Wed, 18 May 2022 07:00:00 GMT"
73,Surging Dollar Stirs Markets Buzz of a 1980s-Style Plaza Accord - Bloomberg,"Wed, 18 May 2022 07:00:00 GMT"
74,Bloomberg Launches Price Transparency Data Solution Targeting SEC Rule 2a-5 - Bloomberg,"Thu, 12 May 2022 07:00:00 GMT"
75,"Nike Escalates Feud with StockX, Says Site is Selling Fake Shoes - Bloomberg","Wed, 11 May 2022 07:00:00 GMT"
76,Elon Musk’s Fixer Is Quietly Tending the World’s Biggest Fortune - Bloomberg,"Thu, 05 May 2022 07:00:00 GMT"
77,Why Is My Ice Cream Shrinking? Inflation by Stealth - Bloomberg,"Mon, 30 May 2022 07:00:00 GMT"
78,US Growth Seen Outpacing China’s for First Time Since 1976 - Bloomberg,"Thu, 19 May 2022 07:00:00 GMT"
79,Elon Musk Sows Doubt Over His $44 Billion Twitter Takeover - Bloomberg,"Fri, 13 May 2022 07:00:00 GMT"
80,Ethereum Co-Founder Vitalik Buterin Says He’s No Longer a Billionaire - Bloomberg,"Fri, 20 May 2022 07:00:00 GMT"
81,Tree-Boring Beetle Could Cost South Africa $18.5 Billion - Bloomberg,"Wed, 25 May 2022 07:00:00 GMT"
82,China Is on Track to Double Its Solar Panels From Last Year’s Record - Bloomberg,"Mon, 30 May 2022 07:00:00 GMT"
83,The Best Outcome for Ukraine in This Conflict - Bloomberg,"Wed, 25 May 2022 07:00:00 GMT"
84,How Germany’s LNG Terminals Will Morph Into Green Hydrogen Hubs - Bloomberg,"Wed, 11 May 2022 07:00:00 GMT"
85,Redbird Capital Reaches Preliminary Deal to Buy Italy’s AC Milan - Bloomberg,"Fri, 20 May 2022 07:00:00 GMT"
86,Star Alliance Plans Credit Card For Redeeming Points Across 26 Airlines - Bloomberg,"Thu, 12 May 2022 07:00:00 GMT"
87,Rivian (RIVN) Wins $1.5 Billion in State Incentives for Georgia Plant - Bloomberg,"Mon, 02 May 2022 07:00:00 GMT"
88,"Colleges Are Launching TikTok Classes for Influencers Making $5,000 a Post - Bloomberg","Fri, 06 May 2022 07:00:00 GMT"
89,"Sanctions Slow Burn Gives Putin More Time to Be Defiant, for Now - Bloomberg","Wed, 18 May 2022 07:00:00 GMT"
90,CityLab Daily: US Data Shows Largest Traffic Death Yearly Increase - Bloomberg,"Wed, 18 May 2022 07:00:00 GMT"
91,Shell Posts Record Profit on Soaring Oil and Gas Prices - Bloomberg,"Thu, 05 May 2022 07:00:00 GMT"
92,Formula One Finally Found a Way to Get Americans to Care - Bloomberg,"Wed, 04 May 2022 07:00:00 GMT"
93,Millennials Are Saving Golf by Rebranding It - Bloomberg,"Tue, 24 May 2022 07:00:00 GMT"
94,Tough Times Hit Luxury Watch Makers Unable to Meet Demand - Bloomberg,"Wed, 25 May 2022 07:00:00 GMT"
95,Bloomberg Wealth: Hall Capital's Katie Hall - Bloomberg,"Wed, 18 May 2022 07:00:00 GMT"
96,Broadcom Builds $60 Billion Hedge Against Chip Turmoil With VMware Pursuit - Bloomberg,"Wed, 25 May 2022 07:00:00 GMT"
97,Crypto Betting Service Polymarket Taps Ex-CFTC Head as Chair After Agency Probe - Bloomberg,"Thu, 19 May 2022 07:00:00 GMT"
98,Is the SEC Unconstitutional? - Bloomberg,"Thu, 19 May 2022 07:00:00 GMT"
99,Mercedes Makes High-End Luxury Moves That Pose a Few Risks - Bloomberg,"Wed, 25 May 2022 07:00:00 GMT"
