,Title,Date
0,Wabash Valley Resources LLC - Bloomberg,"Tue, 22 Apr 2025 12:56:07 GMT"
1,MARUTI TEXTILE - Bloomberg LEI,"Sat, 19 Apr 2025 22:53:02 GMT"
2,Diamondbacks Owner Says Stopping Trump Tops Selling Tickets - Bloomberg,"Thu, 17 Mar 2016 07:00:00 GMT"
3,Total Play Telecomunicaciones SA de CV - Bloomberg,"Fri, 10 May 2019 04:26:35 GMT"
4,Singapore Air Has Premium Flyers in Its Sights - Bloomberg,"Wed, 02 Mar 2016 08:00:00 GMT"
5,Clearway Energy Group LLC - Bloomberg,"Sat, 11 May 2019 18:06:23 GMT"
6,China Plans 22% Boost for Wind Power Capacity After Record 2015 - Bloomberg,"Mon, 21 Mar 2016 07:00:00 GMT"
7,"With GOP in Disarray, Super-PACs Target Congress - Bloomberg","Tue, 22 Mar 2016 07:00:00 GMT"
8,KGI Securities Singapore Pte Ltd - Bloomberg,"Sun, 12 May 2019 23:26:39 GMT"
9,"Anderson Cooper, Steve Martin Hit Armory as Black Artists Dazzle - Bloomberg","Thu, 03 Mar 2016 08:00:00 GMT"
10,Does Any City Want This 'Asian Cobra Tower'? - Bloomberg,"Wed, 16 Mar 2016 07:00:00 GMT"
11,Simply Delicious Inc - Bloomberg,"Sat, 11 May 2019 08:00:51 GMT"
12,Europe Bets on Robots to Help Care for Seniors - Bloomberg,"Thu, 17 Mar 2016 07:00:00 GMT"
13,Firat Kozok - Bloomberg,"Tue, 22 Mar 2016 07:42:54 GMT"
14,'What the Victorians Threw Away' Catalogs Victorian-Era Trash - Bloomberg,"Tue, 15 Mar 2016 07:00:00 GMT"
15,The U.S. Cities Where College Grads Are Most Likely to Stick Around - Bloomberg,"Tue, 15 Mar 2016 07:00:00 GMT"
16,China Pushes Big State Companies to Leave Overcrowded Beijing - Bloomberg,"Mon, 28 Mar 2016 07:00:00 GMT"
17,Cancerous Bread Scare Entangles Egypt's Effort to End Wheat Spat - Bloomberg,"Tue, 15 Mar 2016 07:00:00 GMT"
18,Broker Genius Inc - Bloomberg,"Tue, 14 May 2019 08:26:19 GMT"
19,Building Infrastructure for More Inclusive Communities - Bloomberg,"Wed, 23 Mar 2016 07:00:00 GMT"
20,Genus Inc - Bloomberg,"Tue, 14 May 2019 07:00:21 GMT"
21,SIMCOE VESEY (NON-PENSION) LTD. - Bloomberg LEI,"Mon, 31 Mar 2025 07:30:26 GMT"
22,Beijing Construction Engineering Group Co Ltd - Bloomberg,"Fri, 10 May 2019 23:43:59 GMT"
23,Macau's Economy Shrinks 20% in 2015 Amid Casino Gaming Slump - Bloomberg,"Thu, 03 Mar 2016 08:00:00 GMT"
24,Palm Springs Treatment Centers LLC - Bloomberg,"Fri, 17 May 2019 11:07:57 GMT"
25,Coca-Cola Cuts CEO Kent's Pay After Revamping Equity Program - Bloomberg,"Fri, 11 Mar 2016 08:00:00 GMT"
26,GlaxoSmithKline CEO Andrew Witty to Retire in March 2017 - Bloomberg,"Thu, 17 Mar 2016 07:00:00 GMT"
27,"Snapchat Adds Voice, Video Calling to Mobile Messaging App - Bloomberg","Tue, 29 Mar 2016 07:00:00 GMT"
28,Orthodox Jews Set Sights on N.J. Town and Angry Residents Resist - Bloomberg,"Mon, 14 Mar 2016 07:00:00 GMT"
29,Southeast Asian Stocks Crawl Back From Bear Market as Funds Buy - Bloomberg,"Fri, 18 Mar 2016 07:00:00 GMT"
30,"The State of Global Diplomacy, Mapped - Bloomberg","Thu, 17 Mar 2016 07:00:00 GMT"
31,How ETF Shares Are Created and Redeemed - Bloomberg,"Mon, 07 Mar 2016 08:00:00 GMT"
32,Hanon Systems Italia Campiglione Srl - Bloomberg,"Sat, 11 May 2019 00:25:52 GMT"
33,Antigua Is the Caribbean’s Little Italy - Bloomberg,"Wed, 16 Mar 2016 07:00:00 GMT"
34,ATP Tower Holdings LLC - Bloomberg,"Mon, 20 May 2024 20:39:11 GMT"
35,Cornell President Elizabeth Garrett Dies of Colon Cancer - Bloomberg,"Mon, 07 Mar 2016 08:00:00 GMT"
36,Porsche Profit Rises 25% to Record as Macan SUV Lifts Sales - Bloomberg,"Fri, 11 Mar 2016 08:00:00 GMT"
37,Anschutz Corp/The - Bloomberg,"Sun, 12 May 2019 05:04:42 GMT"
38,The Future of Twitter: Q&A with Jack Dorsey - Bloomberg,"Mon, 21 Mar 2016 07:00:00 GMT"
39,How Australia’s Ruslan Kogan Built an Off-Brand Online Retail Empire - Bloomberg,"Thu, 10 Mar 2016 08:00:00 GMT"
40,"Oil Pioneer McClendon, Charged in Bid Rigging, Dies in Crash - Bloomberg","Wed, 02 Mar 2016 08:00:00 GMT"
41,Saudi Shows More Signs of Strain as Spending Drops - Bloomberg,"Mon, 28 Mar 2016 07:00:00 GMT"
42,Helvetia Schweizerische Lebensversicherungsgesellschaft AG - Bloomberg,"Sat, 06 Jul 2019 21:11:38 GMT"
43,Adobe Beats Estimates as Demand Surges for Cloud Services - Bloomberg,"Thu, 17 Mar 2016 07:00:00 GMT"
44,"Ireland Sells First 100-Year Bond, Staying on Comeback Trail - Bloomberg","Wed, 30 Mar 2016 07:00:00 GMT"
45,"Colgate, RBC Director Leaves Boards After Cocaine Charges - Bloomberg","Thu, 10 Mar 2016 08:00:00 GMT"
46,Nizas Group Inc. - Bloomberg LEI,"Mon, 30 Nov 2020 17:18:53 GMT"
47,Xi's Washington Visit Crashed by Unwelcome Guest - Bloomberg,"Thu, 31 Mar 2016 07:00:00 GMT"
48,"What Will Become of Levittown, Pennsylvania? - Bloomberg","Tue, 01 Mar 2016 08:00:00 GMT"
49,"BCIP VENTURE ASSOCIATES II-B, LP - Bloomberg LEI","Thu, 06 Feb 2025 20:40:48 GMT"
50,HMU: HMS Bergbau AG Stock Price Quote - Xetra - Bloomberg,"Sat, 22 Mar 2014 09:15:46 GMT"
51,"Petronas May Cut 1,000 Jobs as Oil Slump Prompts Reorganization - Bloomberg","Tue, 01 Mar 2016 08:00:00 GMT"
52,Watch Bloomberg ‹GO› Full Episode (03/24) - Bloomberg,"Thu, 24 Mar 2016 07:00:00 GMT"
53,Cadent Gas Ltd - Bloomberg,"Fri, 10 May 2019 21:23:34 GMT"
54,Shivansh Finserve Ltd - Bloomberg,"Fri, 08 Mar 2019 11:23:21 GMT"
55,The Real Stories of Mt. Everest’s Sherpas - Bloomberg,"Wed, 23 Mar 2016 07:00:00 GMT"
56,"Buy Daniel Craig’s Favorite Bond Car, Now on EBay - Bloomberg","Fri, 18 Mar 2016 07:00:00 GMT"
57,The First U.S. Climate Refugees - Bloomberg,"Sun, 20 Mar 2016 07:00:00 GMT"
58,Missionary Turned Hedge Fund Boss Bets Big on Saving Fukushima - Bloomberg,"Wed, 30 Mar 2016 07:00:00 GMT"
59,Routledge Publishing Ltd - Bloomberg,"Sat, 11 May 2019 11:17:57 GMT"
60,Mapping the Sorry State of America's Bridges - Bloomberg,"Fri, 25 Mar 2016 07:00:00 GMT"
61,Mitt Romney: Trump Plans Would Sink U.S. Into Recession - Bloomberg,"Thu, 03 Mar 2016 08:00:00 GMT"
62,"Stiglitz to Abe: Don't Raise Japan's Sales Tax, Stimulate Growth - Bloomberg","Tue, 15 Mar 2016 07:00:00 GMT"
63,'Statistically Significant' Doesn't Mean 'Right' - Bloomberg,"Fri, 18 Mar 2016 07:00:00 GMT"
64,Marcegaglia Steel SpA - Bloomberg,"Sat, 11 May 2019 02:51:09 GMT"
65,Tesla Motors Chief Spokesman Leaves Ahead of Model 3 Unveil - Bloomberg,"Wed, 16 Mar 2016 07:00:00 GMT"
66,Apple Unveils Smaller-Screened iPhone SE to Jump-Start Sales - Bloomberg,"Mon, 21 Mar 2016 07:00:00 GMT"
67,Buffett Protege Turns to Job Cuts to Revive Berkshire Units - Bloomberg,"Wed, 02 Mar 2016 08:00:00 GMT"
68,Why Five Years in Cuban Prison Sold Alan Gross on Obama Trip - Bloomberg,"Fri, 11 Mar 2016 08:00:00 GMT"
69,"After Historic Singer Deal, Argentina Eyes $15 Billion Bond Sale - Bloomberg","Tue, 01 Mar 2016 08:00:00 GMT"
70,"Fendi Unveils New Rome Palace, Both Store and Boutique Hotel - Bloomberg","Wed, 09 Mar 2016 08:00:00 GMT"
71,FlyDubai Jet Crash Kills 62 in Failed Russia Landing Attempt - Bloomberg,"Sun, 20 Mar 2016 07:00:00 GMT"
72,"Forty Years After Pele, Under Armour Sponsors New York Cosmos - Bloomberg","Thu, 03 Mar 2016 08:00:00 GMT"
73,Bloomberg Women in Technology (BWIT): Bringing Tech to Women and Women to Tech - Bloomberg,"Thu, 17 Mar 2016 07:00:00 GMT"
74,Tapstone's Ward: I Regret Leaving Chesapeake Energy - Bloomberg,"Tue, 29 Mar 2016 07:00:00 GMT"
75,Lion Global Investors Ltd - Bloomberg,"Sat, 11 May 2019 07:12:43 GMT"
76,Trump Switches Florida Rally to Ohio as Protests Shadow Events - Bloomberg,"Sun, 13 Mar 2016 08:00:00 GMT"
77,Burt’s Bees Goes From Big-Box to Upscale - Bloomberg,"Thu, 31 Mar 2016 07:00:00 GMT"
78,Lex Products LLC - Bloomberg,"Sat, 11 May 2019 09:09:02 GMT"
79,Carson Group Holdings LLC - Bloomberg,"Sun, 12 May 2019 00:02:34 GMT"
80,New Pemex CEO Raises Hopes of Contractors for $7 Billion Payment - Bloomberg,"Tue, 15 Mar 2016 07:00:00 GMT"
81,GLOBERIDE Inc - Bloomberg,"Sat, 02 Mar 2019 09:20:24 GMT"
82,Will America Ever Come Around to Loving Roundabouts? - Bloomberg,"Thu, 10 Mar 2016 08:00:00 GMT"
83,Drilling Rig Suppliers Say Oil Recovery Will Be Slower Than Expected - Bloomberg,"Tue, 22 Mar 2016 07:00:00 GMT"
84,Stop-Trump Backers Revealed in FEC Filings - Bloomberg,"Mon, 21 Mar 2016 07:00:00 GMT"
85,South African Growth Weakens Amid Worst Drought in 100 Years - Bloomberg,"Tue, 01 Mar 2016 08:00:00 GMT"
86,Why Michael Jackson’s Neverland Ranch Still Isn’t Sold - Bloomberg,"Fri, 25 Mar 2016 07:00:00 GMT"
87,Philippine Court Clears Presidential Candidacy of Grace Poe - Bloomberg,"Tue, 08 Mar 2016 08:00:00 GMT"
88,Oscar-winning Actress Patty Duke Dies At 69 - Bloomberg,"Tue, 29 Mar 2016 07:00:00 GMT"
89,Ignatius Ssuuna - Bloomberg,"Fri, 18 Mar 2016 20:34:59 GMT"
90,"Andy Grove, Who Taught Silicon Valley How to Do Business, Dies - Bloomberg","Mon, 21 Mar 2016 07:00:00 GMT"
91,The Tipping Point: Creating Opportunities for Women in Business - Bloomberg,"Wed, 23 Mar 2016 07:00:00 GMT"
92,How Washington Got Turkey's Dictator So Wrong - Bloomberg,"Wed, 30 Mar 2016 07:00:00 GMT"
93,Singer Makes 369% of Principal on Argentine Bonds in Debt Offer - Bloomberg,"Tue, 01 Mar 2016 08:00:00 GMT"
94,360-Degree Video Inside New York’s $4 Billion WTC Train Station - Bloomberg,"Fri, 04 Mar 2016 08:00:00 GMT"
95,Watch Canada Goose CEO Dani Reiss on His Success - Bloomberg,"Thu, 17 Mar 2016 07:00:00 GMT"
96,Lavazza Targets $2 Billion of Revenue After Carte Noire Deal - Bloomberg,"Fri, 11 Mar 2016 08:00:00 GMT"
97,Keywords Asia Pvt Ltd - Bloomberg,"Sat, 06 Jul 2019 05:35:15 GMT"
98,EDF Shares Sink as Finance Chief Quits Over U.K. Reactor Project - Bloomberg,"Mon, 07 Mar 2016 08:00:00 GMT"
99,Here's What China's Middle Classes Really Earn — and Spend - Bloomberg,"Wed, 09 Mar 2016 08:00:00 GMT"
