,Title,Date
0,Mark Gurman - Bloomberg,"Thu, 28 Jul 2016 17:53:12 GMT"
1,Star Trading Desk - Bloomberg News - Bloomberg.com,"Mon, 12 May 2025 10:18:36 GMT"
2,Envoy Technologies Inc - Bloomberg,"Fri, 25 Apr 2025 15:49:58 GMT"
3,GBK Corp - Bloomberg,"Fri, 10 May 2019 17:18:46 GMT"
4,Qure.ai Technologies Pvt Ltd - Bloomberg,"Mon, 09 May 2022 12:36:28 GMT"
5,M Group Services Ltd - Bloomberg,"Sun, 12 May 2019 03:20:24 GMT"
6,VidaCaixa SA de Seguros y Reaseguros - Bloomberg,"Sun, 12 May 2019 01:34:43 GMT"
7,Who killed Maurice Spagnoletti? - Bloomberg,"Wed, 06 Jul 2016 07:00:00 GMT"
8,Climbing Walls Are Moving Into a Shopping Center Near You - Bloomberg,"Thu, 14 Jul 2016 07:00:00 GMT"
9,MC FP EQUITY: LVMH Moet Hennessy Louis Vuitton SE Stock Price Quote - EN Paris - Bloomberg,"Fri, 21 Mar 2025 12:47:16 GMT"
10,"Sorry, Fiji: The Caribbean Is Getting Overwater Bungalows, Too - Bloomberg","Wed, 13 Jul 2016 07:00:00 GMT"
11,Elliott Management Is the Mystery Lender Behind Colombian Airline Pledge - Bloomberg,"Tue, 12 Jul 2016 07:00:00 GMT"
12,"Fox’s Megyn Kelly Alleges Ailes Harassed Her, NY Mag Says - Bloomberg","Tue, 19 Jul 2016 07:00:00 GMT"
13,SoftBank Tumble Shaves $1.1 Billion Off Son’s Net Worth: Chart - Bloomberg,"Tue, 19 Jul 2016 07:00:00 GMT"
14,WATCH: 360° Video of Trump's Helicopter Arrival - Bloomberg,"Thu, 21 Jul 2016 07:00:00 GMT"
15,Ericsson Ousts Vestberg as CEO After Turnaround Plans Stall - Bloomberg,"Mon, 25 Jul 2016 07:00:00 GMT"
16,My Venezuela Nightmare: A 30-Day Hunt for Food in a Starving Land - Bloomberg,"Mon, 18 Jul 2016 07:00:00 GMT"
17,U.K. Seals Files on Sixties Profumo Sex Scandal Until 2047 - Bloomberg,"Wed, 20 Jul 2016 07:00:00 GMT"
18,HRA Quote - Horizons Global Risk Parity ETF Fund - Bloomberg,"Mon, 31 Oct 2016 02:11:20 GMT"
19,Nissan Trading Co Ltd - Bloomberg,"Sun, 12 May 2019 06:31:27 GMT"
20,Governance Metrics International - Bloomberg,"Sat, 11 May 2019 09:08:10 GMT"
21,Hawaiki Submarine Cable LP - Bloomberg,"Fri, 10 May 2019 04:17:04 GMT"
22,Western Boxed Meats Distributors Inc - Bloomberg,"Sun, 12 May 2019 08:55:32 GMT"
23,"Donald Trump's Acceptance Speech, Annotated - Bloomberg","Thu, 21 Jul 2016 07:00:00 GMT"
24,ALANDER MANAGEMENT S.à r.l. - LEI: 549300ARADDDNR50NY06 - Bloomberg LEI,"Sat, 01 Mar 2025 19:33:12 GMT"
25,Oldest Asia Railway Plans More Debt Than GDP of Some Nations - Bloomberg,"Mon, 25 Jul 2016 07:00:00 GMT"
26,Moore Capital’s Barna Fired Following Hamptons Party Gone Awry - Bloomberg,"Thu, 07 Jul 2016 07:00:00 GMT"
27,"S&P 500 Rises to All-Time High on Growth Optimism, Stimulus Bets - Bloomberg","Mon, 11 Jul 2016 07:00:00 GMT"
28,KEW Soda Ltd - Bloomberg,"Wed, 31 May 2023 13:49:46 GMT"
29,TUI AG - Bloomberg,"Thu, 28 Feb 2019 00:14:04 GMT"
30,Sun Hung Kai Strategic Capital Ltd - Bloomberg,"Fri, 10 May 2019 17:20:15 GMT"
31,Liberal Online Daters Less Willing to Fall in Love With Conservatives - Bloomberg,"Wed, 13 Jul 2016 07:00:00 GMT"
32,Detroit-Made Bicycles Are Taking Over Bike-Share Programs - Bloomberg,"Wed, 13 Jul 2016 07:00:00 GMT"
33,This $14 Million Ranch Has a Go-Kart Track and a $1 Million Pool - Bloomberg,"Tue, 19 Jul 2016 07:00:00 GMT"
34,Trump’s Rise Pressures Both Parties to Change - Bloomberg,"Fri, 15 Jul 2016 07:00:00 GMT"
35,Emma Rosenblum - Bloomberg,"Tue, 24 Mar 2015 05:02:59 GMT"
36,Pokémon Go Has Created a New Kind of Flâneur - Bloomberg,"Tue, 12 Jul 2016 07:00:00 GMT"
37,German Military Said to Take More Assertive Role in Shift - Bloomberg,"Mon, 11 Jul 2016 07:00:00 GMT"
38,Hillary Clinton: We Just Put the Biggest Crack in That Glass Ceiling - Bloomberg,"Tue, 26 Jul 2016 07:00:00 GMT"
39,"Bullet-Train Plan Banks on Texas Turning More Urban, Less Cowboy - Bloomberg","Thu, 21 Jul 2016 07:00:00 GMT"
40,LGBT Purchasing Power Near $1 Trillion Rivals Other Minorities - Bloomberg,"Wed, 20 Jul 2016 07:00:00 GMT"
41,BBFIT INVESTMENTS PTE. LTD. - Bloomberg LEI,"Thu, 20 Feb 2025 04:27:32 GMT"
42,The Profit Motive Behind Financial Complexity - Bloomberg,"Tue, 12 Jul 2016 07:00:00 GMT"
43,Bloomberg connects to Bank Indonesia’s real-time trade monitoring - Bloomberg,"Tue, 26 Jul 2016 07:00:00 GMT"
44,CVC Capital Partners BV - Bloomberg,"Sun, 12 May 2019 01:56:50 GMT"
45,Gawker Can’t Shield Founder From Hulk Hogan Sex-Tape Verdict - Bloomberg,"Tue, 19 Jul 2016 07:00:00 GMT"
46,The Ugly Battle Over the Wildenstein Art Empire - Bloomberg,"Mon, 11 Jul 2016 07:00:00 GMT"
47,Tyler Cowen - Bloomberg,"Wed, 08 Feb 2017 13:49:22 GMT"
48,Atlantic Lithium Ltd - Bloomberg,"Sat, 11 May 2019 14:13:22 GMT"
49,TAC AB - Bloomberg,"Sun, 12 May 2019 22:07:12 GMT"
50,Goodnight Midstream LLC - Bloomberg,"Tue, 14 May 2019 15:40:39 GMT"
51,FNC: Leonardo SpA Stock Price Quote - Bloomberg,"Sat, 15 Mar 2014 04:29:58 GMT"
52,A Gen-X User Guide to Pokémon Go - Bloomberg,"Mon, 11 Jul 2016 07:00:00 GMT"
53,Israel at a Crossroads as Economy Shifts Away From Manufacturing - Bloomberg,"Tue, 12 Jul 2016 07:00:00 GMT"
54,Americans Blow $27.8 Billion a Year by Being Lazy - Bloomberg,"Thu, 28 Jul 2016 07:00:00 GMT"
55,FWD Life Insurance Corp - Bloomberg,"Fri, 10 May 2019 23:44:33 GMT"
56,Japan’s Largest Lender to Leave Primary Bond Dealer Group - Bloomberg,"Wed, 13 Jul 2016 07:00:00 GMT"
57,Bloomberg Best (and Worst) - Bloomberg,"Thu, 11 Aug 2016 20:45:04 GMT"
58,FCC Notices - Bloomberg,"Thu, 01 Dec 2022 12:57:25 GMT"
59,America Wastes $160 Billion in Food Every Year But Is Too Busy to Stop - Bloomberg,"Fri, 22 Jul 2016 07:00:00 GMT"
60,Chinese Group to Buy Caesars’ Games Unit for $4.4 Billion - Bloomberg,"Sun, 31 Jul 2016 07:00:00 GMT"
61,Morgan Stanley Analyst Says Robo Advisers Are One of the Major Threats to the Industry - Bloomberg,"Wed, 13 Jul 2016 07:00:00 GMT"
62,Daikin Industries Ltd - Bloomberg,"Sat, 15 Mar 2014 00:57:20 GMT"
63,GE Scraps Employee Rating Scale as It Rethinks Annual Reviews - Bloomberg,"Tue, 26 Jul 2016 07:00:00 GMT"
64,Clinton Beats Trump Among College-Educated in Bloomberg Poll - Bloomberg,"Tue, 12 Jul 2016 07:00:00 GMT"
65,Pimco Names Man Group’s Chief Emmanuel Roman as Its New CEO - Bloomberg,"Wed, 20 Jul 2016 07:00:00 GMT"
66,Yum China Holdings Inc - Bloomberg,"Tue, 01 Nov 2016 14:33:35 GMT"
67,Amazon Data Services South Africa (Pty) Ltd - Bloomberg LEI,"Tue, 01 Apr 2025 05:28:31 GMT"
68,That Time Bill Gates Accidentally Shamed Bangkok Into Burying Its Power Lines - Bloomberg,"Mon, 11 Jul 2016 07:00:00 GMT"
69,"Porsche Plans 1,400 New Jobs for Tesla-Fighting Sports Car - Bloomberg","Tue, 26 Jul 2016 07:00:00 GMT"
70,Aramex Founder: Why I Sold My Stake in the Company - Bloomberg,"Sun, 31 Jul 2016 07:00:00 GMT"
71,Ask 7 Cents a Plastic Bag and 90% of English Say ‘No Thanks’ - Bloomberg,"Sat, 30 Jul 2016 07:00:00 GMT"
72,The Eccentric Short-Seller Bill Ackman Describes as 'Certifiably Crazy' - Bloomberg,"Mon, 11 Jul 2016 07:00:00 GMT"
73,Yorick Inc - Bloomberg,"Sun, 12 May 2019 13:47:19 GMT"
74,Elephant Asset Management Ltd - Bloomberg,"Sat, 11 May 2019 06:33:12 GMT"
75,"Elie Wiesel, Auschwitz Survivor Who Wrote for Dead, Dies, 87 - Bloomberg","Sat, 02 Jul 2016 07:00:00 GMT"
76,Lowell Sverige AB - Bloomberg,"Sun, 12 May 2019 07:38:38 GMT"
77,Multilaser Industrial SA - Bloomberg,"Sat, 11 May 2019 08:36:48 GMT"
78,Consilium Marine & Safety AB - Bloomberg,"Fri, 10 May 2019 23:40:48 GMT"
79,Many Unhappy Returns for a $50 Billion Merger - Bloomberg,"Wed, 13 Jul 2016 07:00:00 GMT"
80,FALAH ISPAT - LEI: 3358005J42YW2AMQM241 - Bloomberg LEI,"Thu, 27 Feb 2025 14:55:02 GMT"
81,Circuit Clinical Solutions Inc - Bloomberg,"Thu, 10 Apr 2025 00:29:15 GMT"
82,Saving Fish By Farming Them - Bloomberg,"Thu, 14 Jul 2016 07:00:00 GMT"
83,Japan’s Population Falls by Most Since Records Began in 1968 - Bloomberg,"Wed, 13 Jul 2016 07:00:00 GMT"
84,Hyperloop Sued by Co-Founder Over Claims of Mismanagement - Bloomberg,"Wed, 13 Jul 2016 07:00:00 GMT"
85,Christopher Wood - Bloomberg,"Mon, 25 Jul 2016 07:00:00 GMT"
86,Trump's Manager Is a Master of Post-Soviet Business - Bloomberg,"Wed, 20 Jul 2016 07:00:00 GMT"
87,GATX Corp - Bloomberg,"Thu, 28 Feb 2019 05:55:58 GMT"
88,IBL Ltd/Australia - Bloomberg,"Wed, 15 May 2019 10:39:41 GMT"
89,"Citigroup, HSBC Jettison Customers as Era of Global Empires Ends - Bloomberg","Tue, 26 Jul 2016 07:00:00 GMT"
90,American Phoenix Inc - Bloomberg,"Fri, 10 May 2019 23:41:40 GMT"
91,edotco Investments Labuan Ltd - Bloomberg,"Sat, 11 May 2019 02:51:26 GMT"
92,"Tesla Opens Gigafactory to Expand Battery Production, Sales - Bloomberg","Tue, 26 Jul 2016 07:00:00 GMT"
93,Asian Men Win the Hourly Earnings Race in America - Bloomberg,"Fri, 01 Jul 2016 07:00:00 GMT"
94,"While S&P 500 Hits Record High, Profits Keep Falling: Chart - Bloomberg","Thu, 14 Jul 2016 07:00:00 GMT"
95,Tambrands Inc - Bloomberg,"Sun, 12 May 2019 15:31:31 GMT"
96,Cejn AB - Bloomberg,"Sun, 12 May 2019 11:14:51 GMT"
97,Under Armour Plans ‘Greatest’ Store for NYC’s Former FAO Schwarz - Bloomberg,"Tue, 26 Jul 2016 07:00:00 GMT"
98,The Extraordinary Privilege of the Wealthy Suburbs in Egypt - Bloomberg,"Fri, 01 Jul 2016 07:00:00 GMT"
99,These Stylish Vintage Ads Reveal How Much Car Culture Has Changed - Bloomberg,"Thu, 28 Jul 2016 07:00:00 GMT"
