,Title,Date
0,Kochav Defense Acquisition Corp - Bloomberg,"Fri, 02 May 2025 11:16:18 GMT"
1,"China Plans Export Curbs on Battery Parts, Mineral Technology - Bloomberg","Fri, 03 Jan 2025 08:00:00 GMT"
2,EU’s Von Der Leyen Trying to Clinch Meeting With Trump Ahead of Inauguration - Bloomberg,"Thu, 09 Jan 2025 08:00:00 GMT"
3,LA Wildfire Insurance-Loss Estimates Approach $40 Billion - Bloomberg,"Tue, 14 Jan 2025 08:00:00 GMT"
4,CIA Shifts View on Covid-19 Cause to Lab Leak ‘More Likely’ - Bloomberg,"Sun, 26 Jan 2025 08:00:00 GMT"
5,"Tencent, Guillemot Family Are Said to Mull Ubisoft Asset Venture - Bloomberg","Wed, 15 Jan 2025 08:00:00 GMT"
6,Shell Takes $1 Billion Hit on Wind Farm That Trump Wants ‘Dead’ - Bloomberg,"Thu, 30 Jan 2025 08:00:00 GMT"
7,Orban’s Opponent Magyar Calls For Early Elections in Hungary - Bloomberg,"Wed, 01 Jan 2025 08:00:00 GMT"
8,Markets Sound Alarm Over Deflationary Spiral in China - Bloomberg,"Tue, 07 Jan 2025 08:00:00 GMT"
9,Sonos CEO Leaving After Botched App Revamp Led to Customer Revolt - Bloomberg,"Mon, 13 Jan 2025 08:00:00 GMT"
10,Kash Patel’s Emails Offer Insight Into How He Might Run the FBI - Bloomberg,"Fri, 10 Jan 2025 08:00:00 GMT"
11,The US’s Worst Fears of Chinese Hacking Are on Display in Guam - Bloomberg,"Fri, 03 Jan 2025 08:00:00 GMT"
12,Russia Gets Past US Pressures and Returns to Yuan Surplus (CNY USD) - Bloomberg,"Thu, 30 Jan 2025 08:00:00 GMT"
13,Syria Pushes Russia for Compensation With Talks on Bases Stalled - Bloomberg,"Tue, 28 Jan 2025 08:00:00 GMT"
14,"Trump Holds Off on Immediate China Tariffs, Calls for Study - Bloomberg","Mon, 20 Jan 2025 08:00:00 GMT"
15,Sony Cancels Two More PlayStation Projects in Broader Retreat - Bloomberg,"Thu, 16 Jan 2025 08:00:00 GMT"
16,HongShan Confirms $1.1 Billion Deal to Acquire Rock Icon Marshall - Bloomberg,"Fri, 24 Jan 2025 08:00:00 GMT"
17,"Foxconn, Dixon Urge India to Pay Pending Production Subsidies - Bloomberg","Wed, 08 Jan 2025 08:00:00 GMT"
18,Microsoft Poised to Benefit From Stargate JV With Zero Money - Bloomberg,"Thu, 23 Jan 2025 08:00:00 GMT"
19,"Forget Factories, Small US Towns Want Buc-ee’s Gas Stations - Bloomberg","Thu, 23 Jan 2025 08:00:00 GMT"
20,TikTok Saga Shows Americans Can’t Be Bothered to Take On China - Bloomberg,"Wed, 22 Jan 2025 08:00:00 GMT"
21,Trump Threatens Denmark With Tariffs Over Greenland - Bloomberg,"Tue, 07 Jan 2025 08:00:00 GMT"
22,‘Home Alone’ House Sells Above Asking Price at $5.5 Million - Bloomberg,"Fri, 17 Jan 2025 08:00:00 GMT"
23,"Sam Altman on ChatGPT’s First Two Years, Elon Musk and AI Under Trump - Bloomberg","Mon, 06 Jan 2025 08:00:00 GMT"
24,"BlackRock to Cut About 1% of Its Employees, Staff Memo Says - Bloomberg","Wed, 08 Jan 2025 08:00:00 GMT"
25,"MrBeast, Internet’s Top Creator, Joins New Bid to Buy TikTok - Bloomberg","Tue, 21 Jan 2025 08:00:00 GMT"
26,"Apple Close to Deal to Lift Indonesian iPhone Ban, Minister Says - Bloomberg","Wed, 22 Jan 2025 08:00:00 GMT"
27,Taliban Rejects Trump’s Call to Return US Weapons Worth Billions - Bloomberg,"Tue, 21 Jan 2025 08:00:00 GMT"
28,China Is Scouring the Globe in Search of New Food Suppliers - Bloomberg,"Tue, 14 Jan 2025 08:00:00 GMT"
29,EU’s Top Diplomat Aims to Use Economic Muscle Against Russia - Bloomberg,"Tue, 14 Jan 2025 08:00:00 GMT"
30,"BYD’s Supply Chain Financing Masks Ballooning Debt, GMT Says - Bloomberg","Sun, 19 Jan 2025 08:00:00 GMT"
31,"Saudi Arabia Is Still Assessing BRICS Membership, Minister Says - Bloomberg","Mon, 20 Jan 2025 08:00:00 GMT"
32,Apple’s New App Fees Spark More EU Scrutiny Under Big Tech Rules - Bloomberg,"Mon, 13 Jan 2025 08:00:00 GMT"
33,"Trump Team Readies Oil Sanctions Plan for Russia Deal, Iran Squeeze - Bloomberg","Thu, 16 Jan 2025 08:00:00 GMT"
34,Ukrainian Drone Surge Highlights Russian Oil Refining Risk - Bloomberg,"Fri, 31 Jan 2025 08:00:00 GMT"
35,"Cannabis Cocktails Are Growing Quickly, But the Law Might Stop That Soon - Bloomberg","Tue, 14 Jan 2025 08:00:00 GMT"
36,"Hershey Wants Special Permission to Buy Over 90,000 Metric Tons of Cocoa - Bloomberg","Wed, 08 Jan 2025 08:00:00 GMT"
37,Mistral’s Secret Powerbroker Keeps Europe’s AI Hopes Alive - Bloomberg,"Sun, 26 Jan 2025 08:00:00 GMT"
38,China Said to Consider TikTok US Sale to Elon Musk - Bloomberg,"Mon, 13 Jan 2025 08:00:00 GMT"
39,Wildfire Smoke From the LA Fires Is a Hidden Health Cost - Bloomberg,"Fri, 10 Jan 2025 08:00:00 GMT"
40,What Robotaxis Brought San Francisco - Bloomberg,"Thu, 09 Jan 2025 08:00:00 GMT"
41,Bessent Says He Would Support Sanctioning Russian Oil Majors - Bloomberg,"Thu, 16 Jan 2025 08:00:00 GMT"
42,"NATO Plans to Share Classified Military Information With Industry, EU - Bloomberg","Sun, 26 Jan 2025 08:00:00 GMT"
43,Working Americans Turn to Food Banks as Fed Inflation Battle Drags On - Bloomberg,"Mon, 27 Jan 2025 08:00:00 GMT"
44,A Blueprint for Better Bike Lanes - Bloomberg,"Fri, 10 Jan 2025 08:00:00 GMT"
45,White House Unveils New Curbs on Exporting Nvidia AI Chips - Bloomberg,"Mon, 13 Jan 2025 08:00:00 GMT"
46,Tiffany Workers Mock Forced 'Joy' That Exacerbated Staff Exits - Bloomberg,"Mon, 27 Jan 2025 08:00:00 GMT"
47,European Gas Storage Sites Dwindle at Fastest Pace Since 2018 - Bloomberg,"Mon, 06 Jan 2025 08:00:00 GMT"
48,Biden to Ban More Offshore Oil Drilling Before Trump Arrives - Bloomberg,"Thu, 02 Jan 2025 08:00:00 GMT"
49,FBI Has Warned Agents It Believes Hackers Stole Their Call Logs - Bloomberg,"Thu, 16 Jan 2025 08:00:00 GMT"
50,SoftBank’s Chip Designer Arm Considers Acquiring Ampere Computing - Bloomberg,"Wed, 08 Jan 2025 08:00:00 GMT"
51,"HSBC to Shutter Some Investment Banking Units in Europe, US - Bloomberg","Tue, 28 Jan 2025 08:00:00 GMT"
52,War Ate Up Almost a Quarter of Russia’s Liquid Assets in 2024 - Bloomberg,"Thu, 16 Jan 2025 08:00:00 GMT"
53,How Long Can Toyota Put Off Figuring Out EVs? - Bloomberg,"Tue, 14 Jan 2025 08:00:00 GMT"
54,Mobile AI Apps Are Now a $2 Billion Market Led by ChatGPT - Bloomberg,"Tue, 28 Jan 2025 08:00:00 GMT"
55,Japanese Companies Are Pulling Out All the Stops to Recruit Young Workers - Bloomberg,"Fri, 03 Jan 2025 08:00:00 GMT"
56,"French AI Champion Mistral Isn’t for Sale, CEO Mensch Says - Bloomberg","Tue, 21 Jan 2025 08:00:00 GMT"
57,UK Trade Darling Stenn Went from $900 Million to Insolvency in Days - Bloomberg,"Thu, 09 Jan 2025 08:00:00 GMT"
58,"Disney, Amazon Are in Talks to Stream LA Fires Charity Concert - Bloomberg","Thu, 16 Jan 2025 08:00:00 GMT"
59,Apple CEO Pay Rises 18%; Company Opposes Anti-Diversity Measure - Bloomberg,"Fri, 10 Jan 2025 08:00:00 GMT"
60,Volkswagen Sees €1.5 Billion Cost From EU Emissions Rules - Bloomberg,"Thu, 23 Jan 2025 08:00:00 GMT"
61,Apollo Weighs $9.5 Billion Stake in Seven & i Buyout - Bloomberg,"Thu, 09 Jan 2025 08:00:00 GMT"
62,Investors Seek $5 Billion to Form Basketball League to Rival NBA - Bloomberg,"Wed, 15 Jan 2025 08:00:00 GMT"
63,China Weighs Sale of TikTok's US Operations to Elon Musk as One Possible Option - Bloomberg,"Tue, 14 Jan 2025 08:00:00 GMT"
64,Putin Has Options for Russian Gas After Ukraine Route Closed - Bloomberg,"Mon, 06 Jan 2025 08:00:00 GMT"
65,The White Lotus Is Already Driving a Travel Boom in Thailand - Bloomberg,"Tue, 28 Jan 2025 08:00:00 GMT"
66,"Europe Must Not Rely Too Much on US Energy, Habeck Warns - Bloomberg","Tue, 21 Jan 2025 08:00:00 GMT"
67,"US to Finalize Billions in Funding for Rivian, Plug Before Trump - Bloomberg","Thu, 16 Jan 2025 08:00:00 GMT"
68,Apple Scraps Work on Mac-Connected Augmented Reality Glasses (AAPL) - Bloomberg,"Fri, 31 Jan 2025 08:00:00 GMT"
69,Meta Will Continue to Use Fact Checkers Outside the US ‘for Now’ - Bloomberg,"Mon, 20 Jan 2025 08:00:00 GMT"
70,Trump’s Folly? Greenland for Critical Minerals Is Utter Nonsense - Bloomberg,"Tue, 14 Jan 2025 08:00:00 GMT"
71,EU to Propose Russian Aluminum Ban in Sweeping Sanctions Package - Bloomberg,"Wed, 29 Jan 2025 08:00:00 GMT"
72,Goldman Strategists See Tumbling China Stocks Rising 20% in 2025 - Bloomberg,"Sun, 12 Jan 2025 08:00:00 GMT"
73,iPhone Sales Drop 5% in Holiday Quarter After AI Disappoints - Bloomberg,"Mon, 13 Jan 2025 08:00:00 GMT"
74,STMicro Eyes Workforce Cuts of Up to 6% as Chip Slump Drags On - Bloomberg,"Fri, 31 Jan 2025 08:00:00 GMT"
75,Specter of Trump Tariffs Spurs Interest in US Gas Contracts - Bloomberg,"Thu, 30 Jan 2025 08:00:00 GMT"
76,Oil Declines After Trump Says He’ll Push OPEC to Lower Prices - Bloomberg,"Thu, 23 Jan 2025 08:00:00 GMT"
77,Trump’s Spending Halt Spawns Day of Chaos Before Getting Blocked - Bloomberg,"Tue, 28 Jan 2025 08:00:00 GMT"
78,"Rio Tinto, Glencore Discuss Mining's Biggest-Ever Potential Merger - Bloomberg","Fri, 17 Jan 2025 08:00:00 GMT"
79,Corporate Insiders Dump Shares at Record Pace Amid S&P 500 Rally - Bloomberg,"Fri, 24 Jan 2025 08:00:00 GMT"
80,"Bitcoin Approaches $100,000 as Congress Set to Certify Trump Win - Bloomberg","Mon, 06 Jan 2025 08:00:00 GMT"
81,Fire Agencies to Probe Possible Edison Link to LA Hurst Fire - Bloomberg,"Fri, 10 Jan 2025 08:00:00 GMT"
82,Trump Raised Millions From Crypto Firms for His Inauguration - Bloomberg,"Fri, 31 Jan 2025 08:00:00 GMT"
83,Bitcoin Rallies to Record Level Ahead of Trump’s Inauguration - Bloomberg,"Tue, 21 Jan 2025 08:00:00 GMT"
84,"Meta to Cut Roughly 5% of Staff, Targeting Lowest Performers - Bloomberg","Tue, 14 Jan 2025 08:00:00 GMT"
85,German Economy Shrinks for Second Straight Year Before Election - Bloomberg,"Wed, 15 Jan 2025 08:00:00 GMT"
86,Europe’s Summer Will Bring Worries About Next Winter’s Gas - Bloomberg,"Sun, 05 Jan 2025 08:00:00 GMT"
87,Trump Is Like Putin and Xi: an Imperialist - Bloomberg,"Wed, 29 Jan 2025 08:00:00 GMT"
88,Greek Premier Urges EU to Tackle High Energy Prices Faster - Bloomberg,"Tue, 14 Jan 2025 08:00:00 GMT"
89,NYC Congestion Pricing to Take Effect After Years of Delays - Bloomberg,"Sat, 04 Jan 2025 08:00:00 GMT"
90,Norway to Mandate Bomb Shelters in New Civil Defense Plan - Bloomberg,"Fri, 10 Jan 2025 08:00:00 GMT"
91,"BP Eliminates Thousands Of Jobs In Cost-Cutting Effort, CEO Says - Bloomberg","Thu, 16 Jan 2025 08:00:00 GMT"
92,"EU Plans Tariffs on Agricultural Products From Russia, Belarus - Bloomberg","Tue, 28 Jan 2025 08:00:00 GMT"
93,"As China Spending Falters, Luxury Brands Set Their Sights on Thailand - Bloomberg","Thu, 16 Jan 2025 08:00:00 GMT"
94,Europeans Push Trump to Play a Part in Guarantees for Ukraine - Bloomberg,"Fri, 24 Jan 2025 08:00:00 GMT"
95,Diageo Weighs Options for Guinness in Portfolio Review - Bloomberg,"Fri, 24 Jan 2025 08:00:00 GMT"
96,Oreo-Maker Mondelez’s Apparent Backtrack on Russia Prompts Transparency Concern - Bloomberg,"Thu, 23 Jan 2025 08:00:00 GMT"
97,Musk’s Massive Tesla Lithium Plant Hunts for Water in Drought-Hit Texas - Bloomberg,"Tue, 07 Jan 2025 08:00:00 GMT"
98,Donald Trump Again Calls for EU to Buy More US Energy to Avoid Tariffs - Bloomberg,"Mon, 20 Jan 2025 08:00:00 GMT"
99,China Is Facing Longest Deflation Streak Since Mao Era in 1960s - Bloomberg,"Thu, 16 Jan 2025 08:00:00 GMT"
