,Title,Date
0,Target Is Reopening Its Looted Store With Black Shoppers in Mind - Bloomberg.com,"Wed, 11 Nov 2020 08:00:00 GMT"
1,Customer Centricity Index - Bloomberg Media,"Sat, 16 Apr 2022 10:24:36 GMT"
2,China Gained Ground on India During Bloody Summer in Himalayas - Bloomberg.com,"Sun, 01 Nov 2020 07:00:00 GMT"
3,PNC Parlays Its BlackRock Cash Into $11.6 Billion BBVA Deal - Bloomberg.com,"Mon, 16 Nov 2020 08:00:00 GMT"
4,Iconic Boston Dynamics Robots Seek Stable Employment - Bloomberg.com,"Tue, 17 Nov 2020 08:00:00 GMT"
5,Women Rise to Record Numbers at Top-Ranked Business Schools - Bloomberg.com,"Sun, 15 Nov 2020 08:00:00 GMT"
6,Rusty Pilots Making Flying Errors Is Next Aviation Headache - Bloomberg.com,"Mon, 30 Nov 2020 08:00:00 GMT"
7,CityLab Daily: What’s Next for Shuttered Movie Theaters? - Bloomberg.com,"Mon, 23 Nov 2020 08:00:00 GMT"
8,Elevate Shares 2x Daily Blockchain ETF - Bloomberg.com,"Sun, 22 May 2022 19:15:01 GMT"
9,Will ‘Wonder Woman 1984’ Be the Biggest Movie to Stream Yet? - Bloomberg.com,"Sun, 15 Nov 2020 08:00:00 GMT"
10,Russia Ex-Deputy Minister Buys 75% Stake in Concern Kalashnikov - Bloomberg.com,"Fri, 06 Nov 2020 08:00:00 GMT"
11,America’s Biggest Oil Storage Hub Is Filling to the Brim Again - Bloomberg.com,"Fri, 20 Nov 2020 08:00:00 GMT"
12,Gagosian Director Let Go After Alleged Misconduct Against Women - Bloomberg.com,"Tue, 03 Nov 2020 08:00:00 GMT"
13,UOBK: UOB-Kay Hian Holdings Ltd Stock Price Quote - Singapore - Bloomberg.com,"Sat, 28 Mar 2015 02:53:53 GMT"
14,SoftBank Is in Talks to Sell Robot Maker Boston Dynamics to Hyundai - Bloomberg.com,"Mon, 09 Nov 2020 08:00:00 GMT"
15,Modi Seeks Funding to Build Smarter Indian Cities Post Pandemic - Bloomberg.com,"Tue, 17 Nov 2020 08:00:00 GMT"
16,SEC’s Clayton Plans to Step Down as Chairman at Year’s End - Bloomberg.com,"Mon, 16 Nov 2020 08:00:00 GMT"
17,Identifying Today’s Most Customer-Centric Companies - Bloomberg Media,"Sat, 26 Jun 2021 06:09:24 GMT"
18,The Breakdown - Bloomberg - Bloomberg.com,"Sun, 08 Nov 2020 23:36:39 GMT"
19,Asia’s 20 Richest Families Control $463 Billion - Bloomberg.com,"Sat, 28 Nov 2020 08:00:00 GMT"
20,"Malaysia Places 13,000 Top Glove Workers Under Virus Lockdown - Bloomberg.com","Mon, 16 Nov 2020 08:00:00 GMT"
21,Depression-Era Secrets of Retail Survival - Bloomberg.com,"Fri, 27 Nov 2020 08:00:00 GMT"
22,JP Morgan Securities Asia Pte Ltd/Singapore - Bloomberg.com,"Tue, 14 May 2019 15:07:48 GMT"
23,"Bitcoin Rallies Above $19,000 After Biggest Rout Since Pandemic - Bloomberg.com","Mon, 30 Nov 2020 08:00:00 GMT"
24,Holmes Says Her Wealth Has No Place in Theranos Fraud Trial - Bloomberg.com,"Fri, 20 Nov 2020 08:00:00 GMT"
25,The Best and Worst Places to Be in a World Divided Over Covid - Bloomberg.com,"Tue, 24 Nov 2020 08:00:00 GMT"
26,Zhejiang Seaport International Co Ltd - Bloomberg.com,"Sat, 12 Apr 2025 20:06:53 GMT"
27,Watch The David Rubenstein Show: GSK CEO Emma Walmsley - Bloomberg.com,"Thu, 19 Nov 2020 08:00:00 GMT"
28,Is the Bloomberg Terminal software compatible with MAC OS? | FAQ | Bloomberg Professional Services - Bloomberg.com,"Sun, 15 Nov 2020 12:51:39 GMT"
29,"Philippines Logs 100 Deaths, 25b-Peso Losses From Recent Storms - Bloomberg.com","Mon, 16 Nov 2020 08:00:00 GMT"
30,Foxtron Vehicle Technologies Co Ltd - Company Profile and News - Bloomberg.com,"Thu, 16 Nov 2023 01:48:58 GMT"
31,NRL Real Estate B.V. - Bloomberg LEI,"Sat, 15 Feb 2025 05:06:33 GMT"
32,PG&E’s New CEO Faces Epic Task of Fixing ‘Culture of Ineptitude’ - Bloomberg.com,"Thu, 19 Nov 2020 08:00:00 GMT"
33,California Hits Record; Toronto Locks Down Again: Virus Update - Bloomberg.com,"Fri, 20 Nov 2020 08:00:00 GMT"
34,Biden Plans to Nominate Janet Yellen for Treasury Secretary - Bloomberg.com,"Mon, 23 Nov 2020 08:00:00 GMT"
35,Trump Adviser Leading Post-Election Legal Fight Has Coronavirus - Bloomberg.com,"Mon, 09 Nov 2020 08:00:00 GMT"
36,"AT&T’s CFO to Retire, With WarnerMedia Executive Taking Job - Bloomberg.com","Tue, 17 Nov 2020 08:00:00 GMT"
37,Millions of Facebook Users Pass on $650 Million Privacy Jackpot - Bloomberg.com,"Wed, 25 Nov 2020 08:00:00 GMT"
38,"Global Rich Trigger 1,900% Sales Surge for U.K. Country Estates - Bloomberg.com","Tue, 10 Nov 2020 08:00:00 GMT"
39,Malaysia’s Once-Peripheral King Emerges as Major Political Force - Bloomberg.com,"Sun, 01 Nov 2020 07:00:00 GMT"
40,Tesla (TSLA) Elon Musk Hints Again at Longer-Range Cars and Hatchback for Europe - Bloomberg.com,"Tue, 24 Nov 2020 08:00:00 GMT"
41,Should Millennials and Gen Z Get the Vaccine First? - Bloomberg.com,"Tue, 10 Nov 2020 08:00:00 GMT"
42,Scooter Braun Sells Taylor Swift’s Catalog for $300 Million - Bloomberg.com,"Mon, 16 Nov 2020 08:00:00 GMT"
43,UAE Escalates OPEC Dispute as Tensions on Output Quotas Grow - Bloomberg.com,"Thu, 19 Nov 2020 08:00:00 GMT"
44,Jet fuel demand gets a thrashing until 2026 | Insights | Bloomberg Professional Services - Bloomberg.com,"Wed, 04 Nov 2020 08:00:00 GMT"
45,Trump Was Right to Pardon Michael Flynn - Bloomberg.com,"Wed, 25 Nov 2020 08:00:00 GMT"
46,BlackRock Bets $1 Billion on Personalized Index Investing - Bloomberg.com,"Mon, 23 Nov 2020 08:00:00 GMT"
47,How Suburbs Swung the 2020 Election - Bloomberg.com,"Tue, 17 Nov 2020 08:00:00 GMT"
48,Turkey’s New Banker Delivers Radical Medicine. He Had Little Choice - Bloomberg.com,"Thu, 19 Nov 2020 08:00:00 GMT"
49,Numbers Show We’re Not as Addicted to Fossil Fuels as You Think - Bloomberg.com,"Tue, 17 Nov 2020 08:00:00 GMT"
50,Your Evening Briefing: Steve Mnuchin’s Covid Bailout Bomb Explodes - Bloomberg.com,"Fri, 20 Nov 2020 08:00:00 GMT"
51,JavaScript/TypeScript - Bloomberg.com,"Thu, 03 Mar 2022 00:50:05 GMT"
52,NYC Pilot Tries Mental Health Responders in Place of Police - Bloomberg.com,"Fri, 13 Nov 2020 08:00:00 GMT"
53,Bank That Pioneered Green Bonds Sets Ultimatum for Clients - Bloomberg.com,"Mon, 23 Nov 2020 08:00:00 GMT"
54,Carrier President David Gitlin on Healthy Buildings - Bloomberg.com,"Mon, 30 Nov 2020 08:00:00 GMT"
55,Help Center - Bloomberg.com,"Wed, 11 Nov 2020 16:13:37 GMT"
56,Caution Arises on Rapid Covid Tests in Asymptomatic People - Bloomberg.com,"Wed, 04 Nov 2020 08:00:00 GMT"
57,"Biden Picks John Kerry, Paris Accord Author, as Climate Czar - Bloomberg.com","Mon, 23 Nov 2020 08:00:00 GMT"
58,The Pro-Israel Progressive Movement Notches a Win - Bloomberg.com,"Sun, 15 Nov 2020 08:00:00 GMT"
59,Epidemic Sound Said to Consider Options for Online Music Vault - Bloomberg.com,"Tue, 17 Nov 2020 08:00:00 GMT"
60,One of the Biggest Ever Diamonds Has Been Found in Botswana - Bloomberg.com,"Wed, 11 Nov 2020 08:00:00 GMT"
61,What Janet Yellen Doesn’t Know - Bloomberg.com,"Tue, 24 Nov 2020 08:00:00 GMT"
62,"High-Voltage Power Lines Are Ugly, and the U.S. Needs More - Bloomberg.com","Mon, 30 Nov 2020 08:00:00 GMT"
63,Amundi's Fagan Says ESG Is Becoming Mainstream - Bloomberg.com,"Wed, 18 Nov 2020 08:00:00 GMT"
64,"Like Trump, Biden Is Transactional. That’s Not a Bad Thing. - Bloomberg.com","Mon, 30 Nov 2020 08:00:00 GMT"
65,Lombard Odier Launches $400 Million Natural Capital Equity Fund - Bloomberg.com,"Sun, 15 Nov 2020 08:00:00 GMT"
66,Virus Shouldn’t Be Sole Focus for Biden Economic Aide - Bloomberg.com,"Mon, 30 Nov 2020 08:00:00 GMT"
67,Local volatility in multi dimensions - Bloomberg.com,"Mon, 23 Nov 2020 08:00:00 GMT"
68,"Senegal President Unveils New Cabinet, Retains Finance Chief - Bloomberg.com","Sun, 01 Nov 2020 07:00:00 GMT"
69,Apple Must Ask Why Good Help Is So Hard to Find - Bloomberg.com,"Mon, 09 Nov 2020 08:00:00 GMT"
70,What Biden’s Win Means for Paris Climate Agreement: QuickTake - Bloomberg.com,"Tue, 10 Nov 2020 08:00:00 GMT"
71,Spartz Wins Indiana House Race; Republicans Hold - Bloomberg.com,"Wed, 04 Nov 2020 08:00:00 GMT"
72,Russia’s Richest Man Seeks Global Market for Local Covid-19 Drug - Bloomberg.com,"Tue, 24 Nov 2020 08:00:00 GMT"
73,CF Acquisition Corp A - Bloomberg.com,"Sat, 09 Mar 2019 01:17:36 GMT"
74,S24: Il Sole 24 Ore SpA Stock Price Quote - BrsaItaliana - Bloomberg.com,"Mon, 24 Mar 2014 07:23:24 GMT"
75,Zappos Founder Tony Hsieh Dies at 46; Bezos Mourns Untimely Loss - Bloomberg.com,"Sat, 28 Nov 2020 08:00:00 GMT"
76,Xi Says Economy Can Double as China Lays Out Ambitious Plans - Bloomberg.com,"Tue, 03 Nov 2020 08:00:00 GMT"
77,"Blackpink Is the Biggest Pop Band In the World, A First For South Korea - Bloomberg.com","Tue, 10 Nov 2020 08:00:00 GMT"
78,"Trump Aide Ja’Ron Smith, Highest-Ranking Black Staffer, Departs - Bloomberg.com","Fri, 06 Nov 2020 08:00:00 GMT"
79,Israel Should Invest in Its New Ties to Sudan - Bloomberg.com,"Tue, 24 Nov 2020 08:00:00 GMT"
80,Fear and Greed Paralyze Markets as Traders Seek Next Trigger - Bloomberg.com,"Thu, 19 Nov 2020 08:00:00 GMT"
81,Inside AT&T’s Innovative Programs to Improve Education Access and Close the Homework Gap - Bloomberg Media,"Tue, 14 Dec 2021 12:57:45 GMT"
82,"Zuckerberg, Dorsey to Face Republicans’ Claims of Censorship - Bloomberg.com","Tue, 17 Nov 2020 08:00:00 GMT"
83,"Berkshire Bets on Vaccine Makers in Pandemic, Cuts Banks - Bloomberg.com","Mon, 16 Nov 2020 08:00:00 GMT"
84,Mutant Virus in Mink Raises Doubts About the Future of Fur - Bloomberg.com,"Wed, 11 Nov 2020 08:00:00 GMT"
85,Watch Saudi Aramco Sells $8 Billion in Bonds - Bloomberg.com,"Tue, 17 Nov 2020 08:00:00 GMT"
86,"Nio Tops GM in Market Value, Buoyed by Bets on Electric Future - Bloomberg.com","Thu, 05 Nov 2020 08:00:00 GMT"
87,"Celebrities Are Cashing In on Tequila, But Bruno Mars Bets on Rum - Bloomberg.com","Fri, 20 Nov 2020 08:00:00 GMT"
88,"Dyal, Wafra Set to Buy Minority Stake in Venture Firm NEA - Bloomberg.com","Mon, 30 Nov 2020 08:00:00 GMT"
89,U.S. Trucking Battles Surging Demand and a Dearth of Drivers - Bloomberg.com,"Wed, 11 Nov 2020 08:00:00 GMT"
90,Snap to Pay $1 Million a Day to Creators for Spotlight Videos - Bloomberg.com,"Mon, 23 Nov 2020 08:00:00 GMT"
91,SoftBank Founder Has $80 Billion to Defend His AI Vision - Bloomberg.com,"Tue, 17 Nov 2020 08:00:00 GMT"
92,China Cosmetics Firm Yatsen Pops After $617 Million IPO - Bloomberg.com,"Thu, 19 Nov 2020 08:00:00 GMT"
93,World’s Top Hedge Fund Soars 275% With Bets on China Schools - Bloomberg.com,"Mon, 02 Nov 2020 08:00:00 GMT"
94,"Moderna, Pfizer Shots Look Strong. Here’s How They Stack Up - Bloomberg.com","Mon, 16 Nov 2020 08:00:00 GMT"
95,"Sheldon Solow, Billionaire Real Estate Developer, Dies at 92 - Bloomberg.com","Tue, 17 Nov 2020 08:00:00 GMT"
96,Serie A Agrees Sale of $2 Billion Stake to CVC and Advent - Bloomberg.com,"Wed, 18 Nov 2020 08:00:00 GMT"
97,Glass Shortage Threatens Solar Panels Needed for Climate Fix - Bloomberg.com,"Thu, 05 Nov 2020 08:00:00 GMT"
98,"Universal, Cinemark Agree to Change the Way Movies Are Released - Bloomberg.com","Mon, 16 Nov 2020 08:00:00 GMT"
99,Boeing’s 737 Max Is Back. Are You Willing to Board? - Bloomberg.com,"Wed, 18 Nov 2020 08:00:00 GMT"
