,Title,Date
0,confidentially - Bloomberg.com - Bloomberg.com,"Wed, 14 May 2025 20:08:11 GMT"
1,Gender Neutral Kids Clothing Startups - Bloomberg.com - Bloomberg.com,"Mon, 12 May 2025 11:20:23 GMT"
2,Morgan Stanley Shows Fixed Income 'Has a Pulse': Hawken - Bloomberg,"Mon, 20 Jul 2015 07:00:00 GMT"
3,5 Books About Technical Analysis That Will Help You Make Money - Bloomberg,"Fri, 10 Jul 2015 07:00:00 GMT"
4,Glory Sky Group Ltd - Bloomberg,"Fri, 26 Jul 2019 16:16:48 GMT"
5,How Puerto Rico's Debt Levels Compare With Those of U.S. States - Bloomberg,"Thu, 09 Jul 2015 07:00:00 GMT"
6,Discover a Hidden Champagne Room in London - Bloomberg,"Mon, 13 Jul 2015 07:00:00 GMT"
7,Credit Suisse Private Banking - Bloomberg,"Sun, 12 May 2019 06:09:14 GMT"
8,Oando Energy Services Ltd - Bloomberg,"Sun, 12 May 2019 08:22:54 GMT"
9,Chubb CEO Finnegan Eligible for $93 Million Golden Parachute - Bloomberg,"Wed, 01 Jul 2015 07:00:00 GMT"
10,Ferrari Has An Air-Bag Problem: Leather Skins Glued on Wrong - Bloomberg,"Fri, 17 Jul 2015 07:00:00 GMT"
11,You Are Now Liable for Your Butt Dials - Bloomberg,"Thu, 23 Jul 2015 07:00:00 GMT"
12,Walk Forever While Going Nowhere on Denmark's 'Infinite Bridge' - Bloomberg,"Wed, 15 Jul 2015 07:00:00 GMT"
13,There Holding BV - Bloomberg,"Fri, 10 May 2019 17:20:31 GMT"
14,Schneider Electric Takes Control of Aveva in Software Push - Bloomberg,"Mon, 20 Jul 2015 07:00:00 GMT"
15,The Disastrous Loan Deal That Shows Wall Street Still Has a Wild West - Bloomberg,"Wed, 15 Jul 2015 07:00:00 GMT"
16,The Biggest Mistake AshleyMadison Customers Made: Using Their Credit Cards - Bloomberg,"Mon, 20 Jul 2015 07:00:00 GMT"
17,Edgewell Personal Care Co - Company Profile and News - Bloomberg,"Wed, 27 Feb 2019 22:46:43 GMT"
18,"Virgin Galactic Craft Design Ignored Pilot Risk, Probe Finds - Bloomberg","Tue, 28 Jul 2015 07:00:00 GMT"
19,Sammons Corp - Bloomberg,"Fri, 10 May 2019 22:35:49 GMT"
20,U.S.-Cuba Relations Restored With Signs of Conflicts Still Ahead - Bloomberg,"Mon, 20 Jul 2015 07:00:00 GMT"
21,Ashutosh Joshi - Bloomberg,"Tue, 14 Jul 2015 15:32:11 GMT"
22,Medtronic’s Wireless Pacemaker Goes Straight to the Heart - Bloomberg,"Fri, 10 Jul 2015 07:00:00 GMT"
23,HC Wainwright & Co LLC - Bloomberg,"Sun, 12 May 2019 20:31:01 GMT"
24,Why Russia Vetoed the MH17 Tribunal - Bloomberg,"Thu, 30 Jul 2015 07:00:00 GMT"
25,Reignwood International Investment Group Co Ltd - Bloomberg,"Fri, 10 May 2019 22:34:44 GMT"
26,Are you missing VWAP because of the auctions? - Bloomberg,"Wed, 08 Jul 2015 07:00:00 GMT"
27,"Donald Trump on John McCain: 'I Like People That Weren't Captured, OK?' - Bloomberg","Sat, 18 Jul 2015 07:00:00 GMT"
28,These Superhumans Are Real and Their DNA Could Be Worth Billions - Bloomberg,"Wed, 22 Jul 2015 07:00:00 GMT"
29,The Grateful Dead's Final Farewell Tour - Bloomberg,"Wed, 01 Jul 2015 07:00:00 GMT"
30,The Few Who Won't Say 'Sorry' for Financial Crisis - Bloomberg,"Mon, 27 Jul 2015 07:00:00 GMT"
31,Warren Buffett’s Family Secretly Funded a Birth Control Revolution - Bloomberg,"Thu, 30 Jul 2015 07:00:00 GMT"
32,U.K. to End 300 Years of Deep Coal Mining as Prices Slump - Bloomberg,"Fri, 10 Jul 2015 07:00:00 GMT"
33,You Could Get Arrested for Charging Your Phone - Bloomberg,"Fri, 17 Jul 2015 07:00:00 GMT"
34,How Your Work Crush Can Improve Your Marriage - Bloomberg,"Tue, 28 Jul 2015 07:00:00 GMT"
35,"The Best Tidbits From 3,000 Pages of Hillary Clinton E-mails - Bloomberg","Wed, 01 Jul 2015 07:00:00 GMT"
36,Algorithms Had Themselves a Treasury Flash Crash - Bloomberg,"Mon, 13 Jul 2015 07:00:00 GMT"
37,Joe Mayes - Bloomberg,"Wed, 15 Jul 2015 16:26:55 GMT"
38,Scott Walker Accuses Donald Trump of Using Democratic Talking Points to Attack Him - Bloomberg,"Mon, 27 Jul 2015 07:00:00 GMT"
39,Aims Data Centre Sdn bhd - Bloomberg,"Fri, 10 May 2019 18:24:35 GMT"
40,Zafco FZCO - Bloomberg,"Sat, 11 May 2019 14:52:12 GMT"
41,Micro-Apartments Are Coming to the Midwest - Bloomberg,"Thu, 16 Jul 2015 07:00:00 GMT"
42,"SeaWorld Employee Masqueraded as Animal Activist, Peta Says - Bloomberg","Tue, 14 Jul 2015 07:00:00 GMT"
43,What Does Harper Lee Want? - Bloomberg,"Thu, 09 Jul 2015 07:00:00 GMT"
44,The Corruption at the End of El Chapo's Tunnel - Bloomberg,"Tue, 14 Jul 2015 07:00:00 GMT"
45,Ellen Pao Resigns as Reddit Interim CEO After User Revolt - Bloomberg,"Fri, 10 Jul 2015 07:00:00 GMT"
46,No Really—What’s the Difference Between a Democrat and a Socialist? - Bloomberg,"Fri, 31 Jul 2015 07:00:00 GMT"
47,Trump's Obamacare Replacement Plan Sounds Quite a Bit Like Obamacare - Bloomberg,"Thu, 30 Jul 2015 07:00:00 GMT"
48,Watch YouTube Co-Founder Chad Hurley: (Full Show 7/23) - Bloomberg,"Thu, 23 Jul 2015 07:00:00 GMT"
49,The Prolific History of the Ticker Tape Parade - Bloomberg,"Fri, 10 Jul 2015 07:00:00 GMT"
50,Serta Will Stop Selling Donald Trump Mattress Line in Latest Defection - Bloomberg,"Thu, 02 Jul 2015 07:00:00 GMT"
51,FinClear Pty Ltd - Bloomberg,"Fri, 10 May 2019 23:09:43 GMT"
52,Amazon Envisions Distinct Drone Zones for Future Delivery Fleet - Bloomberg,"Tue, 28 Jul 2015 07:00:00 GMT"
53,SLG LLC - Bloomberg,"Sun, 12 May 2019 00:03:27 GMT"
54,Why Atlantic City Should Trade in Its Casinos for Research Institutes - Bloomberg,"Thu, 23 Jul 2015 07:00:00 GMT"
55,Ohio Farmers Insurance Co - Company Profile and News - Bloomberg,"Wed, 15 May 2019 02:08:19 GMT"
56,How Kitty Fisher’s Became London’s Neighborhood Restaurant - Bloomberg,"Tue, 07 Jul 2015 07:00:00 GMT"
57,CD Projekt SA - Bloomberg,"Sat, 22 Mar 2014 04:41:18 GMT"
58,How Americans Die Abroad - Bloomberg,"Mon, 27 Jul 2015 07:00:00 GMT"
59,State Companies: Back on China’s To-Do List - Bloomberg,"Thu, 30 Jul 2015 07:00:00 GMT"
60,HB Sealing Products Inc - Bloomberg,"Sun, 12 May 2019 23:00:46 GMT"
61,Default Seen Averted in Swaps by Greek Failure to Pay IMF - Bloomberg,"Wed, 01 Jul 2015 07:00:00 GMT"
62,Dongxing Securities Hong Kong Financial Holdings Ltd - Bloomberg,"Fri, 10 May 2019 23:42:44 GMT"
63,NBA Players Get Roomier Chartered Jets as Delta Air Adds Teams - Bloomberg,"Sun, 05 Jul 2015 07:00:00 GMT"
64,Overhaul Group Inc - Bloomberg,"Sat, 11 May 2019 11:17:56 GMT"
65,How Daniel Wellington Made a $200 Million Business Out of Cheap Watches - Bloomberg,"Tue, 14 Jul 2015 07:00:00 GMT"
66,CCV LLC - Bloomberg,"Fri, 10 May 2019 22:42:45 GMT"
67,"Three Modern Takes on the Yuppie, Seventies-Era Cocktail Spot - Bloomberg","Thu, 16 Jul 2015 07:00:00 GMT"
68,Fake News Report Spikes Twitter's Shares - Bloomberg,"Tue, 14 Jul 2015 07:00:00 GMT"
69,Marchionne Sees Ferrari’s Value Exceeding $11 Billion in IPO - Bloomberg,"Fri, 03 Jul 2015 07:00:00 GMT"
70,Global Cast Partners LLC - Bloomberg,"Sun, 19 May 2019 21:44:49 GMT"
71,Subway Planned to Rebrand Jared Fogle as a Family Man Before FBI Raid - Bloomberg,"Thu, 09 Jul 2015 07:00:00 GMT"
72,Galdana Ventures SL - Bloomberg,"Sun, 12 May 2019 01:27:43 GMT"
73,Pedro Martinez Strikes Out a Racial Myth - Bloomberg,"Mon, 27 Jul 2015 07:00:00 GMT"
74,Danielle Bochove - Bloomberg,"Sun, 05 Jul 2015 23:35:41 GMT"
75,Global North American Business LLC - Bloomberg,"Sat, 11 May 2019 08:49:50 GMT"
76,The Perfect Polo for Every Body Type - Bloomberg,"Mon, 27 Jul 2015 07:00:00 GMT"
77,How Berlin’s Futuristic Airport Became a $6 Billion Embarrassment - Bloomberg,"Thu, 23 Jul 2015 07:00:00 GMT"
78,ProAmpac LLC - Bloomberg,"Sat, 11 May 2019 08:10:55 GMT"
79,Amazon Passes Wal-Mart as Biggest Retailer by Market Value - Bloomberg,"Fri, 24 Jul 2015 07:00:00 GMT"
80,Rock Star Restaurateur Gives Natural Wine the Spotlight - Bloomberg,"Tue, 28 Jul 2015 07:00:00 GMT"
81,"Dick Grasso Returns to U.S. Stocks, on a Smaller Stage - Bloomberg","Tue, 28 Jul 2015 07:00:00 GMT"
82,The Midsize Newspaper Is Toast - Bloomberg,"Tue, 28 Jul 2015 07:00:00 GMT"
83,"Venezuela Seizes Nestle, Polar Warehouse to Build Housing - Bloomberg","Thu, 30 Jul 2015 07:00:00 GMT"
84,"Donald Trump's New Hat, Now With More Trumpisms - Bloomberg","Thu, 23 Jul 2015 07:00:00 GMT"
85,Does Hillary Clinton Know What's Best for You? - Bloomberg,"Mon, 13 Jul 2015 07:00:00 GMT"
86,FT Valuation Is Leaps and Bounds Above Washington Post: Real M&A - Bloomberg,"Thu, 23 Jul 2015 07:00:00 GMT"
87,"This Spanish Ghost Airport May Be Sold for Less Than $11,000 - Bloomberg","Fri, 17 Jul 2015 07:00:00 GMT"
88,U.S. Airline Stocks Fall as Antitrust-Probe Report Erases Rally - Bloomberg,"Wed, 01 Jul 2015 07:00:00 GMT"
89,Annie Lee - Bloomberg,"Sun, 26 Jul 2015 18:27:04 GMT"
90,Tesla Adds ‘Ludicrous Mode’ for Drivers With Need for Speed - Bloomberg,"Fri, 17 Jul 2015 07:00:00 GMT"
91,In Defense of Donald Trump (as a Golf Course Owner) - Bloomberg,"Tue, 28 Jul 2015 07:00:00 GMT"
92,This Medical Charity Made $3.3 Billion From a Single Pill - Bloomberg,"Tue, 07 Jul 2015 07:00:00 GMT"
93,Museum Food Has Never Been Better in New York - Bloomberg,"Tue, 14 Jul 2015 07:00:00 GMT"
94,Huawei Technologies South Africa Pty Ltd - Bloomberg,"Thu, 16 May 2019 00:33:47 GMT"
95,"R.I.P., America's Oldest Pizza Hut - Bloomberg","Thu, 23 Jul 2015 07:00:00 GMT"
96,Bridgestone Europe SA - Bloomberg,"Tue, 14 May 2019 15:01:38 GMT"
97,A New Study Finds That 10-Foot Traffic Lanes Are Safer and Still Move Plenty of Cars - Bloomberg,"Tue, 28 Jul 2015 07:00:00 GMT"
98,What Does It Take to Prove Airline Collusion? - Bloomberg,"Thu, 16 Jul 2015 07:00:00 GMT"
99,Chiquita Brands LLC - Bloomberg,"Sun, 12 May 2019 01:03:40 GMT"
