,Title,Date
0,"Thanks to Duke, Durham's Light Rail Dream Is All But Dead - Bloomberg","Thu, 14 Mar 2019 07:00:00 GMT"
1,Nissan Is Said to Have Paid Stanford Tuition for Ghosn Children - Bloomberg.com - Bloomberg.com,"Thu, 15 May 2025 23:09:34 GMT"
2,Swedish Unemployment Rate Rises as Employment Growth Slows - Bloomberg,"Thu, 14 Mar 2019 07:00:00 GMT"
3,Lam Research Corp - Bloomberg,"Sat, 02 Mar 2019 12:46:30 GMT"
4,U.S. Credit Card Debt Closed 2018 at a Record $870 Billion - Bloomberg,"Tue, 05 Mar 2019 08:00:00 GMT"
5,OneCoin Leaders Charged in Multibillion-Dollar Pyramid Scam - Bloomberg,"Fri, 08 Mar 2019 08:00:00 GMT"
6,Keshia Clukey - Bloomberg,"Wed, 27 Mar 2019 11:16:16 GMT"
7,Airwallex Becomes Australia's Third Tech Unicorn - Bloomberg,"Tue, 26 Mar 2019 07:00:00 GMT"
8,Trade Desk Inc/The - Bloomberg,"Thu, 27 Oct 2016 17:31:26 GMT"
9,Boeing’s 737 Max Crisis -- Your Questions Answered - Bloomberg,"Mon, 11 Mar 2019 07:00:00 GMT"
10,"In Tech Race With China, U.S. Universities May Lose a Vital Edge - Bloomberg","Fri, 01 Mar 2019 08:00:00 GMT"
11,Crypto Mining Giant Bitmain Lets Hong Kong IPO Application Lapse - Bloomberg,"Mon, 25 Mar 2019 07:00:00 GMT"
12,EEJPUS5E Quote - JPMorgan ETF Efficiente 5 Index - Bloomberg,"Sat, 14 Mar 2015 03:59:37 GMT"
13,NYC's Trendy Neighborhood Leaps Into Top Five Richest Zip Codes - Bloomberg,"Mon, 04 Mar 2019 08:00:00 GMT"
14,Owen Franks - Bloomberg,"Fri, 15 Mar 2019 13:03:18 GMT"
15,Robots Conquered Stock Markets. Now They’re Coming for Bonds and Currencies - Bloomberg,"Thu, 07 Mar 2019 08:00:00 GMT"
16,Insulting Putin May Now Land You in Jail Under a New Russian Law - Bloomberg,"Mon, 18 Mar 2019 07:00:00 GMT"
17,How Fast Can CalPERS’s $360 Billion Grow? - Bloomberg,"Thu, 21 Mar 2019 07:00:00 GMT"
18,Trump Fails to Deter Lawsuit That Could Force His Testimony - Bloomberg,"Thu, 14 Mar 2019 07:00:00 GMT"
19,Tesla's Model 3 Shatters Record in Electric Car Crazy Norway - Bloomberg,"Tue, 26 Mar 2019 07:00:00 GMT"
20,Tesla Sell-Off Worsens After Elon Musk's Surprise Store Closings - Bloomberg,"Tue, 05 Mar 2019 08:00:00 GMT"
21,The World's Greatest Delivery Empire Made It Cheaper to Order In Than Eat Out - Bloomberg,"Thu, 28 Mar 2019 07:00:00 GMT"
22,Dassault Systemes SE - Bloomberg,"Wed, 13 Mar 2019 04:24:02 GMT"
23,Lego Adapts to Human Behavior That's Wiping Out the Toy Shops - Bloomberg,"Sat, 02 Mar 2019 08:00:00 GMT"
24,Climate Advocates Cheer Trump Policy Shift on Flood Insurance - Bloomberg,"Mon, 18 Mar 2019 07:00:00 GMT"
25,It’s Time to Pay Attention to the Other Cabernet - Bloomberg,"Fri, 01 Mar 2019 08:00:00 GMT"
26,"Elon Musk Should Be Enabled to Step Back From Tesla, Investor Says - Bloomberg","Tue, 05 Mar 2019 08:00:00 GMT"
27,Hamas - Bloomberg,"Mon, 25 Mar 2019 07:00:00 GMT"
28,Wells Fargo’s CEO Search: Here Are Likely Outside Candidates - Bloomberg,"Fri, 29 Mar 2019 07:00:00 GMT"
29,Hong Kong Subway Trains Collide During Test of Signaling System - Bloomberg,"Mon, 18 Mar 2019 07:00:00 GMT"
30,Bugatti Wants to Make a Car That Is … Not Super - Bloomberg,"Wed, 13 Mar 2019 07:00:00 GMT"
31,Why Are Economists So Bad at Forecasting Recessions? - Bloomberg,"Wed, 27 Mar 2019 07:00:00 GMT"
32,International Container Terminal Services Inc - Company Profile and News - Bloomberg,"Sat, 02 Mar 2019 09:21:54 GMT"
33,"Hulu, YouTube Are Said to Snare 3 Million Customers for Live TV - Bloomberg","Fri, 01 Mar 2019 08:00:00 GMT"
34,Former Mt. Gox CEO Mark Karpeles Gets Suspended Jail Term - Bloomberg,"Thu, 14 Mar 2019 07:00:00 GMT"
35,What Broke Venezuela’s Economy and What Could Fix It: QuickTake - Bloomberg,"Sat, 09 Mar 2019 08:00:00 GMT"
36,Mustapha Adamu - Bloomberg,"Tue, 19 Mar 2019 14:35:01 GMT"
37,Holcim AG - Bloomberg,"Tue, 12 Mar 2019 01:28:05 GMT"
38,"The Undersea Cable Market Is Booming Again, This Time Funded by Big Tech - Bloomberg","Wed, 13 Mar 2019 07:00:00 GMT"
39,Li Ka-Shing's Son Stumbles in Year Since Father’s Retirement - Bloomberg,"Thu, 21 Mar 2019 07:00:00 GMT"
40,Everything You Wanted to Know About Mormon Temple Architecture - Bloomberg,"Thu, 21 Mar 2019 07:00:00 GMT"
41,Apple's Tim Cook Changes His Twitter Name to ‘Tim Apple’ - Bloomberg,"Thu, 07 Mar 2019 08:00:00 GMT"
42,Tesla Joins Apple in Trade Secret Cases Tied to China's Xpeng - Bloomberg,"Thu, 21 Mar 2019 07:00:00 GMT"
43,Airbus Secures $35 Billion China Deal in New Blow to Boeing - Bloomberg,"Tue, 26 Mar 2019 07:00:00 GMT"
44,China Calls for U.S. and European Companies to Join Belt and Road - Bloomberg,"Thu, 14 Mar 2019 07:00:00 GMT"
45,McDonald's $300 Million Tech Deal Will Revolutionize Menus - Bloomberg,"Tue, 26 Mar 2019 07:00:00 GMT"
46,Housing Is a Magnet for Money Launderers in Toronto: Study - Bloomberg,"Thu, 21 Mar 2019 07:00:00 GMT"
47,Yelena Shulyatyeva - Bloomberg,"Mon, 04 Mar 2019 14:44:06 GMT"
48,Disillusioned Bureaucrats Are Fleeing China’s Ministries - Bloomberg,"Mon, 11 Mar 2019 07:00:00 GMT"
49,Deutsche Bank Asset Management Arm Gets Allianz Interest - Bloomberg,"Sat, 16 Mar 2019 07:00:00 GMT"
50,"After a Sex Scandal, 500 Startups and Its Former CEO Plan Their Next Acts - Bloomberg","Mon, 25 Mar 2019 07:00:00 GMT"
51,Sackler Family Accused in New Suit of Causing Opioid Crisis - Bloomberg,"Wed, 20 Mar 2019 07:00:00 GMT"
52,You Need a Big Tower to Trade Stocks - Bloomberg,"Mon, 11 Mar 2019 07:00:00 GMT"
53,"Trump Tried to Undo North Korea Penalty, Contrary to U.S. Account - Bloomberg","Tue, 26 Mar 2019 07:00:00 GMT"
54,Here’s How the Quants Might Pick NCAA Basketball Winners - Bloomberg,"Tue, 19 Mar 2019 07:00:00 GMT"
55,U.S. Fourth-Quarter Growth Revised Down to 2.2% From 2.6% - Bloomberg,"Thu, 28 Mar 2019 07:00:00 GMT"
56,East West Banking Corp - Bloomberg,"Sat, 02 Mar 2019 12:46:34 GMT"
57,EFPLUS5D Quote - J.P. Morgan Efficiente Plus DS 5 Index (Net ER) - Bloomberg,"Thu, 27 Oct 2016 21:48:43 GMT"
58,JPMorgan Hack Suspect Is Helping the U.S. Here's What He May Offer - Bloomberg,"Sat, 16 Mar 2019 07:00:00 GMT"
59,"Chipotle, Panera Turn to Drive-Thrus With Fast-Food Stigma Fading - Bloomberg","Thu, 28 Mar 2019 07:00:00 GMT"
60,"Tesla Staff’s Lost Workdays Triple on Factory Injuries, Illness - Bloomberg","Tue, 19 Mar 2019 07:00:00 GMT"
61,JPMRDIAN Quote - J.P. Morgan Meridian Index - Bloomberg,"Fri, 20 Jan 2017 12:14:26 GMT"
62,Denmark Wants a New Route for Nord Stream 2 Gas Pipeline - Bloomberg,"Thu, 28 Mar 2019 07:00:00 GMT"
63,World’s Longest Undersea Rail Tunnel Gets $17 Billion in Funding - Bloomberg,"Thu, 07 Mar 2019 08:00:00 GMT"
64,Intuitive Surgical Inc - Bloomberg,"Sat, 02 Mar 2019 09:15:37 GMT"
65,"How the Bauhaus Kept the Nazis at Bay, Until It Couldn’t - Bloomberg","Mon, 11 Mar 2019 07:00:00 GMT"
66,Google's Page Allegedly Gave Rubin $150 Million Stock Award - Bloomberg,"Mon, 11 Mar 2019 07:00:00 GMT"
67,Repsol SA - Bloomberg,"Mon, 25 Mar 2019 17:26:01 GMT"
68,Paige Smith - Bloomberg,"Wed, 06 Mar 2019 11:15:57 GMT"
69,"Kazakh Leader Nazarbayev Quits Presidency, Retains Key Posts - Bloomberg","Wed, 20 Mar 2019 07:00:00 GMT"
70,Snap Inc - Bloomberg,"Sat, 02 Mar 2019 02:40:09 GMT"
71,How the Reimanns Can Atone for Their Nazi Past - Bloomberg,"Tue, 26 Mar 2019 07:00:00 GMT"
72,Netanyahu’s Challenger Has a Major Handicap - Bloomberg,"Sun, 17 Mar 2019 07:00:00 GMT"
73,The World's Dirtiest Air Is in India Where Pollution Costs Lives - Bloomberg,"Mon, 04 Mar 2019 08:00:00 GMT"
74,Be Careful Wearing Jeans at Goldman - Bloomberg,"Wed, 06 Mar 2019 08:00:00 GMT"
75,Corporate America Can't Afford to Ignore Gen Z - Bloomberg,"Fri, 29 Mar 2019 07:00:00 GMT"
76,"Mylan Must Face Narrowed EpiPen Class-Action Suit, Judge Rules - Bloomberg","Fri, 29 Mar 2019 07:00:00 GMT"
77,American Farmers Confront a Mental Health Crisis - Bloomberg,"Wed, 20 Mar 2019 07:00:00 GMT"
78,CVS Distribution of CBD Products Sends Curaleaf Shares Soaring - Bloomberg,"Thu, 21 Mar 2019 07:00:00 GMT"
79,People Are Living in Illegal Steel Boxes in the World’s Priciest Property Market - Bloomberg,"Thu, 07 Mar 2019 08:00:00 GMT"
80,Restricting Gun Sales Cost Dick's $150 Million Last Year - Bloomberg,"Fri, 29 Mar 2019 07:00:00 GMT"
81,China Animation Appetite Draws Pioneers Back to Bilibili Board - Bloomberg,"Fri, 01 Mar 2019 08:00:00 GMT"
82,"In Fatberg Fight, NYC Goes to War Against Flushable Wipes - Bloomberg","Thu, 14 Mar 2019 07:00:00 GMT"
83,"Trump Complained That Puerto Rico Has Gotten Too Much Aid, Senators Say - Bloomberg","Tue, 26 Mar 2019 07:00:00 GMT"
84,Malls Take a 48-Hour Beating as Retailers Cull Over 300 Stores - Bloomberg,"Fri, 01 Mar 2019 08:00:00 GMT"
85,Axis Bank Ltd - Bloomberg,"Sat, 02 Mar 2019 12:47:30 GMT"
86,Singapore Plans to Move Facilities Underground to Free Space for Housing - Bloomberg,"Wed, 27 Mar 2019 07:00:00 GMT"
87,Dick's Sporting Goods Is Removing Even More Guns From Stores - Bloomberg,"Tue, 12 Mar 2019 07:00:00 GMT"
88,London HIV Patient's Remission Spurs Hope for Curing AIDS - Bloomberg,"Tue, 05 Mar 2019 08:00:00 GMT"
89,China Steel Corp - Bloomberg,"Sun, 03 Mar 2019 11:58:32 GMT"
90,The Fed Versus the Narrow Bank - Bloomberg,"Fri, 08 Mar 2019 08:00:00 GMT"
91,Erdogan’s ‘New Turkey’ Has Left Millions Unmoored - Bloomberg,"Wed, 27 Mar 2019 07:00:00 GMT"
92,JMOZUSD Quote - J.P. Morgan Mozaic USD Index - Bloomberg,"Thu, 14 May 2015 01:30:29 GMT"
93,Ferrovial SE - Bloomberg,"Sat, 02 Mar 2019 12:46:31 GMT"
94,Warriors Make $2 Billion From New Arena Even Before Doors Open - Bloomberg,"Thu, 28 Mar 2019 07:00:00 GMT"
95,Chinese Buyers Helped Boost Australian Home Prices. Now They're Leaving - Bloomberg,"Thu, 07 Mar 2019 08:00:00 GMT"
96,Mark Wahlberg Backs Australian Fitness Franchise F45 Training - Bloomberg,"Mon, 18 Mar 2019 07:00:00 GMT"
97,The Billionaire Behind the Dakota Access Pipeline Is a Little Lonely - Bloomberg,"Wed, 27 Mar 2019 07:00:00 GMT"
98,Norway’s Oil Disposal Drama Descends Into Farce - Bloomberg,"Fri, 08 Mar 2019 08:00:00 GMT"
99,Douglas Cliggott - Bloomberg,"Fri, 08 Mar 2019 08:00:00 GMT"
