,Title,Date
0,Under Armour Declines Over Fears That Steph Curry Shoe Is a Flop - Bloomberg.com,"Fri, 18 Nov 2016 08:00:00 GMT"
1,Swiss Reinsurance Co Ltd - Company Profile and News - Bloomberg.com,"Mon, 22 Jan 2018 19:17:51 GMT"
2,The Voters Who Gave Trump the White House - Bloomberg.com,"Wed, 09 Nov 2016 08:00:00 GMT"
3,Ford CEO Warns of Huge Impact From Trump’s Proposed Tariff - Bloomberg.com,"Tue, 15 Nov 2016 08:00:00 GMT"
4,Renaissance Technologies LLC - Company Profile and News - Bloomberg.com,"Mon, 21 Oct 2019 21:49:18 GMT"
5,"Actually, There Are Still Good Blue-Collar Jobs - Bloomberg.com","Fri, 18 Nov 2016 08:00:00 GMT"
6,Gulf DTH FZ LLC - Bloomberg.com,"Fri, 10 May 2019 06:53:34 GMT"
7,Amazon Worker Jumps Off Company Building After E-Mail Note - Bloomberg.com,"Mon, 28 Nov 2016 08:00:00 GMT"
8,Hello World: Japan Hearts Robots - Bloomberg.com,"Wed, 02 Nov 2016 07:00:00 GMT"
9,Fresenius Finance Ireland PLC - Bloomberg.com,"Sat, 03 Aug 2019 03:06:12 GMT"
10,Double R Srl - Bloomberg.com,"Sun, 12 May 2019 05:04:59 GMT"
11,Bloomberg Billionaires Index - Elon Musk - Bloomberg.com,"Mon, 21 Nov 2016 08:00:00 GMT"
12,Pony.ai Inc/CA - Bloomberg.com,"Sun, 12 May 2019 11:37:52 GMT"
13,A&L Wood Inc - Bloomberg.com,"Fri, 17 May 2019 20:21:47 GMT"
14,Supreme Court Never Imagined a Litigant Like President Trump - Bloomberg.com,"Fri, 11 Nov 2016 08:00:00 GMT"
15,Today's S&P 500 Reversal Is the Biggest Since 2008 Crisis: Chart - Bloomberg.com,"Wed, 09 Nov 2016 08:00:00 GMT"
16,$100 Billion Chinese-Made City Near Singapore 'Scares the Hell Out of Everybody' - Bloomberg.com,"Mon, 21 Nov 2016 08:00:00 GMT"
17,"Clinton, Trump Prepare for Possibility of Election Overtime - Bloomberg.com","Tue, 01 Nov 2016 07:00:00 GMT"
18,Richemont Abolishes CEO Role Amid Biggest Shakeup in Years - Bloomberg.com,"Fri, 04 Nov 2016 07:00:00 GMT"
19,"Centerbridge Partners' Gallogly on Trump, Markets - Bloomberg.com","Wed, 09 Nov 2016 08:00:00 GMT"
20,How to Cash In on Weed Legalization - Bloomberg.com,"Thu, 10 Nov 2016 08:00:00 GMT"
21,Ctrip Acquires Skyscanner for $1.7 Billion to Expand Bookings - Bloomberg.com,"Thu, 24 Nov 2016 08:00:00 GMT"
22,New York's 311 Now Lets People Report Bike-Lane Blockers - Bloomberg.com,"Wed, 02 Nov 2016 07:00:00 GMT"
23,HPEF Capital Said to Consider Sale of Vietnam Education Business - Bloomberg.com,"Mon, 28 Nov 2016 08:00:00 GMT"
24,Ellen Proper - Bloomberg.com,"Sun, 27 Nov 2016 12:57:58 GMT"
25,Divorce in U.S. Plunges to 35-Year Low - Bloomberg.com,"Thu, 17 Nov 2016 08:00:00 GMT"
26,The David Rubenstein Show: Indra Nooyi - Bloomberg.com,"Wed, 23 Nov 2016 08:00:00 GMT"
27,Cuba After Castro - Bloomberg.com,"Sun, 27 Nov 2016 08:00:00 GMT"
28,Donald Trump's Path to Victory Over Hillary Clinton - Bloomberg.com,"Wed, 09 Nov 2016 08:00:00 GMT"
29,"In the U.S., Almost No One Votes in Local Elections - Bloomberg.com","Tue, 01 Nov 2016 07:00:00 GMT"
30,CARLO RIPAMONTI SOCIETA' SEMPLICE - Bloomberg LEI,"Sat, 01 Mar 2025 15:27:15 GMT"
31,Lotte Properties Hanoi Singapore Pte Ltd - Bloomberg.com,"Sat, 11 May 2019 23:41:46 GMT"
32,Singapore Marina Land Gets Record Bid From Malaysia Group - Bloomberg.com,"Tue, 08 Nov 2016 08:00:00 GMT"
33,Samsung’s Stock Hits Highest in 40 Years as It Heads for a Split - Bloomberg.com,"Tue, 29 Nov 2016 08:00:00 GMT"
34,REV Group Inc - Bloomberg.com,"Sat, 02 Mar 2019 09:18:42 GMT"
35,Gawker Settles Hulk Hogan Sex-Tape Lawsuit for $31 Million - Bloomberg.com,"Wed, 02 Nov 2016 07:00:00 GMT"
36,Camden Town Technologies Pvt Ltd - Bloomberg.com,"Fri, 10 May 2019 23:11:18 GMT"
37,An Economic Explanation of New York City's Skyline - Bloomberg.com,"Wed, 23 Nov 2016 08:00:00 GMT"
38,Why Trump's Victory Just Wounded Gunmakers - Bloomberg.com,"Wed, 09 Nov 2016 08:00:00 GMT"
39,Corona Beer Importer Rallies With a Trump Defeat Looking More Likely - Bloomberg.com,"Mon, 07 Nov 2016 08:00:00 GMT"
40,"Nissan: We Gave You Clean Cars, Now Give Us Clean Energy - Bloomberg.com","Thu, 03 Nov 2016 07:00:00 GMT"
41,GO2 People Ltd/The - Company Profile and News - Bloomberg.com,"Sun, 21 Feb 2021 19:47:27 GMT"
42,Sinohope Technology Holdings Ltd - Bloomberg.com,"Fri, 08 Mar 2019 01:24:09 GMT"
43,Paranoid Android: Erica May Be the Creepiest Robot Ever Built - Bloomberg.com,"Tue, 01 Nov 2016 07:00:00 GMT"
44,Asli Kandemir - Bloomberg.com,"Fri, 18 Nov 2016 10:09:44 GMT"
45,"Big Money, Big Questions at Trump Protege's Remote Casino - Bloomberg.com","Sun, 13 Nov 2016 08:00:00 GMT"
46,Thrive Operations LLC - Bloomberg.com,"Fri, 05 Aug 2022 04:21:24 GMT"
47,Racism Probably Is Getting Worse. (I Hope I'm Wrong.) - Bloomberg.com,"Wed, 16 Nov 2016 08:00:00 GMT"
48,Germany's 'Nice Toilet' Network Means You'll Always Have a Place to Go - Bloomberg.com,"Tue, 01 Nov 2016 07:00:00 GMT"
49,The Artist Who Declared Sanitation Workers Worthy of a Museum - Bloomberg.com,"Tue, 29 Nov 2016 08:00:00 GMT"
50,Daiwa Asset Management Co Ltd - Bloomberg.com,"Fri, 22 Nov 2019 02:01:47 GMT"
51,Watch Robot Fight Club - Bloomberg.com,"Thu, 10 Nov 2016 08:00:00 GMT"
52,Paleoconservatism Is Back - Bloomberg.com,"Sun, 27 Nov 2016 08:00:00 GMT"
53,"Rebekah Mercer, Daughter of Major Donor, Named to Trump Role - Bloomberg.com","Fri, 11 Nov 2016 08:00:00 GMT"
54,"Watch Jin: China Economy Stabilizing, but Credit Is Tight - Bloomberg.com","Tue, 01 Nov 2016 07:00:00 GMT"
55,The Strange Politics of the World Chess Championship - Bloomberg.com,"Mon, 28 Nov 2016 08:00:00 GMT"
56,No Credit History? No Problem. Lenders Are Looking at Your Phone Data - Bloomberg.com,"Fri, 25 Nov 2016 08:00:00 GMT"
57,Hertz’s Shares Tumble 23% After Profit Misses Estimates - Bloomberg.com,"Tue, 08 Nov 2016 08:00:00 GMT"
58,3G Wants the Fat - Bloomberg.com,"Tue, 08 Nov 2016 08:00:00 GMT"
59,"Now You Can Get Bespoke Shoes From Ermenegildo Zegna, Too - Bloomberg.com","Mon, 21 Nov 2016 08:00:00 GMT"
60,Disney Cuts Off Chinese Toy Factory Over Alleged Labor Violations - Bloomberg.com,"Tue, 29 Nov 2016 08:00:00 GMT"
61,Disney CEO Bob Iger on 2017 Forecast and the Election - Bloomberg.com,"Thu, 10 Nov 2016 08:00:00 GMT"
62,The Case Against Leaf Blowers - Bloomberg.com,"Thu, 03 Nov 2016 07:00:00 GMT"
63,India Is Experimenting With a Cashless System - Bloomberg.com,"Wed, 23 Nov 2016 08:00:00 GMT"
64,Pro-Brexit Press Rages at ‘Enemies of the People’ on Court - Bloomberg.com,"Fri, 04 Nov 2016 07:00:00 GMT"
65,"Cash Is Still King in Japan, and That Could Be a Problem for the BOJ - Bloomberg.com","Mon, 07 Nov 2016 08:00:00 GMT"
66,The $106 Million ‘Eataly World’ Revealed - Bloomberg.com,"Thu, 17 Nov 2016 08:00:00 GMT"
67,Sentient Medical Systems - Bloomberg.com,"Sun, 12 May 2019 05:09:25 GMT"
68,Grandi Stazioni Retail SpA - Bloomberg.com,"Fri, 10 May 2019 19:28:37 GMT"
69,Ted Cruz Considered by Trump for Attorney General - Bloomberg.com,"Wed, 16 Nov 2016 08:00:00 GMT"
70,NYC’s Trump Place Apartments to Drop Name Amid Tenant Outcry - Bloomberg.com,"Tue, 15 Nov 2016 08:00:00 GMT"
71,Warren Buffett: Smartphone Is Too Smart for Me - Bloomberg.com,"Wed, 02 Nov 2016 07:00:00 GMT"
72,Watch Discovery Communications Misses Estimates - Bloomberg.com,"Tue, 01 Nov 2016 07:00:00 GMT"
73,"Protesting Trump, the District of Columbia Way - Bloomberg.com","Wed, 23 Nov 2016 08:00:00 GMT"
74,Altera Capital LLC - Bloomberg.com,"Fri, 10 May 2019 23:46:52 GMT"
75,These Delivery Men Defy Death to Bring You Your Shopping - Bloomberg.com,"Wed, 16 Nov 2016 08:00:00 GMT"
76,Renaissance's Skill and Facebook's Buyback - Bloomberg.com,"Mon, 21 Nov 2016 08:00:00 GMT"
77,"Bill Walton, Old Einhorn Enemy, Makes a Comeback With Trump Role - Bloomberg.com","Tue, 29 Nov 2016 08:00:00 GMT"
78,Western Asset's Eichstaedt Sees U.S. Bonds as a Bargain - Bloomberg.com,"Wed, 30 Nov 2016 08:00:00 GMT"
79,Victorious Donald Trump Is Devil Wall Street Doesn’t Know - Bloomberg.com,"Wed, 09 Nov 2016 08:00:00 GMT"
80,MEXBOL Quote - S&P/BMV IPC Index - Bloomberg.com,"Thu, 20 Mar 2014 03:46:53 GMT"
81,The Caribbean Resort Where Billionaires Go to Escape Millionaires - Bloomberg.com,"Fri, 11 Nov 2016 08:00:00 GMT"
82,Trump’s Business Partner Will Be Manila’s Man in Washington - Bloomberg.com,"Tue, 22 Nov 2016 08:00:00 GMT"
83,An Incubator for (Former) Drug Dealers - Bloomberg.com,"Tue, 29 Nov 2016 08:00:00 GMT"
84,Rapper Q-Tip on Kanye West’s Remarks About Donald Trump - Bloomberg.com,"Mon, 28 Nov 2016 08:00:00 GMT"
85,Financial Repression Is Ending -- And Governments Can Afford It - Bloomberg.com,"Thu, 03 Nov 2016 07:00:00 GMT"
86,Macy’s Website Suffers Disruptions on Critical Shopping Day - Bloomberg.com,"Fri, 25 Nov 2016 08:00:00 GMT"
87,PepsiCo CEO: I Write Letters to Parents of My Executives - Bloomberg.com,"Wed, 23 Nov 2016 08:00:00 GMT"
88,Levi Strauss Tells Customers: Leave Your Guns at Home - Bloomberg.com,"Wed, 30 Nov 2016 08:00:00 GMT"
89,Partner at Peter Thiel’s Founders Fund Speaks Out Against Trump - Bloomberg.com,"Sun, 13 Nov 2016 08:00:00 GMT"
90,Saudi Oger Said Near $1.1 Billion Deal to Sell Arab Bank Stake - Bloomberg.com,"Mon, 14 Nov 2016 08:00:00 GMT"
91,Emirates Says Rolls-Royce’s A380 Engines Not Up to Standard - Bloomberg.com,"Fri, 18 Nov 2016 08:00:00 GMT"
92,Carney Growing Tired of the Global Central Bank Blame Game - Bloomberg.com,"Wed, 16 Nov 2016 08:00:00 GMT"
93,The Man Who Invented the World’s Most Important Number - Bloomberg.com,"Tue, 29 Nov 2016 08:00:00 GMT"
94,Elon Musk - Bloomberg.com,"Sun, 06 Nov 2016 07:00:00 GMT"
95,"To Understand the 2016 Election, Look to the Metro Areas - Bloomberg.com","Tue, 29 Nov 2016 08:00:00 GMT"
96,China's New Jets Are Impressive. But Are They for Real? - Bloomberg.com,"Wed, 02 Nov 2016 07:00:00 GMT"
97,What We're Wondering About the Next Secretary of Transportation - Bloomberg.com,"Tue, 29 Nov 2016 08:00:00 GMT"
98,"Inside the Rehab Center Where Rich, Addicted, Off-the-Rails Teens Get Help - Bloomberg.com","Mon, 21 Nov 2016 08:00:00 GMT"
99,Why Modern Art Portraits of Men Sell for Less Than Those of Women - Bloomberg.com,"Tue, 01 Nov 2016 07:00:00 GMT"
