,Title,Date
0,Mordor Intelligence Pvt Ltd - Bloomberg,"Wed, 14 May 2025 01:04:33 GMT"
1,Guangdong Huitian Aerospace Technology Co Ltd - Bloomberg,"Wed, 07 May 2025 10:06:21 GMT"
2,Applied Technical Services LLC - Bloomberg,"Tue, 22 Apr 2025 12:18:57 GMT"
3,"Midtown Is Still Empty, and Landlords Are Sounding the Alarm - Bloomberg","Fri, 18 Dec 2020 08:00:00 GMT"
4,PlayStation 5 Scalpers Use Bots to Hunt Down Scarce Consoles - Bloomberg,"Wed, 16 Dec 2020 08:00:00 GMT"
5,Simplify Nasdaq 100 PLUS Downside Convexity ETF - Bloomberg,"Sun, 13 Dec 2020 00:20:57 GMT"
6,Cyberpunk 2077 Bugs Hit CD Projekt - Bloomberg,"Thu, 10 Dec 2020 08:00:00 GMT"
7,Your Evening Briefing: Tesla Held a $38 Billion Barbecue in 2020 - Bloomberg,"Thu, 31 Dec 2020 08:00:00 GMT"
8,"Guggenheim’s Scott Minerd Says Bitcoin Should Be Worth $400,000 - Bloomberg","Wed, 16 Dec 2020 08:00:00 GMT"
9,The Wrong Way to Fight the Death Penalty - Bloomberg,"Thu, 17 Dec 2020 08:00:00 GMT"
10,Moncler Buys Stone Island Sportswear Brand for $1.4 Billion - Bloomberg,"Mon, 07 Dec 2020 08:00:00 GMT"
11,Trump Campaign to Run Ads Promoting Effort to Overturn Election - Bloomberg,"Fri, 11 Dec 2020 08:00:00 GMT"
12,"Aphria, Tilray Combine to Create Biggest Cannabis Company - Bloomberg","Wed, 16 Dec 2020 08:00:00 GMT"
13,Tesla’s Dominant Position in China Could Be Threatened Next Year - Bloomberg,"Mon, 28 Dec 2020 08:00:00 GMT"
14,How to Diversify Trump County - Bloomberg,"Fri, 11 Dec 2020 08:00:00 GMT"
15,Watch China Authorities Detain Bloomberg News Staff Member Haze Fan in Beijing: Video - Bloomberg - Bloomberg,"Fri, 11 Dec 2020 08:00:00 GMT"
16,U.K. Grants Five Passports a Minute to Hongkongers as China Tightens Grip - Bloomberg,"Fri, 04 Dec 2020 08:00:00 GMT"
17,"John Foley, the Exercise King of Quarantine - Bloomberg","Thu, 03 Dec 2020 08:00:00 GMT"
18,"Google AI Researchers Lay Out Demands, Escalating Internal Fight - Bloomberg","Wed, 16 Dec 2020 08:00:00 GMT"
19,IPO Frenzy Drives Record $435 Billion in U.S. Stock Sales - Bloomberg,"Mon, 21 Dec 2020 08:00:00 GMT"
20,Elon Musk Has Made Millionaires Out of His Most Loyal Fans - Bloomberg,"Fri, 18 Dec 2020 08:00:00 GMT"
21,"U.S. Ranks Behind EU, Australia, U.K. in Vaccine Buys But Says It Will Meet Goal - Bloomberg","Wed, 09 Dec 2020 08:00:00 GMT"
22,Your Next Car Will Probably Be an Electric Pickup Truck - Bloomberg,"Thu, 10 Dec 2020 08:00:00 GMT"
23,We May Be Exactly Wrong About Technology and Inequality - Bloomberg,"Wed, 09 Dec 2020 08:00:00 GMT"
24,NB6: Profile Systems & Software SA Stock Price Quote - LSXExchange - Bloomberg,"Tue, 21 Apr 2015 16:11:29 GMT"
25,Turkish Farmers Eye $3 Billion Profit Jackpot From Gold Find - Bloomberg,"Wed, 23 Dec 2020 08:00:00 GMT"
26,Chick-fil-A Sues U.S. Chicken Producers for Poultry Price-Fixing - Bloomberg,"Sun, 06 Dec 2020 08:00:00 GMT"
27,Charlie Wells - Bloomberg,"Sat, 26 Dec 2020 13:10:35 GMT"
28,Andrew Kreighbaum - Bloomberg,"Tue, 22 Dec 2020 16:18:08 GMT"
29,"Abdalla Hamdok, Sudan’s Pioneering Reformer - Bloomberg","Thu, 03 Dec 2020 08:00:00 GMT"
30,Singapore Becomes First Country to Approve Sales of Lab-Created Meat - Bloomberg,"Tue, 01 Dec 2020 08:00:00 GMT"
31,Cuba to End Dual Currency System in 2021 Amid Crisis Reform - Bloomberg,"Fri, 11 Dec 2020 08:00:00 GMT"
32,Trump Sits Out Debut of Covid-19 Vaccine That He Long Championed - Bloomberg,"Wed, 16 Dec 2020 08:00:00 GMT"
33,"For Some in Russia’s Elite, Putin’s Future Is Again a Hot Topic - Bloomberg","Sat, 19 Dec 2020 08:00:00 GMT"
34,Capiva Plus Fund SCSp RAIF - Bloomberg,"Fri, 08 Mar 2019 21:38:07 GMT"
35,Tesla (TSLA) Elon Musk Raising Up to $5 Billion in Third Capital Raise This Year - Bloomberg,"Tue, 08 Dec 2020 08:00:00 GMT"
36,Square Has Discussed Acquiring Jay-Z’s Tidal Service - Bloomberg,"Thu, 24 Dec 2020 08:00:00 GMT"
37,Times Square Development Draws New Wave of Foreign Investment - Bloomberg,"Thu, 17 Dec 2020 08:00:00 GMT"
38,Starbucks (SBUX) Names Mellody Hobson Chair in Gain for Black Directors - Bloomberg,"Wed, 09 Dec 2020 08:00:00 GMT"
39,Yoozoo Games CEO Lin Dies at 39 Amid Police Probe Over Poisoning - Bloomberg,"Fri, 25 Dec 2020 08:00:00 GMT"
40,Iran Says Scientist Was Killed Using Satellite-Controlled Gun - Bloomberg,"Sun, 06 Dec 2020 08:00:00 GMT"
41,"Luis Lacalle Pou, Uruguay’s President With a Plan - Bloomberg","Thu, 03 Dec 2020 08:00:00 GMT"
42,The Biggest Climate Change Stories of 2020 - Bloomberg,"Mon, 28 Dec 2020 08:00:00 GMT"
43,CityLab Daily: The Legacy of the Atrium Hotel - Bloomberg,"Thu, 03 Dec 2020 08:00:00 GMT"
44,"France’s Versailles Palace Gets Another Revolution, On TikTok - Bloomberg","Wed, 02 Dec 2020 08:00:00 GMT"
45,Airbnb Valuation Reaches $100 Billion in Trading Debut Surge - Bloomberg,"Fri, 11 Dec 2020 08:00:00 GMT"
46,This Is How Singapore Keeps Its Cool as the City Heats Up - Bloomberg,"Tue, 01 Dec 2020 08:00:00 GMT"
47,AstraZeneca to Buy Alexion for $39 Billion in Rare-Disease Push - Bloomberg,"Sat, 12 Dec 2020 08:00:00 GMT"
48,"Danone Creates New Yogurt Brand Using Ugly, Rejected Fruit - Bloomberg","Wed, 09 Dec 2020 08:00:00 GMT"
49,"For North Korean Spies, Vienna Provides Key Gateway to Europe - Bloomberg","Fri, 04 Dec 2020 08:00:00 GMT"
50,Apple Preps Next Mac Chips With Aim to Outclass Top-End PCs - Bloomberg,"Mon, 07 Dec 2020 08:00:00 GMT"
51,"Boeing’s 737 Max Comeback Nears With United Delivery, Gol Flight - Bloomberg","Wed, 02 Dec 2020 08:00:00 GMT"
52,How Timnit Gebru's Academic Paper Set Off a Firestorm at Google - Bloomberg,"Tue, 08 Dec 2020 08:00:00 GMT"
53,"Roger Berlind, Who Scored on Wall Street, Broadway, Dies at 90 - Bloomberg","Thu, 24 Dec 2020 08:00:00 GMT"
54,Bloomberg Completes Acquisition of Second Measure | Press | Bloomberg LP - Bloomberg,"Thu, 24 Dec 2020 08:00:00 GMT"
55,Linda Poon - Bloomberg,"Wed, 02 Dec 2020 08:12:22 GMT"
56,Into the Heart of the Atrium Hotel - Bloomberg,"Wed, 02 Dec 2020 08:00:00 GMT"
57,What a Pro-Worker Republican Party Really Looks Like - Bloomberg,"Thu, 31 Dec 2020 08:00:00 GMT"
58,Toxic Spills in Venezuela Offer a Bleak Vision of the End of Oil - Bloomberg,"Tue, 15 Dec 2020 08:00:00 GMT"
59,Netflix’s Foreign-Language Shows See Popularity Soar in the U.S. - Bloomberg,"Thu, 10 Dec 2020 08:00:00 GMT"
60,Russia’s Answer to Office 365 Helps Putin With African Ambitions - Bloomberg,"Tue, 01 Dec 2020 08:00:00 GMT"
61,Lego Bets on China’s Children With Hundreds of New Stores - Bloomberg,"Wed, 16 Dec 2020 08:00:00 GMT"
62,Worst Spot for U.S. Brain Drain Gets Hope as Vaccine Hub - Bloomberg,"Thu, 31 Dec 2020 08:00:00 GMT"
63,"Safra, Banker With an $85 Billion-Dollar Empire, Dies at 82 - Bloomberg","Thu, 10 Dec 2020 08:00:00 GMT"
64,Biden Administration Will Create Position to Reach Conservatives - Bloomberg,"Mon, 07 Dec 2020 08:00:00 GMT"
65,Denmark to End North Sea Oil Production in Milestone Deal - Bloomberg,"Fri, 04 Dec 2020 08:00:00 GMT"
66,Financial Products UX - Bloomberg,"Tue, 29 Dec 2020 08:00:00 GMT"
67,"Renee Montgomery, a WNBA Do-Gooder - Bloomberg","Thu, 03 Dec 2020 08:00:00 GMT"
68,MacKenzie Scott Gives Away $4.2 Billion in Four Months - Bloomberg,"Tue, 15 Dec 2020 08:00:00 GMT"
69,Watch The David Rubenstein Show: Disney Exec. Chairman Bob Iger - Bloomberg,"Thu, 03 Dec 2020 08:00:00 GMT"
70,BMW Joins Audi in Quitting Battery-Powered Formula E Racing - Bloomberg,"Thu, 03 Dec 2020 08:00:00 GMT"
71,Robinhood Is Losing Thousands of Traders to a China-Owned Rival - Bloomberg,"Tue, 08 Dec 2020 08:00:00 GMT"
72,SmileDirectClub Patent on Business Is Invalidated by Judge - Bloomberg,"Mon, 07 Dec 2020 08:00:00 GMT"
73,U.S. Jobless Claims Unexpectedly Jump to Highest in Three Months - Bloomberg,"Thu, 17 Dec 2020 08:00:00 GMT"
74,Parents Feeling Guilty About Covid Ignites Boom in Toy Sales - Bloomberg,"Fri, 18 Dec 2020 08:00:00 GMT"
75,The World’s Most Loathed Industry Gave Us a Vaccine in Record Time - Bloomberg,"Wed, 23 Dec 2020 08:00:00 GMT"
76,What We Know About Pete Buttigieg’s Transportation Record - Bloomberg,"Wed, 16 Dec 2020 08:00:00 GMT"
77,Biden @POTUS Account Reset to Zero With Trump Followers Out - Bloomberg,"Tue, 22 Dec 2020 08:00:00 GMT"
78,"Why It’s So Hard to Stop Amazon Deforestation, Starting With the Beef Industry - Bloomberg","Thu, 17 Dec 2020 08:00:00 GMT"
79,"Aya Kyogoku and Hisashi Nogami, the Humans Behind Animal Crossing - Bloomberg","Thu, 03 Dec 2020 08:00:00 GMT"
80,What If Covid-19 Measures Killed Flu Season? - Bloomberg,"Tue, 15 Dec 2020 08:00:00 GMT"
81,The Bloomberg 50: The People Who Changed Global Business in 2020 - Bloomberg,"Mon, 07 Dec 2020 08:00:00 GMT"
82,Why Trump's ‘Beautiful’ Federal Building Order May Be Here to Stay - Bloomberg,"Wed, 23 Dec 2020 08:00:00 GMT"
83,Erdogan Warns EU of ‘Blindness’ as Greece Seeks Sanctions - Bloomberg,"Mon, 07 Dec 2020 08:00:00 GMT"
84,"Viya, China’s Livestreaming Queen - Bloomberg","Thu, 03 Dec 2020 08:00:00 GMT"
85,The Real Trees Delivering Fake Corporate Climate Progress - Bloomberg,"Thu, 17 Dec 2020 08:00:00 GMT"
86,Russia Pushes Ahead on Europe Gas Link Before U.S. Sanctions - Bloomberg,"Tue, 29 Dec 2020 08:00:00 GMT"
87,IVLC Quote - Invesco US Large Cap Core ESG ETF Fund - Bloomberg,"Tue, 22 Dec 2020 13:39:05 GMT"
88,A 10 Billion-Tree Plan Is Restoring Pakistan’s Lost Forests - Bloomberg,"Thu, 17 Dec 2020 08:00:00 GMT"
89,"Facebook Sees WhatsApp As Its Future, Antitrust Suit or Not - Bloomberg","Wed, 09 Dec 2020 08:00:00 GMT"
90,Reuben Brothers to Buy New York City’s Surrey Hotel - Bloomberg,"Fri, 04 Dec 2020 08:00:00 GMT"
91,"‘Solidarity, Not Charity’: A Visual History of Mutual Aid - Bloomberg","Tue, 22 Dec 2020 08:00:00 GMT"
92,"Dave Brubeck Took Jazz Behind Iron Curtain, and So Much More - Bloomberg","Sat, 19 Dec 2020 08:00:00 GMT"
93,BlackRock Gains Clout in Washington as Biden Builds His Team - Bloomberg,"Tue, 01 Dec 2020 08:00:00 GMT"
94,MapLab: Geography Is a Gift - Bloomberg,"Wed, 16 Dec 2020 08:00:00 GMT"
95,Opendoor Faces an Expensive Path to Profitability in Real Estate - Bloomberg,"Tue, 22 Dec 2020 08:00:00 GMT"
96,Workers Flocking to China’s Tech Hub Can’t Afford to Buy Homes - Bloomberg,"Sun, 20 Dec 2020 08:00:00 GMT"
97,Russia-Linked SolarWinds Hack Snags Widening List of Victims - Bloomberg,"Fri, 18 Dec 2020 08:00:00 GMT"
98,Your Evening Briefing: Covid-19 Was in America Last Year - Bloomberg,"Tue, 01 Dec 2020 08:00:00 GMT"
99,The Cruise Ship Suicides Began After the Last Passengers Left - Bloomberg,"Wed, 30 Dec 2020 08:00:00 GMT"
