,Title,Date
0,S&P's Yip Expects China Developers' Consolidation to Accelerate - Bloomberg.com,"Wed, 07 Nov 2018 08:00:00 GMT"
1,Alphabet Chairman Struggles With Google CEO's China Strategy - Bloomberg.com,"Tue, 20 Nov 2018 08:00:00 GMT"
2,Japan's 10-Year Yields Now Above Treasuries After Hedging Costs - Bloomberg.com,"Mon, 05 Nov 2018 08:00:00 GMT"
3,Lone U.S. Cannabis REIT Trounces Peers in Legal Gray Area - Bloomberg.com,"Thu, 08 Nov 2018 08:00:00 GMT"
4,Gold Now Has a Challenger for the Mantle of Most-Precious Metal - Bloomberg.com,"Fri, 30 Nov 2018 08:00:00 GMT"
5,U.A.E.’s Long-Term Visa Plan Excludes Most of Its Residents - Bloomberg.com,"Mon, 26 Nov 2018 08:00:00 GMT"
6,North Korea Missile Bases Outed in Report That Undermines Trump - Bloomberg.com,"Tue, 13 Nov 2018 08:00:00 GMT"
7,U.S. Inflation Remained Muted in October Despite Solid Economy - Bloomberg.com,"Wed, 14 Nov 2018 08:00:00 GMT"
8,Trump Begins Paris Visit With Attack on Emmanuel Macron - Bloomberg.com,"Sat, 10 Nov 2018 08:00:00 GMT"
9,It’s 2005 All Over Again as Ford Teeters on the Edge of Junk - Bloomberg.com,"Fri, 09 Nov 2018 08:00:00 GMT"
10,The Dirty Legacy of China’s and India’s Growth - Bloomberg.com,"Fri, 02 Nov 2018 07:00:00 GMT"
11,Father of Z-Score Expects Bigger Bankruptcies in Next Downturn - Bloomberg.com,"Fri, 09 Nov 2018 08:00:00 GMT"
12,Google Cloud CEO Diane Greene to Leave; Kurian Steps In - Bloomberg.com,"Fri, 16 Nov 2018 08:00:00 GMT"
13,Putin Resurrects the Soviet Super Chicken - Bloomberg.com,"Fri, 09 Nov 2018 08:00:00 GMT"
14,Panasonic Says Gigafactory Profit in Sight as Tesla Ramps Output - Bloomberg.com,"Thu, 01 Nov 2018 07:00:00 GMT"
15,Is There a Silver Lining in Redlining Cleveland? - Bloomberg.com,"Fri, 09 Nov 2018 08:00:00 GMT"
16,Why Stockholm Said No to Apple - Bloomberg.com,"Tue, 06 Nov 2018 08:00:00 GMT"
17,Watch Brookfield Renewable CEO Sees Investment Opportunities in India and China - Bloomberg.com,"Thu, 01 Nov 2018 07:00:00 GMT"
18,Ex-Goldman Banker Channels the Hulk for Deals With Billionaires - Bloomberg.com,"Mon, 26 Nov 2018 08:00:00 GMT"
19,Here's One Measure That Shows Sanctions on Russia are Working - Bloomberg.com,"Fri, 16 Nov 2018 08:00:00 GMT"
20,Watch Giving People With Criminal Records a Second Chance in the Workforce - Bloomberg.com,"Mon, 26 Nov 2018 08:00:00 GMT"
21,"Oil Could Touch $100 If Supply Crunch Worsens, Citi's Morse Says - Bloomberg.com","Tue, 06 Nov 2018 08:00:00 GMT"
22,"Bill Cosby Sells Painting, Takes Loan on Vast Art Collection - Bloomberg.com","Fri, 09 Nov 2018 08:00:00 GMT"
23,California Turns to War-Zone DNA Test to ID Fire Remains - Bloomberg.com,"Mon, 19 Nov 2018 08:00:00 GMT"
24,UBS Sued by U.S. Over Billions in `Catastrophic' Mortgage Bonds - Bloomberg.com,"Thu, 08 Nov 2018 08:00:00 GMT"
25,The World Was Catching on to Iran’s Contemporary Art. Then Sanctions Returned - Bloomberg.com,"Wed, 14 Nov 2018 08:00:00 GMT"
26,Fascist Flags on Poland’s 100th Birthday Show a Fractured Europe - Bloomberg.com,"Mon, 12 Nov 2018 08:00:00 GMT"
27,"WTO Starts U.S. Tariffs Probe, Crossing Trump’s Red Line - Bloomberg.com","Wed, 21 Nov 2018 08:00:00 GMT"
28,Kobe Bryant Wants to Sell You a Sports Drink - Bloomberg.com,"Mon, 12 Nov 2018 08:00:00 GMT"
29,Apple Will Stop Reporting iPhone Unit Sales; Forecast Underwhelms - Bloomberg.com,"Thu, 01 Nov 2018 07:00:00 GMT"
30,Alex Vasquez - Bloomberg.com,"Thu, 15 Nov 2018 15:27:04 GMT"
31,Apple and Fast Food Have the Same Problem - Bloomberg.com,"Fri, 30 Nov 2018 08:00:00 GMT"
32,Today’s Armies Are Still Fighting World War I - Bloomberg.com,"Sat, 10 Nov 2018 08:00:00 GMT"
33,Canada Goose Is Turning the Dressing Room Into a Freezer - Bloomberg.com,"Sat, 17 Nov 2018 08:00:00 GMT"
34,Private Equity Controls the Gatekeepers of American Democracy - Bloomberg.com,"Sat, 03 Nov 2018 07:00:00 GMT"
35,U.S. Elects Record Number of Women to House of Representatives - Bloomberg.com,"Wed, 07 Nov 2018 08:00:00 GMT"
36,"Watch Ripple CEO Discusses Cryptocurrency XRP, Need of 'Global Framework' - Bloomberg.com","Mon, 12 Nov 2018 08:00:00 GMT"
37,Boeing Crash Clues Spark Questions Over Why Plane Cleared to Fly - Bloomberg.com,"Thu, 08 Nov 2018 08:00:00 GMT"
38,Facebook's Ads System Suffers Glitch Days Before Black Friday - Bloomberg.com,"Tue, 20 Nov 2018 08:00:00 GMT"
39,CityLab’s Congressional Density Index: A Reference - Bloomberg.com,"Tue, 20 Nov 2018 08:00:00 GMT"
40,Athenahealth Sale Is as Good as It’s Going to Get - Bloomberg.com,"Mon, 12 Nov 2018 08:00:00 GMT"
41,U.S. Scraps Boeing Upgrade of Surveillance Plane’s Radar - Bloomberg.com,"Tue, 06 Nov 2018 08:00:00 GMT"
42,The Good News Hidden in China’s Slowing Economy - Bloomberg.com,"Tue, 20 Nov 2018 08:00:00 GMT"
43,Macquarie Said to Close Oldest Asia Quant Equity Hedge Fund - Bloomberg.com,"Wed, 21 Nov 2018 08:00:00 GMT"
44,Michael Avenatti Arrested on Suspicion of Domestic Violence - Bloomberg.com,"Wed, 14 Nov 2018 08:00:00 GMT"
45,One Big Loser of the Midterms: Russian Hackers - Bloomberg.com,"Wed, 07 Nov 2018 08:00:00 GMT"
46,Why It’s Difficult to Find Organic Pork - Bloomberg.com,"Thu, 01 Nov 2018 07:00:00 GMT"
47,Australia to China: Don't Bother Bidding for Our Gas Pipelines - Bloomberg.com,"Wed, 07 Nov 2018 08:00:00 GMT"
48,Philip Morris's IQOS Seen Benefiting From FDA Flavor Crackdown - Bloomberg.com,"Thu, 15 Nov 2018 08:00:00 GMT"
49,YourIndex SICAV - YIS MSCI World Universal - Bloomberg.com,"Sun, 18 May 2025 18:13:21 GMT"
50,Nike Sock Supplier Plans Biggest Pakistan Private Sector IPO - Bloomberg.com,"Thu, 08 Nov 2018 08:00:00 GMT"
51,Shell Implements New Global Electronic Central Treasury System - Bloomberg.com,"Mon, 05 Nov 2018 08:00:00 GMT"
52,World's Largest Ikea to Open in Manila as Company Bets on Asia - Bloomberg.com,"Tue, 20 Nov 2018 08:00:00 GMT"
53,Google Workers Stage Mass Walkout to Protest Handling of Sexual Misconduct - Bloomberg.com,"Thu, 01 Nov 2018 07:00:00 GMT"
54,Jay-Z Says Lack of Black Arbitrators Should Halt Iconix Case - Bloomberg.com,"Wed, 28 Nov 2018 08:00:00 GMT"
55,Airbus Unlocks Emirates A380 Logjam But Engine Standoff Goes On - Bloomberg.com,"Thu, 29 Nov 2018 08:00:00 GMT"
56,CNN Wins Court Order Restoring White House Reporter’s Access - Bloomberg.com,"Fri, 16 Nov 2018 08:00:00 GMT"
57,Don’t Think It Will Be Easy to Fireproof California - Bloomberg.com,"Tue, 13 Nov 2018 08:00:00 GMT"
58,"Cage-Free Eggs Are Out, Pastured Ones In as Tastes Change, Again - Bloomberg.com","Sat, 17 Nov 2018 08:00:00 GMT"
59,Snoop Dogg’s Surprisingly Solid Tips for Thanksgiving Dinner - Bloomberg.com,"Wed, 07 Nov 2018 08:00:00 GMT"
60,Victoria's Secret Lingerie CEO Jan Singer Is Said to Resign - Bloomberg.com,"Wed, 14 Nov 2018 08:00:00 GMT"
61,Trump's Sanctions Are Proving a Bitter Pill for Iran's Sick - Bloomberg.com,"Tue, 20 Nov 2018 08:00:00 GMT"
62,Barclays CEO May Have Found Backing in Veteran Rothschild Banker - Bloomberg.com,"Fri, 02 Nov 2018 07:00:00 GMT"
63,Elon Musk Says He Wouldn’t Take Money From Saudi Arabia Now - Bloomberg.com,"Fri, 02 Nov 2018 07:00:00 GMT"
64,Trump's Attack on Mueller Is About One Thing: Fear - Bloomberg.com,"Thu, 15 Nov 2018 08:00:00 GMT"
65,"Hugo Boss CEO on Customer Trends, Product Demand, China, Business Strategy - Bloomberg.com","Fri, 16 Nov 2018 08:00:00 GMT"
66,China Property Queen Claws Her Way Back With $7 Billion Transfer - Bloomberg.com,"Mon, 26 Nov 2018 08:00:00 GMT"
67,The Harajuku Store That Won't Let You Bring Clothes Home - Bloomberg.com,"Thu, 29 Nov 2018 08:00:00 GMT"
68,America's Gilded Age Starchitects - Bloomberg.com,"Wed, 14 Nov 2018 08:00:00 GMT"
69,Kids Are So Addicted to Fortnite They're Being Sent to Gamer Rehab - Bloomberg.com,"Tue, 27 Nov 2018 08:00:00 GMT"
70,This Is the Single Most Meaningless Shopping Event - Bloomberg.com,"Sun, 11 Nov 2018 08:00:00 GMT"
71,Tesla’s Insider Chairwoman Stirs Doubts on Musk Being Reined In - Bloomberg.com,"Thu, 08 Nov 2018 08:00:00 GMT"
72,There’s Less to Private Equity Than Meets the Eye - Bloomberg.com,"Mon, 12 Nov 2018 08:00:00 GMT"
73,Trump Leaves World War Commemorations Isolated Among Allies - Bloomberg.com,"Sun, 11 Nov 2018 08:00:00 GMT"
74,The Democrats Turn From Resistance to Opposition - Bloomberg.com,"Thu, 15 Nov 2018 08:00:00 GMT"
75,"Eskom Says It Plans to Cut 2,000 Megawatts From South Africa Grid - Bloomberg.com","Thu, 29 Nov 2018 08:00:00 GMT"
76,Swedish Opposition Leader Loses as Political Landscape Shifts - Bloomberg.com,"Wed, 14 Nov 2018 08:00:00 GMT"
77,Chinese Superstar Fan Bingbing Resurfaces With Pro-China Post on Weibo - Bloomberg.com,"Mon, 19 Nov 2018 08:00:00 GMT"
78,Chess Is the Killer App - Bloomberg.com,"Tue, 13 Nov 2018 08:00:00 GMT"
79,Egypt Ends Forex Repatriation Guarantee for Overseas Investors - Bloomberg.com,"Wed, 28 Nov 2018 08:00:00 GMT"
80,China’s biggest problem isn’t Trump. It’s China. - Bloomberg.com,"Mon, 19 Nov 2018 08:00:00 GMT"
81,A Meal of 50 Courses Over 6 Hours. Is This the Future of Dining? - Bloomberg.com,"Thu, 15 Nov 2018 08:00:00 GMT"
82,U.S. Accuses China of Continuing IP Theft as WTO Launches Probe - Bloomberg.com,"Tue, 20 Nov 2018 08:00:00 GMT"
83,Microsoft Wins $480 Million Army Battlefield Contract - Bloomberg.com,"Wed, 28 Nov 2018 08:00:00 GMT"
84,"FBI Is Probing OneTaste, a Sexuality Wellness Company - Bloomberg.com","Tue, 13 Nov 2018 08:00:00 GMT"
85,This Company Is Helping Build China’s Panopticon. It Won’t Stop There - Bloomberg.com,"Mon, 19 Nov 2018 08:00:00 GMT"
86,"Hugo Boss's Winning Recipe: More Meghan Markle, Fewer Suits - Bloomberg.com","Sun, 18 Nov 2018 08:00:00 GMT"
87,"The Best Mail-Order Pies in America, Ranked - Bloomberg.com","Wed, 14 Nov 2018 08:00:00 GMT"
88,Free Condoms and a Soda Tax: Populists Have Big Ideas for Italy - Bloomberg.com,"Wed, 21 Nov 2018 08:00:00 GMT"
89,Watch Bloomberg Intelligence 50 Companies to Watch - Bloomberg.com,"Wed, 28 Nov 2018 08:00:00 GMT"
90,"Fortnite Now Has 200 Million Players, Up 60% From the Last Count - Bloomberg.com","Mon, 26 Nov 2018 08:00:00 GMT"
91,Trouble in the Congo: The Misadventures of Glencore - Bloomberg.com,"Fri, 16 Nov 2018 08:00:00 GMT"
92,The David Rubenstein Show: Anthony Kennedy - Bloomberg.com,"Wed, 28 Nov 2018 08:00:00 GMT"
93,How Foreign Guns Invaded the U.S. - Bloomberg.com,"Tue, 27 Nov 2018 08:00:00 GMT"
94,Guinea Bauxite Miner to Build New Railway in $3 Billion Deal - Bloomberg.com,"Mon, 26 Nov 2018 08:00:00 GMT"
95,Steph Curry Tells Under Armour to Market His Shoes to Girls - Bloomberg.com,"Thu, 29 Nov 2018 08:00:00 GMT"
96,Fed Said to Ramp Up Goldman-1MDB Probe - Bloomberg.com,"Fri, 30 Nov 2018 08:00:00 GMT"
97,Builder of $200 Million Turkish Chateaux Project Goes Bankrupt - Bloomberg.com,"Mon, 26 Nov 2018 08:00:00 GMT"
98,Saudi Prince Alwaleed’s Brother Released After Reported Arrest - Bloomberg.com,"Sat, 03 Nov 2018 07:00:00 GMT"
99,"SoftBank's Next Robot After Pepper Skips Chit Chat, Mops Floors - Bloomberg.com","Sun, 18 Nov 2018 08:00:00 GMT"
